[I 2025-12-04 00:02:55,896] Trial 20 finished with value: 0.1820979414555429 and parameters: {'n_estimators': 250, 'learning_rate': 0.06154931898658955, 'max_depth': 3, 'min_samples_split': 10, 'min_samples_leaf': 6, 'subsample': 0.838655717705499, 'max_features': 'log2'}. Best is trial 18 with value: 0.19561069035513134.
[I 2025-12-04 00:03:07,682] Trial 21 finished with value: 0.18289420796046768 and parameters: {'n_estimators': 200, 'learning_rate': 0.05322675797991609, 'max_depth': 5, 'min_samples_split': 14, 'min_samples_leaf': 13, 'subsample': 0.8467705945098106, 'max_features': 'log2'}. Best is trial 18 with value: 0.19561069035513134.
[I 2025-12-04 00:03:19,157] Trial 22 finished with value: 0.15646728355311829 and parameters: {'n_estimators': 250, 'learning_rate': 0.11257115148255671, 'max_depth': 4, 'min_samples_split': 17, 'min_samples_leaf': 13, 'subsample': 0.8016556652842142, 'max_features': 'log2'}. Best is trial 18 with value: 0.19561069035513134.
[I 2025-12-04 00:03:26,515] Trial 23 finished with value: 0.18748540865180024 and parameters: {'n_estimators': 200, 'learning_rate': 0.04489391197920852, 'max_depth': 3, 'min_samples_split': 15, 'min_samples_leaf': 10, 'subsample': 0.8276404016921439, 'max_features': 'log2'}. Best is trial 18 with value: 0.19561069035513134.
[I 2025-12-04 00:03:41,890] Trial 24 finished with value: 0.17823326077135643 and parameters: {'n_estimators': 200, 'learning_rate': 0.07934864107370126, 'max_depth': 5, 'min_samples_split': 16, 'min_samples_leaf': 14, 'subsample': 0.8581513575867235, 'max_features': 'sqrt'}. Best is trial 18 with value: 0.19561069035513134.
[I 2025-12-04 00:03:55,821] Trial 25 finished with value: 0.16532235656737432 and parameters: {'n_estimators': 300, 'learning_rate': 0.11058645527440489, 'max_depth': 4, 'min_samples_split': 18, 'min_samples_leaf': 12, 'subsample': 0.8124571882412618, 'max_features': 'log2'}. Best is trial 18 with value: 0.19561069035513134.
[I 2025-12-04 00:04:08,269] Trial 26 finished with value: 0.163140306583895 and parameters: {'n_estimators': 250, 'learning_rate': 0.1704937371226674, 'max_depth': 3, 'min_samples_split': 13, 'min_samples_leaf': 10, 'subsample': 0.8805657898137278, 'max_features': 'sqrt'}. Best is trial 18 with value: 0.19561069035513134.
[I 2025-12-04 00:04:19,894] Trial 27 finished with value: 0.17677328221460464 and parameters: {'n_estimators': 200, 'learning_rate': 0.0670356695683558, 'max_depth': 5, 'min_samples_split': 9, 'min_samples_leaf': 14, 'subsample': 0.8369142498059483, 'max_features': 'log2'}. Best is trial 18 with value: 0.19561069035513134.
[I 2025-12-04 00:07:03,365] Trial 28 finished with value: 0.16047725445236657 and parameters: {'n_estimators': 250, 'learning_rate': 0.04161488909112544, 'max_depth': 6, 'min_samples_split': 18, 'min_samples_leaf': 18, 'subsample': 0.8558105139047273, 'max_features': None}. Best is trial 18 with value: 0.19561069035513134.
[I 2025-12-04 00:07:22,411] Trial 29 finished with value: 0.15799440144831361 and parameters: {'n_estimators': 300, 'learning_rate': 0.10325508188198299, 'max_depth': 4, 'min_samples_split': 11, 'min_samples_leaf': 16, 'subsample': 0.8667410110132525, 'max_features': 'sqrt'}. Best is trial 18 with value: 0.19561069035513134.
[I 2025-12-04 00:07:25,395] A new study created in memory with name: gradient_boosting_fold_5
[I 2025-12-04 00:13:53,372] Trial 0 finished with value: 0.11313775567358837 and parameters: {'n_estimators': 250, 'learning_rate': 0.1321489248948365, 'max_depth': 14, 'min_samples_split': 12, 'min_samples_leaf': 13, 'subsample': 0.9733127475255724, 'max_features': None}. Best is trial 0 with value: 0.11313775567358837.
[I 2025-12-04 00:14:12,752] Trial 1 finished with value: 0.12375059477766874 and parameters: {'n_estimators': 150, 'learning_rate': 0.10799094337654937, 'max_depth': 9, 'min_samples_split': 12, 'min_samples_leaf': 3, 'subsample': 0.8263985581450812, 'max_features': 'sqrt'}. Best is trial 1 with value: 0.12375059477766874.
[I 2025-12-04 00:14:33,452] Trial 2 finished with value: 0.10342309513544494 and parameters: {'n_estimators': 100, 'learning_rate': 0.20944322518299416, 'max_depth': 15, 'min_samples_split': 19, 'min_samples_leaf': 8, 'subsample': 0.8747542099883596, 'max_features': 'sqrt'}. Best is trial 1 with value: 0.12375059477766874.
[I 2025-12-04 00:15:13,285] Trial 3 finished with value: 0.09832184442554845 and parameters: {'n_estimators': 200, 'learning_rate': 0.2852407891288372, 'max_depth': 15, 'min_samples_split': 16, 'min_samples_leaf': 14, 'subsample': 0.9206398008646186, 'max_features': 'sqrt'}. Best is trial 1 with value: 0.12375059477766874.
[I 2025-12-04 00:19:07,663] Trial 4 finished with value: 0.11871900836428853 and parameters: {'n_estimators': 150, 'learning_rate': 0.06069579069803273, 'max_depth': 14, 'min_samples_split': 3, 'min_samples_leaf': 10, 'subsample': 0.9685929123641303, 'max_features': None}. Best is trial 1 with value: 0.12375059477766874.
[I 2025-12-04 00:20:26,011] Trial 5 finished with value: 0.1562527397135703 and parameters: {'n_estimators': 100, 'learning_rate': 0.02873219389394817, 'max_depth': 7, 'min_samples_split': 10, 'min_samples_leaf': 19, 'subsample': 0.8858787276410546, 'max_features': None}. Best is trial 5 with value: 0.1562527397135703.
[I 2025-12-04 00:20:40,813] Trial 6 finished with value: 0.10507196395980298 and parameters: {'n_estimators': 100, 'learning_rate': 0.23350357860590762, 'max_depth': 11, 'min_samples_split': 2, 'min_samples_leaf': 17, 'subsample': 0.8454819165265323, 'max_features': 'sqrt'}. Best is trial 5 with value: 0.1562527397135703.
[I 2025-12-04 00:24:13,900] Trial 7 finished with value: 0.14712169467192157 and parameters: {'n_estimators': 150, 'learning_rate': 0.02379145669272017, 'max_depth': 14, 'min_samples_split': 6, 'min_samples_leaf': 12, 'subsample': 0.87933051980597, 'max_features': None}. Best is trial 5 with value: 0.1562527397135703.
[I 2025-12-04 00:25:44,489] Trial 8 finished with value: 0.1233843495582482 and parameters: {'n_estimators': 250, 'learning_rate': 0.23654503788210543, 'max_depth': 3, 'min_samples_split': 16, 'min_samples_leaf': 13, 'subsample': 0.9096934621160466, 'max_features': None}. Best is trial 5 with value: 0.1562527397135703.
[I 2025-12-04 00:26:08,025] Trial 9 finished with value: 0.11547441432721557 and parameters: {'n_estimators': 100, 'learning_rate': 0.1189016187391414, 'max_depth': 15, 'min_samples_split': 17, 'min_samples_leaf': 9, 'subsample': 0.9883475458713233, 'max_features': 'sqrt'}. Best is trial 5 with value: 0.1562527397135703.
[I 2025-12-04 00:26:30,613] Trial 10 finished with value: 0.16357600381266407 and parameters: {'n_estimators': 300, 'learning_rate': 0.01029788278981936, 'max_depth': 6, 'min_samples_split': 8, 'min_samples_leaf': 20, 'subsample': 0.9347017237862151, 'max_features': 'log2'}. Best is trial 10 with value: 0.16357600381266407.
[I 2025-12-04 00:26:53,113] Trial 11 finished with value: 0.1685269029457322 and parameters: {'n_estimators': 300, 'learning_rate': 0.011642627015570724, 'max_depth': 6, 'min_samples_split': 8, 'min_samples_leaf': 20, 'subsample': 0.9329477897131646, 'max_features': 'log2'}. Best is trial 11 with value: 0.1685269029457322.
[I 2025-12-04 00:27:12,257] Trial 12 finished with value: 0.15246870905494286 and parameters: {'n_estimators': 300, 'learning_rate': 0.07967412100220506, 'max_depth': 5, 'min_samples_split': 8, 'min_samples_leaf': 20, 'subsample': 0.9358019768381237, 'max_features': 'log2'}. Best is trial 11 with value: 0.1685269029457322.
[I 2025-12-04 00:27:35,041] Trial 13 finished with value: 0.1677016181177636 and parameters: {'n_estimators': 300, 'learning_rate': 0.010655516928161267, 'max_depth': 6, 'min_samples_split': 6, 'min_samples_leaf': 17, 'subsample': 0.9430454218764507, 'max_features': 'log2'}. Best is trial 11 with value: 0.1685269029457322.
[I 2025-12-04 00:27:59,853] Trial 14 finished with value: 0.11052707263386843 and parameters: {'n_estimators': 250, 'learning_rate': 0.17510062515820674, 'max_depth': 8, 'min_samples_split': 5, 'min_samples_leaf': 16, 'subsample': 0.952231767921998, 'max_features': 'log2'}. Best is trial 11 with value: 0.1685269029457322.
[I 2025-12-04 00:28:16,466] Trial 15 finished with value: 0.16025469128173164 and parameters: {'n_estimators': 300, 'learning_rate': 0.0649198243256363, 'max_depth': 4, 'min_samples_split': 5, 'min_samples_leaf': 17, 'subsample': 0.9945766188825101, 'max_features': 'log2'}. Best is trial 11 with value: 0.1685269029457322.
[I 2025-12-04 00:28:48,571] Trial 16 finished with value: 0.12019208890740476 and parameters: {'n_estimators': 250, 'learning_rate': 0.055883167348611554, 'max_depth': 10, 'min_samples_split': 9, 'min_samples_leaf': 4, 'subsample': 0.9472842359854143, 'max_features': 'log2'}. Best is trial 11 with value: 0.1685269029457322.
[I 2025-12-04 00:29:10,441] Trial 17 finished with value: 0.12043326096722518 and parameters: {'n_estimators': 300, 'learning_rate': 0.17391987402318576, 'max_depth': 6, 'min_samples_split': 13, 'min_samples_leaf': 16, 'subsample': 0.9017298160777896, 'max_features': 'log2'}. Best is trial 11 with value: 0.1685269029457322.
[I 2025-12-04 00:29:17,548] Trial 18 finished with value: 0.1489827908858023 and parameters: {'n_estimators': 200, 'learning_rate': 0.09954082161877409, 'max_depth': 3, 'min_samples_split': 7, 'min_samples_leaf': 18, 'subsample': 0.8029206128872876, 'max_features': 'log2'}. Best is trial 11 with value: 0.1685269029457322.
[I 2025-12-04 00:29:37,820] Trial 19 finished with value: 0.14452985897371823 and parameters: {'n_estimators': 200, 'learning_rate': 0.04155672393158587, 'max_depth': 8, 'min_samples_split': 4, 'min_samples_leaf': 15, 'subsample': 0.9651284682941477, 'max_features': 'log2'}. Best is trial 11 with value: 0.1685269029457322.
[I 2025-12-04 00:30:18,080] Trial 20 finished with value: 0.1018627714599617 and parameters: {'n_estimators': 300, 'learning_rate': 0.1491504602490532, 'max_depth': 11, 'min_samples_split': 10, 'min_samples_leaf': 6, 'subsample': 0.9237381634888503, 'max_features': 'log2'}. Best is trial 11 with value: 0.1685269029457322.
[I 2025-12-04 00:30:40,535] Trial 21 finished with value: 0.16635736386996558 and parameters: {'n_estimators': 300, 'learning_rate': 0.011724851252866875, 'max_depth': 6, 'min_samples_split': 7, 'min_samples_leaf': 20, 'subsample': 0.9357042647127757, 'max_features': 'log2'}. Best is trial 11 with value: 0.1685269029457322.
[I 2025-12-04 00:31:00,053] Trial 22 finished with value: 0.1621345911995679 and parameters: {'n_estimators': 300, 'learning_rate': 0.010349275762607503, 'max_depth': 5, 'min_samples_split': 7, 'min_samples_leaf': 20, 'subsample': 0.9500781890061281, 'max_features': 'log2'}. Best is trial 11 with value: 0.1685269029457322.
[I 2025-12-04 00:31:21,618] Trial 23 finished with value: 0.1292897057226016 and parameters: {'n_estimators': 250, 'learning_rate': 0.08461941728285997, 'max_depth': 7, 'min_samples_split': 6, 'min_samples_leaf': 18, 'subsample': 0.9318151469086071, 'max_features': 'log2'}. Best is trial 11 with value: 0.1685269029457322.
[I 2025-12-04 00:31:40,326] Trial 24 finished with value: 0.16002262334313203 and parameters: {'n_estimators': 300, 'learning_rate': 0.045018289762057226, 'max_depth': 5, 'min_samples_split': 14, 'min_samples_leaf': 18, 'subsample': 0.9071038113740478, 'max_features': 'log2'}. Best is trial 11 with value: 0.1685269029457322.
[I 2025-12-04 00:32:00,248] Trial 25 finished with value: 0.15247825610303462 and parameters: {'n_estimators': 250, 'learning_rate': 0.03331425963168666, 'max_depth': 7, 'min_samples_split': 10, 'min_samples_leaf': 20, 'subsample': 0.8600891975473032, 'max_features': 'log2'}. Best is trial 11 with value: 0.1685269029457322.
[I 2025-12-04 00:32:16,694] Trial 26 finished with value: 0.15221137896099263 and parameters: {'n_estimators': 300, 'learning_rate': 0.07912999675329684, 'max_depth': 4, 'min_samples_split': 2, 'min_samples_leaf': 1, 'subsample': 0.9768312153900894, 'max_features': 'log2'}. Best is trial 11 with value: 0.1685269029457322.
[I 2025-12-04 00:32:35,962] Trial 27 finished with value: 0.16724678889861044 and parameters: {'n_estimators': 250, 'learning_rate': 0.012317871426638637, 'max_depth': 6, 'min_samples_split': 4, 'min_samples_leaf': 15, 'subsample': 0.9521638236246035, 'max_features': 'log2'}. Best is trial 11 with value: 0.1685269029457322.
[I 2025-12-04 00:33:03,737] Trial 28 finished with value: 0.13577493591477893 and parameters: {'n_estimators': 250, 'learning_rate': 0.04967926945354954, 'max_depth': 9, 'min_samples_split': 4, 'min_samples_leaf': 15, 'subsample': 0.9573033127729041, 'max_features': 'log2'}. Best is trial 11 with value: 0.1685269029457322.
[I 2025-12-04 00:33:14,716] Trial 29 finished with value: 0.15185247415733166 and parameters: {'n_estimators': 200, 'learning_rate': 0.1319489611697297, 'max_depth': 4, 'min_samples_split': 11, 'min_samples_leaf': 12, 'subsample': 0.9781474932267632, 'max_features': 'log2'}. Best is trial 11 with value: 0.1685269029457322.
[I 2025-12-04 00:36:34,394] A new study created in memory with name: histogram_gradient_boosting_fold_1
[I 2025-12-04 00:36:35,777] Trial 0 finished with value: 0.11360658566657009 and parameters: {'max_iter': 161, 'learning_rate': 0.27809505985916166, 'max_depth': 8, 'min_samples_leaf': 39, 'l2_regularization': 0.8143120261678563}. Best is trial 0 with value: 0.11360658566657009.
[I 2025-12-04 00:36:37,170] Trial 1 finished with value: 0.12940504319987192 and parameters: {'max_iter': 115, 'learning_rate': 0.15071757246067924, 'max_depth': 12, 'min_samples_leaf': 12, 'l2_regularization': 0.6410668854271158}. Best is trial 1 with value: 0.12940504319987192.
[I 2025-12-04 00:36:38,419] Trial 2 finished with value: 0.1112784413233751 and parameters: {'max_iter': 120, 'learning_rate': 0.2900561383935958, 'max_depth': 11, 'min_samples_leaf': 35, 'l2_regularization': 0.5899785928673756}. Best is trial 1 with value: 0.12940504319987192.
[I 2025-12-04 00:36:40,260] Trial 3 finished with value: 0.11613378493673228 and parameters: {'max_iter': 157, 'learning_rate': 0.28669944690896815, 'max_depth': 15, 'min_samples_leaf': 16, 'l2_regularization': 0.7933601376204108}. Best is trial 1 with value: 0.12940504319987192.
[I 2025-12-04 00:36:40,844] Trial 4 finished with value: 0.13813075942340705 and parameters: {'max_iter': 107, 'learning_rate': 0.29994861118729127, 'max_depth': 3, 'min_samples_leaf': 14, 'l2_regularization': 0.6274738584626647}. Best is trial 4 with value: 0.13813075942340705.
[I 2025-12-04 00:36:41,830] Trial 5 finished with value: 0.11950792068313235 and parameters: {'max_iter': 78, 'learning_rate': 0.24291296872568519, 'max_depth': 13, 'min_samples_leaf': 29, 'l2_regularization': 0.6389657817382415}. Best is trial 4 with value: 0.13813075942340705.
[I 2025-12-04 00:36:43,549] Trial 6 finished with value: 0.11865438965198742 and parameters: {'max_iter': 164, 'learning_rate': 0.22672572000865665, 'max_depth': 8, 'min_samples_leaf': 25, 'l2_regularization': 0.27228715877128795}. Best is trial 4 with value: 0.13813075942340705.
[I 2025-12-04 00:36:44,887] Trial 7 finished with value: 0.12297377414151889 and parameters: {'max_iter': 112, 'learning_rate': 0.23298506170227315, 'max_depth': 9, 'min_samples_leaf': 19, 'l2_regularization': 0.9123915898793358}. Best is trial 4 with value: 0.13813075942340705.
[I 2025-12-04 00:36:45,530] Trial 8 finished with value: 0.13205345355090253 and parameters: {'max_iter': 152, 'learning_rate': 0.2326817272857426, 'max_depth': 3, 'min_samples_leaf': 20, 'l2_regularization': 0.28755875904360195}. Best is trial 4 with value: 0.13813075942340705.
[I 2025-12-04 00:36:46,343] Trial 9 finished with value: 0.11919838657065256 and parameters: {'max_iter': 79, 'learning_rate': 0.2382372746335608, 'max_depth': 7, 'min_samples_leaf': 48, 'l2_regularization': 0.6581039099601634}. Best is trial 4 with value: 0.13813075942340705.
[I 2025-12-04 00:36:46,773] Trial 10 finished with value: 0.16629355100516308 and parameters: {'max_iter': 51, 'learning_rate': 0.04990384942861539, 'max_depth': 3, 'min_samples_leaf': 1, 'l2_regularization': 0.06857374788655624}. Best is trial 10 with value: 0.16629355100516308.
[I 2025-12-04 00:36:47,237] Trial 11 finished with value: 0.16722819349561807 and parameters: {'max_iter': 62, 'learning_rate': 0.025763083837396825, 'max_depth': 3, 'min_samples_leaf': 1, 'l2_regularization': 0.026268217171014074}. Best is trial 11 with value: 0.16722819349561807.
[I 2025-12-04 00:36:47,808] Trial 12 finished with value: 0.15693540403168602 and parameters: {'max_iter': 50, 'learning_rate': 0.018191342936317405, 'max_depth': 5, 'min_samples_leaf': 2, 'l2_regularization': 0.011281562660681532}. Best is trial 11 with value: 0.16722819349561807.
[I 2025-12-04 00:36:48,480] Trial 13 finished with value: 0.15664089562670458 and parameters: {'max_iter': 52, 'learning_rate': 0.019485542730691308, 'max_depth': 5, 'min_samples_leaf': 2, 'l2_regularization': 0.005083208266715655}. Best is trial 11 with value: 0.16722819349561807.
[I 2025-12-04 00:36:50,064] Trial 14 finished with value: 0.13897957502035185 and parameters: {'max_iter': 199, 'learning_rate': 0.08389290049655966, 'max_depth': 5, 'min_samples_leaf': 8, 'l2_regularization': 0.19950699328389904}. Best is trial 11 with value: 0.16722819349561807.
[I 2025-12-04 00:36:50,592] Trial 15 finished with value: 0.16732756112666464 and parameters: {'max_iter': 78, 'learning_rate': 0.0741852995074731, 'max_depth': 3, 'min_samples_leaf': 7, 'l2_regularization': 0.1300972678535376}. Best is trial 15 with value: 0.16732756112666464.
[I 2025-12-04 00:36:51,508] Trial 16 finished with value: 0.13868059128179294 and parameters: {'max_iter': 80, 'learning_rate': 0.10645574293830865, 'max_depth': 6, 'min_samples_leaf': 8, 'l2_regularization': 0.41478642023777146}. Best is trial 15 with value: 0.16732756112666464.
[I 2025-12-04 00:36:52,207] Trial 17 finished with value: 0.16173768508023567 and parameters: {'max_iter': 93, 'learning_rate': 0.07898438018284828, 'max_depth': 4, 'min_samples_leaf': 9, 'l2_regularization': 0.1699509352076901}. Best is trial 15 with value: 0.16732756112666464.
[I 2025-12-04 00:36:53,126] Trial 18 finished with value: 0.1312967592538325 and parameters: {'max_iter': 71, 'learning_rate': 0.1331787239706488, 'max_depth': 6, 'min_samples_leaf': 5, 'l2_regularization': 0.3942770605290567}. Best is trial 15 with value: 0.16732756112666464.
[I 2025-12-04 00:36:54,767] Trial 19 finished with value: 0.15345401434084277 and parameters: {'max_iter': 138, 'learning_rate': 0.05462775774426795, 'max_depth': 10, 'min_samples_leaf': 23, 'l2_regularization': 0.11758134274080602}. Best is trial 15 with value: 0.16732756112666464.
[I 2025-12-04 00:36:55,347] Trial 20 finished with value: 0.15419337199071848 and parameters: {'max_iter': 66, 'learning_rate': 0.1836265846697429, 'max_depth': 4, 'min_samples_leaf': 30, 'l2_regularization': 0.28355009913708595}. Best is trial 15 with value: 0.16732756112666464.
[I 2025-12-04 00:36:55,923] Trial 21 finished with value: 0.17070995107248377 and parameters: {'max_iter': 94, 'learning_rate': 0.051928205275113805, 'max_depth': 3, 'min_samples_leaf': 1, 'l2_regularization': 0.08887120002758907}. Best is trial 21 with value: 0.17070995107248377.
[I 2025-12-04 00:36:56,571] Trial 22 finished with value: 0.17097552998540944 and parameters: {'max_iter': 93, 'learning_rate': 0.04338322004543804, 'max_depth': 4, 'min_samples_leaf': 6, 'l2_regularization': 0.10808950343373314}. Best is trial 22 with value: 0.17097552998540944.
[I 2025-12-04 00:36:57,275] Trial 23 finished with value: 0.1635015084431818 and parameters: {'max_iter': 92, 'learning_rate': 0.054949662124044805, 'max_depth': 4, 'min_samples_leaf': 11, 'l2_regularization': 0.15517843273932747}. Best is trial 22 with value: 0.17097552998540944.
[I 2025-12-04 00:36:58,359] Trial 24 finished with value: 0.1434228566509364 and parameters: {'max_iter': 96, 'learning_rate': 0.10790370550428348, 'max_depth': 7, 'min_samples_leaf': 6, 'l2_regularization': 0.3826429110510245}. Best is trial 22 with value: 0.17097552998540944.
[I 2025-12-04 00:36:59,250] Trial 25 finished with value: 0.1637679483079169 and parameters: {'max_iter': 134, 'learning_rate': 0.08021813485297834, 'max_depth': 4, 'min_samples_leaf': 16, 'l2_regularization': 0.2174158610474095}. Best is trial 22 with value: 0.17097552998540944.
[I 2025-12-04 00:37:00,275] Trial 26 finished with value: 0.15510593791046468 and parameters: {'max_iter': 98, 'learning_rate': 0.040876661833806414, 'max_depth': 6, 'min_samples_leaf': 6, 'l2_regularization': 0.09874862152992318}. Best is trial 22 with value: 0.17097552998540944.
[I 2025-12-04 00:37:01,086] Trial 27 finished with value: 0.14024194330153172 and parameters: {'max_iter': 86, 'learning_rate': 0.10696343184380155, 'max_depth': 5, 'min_samples_leaf': 12, 'l2_regularization': 0.5339718065830115}. Best is trial 22 with value: 0.17097552998540944.
[I 2025-12-04 00:37:01,599] Trial 28 finished with value: 0.1540265180947319 and parameters: {'max_iter': 103, 'learning_rate': 0.1798212531187201, 'max_depth': 3, 'min_samples_leaf': 5, 'l2_regularization': 0.32534294844062783}. Best is trial 22 with value: 0.17097552998540944.
[I 2025-12-04 00:37:02,839] Trial 29 finished with value: 0.14700994530716685 and parameters: {'max_iter': 126, 'learning_rate': 0.07571792787555412, 'max_depth': 8, 'min_samples_leaf': 42, 'l2_regularization': 0.46529233847751117}. Best is trial 22 with value: 0.17097552998540944.
[I 2025-12-04 00:37:03,457] A new study created in memory with name: histogram_gradient_boosting_fold_2
[I 2025-12-04 00:37:04,865] Trial 0 finished with value: 0.13882850102492691 and parameters: {'max_iter': 159, 'learning_rate': 0.03587065042415262, 'max_depth': 12, 'min_samples_leaf': 44, 'l2_regularization': 0.8697543856065739}. Best is trial 0 with value: 0.13882850102492691.
