[I 2025-12-04 04:55:58,016] Trial 28 finished with value: 0.11665226486507976 and parameters: {'n_estimators': 167, 'learning_rate': 0.08628668762607447, 'max_depth': 5, 'min_child_weight': 3, 'subsample': 0.7318625294299904, 'colsample_bytree': 0.8636584236078384, 'reg_alpha': 0.7575110812804767, 'reg_lambda': 6.021381973688927, 'gamma': 2.7279140863771465, 'scale_pos_weight': 15.181454095519372}. Best is trial 25 with value: 0.13919481883456017.
[I 2025-12-04 04:56:56,077] Trial 29 finished with value: 0.11051413186234375 and parameters: {'n_estimators': 537, 'learning_rate': 0.07427947141687555, 'max_depth': 4, 'min_child_weight': 1, 'subsample': 0.6278840021191445, 'colsample_bytree': 0.7072658479491835, 'reg_alpha': 0.5007888857411085, 'reg_lambda': 7.669575552257827, 'gamma': 1.976373350685369, 'scale_pos_weight': 9.896962560620203}. Best is trial 25 with value: 0.13919481883456017.
[I 2025-12-04 05:01:13,669] A new study created in memory with name: catboost_fold_1
[I 2025-12-04 05:01:22,786] Trial 0 finished with value: 0.13991512073480253 and parameters: {'iterations': 741, 'learning_rate': 0.01480501811675683, 'depth': 7, 'l2_leaf_reg': 7.034420186227403, 'border_count': 163, 'bagging_temperature': 0.36375177164987793, 'random_strength': 0.21160807699626116, 'scale_pos_weight': 38.53402171669339}. Best is trial 0 with value: 0.13991512073480253.
[I 2025-12-04 05:01:27,859] Trial 1 finished with value: 0.09707446295732888 and parameters: {'iterations': 272, 'learning_rate': 0.12479350588628124, 'depth': 7, 'l2_leaf_reg': 3.6767213281201974, 'border_count': 222, 'bagging_temperature': 0.4123474827082271, 'random_strength': 0.17573518489207218, 'scale_pos_weight': 36.21192865613041}. Best is trial 0 with value: 0.13991512073480253.
[I 2025-12-04 05:01:31,908] Trial 2 finished with value: 0.10052773878459413 and parameters: {'iterations': 674, 'learning_rate': 0.10337864632259677, 'depth': 4, 'l2_leaf_reg': 2.864984028854437, 'border_count': 225, 'bagging_temperature': 0.29658850396868974, 'random_strength': 0.792370165556378, 'scale_pos_weight': 27.02655500730082}. Best is trial 0 with value: 0.13991512073480253.
[I 2025-12-04 05:02:00,364] Trial 3 finished with value: 0.13406380917011737 and parameters: {'iterations': 528, 'learning_rate': 0.03723229326771417, 'depth': 8, 'l2_leaf_reg': 5.769818938332633, 'border_count': 246, 'bagging_temperature': 0.9567173783731455, 'random_strength': 0.7228898114204482, 'scale_pos_weight': 6.254024781154202}. Best is trial 0 with value: 0.13991512073480253.
[I 2025-12-04 05:02:05,472] Trial 4 finished with value: 0.08781169961859929 and parameters: {'iterations': 674, 'learning_rate': 0.22109073250596875, 'depth': 6, 'l2_leaf_reg': 1.1244652226808367, 'border_count': 184, 'bagging_temperature': 0.5689587566643981, 'random_strength': 0.6396802120227209, 'scale_pos_weight': 12.71165181161902}. Best is trial 0 with value: 0.13991512073480253.
[I 2025-12-04 05:02:33,141] Trial 5 finished with value: 0.08558755318875519 and parameters: {'iterations': 830, 'learning_rate': 0.2981386609003658, 'depth': 8, 'l2_leaf_reg': 3.6295842138628736, 'border_count': 171, 'bagging_temperature': 0.13558672363407676, 'random_strength': 0.5251193135352552, 'scale_pos_weight': 16.368106966030886}. Best is trial 0 with value: 0.13991512073480253.
[I 2025-12-04 05:02:40,806] Trial 6 finished with value: 0.10360310737432658 and parameters: {'iterations': 456, 'learning_rate': 0.22292092803377875, 'depth': 7, 'l2_leaf_reg': 4.4458487030388945, 'border_count': 214, 'bagging_temperature': 0.9770156452058301, 'random_strength': 0.9569042551840397, 'scale_pos_weight': 9.19926032733376}. Best is trial 0 with value: 0.13991512073480253.
[I 2025-12-04 05:03:09,213] Trial 7 finished with value: 0.09566969979195393 and parameters: {'iterations': 963, 'learning_rate': 0.11821598374130139, 'depth': 8, 'l2_leaf_reg': 6.900095650758342, 'border_count': 154, 'bagging_temperature': 0.35511213803790487, 'random_strength': 0.919767760882004, 'scale_pos_weight': 27.07167194013401}. Best is trial 0 with value: 0.13991512073480253.
[I 2025-12-04 05:04:38,836] Trial 8 finished with value: 0.08799064891347722 and parameters: {'iterations': 520, 'learning_rate': 0.27223427446702964, 'depth': 10, 'l2_leaf_reg': 2.57058428291653, 'border_count': 221, 'bagging_temperature': 0.5817160392378599, 'random_strength': 0.49568639508138623, 'scale_pos_weight': 16.637828888400755}. Best is trial 0 with value: 0.13991512073480253.
[I 2025-12-04 05:04:44,294] Trial 9 finished with value: 0.09231168538399911 and parameters: {'iterations': 751, 'learning_rate': 0.16405713052115722, 'depth': 6, 'l2_leaf_reg': 1.5538614146644258, 'border_count': 158, 'bagging_temperature': 0.8020984562363476, 'random_strength': 0.8287825509369432, 'scale_pos_weight': 17.764395233182412}. Best is trial 0 with value: 0.13991512073480253.
[I 2025-12-04 05:04:45,448] Trial 10 finished with value: 0.16027487830176884 and parameters: {'iterations': 118, 'learning_rate': 0.029047518363860617, 'depth': 4, 'l2_leaf_reg': 9.818648944112237, 'border_count': 85, 'bagging_temperature': 0.08518774501851406, 'random_strength': 0.011545647194552366, 'scale_pos_weight': 52.382539046675525}. Best is trial 10 with value: 0.16027487830176884.
[I 2025-12-04 05:04:46,669] Trial 11 finished with value: 0.1577636697912319 and parameters: {'iterations': 140, 'learning_rate': 0.02384492039044981, 'depth': 4, 'l2_leaf_reg': 9.826271900814689, 'border_count': 85, 'bagging_temperature': 0.012380058407524763, 'random_strength': 0.008593747942943838, 'scale_pos_weight': 50.05100799079352}. Best is trial 10 with value: 0.16027487830176884.
[I 2025-12-04 05:04:47,762] Trial 12 finished with value: 0.15071365279584076 and parameters: {'iterations': 107, 'learning_rate': 0.05947042809297168, 'depth': 4, 'l2_leaf_reg': 9.946592004541566, 'border_count': 77, 'bagging_temperature': 0.01846717857847341, 'random_strength': 0.01989051072877392, 'scale_pos_weight': 50.6291252181674}. Best is trial 10 with value: 0.16027487830176884.
[I 2025-12-04 05:04:48,986] Trial 13 finished with value: 0.1412648724720556 and parameters: {'iterations': 122, 'learning_rate': 0.07045268444103178, 'depth': 5, 'l2_leaf_reg': 9.986139782998716, 'border_count': 86, 'bagging_temperature': 0.14528386198341575, 'random_strength': 0.021876310719828818, 'scale_pos_weight': 51.71212112332594}. Best is trial 10 with value: 0.16027487830176884.
[I 2025-12-04 05:04:50,809] Trial 14 finished with value: 0.16064600141544144 and parameters: {'iterations': 270, 'learning_rate': 0.013823200794125523, 'depth': 5, 'l2_leaf_reg': 8.49972302347783, 'border_count': 34, 'bagging_temperature': 0.02026544540924949, 'random_strength': 0.2776045114875473, 'scale_pos_weight': 43.57350465544524}. Best is trial 14 with value: 0.16064600141544144.
[I 2025-12-04 05:04:52,979] Trial 15 finished with value: 0.12127906917266007 and parameters: {'iterations': 335, 'learning_rate': 0.07724653231631526, 'depth': 5, 'l2_leaf_reg': 8.347619154386981, 'border_count': 34, 'bagging_temperature': 0.2028682826248301, 'random_strength': 0.3262333805107324, 'scale_pos_weight': 42.895893411666385}. Best is trial 14 with value: 0.16064600141544144.
[I 2025-12-04 05:04:54,829] Trial 16 finished with value: 0.104456714584927 and parameters: {'iterations': 268, 'learning_rate': 0.16823531284252266, 'depth': 5, 'l2_leaf_reg': 8.387905663245329, 'border_count': 39, 'bagging_temperature': 0.006831191894614987, 'random_strength': 0.3550457619281855, 'scale_pos_weight': 43.46481709911936}. Best is trial 14 with value: 0.16064600141544144.
[I 2025-12-04 05:04:57,407] Trial 17 finished with value: 0.15703818833549238 and parameters: {'iterations': 382, 'learning_rate': 0.010324302909392952, 'depth': 5, 'l2_leaf_reg': 8.556617406159805, 'border_count': 123, 'bagging_temperature': 0.2338203605580082, 'random_strength': 0.16462360311777036, 'scale_pos_weight': 43.5952651551679}. Best is trial 14 with value: 0.16064600141544144.
[I 2025-12-04 05:04:59,228] Trial 18 finished with value: 0.13829560729214987 and parameters: {'iterations': 220, 'learning_rate': 0.04960781506464244, 'depth': 6, 'l2_leaf_reg': 6.975184691033435, 'border_count': 61, 'bagging_temperature': 0.14249074013812998, 'random_strength': 0.3320505446454159, 'scale_pos_weight': 33.38655391751114}. Best is trial 14 with value: 0.16064600141544144.
[I 2025-12-04 05:05:18,874] Trial 19 finished with value: 0.09654772188494802 and parameters: {'iterations': 402, 'learning_rate': 0.09390690259785794, 'depth': 10, 'l2_leaf_reg': 8.744698967622615, 'border_count': 111, 'bagging_temperature': 0.5199077440642585, 'random_strength': 0.12603877049576978, 'scale_pos_weight': 46.54439937019762}. Best is trial 14 with value: 0.16064600141544144.
[I 2025-12-04 05:05:20,511] Trial 20 finished with value: 0.11272182429757897 and parameters: {'iterations': 218, 'learning_rate': 0.13779254748748715, 'depth': 4, 'l2_leaf_reg': 5.683942692474246, 'border_count': 120, 'bagging_temperature': 0.7447955122160932, 'random_strength': 0.42402950518447774, 'scale_pos_weight': 32.048892933344206}. Best is trial 14 with value: 0.16064600141544144.
[I 2025-12-04 05:05:21,875] Trial 21 finished with value: 0.15913524983579558 and parameters: {'iterations': 164, 'learning_rate': 0.028713076451776127, 'depth': 4, 'l2_leaf_reg': 9.279265070884312, 'border_count': 93, 'bagging_temperature': 0.05645663172939832, 'random_strength': 0.065144682351442, 'scale_pos_weight': 52.782913023289154}. Best is trial 14 with value: 0.16064600141544144.
[I 2025-12-04 05:05:23,354] Trial 22 finished with value: 0.1609849963802931 and parameters: {'iterations': 191, 'learning_rate': 0.042152322388885166, 'depth': 4, 'l2_leaf_reg': 9.192672786807968, 'border_count': 48, 'bagging_temperature': 0.0814962342438295, 'random_strength': 0.08875607207509742, 'scale_pos_weight': 52.738022435945325}. Best is trial 22 with value: 0.1609849963802931.
[I 2025-12-04 05:05:25,606] Trial 23 finished with value: 0.14276309216918381 and parameters: {'iterations': 317, 'learning_rate': 0.05037585784664486, 'depth': 5, 'l2_leaf_reg': 7.832579170555496, 'border_count': 59, 'bagging_temperature': 0.1128098696414763, 'random_strength': 0.23796771815127776, 'scale_pos_weight': 47.1703202325365}. Best is trial 22 with value: 0.1609849963802931.
[I 2025-12-04 05:05:27,173] Trial 24 finished with value: 0.13558678906076743 and parameters: {'iterations': 217, 'learning_rate': 0.0795000511981539, 'depth': 4, 'l2_leaf_reg': 7.59241822768943, 'border_count': 51, 'bagging_temperature': 0.23147880693583234, 'random_strength': 0.11027490672196845, 'scale_pos_weight': 47.679509294783465}. Best is trial 22 with value: 0.1609849963802931.
[I 2025-12-04 05:05:28,750] Trial 25 finished with value: 0.15078511486389568 and parameters: {'iterations': 173, 'learning_rate': 0.04137455549426847, 'depth': 6, 'l2_leaf_reg': 9.202983329569753, 'border_count': 66, 'bagging_temperature': 0.08580789450257303, 'random_strength': 0.26910079925336766, 'scale_pos_weight': 40.847923928518576}. Best is trial 22 with value: 0.1609849963802931.
[I 2025-12-04 05:05:31,334] Trial 26 finished with value: 0.16146411507611388 and parameters: {'iterations': 427, 'learning_rate': 0.010140081252533958, 'depth': 5, 'l2_leaf_reg': 6.423745948197915, 'border_count': 45, 'bagging_temperature': 0.2754277584939279, 'random_strength': 0.09797298584506628, 'scale_pos_weight': 46.83557560406215}. Best is trial 26 with value: 0.16146411507611388.
[I 2025-12-04 05:05:34,076] Trial 27 finished with value: 0.10092014118625112 and parameters: {'iterations': 460, 'learning_rate': 0.19376193831869412, 'depth': 5, 'l2_leaf_reg': 7.567495431865442, 'border_count': 34, 'bagging_temperature': 0.30836846738904783, 'random_strength': 0.2703737368395117, 'scale_pos_weight': 38.523226256046485}. Best is trial 26 with value: 0.16146411507611388.
[I 2025-12-04 05:05:36,610] Trial 28 finished with value: 0.11168725830531061 and parameters: {'iterations': 350, 'learning_rate': 0.09408689166481464, 'depth': 6, 'l2_leaf_reg': 5.026909455736507, 'border_count': 50, 'bagging_temperature': 0.4358638681512003, 'random_strength': 0.430830811119045, 'scale_pos_weight': 22.203690538769102}. Best is trial 26 with value: 0.16146411507611388.
[I 2025-12-04 05:05:39,484] Trial 29 finished with value: 0.15822385053232652 and parameters: {'iterations': 448, 'learning_rate': 0.013990075593407926, 'depth': 5, 'l2_leaf_reg': 6.447368520211051, 'border_count': 102, 'bagging_temperature': 0.19217178768941096, 'random_strength': 0.19656959532304966, 'scale_pos_weight': 38.266144266435234}. Best is trial 26 with value: 0.16146411507611388.
[I 2025-12-04 05:05:41,016] A new study created in memory with name: catboost_fold_2
[I 2025-12-04 05:07:07,862] Trial 0 finished with value: 0.08365975063133774 and parameters: {'iterations': 801, 'learning_rate': 0.1841590142566439, 'depth': 9, 'l2_leaf_reg': 5.893241567704226, 'border_count': 212, 'bagging_temperature': 0.24587740973425198, 'random_strength': 0.2231899170691879, 'scale_pos_weight': 43.51450916923192}. Best is trial 0 with value: 0.08365975063133774.
[I 2025-12-04 05:07:12,556] Trial 1 finished with value: 0.08293145691480372 and parameters: {'iterations': 843, 'learning_rate': 0.2456483693153331, 'depth': 4, 'l2_leaf_reg': 5.0151220040518005, 'border_count': 197, 'bagging_temperature': 0.8718829643169203, 'random_strength': 0.8853077285450656, 'scale_pos_weight': 20.842888041617716}. Best is trial 0 with value: 0.08365975063133774.
[I 2025-12-04 05:07:58,441] Trial 2 finished with value: 0.08841246477251898 and parameters: {'iterations': 365, 'learning_rate': 0.14212562357886002, 'depth': 9, 'l2_leaf_reg': 5.6227996992437665, 'border_count': 238, 'bagging_temperature': 0.2275057891772312, 'random_strength': 0.5270878173181962, 'scale_pos_weight': 12.64655531022957}. Best is trial 2 with value: 0.08841246477251898.
[I 2025-12-04 05:08:04,925] Trial 3 finished with value: 0.08275349422785525 and parameters: {'iterations': 243, 'learning_rate': 0.19222353044199803, 'depth': 8, 'l2_leaf_reg': 3.2008529892111355, 'border_count': 130, 'bagging_temperature': 0.8346609310687787, 'random_strength': 0.5088848638171153, 'scale_pos_weight': 22.559770183775115}. Best is trial 2 with value: 0.08841246477251898.
[I 2025-12-04 05:08:08,473] Trial 4 finished with value: 0.0912630839768939 and parameters: {'iterations': 435, 'learning_rate': 0.10696473549769148, 'depth': 6, 'l2_leaf_reg': 6.943804012585018, 'border_count': 152, 'bagging_temperature': 0.6172162682569303, 'random_strength': 0.43072727485381723, 'scale_pos_weight': 24.402724616197844}. Best is trial 4 with value: 0.0912630839768939.
[I 2025-12-04 05:08:15,111] Trial 5 finished with value: 0.09874164176665179 and parameters: {'iterations': 732, 'learning_rate': 0.17730526421442336, 'depth': 8, 'l2_leaf_reg': 9.110375093981265, 'border_count': 50, 'bagging_temperature': 0.40538423041276506, 'random_strength': 0.3903581834190193, 'scale_pos_weight': 6.314019707100211}. Best is trial 5 with value: 0.09874164176665179.
[I 2025-12-04 05:08:49,295] Trial 6 finished with value: 0.08829673882212415 and parameters: {'iterations': 876, 'learning_rate': 0.24795071316626055, 'depth': 8, 'l2_leaf_reg': 8.53891873556174, 'border_count': 192, 'bagging_temperature': 0.9781251488854615, 'random_strength': 0.7481372829187345, 'scale_pos_weight': 14.284241858116587}. Best is trial 5 with value: 0.09874164176665179.
[I 2025-12-04 05:09:01,345] Trial 7 finished with value: 0.09123144389554283 and parameters: {'iterations': 687, 'learning_rate': 0.08053347590460415, 'depth': 8, 'l2_leaf_reg': 8.959276778518857, 'border_count': 98, 'bagging_temperature': 0.2171774652485854, 'random_strength': 0.9149691277525951, 'scale_pos_weight': 16.810500043409583}. Best is trial 5 with value: 0.09874164176665179.
[I 2025-12-04 05:09:05,124] Trial 8 finished with value: 0.1050831549158869 and parameters: {'iterations': 111, 'learning_rate': 0.06572298930798769, 'depth': 9, 'l2_leaf_reg': 3.437762765789123, 'border_count': 67, 'bagging_temperature': 0.7384784746684308, 'random_strength': 0.11592604924269301, 'scale_pos_weight': 52.69525307758539}. Best is trial 8 with value: 0.1050831549158869.
[I 2025-12-04 05:10:34,603] Trial 9 finished with value: 0.08643486233163467 and parameters: {'iterations': 422, 'learning_rate': 0.15698650436849904, 'depth': 10, 'l2_leaf_reg': 7.776951386467424, 'border_count': 252, 'bagging_temperature': 0.7730512145510927, 'random_strength': 0.9360308997734017, 'scale_pos_weight': 25.936782212102514}. Best is trial 8 with value: 0.1050831549158869.
[I 2025-12-04 05:10:35,907] Trial 10 finished with value: 0.1286121810407245 and parameters: {'iterations': 134, 'learning_rate': 0.03855611502835833, 'depth': 6, 'l2_leaf_reg': 1.4662568596675811, 'border_count': 34, 'bagging_temperature': 0.5579400715105773, 'random_strength': 0.023597531083113285, 'scale_pos_weight': 53.07600267875315}. Best is trial 10 with value: 0.1286121810407245.
[I 2025-12-04 05:10:37,087] Trial 11 finished with value: 0.14088186853558612 and parameters: {'iterations': 110, 'learning_rate': 0.012875400851285565, 'depth': 6, 'l2_leaf_reg': 1.078701930095996, 'border_count': 36, 'bagging_temperature': 0.5982880599156641, 'random_strength': 0.008483545942185224, 'scale_pos_weight': 52.81371636232631}. Best is trial 11 with value: 0.14088186853558612.
[I 2025-12-04 05:10:38,209] Trial 12 finished with value: 0.14215964285665317 and parameters: {'iterations': 101, 'learning_rate': 0.012045331669316013, 'depth': 6, 'l2_leaf_reg': 1.0287226233666669, 'border_count': 34, 'bagging_temperature': 0.4577094244316484, 'random_strength': 0.011887276012594187, 'scale_pos_weight': 37.6968825744966}. Best is trial 12 with value: 0.14215964285665317.
[I 2025-12-04 05:10:40,093] Trial 13 finished with value: 0.1445029872908432 and parameters: {'iterations': 255, 'learning_rate': 0.018457254870963283, 'depth': 5, 'l2_leaf_reg': 1.0472458369295001, 'border_count': 82, 'bagging_temperature': 0.02343037724731667, 'random_strength': 0.23438374942150117, 'scale_pos_weight': 36.28436694057058}. Best is trial 13 with value: 0.1445029872908432.
[I 2025-12-04 05:10:41,864] Trial 14 finished with value: 0.1452407067611295 and parameters: {'iterations': 264, 'learning_rate': 0.01850731695825511, 'depth': 4, 'l2_leaf_reg': 2.5561648961486245, 'border_count': 86, 'bagging_temperature': 0.030358507469381818, 'random_strength': 0.24703283428635955, 'scale_pos_weight': 35.07532952589124}. Best is trial 14 with value: 0.1452407067611295.
[I 2025-12-04 05:10:45,072] Trial 15 finished with value: 0.09520484501521509 and parameters: {'iterations': 555, 'learning_rate': 0.10887456032055669, 'depth': 4, 'l2_leaf_reg': 2.624555176385747, 'border_count': 93, 'bagging_temperature': 0.002978693790340648, 'random_strength': 0.28316855966898735, 'scale_pos_weight': 34.08974357398568}. Best is trial 14 with value: 0.1452407067611295.
[I 2025-12-04 05:10:47,201] Trial 16 finished with value: 0.111863697832334 and parameters: {'iterations': 292, 'learning_rate': 0.06625564376986681, 'depth': 5, 'l2_leaf_reg': 2.2922534977546185, 'border_count': 93, 'bagging_temperature': 0.000500478349226955, 'random_strength': 0.25418199775946393, 'scale_pos_weight': 31.629864271749064}. Best is trial 14 with value: 0.1452407067611295.
[I 2025-12-04 05:10:50,776] Trial 17 finished with value: 0.08954543801803962 and parameters: {'iterations': 539, 'learning_rate': 0.29577259459401295, 'depth': 5, 'l2_leaf_reg': 4.1243575373118455, 'border_count': 137, 'bagging_temperature': 0.11432153436481297, 'random_strength': 0.6397542122037746, 'scale_pos_weight': 43.5923520418225}. Best is trial 14 with value: 0.1452407067611295.
[I 2025-12-04 05:10:56,869] Trial 18 finished with value: 0.09578733640292685 and parameters: {'iterations': 973, 'learning_rate': 0.043263265816906316, 'depth': 5, 'l2_leaf_reg': 2.106155623566749, 'border_count': 107, 'bagging_temperature': 0.341632188982515, 'random_strength': 0.1735470622997317, 'scale_pos_weight': 39.83464034178235}. Best is trial 14 with value: 0.1452407067611295.
[I 2025-12-04 05:10:58,499] Trial 19 finished with value: 0.11825640205270227 and parameters: {'iterations': 225, 'learning_rate': 0.10604355114416282, 'depth': 4, 'l2_leaf_reg': 4.326348013087538, 'border_count': 68, 'bagging_temperature': 0.1481364172927898, 'random_strength': 0.3484083953655459, 'scale_pos_weight': 29.61184858707501}. Best is trial 14 with value: 0.1452407067611295.
[I 2025-12-04 05:11:02,148] Trial 20 finished with value: 0.11340197233756222 and parameters: {'iterations': 529, 'learning_rate': 0.03958161749329713, 'depth': 5, 'l2_leaf_reg': 1.917498846767959, 'border_count': 167, 'bagging_temperature': 0.08661253269395487, 'random_strength': 0.13569094181702146, 'scale_pos_weight': 36.31115212708187}. Best is trial 14 with value: 0.1452407067611295.
[I 2025-12-04 05:11:04,239] Trial 21 finished with value: 0.1405079326640503 and parameters: {'iterations': 222, 'learning_rate': 0.012926845053732669, 'depth': 7, 'l2_leaf_reg': 1.0091141765708462, 'border_count': 69, 'bagging_temperature': 0.4356504040538475, 'random_strength': 0.1458084092241591, 'scale_pos_weight': 39.72561094961182}. Best is trial 14 with value: 0.1452407067611295.
[I 2025-12-04 05:11:06,918] Trial 22 finished with value: 0.14428414661330827 and parameters: {'iterations': 336, 'learning_rate': 0.01274861697574457, 'depth': 6, 'l2_leaf_reg': 2.9604403938176467, 'border_count': 116, 'bagging_temperature': 0.29718125759611447, 'random_strength': 0.0651588933889019, 'scale_pos_weight': 44.69145261648873}. Best is trial 14 with value: 0.1452407067611295.
