[I 2025-12-04 01:35:13,210] Trial 22 finished with value: 0.1439134407986749 and parameters: {'n_estimators': 877, 'learning_rate': 0.016017315544122647, 'max_depth': 4, 'min_child_weight': 8, 'subsample': 0.9330376302788866, 'colsample_bytree': 0.6409054097590677, 'reg_alpha': 0.9915150042282235, 'reg_lambda': 5.335598017249227, 'gamma': 3.256529273593812, 'scale_pos_weight': 14.586637833328208}. Best is trial 13 with value: 0.1491376612371969.
[I 2025-12-04 01:36:41,945] Trial 23 finished with value: 0.14614389422885207 and parameters: {'n_estimators': 894, 'learning_rate': 0.011708366930111165, 'max_depth': 4, 'min_child_weight': 8, 'subsample': 0.9407230774385443, 'colsample_bytree': 0.6328768532747635, 'reg_alpha': 0.9894031244586459, 'reg_lambda': 5.351154634161469, 'gamma': 3.309924717272219, 'scale_pos_weight': 14.30321029078568}. Best is trial 13 with value: 0.1491376612371969.
[I 2025-12-04 01:39:52,932] Trial 24 finished with value: 0.1366497213206978 and parameters: {'n_estimators': 902, 'learning_rate': 0.010708740582937774, 'max_depth': 6, 'min_child_weight': 8, 'subsample': 0.9369129730105198, 'colsample_bytree': 0.6352246967474091, 'reg_alpha': 0.9910774840825215, 'reg_lambda': 5.3684623081138785, 'gamma': 3.3985190509931145, 'scale_pos_weight': 12.959914521837945}. Best is trial 13 with value: 0.1491376612371969.
[I 2025-12-04 01:41:30,188] Trial 25 finished with value: 0.11781161826136359 and parameters: {'n_estimators': 917, 'learning_rate': 0.07718843058569835, 'max_depth': 4, 'min_child_weight': 9, 'subsample': 0.9171550654366694, 'colsample_bytree': 0.7038117757548729, 'reg_alpha': 0.725790802637978, 'reg_lambda': 3.7495645253931373, 'gamma': 3.2718256719520014, 'scale_pos_weight': 13.765042590981288}. Best is trial 13 with value: 0.1491376612371969.
[I 2025-12-04 01:43:12,295] Trial 26 finished with value: 0.13652929284906173 and parameters: {'n_estimators': 825, 'learning_rate': 0.027568389257319376, 'max_depth': 6, 'min_child_weight': 8, 'subsample': 0.8558913547655886, 'colsample_bytree': 0.7485825929384584, 'reg_alpha': 0.9258445097479077, 'reg_lambda': 5.579923129543217, 'gamma': 4.084446041077707, 'scale_pos_weight': 6.3835583590139535}. Best is trial 13 with value: 0.1491376612371969.
[I 2025-12-04 01:43:49,372] Trial 27 finished with value: 0.10749238667857422 and parameters: {'n_estimators': 941, 'learning_rate': 0.10553584142235987, 'max_depth': 5, 'min_child_weight': 9, 'subsample': 0.9552969229470499, 'colsample_bytree': 0.695294279061421, 'reg_alpha': 0.8129703409372587, 'reg_lambda': 8.33888792777901, 'gamma': 2.219061984091331, 'scale_pos_weight': 13.74691881309704}. Best is trial 13 with value: 0.1491376612371969.
[I 2025-12-04 01:44:56,839] Trial 28 finished with value: 0.11375809581953114 and parameters: {'n_estimators': 623, 'learning_rate': 0.16464309692206702, 'max_depth': 4, 'min_child_weight': 4, 'subsample': 0.8480867375252187, 'colsample_bytree': 0.6245775688728373, 'reg_alpha': 0.37753831148427464, 'reg_lambda': 6.910980215182084, 'gamma': 2.02174941255982, 'scale_pos_weight': 10.09445071226202}. Best is trial 13 with value: 0.1491376612371969.
[I 2025-12-04 01:47:14,150] Trial 29 finished with value: 0.11008868020767112 and parameters: {'n_estimators': 997, 'learning_rate': 0.0628254264017224, 'max_depth': 8, 'min_child_weight': 10, 'subsample': 0.9608304072244559, 'colsample_bytree': 0.6041393305492601, 'reg_alpha': 0.6881825567902016, 'reg_lambda': 5.236926976524888, 'gamma': 3.6386522324212502, 'scale_pos_weight': 27.78763291221919}. Best is trial 13 with value: 0.1491376612371969.
[I 2025-12-04 01:47:31,505] A new study created in memory with name: xgboost_fold_3
[I 2025-12-04 01:48:21,782] Trial 0 finished with value: 0.13999067404128462 and parameters: {'n_estimators': 570, 'learning_rate': 0.027169582609984366, 'max_depth': 3, 'min_child_weight': 5, 'subsample': 0.8974747176541993, 'colsample_bytree': 0.6907494535607198, 'reg_alpha': 0.025339463349506985, 'reg_lambda': 9.355932151917928, 'gamma': 1.3607686951980154, 'scale_pos_weight': 26.733968596788635}. Best is trial 0 with value: 0.13999067404128462.
[I 2025-12-04 01:49:26,930] Trial 1 finished with value: 0.09067443266087181 and parameters: {'n_estimators': 302, 'learning_rate': 0.10240820537503016, 'max_depth': 7, 'min_child_weight': 2, 'subsample': 0.767330453183074, 'colsample_bytree': 0.9781169893167656, 'reg_alpha': 0.32893197524100515, 'reg_lambda': 8.438249128790034, 'gamma': 2.6762967838876124, 'scale_pos_weight': 50.87394781662555}. Best is trial 0 with value: 0.13999067404128462.
[I 2025-12-04 01:50:43,722] Trial 2 finished with value: 0.08489499421202848 and parameters: {'n_estimators': 452, 'learning_rate': 0.2967334216630288, 'max_depth': 4, 'min_child_weight': 8, 'subsample': 0.8887430856331633, 'colsample_bytree': 0.6531329686486735, 'reg_alpha': 0.8174065822386924, 'reg_lambda': 5.791522142410763, 'gamma': 0.1997418653503702, 'scale_pos_weight': 41.39817202196117}. Best is trial 0 with value: 0.13999067404128462.
[I 2025-12-04 01:51:21,617] Trial 3 finished with value: 0.0853245319531957 and parameters: {'n_estimators': 314, 'learning_rate': 0.2616398992534025, 'max_depth': 10, 'min_child_weight': 5, 'subsample': 0.6741286730735924, 'colsample_bytree': 0.7565054582480474, 'reg_alpha': 0.47470453505869104, 'reg_lambda': 4.08640089398391, 'gamma': 4.629820731204966, 'scale_pos_weight': 48.9475081129417}. Best is trial 0 with value: 0.13999067404128462.
[I 2025-12-04 01:52:21,233] Trial 4 finished with value: 0.1058886928640786 and parameters: {'n_estimators': 386, 'learning_rate': 0.08521838859588647, 'max_depth': 4, 'min_child_weight': 8, 'subsample': 0.9950554542182306, 'colsample_bytree': 0.8978572274337718, 'reg_alpha': 0.13956537640054456, 'reg_lambda': 3.2383121096548972, 'gamma': 1.620695675231751, 'scale_pos_weight': 46.792852639941636}. Best is trial 0 with value: 0.13999067404128462.
[I 2025-12-04 01:52:58,825] Trial 5 finished with value: 0.1009480450640586 and parameters: {'n_estimators': 358, 'learning_rate': 0.19651238546138897, 'max_depth': 5, 'min_child_weight': 7, 'subsample': 0.9042439415918171, 'colsample_bytree': 0.7389990471938859, 'reg_alpha': 0.8289088130271013, 'reg_lambda': 3.6991613533530163, 'gamma': 2.9634889129806923, 'scale_pos_weight': 29.686694460656014}. Best is trial 0 with value: 0.13999067404128462.
[I 2025-12-04 01:54:05,042] Trial 6 finished with value: 0.08281751834467134 and parameters: {'n_estimators': 540, 'learning_rate': 0.2540818470848966, 'max_depth': 13, 'min_child_weight': 6, 'subsample': 0.6261683112240398, 'colsample_bytree': 0.6192637366927028, 'reg_alpha': 0.03020051057289419, 'reg_lambda': 1.7422677958739978, 'gamma': 3.6257827294833063, 'scale_pos_weight': 52.2551448612228}. Best is trial 0 with value: 0.13999067404128462.
[I 2025-12-04 01:55:02,082] Trial 7 finished with value: 0.09200008452914818 and parameters: {'n_estimators': 349, 'learning_rate': 0.12653159475281497, 'max_depth': 8, 'min_child_weight': 3, 'subsample': 0.9222844997832289, 'colsample_bytree': 0.8597289293597787, 'reg_alpha': 0.5088047490838006, 'reg_lambda': 3.6341315005476607, 'gamma': 3.5779073466495994, 'scale_pos_weight': 43.0055973095268}. Best is trial 0 with value: 0.13999067404128462.
[I 2025-12-04 01:56:27,210] Trial 8 finished with value: 0.07856715323159165 and parameters: {'n_estimators': 280, 'learning_rate': 0.2519183814284907, 'max_depth': 14, 'min_child_weight': 3, 'subsample': 0.6479977758867626, 'colsample_bytree': 0.8992822937337822, 'reg_alpha': 0.18604843993534015, 'reg_lambda': 7.073173179380093, 'gamma': 1.2324876169338732, 'scale_pos_weight': 52.45324010578806}. Best is trial 0 with value: 0.13999067404128462.
[I 2025-12-04 01:57:23,869] Trial 9 finished with value: 0.09559003690956047 and parameters: {'n_estimators': 445, 'learning_rate': 0.19118867035621195, 'max_depth': 3, 'min_child_weight': 3, 'subsample': 0.7246466006818428, 'colsample_bytree': 0.6756084038212387, 'reg_alpha': 0.486156045350147, 'reg_lambda': 6.0422208885473925, 'gamma': 2.9004861871839385, 'scale_pos_weight': 26.435778417460654}. Best is trial 0 with value: 0.13999067404128462.
[I 2025-12-04 02:04:33,110] Trial 10 finished with value: 0.1274182853795208 and parameters: {'n_estimators': 806, 'learning_rate': 0.01825776388151081, 'max_depth': 11, 'min_child_weight': 10, 'subsample': 0.8206751523184076, 'colsample_bytree': 0.7167702519599859, 'reg_alpha': 0.9890719793153249, 'reg_lambda': 9.452872506381148, 'gamma': 0.09888858119325517, 'scale_pos_weight': 5.938643637310026}. Best is trial 0 with value: 0.13999067404128462.
[I 2025-12-04 02:11:42,860] Trial 11 finished with value: 0.13621723544788722 and parameters: {'n_estimators': 808, 'learning_rate': 0.010323148265855873, 'max_depth': 11, 'min_child_weight': 10, 'subsample': 0.8356361098788871, 'colsample_bytree': 0.7195647755029018, 'reg_alpha': 0.9734226624577, 'reg_lambda': 9.923578907154868, 'gamma': 0.20516070062642422, 'scale_pos_weight': 6.03432634458949}. Best is trial 0 with value: 0.13999067404128462.
[I 2025-12-04 02:17:15,098] Trial 12 finished with value: 0.12843000293223134 and parameters: {'n_estimators': 785, 'learning_rate': 0.012878334840122085, 'max_depth': 12, 'min_child_weight': 10, 'subsample': 0.8317994663023722, 'colsample_bytree': 0.827555431869798, 'reg_alpha': 0.6797515311820368, 'reg_lambda': 9.611673895415068, 'gamma': 1.1149069326550238, 'scale_pos_weight': 6.787782183169374}. Best is trial 0 with value: 0.13999067404128462.
[I 2025-12-04 02:20:34,525] Trial 13 finished with value: 0.12104961042828152 and parameters: {'n_estimators': 975, 'learning_rate': 0.05311506565574273, 'max_depth': 15, 'min_child_weight': 5, 'subsample': 0.9763691881398734, 'colsample_bytree': 0.7840329353022986, 'reg_alpha': 0.31476098484395426, 'reg_lambda': 7.9181992980586156, 'gamma': 1.8276223953416404, 'scale_pos_weight': 14.63068870190001}. Best is trial 0 with value: 0.13999067404128462.
[I 2025-12-04 02:22:56,886] Trial 14 finished with value: 0.10102151588692884 and parameters: {'n_estimators': 732, 'learning_rate': 0.058618351139755054, 'max_depth': 6, 'min_child_weight': 1, 'subsample': 0.8471175314378665, 'colsample_bytree': 0.6916988839042674, 'reg_alpha': 0.9832753631399899, 'reg_lambda': 9.92744611383296, 'gamma': 0.729798371264053, 'scale_pos_weight': 21.584735864774398}. Best is trial 0 with value: 0.13999067404128462.
[I 2025-12-04 02:25:52,004] Trial 15 finished with value: 0.10024735985291204 and parameters: {'n_estimators': 648, 'learning_rate': 0.04663359721382432, 'max_depth': 9, 'min_child_weight': 6, 'subsample': 0.7650354289127552, 'colsample_bytree': 0.6352160120731132, 'reg_alpha': 0.6550369937029201, 'reg_lambda': 8.194322179712358, 'gamma': 1.9352189433141234, 'scale_pos_weight': 33.87722567632159}. Best is trial 0 with value: 0.13999067404128462.
[I 2025-12-04 02:27:06,917] Trial 16 finished with value: 0.10859487110585182 and parameters: {'n_estimators': 946, 'learning_rate': 0.15391422416682984, 'max_depth': 10, 'min_child_weight': 9, 'subsample': 0.9364342593288772, 'colsample_bytree': 0.7923296891658447, 'reg_alpha': 0.026321379869699423, 'reg_lambda': 8.943849378491388, 'gamma': 0.6651679497045819, 'scale_pos_weight': 14.774004720627818}. Best is trial 0 with value: 0.13999067404128462.
[I 2025-12-04 02:30:29,396] Trial 17 finished with value: 0.12145114353118922 and parameters: {'n_estimators': 618, 'learning_rate': 0.010260075032848648, 'max_depth': 8, 'min_child_weight': 4, 'subsample': 0.8684500381710147, 'colsample_bytree': 0.6059880683815734, 'reg_alpha': 0.2840965028704439, 'reg_lambda': 7.111780465677531, 'gamma': 0.008594532240385977, 'scale_pos_weight': 14.786330725676308}. Best is trial 0 with value: 0.13999067404128462.
[I 2025-12-04 02:32:25,210] Trial 18 finished with value: 0.10369595252476702 and parameters: {'n_estimators': 141, 'learning_rate': 0.08596509314211151, 'max_depth': 12, 'min_child_weight': 8, 'subsample': 0.788645974085193, 'colsample_bytree': 0.7085981294669901, 'reg_alpha': 0.6080065081523038, 'reg_lambda': 7.429154501240369, 'gamma': 0.7282901620722928, 'scale_pos_weight': 34.38467670457207}. Best is trial 0 with value: 0.13999067404128462.
[I 2025-12-04 02:33:30,829] Trial 19 finished with value: 0.09177242998187649 and parameters: {'n_estimators': 862, 'learning_rate': 0.12396455264572055, 'max_depth': 6, 'min_child_weight': 7, 'subsample': 0.7061307716003792, 'colsample_bytree': 0.7550089594612153, 'reg_alpha': 0.8342092790985114, 'reg_lambda': 6.432401063165505, 'gamma': 2.2006896100657443, 'scale_pos_weight': 20.830495826258087}. Best is trial 0 with value: 0.13999067404128462.
[I 2025-12-04 02:36:52,302] Trial 20 finished with value: 0.12017027467264088 and parameters: {'n_estimators': 669, 'learning_rate': 0.040760662087361496, 'max_depth': 9, 'min_child_weight': 4, 'subsample': 0.957855459467779, 'colsample_bytree': 0.6649099933825282, 'reg_alpha': 0.18664682735444993, 'reg_lambda': 5.015742846003137, 'gamma': 1.3505839847538976, 'scale_pos_weight': 10.669290879082919}. Best is trial 0 with value: 0.13999067404128462.
[I 2025-12-04 02:42:11,781] Trial 21 finished with value: 0.12384913627753162 and parameters: {'n_estimators': 792, 'learning_rate': 0.014786226059028637, 'max_depth': 12, 'min_child_weight': 10, 'subsample': 0.8332333253913868, 'colsample_bytree': 0.8343210667964275, 'reg_alpha': 0.6899096662519977, 'reg_lambda': 9.942776453972401, 'gamma': 1.0524386541837183, 'scale_pos_weight': 6.272642006560574}. Best is trial 0 with value: 0.13999067404128462.
[I 2025-12-04 02:47:38,411] Trial 22 finished with value: 0.10935088325609618 and parameters: {'n_estimators': 869, 'learning_rate': 0.03466584557422198, 'max_depth': 12, 'min_child_weight': 9, 'subsample': 0.8694697520354463, 'colsample_bytree': 0.8373312345036695, 'reg_alpha': 0.7227223736236441, 'reg_lambda': 8.97021513349618, 'gamma': 0.5405607730626341, 'scale_pos_weight': 8.878651191625403}. Best is trial 0 with value: 0.13999067404128462.
[I 2025-12-04 02:50:00,600] Trial 23 finished with value: 0.10244886422800226 and parameters: {'n_estimators': 547, 'learning_rate': 0.07064036604034638, 'max_depth': 11, 'min_child_weight': 9, 'subsample': 0.8145783800060413, 'colsample_bytree': 0.7310776886565253, 'reg_alpha': 0.9023360205776543, 'reg_lambda': 9.016088825055604, 'gamma': 1.2047787991464571, 'scale_pos_weight': 20.603512516835746}. Best is trial 0 with value: 0.13999067404128462.
[I 2025-12-04 02:55:19,228] Trial 24 finished with value: 0.11185173810774462 and parameters: {'n_estimators': 733, 'learning_rate': 0.02781370286918248, 'max_depth': 14, 'min_child_weight': 10, 'subsample': 0.8611396685912908, 'colsample_bytree': 0.8144400206027372, 'reg_alpha': 0.559340006255002, 'reg_lambda': 9.453671995841937, 'gamma': 0.44438346010297575, 'scale_pos_weight': 11.592174699200056}. Best is trial 0 with value: 0.13999067404128462.
[I 2025-12-04 02:57:13,376] Trial 25 finished with value: 0.10799114971550346 and parameters: {'n_estimators': 899, 'learning_rate': 0.07764828913501742, 'max_depth': 11, 'min_child_weight': 9, 'subsample': 0.7922584767818451, 'colsample_bytree': 0.7787352026841037, 'reg_alpha': 0.41396852443820537, 'reg_lambda': 8.274232389128834, 'gamma': 2.321649551134567, 'scale_pos_weight': 24.41607220485453}. Best is trial 0 with value: 0.13999067404128462.
[I 2025-12-04 02:58:46,032] Trial 26 finished with value: 0.10680325254009781 and parameters: {'n_estimators': 763, 'learning_rate': 0.10645120607404371, 'max_depth': 13, 'min_child_weight': 7, 'subsample': 0.9008038579781075, 'colsample_bytree': 0.88225544563898, 'reg_alpha': 0.7373546184256007, 'reg_lambda': 9.960618415446085, 'gamma': 1.5125555913829856, 'scale_pos_weight': 18.291270577590737}. Best is trial 0 with value: 0.13999067404128462.
[I 2025-12-04 03:02:13,458] Trial 27 finished with value: 0.09567446995111736 and parameters: {'n_estimators': 593, 'learning_rate': 0.060146018404886925, 'max_depth': 10, 'min_child_weight': 10, 'subsample': 0.7478088485119666, 'colsample_bytree': 0.9883024393338155, 'reg_alpha': 0.8998128170452909, 'reg_lambda': 4.960758163324032, 'gamma': 0.9397965252079816, 'scale_pos_weight': 35.015721987701376}. Best is trial 0 with value: 0.13999067404128462.
[I 2025-12-04 03:08:12,496] Trial 28 finished with value: 0.1137403791662746 and parameters: {'n_estimators': 687, 'learning_rate': 0.03256623706528691, 'max_depth': 15, 'min_child_weight': 6, 'subsample': 0.9360933400524445, 'colsample_bytree': 0.9384915314762206, 'reg_alpha': 0.4046016866300229, 'reg_lambda': 7.5403225805466665, 'gamma': 0.37125748572528666, 'scale_pos_weight': 9.087704716073938}. Best is trial 0 with value: 0.13999067404128462.
[I 2025-12-04 03:09:49,448] Trial 29 finished with value: 0.0889391432287733 and parameters: {'n_estimators': 493, 'learning_rate': 0.10178602219639131, 'max_depth': 7, 'min_child_weight': 4, 'subsample': 0.7950090860406785, 'colsample_bytree': 0.9443592114093847, 'reg_alpha': 0.621317307801697, 'reg_lambda': 8.768719821914793, 'gamma': 1.9003649442274781, 'scale_pos_weight': 29.33446252517561}. Best is trial 0 with value: 0.13999067404128462.
[I 2025-12-04 03:10:10,078] A new study created in memory with name: xgboost_fold_4
[I 2025-12-04 03:10:57,108] Trial 0 finished with value: 0.10609074045055907 and parameters: {'n_estimators': 450, 'learning_rate': 0.1531473695021717, 'max_depth': 14, 'min_child_weight': 3, 'subsample': 0.6533428309344189, 'colsample_bytree': 0.6893676790433806, 'reg_alpha': 0.1239885137988439, 'reg_lambda': 8.454699422159774, 'gamma': 4.99768851764377, 'scale_pos_weight': 35.35029632950727}. Best is trial 0 with value: 0.10609074045055907.
[I 2025-12-04 03:12:17,052] Trial 1 finished with value: 0.09103282915150876 and parameters: {'n_estimators': 306, 'learning_rate': 0.21208485177458528, 'max_depth': 9, 'min_child_weight': 10, 'subsample': 0.6465767689864759, 'colsample_bytree': 0.9364076884022531, 'reg_alpha': 0.13952420343368366, 'reg_lambda': 1.6547639379828867, 'gamma': 0.7699585139777798, 'scale_pos_weight': 35.43088511050754}. Best is trial 0 with value: 0.10609074045055907.
[I 2025-12-04 03:12:57,672] Trial 2 finished with value: 0.15330601092908264 and parameters: {'n_estimators': 607, 'learning_rate': 0.06331489342116714, 'max_depth': 8, 'min_child_weight': 3, 'subsample': 0.9858536893700901, 'colsample_bytree': 0.9377034967960558, 'reg_alpha': 0.8577972593818477, 'reg_lambda': 6.955653991240171, 'gamma': 4.6414701763399595, 'scale_pos_weight': 8.561887642409681}. Best is trial 2 with value: 0.15330601092908264.
[I 2025-12-04 03:14:13,943] Trial 3 finished with value: 0.11410280899195886 and parameters: {'n_estimators': 307, 'learning_rate': 0.13411028162741487, 'max_depth': 5, 'min_child_weight': 2, 'subsample': 0.9813285816051578, 'colsample_bytree': 0.6682936546711914, 'reg_alpha': 0.5544293148918744, 'reg_lambda': 4.305484663741019, 'gamma': 1.6308213615037688, 'scale_pos_weight': 35.220384422800244}. Best is trial 2 with value: 0.15330601092908264.
[I 2025-12-04 03:15:25,768] Trial 4 finished with value: 0.11639405486540774 and parameters: {'n_estimators': 540, 'learning_rate': 0.29534765067763497, 'max_depth': 15, 'min_child_weight': 4, 'subsample': 0.9042836409090061, 'colsample_bytree': 0.8102924666775627, 'reg_alpha': 0.9295698312135119, 'reg_lambda': 2.7826752764531264, 'gamma': 2.066444623291072, 'scale_pos_weight': 8.534075296423644}. Best is trial 2 with value: 0.15330601092908264.
[I 2025-12-04 03:16:03,107] Trial 5 finished with value: 0.10541539750338698 and parameters: {'n_estimators': 225, 'learning_rate': 0.19239149176431314, 'max_depth': 5, 'min_child_weight': 3, 'subsample': 0.7358629040125229, 'colsample_bytree': 0.732123360124339, 'reg_alpha': 0.6452431803891197, 'reg_lambda': 9.068690167109494, 'gamma': 0.08429830352781331, 'scale_pos_weight': 34.0691099740691}. Best is trial 2 with value: 0.15330601092908264.
[I 2025-12-04 03:16:28,734] Trial 6 finished with value: 0.13661154635397263 and parameters: {'n_estimators': 645, 'learning_rate': 0.2274501097545745, 'max_depth': 15, 'min_child_weight': 3, 'subsample': 0.9962275247506915, 'colsample_bytree': 0.678697823390754, 'reg_alpha': 0.07886614304034412, 'reg_lambda': 2.019178315615943, 'gamma': 2.3955059598984256, 'scale_pos_weight': 17.339429116095584}. Best is trial 2 with value: 0.15330601092908264.
[I 2025-12-04 03:17:09,464] Trial 7 finished with value: 0.09595687580136866 and parameters: {'n_estimators': 597, 'learning_rate': 0.25714109512186134, 'max_depth': 14, 'min_child_weight': 3, 'subsample': 0.7626645455334935, 'colsample_bytree': 0.7755365556533061, 'reg_alpha': 0.8521915230331965, 'reg_lambda': 2.7934320318604553, 'gamma': 1.3582307571074315, 'scale_pos_weight': 52.61199012065005}. Best is trial 2 with value: 0.15330601092908264.
[I 2025-12-04 03:17:47,977] Trial 8 finished with value: 0.10865644771072307 and parameters: {'n_estimators': 502, 'learning_rate': 0.2738244092524249, 'max_depth': 15, 'min_child_weight': 1, 'subsample': 0.8827306446810743, 'colsample_bytree': 0.7571584706455858, 'reg_alpha': 0.08845477108874877, 'reg_lambda': 8.639895773234272, 'gamma': 3.844041655118797, 'scale_pos_weight': 29.176321657817795}. Best is trial 2 with value: 0.15330601092908264.
[I 2025-12-04 03:18:51,677] Trial 9 finished with value: 0.10120841287108986 and parameters: {'n_estimators': 724, 'learning_rate': 0.2501883775251393, 'max_depth': 8, 'min_child_weight': 10, 'subsample': 0.8707112211832679, 'colsample_bytree': 0.8243576480683845, 'reg_alpha': 0.9068842651893771, 'reg_lambda': 4.234155981030057, 'gamma': 3.0610422864423152, 'scale_pos_weight': 45.18880355648215}. Best is trial 2 with value: 0.15330601092908264.
