[I 2025-12-04 11:31:17,788] Trial 29 finished with value: 0.04810254031072021 and parameters: {'kernel': 'poly', 'C': 0.33896118826718935, 'degree': 6, 'shrinking': True}. Best is trial 21 with value: 0.09548691651383875.
[I 2025-12-04 11:31:21,248] A new study created in memory with name: svc_fold_3
[I 2025-12-04 11:31:28,867] Trial 0 finished with value: 0.051057447564135175 and parameters: {'kernel': 'rbf', 'C': 18.72043962304392, 'degree': 2, 'shrinking': False, 'gamma': 'auto'}. Best is trial 0 with value: 0.051057447564135175.
[I 2025-12-04 11:31:37,286] Trial 1 finished with value: 0.0942454701209627 and parameters: {'kernel': 'sigmoid', 'C': 0.4827601883062593, 'degree': 4, 'shrinking': True}. Best is trial 1 with value: 0.0942454701209627.
[I 2025-12-04 11:31:45,525] Trial 2 finished with value: 0.09530160193566678 and parameters: {'kernel': 'sigmoid', 'C': 4.096587173581221, 'degree': 6, 'shrinking': False}. Best is trial 2 with value: 0.09530160193566678.
[I 2025-12-04 11:31:53,980] Trial 3 finished with value: 0.09511932293998901 and parameters: {'kernel': 'sigmoid', 'C': 5.986100003811272, 'degree': 3, 'shrinking': False}. Best is trial 2 with value: 0.09530160193566678.
[I 2025-12-04 11:32:02,499] Trial 4 finished with value: 0.09520471715564466 and parameters: {'kernel': 'sigmoid', 'C': 1.5678440852506261, 'degree': 6, 'shrinking': True}. Best is trial 2 with value: 0.09530160193566678.
[I 2025-12-04 11:32:06,735] Trial 5 finished with value: 0.042962480617710554 and parameters: {'kernel': 'linear', 'C': 26.620515490704204, 'degree': 6, 'shrinking': False}. Best is trial 2 with value: 0.09530160193566678.
[I 2025-12-04 11:32:14,413] Trial 6 finished with value: 0.06118085437712738 and parameters: {'kernel': 'rbf', 'C': 42.64687314678004, 'degree': 2, 'shrinking': True, 'gamma': 'auto'}. Best is trial 2 with value: 0.09530160193566678.
[I 2025-12-04 11:32:18,666] Trial 7 finished with value: 0.051914201941138126 and parameters: {'kernel': 'linear', 'C': 2.315517342738238, 'degree': 2, 'shrinking': False}. Best is trial 2 with value: 0.09530160193566678.
[I 2025-12-04 11:32:23,918] Trial 8 finished with value: 0.04760749676744647 and parameters: {'kernel': 'poly', 'C': 0.3968200623587506, 'degree': 6, 'shrinking': True}. Best is trial 2 with value: 0.09530160193566678.
[I 2025-12-04 11:32:32,284] Trial 9 finished with value: 0.09330193735191261 and parameters: {'kernel': 'sigmoid', 'C': 0.26600751997550276, 'degree': 3, 'shrinking': False}. Best is trial 2 with value: 0.09530160193566678.
[I 2025-12-04 11:32:37,595] Trial 10 finished with value: 0.056949912514547264 and parameters: {'kernel': 'poly', 'C': 99.92190457168763, 'degree': 5, 'shrinking': False}. Best is trial 2 with value: 0.09530160193566678.
[I 2025-12-04 11:32:45,907] Trial 11 finished with value: 0.09493347580154207 and parameters: {'kernel': 'sigmoid', 'C': 1.6614276296581822, 'degree': 5, 'shrinking': True}. Best is trial 2 with value: 0.09530160193566678.
[I 2025-12-04 11:32:54,336] Trial 12 finished with value: 0.09530561668123094 and parameters: {'kernel': 'sigmoid', 'C': 5.17985809608032, 'degree': 6, 'shrinking': True}. Best is trial 12 with value: 0.09530561668123094.
[I 2025-12-04 11:33:02,820] Trial 13 finished with value: 0.09502885049060317 and parameters: {'kernel': 'sigmoid', 'C': 7.083972191013721, 'degree': 5, 'shrinking': True}. Best is trial 12 with value: 0.09530561668123094.
[I 2025-12-04 11:33:11,202] Trial 14 finished with value: 0.09508112662310234 and parameters: {'kernel': 'sigmoid', 'C': 6.20201121863537, 'degree': 6, 'shrinking': True}. Best is trial 12 with value: 0.09530561668123094.
[I 2025-12-04 11:33:19,599] Trial 15 finished with value: 0.09491993419011038 and parameters: {'kernel': 'sigmoid', 'C': 0.9561905410484473, 'degree': 5, 'shrinking': False}. Best is trial 12 with value: 0.09530561668123094.
[I 2025-12-04 11:33:25,008] Trial 16 finished with value: 0.052857742367140345 and parameters: {'kernel': 'poly', 'C': 14.064089295219635, 'degree': 4, 'shrinking': False}. Best is trial 12 with value: 0.09530561668123094.
[I 2025-12-04 11:33:31,900] Trial 17 finished with value: 0.04897060869861444 and parameters: {'kernel': 'rbf', 'C': 0.10054665928084887, 'degree': 4, 'shrinking': True, 'gamma': 'scale'}. Best is trial 12 with value: 0.09530561668123094.
[I 2025-12-04 11:33:36,075] Trial 18 finished with value: 0.04290479372034338 and parameters: {'kernel': 'linear', 'C': 3.8424977030240384, 'degree': 6, 'shrinking': True}. Best is trial 12 with value: 0.09530561668123094.
[I 2025-12-04 11:33:44,358] Trial 19 finished with value: 0.09520911143923999 and parameters: {'kernel': 'sigmoid', 'C': 11.588247770650938, 'degree': 5, 'shrinking': False}. Best is trial 12 with value: 0.09530561668123094.
[I 2025-12-04 11:33:52,685] Trial 20 finished with value: 0.09451285760291753 and parameters: {'kernel': 'sigmoid', 'C': 0.8316821558754994, 'degree': 6, 'shrinking': False}. Best is trial 12 with value: 0.09530561668123094.
[I 2025-12-04 11:34:00,884] Trial 21 finished with value: 0.09537776469158582 and parameters: {'kernel': 'sigmoid', 'C': 9.880230524744446, 'degree': 5, 'shrinking': False}. Best is trial 21 with value: 0.09537776469158582.
[I 2025-12-04 11:34:09,507] Trial 22 finished with value: 0.09541741587035939 and parameters: {'kernel': 'sigmoid', 'C': 3.7291404469018645, 'degree': 5, 'shrinking': False}. Best is trial 22 with value: 0.09541741587035939.
[I 2025-12-04 11:34:17,661] Trial 23 finished with value: 0.09542527496308725 and parameters: {'kernel': 'sigmoid', 'C': 8.93601480447101, 'degree': 5, 'shrinking': False}. Best is trial 23 with value: 0.09542527496308725.
[I 2025-12-04 11:34:25,928] Trial 24 finished with value: 0.09504602773520754 and parameters: {'kernel': 'sigmoid', 'C': 40.012075189847344, 'degree': 5, 'shrinking': False}. Best is trial 23 with value: 0.09542527496308725.
[I 2025-12-04 11:34:34,261] Trial 25 finished with value: 0.09530260205045364 and parameters: {'kernel': 'sigmoid', 'C': 10.028209908806396, 'degree': 4, 'shrinking': False}. Best is trial 23 with value: 0.09542527496308725.
[I 2025-12-04 11:34:39,506] Trial 26 finished with value: 0.054870176981512364 and parameters: {'kernel': 'poly', 'C': 2.7064138847385464, 'degree': 5, 'shrinking': False}. Best is trial 23 with value: 0.09542527496308725.
[I 2025-12-04 11:34:43,488] Trial 27 finished with value: 0.0430067591306877 and parameters: {'kernel': 'linear', 'C': 26.366017204406916, 'degree': 4, 'shrinking': False}. Best is trial 23 with value: 0.09542527496308725.
[I 2025-12-04 11:34:50,829] Trial 28 finished with value: 0.05077425293656414 and parameters: {'kernel': 'rbf', 'C': 85.08723316680361, 'degree': 3, 'shrinking': False, 'gamma': 'scale'}. Best is trial 23 with value: 0.09542527496308725.
[I 2025-12-04 11:34:58,411] Trial 29 finished with value: 0.06082332091907301 and parameters: {'kernel': 'rbf', 'C': 20.386820868345122, 'degree': 5, 'shrinking': False, 'gamma': 'auto'}. Best is trial 23 with value: 0.09542527496308725.
[I 2025-12-04 11:35:01,624] A new study created in memory with name: svc_fold_4
[I 2025-12-04 11:35:06,572] Trial 0 finished with value: 0.052535406440543754 and parameters: {'kernel': 'poly', 'C': 0.9831042491489764, 'degree': 2, 'shrinking': False}. Best is trial 0 with value: 0.052535406440543754.
[I 2025-12-04 11:35:13,792] Trial 1 finished with value: 0.057313615050555114 and parameters: {'kernel': 'rbf', 'C': 72.441741987111, 'degree': 2, 'shrinking': False, 'gamma': 'auto'}. Best is trial 1 with value: 0.057313615050555114.
[I 2025-12-04 11:35:21,905] Trial 2 finished with value: 0.09798338527373335 and parameters: {'kernel': 'sigmoid', 'C': 4.465342137103337, 'degree': 3, 'shrinking': False}. Best is trial 2 with value: 0.09798338527373335.
[I 2025-12-04 11:35:25,850] Trial 3 finished with value: 0.053878037117940814 and parameters: {'kernel': 'linear', 'C': 42.944967587580706, 'degree': 3, 'shrinking': False}. Best is trial 2 with value: 0.09798338527373335.
[I 2025-12-04 11:35:33,988] Trial 4 finished with value: 0.09793084464706918 and parameters: {'kernel': 'sigmoid', 'C': 61.64497544248058, 'degree': 6, 'shrinking': True}. Best is trial 2 with value: 0.09798338527373335.
[I 2025-12-04 11:35:42,157] Trial 5 finished with value: 0.09778084402265004 and parameters: {'kernel': 'sigmoid', 'C': 4.978404593938898, 'degree': 2, 'shrinking': True}. Best is trial 2 with value: 0.09798338527373335.
[I 2025-12-04 11:35:50,388] Trial 6 finished with value: 0.09680925418897443 and parameters: {'kernel': 'sigmoid', 'C': 0.16871575187935586, 'degree': 3, 'shrinking': True}. Best is trial 2 with value: 0.09798338527373335.
[I 2025-12-04 11:35:54,331] Trial 7 finished with value: 0.05592171907503731 and parameters: {'kernel': 'linear', 'C': 19.891927622608538, 'degree': 2, 'shrinking': True}. Best is trial 2 with value: 0.09798338527373335.
[I 2025-12-04 11:36:01,148] Trial 8 finished with value: 0.04877096235197932 and parameters: {'kernel': 'rbf', 'C': 0.3021014431805188, 'degree': 2, 'shrinking': False, 'gamma': 'scale'}. Best is trial 2 with value: 0.09798338527373335.
[I 2025-12-04 11:36:09,344] Trial 9 finished with value: 0.09792466731209486 and parameters: {'kernel': 'sigmoid', 'C': 74.91469282230462, 'degree': 3, 'shrinking': True}. Best is trial 2 with value: 0.09798338527373335.
[I 2025-12-04 11:36:14,605] Trial 10 finished with value: 0.052826373874901945 and parameters: {'kernel': 'poly', 'C': 5.5648294466417285, 'degree': 5, 'shrinking': False}. Best is trial 2 with value: 0.09798338527373335.
[I 2025-12-04 11:36:22,777] Trial 11 finished with value: 0.09766363628583252 and parameters: {'kernel': 'sigmoid', 'C': 14.30380729371349, 'degree': 6, 'shrinking': True}. Best is trial 2 with value: 0.09798338527373335.
[I 2025-12-04 11:36:30,960] Trial 12 finished with value: 0.09750183846409666 and parameters: {'kernel': 'sigmoid', 'C': 1.0893463982116396, 'degree': 5, 'shrinking': False}. Best is trial 2 with value: 0.09798338527373335.
[I 2025-12-04 11:36:39,209] Trial 13 finished with value: 0.09824991454157417 and parameters: {'kernel': 'sigmoid', 'C': 1.8608663228589606, 'degree': 4, 'shrinking': True}. Best is trial 13 with value: 0.09824991454157417.
[I 2025-12-04 11:36:47,462] Trial 14 finished with value: 0.09805207029812808 and parameters: {'kernel': 'sigmoid', 'C': 1.5318349682665868, 'degree': 4, 'shrinking': True}. Best is trial 13 with value: 0.09824991454157417.
[I 2025-12-04 11:36:55,713] Trial 15 finished with value: 0.09799062790579269 and parameters: {'kernel': 'sigmoid', 'C': 1.5498828260723998, 'degree': 4, 'shrinking': True}. Best is trial 13 with value: 0.09824991454157417.
[I 2025-12-04 11:36:59,831] Trial 16 finished with value: 0.06934902674960197 and parameters: {'kernel': 'linear', 'C': 0.4468745643250378, 'degree': 4, 'shrinking': True}. Best is trial 13 with value: 0.09824991454157417.
[I 2025-12-04 11:37:07,076] Trial 17 finished with value: 0.052543734787247345 and parameters: {'kernel': 'rbf', 'C': 2.329892819318747, 'degree': 5, 'shrinking': True, 'gamma': 'scale'}. Best is trial 13 with value: 0.09824991454157417.
[I 2025-12-04 11:37:12,343] Trial 18 finished with value: 0.048029226885653156 and parameters: {'kernel': 'poly', 'C': 0.5622520800240058, 'degree': 4, 'shrinking': True}. Best is trial 13 with value: 0.09824991454157417.
[I 2025-12-04 11:37:20,476] Trial 19 finished with value: 0.09770240663567857 and parameters: {'kernel': 'sigmoid', 'C': 10.145610091435207, 'degree': 5, 'shrinking': True}. Best is trial 13 with value: 0.09824991454157417.
[I 2025-12-04 11:37:28,696] Trial 20 finished with value: 0.09682118882578876 and parameters: {'kernel': 'sigmoid', 'C': 0.12307344032950256, 'degree': 4, 'shrinking': True}. Best is trial 13 with value: 0.09824991454157417.
[I 2025-12-04 11:37:36,845] Trial 21 finished with value: 0.09789406398668524 and parameters: {'kernel': 'sigmoid', 'C': 1.9304988230929396, 'degree': 4, 'shrinking': True}. Best is trial 13 with value: 0.09824991454157417.
[I 2025-12-04 11:37:44,985] Trial 22 finished with value: 0.09733347260758425 and parameters: {'kernel': 'sigmoid', 'C': 1.281477210465551, 'degree': 4, 'shrinking': True}. Best is trial 13 with value: 0.09824991454157417.
[I 2025-12-04 11:37:53,109] Trial 23 finished with value: 0.098258965350867 and parameters: {'kernel': 'sigmoid', 'C': 2.496929622104702, 'degree': 4, 'shrinking': True}. Best is trial 23 with value: 0.098258965350867.
[I 2025-12-04 11:38:01,215] Trial 24 finished with value: 0.09771555381132105 and parameters: {'kernel': 'sigmoid', 'C': 2.951599532170581, 'degree': 5, 'shrinking': True}. Best is trial 23 with value: 0.098258965350867.
[I 2025-12-04 11:38:09,349] Trial 25 finished with value: 0.09781970806472114 and parameters: {'kernel': 'sigmoid', 'C': 0.6007214417814152, 'degree': 3, 'shrinking': True}. Best is trial 23 with value: 0.098258965350867.
[I 2025-12-04 11:38:14,634] Trial 26 finished with value: 0.050950767095769026 and parameters: {'kernel': 'poly', 'C': 7.796689698798051, 'degree': 4, 'shrinking': True}. Best is trial 23 with value: 0.098258965350867.
[I 2025-12-04 11:38:18,545] Trial 27 finished with value: 0.05145330340498376 and parameters: {'kernel': 'linear', 'C': 3.5891305727210123, 'degree': 4, 'shrinking': True}. Best is trial 23 with value: 0.098258965350867.
[I 2025-12-04 11:38:25,439] Trial 28 finished with value: 0.04945639731157377 and parameters: {'kernel': 'rbf', 'C': 0.8210096424182655, 'degree': 5, 'shrinking': True, 'gamma': 'auto'}. Best is trial 23 with value: 0.098258965350867.
[I 2025-12-04 11:38:30,629] Trial 29 finished with value: 0.053814659267728625 and parameters: {'kernel': 'poly', 'C': 1.9760696494833137, 'degree': 3, 'shrinking': True}. Best is trial 23 with value: 0.098258965350867.
[I 2025-12-04 11:38:34,022] A new study created in memory with name: svc_fold_5
[I 2025-12-04 11:38:37,861] Trial 0 finished with value: 0.053681095398561675 and parameters: {'kernel': 'linear', 'C': 0.43955168130413474, 'degree': 6, 'shrinking': False}. Best is trial 0 with value: 0.053681095398561675.
[I 2025-12-04 11:38:43,265] Trial 1 finished with value: 0.049839957428824994 and parameters: {'kernel': 'poly', 'C': 8.06150348690442, 'degree': 5, 'shrinking': True}. Best is trial 0 with value: 0.053681095398561675.
[I 2025-12-04 11:38:47,257] Trial 2 finished with value: 0.06883807319551535 and parameters: {'kernel': 'linear', 'C': 25.121952688454847, 'degree': 2, 'shrinking': True}. Best is trial 2 with value: 0.06883807319551535.
[I 2025-12-04 11:38:52,780] Trial 3 finished with value: 0.051625688653372026 and parameters: {'kernel': 'poly', 'C': 1.633308196456225, 'degree': 5, 'shrinking': True}. Best is trial 2 with value: 0.06883807319551535.
[I 2025-12-04 11:39:00,528] Trial 4 finished with value: 0.06732014939338761 and parameters: {'kernel': 'rbf', 'C': 13.248210241719757, 'degree': 6, 'shrinking': True, 'gamma': 'auto'}. Best is trial 2 with value: 0.06883807319551535.
[I 2025-12-04 11:39:08,593] Trial 5 finished with value: 0.08447932459904335 and parameters: {'kernel': 'sigmoid', 'C': 43.8437073751208, 'degree': 6, 'shrinking': False}. Best is trial 5 with value: 0.08447932459904335.
[I 2025-12-04 11:39:16,980] Trial 6 finished with value: 0.08450984301400358 and parameters: {'kernel': 'sigmoid', 'C': 1.8213855371372374, 'degree': 5, 'shrinking': True}. Best is trial 6 with value: 0.08450984301400358.
[I 2025-12-04 11:39:22,221] Trial 7 finished with value: 0.059882292550847004 and parameters: {'kernel': 'poly', 'C': 62.368362708799545, 'degree': 6, 'shrinking': False}. Best is trial 6 with value: 0.08450984301400358.
[I 2025-12-04 11:39:26,266] Trial 8 finished with value: 0.0546279429835933 and parameters: {'kernel': 'linear', 'C': 1.5720779961295226, 'degree': 6, 'shrinking': True}. Best is trial 6 with value: 0.08450984301400358.
[I 2025-12-04 11:39:30,302] Trial 9 finished with value: 0.06390285739171575 and parameters: {'kernel': 'linear', 'C': 2.040790472231928, 'degree': 4, 'shrinking': False}. Best is trial 6 with value: 0.08450984301400358.
[I 2025-12-04 11:39:38,462] Trial 10 finished with value: 0.08392088036169976 and parameters: {'kernel': 'sigmoid', 'C': 0.13705218798198757, 'degree': 3, 'shrinking': True}. Best is trial 6 with value: 0.08450984301400358.
[I 2025-12-04 11:39:46,644] Trial 11 finished with value: 0.08406972954954071 and parameters: {'kernel': 'sigmoid', 'C': 5.194614259973035, 'degree': 5, 'shrinking': False}. Best is trial 6 with value: 0.08450984301400358.
[I 2025-12-04 11:39:54,681] Trial 12 finished with value: 0.08436200487774084 and parameters: {'kernel': 'sigmoid', 'C': 89.13970265884436, 'degree': 4, 'shrinking': False}. Best is trial 6 with value: 0.08450984301400358.
[I 2025-12-04 11:40:02,843] Trial 13 finished with value: 0.08432443470681952 and parameters: {'kernel': 'sigmoid', 'C': 0.4330749747491596, 'degree': 5, 'shrinking': False}. Best is trial 6 with value: 0.08450984301400358.
[I 2025-12-04 11:40:11,155] Trial 14 finished with value: 0.0844722905288862 and parameters: {'kernel': 'sigmoid', 'C': 20.24192955051827, 'degree': 5, 'shrinking': True}. Best is trial 6 with value: 0.08450984301400358.
[I 2025-12-04 11:40:17,888] Trial 15 finished with value: 0.04940418682994616 and parameters: {'kernel': 'rbf', 'C': 0.7774205688873803, 'degree': 3, 'shrinking': False, 'gamma': 'scale'}. Best is trial 6 with value: 0.08450984301400358.
[I 2025-12-04 11:40:25,882] Trial 16 finished with value: 0.08428000167924624 and parameters: {'kernel': 'sigmoid', 'C': 4.572012929990803, 'degree': 6, 'shrinking': False}. Best is trial 6 with value: 0.08450984301400358.
[I 2025-12-04 11:40:33,838] Trial 17 finished with value: 0.08453410628904481 and parameters: {'kernel': 'sigmoid', 'C': 46.49699517459186, 'degree': 4, 'shrinking': True}. Best is trial 17 with value: 0.08453410628904481.
[I 2025-12-04 11:40:41,901] Trial 18 finished with value: 0.08409432091791903 and parameters: {'kernel': 'sigmoid', 'C': 0.12656555581345538, 'degree': 3, 'shrinking': True}. Best is trial 17 with value: 0.08453410628904481.
[I 2025-12-04 11:40:49,477] Trial 19 finished with value: 0.05366146307246524 and parameters: {'kernel': 'rbf', 'C': 8.649116399472277, 'degree': 4, 'shrinking': True, 'gamma': 'scale'}. Best is trial 17 with value: 0.08453410628904481.
[I 2025-12-04 11:40:57,546] Trial 20 finished with value: 0.08457799881538801 and parameters: {'kernel': 'sigmoid', 'C': 0.6768685990167969, 'degree': 4, 'shrinking': True}. Best is trial 20 with value: 0.08457799881538801.
[I 2025-12-04 11:41:05,558] Trial 21 finished with value: 0.08457287105374271 and parameters: {'kernel': 'sigmoid', 'C': 0.6768496825081887, 'degree': 4, 'shrinking': True}. Best is trial 20 with value: 0.08457799881538801.
[I 2025-12-04 11:41:13,726] Trial 22 finished with value: 0.0839513791951397 and parameters: {'kernel': 'sigmoid', 'C': 0.28203409331965734, 'degree': 4, 'shrinking': True}. Best is trial 20 with value: 0.08457799881538801.
[I 2025-12-04 11:41:21,840] Trial 23 finished with value: 0.08425343932343868 and parameters: {'kernel': 'sigmoid', 'C': 0.7283400795855008, 'degree': 3, 'shrinking': True}. Best is trial 20 with value: 0.08457799881538801.
[I 2025-12-04 11:41:29,923] Trial 24 finished with value: 0.08427150278643891 and parameters: {'kernel': 'sigmoid', 'C': 0.8646215270824029, 'degree': 4, 'shrinking': True}. Best is trial 20 with value: 0.08457799881538801.
[I 2025-12-04 11:41:38,027] Trial 25 finished with value: 0.08415348136100823 and parameters: {'kernel': 'sigmoid', 'C': 0.24608980789298227, 'degree': 2, 'shrinking': True}. Best is trial 20 with value: 0.08457799881538801.
[I 2025-12-04 11:41:46,354] Trial 26 finished with value: 0.08413063386295234 and parameters: {'kernel': 'sigmoid', 'C': 3.8524642087189602, 'degree': 4, 'shrinking': True}. Best is trial 20 with value: 0.08457799881538801.
[I 2025-12-04 11:41:53,193] Trial 27 finished with value: 0.05349941007187242 and parameters: {'kernel': 'rbf', 'C': 1.0371947734698195, 'degree': 3, 'shrinking': True, 'gamma': 'auto'}. Best is trial 20 with value: 0.08457799881538801.
[I 2025-12-04 11:41:58,331] Trial 28 finished with value: 0.0523036760367499 and parameters: {'kernel': 'poly', 'C': 2.7130424072199824, 'degree': 4, 'shrinking': True}. Best is trial 20 with value: 0.08457799881538801.
