[I 2025-12-04 00:37:05,278] Trial 1 finished with value: 0.13922847149271408 and parameters: {'max_iter': 52, 'learning_rate': 0.255747221134583, 'max_depth': 3, 'min_samples_leaf': 37, 'l2_regularization': 0.27124293642564634}. Best is trial 1 with value: 0.13922847149271408.
[I 2025-12-04 00:37:07,490] Trial 2 finished with value: 0.11874739821540856 and parameters: {'max_iter': 198, 'learning_rate': 0.1625125132511325, 'max_depth': 8, 'min_samples_leaf': 21, 'l2_regularization': 0.46760764706218805}. Best is trial 1 with value: 0.13922847149271408.
[I 2025-12-04 00:37:09,371] Trial 3 finished with value: 0.11957347749449403 and parameters: {'max_iter': 184, 'learning_rate': 0.11181890856602912, 'max_depth': 11, 'min_samples_leaf': 41, 'l2_regularization': 0.37035853810754193}. Best is trial 1 with value: 0.13922847149271408.
[I 2025-12-04 00:37:10,072] Trial 4 finished with value: 0.1374027529515816 and parameters: {'max_iter': 158, 'learning_rate': 0.12353563333559671, 'max_depth': 3, 'min_samples_leaf': 43, 'l2_regularization': 0.10529595264302838}. Best is trial 1 with value: 0.13922847149271408.
[I 2025-12-04 00:37:11,735] Trial 5 finished with value: 0.11189017609984879 and parameters: {'max_iter': 189, 'learning_rate': 0.23708468193481133, 'max_depth': 7, 'min_samples_leaf': 48, 'l2_regularization': 0.16985762810705973}. Best is trial 1 with value: 0.13922847149271408.
[I 2025-12-04 00:37:12,475] Trial 6 finished with value: 0.11874773804487235 and parameters: {'max_iter': 66, 'learning_rate': 0.20931278489863148, 'max_depth': 6, 'min_samples_leaf': 22, 'l2_regularization': 0.48830586632554174}. Best is trial 1 with value: 0.13922847149271408.
[I 2025-12-04 00:37:13,816] Trial 7 finished with value: 0.1401620001163098 and parameters: {'max_iter': 167, 'learning_rate': 0.010219715016410048, 'max_depth': 5, 'min_samples_leaf': 36, 'l2_regularization': 0.7267483445330865}. Best is trial 7 with value: 0.1401620001163098.
[I 2025-12-04 00:37:15,716] Trial 8 finished with value: 0.11236448668984375 and parameters: {'max_iter': 185, 'learning_rate': 0.128472055619894, 'max_depth': 11, 'min_samples_leaf': 48, 'l2_regularization': 0.6084834131139807}. Best is trial 7 with value: 0.1401620001163098.
[I 2025-12-04 00:37:16,976] Trial 9 finished with value: 0.10746601041375241 and parameters: {'max_iter': 102, 'learning_rate': 0.2386351545737792, 'max_depth': 13, 'min_samples_leaf': 10, 'l2_regularization': 0.17833097930634123}. Best is trial 7 with value: 0.1401620001163098.
[I 2025-12-04 00:37:18,524] Trial 10 finished with value: 0.1402761426686159 and parameters: {'max_iter': 124, 'learning_rate': 0.01812669584041513, 'max_depth': 15, 'min_samples_leaf': 1, 'l2_regularization': 0.9568254162568741}. Best is trial 10 with value: 0.1402761426686159.
[I 2025-12-04 00:37:19,883] Trial 11 finished with value: 0.14308202977682766 and parameters: {'max_iter': 121, 'learning_rate': 0.023119381447666003, 'max_depth': 15, 'min_samples_leaf': 4, 'l2_regularization': 0.9735116522051368}. Best is trial 11 with value: 0.14308202977682766.
[I 2025-12-04 00:37:21,271] Trial 12 finished with value: 0.13200190793629313 and parameters: {'max_iter': 122, 'learning_rate': 0.07074318181038754, 'max_depth': 15, 'min_samples_leaf': 2, 'l2_regularization': 0.9899659076243656}. Best is trial 11 with value: 0.14308202977682766.
[I 2025-12-04 00:37:22,646] Trial 13 finished with value: 0.13890520715730326 and parameters: {'max_iter': 102, 'learning_rate': 0.06491565328872531, 'max_depth': 15, 'min_samples_leaf': 1, 'l2_regularization': 0.9952269484846765}. Best is trial 11 with value: 0.14308202977682766.
[I 2025-12-04 00:37:24,346] Trial 14 finished with value: 0.1322409402074325 and parameters: {'max_iter': 132, 'learning_rate': 0.06612643732313812, 'max_depth': 14, 'min_samples_leaf': 13, 'l2_regularization': 0.7899030494905407}. Best is trial 11 with value: 0.14308202977682766.
[I 2025-12-04 00:37:25,908] Trial 15 finished with value: 0.13737292425791278 and parameters: {'max_iter': 128, 'learning_rate': 0.016050120776653683, 'max_depth': 10, 'min_samples_leaf': 9, 'l2_regularization': 0.653521334268526}. Best is trial 11 with value: 0.14308202977682766.
[I 2025-12-04 00:37:27,065] Trial 16 finished with value: 0.14458225795320442 and parameters: {'max_iter': 98, 'learning_rate': 0.05274508418847781, 'max_depth': 13, 'min_samples_leaf': 15, 'l2_regularization': 0.8595887468879828}. Best is trial 16 with value: 0.14458225795320442.
[I 2025-12-04 00:37:28,104] Trial 17 finished with value: 0.11737715188232908 and parameters: {'max_iter': 84, 'learning_rate': 0.17237730279541774, 'max_depth': 13, 'min_samples_leaf': 16, 'l2_regularization': 0.8258253592348096}. Best is trial 16 with value: 0.14458225795320442.
[I 2025-12-04 00:37:29,466] Trial 18 finished with value: 0.11352497292992743 and parameters: {'max_iter': 103, 'learning_rate': 0.2928083299623887, 'max_depth': 9, 'min_samples_leaf': 30, 'l2_regularization': 0.6905272344957102}. Best is trial 16 with value: 0.14458225795320442.
[I 2025-12-04 00:37:30,641] Trial 19 finished with value: 0.12789981183880011 and parameters: {'max_iter': 83, 'learning_rate': 0.09457827494652765, 'max_depth': 13, 'min_samples_leaf': 7, 'l2_regularization': 0.8896034320472405}. Best is trial 16 with value: 0.14458225795320442.
[I 2025-12-04 00:37:32,126] Trial 20 finished with value: 0.12974659150376944 and parameters: {'max_iter': 140, 'learning_rate': 0.04484470054146067, 'max_depth': 12, 'min_samples_leaf': 27, 'l2_regularization': 0.7710634553219979}. Best is trial 16 with value: 0.14458225795320442.
[I 2025-12-04 00:37:33,495] Trial 21 finished with value: 0.14431714166328252 and parameters: {'max_iter': 112, 'learning_rate': 0.04202927797123974, 'max_depth': 15, 'min_samples_leaf': 5, 'l2_regularization': 0.9179595656774204}. Best is trial 16 with value: 0.14458225795320442.
[I 2025-12-04 00:37:34,916] Trial 22 finished with value: 0.1295828120406186 and parameters: {'max_iter': 112, 'learning_rate': 0.08976801337788481, 'max_depth': 14, 'min_samples_leaf': 17, 'l2_regularization': 0.8986692318607761}. Best is trial 16 with value: 0.14458225795320442.
[I 2025-12-04 00:37:35,919] Trial 23 finished with value: 0.14719650215537886 and parameters: {'max_iter': 75, 'learning_rate': 0.047316668424065636, 'max_depth': 14, 'min_samples_leaf': 5, 'l2_regularization': 0.9004257016094602}. Best is trial 23 with value: 0.14719650215537886.
[I 2025-12-04 00:37:36,970] Trial 24 finished with value: 0.14105053735754386 and parameters: {'max_iter': 81, 'learning_rate': 0.048089138820880804, 'max_depth': 14, 'min_samples_leaf': 6, 'l2_regularization': 0.5850919280112405}. Best is trial 23 with value: 0.14719650215537886.
[I 2025-12-04 00:37:37,949] Trial 25 finished with value: 0.12945483008680816 and parameters: {'max_iter': 74, 'learning_rate': 0.08982779928081994, 'max_depth': 12, 'min_samples_leaf': 13, 'l2_regularization': 0.8400363590881286}. Best is trial 23 with value: 0.14719650215537886.
[I 2025-12-04 00:37:39,186] Trial 26 finished with value: 0.12818398087386368 and parameters: {'max_iter': 93, 'learning_rate': 0.1379285959288939, 'max_depth': 10, 'min_samples_leaf': 12, 'l2_regularization': 0.752326138637174}. Best is trial 23 with value: 0.14719650215537886.
[I 2025-12-04 00:37:40,020] Trial 27 finished with value: 0.13652696429535213 and parameters: {'max_iter': 57, 'learning_rate': 0.05854616855053698, 'max_depth': 14, 'min_samples_leaf': 18, 'l2_regularization': 0.8989341779934745}. Best is trial 23 with value: 0.14719650215537886.
[I 2025-12-04 00:37:40,903] Trial 28 finished with value: 0.1332759375120734 and parameters: {'max_iter': 67, 'learning_rate': 0.0828959292534896, 'max_depth': 13, 'min_samples_leaf': 6, 'l2_regularization': 0.5411590138502432}. Best is trial 23 with value: 0.14719650215537886.
[I 2025-12-04 00:37:41,996] Trial 29 finished with value: 0.13912103130116218 and parameters: {'max_iter': 91, 'learning_rate': 0.03866021681741453, 'max_depth': 12, 'min_samples_leaf': 10, 'l2_regularization': 0.8488407686971873}. Best is trial 23 with value: 0.14719650215537886.
[I 2025-12-04 00:37:42,628] A new study created in memory with name: histogram_gradient_boosting_fold_3
[I 2025-12-04 00:37:44,326] Trial 0 finished with value: 0.13487794280625773 and parameters: {'max_iter': 179, 'learning_rate': 0.07352758023070503, 'max_depth': 11, 'min_samples_leaf': 33, 'l2_regularization': 0.19485713196384213}. Best is trial 0 with value: 0.13487794280625773.
[I 2025-12-04 00:37:45,301] Trial 1 finished with value: 0.14627614558344465 and parameters: {'max_iter': 139, 'learning_rate': 0.05779360919156752, 'max_depth': 5, 'min_samples_leaf': 36, 'l2_regularization': 0.30420680624449825}. Best is trial 1 with value: 0.14627614558344465.
[I 2025-12-04 00:37:46,307] Trial 2 finished with value: 0.11592095265618348 and parameters: {'max_iter': 73, 'learning_rate': 0.24007410392967352, 'max_depth': 11, 'min_samples_leaf': 24, 'l2_regularization': 0.7491053254894292}. Best is trial 1 with value: 0.14627614558344465.
[I 2025-12-04 00:37:47,408] Trial 3 finished with value: 0.14196479168690582 and parameters: {'max_iter': 152, 'learning_rate': 0.016656729838677088, 'max_depth': 5, 'min_samples_leaf': 42, 'l2_regularization': 0.3653480105187058}. Best is trial 1 with value: 0.14627614558344465.
[I 2025-12-04 00:37:49,068] Trial 4 finished with value: 0.09398452232834034 and parameters: {'max_iter': 131, 'learning_rate': 0.2914168385535904, 'max_depth': 7, 'min_samples_leaf': 2, 'l2_regularization': 0.8047942057084907}. Best is trial 1 with value: 0.14627614558344465.
[I 2025-12-04 00:37:50,368] Trial 5 finished with value: 0.09867875299743543 and parameters: {'max_iter': 95, 'learning_rate': 0.2782970268119788, 'max_depth': 15, 'min_samples_leaf': 20, 'l2_regularization': 0.8338195518558584}. Best is trial 1 with value: 0.14627614558344465.
[I 2025-12-04 00:37:52,516] Trial 6 finished with value: 0.10447926815904414 and parameters: {'max_iter': 197, 'learning_rate': 0.26046116115313395, 'max_depth': 7, 'min_samples_leaf': 15, 'l2_regularization': 0.5427177401536362}. Best is trial 1 with value: 0.14627614558344465.
[I 2025-12-04 00:37:53,855] Trial 7 finished with value: 0.10694964339308069 and parameters: {'max_iter': 98, 'learning_rate': 0.19658477319489734, 'max_depth': 9, 'min_samples_leaf': 44, 'l2_regularization': 0.7522384276248454}. Best is trial 1 with value: 0.14627614558344465.
[I 2025-12-04 00:37:55,966] Trial 8 finished with value: 0.10488592452257572 and parameters: {'max_iter': 185, 'learning_rate': 0.22697993718278356, 'max_depth': 15, 'min_samples_leaf': 17, 'l2_regularization': 0.32703041169834257}. Best is trial 1 with value: 0.14627614558344465.
[I 2025-12-04 00:37:57,665] Trial 9 finished with value: 0.14807980149324892 and parameters: {'max_iter': 153, 'learning_rate': 0.02169308141351367, 'max_depth': 13, 'min_samples_leaf': 22, 'l2_regularization': 0.47868276725397285}. Best is trial 9 with value: 0.14807980149324892.
[I 2025-12-04 00:37:59,484] Trial 10 finished with value: 0.11367379887398862 and parameters: {'max_iter': 160, 'learning_rate': 0.14393495296726735, 'max_depth': 12, 'min_samples_leaf': 7, 'l2_regularization': 0.0242331836885345}. Best is trial 9 with value: 0.14807980149324892.
[I 2025-12-04 00:38:00,086] Trial 11 finished with value: 0.14963633954617445 and parameters: {'max_iter': 131, 'learning_rate': 0.02037257527741236, 'max_depth': 3, 'min_samples_leaf': 33, 'l2_regularization': 0.5553136341305556}. Best is trial 11 with value: 0.14963633954617445.
[I 2025-12-04 00:38:00,653] Trial 12 finished with value: 0.14892293590730804 and parameters: {'max_iter': 115, 'learning_rate': 0.01427433969049596, 'max_depth': 3, 'min_samples_leaf': 30, 'l2_regularization': 0.5929891743828467}. Best is trial 11 with value: 0.14963633954617445.
[I 2025-12-04 00:38:01,204] Trial 13 finished with value: 0.15037614165006158 and parameters: {'max_iter': 114, 'learning_rate': 0.11228182645976002, 'max_depth': 3, 'min_samples_leaf': 30, 'l2_regularization': 0.5976941558074592}. Best is trial 13 with value: 0.15037614165006158.
[I 2025-12-04 00:38:01,682] Trial 14 finished with value: 0.14601844400949135 and parameters: {'max_iter': 64, 'learning_rate': 0.12274879997219539, 'max_depth': 3, 'min_samples_leaf': 39, 'l2_regularization': 0.6687158495992422}. Best is trial 13 with value: 0.15037614165006158.
[I 2025-12-04 00:38:02,543] Trial 15 finished with value: 0.1334305199115084 and parameters: {'max_iter': 111, 'learning_rate': 0.09292411190181735, 'max_depth': 5, 'min_samples_leaf': 50, 'l2_regularization': 0.9521784184891217}. Best is trial 13 with value: 0.15037614165006158.
[I 2025-12-04 00:38:03,041] Trial 16 finished with value: 0.13976029451687672 and parameters: {'max_iter': 88, 'learning_rate': 0.19083920547856642, 'max_depth': 3, 'min_samples_leaf': 27, 'l2_regularization': 0.45365876756610696}. Best is trial 13 with value: 0.15037614165006158.
[I 2025-12-04 00:38:04,229] Trial 17 finished with value: 0.1260911405080912 and parameters: {'max_iter': 121, 'learning_rate': 0.10798071149541737, 'max_depth': 7, 'min_samples_leaf': 33, 'l2_regularization': 0.6117239663129245}. Best is trial 13 with value: 0.15037614165006158.
[I 2025-12-04 00:38:05,454] Trial 18 finished with value: 0.11533230666829739 and parameters: {'max_iter': 142, 'learning_rate': 0.17443530631128243, 'max_depth': 5, 'min_samples_leaf': 11, 'l2_regularization': 0.9592789208644467}. Best is trial 13 with value: 0.15037614165006158.
[I 2025-12-04 00:38:06,183] Trial 19 finished with value: 0.1425834050942026 and parameters: {'max_iter': 53, 'learning_rate': 0.05279122793956033, 'max_depth': 8, 'min_samples_leaf': 28, 'l2_regularization': 0.4073017223649287}. Best is trial 13 with value: 0.15037614165006158.
[I 2025-12-04 00:38:06,866] Trial 20 finished with value: 0.14936783648613836 and parameters: {'max_iter': 106, 'learning_rate': 0.04358939940572387, 'max_depth': 4, 'min_samples_leaf': 48, 'l2_regularization': 0.2254855838303611}. Best is trial 13 with value: 0.15037614165006158.
[I 2025-12-04 00:38:07,469] Trial 21 finished with value: 0.1515581158000388 and parameters: {'max_iter': 106, 'learning_rate': 0.04496517421121274, 'max_depth': 4, 'min_samples_leaf': 50, 'l2_regularization': 0.1932322576956057}. Best is trial 21 with value: 0.1515581158000388.
[I 2025-12-04 00:38:08,094] Trial 22 finished with value: 0.14510167064728785 and parameters: {'max_iter': 89, 'learning_rate': 0.08440494379310297, 'max_depth': 4, 'min_samples_leaf': 44, 'l2_regularization': 0.019443004601638336}. Best is trial 21 with value: 0.1515581158000388.
[I 2025-12-04 00:38:09,313] Trial 23 finished with value: 0.13626492157347775 and parameters: {'max_iter': 128, 'learning_rate': 0.04436444261846032, 'max_depth': 6, 'min_samples_leaf': 38, 'l2_regularization': 0.1369705221263885}. Best is trial 21 with value: 0.1515581158000388.
[I 2025-12-04 00:38:09,892] Trial 24 finished with value: 0.13698552605783088 and parameters: {'max_iter': 79, 'learning_rate': 0.13206205874570326, 'max_depth': 4, 'min_samples_leaf': 33, 'l2_regularization': 0.5269829720191911}. Best is trial 21 with value: 0.1515581158000388.
[I 2025-12-04 00:38:10,479] Trial 25 finished with value: 0.14993198574095423 and parameters: {'max_iter': 105, 'learning_rate': 0.0720502646182803, 'max_depth': 3, 'min_samples_leaf': 46, 'l2_regularization': 0.6805353269389657}. Best is trial 21 with value: 0.1515581158000388.
[I 2025-12-04 00:38:11,490] Trial 26 finished with value: 0.12428825712523592 and parameters: {'max_iter': 104, 'learning_rate': 0.10463413216812416, 'max_depth': 6, 'min_samples_leaf': 47, 'l2_regularization': 0.6521555387841651}. Best is trial 21 with value: 0.1515581158000388.
[I 2025-12-04 00:38:12,358] Trial 27 finished with value: 0.13317099672364566 and parameters: {'max_iter': 80, 'learning_rate': 0.07677918971736822, 'max_depth': 9, 'min_samples_leaf': 40, 'l2_regularization': 0.6888772671017218}. Best is trial 21 with value: 0.1515581158000388.
[I 2025-12-04 00:38:12,996] Trial 28 finished with value: 0.13815309166141349 and parameters: {'max_iter': 117, 'learning_rate': 0.11450059034533733, 'max_depth': 4, 'min_samples_leaf': 50, 'l2_regularization': 0.862271102560527}. Best is trial 21 with value: 0.1515581158000388.
[I 2025-12-04 00:38:14,272] Trial 29 finished with value: 0.1164578155414201 and parameters: {'max_iter': 167, 'learning_rate': 0.15714688074914723, 'max_depth': 6, 'min_samples_leaf': 45, 'l2_regularization': 0.1739101002144508}. Best is trial 21 with value: 0.1515581158000388.
[I 2025-12-04 00:38:14,925] A new study created in memory with name: histogram_gradient_boosting_fold_4
[I 2025-12-04 00:38:16,820] Trial 0 finished with value: 0.15950933099842918 and parameters: {'max_iter': 195, 'learning_rate': 0.042684531864038436, 'max_depth': 13, 'min_samples_leaf': 47, 'l2_regularization': 0.292062135029878}. Best is trial 0 with value: 0.15950933099842918.
[I 2025-12-04 00:38:17,719] Trial 1 finished with value: 0.13953251405748401 and parameters: {'max_iter': 79, 'learning_rate': 0.1705691908462161, 'max_depth': 14, 'min_samples_leaf': 40, 'l2_regularization': 0.003453066503328106}. Best is trial 0 with value: 0.15950933099842918.
[I 2025-12-04 00:38:18,375] Trial 2 finished with value: 0.15514705189578626 and parameters: {'max_iter': 61, 'learning_rate': 0.13903481640651374, 'max_depth': 6, 'min_samples_leaf': 22, 'l2_regularization': 0.6553216423148416}. Best is trial 0 with value: 0.15950933099842918.
[I 2025-12-04 00:38:19,044] Trial 3 finished with value: 0.1397096891210592 and parameters: {'max_iter': 52, 'learning_rate': 0.1326543698135329, 'max_depth': 9, 'min_samples_leaf': 18, 'l2_regularization': 0.11208578139304903}. Best is trial 0 with value: 0.15950933099842918.
[I 2025-12-04 00:38:20,309] Trial 4 finished with value: 0.13084756969322126 and parameters: {'max_iter': 110, 'learning_rate': 0.23629369213266838, 'max_depth': 11, 'min_samples_leaf': 50, 'l2_regularization': 0.6788046846547227}. Best is trial 0 with value: 0.15950933099842918.
[I 2025-12-04 00:38:21,818] Trial 5 finished with value: 0.13136605870672735 and parameters: {'max_iter': 112, 'learning_rate': 0.2472701796271827, 'max_depth': 12, 'min_samples_leaf': 16, 'l2_regularization': 0.4611364244266275}. Best is trial 0 with value: 0.15950933099842918.
[I 2025-12-04 00:38:22,811] Trial 6 finished with value: 0.13348638867815873 and parameters: {'max_iter': 185, 'learning_rate': 0.21349816756954249, 'max_depth': 4, 'min_samples_leaf': 32, 'l2_regularization': 0.05738696366335083}. Best is trial 0 with value: 0.15950933099842918.
[I 2025-12-04 00:38:24,796] Trial 7 finished with value: 0.13787408163073403 and parameters: {'max_iter': 196, 'learning_rate': 0.2997928656552881, 'max_depth': 11, 'min_samples_leaf': 48, 'l2_regularization': 0.7311205248342151}. Best is trial 0 with value: 0.15950933099842918.
[I 2025-12-04 00:38:26,313] Trial 8 finished with value: 0.1405981755606812 and parameters: {'max_iter': 151, 'learning_rate': 0.20736362585162998, 'max_depth': 15, 'min_samples_leaf': 37, 'l2_regularization': 0.8300418414123071}. Best is trial 0 with value: 0.15950933099842918.
[I 2025-12-04 00:38:27,124] Trial 9 finished with value: 0.12724156663699268 and parameters: {'max_iter': 51, 'learning_rate': 0.26613200910253226, 'max_depth': 13, 'min_samples_leaf': 16, 'l2_regularization': 0.33973661377180164}. Best is trial 0 with value: 0.15950933099842918.
[I 2025-12-04 00:38:28,934] Trial 10 finished with value: 0.16769409475524372 and parameters: {'max_iter': 157, 'learning_rate': 0.018449419977038944, 'max_depth': 8, 'min_samples_leaf': 1, 'l2_regularization': 0.9836542288840521}. Best is trial 10 with value: 0.16769409475524372.
[I 2025-12-04 00:38:30,743] Trial 11 finished with value: 0.16669108914864075 and parameters: {'max_iter': 159, 'learning_rate': 0.01158957826788435, 'max_depth': 8, 'min_samples_leaf': 3, 'l2_regularization': 0.29021184644936565}. Best is trial 10 with value: 0.16769409475524372.
[I 2025-12-04 00:38:32,521] Trial 12 finished with value: 0.16819143224970193 and parameters: {'max_iter': 155, 'learning_rate': 0.012260667191277191, 'max_depth': 8, 'min_samples_leaf': 1, 'l2_regularization': 0.988417634210846}. Best is trial 12 with value: 0.16819143224970193.
[I 2025-12-04 00:38:34,407] Trial 13 finished with value: 0.1521504964921676 and parameters: {'max_iter': 147, 'learning_rate': 0.07445247216585853, 'max_depth': 7, 'min_samples_leaf': 1, 'l2_regularization': 0.9621619765582861}. Best is trial 12 with value: 0.16819143224970193.
[I 2025-12-04 00:38:35,084] Trial 14 finished with value: 0.1687263453731813 and parameters: {'max_iter': 169, 'learning_rate': 0.07961184185468123, 'max_depth': 3, 'min_samples_leaf': 8, 'l2_regularization': 0.9750018739707248}. Best is trial 14 with value: 0.1687263453731813.
[I 2025-12-04 00:38:35,855] Trial 15 finished with value: 0.1651145542784263 and parameters: {'max_iter': 175, 'learning_rate': 0.08799924312131177, 'max_depth': 3, 'min_samples_leaf': 9, 'l2_regularization': 0.8383547831743772}. Best is trial 14 with value: 0.1687263453731813.
[I 2025-12-04 00:38:36,908] Trial 16 finished with value: 0.15338245784068785 and parameters: {'max_iter': 131, 'learning_rate': 0.08545790093903403, 'max_depth': 5, 'min_samples_leaf': 9, 'l2_regularization': 0.8684832101739688}. Best is trial 14 with value: 0.1687263453731813.
[I 2025-12-04 00:38:37,664] Trial 17 finished with value: 0.1757305020475313 and parameters: {'max_iter': 176, 'learning_rate': 0.05379371449337969, 'max_depth': 3, 'min_samples_leaf': 9, 'l2_regularization': 0.5655340983568862}. Best is trial 17 with value: 0.1757305020475313.
