[I 2025-12-03 22:02:38,293] Trial 29 finished with value: 0.08904846297055254 and parameters: {'max_depth': 11, 'min_samples_split': 18, 'min_samples_leaf': 5, 'criterion': 'gini', 'max_features': None, 'splitter': 'best'}. Best is trial 22 with value: 0.11742462694885988.
[I 2025-12-03 22:02:38,818] A new study created in memory with name: decision_tree_fold_2
[I 2025-12-03 22:02:38,861] Trial 0 finished with value: 0.08101938812690421 and parameters: {'max_depth': 5, 'min_samples_split': 3, 'min_samples_leaf': 9, 'criterion': 'entropy', 'max_features': 'log2', 'splitter': 'random'}. Best is trial 0 with value: 0.08101938812690421.
[I 2025-12-03 22:02:39,198] Trial 1 finished with value: 0.07531812830735085 and parameters: {'max_depth': 31, 'min_samples_split': 16, 'min_samples_leaf': 9, 'criterion': 'entropy', 'max_features': 'sqrt', 'splitter': 'best'}. Best is trial 0 with value: 0.08101938812690421.
[I 2025-12-03 22:02:39,334] Trial 2 finished with value: 0.08541395349511229 and parameters: {'max_depth': 21, 'min_samples_split': 8, 'min_samples_leaf': 7, 'criterion': 'entropy', 'max_features': 'sqrt', 'splitter': 'random'}. Best is trial 2 with value: 0.08541395349511229.
[I 2025-12-03 22:02:40,573] Trial 3 finished with value: 0.0941943419639664 and parameters: {'max_depth': 9, 'min_samples_split': 6, 'min_samples_leaf': 13, 'criterion': 'entropy', 'max_features': None, 'splitter': 'best'}. Best is trial 3 with value: 0.0941943419639664.
[I 2025-12-03 22:02:41,736] Trial 4 finished with value: 0.09401544026374843 and parameters: {'max_depth': 10, 'min_samples_split': 3, 'min_samples_leaf': 18, 'criterion': 'gini', 'max_features': None, 'splitter': 'best'}. Best is trial 3 with value: 0.0941943419639664.
[I 2025-12-03 22:02:41,865] Trial 5 finished with value: 0.0810085198732163 and parameters: {'max_depth': 31, 'min_samples_split': 5, 'min_samples_leaf': 14, 'criterion': 'log_loss', 'max_features': 'log2', 'splitter': 'random'}. Best is trial 3 with value: 0.0941943419639664.
[I 2025-12-03 22:02:42,000] Trial 6 finished with value: 0.07577841924741946 and parameters: {'max_depth': 23, 'min_samples_split': 6, 'min_samples_leaf': 7, 'criterion': 'gini', 'max_features': 'sqrt', 'splitter': 'random'}. Best is trial 3 with value: 0.0941943419639664.
[I 2025-12-03 22:02:43,160] Trial 7 finished with value: 0.10033934842798642 and parameters: {'max_depth': 8, 'min_samples_split': 9, 'min_samples_leaf': 8, 'criterion': 'entropy', 'max_features': None, 'splitter': 'best'}. Best is trial 7 with value: 0.10033934842798642.
[I 2025-12-03 22:02:43,402] Trial 8 finished with value: 0.09026601913495565 and parameters: {'max_depth': 14, 'min_samples_split': 10, 'min_samples_leaf': 20, 'criterion': 'gini', 'max_features': 'log2', 'splitter': 'best'}. Best is trial 7 with value: 0.10033934842798642.
[I 2025-12-03 22:02:43,530] Trial 9 finished with value: 0.08929685607514337 and parameters: {'max_depth': 30, 'min_samples_split': 2, 'min_samples_leaf': 14, 'criterion': 'log_loss', 'max_features': 'log2', 'splitter': 'random'}. Best is trial 7 with value: 0.10033934842798642.
[I 2025-12-03 22:02:43,957] Trial 10 finished with value: 0.08659399479914537 and parameters: {'max_depth': 2, 'min_samples_split': 14, 'min_samples_leaf': 1, 'criterion': 'entropy', 'max_features': None, 'splitter': 'best'}. Best is trial 7 with value: 0.10033934842798642.
[I 2025-12-03 22:02:45,218] Trial 11 finished with value: 0.09697045915150447 and parameters: {'max_depth': 9, 'min_samples_split': 12, 'min_samples_leaf': 3, 'criterion': 'entropy', 'max_features': None, 'splitter': 'best'}. Best is trial 7 with value: 0.10033934842798642.
[I 2025-12-03 22:02:46,777] Trial 12 finished with value: 0.08001873985635292 and parameters: {'max_depth': 14, 'min_samples_split': 20, 'min_samples_leaf': 2, 'criterion': 'entropy', 'max_features': None, 'splitter': 'best'}. Best is trial 7 with value: 0.10033934842798642.
[I 2025-12-03 22:02:47,944] Trial 13 finished with value: 0.10116771891431564 and parameters: {'max_depth': 8, 'min_samples_split': 13, 'min_samples_leaf': 4, 'criterion': 'entropy', 'max_features': None, 'splitter': 'best'}. Best is trial 13 with value: 0.10116771891431564.
[I 2025-12-03 22:02:48,655] Trial 14 finished with value: 0.098627265354515 and parameters: {'max_depth': 4, 'min_samples_split': 17, 'min_samples_leaf': 4, 'criterion': 'log_loss', 'max_features': None, 'splitter': 'best'}. Best is trial 13 with value: 0.10116771891431564.
[I 2025-12-03 22:02:50,292] Trial 15 finished with value: 0.07301019098876294 and parameters: {'max_depth': 18, 'min_samples_split': 10, 'min_samples_leaf': 6, 'criterion': 'entropy', 'max_features': None, 'splitter': 'best'}. Best is trial 13 with value: 0.10116771891431564.
[I 2025-12-03 22:02:51,350] Trial 16 finished with value: 0.10517972922002121 and parameters: {'max_depth': 7, 'min_samples_split': 13, 'min_samples_leaf': 11, 'criterion': 'entropy', 'max_features': None, 'splitter': 'best'}. Best is trial 16 with value: 0.10517972922002121.
[I 2025-12-03 22:02:52,819] Trial 17 finished with value: 0.08036816404658083 and parameters: {'max_depth': 13, 'min_samples_split': 13, 'min_samples_leaf': 12, 'criterion': 'entropy', 'max_features': None, 'splitter': 'best'}. Best is trial 16 with value: 0.10517972922002121.
[I 2025-12-03 22:02:53,768] Trial 18 finished with value: 0.10500101846095973 and parameters: {'max_depth': 6, 'min_samples_split': 15, 'min_samples_leaf': 16, 'criterion': 'log_loss', 'max_features': None, 'splitter': 'best'}. Best is trial 16 with value: 0.10517972922002121.
[I 2025-12-03 22:02:53,927] Trial 19 finished with value: 0.07809990245803818 and parameters: {'max_depth': 2, 'min_samples_split': 16, 'min_samples_leaf': 18, 'criterion': 'log_loss', 'max_features': 'sqrt', 'splitter': 'best'}. Best is trial 16 with value: 0.10517972922002121.
[I 2025-12-03 22:02:54,760] Trial 20 finished with value: 0.10452367991128819 and parameters: {'max_depth': 5, 'min_samples_split': 19, 'min_samples_leaf': 16, 'criterion': 'log_loss', 'max_features': None, 'splitter': 'best'}. Best is trial 16 with value: 0.10517972922002121.
[I 2025-12-03 22:02:55,594] Trial 21 finished with value: 0.10442937381368571 and parameters: {'max_depth': 5, 'min_samples_split': 20, 'min_samples_leaf': 16, 'criterion': 'log_loss', 'max_features': None, 'splitter': 'best'}. Best is trial 16 with value: 0.10517972922002121.
[I 2025-12-03 22:02:56,553] Trial 22 finished with value: 0.10553184534686247 and parameters: {'max_depth': 6, 'min_samples_split': 18, 'min_samples_leaf': 11, 'criterion': 'log_loss', 'max_features': None, 'splitter': 'best'}. Best is trial 22 with value: 0.10553184534686247.
[I 2025-12-03 22:02:58,026] Trial 23 finished with value: 0.08829808015294245 and parameters: {'max_depth': 13, 'min_samples_split': 15, 'min_samples_leaf': 11, 'criterion': 'log_loss', 'max_features': None, 'splitter': 'best'}. Best is trial 22 with value: 0.10553184534686247.
[I 2025-12-03 22:02:59,439] Trial 24 finished with value: 0.09258330763437042 and parameters: {'max_depth': 11, 'min_samples_split': 18, 'min_samples_leaf': 10, 'criterion': 'log_loss', 'max_features': None, 'splitter': 'best'}. Best is trial 22 with value: 0.10553184534686247.
[I 2025-12-03 22:03:00,563] Trial 25 finished with value: 0.10605465535172354 and parameters: {'max_depth': 7, 'min_samples_split': 18, 'min_samples_leaf': 16, 'criterion': 'log_loss', 'max_features': None, 'splitter': 'best'}. Best is trial 25 with value: 0.10605465535172354.
[I 2025-12-03 22:03:00,762] Trial 26 finished with value: 0.07696687714856351 and parameters: {'max_depth': 16, 'min_samples_split': 18, 'min_samples_leaf': 11, 'criterion': 'log_loss', 'max_features': None, 'splitter': 'random'}. Best is trial 25 with value: 0.10605465535172354.
[I 2025-12-03 22:03:01,797] Trial 27 finished with value: 0.10125276040835254 and parameters: {'max_depth': 7, 'min_samples_split': 18, 'min_samples_leaf': 14, 'criterion': 'gini', 'max_features': None, 'splitter': 'best'}. Best is trial 25 with value: 0.10605465535172354.
[I 2025-12-03 22:03:02,072] Trial 28 finished with value: 0.07280146559205278 and parameters: {'max_depth': 18, 'min_samples_split': 12, 'min_samples_leaf': 12, 'criterion': 'log_loss', 'max_features': 'log2', 'splitter': 'best'}. Best is trial 25 with value: 0.10605465535172354.
[I 2025-12-03 22:03:02,203] Trial 29 finished with value: 0.08532477699549937 and parameters: {'max_depth': 11, 'min_samples_split': 16, 'min_samples_leaf': 9, 'criterion': 'log_loss', 'max_features': 'sqrt', 'splitter': 'random'}. Best is trial 25 with value: 0.10605465535172354.
[I 2025-12-03 22:03:02,979] A new study created in memory with name: decision_tree_fold_3
[I 2025-12-03 22:03:03,182] Trial 0 finished with value: 0.08484162127023753 and parameters: {'max_depth': 21, 'min_samples_split': 2, 'min_samples_leaf': 20, 'criterion': 'gini', 'max_features': 'sqrt', 'splitter': 'best'}. Best is trial 0 with value: 0.08484162127023753.
[I 2025-12-03 22:03:03,319] Trial 1 finished with value: 0.07719243150231848 and parameters: {'max_depth': 18, 'min_samples_split': 8, 'min_samples_leaf': 1, 'criterion': 'gini', 'max_features': 'sqrt', 'splitter': 'random'}. Best is trial 0 with value: 0.08484162127023753.
[I 2025-12-03 22:03:03,439] Trial 2 finished with value: 0.06773571648325434 and parameters: {'max_depth': 2, 'min_samples_split': 19, 'min_samples_leaf': 1, 'criterion': 'gini', 'max_features': 'sqrt', 'splitter': 'random'}. Best is trial 0 with value: 0.08484162127023753.
[I 2025-12-03 22:03:03,784] Trial 3 finished with value: 0.07053662000624965 and parameters: {'max_depth': 23, 'min_samples_split': 18, 'min_samples_leaf': 6, 'criterion': 'entropy', 'max_features': 'sqrt', 'splitter': 'best'}. Best is trial 0 with value: 0.08484162127023753.
[I 2025-12-03 22:03:04,089] Trial 4 finished with value: 0.06681796797858858 and parameters: {'max_depth': 28, 'min_samples_split': 11, 'min_samples_leaf': 12, 'criterion': 'gini', 'max_features': 'sqrt', 'splitter': 'best'}. Best is trial 0 with value: 0.08484162127023753.
[I 2025-12-03 22:03:04,415] Trial 5 finished with value: 0.08766160275420944 and parameters: {'max_depth': 17, 'min_samples_split': 8, 'min_samples_leaf': 13, 'criterion': 'entropy', 'max_features': 'sqrt', 'splitter': 'best'}. Best is trial 5 with value: 0.08766160275420944.
[I 2025-12-03 22:03:04,536] Trial 6 finished with value: 0.06439305605746617 and parameters: {'max_depth': 2, 'min_samples_split': 5, 'min_samples_leaf': 18, 'criterion': 'gini', 'max_features': 'sqrt', 'splitter': 'random'}. Best is trial 5 with value: 0.08766160275420944.
[I 2025-12-03 22:03:04,665] Trial 7 finished with value: 0.08756375314047724 and parameters: {'max_depth': 28, 'min_samples_split': 16, 'min_samples_leaf': 18, 'criterion': 'log_loss', 'max_features': 'log2', 'splitter': 'random'}. Best is trial 5 with value: 0.08766160275420944.
[I 2025-12-03 22:03:04,790] Trial 8 finished with value: 0.09030714556113223 and parameters: {'max_depth': 7, 'min_samples_split': 9, 'min_samples_leaf': 15, 'criterion': 'gini', 'max_features': 'sqrt', 'splitter': 'random'}. Best is trial 8 with value: 0.09030714556113223.
[I 2025-12-03 22:03:04,921] Trial 9 finished with value: 0.08442235190582975 and parameters: {'max_depth': 27, 'min_samples_split': 20, 'min_samples_leaf': 14, 'criterion': 'gini', 'max_features': 'sqrt', 'splitter': 'random'}. Best is trial 8 with value: 0.09030714556113223.
[I 2025-12-03 22:03:05,101] Trial 10 finished with value: 0.09781424501779781 and parameters: {'max_depth': 10, 'min_samples_split': 13, 'min_samples_leaf': 7, 'criterion': 'log_loss', 'max_features': None, 'splitter': 'random'}. Best is trial 10 with value: 0.09781424501779781.
[I 2025-12-03 22:03:05,276] Trial 11 finished with value: 0.08863568782089166 and parameters: {'max_depth': 9, 'min_samples_split': 14, 'min_samples_leaf': 8, 'criterion': 'log_loss', 'max_features': None, 'splitter': 'random'}. Best is trial 10 with value: 0.09781424501779781.
[I 2025-12-03 22:03:05,456] Trial 12 finished with value: 0.10121264253248204 and parameters: {'max_depth': 10, 'min_samples_split': 12, 'min_samples_leaf': 7, 'criterion': 'log_loss', 'max_features': None, 'splitter': 'random'}. Best is trial 12 with value: 0.10121264253248204.
[I 2025-12-03 22:03:05,644] Trial 13 finished with value: 0.08703511178734888 and parameters: {'max_depth': 12, 'min_samples_split': 13, 'min_samples_leaf': 6, 'criterion': 'log_loss', 'max_features': None, 'splitter': 'random'}. Best is trial 12 with value: 0.10121264253248204.
[I 2025-12-03 22:03:05,831] Trial 14 finished with value: 0.08871350121903457 and parameters: {'max_depth': 12, 'min_samples_split': 13, 'min_samples_leaf': 9, 'criterion': 'log_loss', 'max_features': None, 'splitter': 'random'}. Best is trial 12 with value: 0.10121264253248204.
[I 2025-12-03 22:03:05,993] Trial 15 finished with value: 0.0985680284157968 and parameters: {'max_depth': 7, 'min_samples_split': 11, 'min_samples_leaf': 5, 'criterion': 'log_loss', 'max_features': None, 'splitter': 'random'}. Best is trial 12 with value: 0.10121264253248204.
[I 2025-12-03 22:03:06,153] Trial 16 finished with value: 0.10404417056131268 and parameters: {'max_depth': 6, 'min_samples_split': 10, 'min_samples_leaf': 4, 'criterion': 'log_loss', 'max_features': None, 'splitter': 'random'}. Best is trial 16 with value: 0.10404417056131268.
[I 2025-12-03 22:03:06,283] Trial 17 finished with value: 0.08017102663018635 and parameters: {'max_depth': 14, 'min_samples_split': 5, 'min_samples_leaf': 3, 'criterion': 'log_loss', 'max_features': 'log2', 'splitter': 'random'}. Best is trial 16 with value: 0.10404417056131268.
[I 2025-12-03 22:03:07,130] Trial 18 finished with value: 0.09368719996671349 and parameters: {'max_depth': 5, 'min_samples_split': 15, 'min_samples_leaf': 10, 'criterion': 'log_loss', 'max_features': None, 'splitter': 'best'}. Best is trial 16 with value: 0.10404417056131268.
[I 2025-12-03 22:03:07,327] Trial 19 finished with value: 0.07877886505787597 and parameters: {'max_depth': 14, 'min_samples_split': 17, 'min_samples_leaf': 4, 'criterion': 'entropy', 'max_features': None, 'splitter': 'random'}. Best is trial 16 with value: 0.10404417056131268.
[I 2025-12-03 22:03:07,454] Trial 20 finished with value: 0.06565762902853808 and parameters: {'max_depth': 5, 'min_samples_split': 10, 'min_samples_leaf': 3, 'criterion': 'log_loss', 'max_features': 'log2', 'splitter': 'random'}. Best is trial 16 with value: 0.10404417056131268.
[I 2025-12-03 22:03:07,617] Trial 21 finished with value: 0.10236960460825692 and parameters: {'max_depth': 7, 'min_samples_split': 11, 'min_samples_leaf': 5, 'criterion': 'log_loss', 'max_features': None, 'splitter': 'random'}. Best is trial 16 with value: 0.10404417056131268.
[I 2025-12-03 22:03:07,840] Trial 22 finished with value: 0.07586448292072805 and parameters: {'max_depth': 32, 'min_samples_split': 6, 'min_samples_leaf': 4, 'criterion': 'log_loss', 'max_features': None, 'splitter': 'random'}. Best is trial 16 with value: 0.10404417056131268.
[I 2025-12-03 22:03:07,991] Trial 23 finished with value: 0.09418988992488878 and parameters: {'max_depth': 5, 'min_samples_split': 11, 'min_samples_leaf': 8, 'criterion': 'log_loss', 'max_features': None, 'splitter': 'random'}. Best is trial 16 with value: 0.10404417056131268.
[I 2025-12-03 22:03:08,163] Trial 24 finished with value: 0.07980496232045488 and parameters: {'max_depth': 9, 'min_samples_split': 7, 'min_samples_leaf': 11, 'criterion': 'log_loss', 'max_features': None, 'splitter': 'random'}. Best is trial 16 with value: 0.10404417056131268.
[I 2025-12-03 22:03:08,359] Trial 25 finished with value: 0.0855314891865903 and parameters: {'max_depth': 13, 'min_samples_split': 12, 'min_samples_leaf': 2, 'criterion': 'log_loss', 'max_features': None, 'splitter': 'random'}. Best is trial 16 with value: 0.10404417056131268.
[I 2025-12-03 22:03:09,445] Trial 26 finished with value: 0.10040087698976348 and parameters: {'max_depth': 7, 'min_samples_split': 9, 'min_samples_leaf': 6, 'criterion': 'entropy', 'max_features': None, 'splitter': 'best'}. Best is trial 16 with value: 0.10404417056131268.
[I 2025-12-03 22:03:09,650] Trial 27 finished with value: 0.07811963597593388 and parameters: {'max_depth': 16, 'min_samples_split': 15, 'min_samples_leaf': 8, 'criterion': 'log_loss', 'max_features': None, 'splitter': 'random'}. Best is trial 16 with value: 0.10404417056131268.
[I 2025-12-03 22:03:09,778] Trial 28 finished with value: 0.08667725553202024 and parameters: {'max_depth': 10, 'min_samples_split': 10, 'min_samples_leaf': 5, 'criterion': 'log_loss', 'max_features': 'log2', 'splitter': 'random'}. Best is trial 16 with value: 0.10404417056131268.
[I 2025-12-03 22:03:10,496] Trial 29 finished with value: 0.09203254015842804 and parameters: {'max_depth': 4, 'min_samples_split': 2, 'min_samples_leaf': 3, 'criterion': 'log_loss', 'max_features': None, 'splitter': 'best'}. Best is trial 16 with value: 0.10404417056131268.
[I 2025-12-03 22:03:11,022] A new study created in memory with name: decision_tree_fold_4
[I 2025-12-03 22:03:11,236] Trial 0 finished with value: 0.07245797230853539 and parameters: {'max_depth': 30, 'min_samples_split': 16, 'min_samples_leaf': 5, 'criterion': 'log_loss', 'max_features': 'log2', 'splitter': 'best'}. Best is trial 0 with value: 0.07245797230853539.
[I 2025-12-03 22:03:11,364] Trial 1 finished with value: 0.07612895282611573 and parameters: {'max_depth': 5, 'min_samples_split': 10, 'min_samples_leaf': 11, 'criterion': 'log_loss', 'max_features': 'sqrt', 'splitter': 'random'}. Best is trial 1 with value: 0.07612895282611573.
[I 2025-12-03 22:03:11,687] Trial 2 finished with value: 0.08676014144344066 and parameters: {'max_depth': 16, 'min_samples_split': 12, 'min_samples_leaf': 16, 'criterion': 'log_loss', 'max_features': 'sqrt', 'splitter': 'best'}. Best is trial 2 with value: 0.08676014144344066.
[I 2025-12-03 22:03:11,815] Trial 3 finished with value: 0.09305639332555397 and parameters: {'max_depth': 6, 'min_samples_split': 7, 'min_samples_leaf': 7, 'criterion': 'entropy', 'max_features': 'sqrt', 'splitter': 'random'}. Best is trial 3 with value: 0.09305639332555397.
[I 2025-12-03 22:03:13,446] Trial 4 finished with value: 0.0856080332755351 and parameters: {'max_depth': 17, 'min_samples_split': 4, 'min_samples_leaf': 12, 'criterion': 'log_loss', 'max_features': None, 'splitter': 'best'}. Best is trial 3 with value: 0.09305639332555397.
[I 2025-12-03 22:03:13,691] Trial 5 finished with value: 0.08307762001744576 and parameters: {'max_depth': 16, 'min_samples_split': 15, 'min_samples_leaf': 13, 'criterion': 'gini', 'max_features': 'log2', 'splitter': 'best'}. Best is trial 3 with value: 0.09305639332555397.
[I 2025-12-03 22:03:14,001] Trial 6 finished with value: 0.09167301447758917 and parameters: {'max_depth': 25, 'min_samples_split': 6, 'min_samples_leaf': 20, 'criterion': 'entropy', 'max_features': 'sqrt', 'splitter': 'best'}. Best is trial 3 with value: 0.09305639332555397.
[I 2025-12-03 22:03:14,316] Trial 7 finished with value: 0.09047134071226134 and parameters: {'max_depth': 14, 'min_samples_split': 19, 'min_samples_leaf': 11, 'criterion': 'entropy', 'max_features': 'sqrt', 'splitter': 'best'}. Best is trial 3 with value: 0.09305639332555397.
[I 2025-12-03 22:03:14,591] Trial 8 finished with value: 0.07507909586384585 and parameters: {'max_depth': 15, 'min_samples_split': 10, 'min_samples_leaf': 6, 'criterion': 'log_loss', 'max_features': 'log2', 'splitter': 'best'}. Best is trial 3 with value: 0.09305639332555397.
[I 2025-12-03 22:03:14,720] Trial 9 finished with value: 0.09362600693225687 and parameters: {'max_depth': 15, 'min_samples_split': 8, 'min_samples_leaf': 16, 'criterion': 'log_loss', 'max_features': 'log2', 'splitter': 'random'}. Best is trial 9 with value: 0.09362600693225687.
[I 2025-12-03 22:03:14,948] Trial 10 finished with value: 0.060005199946935026 and parameters: {'max_depth': 23, 'min_samples_split': 2, 'min_samples_leaf': 1, 'criterion': 'gini', 'max_features': None, 'splitter': 'random'}. Best is trial 9 with value: 0.09362600693225687.
[I 2025-12-03 22:03:15,076] Trial 11 finished with value: 0.09786706502130993 and parameters: {'max_depth': 6, 'min_samples_split': 7, 'min_samples_leaf': 6, 'criterion': 'entropy', 'max_features': 'log2', 'splitter': 'random'}. Best is trial 11 with value: 0.09786706502130993.
[I 2025-12-03 22:03:15,204] Trial 12 finished with value: 0.09016505165169605 and parameters: {'max_depth': 9, 'min_samples_split': 7, 'min_samples_leaf': 18, 'criterion': 'entropy', 'max_features': 'log2', 'splitter': 'random'}. Best is trial 11 with value: 0.09786706502130993.
[I 2025-12-03 22:03:15,333] Trial 13 finished with value: 0.08774489159331317 and parameters: {'max_depth': 11, 'min_samples_split': 12, 'min_samples_leaf': 15, 'criterion': 'entropy', 'max_features': 'log2', 'splitter': 'random'}. Best is trial 11 with value: 0.09786706502130993.
[I 2025-12-03 22:03:15,456] Trial 14 finished with value: 0.05723442049911363 and parameters: {'max_depth': 2, 'min_samples_split': 8, 'min_samples_leaf': 2, 'criterion': 'gini', 'max_features': 'log2', 'splitter': 'random'}. Best is trial 11 with value: 0.09786706502130993.
[I 2025-12-03 22:03:15,591] Trial 15 finished with value: 0.09114221483446801 and parameters: {'max_depth': 21, 'min_samples_split': 4, 'min_samples_leaf': 8, 'criterion': 'log_loss', 'max_features': 'log2', 'splitter': 'random'}. Best is trial 11 with value: 0.09786706502130993.
[I 2025-12-03 22:03:15,723] Trial 16 finished with value: 0.08483470445760662 and parameters: {'max_depth': 10, 'min_samples_split': 9, 'min_samples_leaf': 9, 'criterion': 'entropy', 'max_features': 'log2', 'splitter': 'random'}. Best is trial 11 with value: 0.09786706502130993.
