[I 2025-12-03 22:41:03,362] Trial 13 finished with value: 0.15106618841020697 and parameters: {'n_estimators': 250, 'learning_rate': 0.050700193574017276, 'max_depth': 7, 'min_samples_split': 13, 'min_samples_leaf': 16, 'subsample': 0.8805304981023592, 'max_features': 'sqrt'}. Best is trial 9 with value: 0.17447271328612685.
[I 2025-12-03 22:41:37,005] Trial 14 finished with value: 0.15373007417810455 and parameters: {'n_estimators': 250, 'learning_rate': 0.03615567158879611, 'max_depth': 10, 'min_samples_split': 20, 'min_samples_leaf': 8, 'subsample': 0.8014514358611092, 'max_features': 'sqrt'}. Best is trial 9 with value: 0.17447271328612685.
[I 2025-12-03 22:42:10,609] Trial 15 finished with value: 0.11962978362826218 and parameters: {'n_estimators': 300, 'learning_rate': 0.14260114587089062, 'max_depth': 7, 'min_samples_split': 8, 'min_samples_leaf': 15, 'subsample': 0.937451159205101, 'max_features': 'sqrt'}. Best is trial 9 with value: 0.17447271328612685.
[I 2025-12-03 22:46:12,433] Trial 16 finished with value: 0.139993064192732 and parameters: {'n_estimators': 250, 'learning_rate': 0.04930007067656996, 'max_depth': 9, 'min_samples_split': 17, 'min_samples_leaf': 14, 'subsample': 0.8822360120465917, 'max_features': None}. Best is trial 9 with value: 0.17447271328612685.
[I 2025-12-03 22:46:46,875] Trial 17 finished with value: 0.12688193511669182 and parameters: {'n_estimators': 300, 'learning_rate': 0.19392943829693987, 'max_depth': 7, 'min_samples_split': 2, 'min_samples_leaf': 8, 'subsample': 0.9456591422911429, 'max_features': 'sqrt'}. Best is trial 9 with value: 0.17447271328612685.
[I 2025-12-03 22:47:17,800] Trial 18 finished with value: 0.14221309239314717 and parameters: {'n_estimators': 200, 'learning_rate': 0.06741991550720172, 'max_depth': 11, 'min_samples_split': 12, 'min_samples_leaf': 17, 'subsample': 0.8801745892543527, 'max_features': 'sqrt'}. Best is trial 9 with value: 0.17447271328612685.
[I 2025-12-03 22:48:23,355] Trial 19 finished with value: 0.14818733219195068 and parameters: {'n_estimators': 200, 'learning_rate': 0.12694839736655228, 'max_depth': 3, 'min_samples_split': 10, 'min_samples_leaf': 13, 'subsample': 0.8242285868537312, 'max_features': None}. Best is trial 9 with value: 0.17447271328612685.
[I 2025-12-03 22:48:47,296] Trial 20 finished with value: 0.1633136370521997 and parameters: {'n_estimators': 250, 'learning_rate': 0.027258138372920473, 'max_depth': 6, 'min_samples_split': 5, 'min_samples_leaf': 18, 'subsample': 0.9132905344299437, 'max_features': 'sqrt'}. Best is trial 9 with value: 0.17447271328612685.
[I 2025-12-03 22:49:20,650] Trial 21 finished with value: 0.16817488369478556 and parameters: {'n_estimators': 250, 'learning_rate': 0.010951261616864083, 'max_depth': 9, 'min_samples_split': 10, 'min_samples_leaf': 20, 'subsample': 0.8985538304411209, 'max_features': 'sqrt'}. Best is trial 9 with value: 0.17447271328612685.
[I 2025-12-03 22:49:50,980] Trial 22 finished with value: 0.14308335423088592 and parameters: {'n_estimators': 250, 'learning_rate': 0.06579993033565806, 'max_depth': 8, 'min_samples_split': 13, 'min_samples_leaf': 18, 'subsample': 0.9005781482345268, 'max_features': 'sqrt'}. Best is trial 9 with value: 0.17447271328612685.
[I 2025-12-03 22:50:35,618] Trial 23 finished with value: 0.14066690525888198 and parameters: {'n_estimators': 300, 'learning_rate': 0.035822180783469854, 'max_depth': 10, 'min_samples_split': 10, 'min_samples_leaf': 20, 'subsample': 0.9218195199701015, 'max_features': 'sqrt'}. Best is trial 9 with value: 0.17447271328612685.
[I 2025-12-03 22:51:05,029] Trial 24 finished with value: 0.17057885589551228 and parameters: {'n_estimators': 250, 'learning_rate': 0.010824455913029052, 'max_depth': 8, 'min_samples_split': 12, 'min_samples_leaf': 13, 'subsample': 0.8653235799332656, 'max_features': 'sqrt'}. Best is trial 9 with value: 0.17447271328612685.
[I 2025-12-03 22:51:40,403] Trial 25 finished with value: 0.1258672156092984 and parameters: {'n_estimators': 300, 'learning_rate': 0.0818818590267835, 'max_depth': 8, 'min_samples_split': 17, 'min_samples_leaf': 13, 'subsample': 0.8673992837634709, 'max_features': 'sqrt'}. Best is trial 9 with value: 0.17447271328612685.
[I 2025-12-03 22:52:02,228] Trial 26 finished with value: 0.12033780730072643 and parameters: {'n_estimators': 250, 'learning_rate': 0.29317792525175074, 'max_depth': 6, 'min_samples_split': 6, 'min_samples_leaf': 8, 'subsample': 0.8293683537757193, 'max_features': 'sqrt'}. Best is trial 9 with value: 0.17447271328612685.
[I 2025-12-03 22:52:46,240] Trial 27 finished with value: 0.13198611004141464 and parameters: {'n_estimators': 300, 'learning_rate': 0.048468388798166305, 'max_depth': 10, 'min_samples_split': 18, 'min_samples_leaf': 6, 'subsample': 0.8677744218480954, 'max_features': 'sqrt'}. Best is trial 9 with value: 0.17447271328612685.
[I 2025-12-03 22:54:52,400] Trial 28 finished with value: 0.11743716502290466 and parameters: {'n_estimators': 200, 'learning_rate': 0.19033440793985837, 'max_depth': 6, 'min_samples_split': 15, 'min_samples_leaf': 13, 'subsample': 0.8301183342204781, 'max_features': None}. Best is trial 9 with value: 0.17447271328612685.
[I 2025-12-03 22:55:05,947] Trial 29 finished with value: 0.18011711268763847 and parameters: {'n_estimators': 250, 'learning_rate': 0.026782938162367646, 'max_depth': 4, 'min_samples_split': 15, 'min_samples_leaf': 10, 'subsample': 0.9601233872759513, 'max_features': 'log2'}. Best is trial 29 with value: 0.18011711268763847.
[I 2025-12-03 22:55:09,985] A new study created in memory with name: gradient_boosting_fold_3
[I 2025-12-03 22:55:42,166] Trial 0 finished with value: 0.1316180415611213 and parameters: {'n_estimators': 150, 'learning_rate': 0.10783897237115873, 'max_depth': 15, 'min_samples_split': 14, 'min_samples_leaf': 18, 'subsample': 0.9726665651392186, 'max_features': 'sqrt'}. Best is trial 0 with value: 0.1316180415611213.
[I 2025-12-03 22:56:16,193] Trial 1 finished with value: 0.16414322541291632 and parameters: {'n_estimators': 300, 'learning_rate': 0.018799911716462177, 'max_depth': 9, 'min_samples_split': 5, 'min_samples_leaf': 14, 'subsample': 0.9668011267966181, 'max_features': 'log2'}. Best is trial 1 with value: 0.16414322541291632.
[I 2025-12-03 22:56:56,561] Trial 2 finished with value: 0.10763683168398883 and parameters: {'n_estimators': 300, 'learning_rate': 0.27058342500164684, 'max_depth': 8, 'min_samples_split': 9, 'min_samples_leaf': 6, 'subsample': 0.978193740646829, 'max_features': 'sqrt'}. Best is trial 1 with value: 0.16414322541291632.
[I 2025-12-03 23:03:01,042] Trial 3 finished with value: 0.1166473461288335 and parameters: {'n_estimators': 250, 'learning_rate': 0.0920350737971982, 'max_depth': 15, 'min_samples_split': 8, 'min_samples_leaf': 13, 'subsample': 0.8820424011140259, 'max_features': None}. Best is trial 1 with value: 0.16414322541291632.
[I 2025-12-03 23:03:36,849] Trial 4 finished with value: 0.09731074803681514 and parameters: {'n_estimators': 250, 'learning_rate': 0.22273782245226395, 'max_depth': 12, 'min_samples_split': 4, 'min_samples_leaf': 8, 'subsample': 0.9426278539551681, 'max_features': 'log2'}. Best is trial 1 with value: 0.16414322541291632.
[I 2025-12-03 23:04:13,676] Trial 5 finished with value: 0.13943372648121102 and parameters: {'n_estimators': 250, 'learning_rate': 0.034393594692548476, 'max_depth': 11, 'min_samples_split': 9, 'min_samples_leaf': 1, 'subsample': 0.9883281319184788, 'max_features': 'log2'}. Best is trial 1 with value: 0.16414322541291632.
[I 2025-12-03 23:04:39,189] Trial 6 finished with value: 0.11302186479761142 and parameters: {'n_estimators': 150, 'learning_rate': 0.13147637502788162, 'max_depth': 12, 'min_samples_split': 5, 'min_samples_leaf': 6, 'subsample': 0.8372088142848031, 'max_features': 'sqrt'}. Best is trial 1 with value: 0.16414322541291632.
[I 2025-12-03 23:04:58,977] Trial 7 finished with value: 0.11754129174889519 and parameters: {'n_estimators': 150, 'learning_rate': 0.13960781232094027, 'max_depth': 11, 'min_samples_split': 10, 'min_samples_leaf': 18, 'subsample': 0.9783730774161988, 'max_features': 'log2'}. Best is trial 1 with value: 0.16414322541291632.
[I 2025-12-03 23:05:09,912] Trial 8 finished with value: 0.12228791536600873 and parameters: {'n_estimators': 300, 'learning_rate': 0.256661152198676, 'max_depth': 3, 'min_samples_split': 7, 'min_samples_leaf': 7, 'subsample': 0.8404465339572227, 'max_features': 'log2'}. Best is trial 1 with value: 0.16414322541291632.
[I 2025-12-03 23:05:20,441] Trial 9 finished with value: 0.13138125702097259 and parameters: {'n_estimators': 100, 'learning_rate': 0.1743201946610746, 'max_depth': 7, 'min_samples_split': 15, 'min_samples_leaf': 16, 'subsample': 0.8790233070166824, 'max_features': 'sqrt'}. Best is trial 1 with value: 0.16414322541291632.
[I 2025-12-03 23:07:21,183] Trial 10 finished with value: 0.16676916369784567 and parameters: {'n_estimators': 200, 'learning_rate': 0.018928411258823878, 'max_depth': 5, 'min_samples_split': 20, 'min_samples_leaf': 13, 'subsample': 0.9284075048729626, 'max_features': None}. Best is trial 10 with value: 0.16676916369784567.
[I 2025-12-03 23:09:23,492] Trial 11 finished with value: 0.1646476074447702 and parameters: {'n_estimators': 200, 'learning_rate': 0.018323468992031283, 'max_depth': 5, 'min_samples_split': 20, 'min_samples_leaf': 13, 'subsample': 0.9399840017543042, 'max_features': None}. Best is trial 10 with value: 0.16676916369784567.
[I 2025-12-03 23:11:00,598] Trial 12 finished with value: 0.16644837259314124 and parameters: {'n_estimators': 200, 'learning_rate': 0.05542501546761759, 'max_depth': 4, 'min_samples_split': 20, 'min_samples_leaf': 11, 'subsample': 0.9237584152961735, 'max_features': None}. Best is trial 10 with value: 0.16676916369784567.
[I 2025-12-03 23:12:13,763] Trial 13 finished with value: 0.17118665206422934 and parameters: {'n_estimators': 200, 'learning_rate': 0.07268429933762083, 'max_depth': 3, 'min_samples_split': 20, 'min_samples_leaf': 10, 'subsample': 0.9174929824026422, 'max_features': None}. Best is trial 13 with value: 0.17118665206422934.
[I 2025-12-03 23:14:32,790] Trial 14 finished with value: 0.14477697780562915 and parameters: {'n_estimators': 200, 'learning_rate': 0.07188227437779836, 'max_depth': 6, 'min_samples_split': 17, 'min_samples_leaf': 10, 'subsample': 0.9076912016070764, 'max_features': None}. Best is trial 13 with value: 0.17118665206422934.
[I 2025-12-03 23:15:07,509] Trial 15 finished with value: 0.14868726872475366 and parameters: {'n_estimators': 100, 'learning_rate': 0.17314426101499442, 'max_depth': 3, 'min_samples_split': 17, 'min_samples_leaf': 3, 'subsample': 0.8705466281780182, 'max_features': None}. Best is trial 13 with value: 0.17118665206422934.
[I 2025-12-03 23:17:05,294] Trial 16 finished with value: 0.15097659491162907 and parameters: {'n_estimators': 200, 'learning_rate': 0.058454491638325355, 'max_depth': 5, 'min_samples_split': 13, 'min_samples_leaf': 10, 'subsample': 0.9073528709502512, 'max_features': None}. Best is trial 13 with value: 0.17118665206422934.
[I 2025-12-03 23:18:54,501] Trial 17 finished with value: 0.14211622552041434 and parameters: {'n_estimators': 150, 'learning_rate': 0.09588771077695832, 'max_depth': 6, 'min_samples_split': 17, 'min_samples_leaf': 15, 'subsample': 0.948517999386446, 'max_features': None}. Best is trial 13 with value: 0.17118665206422934.
[I 2025-12-03 23:20:14,484] Trial 18 finished with value: 0.16636756082978735 and parameters: {'n_estimators': 250, 'learning_rate': 0.011191129875551802, 'max_depth': 3, 'min_samples_split': 12, 'min_samples_leaf': 11, 'subsample': 0.8080099489387274, 'max_features': None}. Best is trial 13 with value: 0.17118665206422934.
[I 2025-12-03 23:21:41,184] Trial 19 finished with value: 0.12169681987354815 and parameters: {'n_estimators': 150, 'learning_rate': 0.20978193591579425, 'max_depth': 5, 'min_samples_split': 19, 'min_samples_leaf': 4, 'subsample': 0.8929939421669311, 'max_features': None}. Best is trial 13 with value: 0.17118665206422934.
[I 2025-12-03 23:24:24,148] Trial 20 finished with value: 0.1460255511129157 and parameters: {'n_estimators': 200, 'learning_rate': 0.047981691908161136, 'max_depth': 7, 'min_samples_split': 2, 'min_samples_leaf': 9, 'subsample': 0.9199782569579208, 'max_features': None}. Best is trial 13 with value: 0.17118665206422934.
[I 2025-12-03 23:26:01,412] Trial 21 finished with value: 0.1641637751834217 and parameters: {'n_estimators': 200, 'learning_rate': 0.07093421142932833, 'max_depth': 4, 'min_samples_split': 20, 'min_samples_leaf': 12, 'subsample': 0.9257496272118242, 'max_features': None}. Best is trial 13 with value: 0.17118665206422934.
[I 2025-12-03 23:28:06,583] Trial 22 finished with value: 0.16402612314006143 and parameters: {'n_estimators': 250, 'learning_rate': 0.039966243651367486, 'max_depth': 4, 'min_samples_split': 18, 'min_samples_leaf': 16, 'subsample': 0.952033351512728, 'max_features': None}. Best is trial 13 with value: 0.17118665206422934.
[I 2025-12-03 23:29:43,303] Trial 23 finished with value: 0.14124507203278971 and parameters: {'n_estimators': 200, 'learning_rate': 0.11305075150414091, 'max_depth': 4, 'min_samples_split': 16, 'min_samples_leaf': 11, 'subsample': 0.9226466624910543, 'max_features': None}. Best is trial 13 with value: 0.17118665206422934.
[I 2025-12-03 23:33:09,271] Trial 24 finished with value: 0.1298803596376113 and parameters: {'n_estimators': 200, 'learning_rate': 0.08123116490220963, 'max_depth': 9, 'min_samples_split': 20, 'min_samples_leaf': 9, 'subsample': 0.9309294547820323, 'max_features': None}. Best is trial 13 with value: 0.17118665206422934.
[I 2025-12-03 23:35:19,941] Trial 25 finished with value: 0.1449336333865162 and parameters: {'n_estimators': 200, 'learning_rate': 0.059921273132953076, 'max_depth': 6, 'min_samples_split': 18, 'min_samples_leaf': 12, 'subsample': 0.8569715943283985, 'max_features': None}. Best is trial 13 with value: 0.17118665206422934.
[I 2025-12-03 23:36:13,504] Trial 26 finished with value: 0.12225525181504689 and parameters: {'n_estimators': 150, 'learning_rate': 0.2999316076285333, 'max_depth': 3, 'min_samples_split': 15, 'min_samples_leaf': 20, 'subsample': 0.8995765514609615, 'max_features': None}. Best is trial 13 with value: 0.17118665206422934.
[I 2025-12-03 23:38:19,663] Trial 27 finished with value: 0.16710430388916014 and parameters: {'n_estimators': 250, 'learning_rate': 0.03143977741797105, 'max_depth': 4, 'min_samples_split': 19, 'min_samples_leaf': 14, 'subsample': 0.958412411318156, 'max_features': None}. Best is trial 13 with value: 0.17118665206422934.
[I 2025-12-03 23:38:51,852] Trial 28 finished with value: 0.1611108156003767 and parameters: {'n_estimators': 250, 'learning_rate': 0.0330082584729738, 'max_depth': 8, 'min_samples_split': 18, 'min_samples_leaf': 15, 'subsample': 0.9585751044605659, 'max_features': 'sqrt'}. Best is trial 13 with value: 0.17118665206422934.
[I 2025-12-03 23:41:28,037] Trial 29 finished with value: 0.13788547171605264 and parameters: {'n_estimators': 250, 'learning_rate': 0.10880966357356131, 'max_depth': 5, 'min_samples_split': 14, 'min_samples_leaf': 17, 'subsample': 0.9637665152703737, 'max_features': None}. Best is trial 13 with value: 0.17118665206422934.
[I 2025-12-03 23:41:47,409] A new study created in memory with name: gradient_boosting_fold_4
[I 2025-12-03 23:48:52,091] Trial 0 finished with value: 0.12152654453289498 and parameters: {'n_estimators': 300, 'learning_rate': 0.12234534122967981, 'max_depth': 15, 'min_samples_split': 11, 'min_samples_leaf': 16, 'subsample': 0.8601863315432905, 'max_features': None}. Best is trial 0 with value: 0.12152654453289498.
[I 2025-12-03 23:49:08,634] Trial 1 finished with value: 0.13961150609307826 and parameters: {'n_estimators': 100, 'learning_rate': 0.0833027807538474, 'max_depth': 15, 'min_samples_split': 5, 'min_samples_leaf': 15, 'subsample': 0.9377896510364929, 'max_features': 'log2'}. Best is trial 1 with value: 0.13961150609307826.
[I 2025-12-03 23:49:30,223] Trial 2 finished with value: 0.11228398374257365 and parameters: {'n_estimators': 150, 'learning_rate': 0.2313383829204808, 'max_depth': 13, 'min_samples_split': 8, 'min_samples_leaf': 11, 'subsample': 0.8875077214941272, 'max_features': 'log2'}. Best is trial 1 with value: 0.13961150609307826.
[I 2025-12-03 23:51:01,416] Trial 3 finished with value: 0.1438503087814305 and parameters: {'n_estimators': 250, 'learning_rate': 0.19638473830130881, 'max_depth': 3, 'min_samples_split': 15, 'min_samples_leaf': 3, 'subsample': 0.9101959330611132, 'max_features': None}. Best is trial 3 with value: 0.1438503087814305.
[I 2025-12-03 23:56:21,716] Trial 4 finished with value: 0.14932554404710519 and parameters: {'n_estimators': 250, 'learning_rate': 0.027997992281361364, 'max_depth': 13, 'min_samples_split': 2, 'min_samples_leaf': 3, 'subsample': 0.8256226455164601, 'max_features': None}. Best is trial 4 with value: 0.14932554404710519.
[I 2025-12-03 23:56:44,757] Trial 5 finished with value: 0.15536630657582645 and parameters: {'n_estimators': 250, 'learning_rate': 0.09311805199789523, 'max_depth': 6, 'min_samples_split': 17, 'min_samples_leaf': 8, 'subsample': 0.8726153418132526, 'max_features': 'sqrt'}. Best is trial 5 with value: 0.15536630657582645.
[I 2025-12-03 23:57:22,540] Trial 6 finished with value: 0.13354931845669077 and parameters: {'n_estimators': 300, 'learning_rate': 0.08468060604163058, 'max_depth': 10, 'min_samples_split': 15, 'min_samples_leaf': 12, 'subsample': 0.9763254251715177, 'max_features': 'log2'}. Best is trial 5 with value: 0.15536630657582645.
[I 2025-12-03 23:57:54,581] Trial 7 finished with value: 0.18317114391075498 and parameters: {'n_estimators': 150, 'learning_rate': 0.019557500925506215, 'max_depth': 14, 'min_samples_split': 4, 'min_samples_leaf': 18, 'subsample': 0.9973299787627428, 'max_features': 'sqrt'}. Best is trial 7 with value: 0.18317114391075498.
[I 2025-12-03 23:58:12,125] Trial 8 finished with value: 0.12663113361000916 and parameters: {'n_estimators': 100, 'learning_rate': 0.22007954926740406, 'max_depth': 11, 'min_samples_split': 8, 'min_samples_leaf': 2, 'subsample': 0.9040627392862667, 'max_features': 'sqrt'}. Best is trial 7 with value: 0.18317114391075498.
[I 2025-12-04 00:00:10,125] Trial 9 finished with value: 0.12847181306281702 and parameters: {'n_estimators': 100, 'learning_rate': 0.2559529458244272, 'max_depth': 10, 'min_samples_split': 13, 'min_samples_leaf': 9, 'subsample': 0.9637806441982045, 'max_features': None}. Best is trial 7 with value: 0.18317114391075498.
[I 2025-12-04 00:00:28,285] Trial 10 finished with value: 0.17955526782719505 and parameters: {'n_estimators': 150, 'learning_rate': 0.03708465031627434, 'max_depth': 7, 'min_samples_split': 20, 'min_samples_leaf': 20, 'subsample': 0.9991685827076681, 'max_features': 'sqrt'}. Best is trial 7 with value: 0.18317114391075498.
[I 2025-12-04 00:00:46,196] Trial 11 finished with value: 0.18598439526155994 and parameters: {'n_estimators': 150, 'learning_rate': 0.020089434755316188, 'max_depth': 7, 'min_samples_split': 20, 'min_samples_leaf': 20, 'subsample': 0.9933004788552184, 'max_features': 'sqrt'}. Best is trial 11 with value: 0.18598439526155994.
[I 2025-12-04 00:01:04,229] Trial 12 finished with value: 0.18397577096172468 and parameters: {'n_estimators': 150, 'learning_rate': 0.010250961266445013, 'max_depth': 7, 'min_samples_split': 20, 'min_samples_leaf': 20, 'subsample': 0.9982075022128144, 'max_features': 'sqrt'}. Best is trial 11 with value: 0.18598439526155994.
[I 2025-12-04 00:01:27,009] Trial 13 finished with value: 0.1474879158011365 and parameters: {'n_estimators': 200, 'learning_rate': 0.14139644370912546, 'max_depth': 7, 'min_samples_split': 20, 'min_samples_leaf': 20, 'subsample': 0.9488054535104025, 'max_features': 'sqrt'}. Best is trial 11 with value: 0.18598439526155994.
[I 2025-12-04 00:01:43,687] Trial 14 finished with value: 0.17932759542049398 and parameters: {'n_estimators': 200, 'learning_rate': 0.05902755176010652, 'max_depth': 5, 'min_samples_split': 18, 'min_samples_leaf': 15, 'subsample': 0.9312221559917345, 'max_features': 'sqrt'}. Best is trial 11 with value: 0.18598439526155994.
[I 2025-12-04 00:02:03,654] Trial 15 finished with value: 0.1278084043343061 and parameters: {'n_estimators': 150, 'learning_rate': 0.29362532416582854, 'max_depth': 8, 'min_samples_split': 17, 'min_samples_leaf': 17, 'subsample': 0.9779199928094773, 'max_features': 'sqrt'}. Best is trial 11 with value: 0.18598439526155994.
[I 2025-12-04 00:02:15,693] Trial 16 finished with value: 0.18779300918532305 and parameters: {'n_estimators': 200, 'learning_rate': 0.010232255930230132, 'max_depth': 4, 'min_samples_split': 20, 'min_samples_leaf': 13, 'subsample': 0.8149784177446362, 'max_features': 'sqrt'}. Best is trial 16 with value: 0.18779300918532305.
[I 2025-12-04 00:02:27,685] Trial 17 finished with value: 0.15869000914869477 and parameters: {'n_estimators': 200, 'learning_rate': 0.1638861865607713, 'max_depth': 4, 'min_samples_split': 12, 'min_samples_leaf': 7, 'subsample': 0.8131478221864731, 'max_features': 'sqrt'}. Best is trial 16 with value: 0.18779300918532305.
[I 2025-12-04 00:02:37,296] Trial 18 finished with value: 0.19561069035513134 and parameters: {'n_estimators': 200, 'learning_rate': 0.047205183424971986, 'max_depth': 3, 'min_samples_split': 15, 'min_samples_leaf': 13, 'subsample': 0.8421496124201309, 'max_features': 'sqrt'}. Best is trial 18 with value: 0.19561069035513134.
[I 2025-12-04 00:02:46,611] Trial 19 finished with value: 0.18917029283524114 and parameters: {'n_estimators': 250, 'learning_rate': 0.06254290216859865, 'max_depth': 3, 'min_samples_split': 15, 'min_samples_leaf': 13, 'subsample': 0.8365351483913003, 'max_features': 'log2'}. Best is trial 18 with value: 0.19561069035513134.
