[I 2025-12-04 03:20:22,466] Trial 10 finished with value: 0.15061615576051599 and parameters: {'n_estimators': 959, 'learning_rate': 0.03776487456200098, 'max_depth': 3, 'min_child_weight': 7, 'subsample': 0.8289279504501832, 'colsample_bytree': 0.9953132480415036, 'reg_alpha': 0.36697035248323584, 'reg_lambda': 6.571359939034443, 'gamma': 4.915675695648245, 'scale_pos_weight': 8.66531694218327}. Best is trial 2 with value: 0.15330601092908264.
[I 2025-12-04 03:22:12,350] Trial 11 finished with value: 0.1561847940145325 and parameters: {'n_estimators': 974, 'learning_rate': 0.0215721337230173, 'max_depth': 3, 'min_child_weight': 6, 'subsample': 0.8132878881247946, 'colsample_bytree': 0.9948355193786693, 'reg_alpha': 0.3234001150692515, 'reg_lambda': 6.9536856888092204, 'gamma': 4.967104499343914, 'scale_pos_weight': 6.773746210230852}. Best is trial 11 with value: 0.1561847940145325.
[I 2025-12-04 03:28:15,014] Trial 12 finished with value: 0.13473452274483827 and parameters: {'n_estimators': 900, 'learning_rate': 0.010859745596067128, 'max_depth': 11, 'min_child_weight': 6, 'subsample': 0.7103263029965846, 'colsample_bytree': 0.9049351309310438, 'reg_alpha': 0.43582224944184117, 'reg_lambda': 6.735068432240529, 'gamma': 4.044319417441439, 'scale_pos_weight': 19.03646962248949}. Best is trial 11 with value: 0.1561847940145325.
[I 2025-12-04 03:29:15,067] Trial 13 finished with value: 0.13527083486883149 and parameters: {'n_estimators': 794, 'learning_rate': 0.08189841822290558, 'max_depth': 7, 'min_child_weight': 8, 'subsample': 0.7930210212400342, 'colsample_bytree': 0.9923722716901665, 'reg_alpha': 0.3055637961600891, 'reg_lambda': 6.921774260227815, 'gamma': 4.112956778184693, 'scale_pos_weight': 5.65843957363381}. Best is trial 11 with value: 0.1561847940145325.
[I 2025-12-04 03:30:49,192] Trial 14 finished with value: 0.12973524223353408 and parameters: {'n_estimators': 850, 'learning_rate': 0.08601158474393637, 'max_depth': 11, 'min_child_weight': 6, 'subsample': 0.9232107310414057, 'colsample_bytree': 0.8920340275657637, 'reg_alpha': 0.7241383852941075, 'reg_lambda': 5.444175169925039, 'gamma': 3.143644050317884, 'scale_pos_weight': 16.604153057644208}. Best is trial 11 with value: 0.1561847940145325.
[I 2025-12-04 03:33:51,649] Trial 15 finished with value: 0.1446700166348755 and parameters: {'n_estimators': 987, 'learning_rate': 0.06881426997148102, 'max_depth': 3, 'min_child_weight': 5, 'subsample': 0.9419355443835157, 'colsample_bytree': 0.8607421968505813, 'reg_alpha': 0.279143254071827, 'reg_lambda': 9.96403408955866, 'gamma': 4.568012715938112, 'scale_pos_weight': 13.53117403041357}. Best is trial 11 with value: 0.1561847940145325.
[I 2025-12-04 03:34:09,724] Trial 16 finished with value: 0.13378718365646464 and parameters: {'n_estimators': 139, 'learning_rate': 0.11538262980228406, 'max_depth': 5, 'min_child_weight': 8, 'subsample': 0.8348682560517223, 'colsample_bytree': 0.6001669915009821, 'reg_alpha': 0.7130207131690582, 'reg_lambda': 7.502171449958233, 'gamma': 3.3332247557165227, 'scale_pos_weight': 23.69436504849518}. Best is trial 11 with value: 0.1561847940145325.
[I 2025-12-04 03:40:47,114] Trial 17 finished with value: 0.1321896575030134 and parameters: {'n_estimators': 724, 'learning_rate': 0.012235121487817857, 'max_depth': 11, 'min_child_weight': 5, 'subsample': 0.6903151590845196, 'colsample_bytree': 0.9496972405394069, 'reg_alpha': 0.5349843264557836, 'reg_lambda': 5.41445606512859, 'gamma': 4.4125191653592575, 'scale_pos_weight': 24.849892034614065}. Best is trial 11 with value: 0.1561847940145325.
[I 2025-12-04 03:43:46,267] Trial 18 finished with value: 0.12711617536712044 and parameters: {'n_estimators': 408, 'learning_rate': 0.054058986288489416, 'max_depth': 7, 'min_child_weight': 1, 'subsample': 0.6036199232754647, 'colsample_bytree': 0.9534668851241459, 'reg_alpha': 0.8009552647632671, 'reg_lambda': 7.801415904973411, 'gamma': 3.6213894208230633, 'scale_pos_weight': 12.358534845864456}. Best is trial 11 with value: 0.1561847940145325.
[I 2025-12-04 03:44:41,217] Trial 19 finished with value: 0.14556390453633086 and parameters: {'n_estimators': 680, 'learning_rate': 0.11432689796621784, 'max_depth': 9, 'min_child_weight': 4, 'subsample': 0.9461517822607585, 'colsample_bytree': 0.8572805395154137, 'reg_alpha': 0.9913647333465436, 'reg_lambda': 5.988906292479577, 'gamma': 4.526181500989218, 'scale_pos_weight': 5.803639161729825}. Best is trial 11 with value: 0.1561847940145325.
[I 2025-12-04 03:45:39,173] Trial 20 finished with value: 0.13722968428008098 and parameters: {'n_estimators': 804, 'learning_rate': 0.03815713028229316, 'max_depth': 4, 'min_child_weight': 7, 'subsample': 0.8343970825238384, 'colsample_bytree': 0.92005945630957, 'reg_alpha': 0.22139770769850897, 'reg_lambda': 4.164185984920941, 'gamma': 3.0216697800795718, 'scale_pos_weight': 21.2173206505188}. Best is trial 11 with value: 0.1561847940145325.
[I 2025-12-04 03:47:06,623] Trial 21 finished with value: 0.1524848413715539 and parameters: {'n_estimators': 975, 'learning_rate': 0.031943127810246906, 'max_depth': 3, 'min_child_weight': 7, 'subsample': 0.8209669975446708, 'colsample_bytree': 0.9951094697550673, 'reg_alpha': 0.40464411922238597, 'reg_lambda': 6.29835698759669, 'gamma': 4.940178738162959, 'scale_pos_weight': 10.978806494733291}. Best is trial 11 with value: 0.1561847940145325.
[I 2025-12-04 03:48:45,017] Trial 22 finished with value: 0.14198668575510473 and parameters: {'n_estimators': 898, 'learning_rate': 0.03776323210078175, 'max_depth': 6, 'min_child_weight': 7, 'subsample': 0.7956534013128969, 'colsample_bytree': 0.9905566146268336, 'reg_alpha': 0.43078257646823354, 'reg_lambda': 7.647562652448816, 'gamma': 4.939143423112923, 'scale_pos_weight': 11.851893978902291}. Best is trial 11 with value: 0.1561847940145325.
[I 2025-12-04 03:49:52,781] Trial 23 finished with value: 0.13563537258569788 and parameters: {'n_estimators': 989, 'learning_rate': 0.09696187379389451, 'max_depth': 3, 'min_child_weight': 9, 'subsample': 0.760606691108734, 'colsample_bytree': 0.9664744367041479, 'reg_alpha': 0.5998783029756032, 'reg_lambda': 6.080865706903844, 'gamma': 4.214330840071586, 'scale_pos_weight': 13.404189340906072}. Best is trial 11 with value: 0.1561847940145325.
[I 2025-12-04 03:51:39,787] Trial 24 finished with value: 0.14038680124819627 and parameters: {'n_estimators': 885, 'learning_rate': 0.05722207196630384, 'max_depth': 4, 'min_child_weight': 6, 'subsample': 0.8602464325814883, 'colsample_bytree': 0.8750529120071535, 'reg_alpha': 0.45510823300527237, 'reg_lambda': 4.955209874768591, 'gamma': 4.601634377232384, 'scale_pos_weight': 8.87047787822948}. Best is trial 11 with value: 0.1561847940145325.
[I 2025-12-04 03:55:47,262] Trial 25 finished with value: 0.1554641201101732 and parameters: {'n_estimators': 773, 'learning_rate': 0.010909461468074352, 'max_depth': 6, 'min_child_weight': 8, 'subsample': 0.96889458630896, 'colsample_bytree': 0.9739852426729184, 'reg_alpha': 0.2141501125416576, 'reg_lambda': 7.201221392542799, 'gamma': 3.762675068966609, 'scale_pos_weight': 16.25616740197483}. Best is trial 11 with value: 0.1561847940145325.
[I 2025-12-04 04:00:29,253] Trial 26 finished with value: 0.14773885308061394 and parameters: {'n_estimators': 777, 'learning_rate': 0.014185392585680641, 'max_depth': 7, 'min_child_weight': 8, 'subsample': 0.9760854037654414, 'colsample_bytree': 0.9293597218535747, 'reg_alpha': 0.2428710053855463, 'reg_lambda': 7.162501760075903, 'gamma': 3.595148563073672, 'scale_pos_weight': 16.828540744507936}. Best is trial 11 with value: 0.1561847940145325.
[I 2025-12-04 04:01:44,998] Trial 27 finished with value: 0.14934432529176506 and parameters: {'n_estimators': 614, 'learning_rate': 0.0622348301846206, 'max_depth': 10, 'min_child_weight': 9, 'subsample': 0.9506935301600233, 'colsample_bytree': 0.9643680694244766, 'reg_alpha': 0.025441384797977362, 'reg_lambda': 8.070501450689644, 'gamma': 2.573102072072311, 'scale_pos_weight': 5.416711787311171}. Best is trial 11 with value: 0.1561847940145325.
[I 2025-12-04 04:02:23,062] Trial 28 finished with value: 0.13019339076612363 and parameters: {'n_estimators': 707, 'learning_rate': 0.161379862479764, 'max_depth': 6, 'min_child_weight': 4, 'subsample': 0.9046020333631906, 'colsample_bytree': 0.8982763444291378, 'reg_alpha': 0.20276087717253446, 'reg_lambda': 9.476098977424261, 'gamma': 3.7616409684836434, 'scale_pos_weight': 26.991540076665977}. Best is trial 11 with value: 0.1561847940145325.
[I 2025-12-04 04:04:14,643] Trial 29 finished with value: 0.13807959544666765 and parameters: {'n_estimators': 524, 'learning_rate': 0.027701104070362602, 'max_depth': 8, 'min_child_weight': 2, 'subsample': 0.9623294321831843, 'colsample_bytree': 0.8471791147756901, 'reg_alpha': 0.3333589156171245, 'reg_lambda': 8.457813641488965, 'gamma': 4.216820338572765, 'scale_pos_weight': 21.746284679649193}. Best is trial 11 with value: 0.1561847940145325.
[I 2025-12-04 04:04:23,325] A new study created in memory with name: xgboost_fold_5
[I 2025-12-04 04:05:18,233] Trial 0 finished with value: 0.07695366076601697 and parameters: {'n_estimators': 567, 'learning_rate': 0.29536774543313055, 'max_depth': 6, 'min_child_weight': 1, 'subsample': 0.6341350486702846, 'colsample_bytree': 0.6949971500867238, 'reg_alpha': 0.7391875955622682, 'reg_lambda': 2.742559364581581, 'gamma': 1.7996798742848263, 'scale_pos_weight': 24.43920456087953}. Best is trial 0 with value: 0.07695366076601697.
[I 2025-12-04 04:09:45,132] Trial 1 finished with value: 0.08964818843505887 and parameters: {'n_estimators': 485, 'learning_rate': 0.03659452666676822, 'max_depth': 12, 'min_child_weight': 6, 'subsample': 0.9255472009340399, 'colsample_bytree': 0.997223818909391, 'reg_alpha': 0.19973638619167677, 'reg_lambda': 1.6021556487881452, 'gamma': 0.5013294242505628, 'scale_pos_weight': 49.13406728164417}. Best is trial 1 with value: 0.08964818843505887.
[I 2025-12-04 04:10:30,435] Trial 2 finished with value: 0.10004124666190546 and parameters: {'n_estimators': 615, 'learning_rate': 0.2749667587726217, 'max_depth': 15, 'min_child_weight': 7, 'subsample': 0.8230307634014512, 'colsample_bytree': 0.8492190969637551, 'reg_alpha': 0.35802323220333876, 'reg_lambda': 9.750594333151467, 'gamma': 3.2789035585520137, 'scale_pos_weight': 19.960513526777365}. Best is trial 2 with value: 0.10004124666190546.
[I 2025-12-04 04:12:04,105] Trial 3 finished with value: 0.09006694183801564 and parameters: {'n_estimators': 985, 'learning_rate': 0.11697656659282255, 'max_depth': 8, 'min_child_weight': 1, 'subsample': 0.6312677001315862, 'colsample_bytree': 0.6114155785779035, 'reg_alpha': 0.1786500665069939, 'reg_lambda': 3.8339741235738023, 'gamma': 4.823876344398448, 'scale_pos_weight': 40.84094781425965}. Best is trial 2 with value: 0.10004124666190546.
[I 2025-12-04 04:14:03,555] Trial 4 finished with value: 0.09459834719654303 and parameters: {'n_estimators': 274, 'learning_rate': 0.10846847254007387, 'max_depth': 13, 'min_child_weight': 7, 'subsample': 0.7519807932425907, 'colsample_bytree': 0.7578007647498566, 'reg_alpha': 0.6573550090693332, 'reg_lambda': 2.160013531311451, 'gamma': 0.7430761751351578, 'scale_pos_weight': 46.51562604368413}. Best is trial 2 with value: 0.10004124666190546.
[I 2025-12-04 04:15:21,526] Trial 5 finished with value: 0.1083466233672904 and parameters: {'n_estimators': 593, 'learning_rate': 0.25902610891584427, 'max_depth': 8, 'min_child_weight': 7, 'subsample': 0.8625992009444718, 'colsample_bytree': 0.8787777478720273, 'reg_alpha': 0.44199964733400954, 'reg_lambda': 9.918111318926579, 'gamma': 1.0155346365017919, 'scale_pos_weight': 9.875784482762043}. Best is trial 5 with value: 0.1083466233672904.
[I 2025-12-04 04:16:55,024] Trial 6 finished with value: 0.1218152991387655 and parameters: {'n_estimators': 326, 'learning_rate': 0.01599032421542383, 'max_depth': 7, 'min_child_weight': 5, 'subsample': 0.879154938013742, 'colsample_bytree': 0.9023245265150521, 'reg_alpha': 0.3650440837116451, 'reg_lambda': 8.50992934902591, 'gamma': 4.592067393796294, 'scale_pos_weight': 27.940806612432375}. Best is trial 6 with value: 0.1218152991387655.
[I 2025-12-04 04:19:18,909] Trial 7 finished with value: 0.11968772935206082 and parameters: {'n_estimators': 835, 'learning_rate': 0.031590668839649456, 'max_depth': 9, 'min_child_weight': 7, 'subsample': 0.6541883258083678, 'colsample_bytree': 0.8668212858563318, 'reg_alpha': 0.6321173410466582, 'reg_lambda': 6.951979274568344, 'gamma': 1.7121948241396017, 'scale_pos_weight': 6.618516401723395}. Best is trial 6 with value: 0.1218152991387655.
[I 2025-12-04 04:22:10,857] Trial 8 finished with value: 0.08493403616082197 and parameters: {'n_estimators': 728, 'learning_rate': 0.0983461214570629, 'max_depth': 14, 'min_child_weight': 1, 'subsample': 0.7279234628830566, 'colsample_bytree': 0.622197691672434, 'reg_alpha': 0.1252387725764228, 'reg_lambda': 2.1096186859594037, 'gamma': 1.2846749964331594, 'scale_pos_weight': 30.422133752149172}. Best is trial 6 with value: 0.1218152991387655.
[I 2025-12-04 04:22:29,796] Trial 9 finished with value: 0.11233003815225243 and parameters: {'n_estimators': 101, 'learning_rate': 0.24831598640258068, 'max_depth': 3, 'min_child_weight': 7, 'subsample': 0.8696418095376801, 'colsample_bytree': 0.6866119351977995, 'reg_alpha': 0.8881782594952444, 'reg_lambda': 9.182069549205249, 'gamma': 2.802893549318641, 'scale_pos_weight': 41.58789947462858}. Best is trial 6 with value: 0.1218152991387655.
[I 2025-12-04 04:23:13,099] Trial 10 finished with value: 0.11171423447150679 and parameters: {'n_estimators': 328, 'learning_rate': 0.1898432224553879, 'max_depth': 3, 'min_child_weight': 10, 'subsample': 0.9844885959019841, 'colsample_bytree': 0.9810051983496401, 'reg_alpha': 0.0020843800554043446, 'reg_lambda': 7.075918486191644, 'gamma': 4.9740721380985145, 'scale_pos_weight': 33.42422834390006}. Best is trial 6 with value: 0.1218152991387655.
[I 2025-12-04 04:27:49,035] Trial 11 finished with value: 0.13136019637341204 and parameters: {'n_estimators': 895, 'learning_rate': 0.011445723856995958, 'max_depth': 10, 'min_child_weight': 4, 'subsample': 0.6954350014023879, 'colsample_bytree': 0.9123011669697911, 'reg_alpha': 0.5916003844708346, 'reg_lambda': 6.985457022735716, 'gamma': 3.981892619850524, 'scale_pos_weight': 5.395646501479139}. Best is trial 11 with value: 0.13136019637341204.
[I 2025-12-04 04:31:37,265] Trial 12 finished with value: 0.11610965491544348 and parameters: {'n_estimators': 323, 'learning_rate': 0.017254074792617057, 'max_depth': 11, 'min_child_weight': 4, 'subsample': 0.7286833435063742, 'colsample_bytree': 0.9256609349135825, 'reg_alpha': 0.4999684564719066, 'reg_lambda': 7.560846115616828, 'gamma': 3.7609261032218857, 'scale_pos_weight': 17.114390601229182}. Best is trial 11 with value: 0.13136019637341204.
[I 2025-12-04 04:33:02,942] Trial 13 finished with value: 0.11102570499190505 and parameters: {'n_estimators': 974, 'learning_rate': 0.06171341211179092, 'max_depth': 6, 'min_child_weight': 4, 'subsample': 0.779881990341515, 'colsample_bytree': 0.9289350787757309, 'reg_alpha': 0.34936780076171375, 'reg_lambda': 4.811105004397865, 'gamma': 4.048464537602085, 'scale_pos_weight': 13.372221720775443}. Best is trial 11 with value: 0.13136019637341204.
[I 2025-12-04 04:34:01,285] Trial 14 finished with value: 0.10284296934740005 and parameters: {'n_estimators': 414, 'learning_rate': 0.16515467721836863, 'max_depth': 6, 'min_child_weight': 4, 'subsample': 0.9304785289150903, 'colsample_bytree': 0.7914824237585469, 'reg_alpha': 0.9903384648379431, 'reg_lambda': 8.376182120642984, 'gamma': 4.1567064198322, 'scale_pos_weight': 23.5405379590876}. Best is trial 11 with value: 0.13136019637341204.
[I 2025-12-04 04:35:40,863] Trial 15 finished with value: 0.09932281642309641 and parameters: {'n_estimators': 137, 'learning_rate': 0.06679893055756951, 'max_depth': 10, 'min_child_weight': 3, 'subsample': 0.6855176896649546, 'colsample_bytree': 0.9031765334899869, 'reg_alpha': 0.5795631197754807, 'reg_lambda': 5.885608265121226, 'gamma': 2.7566182957201315, 'scale_pos_weight': 35.77768060717588}. Best is trial 11 with value: 0.13136019637341204.
[I 2025-12-04 04:37:52,320] Trial 16 finished with value: 0.08756098107172552 and parameters: {'n_estimators': 776, 'learning_rate': 0.21473731790861986, 'max_depth': 7, 'min_child_weight': 9, 'subsample': 0.8205994883212913, 'colsample_bytree': 0.8227273571665403, 'reg_alpha': 0.34022284641911515, 'reg_lambda': 5.846537083097122, 'gamma': 4.398198379583506, 'scale_pos_weight': 52.903911579093695}. Best is trial 11 with value: 0.13136019637341204.
[I 2025-12-04 04:40:18,062] Trial 17 finished with value: 0.13164633720945698 and parameters: {'n_estimators': 219, 'learning_rate': 0.01047638479949688, 'max_depth': 10, 'min_child_weight': 3, 'subsample': 0.6017527672649037, 'colsample_bytree': 0.9486523290322296, 'reg_alpha': 0.7745713045485911, 'reg_lambda': 7.381173971409833, 'gamma': 3.4409189957079946, 'scale_pos_weight': 5.968594623086176}. Best is trial 17 with value: 0.13164633720945698.
[I 2025-12-04 04:43:00,358] Trial 18 finished with value: 0.11022621701347815 and parameters: {'n_estimators': 880, 'learning_rate': 0.07206698259758362, 'max_depth': 11, 'min_child_weight': 3, 'subsample': 0.608429277642432, 'colsample_bytree': 0.9629859731918639, 'reg_alpha': 0.7847548889725651, 'reg_lambda': 4.755403515437075, 'gamma': 3.5579100809870106, 'scale_pos_weight': 5.356747877191113}. Best is trial 17 with value: 0.13164633720945698.
[I 2025-12-04 04:44:55,498] Trial 19 finished with value: 0.10110725831322301 and parameters: {'n_estimators': 688, 'learning_rate': 0.13142597694847458, 'max_depth': 10, 'min_child_weight': 2, 'subsample': 0.6844547684789241, 'colsample_bytree': 0.9529043132001617, 'reg_alpha': 0.8049389118832091, 'reg_lambda': 6.488741421737819, 'gamma': 3.2802402018639274, 'scale_pos_weight': 13.641536688431536}. Best is trial 17 with value: 0.13164633720945698.
[I 2025-12-04 04:46:38,752] Trial 20 finished with value: 0.11791128426645252 and parameters: {'n_estimators': 206, 'learning_rate': 0.0541243616852009, 'max_depth': 12, 'min_child_weight': 5, 'subsample': 0.6795803291901837, 'colsample_bytree': 0.7637635238883044, 'reg_alpha': 0.9158098774096172, 'reg_lambda': 7.929586425451288, 'gamma': 2.4100525334951772, 'scale_pos_weight': 11.400309513723414}. Best is trial 17 with value: 0.13164633720945698.
[I 2025-12-04 04:50:37,104] Trial 21 finished with value: 0.11862316158433181 and parameters: {'n_estimators': 448, 'learning_rate': 0.013649526013480129, 'max_depth': 9, 'min_child_weight': 5, 'subsample': 0.8773337090920325, 'colsample_bytree': 0.9025790058824008, 'reg_alpha': 0.5615341962379711, 'reg_lambda': 9.005345831316767, 'gamma': 4.4101887307216145, 'scale_pos_weight': 26.463686332507073}. Best is trial 17 with value: 0.13164633720945698.
[I 2025-12-04 04:51:18,680] Trial 22 finished with value: 0.12472579956579535 and parameters: {'n_estimators': 233, 'learning_rate': 0.03483594391742533, 'max_depth': 5, 'min_child_weight': 3, 'subsample': 0.6031413946601518, 'colsample_bytree': 0.9376633960308264, 'reg_alpha': 0.7076035160036231, 'reg_lambda': 8.416165494614818, 'gamma': 3.6733209376206744, 'scale_pos_weight': 19.440819554194825}. Best is trial 17 with value: 0.13164633720945698.
[I 2025-12-04 04:51:48,290] Trial 23 finished with value: 0.13436799750072287 and parameters: {'n_estimators': 199, 'learning_rate': 0.04533173253445354, 'max_depth': 4, 'min_child_weight': 3, 'subsample': 0.6046623111002114, 'colsample_bytree': 0.9492809759203414, 'reg_alpha': 0.6997297045722118, 'reg_lambda': 7.523561119992946, 'gamma': 3.215954007741898, 'scale_pos_weight': 17.821837897574678}. Best is trial 23 with value: 0.13436799750072287.
[I 2025-12-04 04:54:07,346] Trial 24 finished with value: 0.11262229243791481 and parameters: {'n_estimators': 407, 'learning_rate': 0.0855509184409835, 'max_depth': 10, 'min_child_weight': 2, 'subsample': 0.6590139558327608, 'colsample_bytree': 0.9699271846487927, 'reg_alpha': 0.8396289997382405, 'reg_lambda': 6.71540094477972, 'gamma': 3.1396471321532617, 'scale_pos_weight': 8.492899827343079}. Best is trial 23 with value: 0.13436799750072287.
[I 2025-12-04 04:54:32,771] Trial 25 finished with value: 0.13919481883456017 and parameters: {'n_estimators': 172, 'learning_rate': 0.044839250898827086, 'max_depth': 4, 'min_child_weight': 2, 'subsample': 0.7050329846498063, 'colsample_bytree': 0.8543431050238692, 'reg_alpha': 0.690852789037751, 'reg_lambda': 7.731765555488504, 'gamma': 2.4282759277991675, 'scale_pos_weight': 15.637918330757373}. Best is trial 25 with value: 0.13919481883456017.
[I 2025-12-04 04:55:11,577] Trial 26 finished with value: 0.11375749310877037 and parameters: {'n_estimators': 172, 'learning_rate': 0.14949351945578515, 'max_depth': 4, 'min_child_weight': 2, 'subsample': 0.6011638897591874, 'colsample_bytree': 0.827773467283554, 'reg_alpha': 0.7052843975506529, 'reg_lambda': 7.648867649474723, 'gamma': 2.345718238988113, 'scale_pos_weight': 16.459218838368592}. Best is trial 25 with value: 0.13919481883456017.
[I 2025-12-04 04:55:34,253] Trial 27 finished with value: 0.11996172654620621 and parameters: {'n_estimators': 261, 'learning_rate': 0.04694572810760866, 'max_depth': 4, 'min_child_weight': 2, 'subsample': 0.6378306384020933, 'colsample_bytree': 0.9998764035087175, 'reg_alpha': 0.9221330589722675, 'reg_lambda': 5.039514840062368, 'gamma': 2.0012287988954682, 'scale_pos_weight': 21.21813267990585}. Best is trial 25 with value: 0.13919481883456017.
