[I 2025-12-04 06:11:50,895] Trial 2 finished with value: 0.09581481980737501 and parameters: {'n_layers': 2, 'layer_0_size': 113, 'layer_1_size': 161, 'activation': 'relu', 'alpha': 0.00043776834969465827, 'learning_rate': 'adaptive', 'solver': 'sgd', 'learning_rate_init': 0.011185986735825963, 'max_iter': 859}. Best is trial 2 with value: 0.09581481980737501.
[I 2025-12-04 06:14:16,072] Trial 3 finished with value: 0.08132969152500719 and parameters: {'n_layers': 3, 'layer_0_size': 98, 'layer_1_size': 128, 'layer_2_size': 41, 'activation': 'tanh', 'alpha': 0.0006909962049420615, 'learning_rate': 'invscaling', 'solver': 'lbfgs', 'learning_rate_init': 0.0005342531011415677, 'max_iter': 633}. Best is trial 2 with value: 0.09581481980737501.
[I 2025-12-04 06:18:46,960] Trial 4 finished with value: 0.09127550700135219 and parameters: {'n_layers': 3, 'layer_0_size': 178, 'layer_1_size': 148, 'layer_2_size': 162, 'activation': 'tanh', 'alpha': 0.044824222056208375, 'learning_rate': 'adaptive', 'solver': 'adam', 'learning_rate_init': 0.0016466697049030716, 'max_iter': 529}. Best is trial 2 with value: 0.09581481980737501.
[I 2025-12-04 06:22:16,163] Trial 5 finished with value: 0.10002238907505186 and parameters: {'n_layers': 3, 'layer_0_size': 115, 'layer_1_size': 121, 'layer_2_size': 140, 'activation': 'relu', 'alpha': 0.01986874048503198, 'learning_rate': 'constant', 'solver': 'adam', 'learning_rate_init': 0.0002499060138840928, 'max_iter': 654}. Best is trial 5 with value: 0.10002238907505186.
[I 2025-12-04 06:23:25,085] Trial 6 finished with value: 0.05857746276236568 and parameters: {'n_layers': 3, 'layer_0_size': 93, 'layer_1_size': 90, 'layer_2_size': 39, 'activation': 'logistic', 'alpha': 0.0023685871663764978, 'learning_rate': 'adaptive', 'solver': 'lbfgs', 'learning_rate_init': 0.0024072213392414927, 'max_iter': 901}. Best is trial 5 with value: 0.10002238907505186.
[I 2025-12-04 06:25:54,497] Trial 7 finished with value: 0.07379760042511821 and parameters: {'n_layers': 3, 'layer_0_size': 60, 'layer_1_size': 160, 'layer_2_size': 88, 'activation': 'tanh', 'alpha': 0.08198998577843385, 'learning_rate': 'invscaling', 'solver': 'sgd', 'learning_rate_init': 0.00035330013664463844, 'max_iter': 970}. Best is trial 5 with value: 0.10002238907505186.
[I 2025-12-04 06:31:13,745] Trial 8 finished with value: 0.08604196521924787 and parameters: {'n_layers': 3, 'layer_0_size': 70, 'layer_1_size': 51, 'layer_2_size': 145, 'activation': 'relu', 'alpha': 0.08509097396376525, 'learning_rate': 'adaptive', 'solver': 'lbfgs', 'learning_rate_init': 0.00013522990807206207, 'max_iter': 491}. Best is trial 5 with value: 0.10002238907505186.
[I 2025-12-04 06:34:16,265] Trial 9 finished with value: 0.10414870626519583 and parameters: {'n_layers': 2, 'layer_0_size': 199, 'layer_1_size': 73, 'activation': 'relu', 'alpha': 1.0169932076104148e-05, 'learning_rate': 'adaptive', 'solver': 'adam', 'learning_rate_init': 0.000420281777526548, 'max_iter': 726}. Best is trial 9 with value: 0.10414870626519583.
[I 2025-12-04 06:34:20,736] Trial 10 finished with value: 0.10919778375202975 and parameters: {'n_layers': 1, 'layer_0_size': 155, 'activation': 'relu', 'alpha': 1.0339070879207914e-05, 'learning_rate': 'constant', 'solver': 'adam', 'learning_rate_init': 0.028989202056505604, 'max_iter': 262}. Best is trial 10 with value: 0.10919778375202975.
[I 2025-12-04 06:34:45,900] Trial 11 finished with value: 0.1083137672866951 and parameters: {'n_layers': 1, 'layer_0_size': 195, 'activation': 'relu', 'alpha': 1.001737874879645e-05, 'learning_rate': 'constant', 'solver': 'adam', 'learning_rate_init': 0.09898996388935292, 'max_iter': 239}. Best is trial 10 with value: 0.10919778375202975.
[I 2025-12-04 06:34:48,812] Trial 12 finished with value: 0.10754543658585544 and parameters: {'n_layers': 1, 'layer_0_size': 149, 'activation': 'relu', 'alpha': 1.0191104278593755e-05, 'learning_rate': 'constant', 'solver': 'adam', 'learning_rate_init': 0.08920340937202077, 'max_iter': 248}. Best is trial 10 with value: 0.10919778375202975.
[I 2025-12-04 06:34:51,296] Trial 13 finished with value: 0.11498468431485118 and parameters: {'n_layers': 1, 'layer_0_size': 144, 'activation': 'relu', 'alpha': 5.6479188615778106e-05, 'learning_rate': 'constant', 'solver': 'adam', 'learning_rate_init': 0.09226598884189768, 'max_iter': 227}. Best is trial 13 with value: 0.11498468431485118.
[I 2025-12-04 06:37:08,871] Trial 14 finished with value: 0.08369155912602426 and parameters: {'n_layers': 2, 'layer_0_size': 141, 'layer_1_size': 182, 'activation': 'logistic', 'alpha': 7.513773083608949e-05, 'learning_rate': 'constant', 'solver': 'adam', 'learning_rate_init': 0.021555157236262796, 'max_iter': 371}. Best is trial 13 with value: 0.11498468431485118.
[I 2025-12-04 06:37:13,062] Trial 15 finished with value: 0.0934164885033493 and parameters: {'n_layers': 1, 'layer_0_size': 139, 'activation': 'relu', 'alpha': 5.011534388749585e-05, 'learning_rate': 'constant', 'solver': 'adam', 'learning_rate_init': 0.024399925934628093, 'max_iter': 347}. Best is trial 13 with value: 0.11498468431485118.
[I 2025-12-04 06:38:12,821] Trial 16 finished with value: 0.09496444722623476 and parameters: {'n_layers': 1, 'layer_0_size': 165, 'activation': 'relu', 'alpha': 3.528849668054352e-05, 'learning_rate': 'constant', 'solver': 'adam', 'learning_rate_init': 0.006392501926506245, 'max_iter': 320}. Best is trial 13 with value: 0.11498468431485118.
[I 2025-12-04 06:38:18,596] Trial 17 finished with value: 0.09720224386064177 and parameters: {'n_layers': 1, 'layer_0_size': 28, 'activation': 'relu', 'alpha': 0.00016687116176914522, 'learning_rate': 'constant', 'solver': 'sgd', 'learning_rate_init': 0.04277074267947489, 'max_iter': 211}. Best is trial 13 with value: 0.11498468431485118.
[I 2025-12-04 06:38:57,101] Trial 18 finished with value: 0.07894374470557633 and parameters: {'n_layers': 2, 'layer_0_size': 137, 'layer_1_size': 194, 'activation': 'tanh', 'alpha': 0.005511245154679988, 'learning_rate': 'constant', 'solver': 'adam', 'learning_rate_init': 0.04108602525139506, 'max_iter': 427}. Best is trial 13 with value: 0.11498468431485118.
[I 2025-12-04 06:39:07,050] Trial 19 finished with value: 0.09542157327217202 and parameters: {'n_layers': 1, 'layer_0_size': 122, 'activation': 'logistic', 'alpha': 3.0207422978111474e-05, 'learning_rate': 'invscaling', 'solver': 'adam', 'learning_rate_init': 0.005904034493670101, 'max_iter': 307}. Best is trial 13 with value: 0.11498468431485118.
[I 2025-12-04 06:39:14,145] Trial 20 finished with value: 0.1039108437339149 and parameters: {'n_layers': 2, 'layer_0_size': 156, 'layer_1_size': 10, 'activation': 'relu', 'alpha': 0.0002488080015089962, 'learning_rate': 'constant', 'solver': 'sgd', 'learning_rate_init': 0.04623830228109157, 'max_iter': 408}. Best is trial 13 with value: 0.11498468431485118.
[I 2025-12-04 06:39:31,793] Trial 21 finished with value: 0.09887735779348972 and parameters: {'n_layers': 1, 'layer_0_size': 198, 'activation': 'relu', 'alpha': 2.1725787395110457e-05, 'learning_rate': 'constant', 'solver': 'adam', 'learning_rate_init': 0.09141124227256141, 'max_iter': 207}. Best is trial 13 with value: 0.11498468431485118.
[I 2025-12-04 06:40:03,041] Trial 22 finished with value: 0.10948033298431384 and parameters: {'n_layers': 1, 'layer_0_size': 180, 'activation': 'relu', 'alpha': 2.0040864635122578e-05, 'learning_rate': 'constant', 'solver': 'adam', 'learning_rate_init': 0.088001307743193, 'max_iter': 280}. Best is trial 13 with value: 0.11498468431485118.
[I 2025-12-04 06:40:47,015] Trial 23 finished with value: 0.10811463403352597 and parameters: {'n_layers': 1, 'layer_0_size': 180, 'activation': 'relu', 'alpha': 2.2668166674827413e-05, 'learning_rate': 'constant', 'solver': 'adam', 'learning_rate_init': 0.019458338182649765, 'max_iter': 294}. Best is trial 13 with value: 0.11498468431485118.
[I 2025-12-04 06:41:30,219] Trial 24 finished with value: 0.09336179280867676 and parameters: {'n_layers': 1, 'layer_0_size': 175, 'activation': 'relu', 'alpha': 7.621688177751167e-05, 'learning_rate': 'constant', 'solver': 'adam', 'learning_rate_init': 0.048457691336941826, 'max_iter': 285}. Best is trial 13 with value: 0.11498468431485118.
[I 2025-12-04 06:41:35,839] Trial 25 finished with value: 0.09428155835260331 and parameters: {'n_layers': 2, 'layer_0_size': 131, 'layer_1_size': 48, 'activation': 'relu', 'alpha': 2.030586696338197e-05, 'learning_rate': 'constant', 'solver': 'adam', 'learning_rate_init': 0.012499844056692001, 'max_iter': 578}. Best is trial 13 with value: 0.11498468431485118.
[I 2025-12-04 06:41:40,301] Trial 26 finished with value: 0.09349724135784132 and parameters: {'n_layers': 1, 'layer_0_size': 155, 'activation': 'relu', 'alpha': 7.480114022474884e-05, 'learning_rate': 'invscaling', 'solver': 'adam', 'learning_rate_init': 0.05765945108734041, 'max_iter': 393}. Best is trial 13 with value: 0.11498468431485118.
[I 2025-12-04 06:42:25,397] Trial 27 finished with value: 0.10462646591375906 and parameters: {'n_layers': 1, 'layer_0_size': 183, 'activation': 'relu', 'alpha': 0.0014338023996269275, 'learning_rate': 'constant', 'solver': 'adam', 'learning_rate_init': 0.029236834794759234, 'max_iter': 266}. Best is trial 13 with value: 0.11498468431485118.
[I 2025-12-04 06:42:31,594] Trial 28 finished with value: 0.10618991781704082 and parameters: {'n_layers': 2, 'layer_0_size': 84, 'layer_1_size': 97, 'activation': 'tanh', 'alpha': 0.00020679350314389301, 'learning_rate': 'constant', 'solver': 'adam', 'learning_rate_init': 0.012374286389658025, 'max_iter': 200}. Best is trial 13 with value: 0.11498468431485118.
[I 2025-12-04 06:46:59,848] Trial 29 finished with value: 0.08988722551591856 and parameters: {'n_layers': 1, 'layer_0_size': 163, 'activation': 'logistic', 'alpha': 0.0001123097813958203, 'learning_rate': 'constant', 'solver': 'sgd', 'learning_rate_init': 0.0712265103332044, 'max_iter': 348}. Best is trial 13 with value: 0.11498468431485118.
[I 2025-12-04 06:47:01,586] A new study created in memory with name: multi_layer_perceptron_fold_3
[I 2025-12-04 06:47:06,417] Trial 0 finished with value: 0.06971310153405828 and parameters: {'n_layers': 3, 'layer_0_size': 37, 'layer_1_size': 69, 'layer_2_size': 130, 'activation': 'logistic', 'alpha': 0.08762377369554836, 'learning_rate': 'constant', 'solver': 'lbfgs', 'learning_rate_init': 0.0032938362602970795, 'max_iter': 761}. Best is trial 0 with value: 0.06971310153405828.
[I 2025-12-04 06:48:01,075] Trial 1 finished with value: 0.13568305476659592 and parameters: {'n_layers': 2, 'layer_0_size': 180, 'layer_1_size': 11, 'activation': 'logistic', 'alpha': 0.0009297398079360896, 'learning_rate': 'constant', 'solver': 'sgd', 'learning_rate_init': 0.005016693116944345, 'max_iter': 521}. Best is trial 1 with value: 0.13568305476659592.
[I 2025-12-04 06:51:40,612] Trial 2 finished with value: 0.08924958931211789 and parameters: {'n_layers': 3, 'layer_0_size': 182, 'layer_1_size': 154, 'layer_2_size': 176, 'activation': 'tanh', 'alpha': 0.0015935380795998055, 'learning_rate': 'invscaling', 'solver': 'lbfgs', 'learning_rate_init': 0.018191244871349443, 'max_iter': 327}. Best is trial 1 with value: 0.13568305476659592.
[I 2025-12-04 06:59:55,473] Trial 3 finished with value: 0.11531488635359541 and parameters: {'n_layers': 2, 'layer_0_size': 177, 'layer_1_size': 162, 'activation': 'relu', 'alpha': 0.00026285670939728837, 'learning_rate': 'constant', 'solver': 'adam', 'learning_rate_init': 0.00016824843234685221, 'max_iter': 787}. Best is trial 1 with value: 0.13568305476659592.
[I 2025-12-04 07:00:00,741] Trial 4 finished with value: 0.11037169310663922 and parameters: {'n_layers': 1, 'layer_0_size': 76, 'activation': 'relu', 'alpha': 0.005568165066679337, 'learning_rate': 'constant', 'solver': 'sgd', 'learning_rate_init': 0.08450882289916181, 'max_iter': 592}. Best is trial 1 with value: 0.13568305476659592.
[I 2025-12-04 07:00:04,766] Trial 5 finished with value: 0.11473768634283119 and parameters: {'n_layers': 1, 'layer_0_size': 115, 'activation': 'relu', 'alpha': 6.111699042429962e-05, 'learning_rate': 'invscaling', 'solver': 'adam', 'learning_rate_init': 0.02120897668330886, 'max_iter': 995}. Best is trial 1 with value: 0.13568305476659592.
[I 2025-12-04 07:01:24,631] Trial 6 finished with value: 0.1426741826866938 and parameters: {'n_layers': 3, 'layer_0_size': 135, 'layer_1_size': 134, 'layer_2_size': 146, 'activation': 'logistic', 'alpha': 0.03162274936883866, 'learning_rate': 'adaptive', 'solver': 'adam', 'learning_rate_init': 0.03652800204156811, 'max_iter': 553}. Best is trial 6 with value: 0.1426741826866938.
[I 2025-12-04 07:01:26,552] Trial 7 finished with value: 0.05877999568491854 and parameters: {'n_layers': 3, 'layer_0_size': 15, 'layer_1_size': 84, 'layer_2_size': 69, 'activation': 'logistic', 'alpha': 0.002513533839452575, 'learning_rate': 'constant', 'solver': 'lbfgs', 'learning_rate_init': 0.04954442606193861, 'max_iter': 624}. Best is trial 6 with value: 0.1426741826866938.
[I 2025-12-04 07:01:49,990] Trial 8 finished with value: 0.1479706010425391 and parameters: {'n_layers': 1, 'layer_0_size': 180, 'activation': 'relu', 'alpha': 0.00013103312205029068, 'learning_rate': 'invscaling', 'solver': 'sgd', 'learning_rate_init': 0.08837010705534191, 'max_iter': 801}. Best is trial 8 with value: 0.1479706010425391.
[I 2025-12-04 07:01:52,764] Trial 9 finished with value: 0.0717128768058414 and parameters: {'n_layers': 2, 'layer_0_size': 41, 'layer_1_size': 149, 'activation': 'logistic', 'alpha': 0.05633482944827404, 'learning_rate': 'constant', 'solver': 'sgd', 'learning_rate_init': 0.00029213736151727097, 'max_iter': 370}. Best is trial 8 with value: 0.1479706010425391.
[I 2025-12-04 07:02:06,581] Trial 10 finished with value: 0.07402924518225881 and parameters: {'n_layers': 1, 'layer_0_size': 141, 'activation': 'tanh', 'alpha': 1.494006061373327e-05, 'learning_rate': 'invscaling', 'solver': 'sgd', 'learning_rate_init': 0.0007944405186391424, 'max_iter': 979}. Best is trial 8 with value: 0.1479706010425391.
[I 2025-12-04 07:04:18,120] Trial 11 finished with value: 0.11602950278110521 and parameters: {'n_layers': 2, 'layer_0_size': 139, 'layer_1_size': 189, 'activation': 'relu', 'alpha': 0.014537959802083326, 'learning_rate': 'adaptive', 'solver': 'adam', 'learning_rate_init': 0.014842809724568572, 'max_iter': 793}. Best is trial 8 with value: 0.1479706010425391.
[I 2025-12-04 07:05:19,758] Trial 12 finished with value: 0.10453489912874545 and parameters: {'n_layers': 3, 'layer_0_size': 144, 'layer_1_size': 115, 'layer_2_size': 13, 'activation': 'logistic', 'alpha': 0.0002521536141562242, 'learning_rate': 'adaptive', 'solver': 'adam', 'learning_rate_init': 0.09434143777374963, 'max_iter': 450}. Best is trial 8 with value: 0.1479706010425391.
[I 2025-12-04 07:09:01,637] Trial 13 finished with value: 0.11528301736735587 and parameters: {'n_layers': 1, 'layer_0_size': 199, 'activation': 'relu', 'alpha': 0.00020149502255157096, 'learning_rate': 'adaptive', 'solver': 'sgd', 'learning_rate_init': 0.031924571719758044, 'max_iter': 238}. Best is trial 8 with value: 0.1479706010425391.
[I 2025-12-04 07:09:06,991] Trial 14 finished with value: 0.095388527252411 and parameters: {'n_layers': 2, 'layer_0_size': 101, 'layer_1_size': 31, 'activation': 'tanh', 'alpha': 4.9541804232418764e-05, 'learning_rate': 'adaptive', 'solver': 'adam', 'learning_rate_init': 0.00927630379337706, 'max_iter': 683}. Best is trial 8 with value: 0.1479706010425391.
[I 2025-12-04 07:09:59,020] Trial 15 finished with value: 0.06573365055286111 and parameters: {'n_layers': 3, 'layer_0_size': 157, 'layer_1_size': 113, 'layer_2_size': 192, 'activation': 'logistic', 'alpha': 0.01717519567709118, 'learning_rate': 'invscaling', 'solver': 'sgd', 'learning_rate_init': 0.0017489968707524058, 'max_iter': 869}. Best is trial 8 with value: 0.1479706010425391.
[I 2025-12-04 07:10:02,718] Trial 16 finished with value: 0.13801261176944868 and parameters: {'n_layers': 1, 'layer_0_size': 111, 'activation': 'relu', 'alpha': 0.0007927968382654701, 'learning_rate': 'invscaling', 'solver': 'adam', 'learning_rate_init': 0.05490554409508619, 'max_iter': 495}. Best is trial 8 with value: 0.1479706010425391.
[I 2025-12-04 07:15:44,044] Trial 17 finished with value: 0.12094061119680122 and parameters: {'n_layers': 2, 'layer_0_size': 80, 'layer_1_size': 193, 'activation': 'relu', 'alpha': 7.119002359997705e-05, 'learning_rate': 'adaptive', 'solver': 'sgd', 'learning_rate_init': 0.009284750957938324, 'max_iter': 679}. Best is trial 8 with value: 0.1479706010425391.
[I 2025-12-04 07:17:25,270] Trial 18 finished with value: 0.08425160279744226 and parameters: {'n_layers': 3, 'layer_0_size': 161, 'layer_1_size': 59, 'layer_2_size': 118, 'activation': 'logistic', 'alpha': 1.3449176068887508e-05, 'learning_rate': 'adaptive', 'solver': 'adam', 'learning_rate_init': 0.036643878735331994, 'max_iter': 888}. Best is trial 8 with value: 0.1479706010425391.
[I 2025-12-04 07:17:57,119] Trial 19 finished with value: 0.09265286987832512 and parameters: {'n_layers': 1, 'layer_0_size': 126, 'activation': 'tanh', 'alpha': 0.006171672704367698, 'learning_rate': 'invscaling', 'solver': 'lbfgs', 'learning_rate_init': 0.0016139346947189762, 'max_iter': 612}. Best is trial 8 with value: 0.1479706010425391.
[I 2025-12-04 07:22:25,436] Trial 20 finished with value: 0.12762907572305043 and parameters: {'n_layers': 2, 'layer_0_size': 199, 'layer_1_size': 133, 'activation': 'logistic', 'alpha': 0.022049738528794962, 'learning_rate': 'adaptive', 'solver': 'adam', 'learning_rate_init': 0.0076708347373035, 'max_iter': 894}. Best is trial 8 with value: 0.1479706010425391.
[I 2025-12-04 07:22:28,704] Trial 21 finished with value: 0.10909406930193259 and parameters: {'n_layers': 1, 'layer_0_size': 98, 'activation': 'relu', 'alpha': 0.000665716594372619, 'learning_rate': 'invscaling', 'solver': 'adam', 'learning_rate_init': 0.05707595332648424, 'max_iter': 500}. Best is trial 8 with value: 0.1479706010425391.
[I 2025-12-04 07:22:30,777] Trial 22 finished with value: 0.1297681213533882 and parameters: {'n_layers': 1, 'layer_0_size': 82, 'activation': 'relu', 'alpha': 0.0004124650733191196, 'learning_rate': 'invscaling', 'solver': 'adam', 'learning_rate_init': 0.09939326472764297, 'max_iter': 423}. Best is trial 8 with value: 0.1479706010425391.
[I 2025-12-04 07:22:34,137] Trial 23 finished with value: 0.10918682859024001 and parameters: {'n_layers': 1, 'layer_0_size': 115, 'activation': 'relu', 'alpha': 0.0001119559497870717, 'learning_rate': 'invscaling', 'solver': 'adam', 'learning_rate_init': 0.03393136408041872, 'max_iter': 521}. Best is trial 8 with value: 0.1479706010425391.
[I 2025-12-04 07:23:15,821] Trial 24 finished with value: 0.13560608325415774 and parameters: {'n_layers': 1, 'layer_0_size': 161, 'activation': 'relu', 'alpha': 0.0034133543500454644, 'learning_rate': 'invscaling', 'solver': 'adam', 'learning_rate_init': 0.05675308452897869, 'max_iter': 711}. Best is trial 8 with value: 0.1479706010425391.
[I 2025-12-04 07:23:17,760] Trial 25 finished with value: 0.11682863297680639 and parameters: {'n_layers': 1, 'layer_0_size': 129, 'activation': 'relu', 'alpha': 0.0006017417112893813, 'learning_rate': 'invscaling', 'solver': 'sgd', 'learning_rate_init': 0.028338159739616356, 'max_iter': 549}. Best is trial 8 with value: 0.1479706010425391.
[I 2025-12-04 07:23:23,377] Trial 26 finished with value: 0.11217646216617616 and parameters: {'n_layers': 2, 'layer_0_size': 65, 'layer_1_size': 97, 'activation': 'relu', 'alpha': 2.8517413510449797e-05, 'learning_rate': 'invscaling', 'solver': 'adam', 'learning_rate_init': 0.014633140059918254, 'max_iter': 437}. Best is trial 8 with value: 0.1479706010425391.
[I 2025-12-04 07:24:18,199] Trial 27 finished with value: 0.06448043527912409 and parameters: {'n_layers': 2, 'layer_0_size': 111, 'layer_1_size': 175, 'activation': 'relu', 'alpha': 0.00012659426227280067, 'learning_rate': 'adaptive', 'solver': 'adam', 'learning_rate_init': 0.06040090163382557, 'max_iter': 316}. Best is trial 8 with value: 0.1479706010425391.
[I 2025-12-04 07:24:46,366] Trial 28 finished with value: 0.09252426575343738 and parameters: {'n_layers': 1, 'layer_0_size': 93, 'activation': 'tanh', 'alpha': 0.0014953982460236246, 'learning_rate': 'invscaling', 'solver': 'lbfgs', 'learning_rate_init': 0.021964922452774597, 'max_iter': 589}. Best is trial 8 with value: 0.1479706010425391.
[I 2025-12-04 07:26:30,804] Trial 29 finished with value: 0.06263947327920658 and parameters: {'n_layers': 3, 'layer_0_size': 61, 'layer_1_size': 135, 'layer_2_size': 144, 'activation': 'logistic', 'alpha': 0.04646930831129689, 'learning_rate': 'adaptive', 'solver': 'sgd', 'learning_rate_init': 0.003687714676954024, 'max_iter': 740}. Best is trial 8 with value: 0.1479706010425391.
[I 2025-12-04 07:26:36,509] A new study created in memory with name: multi_layer_perceptron_fold_4
[I 2025-12-04 07:27:04,883] Trial 0 finished with value: 0.13281239278757978 and parameters: {'n_layers': 1, 'layer_0_size': 110, 'activation': 'relu', 'alpha': 0.051942703478159456, 'learning_rate': 'adaptive', 'solver': 'adam', 'learning_rate_init': 0.0003371839476116518, 'max_iter': 612}. Best is trial 0 with value: 0.13281239278757978.
[I 2025-12-04 07:30:37,425] Trial 1 finished with value: 0.18139373357729402 and parameters: {'n_layers': 2, 'layer_0_size': 136, 'layer_1_size': 197, 'activation': 'logistic', 'alpha': 6.29476274585147e-05, 'learning_rate': 'constant', 'solver': 'adam', 'learning_rate_init': 0.00011467997654530301, 'max_iter': 660}. Best is trial 1 with value: 0.18139373357729402.
