[I 2025-12-04 00:38:38,459] Trial 18 finished with value: 0.16316641830567297 and parameters: {'max_iter': 175, 'learning_rate': 0.11174211683452573, 'max_depth': 3, 'min_samples_leaf': 9, 'l2_regularization': 0.5461916029001264}. Best is trial 17 with value: 0.1757305020475313.
[I 2025-12-04 00:38:39,331] Trial 19 finished with value: 0.15941987467667348 and parameters: {'max_iter': 130, 'learning_rate': 0.05697550024396862, 'max_depth': 5, 'min_samples_leaf': 27, 'l2_regularization': 0.5203830510249288}. Best is trial 17 with value: 0.1757305020475313.
[I 2025-12-04 00:38:40,714] Trial 20 finished with value: 0.13598033013313968 and parameters: {'max_iter': 177, 'learning_rate': 0.1737637026315485, 'max_depth': 5, 'min_samples_leaf': 11, 'l2_regularization': 0.39347745967666053}. Best is trial 17 with value: 0.1757305020475313.
[I 2025-12-04 00:38:41,418] Trial 21 finished with value: 0.16845598440950577 and parameters: {'max_iter': 165, 'learning_rate': 0.044175767431697786, 'max_depth': 3, 'min_samples_leaf': 5, 'l2_regularization': 0.997996142082452}. Best is trial 17 with value: 0.1757305020475313.
[I 2025-12-04 00:38:42,067] Trial 22 finished with value: 0.1669936082248702 and parameters: {'max_iter': 166, 'learning_rate': 0.05110960911420062, 'max_depth': 3, 'min_samples_leaf': 6, 'l2_regularization': 0.8095481674136381}. Best is trial 17 with value: 0.1757305020475313.
[I 2025-12-04 00:38:42,874] Trial 23 finished with value: 0.16349875152058757 and parameters: {'max_iter': 142, 'learning_rate': 0.10814152238562318, 'max_depth': 4, 'min_samples_leaf': 13, 'l2_regularization': 0.9088854660067255}. Best is trial 17 with value: 0.1757305020475313.
[I 2025-12-04 00:38:44,632] Trial 24 finished with value: 0.16522628928357191 and parameters: {'max_iter': 187, 'learning_rate': 0.041007741511369086, 'max_depth': 6, 'min_samples_leaf': 6, 'l2_regularization': 0.6161001905494451}. Best is trial 17 with value: 0.1757305020475313.
[I 2025-12-04 00:38:45,612] Trial 25 finished with value: 0.159798044006581 and parameters: {'max_iter': 168, 'learning_rate': 0.07271282378115516, 'max_depth': 4, 'min_samples_leaf': 23, 'l2_regularization': 0.7370875172709741}. Best is trial 17 with value: 0.1757305020475313.
[I 2025-12-04 00:38:46,164] Trial 26 finished with value: 0.16645430221430796 and parameters: {'max_iter': 114, 'learning_rate': 0.10787123132645163, 'max_depth': 3, 'min_samples_leaf': 14, 'l2_regularization': 0.9136115227557483}. Best is trial 17 with value: 0.1757305020475313.
[I 2025-12-04 00:38:47,637] Trial 27 finished with value: 0.16017673678702896 and parameters: {'max_iter': 141, 'learning_rate': 0.029009839305226572, 'max_depth': 6, 'min_samples_leaf': 6, 'l2_regularization': 0.1573696915024057}. Best is trial 17 with value: 0.1757305020475313.
[I 2025-12-04 00:38:48,315] Trial 28 finished with value: 0.1726032420874723 and parameters: {'max_iter': 91, 'learning_rate': 0.06777095016873166, 'max_depth': 4, 'min_samples_leaf': 19, 'l2_regularization': 0.768124748582051}. Best is trial 17 with value: 0.1757305020475313.
[I 2025-12-04 00:38:48,989] Trial 29 finished with value: 0.16608358920730565 and parameters: {'max_iter': 95, 'learning_rate': 0.06551194479185399, 'max_depth': 4, 'min_samples_leaf': 19, 'l2_regularization': 0.7855301448375316}. Best is trial 17 with value: 0.1757305020475313.
[I 2025-12-04 00:38:49,599] A new study created in memory with name: histogram_gradient_boosting_fold_5
[I 2025-12-04 00:38:51,656] Trial 0 finished with value: 0.11381131047498502 and parameters: {'max_iter': 192, 'learning_rate': 0.17083761634164674, 'max_depth': 15, 'min_samples_leaf': 30, 'l2_regularization': 0.5044088013533958}. Best is trial 0 with value: 0.11381131047498502.
[I 2025-12-04 00:38:52,964] Trial 1 finished with value: 0.12902608921554704 and parameters: {'max_iter': 112, 'learning_rate': 0.08618401300705679, 'max_depth': 11, 'min_samples_leaf': 43, 'l2_regularization': 0.23323023298775813}. Best is trial 1 with value: 0.12902608921554704.
[I 2025-12-04 00:38:54,464] Trial 2 finished with value: 0.1151683807833066 and parameters: {'max_iter': 139, 'learning_rate': 0.20213660371800402, 'max_depth': 7, 'min_samples_leaf': 3, 'l2_regularization': 0.49403613472129326}. Best is trial 1 with value: 0.12902608921554704.
[I 2025-12-04 00:38:55,292] Trial 3 finished with value: 0.10521698990155137 and parameters: {'max_iter': 119, 'learning_rate': 0.2704509179651699, 'max_depth': 4, 'min_samples_leaf': 7, 'l2_regularization': 0.6121748976897579}. Best is trial 1 with value: 0.12902608921554704.
[I 2025-12-04 00:38:55,881] Trial 4 finished with value: 0.13319133369186048 and parameters: {'max_iter': 60, 'learning_rate': 0.102045816790222, 'max_depth': 5, 'min_samples_leaf': 50, 'l2_regularization': 0.5200187249440463}. Best is trial 4 with value: 0.13319133369186048.
[I 2025-12-04 00:38:56,828] Trial 5 finished with value: 0.11774928030172986 and parameters: {'max_iter': 82, 'learning_rate': 0.11136129015427045, 'max_depth': 9, 'min_samples_leaf': 7, 'l2_regularization': 0.011133781617785776}. Best is trial 4 with value: 0.13319133369186048.
[I 2025-12-04 00:38:57,772] Trial 6 finished with value: 0.13955537771882837 and parameters: {'max_iter': 80, 'learning_rate': 0.040433476108901245, 'max_depth': 9, 'min_samples_leaf': 38, 'l2_regularization': 0.12769381153058845}. Best is trial 6 with value: 0.13955537771882837.
[I 2025-12-04 00:38:58,762] Trial 7 finished with value: 0.11270471398267805 and parameters: {'max_iter': 92, 'learning_rate': 0.2914228179900224, 'max_depth': 6, 'min_samples_leaf': 29, 'l2_regularization': 0.9430561256313023}. Best is trial 6 with value: 0.13955537771882837.
[I 2025-12-04 00:39:00,549] Trial 8 finished with value: 0.11488027977449863 and parameters: {'max_iter': 169, 'learning_rate': 0.13823587241089244, 'max_depth': 14, 'min_samples_leaf': 26, 'l2_regularization': 0.4930306175826322}. Best is trial 6 with value: 0.13955537771882837.
[I 2025-12-04 00:39:01,990] Trial 9 finished with value: 0.11717342318592902 and parameters: {'max_iter': 119, 'learning_rate': 0.2168751793301688, 'max_depth': 14, 'min_samples_leaf': 19, 'l2_regularization': 0.7434052841988781}. Best is trial 6 with value: 0.13955537771882837.
[I 2025-12-04 00:39:02,770] Trial 10 finished with value: 0.13582927696579278 and parameters: {'max_iter': 52, 'learning_rate': 0.018508112004719114, 'max_depth': 11, 'min_samples_leaf': 40, 'l2_regularization': 0.21538490832369356}. Best is trial 6 with value: 0.13955537771882837.
[I 2025-12-04 00:39:03,540] Trial 11 finished with value: 0.13138329003466512 and parameters: {'max_iter': 52, 'learning_rate': 0.011553264511433702, 'max_depth': 10, 'min_samples_leaf': 39, 'l2_regularization': 0.18728787404146793}. Best is trial 6 with value: 0.13955537771882837.
[I 2025-12-04 00:39:04,570] Trial 12 finished with value: 0.1377011688902034 and parameters: {'max_iter': 77, 'learning_rate': 0.014342613139724937, 'max_depth': 12, 'min_samples_leaf': 38, 'l2_regularization': 0.26489760944130336}. Best is trial 6 with value: 0.13955537771882837.
[I 2025-12-04 00:39:05,471] Trial 13 finished with value: 0.13492777595000066 and parameters: {'max_iter': 86, 'learning_rate': 0.05347674331870818, 'max_depth': 8, 'min_samples_leaf': 35, 'l2_regularization': 0.006080926203787265}. Best is trial 6 with value: 0.13955537771882837.
[I 2025-12-04 00:39:06,504] Trial 14 finished with value: 0.14556362178766427 and parameters: {'max_iter': 76, 'learning_rate': 0.05587559968961156, 'max_depth': 12, 'min_samples_leaf': 18, 'l2_regularization': 0.2981838147882865}. Best is trial 14 with value: 0.14556362178766427.
[I 2025-12-04 00:39:08,240] Trial 15 finished with value: 0.13830016361774616 and parameters: {'max_iter': 143, 'learning_rate': 0.061413612724710104, 'max_depth': 12, 'min_samples_leaf': 18, 'l2_regularization': 0.3163709467515494}. Best is trial 14 with value: 0.14556362178766427.
[I 2025-12-04 00:39:09,406] Trial 16 finished with value: 0.13671707969953106 and parameters: {'max_iter': 104, 'learning_rate': 0.07236794160101714, 'max_depth': 9, 'min_samples_leaf': 18, 'l2_regularization': 0.09430669060200808}. Best is trial 14 with value: 0.14556362178766427.
[I 2025-12-04 00:39:10,411] Trial 17 finished with value: 0.14237472044100313 and parameters: {'max_iter': 70, 'learning_rate': 0.04397737275863347, 'max_depth': 13, 'min_samples_leaf': 12, 'l2_regularization': 0.37040561960803176}. Best is trial 14 with value: 0.14556362178766427.
[I 2025-12-04 00:39:11,335] Trial 18 finished with value: 0.1310879166102859 and parameters: {'max_iter': 65, 'learning_rate': 0.1264960289786593, 'max_depth': 13, 'min_samples_leaf': 12, 'l2_regularization': 0.37218616249212233}. Best is trial 14 with value: 0.14556362178766427.
[I 2025-12-04 00:39:12,616] Trial 19 finished with value: 0.11899687504010074 and parameters: {'max_iter': 97, 'learning_rate': 0.1628200502938198, 'max_depth': 15, 'min_samples_leaf': 13, 'l2_regularization': 0.37973389146480596}. Best is trial 14 with value: 0.14556362178766427.
[I 2025-12-04 00:39:13,592] Trial 20 finished with value: 0.1414245245724224 and parameters: {'max_iter': 69, 'learning_rate': 0.041175178581329235, 'max_depth': 13, 'min_samples_leaf': 22, 'l2_regularization': 0.6867695330649446}. Best is trial 14 with value: 0.14556362178766427.
[I 2025-12-04 00:39:14,612] Trial 21 finished with value: 0.1411524653329192 and parameters: {'max_iter': 76, 'learning_rate': 0.04676216486795914, 'max_depth': 13, 'min_samples_leaf': 21, 'l2_regularization': 0.727974265653566}. Best is trial 14 with value: 0.14556362178766427.
[I 2025-12-04 00:39:15,577] Trial 22 finished with value: 0.14226304887590088 and parameters: {'max_iter': 67, 'learning_rate': 0.08858230726041268, 'max_depth': 13, 'min_samples_leaf': 12, 'l2_regularization': 0.7831978992078472}. Best is trial 14 with value: 0.14556362178766427.
[I 2025-12-04 00:39:17,304] Trial 23 finished with value: 0.12882775699411697 and parameters: {'max_iter': 138, 'learning_rate': 0.09479905648360429, 'max_depth': 11, 'min_samples_leaf': 13, 'l2_regularization': 0.9942526523063829}. Best is trial 14 with value: 0.14556362178766427.
[I 2025-12-04 00:39:18,522] Trial 24 finished with value: 0.13736821642593483 and parameters: {'max_iter': 99, 'learning_rate': 0.07859995558270964, 'max_depth': 12, 'min_samples_leaf': 9, 'l2_regularization': 0.8311565861837422}. Best is trial 14 with value: 0.14556362178766427.
[I 2025-12-04 00:39:19,390] Trial 25 finished with value: 0.1340182741826398 and parameters: {'max_iter': 64, 'learning_rate': 0.12554945110160515, 'max_depth': 14, 'min_samples_leaf': 1, 'l2_regularization': 0.41241180427968516}. Best is trial 14 with value: 0.14556362178766427.
[I 2025-12-04 00:39:20,367] Trial 26 finished with value: 0.14347956537682652 and parameters: {'max_iter': 72, 'learning_rate': 0.07289722361767059, 'max_depth': 10, 'min_samples_leaf': 13, 'l2_regularization': 0.8450380978165098}. Best is trial 14 with value: 0.14556362178766427.
[I 2025-12-04 00:39:21,544] Trial 27 finished with value: 0.1492680201424236 and parameters: {'max_iter': 89, 'learning_rate': 0.034090255017575406, 'max_depth': 10, 'min_samples_leaf': 16, 'l2_regularization': 0.5942748175997044}. Best is trial 27 with value: 0.1492680201424236.
[I 2025-12-04 00:39:22,866] Trial 28 finished with value: 0.1391696796807891 and parameters: {'max_iter': 108, 'learning_rate': 0.029806938681813416, 'max_depth': 10, 'min_samples_leaf': 16, 'l2_regularization': 0.88665353948839}. Best is trial 27 with value: 0.1492680201424236.
[I 2025-12-04 00:39:24,932] Trial 29 finished with value: 0.10345681147029635 and parameters: {'max_iter': 199, 'learning_rate': 0.19385166140488239, 'max_depth': 8, 'min_samples_leaf': 24, 'l2_regularization': 0.6407784972085626}. Best is trial 27 with value: 0.1492680201424236.
Importâncias dos parâmetros para fold 1: {'learning_rate': np.float64(0.5727181494548171), 'max_depth': np.float64(0.25182885761752927), 'min_samples_split': np.float64(0.1156859124176959), 'min_samples_leaf': np.float64(0.031190093891087206), 'n_estimators': np.float64(0.014496195930051482), 'subsample': np.float64(0.012473205707175345), 'max_features': np.float64(0.0016075849816437496)}
Saved Optuna plots to results/20251203_215554_ana_optimized_binary/gradient_boosting/optuna_plots
Fold 2
Importâncias dos parâmetros para fold 2: {'learning_rate': np.float64(0.646185092934267), 'max_depth': np.float64(0.15376234685668497), 'min_samples_split': np.float64(0.05919737280020616), 'subsample': np.float64(0.05349241369988913), 'max_features': np.float64(0.0495870469129752), 'min_samples_leaf': np.float64(0.01910821032335659), 'n_estimators': np.float64(0.01866751647262091)}
Saved Optuna plots to results/20251203_215554_ana_optimized_binary/gradient_boosting/optuna_plots
Fold 3
Importâncias dos parâmetros para fold 3: {'learning_rate': np.float64(0.6687076793468854), 'min_samples_split': np.float64(0.2256724813818027), 'max_depth': np.float64(0.03160405609279863), 'min_samples_leaf': np.float64(0.02730009162920728), 'subsample': np.float64(0.023460982411012934), 'max_features': np.float64(0.017028716014492983), 'n_estimators': np.float64(0.006225993123800153)}
Saved Optuna plots to results/20251203_215554_ana_optimized_binary/gradient_boosting/optuna_plots
Fold 4
Importâncias dos parâmetros para fold 4: {'learning_rate': np.float64(0.5056639306681899), 'max_depth': np.float64(0.3801479134564851), 'subsample': np.float64(0.06809027987905984), 'max_features': np.float64(0.023195881809665204), 'min_samples_split': np.float64(0.011066707305393903), 'n_estimators': np.float64(0.008868042073696906), 'min_samples_leaf': np.float64(0.0029672448075090453)}
Saved Optuna plots to results/20251203_215554_ana_optimized_binary/gradient_boosting/optuna_plots
Fold 5
Importâncias dos parâmetros para fold 5: {'learning_rate': np.float64(0.5690524881481512), 'max_depth': np.float64(0.313000842330497), 'min_samples_leaf': np.float64(0.04470689541158288), 'subsample': np.float64(0.030557966081811414), 'max_features': np.float64(0.018423108608232402), 'min_samples_split': np.float64(0.013431676262993044), 'n_estimators': np.float64(0.010827023156732096)}
Saved Optuna plots to results/20251203_215554_ana_optimized_binary/gradient_boosting/optuna_plots

Nested CV completed. The 20% holdout set (3536 samples) remains untouched.
This holdout set can be used for final unbiased evaluation.

Training and evaluating 5 best parameter sets on holdout data...
Testing with 4 balancing strategies: none, randomundersampler, smoteenn, tomeklinks

Evaluating fold 1 best params on holdout set...
  - Testing with balance strategy: none
  - Testing with balance strategy: randomundersampler
  - Testing with balance strategy: smoteenn
  - Testing with balance strategy: tomeklinks

Evaluating fold 2 best params on holdout set...
  - Testing with balance strategy: none
  - Testing with balance strategy: randomundersampler
  - Testing with balance strategy: smoteenn
  - Testing with balance strategy: tomeklinks

Evaluating fold 3 best params on holdout set...
  - Testing with balance strategy: none
  - Testing with balance strategy: randomundersampler
  - Testing with balance strategy: smoteenn
  - Testing with balance strategy: tomeklinks

Evaluating fold 4 best params on holdout set...
  - Testing with balance strategy: none
  - Testing with balance strategy: randomundersampler
  - Testing with balance strategy: smoteenn
  - Testing with balance strategy: tomeklinks

Evaluating fold 5 best params on holdout set...
  - Testing with balance strategy: none
  - Testing with balance strategy: randomundersampler
  - Testing with balance strategy: smoteenn
  - Testing with balance strategy: tomeklinks
Saving optimization and holdout results...
Detailed results by fold saved to: ./results/20251203_215554_ana_optimized_binary/gradient_boosting/detailed_results_by_fold.txt
Test predictions for all folds saved to: ./results/20251203_215554_ana_optimized_binary/gradient_boosting/metrics.json
Saving holdout results...
Holdout evaluation results saved to: ./results/20251203_215554_ana_optimized_binary/gradient_boosting/holdout_results.txt
Saved!
[OK] Gradient Boosting executado com sucesso!
Progresso: 5/9 modelos
================================================================================
EXECUTANDO MODELO: Histogram Gradient Boosting
================================================================================

Starting Nested Cross-Validation for histogram_gradient_boosting...
Configuration: 5 outer folds, 30 trials per fold
Performing 80/20 holdout split...
Holdout split completed:
  - Training set: 14140 samples (80%)
  - Holdout test set: 3536 samples (20%)
Fold 1
Importâncias dos parâmetros para fold 1: {'learning_rate': np.float64(0.6018182619244421), 'l2_regularization': np.float64(0.25132897269642906), 'max_depth': np.float64(0.09719361794063369), 'min_samples_leaf': np.float64(0.03459975615059063), 'max_iter': np.float64(0.01505939128790458)}
Saved Optuna plots to results/20251203_215554_ana_optimized_binary/histogram_gradient_boosting/optuna_plots
Fold 2
Importâncias dos parâmetros para fold 2: {'learning_rate': np.float64(0.7545303985356118), 'max_depth': np.float64(0.08064797922491972), 'l2_regularization': np.float64(0.0620703238333896), 'max_iter': np.float64(0.05672186836416283), 'min_samples_leaf': np.float64(0.04602943004191609)}
Saved Optuna plots to results/20251203_215554_ana_optimized_binary/histogram_gradient_boosting/optuna_plots
Fold 3
Importâncias dos parâmetros para fold 3: {'learning_rate': np.float64(0.6311335825631192), 'min_samples_leaf': np.float64(0.26802850359334257), 'max_depth': np.float64(0.05749660394508129), 'max_iter': np.float64(0.028108077869978598), 'l2_regularization': np.float64(0.015233232028478256)}
Saved Optuna plots to results/20251203_215554_ana_optimized_binary/histogram_gradient_boosting/optuna_plots
Fold 4
Importâncias dos parâmetros para fold 4: {'learning_rate': np.float64(0.9002886764657418), 'max_depth': np.float64(0.03940143737289165), 'min_samples_leaf': np.float64(0.037247609902577805), 'max_iter': np.float64(0.013461490933417775), 'l2_regularization': np.float64(0.009600785325370792)}
Saved Optuna plots to results/20251203_215554_ana_optimized_binary/histogram_gradient_boosting/optuna_plots
Fold 5
Importâncias dos parâmetros para fold 5: {'learning_rate': np.float64(0.8877047798424819), 'max_iter': np.float64(0.06147409063536487), 'max_depth': np.float64(0.022985598406301152), 'l2_regularization': np.float64(0.01675682858888975), 'min_samples_leaf': np.float64(0.011078702526962414)}
Saved Optuna plots to results/20251203_215554_ana_optimized_binary/histogram_gradient_boosting/optuna_plots

Nested CV completed. The 20% holdout set (3536 samples) remains untouched.
This holdout set can be used for final unbiased evaluation.

Training and evaluating 5 best parameter sets on holdout data...
Testing with 4 balancing strategies: none, randomundersampler, smoteenn, tomeklinks

Evaluating fold 1 best params on holdout set...
  - Testing with balance strategy: none
  - Testing with balance strategy: randomundersampler
  - Testing with balance strategy: smoteenn
  - Testing with balance strategy: tomeklinks

Evaluating fold 2 best params on holdout set...
  - Testing with balance strategy: none
  - Testing with balance strategy: randomundersampler
  - Testing with balance strategy: smoteenn
  - Testing with balance strategy: tomeklinks

Evaluating fold 3 best params on holdout set...
  - Testing with balance strategy: none
  - Testing with balance strategy: randomundersampler
  - Testing with balance strategy: smoteenn
  - Testing with balance strategy: tomeklinks

Evaluating fold 4 best params on holdout set...
  - Testing with balance strategy: none
  - Testing with balance strategy: randomundersampler
  - Testing with balance strategy: smoteenn
  - Testing with balance strategy: tomeklinks
[I 2025-12-04 00:39:30,769] A new study created in memory with name: xgboost_fold_1
[I 2025-12-04 00:44:03,715] Trial 0 finished with value: 0.08693596985299065 and parameters: {'n_estimators': 557, 'learning_rate': 0.08685015138975649, 'max_depth': 12, 'min_child_weight': 4, 'subsample': 0.671441676074966, 'colsample_bytree': 0.8869043354194646, 'reg_alpha': 0.557379166746878, 'reg_lambda': 4.8426127837742765, 'gamma': 0.006042063283117627, 'scale_pos_weight': 48.26040444544327}. Best is trial 0 with value: 0.08693596985299065.
[I 2025-12-04 00:45:36,464] Trial 1 finished with value: 0.11556933303985187 and parameters: {'n_estimators': 806, 'learning_rate': 0.11526659861638466, 'max_depth': 6, 'min_child_weight': 3, 'subsample': 0.612791874772744, 'colsample_bytree': 0.6150819664770775, 'reg_alpha': 0.34427510720217525, 'reg_lambda': 9.808063182538707, 'gamma': 3.6246892515748352, 'scale_pos_weight': 19.178331555422965}. Best is trial 1 with value: 0.11556933303985187.
[I 2025-12-04 00:46:40,715] Trial 2 finished with value: 0.10953240867962284 and parameters: {'n_estimators': 819, 'learning_rate': 0.18086507615695815, 'max_depth': 10, 'min_child_weight': 2, 'subsample': 0.7874203282729362, 'colsample_bytree': 0.9695350877481412, 'reg_alpha': 0.8597751814288691, 'reg_lambda': 8.972850432196605, 'gamma': 4.970955016967035, 'scale_pos_weight': 28.035405521414894}. Best is trial 1 with value: 0.11556933303985187.
[I 2025-12-04 00:48:13,701] Trial 3 finished with value: 0.10790719408803558 and parameters: {'n_estimators': 753, 'learning_rate': 0.2740517436936969, 'max_depth': 15, 'min_child_weight': 5, 'subsample': 0.7371202656382649, 'colsample_bytree': 0.8205033903700398, 'reg_alpha': 0.8579009727667462, 'reg_lambda': 6.390312671101659, 'gamma': 1.814455445483476, 'scale_pos_weight': 45.560274494101186}. Best is trial 1 with value: 0.11556933303985187.
