[I 2025-12-03 22:16:07,893] Trial 1 finished with value: 0.15931400997568257 and parameters: {'n_estimators': 100, 'learning_rate': 0.11176801763812567, 'max_depth': 5, 'min_samples_split': 17, 'min_samples_leaf': 15, 'subsample': 0.904308812711192, 'max_features': 'log2'}. Best is trial 1 with value: 0.15931400997568257.
[I 2025-12-03 22:16:34,175] Trial 2 finished with value: 0.12967595470775878 and parameters: {'n_estimators': 200, 'learning_rate': 0.08281983598369322, 'max_depth': 13, 'min_samples_split': 8, 'min_samples_leaf': 18, 'subsample': 0.8594861473200179, 'max_features': 'log2'}. Best is trial 1 with value: 0.15931400997568257.
[I 2025-12-03 22:17:07,272] Trial 3 finished with value: 0.1103266802670309 and parameters: {'n_estimators': 300, 'learning_rate': 0.17881527754548412, 'max_depth': 11, 'min_samples_split': 10, 'min_samples_leaf': 14, 'subsample': 0.8000676445490587, 'max_features': 'log2'}. Best is trial 1 with value: 0.15931400997568257.
[I 2025-12-03 22:17:15,318] Trial 4 finished with value: 0.16699336973546078 and parameters: {'n_estimators': 200, 'learning_rate': 0.13076395773548702, 'max_depth': 3, 'min_samples_split': 18, 'min_samples_leaf': 8, 'subsample': 0.9285979855535689, 'max_features': 'log2'}. Best is trial 4 with value: 0.16699336973546078.
[I 2025-12-03 22:17:36,360] Trial 5 finished with value: 0.10819118227105025 and parameters: {'n_estimators': 200, 'learning_rate': 0.23621074844260345, 'max_depth': 10, 'min_samples_split': 9, 'min_samples_leaf': 18, 'subsample': 0.8397537433823118, 'max_features': 'log2'}. Best is trial 4 with value: 0.16699336973546078.
[I 2025-12-03 22:17:49,797] Trial 6 finished with value: 0.1338372192643464 and parameters: {'n_estimators': 200, 'learning_rate': 0.21988666264252693, 'max_depth': 5, 'min_samples_split': 12, 'min_samples_leaf': 15, 'subsample': 0.9850749919313919, 'max_features': 'log2'}. Best is trial 4 with value: 0.16699336973546078.
[I 2025-12-03 22:20:14,135] Trial 7 finished with value: 0.11176448537217129 and parameters: {'n_estimators': 200, 'learning_rate': 0.28471142139621514, 'max_depth': 6, 'min_samples_split': 2, 'min_samples_leaf': 20, 'subsample': 0.9500665275378426, 'max_features': None}. Best is trial 4 with value: 0.16699336973546078.
[I 2025-12-03 22:20:42,652] Trial 8 finished with value: 0.09441935718469727 and parameters: {'n_estimators': 250, 'learning_rate': 0.25839923056034286, 'max_depth': 14, 'min_samples_split': 5, 'min_samples_leaf': 7, 'subsample': 0.8328533815510049, 'max_features': 'log2'}. Best is trial 4 with value: 0.16699336973546078.
[I 2025-12-03 22:21:11,220] Trial 9 finished with value: 0.11112757698367812 and parameters: {'n_estimators': 250, 'learning_rate': 0.2223708156337472, 'max_depth': 9, 'min_samples_split': 15, 'min_samples_leaf': 4, 'subsample': 0.9494107086576281, 'max_features': 'log2'}. Best is trial 4 with value: 0.16699336973546078.
[I 2025-12-03 22:21:22,096] Trial 10 finished with value: 0.17710431269910437 and parameters: {'n_estimators': 100, 'learning_rate': 0.014957889335523805, 'max_depth': 7, 'min_samples_split': 20, 'min_samples_leaf': 9, 'subsample': 0.8939248688061954, 'max_features': 'sqrt'}. Best is trial 10 with value: 0.17710431269910437.
[I 2025-12-03 22:21:27,182] Trial 11 finished with value: 0.17361976696758702 and parameters: {'n_estimators': 100, 'learning_rate': 0.015398599067766137, 'max_depth': 3, 'min_samples_split': 20, 'min_samples_leaf': 9, 'subsample': 0.8910633988963894, 'max_features': 'sqrt'}. Best is trial 10 with value: 0.17710431269910437.
[I 2025-12-03 22:21:37,930] Trial 12 finished with value: 0.17843424849755127 and parameters: {'n_estimators': 100, 'learning_rate': 0.020485090649283774, 'max_depth': 7, 'min_samples_split': 20, 'min_samples_leaf': 10, 'subsample': 0.8803316342824397, 'max_features': 'sqrt'}. Best is trial 12 with value: 0.17843424849755127.
[I 2025-12-03 22:21:50,100] Trial 13 finished with value: 0.18126266833014948 and parameters: {'n_estimators': 100, 'learning_rate': 0.01974129178625931, 'max_depth': 8, 'min_samples_split': 14, 'min_samples_leaf': 1, 'subsample': 0.8733116647150095, 'max_features': 'sqrt'}. Best is trial 13 with value: 0.18126266833014948.
[I 2025-12-03 22:22:08,071] Trial 14 finished with value: 0.16947857680432626 and parameters: {'n_estimators': 150, 'learning_rate': 0.04790949065381177, 'max_depth': 8, 'min_samples_split': 14, 'min_samples_leaf': 1, 'subsample': 0.8666053465726505, 'max_features': 'sqrt'}. Best is trial 13 with value: 0.18126266833014948.
[I 2025-12-03 22:22:32,628] Trial 15 finished with value: 0.14586555738397006 and parameters: {'n_estimators': 150, 'learning_rate': 0.06871351895584556, 'max_depth': 11, 'min_samples_split': 13, 'min_samples_leaf': 1, 'subsample': 0.8685228994203982, 'max_features': 'sqrt'}. Best is trial 13 with value: 0.18126266833014948.
[I 2025-12-03 22:24:04,576] Trial 16 finished with value: 0.16181677554869153 and parameters: {'n_estimators': 100, 'learning_rate': 0.04311572546314055, 'max_depth': 8, 'min_samples_split': 16, 'min_samples_leaf': 5, 'subsample': 0.9143565118706787, 'max_features': None}. Best is trial 13 with value: 0.18126266833014948.
[I 2025-12-03 22:24:18,485] Trial 17 finished with value: 0.14511326212453468 and parameters: {'n_estimators': 150, 'learning_rate': 0.13441527022037106, 'max_depth': 6, 'min_samples_split': 11, 'min_samples_leaf': 12, 'subsample': 0.8781670251367524, 'max_features': 'sqrt'}. Best is trial 13 with value: 0.18126266833014948.
[I 2025-12-03 22:24:36,227] Trial 18 finished with value: 0.11521287594933978 and parameters: {'n_estimators': 100, 'learning_rate': 0.17535902450365784, 'max_depth': 12, 'min_samples_split': 7, 'min_samples_leaf': 4, 'subsample': 0.8460346105065395, 'max_features': 'sqrt'}. Best is trial 13 with value: 0.18126266833014948.
[I 2025-12-03 22:24:55,201] Trial 19 finished with value: 0.1622084217751383 and parameters: {'n_estimators': 150, 'learning_rate': 0.04469688027981633, 'max_depth': 8, 'min_samples_split': 20, 'min_samples_leaf': 12, 'subsample': 0.9298804630736864, 'max_features': 'sqrt'}. Best is trial 13 with value: 0.18126266833014948.
[I 2025-12-03 22:26:56,425] Trial 20 finished with value: 0.15423826687448886 and parameters: {'n_estimators': 100, 'learning_rate': 0.01137170776278881, 'max_depth': 10, 'min_samples_split': 15, 'min_samples_leaf': 6, 'subsample': 0.9824781396991495, 'max_features': None}. Best is trial 13 with value: 0.18126266833014948.
[I 2025-12-03 22:27:07,293] Trial 21 finished with value: 0.1807457523490093 and parameters: {'n_estimators': 100, 'learning_rate': 0.011003741009324445, 'max_depth': 7, 'min_samples_split': 20, 'min_samples_leaf': 10, 'subsample': 0.8881407303806553, 'max_features': 'sqrt'}. Best is trial 13 with value: 0.18126266833014948.
[I 2025-12-03 22:27:18,047] Trial 22 finished with value: 0.15900441630165787 and parameters: {'n_estimators': 100, 'learning_rate': 0.05825787748613036, 'max_depth': 7, 'min_samples_split': 18, 'min_samples_leaf': 11, 'subsample': 0.8858441704355235, 'max_features': 'sqrt'}. Best is trial 13 with value: 0.18126266833014948.
[I 2025-12-03 22:27:29,491] Trial 23 finished with value: 0.18257471317237958 and parameters: {'n_estimators': 150, 'learning_rate': 0.030915417100861542, 'max_depth': 5, 'min_samples_split': 19, 'min_samples_leaf': 3, 'subsample': 0.8510947607668277, 'max_features': 'sqrt'}. Best is trial 23 with value: 0.18257471317237958.
[I 2025-12-03 22:27:38,537] Trial 24 finished with value: 0.16326049941665327 and parameters: {'n_estimators': 150, 'learning_rate': 0.09777827497677369, 'max_depth': 4, 'min_samples_split': 17, 'min_samples_leaf': 3, 'subsample': 0.8223435605005357, 'max_features': 'sqrt'}. Best is trial 23 with value: 0.18257471317237958.
[I 2025-12-03 22:27:49,998] Trial 25 finished with value: 0.1878704739331345 and parameters: {'n_estimators': 150, 'learning_rate': 0.034892362863009334, 'max_depth': 5, 'min_samples_split': 18, 'min_samples_leaf': 2, 'subsample': 0.8577290165441114, 'max_features': 'sqrt'}. Best is trial 25 with value: 0.1878704739331345.
[I 2025-12-03 22:28:01,485] Trial 26 finished with value: 0.17518685797382835 and parameters: {'n_estimators': 150, 'learning_rate': 0.07005363293228607, 'max_depth': 5, 'min_samples_split': 13, 'min_samples_leaf': 3, 'subsample': 0.8545985837964101, 'max_features': 'sqrt'}. Best is trial 25 with value: 0.1878704739331345.
[I 2025-12-03 22:29:08,170] Trial 27 finished with value: 0.17405222984581664 and parameters: {'n_estimators': 150, 'learning_rate': 0.03598087208086557, 'max_depth': 4, 'min_samples_split': 16, 'min_samples_leaf': 2, 'subsample': 0.8501944578522244, 'max_features': None}. Best is trial 25 with value: 0.1878704739331345.
[I 2025-12-03 22:29:23,274] Trial 28 finished with value: 0.15680750694102077 and parameters: {'n_estimators': 250, 'learning_rate': 0.11341972866314592, 'max_depth': 4, 'min_samples_split': 18, 'min_samples_leaf': 1, 'subsample': 0.8279688907618529, 'max_features': 'sqrt'}. Best is trial 25 with value: 0.1878704739331345.
[I 2025-12-03 22:29:52,015] Trial 29 finished with value: 0.12352010299106109 and parameters: {'n_estimators': 150, 'learning_rate': 0.08652682320975938, 'max_depth': 15, 'min_samples_split': 18, 'min_samples_leaf': 6, 'subsample': 0.8075111812187602, 'max_features': 'sqrt'}. Best is trial 25 with value: 0.1878704739331345.
Importâncias dos parâmetros para fold 4: {'min_samples_leaf': np.float64(0.4451858580978512), 'max_depth': np.float64(0.28063946498942804), 'max_features': np.float64(0.08926904137879818), 'criterion': np.float64(0.08211316965359705), 'min_samples_split': np.float64(0.07969325859474728), 'splitter': np.float64(0.02309920728557821)}
Saved Optuna plots to results/20251203_215554_ana_optimized_binary/decision_tree/optuna_plots
Fold 5
Importâncias dos parâmetros para fold 5: {'max_depth': np.float64(0.4084511192908677), 'splitter': np.float64(0.3083157389503499), 'min_samples_leaf': np.float64(0.14964990055901797), 'max_features': np.float64(0.06640606620155423), 'min_samples_split': np.float64(0.03579193716541615), 'criterion': np.float64(0.03138523783279405)}
Saved Optuna plots to results/20251203_215554_ana_optimized_binary/decision_tree/optuna_plots

Nested CV completed. The 20% holdout set (3536 samples) remains untouched.
This holdout set can be used for final unbiased evaluation.

Training and evaluating 5 best parameter sets on holdout data...
Testing with 4 balancing strategies: none, randomundersampler, smoteenn, tomeklinks

Evaluating fold 1 best params on holdout set...
  - Testing with balance strategy: none
  - Testing with balance strategy: randomundersampler
  - Testing with balance strategy: smoteenn
  - Testing with balance strategy: tomeklinks

Evaluating fold 2 best params on holdout set...
  - Testing with balance strategy: none
  - Testing with balance strategy: randomundersampler
  - Testing with balance strategy: smoteenn
  - Testing with balance strategy: tomeklinks

Evaluating fold 3 best params on holdout set...
  - Testing with balance strategy: none
  - Testing with balance strategy: randomundersampler
  - Testing with balance strategy: smoteenn
  - Testing with balance strategy: tomeklinks

Evaluating fold 4 best params on holdout set...
  - Testing with balance strategy: none
  - Testing with balance strategy: randomundersampler
  - Testing with balance strategy: smoteenn
  - Testing with balance strategy: tomeklinks

Evaluating fold 5 best params on holdout set...
  - Testing with balance strategy: none
  - Testing with balance strategy: randomundersampler
  - Testing with balance strategy: smoteenn
  - Testing with balance strategy: tomeklinks
Saving optimization and holdout results...
Detailed results by fold saved to: ./results/20251203_215554_ana_optimized_binary/decision_tree/detailed_results_by_fold.txt
Test predictions for all folds saved to: ./results/20251203_215554_ana_optimized_binary/decision_tree/metrics.json
Saving holdout results...
Holdout evaluation results saved to: ./results/20251203_215554_ana_optimized_binary/decision_tree/holdout_results.txt
Saved!
[OK] Decision Tree executado com sucesso!
Progresso: 3/9 modelos
================================================================================
EXECUTANDO MODELO: Random Forest
================================================================================

Starting Nested Cross-Validation for random_forest...
Configuration: 5 outer folds, 30 trials per fold
Performing 80/20 holdout split...
Holdout split completed:
  - Training set: 14140 samples (80%)
  - Holdout test set: 3536 samples (20%)
Fold 1
Importâncias dos parâmetros para fold 1: {'min_samples_leaf': np.float64(0.405066214925484), 'max_features': np.float64(0.34668996502273425), 'min_samples_split': np.float64(0.1283405823238877), 'bootstrap': np.float64(0.05580252968832431), 'max_depth': np.float64(0.029222285286907672), 'n_estimators': np.float64(0.019443612365331545), 'criterion': np.float64(0.01543481038733036)}
Saved Optuna plots to results/20251203_215554_ana_optimized_binary/random_forest/optuna_plots
Fold 2
Importâncias dos parâmetros para fold 2: {'max_features': np.float64(0.3036201242273755), 'max_depth': np.float64(0.2687635486482996), 'criterion': np.float64(0.18207667616743076), 'min_samples_leaf': np.float64(0.10814474738675002), 'bootstrap': np.float64(0.0531605631011643), 'n_estimators': np.float64(0.04803159755799682), 'min_samples_split': np.float64(0.036202742910983125)}
Saved Optuna plots to results/20251203_215554_ana_optimized_binary/random_forest/optuna_plots
Fold 3
Importâncias dos parâmetros para fold 3: {'max_features': np.float64(0.38827713883516546), 'min_samples_leaf': np.float64(0.27605840428828926), 'n_estimators': np.float64(0.12753785062837458), 'bootstrap': np.float64(0.11225371390150635), 'max_depth': np.float64(0.06453283239571973), 'min_samples_split': np.float64(0.021658554933124758), 'criterion': np.float64(0.009681505017819822)}
Saved Optuna plots to results/20251203_215554_ana_optimized_binary/random_forest/optuna_plots
Fold 4
Importâncias dos parâmetros para fold 4: {'max_features': np.float64(0.6917666976682806), 'max_depth': np.float64(0.10081316109824374), 'min_samples_split': np.float64(0.09548738783240643), 'criterion': np.float64(0.04025394094307654), 'min_samples_leaf': np.float64(0.028603134773084748), 'bootstrap': np.float64(0.02448768238818986), 'n_estimators': np.float64(0.018587995296718198)}
Saved Optuna plots to results/20251203_215554_ana_optimized_binary/random_forest/optuna_plots
Fold 5
Importâncias dos parâmetros para fold 5: {'max_features': np.float64(0.502858071987745), 'min_samples_leaf': np.float64(0.2811479085622028), 'criterion': np.float64(0.08282354422289281), 'bootstrap': np.float64(0.06024703005612214), 'max_depth': np.float64(0.03810709916458225), 'n_estimators': np.float64(0.02625924081141142), 'min_samples_split': np.float64(0.008557105195043588)}
Saved Optuna plots to results/20251203_215554_ana_optimized_binary/random_forest/optuna_plots

Nested CV completed. The 20% holdout set (3536 samples) remains untouched.
This holdout set can be used for final unbiased evaluation.

Training and evaluating 5 best parameter sets on holdout data...
Testing with 4 balancing strategies: none, randomundersampler, smoteenn, tomeklinks

Evaluating fold 1 best params on holdout set...
  - Testing with balance strategy: none
  - Testing with balance strategy: randomundersampler
  - Testing with balance strategy: smoteenn
  - Testing with balance strategy: tomeklinks

Evaluating fold 2 best params on holdout set...
  - Testing with balance strategy: none
  - Testing with balance strategy: randomundersampler
  - Testing with balance strategy: smoteenn
  - Testing with balance strategy: tomeklinks

Evaluating fold 3 best params on holdout set...
  - Testing with balance strategy: none
  - Testing with balance strategy: randomundersampler
  - Testing with balance strategy: smoteenn
  - Testing with balance strategy: tomeklinks

Evaluating fold 4 best params on holdout set...
  - Testing with balance strategy: none
  - Testing with balance strategy: randomundersampler
  - Testing with balance strategy: smoteenn
  - Testing with balance strategy: tomeklinks

Evaluating fold 5 best params on holdout set...
  - Testing with balance strategy: none
  - Testing with balance strategy: randomundersampler
  - Testing with balance strategy: smoteenn
  - Testing with balance strategy: tomeklinks
Saving optimization and holdout results...
Detailed results by fold saved to: ./results/20251203_215554_ana_optimized_binary/random_forest/detailed_results_by_fold.txt
Test predictions for all folds saved to: ./results/20251203_215554_ana_optimized_binary/random_forest/metrics.json
Saving holdout results...
Holdout evaluation results saved to: ./results/20251203_215554_ana_optimized_binary/random_forest/holdout_results.txt
Saved!
[OK] Random Forest executado com sucesso!
Progresso: 4/9 modelos
================================================================================
EXECUTANDO MODELO: Gradient Boosting
================================================================================

Starting Nested Cross-Validation for gradient_boosting...
Configuration: 5 outer folds, 30 trials per fold
Performing 80/20 holdout split...
Holdout split completed:
  - Training set: 14140 samples (80%)
  - Holdout test set: 3536 samples (20%)
Fold 1
[I 2025-12-03 22:29:55,536] A new study created in memory with name: gradient_boosting_fold_2
[I 2025-12-03 22:34:04,350] Trial 0 finished with value: 0.11531155653033442 and parameters: {'n_estimators': 150, 'learning_rate': 0.16219227562116298, 'max_depth': 15, 'min_samples_split': 16, 'min_samples_leaf': 11, 'subsample': 0.9696907007713272, 'max_features': None}. Best is trial 0 with value: 0.11531155653033442.
[I 2025-12-03 22:34:26,883] Trial 1 finished with value: 0.12861892563761992 and parameters: {'n_estimators': 300, 'learning_rate': 0.1536194810269398, 'max_depth': 5, 'min_samples_split': 14, 'min_samples_leaf': 2, 'subsample': 0.8434866647940079, 'max_features': 'sqrt'}. Best is trial 1 with value: 0.12861892563761992.
[I 2025-12-03 22:35:21,787] Trial 2 finished with value: 0.14476144857797715 and parameters: {'n_estimators': 100, 'learning_rate': 0.09837958733457977, 'max_depth': 5, 'min_samples_split': 20, 'min_samples_leaf': 10, 'subsample': 0.8475561753344818, 'max_features': None}. Best is trial 2 with value: 0.14476144857797715.
[I 2025-12-03 22:35:30,651] Trial 3 finished with value: 0.13850416084244013 and parameters: {'n_estimators': 150, 'learning_rate': 0.2665563733738607, 'max_depth': 5, 'min_samples_split': 15, 'min_samples_leaf': 6, 'subsample': 0.8569950338014146, 'max_features': 'log2'}. Best is trial 2 with value: 0.14476144857797715.
[I 2025-12-03 22:36:27,399] Trial 4 finished with value: 0.1190330589496507 and parameters: {'n_estimators': 300, 'learning_rate': 0.10032536562480535, 'max_depth': 13, 'min_samples_split': 18, 'min_samples_leaf': 11, 'subsample': 0.9159634876451273, 'max_features': 'sqrt'}. Best is trial 2 with value: 0.14476144857797715.
[I 2025-12-03 22:36:56,972] Trial 5 finished with value: 0.09900770870589878 and parameters: {'n_estimators': 200, 'learning_rate': 0.23069157310552285, 'max_depth': 11, 'min_samples_split': 6, 'min_samples_leaf': 2, 'subsample': 0.9723596627988388, 'max_features': 'log2'}. Best is trial 2 with value: 0.14476144857797715.
[I 2025-12-03 22:37:03,456] Trial 6 finished with value: 0.1428062397189796 and parameters: {'n_estimators': 150, 'learning_rate': 0.2624747626366563, 'max_depth': 3, 'min_samples_split': 8, 'min_samples_leaf': 4, 'subsample': 0.9853142514059963, 'max_features': 'log2'}. Best is trial 2 with value: 0.14476144857797715.
[I 2025-12-03 22:37:52,806] Trial 7 finished with value: 0.10439108859367499 and parameters: {'n_estimators': 300, 'learning_rate': 0.10020779682044467, 'max_depth': 14, 'min_samples_split': 3, 'min_samples_leaf': 4, 'subsample': 0.8490529157374265, 'max_features': 'log2'}. Best is trial 2 with value: 0.14476144857797715.
[I 2025-12-03 22:38:26,564] Trial 8 finished with value: 0.12517167074386226 and parameters: {'n_estimators': 200, 'learning_rate': 0.07765376009323753, 'max_depth': 12, 'min_samples_split': 11, 'min_samples_leaf': 1, 'subsample': 0.8091540258681219, 'max_features': 'sqrt'}. Best is trial 2 with value: 0.14476144857797715.
[I 2025-12-03 22:38:57,606] Trial 9 finished with value: 0.17447271328612685 and parameters: {'n_estimators': 300, 'learning_rate': 0.02562011880963632, 'max_depth': 7, 'min_samples_split': 20, 'min_samples_leaf': 6, 'subsample': 0.8487507946773909, 'max_features': 'sqrt'}. Best is trial 9 with value: 0.17447271328612685.
[I 2025-12-03 22:39:31,133] Trial 10 finished with value: 0.1703612799063054 and parameters: {'n_estimators': 250, 'learning_rate': 0.010008269840269219, 'max_depth': 9, 'min_samples_split': 11, 'min_samples_leaf': 19, 'subsample': 0.9052074840440478, 'max_features': 'sqrt'}. Best is trial 9 with value: 0.17447271328612685.
[I 2025-12-03 22:40:05,470] Trial 11 finished with value: 0.1703858312464963 and parameters: {'n_estimators': 250, 'learning_rate': 0.01252187568945834, 'max_depth': 9, 'min_samples_split': 11, 'min_samples_leaf': 20, 'subsample': 0.9233487663973945, 'max_features': 'sqrt'}. Best is trial 9 with value: 0.17447271328612685.
[I 2025-12-03 22:40:36,894] Trial 12 finished with value: 0.1676709177633223 and parameters: {'n_estimators': 250, 'learning_rate': 0.012220149950473663, 'max_depth': 8, 'min_samples_split': 8, 'min_samples_leaf': 20, 'subsample': 0.9359956861463239, 'max_features': 'sqrt'}. Best is trial 9 with value: 0.17447271328612685.
