[I 2025-12-04 05:11:09,179] Trial 23 finished with value: 0.1420717875586298 and parameters: {'iterations': 350, 'learning_rate': 0.04337424682548778, 'depth': 4, 'l2_leaf_reg': 3.3513532465432996, 'border_count': 123, 'bagging_temperature': 0.32315235164088163, 'random_strength': 0.3198340981720069, 'scale_pos_weight': 46.63508576354894}. Best is trial 14 with value: 0.1452407067611295.
[I 2025-12-04 05:11:12,568] Trial 24 finished with value: 0.09117022715705879 and parameters: {'iterations': 318, 'learning_rate': 0.07995957371679077, 'depth': 7, 'l2_leaf_reg': 2.838739173376471, 'border_count': 114, 'bagging_temperature': 0.0799983390222394, 'random_strength': 0.08735721702604493, 'scale_pos_weight': 46.709761108296476}. Best is trial 14 with value: 0.1452407067611295.
[I 2025-12-04 05:11:15,355] Trial 25 finished with value: 0.11131756523546454 and parameters: {'iterations': 433, 'learning_rate': 0.055388444525791565, 'depth': 5, 'l2_leaf_reg': 4.081725353175928, 'border_count': 81, 'bagging_temperature': 0.17386115865496546, 'random_strength': 0.21646679331398855, 'scale_pos_weight': 32.89012488045676}. Best is trial 14 with value: 0.1452407067611295.
[I 2025-12-04 05:11:17,182] Trial 26 finished with value: 0.14293802973466824 and parameters: {'iterations': 178, 'learning_rate': 0.02855371853439509, 'depth': 6, 'l2_leaf_reg': 1.8443312906185103, 'border_count': 157, 'bagging_temperature': 0.3058111867287977, 'random_strength': 0.4491183743529322, 'scale_pos_weight': 27.634391766789108}. Best is trial 14 with value: 0.1452407067611295.
[I 2025-12-04 05:11:19,029] Trial 27 finished with value: 0.1322981105910948 and parameters: {'iterations': 281, 'learning_rate': 0.08448635170014117, 'depth': 4, 'l2_leaf_reg': 5.007932960498051, 'border_count': 55, 'bagging_temperature': 0.06219580389240641, 'random_strength': 0.5834090213625325, 'scale_pos_weight': 41.88018030689256}. Best is trial 14 with value: 0.1452407067611295.
[I 2025-12-04 05:11:22,183] Trial 28 finished with value: 0.12537192265204672 and parameters: {'iterations': 480, 'learning_rate': 0.028163022014047107, 'depth': 5, 'l2_leaf_reg': 2.6266431670403403, 'border_count': 84, 'bagging_temperature': 0.17657903562067637, 'random_strength': 0.08601136957593489, 'scale_pos_weight': 47.57896989461538}. Best is trial 14 with value: 0.1452407067611295.
[I 2025-12-04 05:11:28,026] Trial 29 finished with value: 0.0808697652172832 and parameters: {'iterations': 629, 'learning_rate': 0.14141530752179438, 'depth': 7, 'l2_leaf_reg': 3.8060897712481907, 'border_count': 114, 'bagging_temperature': 0.2655714476693648, 'random_strength': 0.21344320664161073, 'scale_pos_weight': 43.04460141334244}. Best is trial 14 with value: 0.1452407067611295.
[I 2025-12-04 05:11:29,299] A new study created in memory with name: catboost_fold_3
[I 2025-12-04 05:11:31,991] Trial 0 finished with value: 0.07877425205685987 and parameters: {'iterations': 142, 'learning_rate': 0.08611511600248767, 'depth': 10, 'l2_leaf_reg': 1.1799971388676471, 'border_count': 41, 'bagging_temperature': 0.9557769078984802, 'random_strength': 0.7872410074910163, 'scale_pos_weight': 27.645043933837364}. Best is trial 0 with value: 0.07877425205685987.
[I 2025-12-04 05:11:44,989] Trial 1 finished with value: 0.07831300164072719 and parameters: {'iterations': 679, 'learning_rate': 0.15384989069438304, 'depth': 9, 'l2_leaf_reg': 1.7305216438113677, 'border_count': 49, 'bagging_temperature': 0.5559983386184941, 'random_strength': 0.6813076614890738, 'scale_pos_weight': 15.731734275504424}. Best is trial 0 with value: 0.07877425205685987.
[I 2025-12-04 05:11:49,872] Trial 2 finished with value: 0.09168560103721508 and parameters: {'iterations': 978, 'learning_rate': 0.2991209776677557, 'depth': 4, 'l2_leaf_reg': 8.878812006684262, 'border_count': 116, 'bagging_temperature': 0.810867724255498, 'random_strength': 0.4342390845994022, 'scale_pos_weight': 43.98633621282217}. Best is trial 2 with value: 0.09168560103721508.
[I 2025-12-04 05:11:54,256] Trial 3 finished with value: 0.08930691513524244 and parameters: {'iterations': 559, 'learning_rate': 0.1253783528997827, 'depth': 7, 'l2_leaf_reg': 8.797848673611309, 'border_count': 68, 'bagging_temperature': 0.2669595443467484, 'random_strength': 0.8513420438660636, 'scale_pos_weight': 31.743854381769324}. Best is trial 2 with value: 0.09168560103721508.
[I 2025-12-04 05:13:24,354] Trial 4 finished with value: 0.10152617800051092 and parameters: {'iterations': 972, 'learning_rate': 0.24814622351292606, 'depth': 9, 'l2_leaf_reg': 6.730897609539391, 'border_count': 182, 'bagging_temperature': 0.4896891297078465, 'random_strength': 0.07684925426793932, 'scale_pos_weight': 8.742784922547637}. Best is trial 4 with value: 0.10152617800051092.
[I 2025-12-04 05:14:36,759] Trial 5 finished with value: 0.08357740182014221 and parameters: {'iterations': 947, 'learning_rate': 0.23053056459943871, 'depth': 10, 'l2_leaf_reg': 5.343069491256242, 'border_count': 142, 'bagging_temperature': 0.899516211551638, 'random_strength': 0.5831288200941273, 'scale_pos_weight': 12.316111538502959}. Best is trial 4 with value: 0.10152617800051092.
[I 2025-12-04 05:15:02,740] Trial 6 finished with value: 0.10454187570483253 and parameters: {'iterations': 899, 'learning_rate': 0.015556834030640967, 'depth': 8, 'l2_leaf_reg': 4.009884829608281, 'border_count': 148, 'bagging_temperature': 0.5699406690275418, 'random_strength': 0.42665047380504795, 'scale_pos_weight': 48.719689972259864}. Best is trial 6 with value: 0.10454187570483253.
[I 2025-12-04 05:15:07,448] Trial 7 finished with value: 0.09976832531352946 and parameters: {'iterations': 851, 'learning_rate': 0.1155941240720106, 'depth': 4, 'l2_leaf_reg': 6.0365884717932925, 'border_count': 122, 'bagging_temperature': 0.058902468882847225, 'random_strength': 0.0895647948833388, 'scale_pos_weight': 20.898645118363046}. Best is trial 6 with value: 0.10454187570483253.
[I 2025-12-04 05:15:12,249] Trial 8 finished with value: 0.10468309833900244 and parameters: {'iterations': 765, 'learning_rate': 0.1123042612035453, 'depth': 6, 'l2_leaf_reg': 5.288458071704378, 'border_count': 63, 'bagging_temperature': 0.7343887414958399, 'random_strength': 0.28554300597984394, 'scale_pos_weight': 6.420248067429238}. Best is trial 8 with value: 0.10468309833900244.
[I 2025-12-04 05:15:15,658] Trial 9 finished with value: 0.08244740926030222 and parameters: {'iterations': 465, 'learning_rate': 0.1287390080993989, 'depth': 5, 'l2_leaf_reg': 1.9380723654949312, 'border_count': 200, 'bagging_temperature': 0.7078655596740336, 'random_strength': 0.31478212127127836, 'scale_pos_weight': 37.14153649380843}. Best is trial 8 with value: 0.10468309833900244.
[I 2025-12-04 05:15:19,176] Trial 10 finished with value: 0.12881955465773384 and parameters: {'iterations': 342, 'learning_rate': 0.047031943684190974, 'depth': 6, 'l2_leaf_reg': 3.8443427267283443, 'border_count': 248, 'bagging_temperature': 0.35224825992758085, 'random_strength': 0.9986703577832413, 'scale_pos_weight': 6.677699031822655}. Best is trial 10 with value: 0.12881955465773384.
[I 2025-12-04 05:15:22,861] Trial 11 finished with value: 0.14348057729190444 and parameters: {'iterations': 337, 'learning_rate': 0.02798929094517774, 'depth': 6, 'l2_leaf_reg': 3.9024829974668656, 'border_count': 249, 'bagging_temperature': 0.3711527421697487, 'random_strength': 0.9753650738440648, 'scale_pos_weight': 5.508308319472512}. Best is trial 11 with value: 0.14348057729190444.
[I 2025-12-04 05:15:26,087] Trial 12 finished with value: 0.14133470730311096 and parameters: {'iterations': 283, 'learning_rate': 0.01603376400699357, 'depth': 6, 'l2_leaf_reg': 3.3094776673320982, 'border_count': 255, 'bagging_temperature': 0.3101879561554647, 'random_strength': 0.9945553459520224, 'scale_pos_weight': 21.261445682609946}. Best is trial 11 with value: 0.14348057729190444.
[I 2025-12-04 05:15:28,833] Trial 13 finished with value: 0.1361967664702482 and parameters: {'iterations': 249, 'learning_rate': 0.013023571831440296, 'depth': 6, 'l2_leaf_reg': 3.130507033738511, 'border_count': 250, 'bagging_temperature': 0.2220108467671794, 'random_strength': 0.9987867246453948, 'scale_pos_weight': 20.811470630259922}. Best is trial 11 with value: 0.14348057729190444.
[I 2025-12-04 05:15:35,658] Trial 14 finished with value: 0.09792046369784758 and parameters: {'iterations': 378, 'learning_rate': 0.06216122808589104, 'depth': 7, 'l2_leaf_reg': 2.830581116218622, 'border_count': 216, 'bagging_temperature': 0.05014361848944304, 'random_strength': 0.8487804355210358, 'scale_pos_weight': 19.346076884657514}. Best is trial 11 with value: 0.14348057729190444.
[I 2025-12-04 05:15:37,049] Trial 15 finished with value: 0.13679111296943308 and parameters: {'iterations': 127, 'learning_rate': 0.051777580357056936, 'depth': 5, 'l2_leaf_reg': 4.456525446883335, 'border_count': 222, 'bagging_temperature': 0.3735453467455168, 'random_strength': 0.7082136888547166, 'scale_pos_weight': 30.051617567362534}. Best is trial 11 with value: 0.14348057729190444.
[I 2025-12-04 05:15:41,134] Trial 16 finished with value: 0.09052185161807137 and parameters: {'iterations': 271, 'learning_rate': 0.21313798710460935, 'depth': 7, 'l2_leaf_reg': 7.046448377213409, 'border_count': 177, 'bagging_temperature': 0.2162017224859874, 'random_strength': 0.8936291404487896, 'scale_pos_weight': 24.309024047988963}. Best is trial 11 with value: 0.14348057729190444.
[I 2025-12-04 05:15:44,973] Trial 17 finished with value: 0.09735055999275907 and parameters: {'iterations': 517, 'learning_rate': 0.188025345268332, 'depth': 5, 'l2_leaf_reg': 2.9248629437627427, 'border_count': 255, 'bagging_temperature': 0.44734431314668444, 'random_strength': 0.7006985244136509, 'scale_pos_weight': 14.408952175434683}. Best is trial 11 with value: 0.14348057729190444.
[I 2025-12-04 05:16:05,416] Trial 18 finished with value: 0.08789963968907845 and parameters: {'iterations': 409, 'learning_rate': 0.07429516339187409, 'depth': 8, 'l2_leaf_reg': 4.360838971034207, 'border_count': 226, 'bagging_temperature': 0.14456643156727356, 'random_strength': 0.5863992446010046, 'scale_pos_weight': 37.007667085658866}. Best is trial 11 with value: 0.14348057729190444.
[I 2025-12-04 05:16:07,740] Trial 19 finished with value: 0.13076390428637635 and parameters: {'iterations': 231, 'learning_rate': 0.04023517833821802, 'depth': 6, 'l2_leaf_reg': 7.753103591541175, 'border_count': 190, 'bagging_temperature': 0.350008136795676, 'random_strength': 0.9337261986195053, 'scale_pos_weight': 12.55507863393738}. Best is trial 11 with value: 0.14348057729190444.
[I 2025-12-04 05:16:27,788] Trial 20 finished with value: 0.07623892543528937 and parameters: {'iterations': 607, 'learning_rate': 0.0856357718011446, 'depth': 8, 'l2_leaf_reg': 2.5396461053106814, 'border_count': 163, 'bagging_temperature': 0.6203872831970647, 'random_strength': 0.7819743533234573, 'scale_pos_weight': 35.50589607642354}. Best is trial 11 with value: 0.14348057729190444.
[I 2025-12-04 05:16:29,115] Trial 21 finished with value: 0.1433415110504093 and parameters: {'iterations': 119, 'learning_rate': 0.0368934159003781, 'depth': 5, 'l2_leaf_reg': 4.97284635281697, 'border_count': 230, 'bagging_temperature': 0.3692660869586199, 'random_strength': 0.7396843700717374, 'scale_pos_weight': 29.156736050196635}. Best is trial 11 with value: 0.14348057729190444.
[I 2025-12-04 05:16:30,831] Trial 22 finished with value: 0.14062058419514162 and parameters: {'iterations': 183, 'learning_rate': 0.026866077806955525, 'depth': 5, 'l2_leaf_reg': 4.765580669772193, 'border_count': 234, 'bagging_temperature': 0.29856074015427125, 'random_strength': 0.9358803191409446, 'scale_pos_weight': 26.914001402907502}. Best is trial 11 with value: 0.14348057729190444.
[I 2025-12-04 05:16:32,974] Trial 23 finished with value: 0.14066635414577183 and parameters: {'iterations': 315, 'learning_rate': 0.013491278758338346, 'depth': 4, 'l2_leaf_reg': 3.4285444363244295, 'border_count': 206, 'bagging_temperature': 0.45643950553987633, 'random_strength': 0.7843574421415486, 'scale_pos_weight': 43.28920711025737}. Best is trial 11 with value: 0.14348057729190444.
[I 2025-12-04 05:16:34,558] Trial 24 finished with value: 0.12335499096147953 and parameters: {'iterations': 109, 'learning_rate': 0.08562679789825361, 'depth': 6, 'l2_leaf_reg': 5.9883120715591325, 'border_count': 236, 'bagging_temperature': 0.1447125902487788, 'random_strength': 0.619845570568891, 'scale_pos_weight': 33.47546451819185}. Best is trial 11 with value: 0.14348057729190444.
[I 2025-12-04 05:16:36,431] Trial 25 finished with value: 0.13789182122065494 and parameters: {'iterations': 200, 'learning_rate': 0.03893323161172121, 'depth': 5, 'l2_leaf_reg': 3.7160784005697276, 'border_count': 238, 'bagging_temperature': 0.4031594811009499, 'random_strength': 0.859289874570193, 'scale_pos_weight': 25.14997833264031}. Best is trial 11 with value: 0.14348057729190444.
[I 2025-12-04 05:16:40,478] Trial 26 finished with value: 0.10286182847147299 and parameters: {'iterations': 438, 'learning_rate': 0.05740588968062799, 'depth': 6, 'l2_leaf_reg': 4.744655008001557, 'border_count': 210, 'bagging_temperature': 0.2931421311580414, 'random_strength': 0.9876854937970129, 'scale_pos_weight': 40.5544737755221}. Best is trial 11 with value: 0.14348057729190444.
[I 2025-12-04 05:16:47,945] Trial 27 finished with value: 0.0988165498097744 and parameters: {'iterations': 328, 'learning_rate': 0.15784898606776296, 'depth': 7, 'l2_leaf_reg': 9.927094556298584, 'border_count': 254, 'bagging_temperature': 0.16669920835454302, 'random_strength': 0.7677610529536953, 'scale_pos_weight': 18.41492574143171}. Best is trial 11 with value: 0.14348057729190444.
[I 2025-12-04 05:16:50,007] Trial 28 finished with value: 0.13920399664325117 and parameters: {'iterations': 275, 'learning_rate': 0.032086464059582785, 'depth': 5, 'l2_leaf_reg': 5.1172924732121565, 'border_count': 95, 'bagging_temperature': 0.5387611348273246, 'random_strength': 0.514555648293771, 'scale_pos_weight': 11.254094696314773}. Best is trial 11 with value: 0.14348057729190444.
