[I 2025-12-03 22:09:42,562] Trial 19 finished with value: 0.14568440660003912 and parameters: {'n_estimators': 125, 'max_depth': 5, 'min_samples_split': 9, 'min_samples_leaf': 18, 'max_features': 'sqrt', 'criterion': 'entropy', 'bootstrap': True}. Best is trial 13 with value: 0.1471043199557803.
[I 2025-12-03 22:09:44,093] Trial 20 finished with value: 0.13138879278306576 and parameters: {'n_estimators': 125, 'max_depth': 11, 'min_samples_split': 7, 'min_samples_leaf': 14, 'max_features': 'sqrt', 'criterion': 'entropy', 'bootstrap': True}. Best is trial 13 with value: 0.1471043199557803.
[I 2025-12-03 22:09:45,652] Trial 21 finished with value: 0.1446466311574792 and parameters: {'n_estimators': 175, 'max_depth': 5, 'min_samples_split': 13, 'min_samples_leaf': 18, 'max_features': 'sqrt', 'criterion': 'entropy', 'bootstrap': True}. Best is trial 13 with value: 0.1471043199557803.
[I 2025-12-03 22:09:46,791] Trial 22 finished with value: 0.13908530960528026 and parameters: {'n_estimators': 125, 'max_depth': 5, 'min_samples_split': 13, 'min_samples_leaf': 18, 'max_features': 'sqrt', 'criterion': 'entropy', 'bootstrap': True}. Best is trial 13 with value: 0.1471043199557803.
[I 2025-12-03 22:09:48,734] Trial 23 finished with value: 0.1403378381193534 and parameters: {'n_estimators': 200, 'max_depth': 8, 'min_samples_split': 11, 'min_samples_leaf': 19, 'max_features': 'sqrt', 'criterion': 'entropy', 'bootstrap': True}. Best is trial 13 with value: 0.1471043199557803.
[I 2025-12-03 22:09:50,021] Trial 24 finished with value: 0.13864975553232795 and parameters: {'n_estimators': 125, 'max_depth': 7, 'min_samples_split': 9, 'min_samples_leaf': 16, 'max_features': 'sqrt', 'criterion': 'entropy', 'bootstrap': True}. Best is trial 13 with value: 0.1471043199557803.
[I 2025-12-03 22:09:51,923] Trial 25 finished with value: 0.1396688385987937 and parameters: {'n_estimators': 175, 'max_depth': 10, 'min_samples_split': 5, 'min_samples_leaf': 17, 'max_features': 'sqrt', 'criterion': 'entropy', 'bootstrap': True}. Best is trial 13 with value: 0.1471043199557803.
[I 2025-12-03 22:09:55,273] Trial 26 finished with value: 0.13847820198632863 and parameters: {'n_estimators': 200, 'max_depth': 13, 'min_samples_split': 14, 'min_samples_leaf': 19, 'max_features': 'sqrt', 'criterion': 'entropy', 'bootstrap': False}. Best is trial 13 with value: 0.1471043199557803.
[I 2025-12-03 22:09:56,531] Trial 27 finished with value: 0.1404080804920157 and parameters: {'n_estimators': 150, 'max_depth': 5, 'min_samples_split': 16, 'min_samples_leaf': 14, 'max_features': 'sqrt', 'criterion': 'gini', 'bootstrap': True}. Best is trial 13 with value: 0.1471043199557803.
[I 2025-12-03 22:09:58,122] Trial 28 finished with value: 0.1409038303912391 and parameters: {'n_estimators': 125, 'max_depth': 9, 'min_samples_split': 12, 'min_samples_leaf': 17, 'max_features': 'sqrt', 'criterion': 'entropy', 'bootstrap': True}. Best is trial 13 with value: 0.1471043199557803.
[I 2025-12-03 22:10:10,680] Trial 29 finished with value: 0.08801303718592274 and parameters: {'n_estimators': 200, 'max_depth': 7, 'min_samples_split': 17, 'min_samples_leaf': 5, 'max_features': None, 'criterion': 'gini', 'bootstrap': False}. Best is trial 13 with value: 0.1471043199557803.
[I 2025-12-03 22:10:11,657] A new study created in memory with name: random_forest_fold_4
[I 2025-12-03 22:10:15,946] Trial 0 finished with value: 0.1546549058399079 and parameters: {'n_estimators': 250, 'max_depth': 20, 'min_samples_split': 14, 'min_samples_leaf': 15, 'max_features': 'sqrt', 'criterion': 'log_loss', 'bootstrap': False}. Best is trial 0 with value: 0.1546549058399079.
[I 2025-12-03 22:10:42,603] Trial 1 finished with value: 0.09922712190315772 and parameters: {'n_estimators': 250, 'max_depth': 12, 'min_samples_split': 12, 'min_samples_leaf': 13, 'max_features': None, 'criterion': 'entropy', 'bootstrap': False}. Best is trial 0 with value: 0.1546549058399079.
[I 2025-12-03 22:10:52,042] Trial 2 finished with value: 0.1464855008082466 and parameters: {'n_estimators': 150, 'max_depth': 16, 'min_samples_split': 15, 'min_samples_leaf': 16, 'max_features': None, 'criterion': 'entropy', 'bootstrap': True}. Best is trial 0 with value: 0.1546549058399079.
[I 2025-12-03 22:11:20,712] Trial 3 finished with value: 0.0869661658798007 and parameters: {'n_estimators': 250, 'max_depth': 23, 'min_samples_split': 12, 'min_samples_leaf': 16, 'max_features': None, 'criterion': 'entropy', 'bootstrap': False}. Best is trial 0 with value: 0.1546549058399079.
[I 2025-12-03 22:11:24,194] Trial 4 finished with value: 0.129161243634274 and parameters: {'n_estimators': 200, 'max_depth': 13, 'min_samples_split': 6, 'min_samples_leaf': 3, 'max_features': 'sqrt', 'criterion': 'entropy', 'bootstrap': False}. Best is trial 0 with value: 0.1546549058399079.
[I 2025-12-03 22:11:25,552] Trial 5 finished with value: 0.14179131208370954 and parameters: {'n_estimators': 100, 'max_depth': 29, 'min_samples_split': 19, 'min_samples_leaf': 10, 'max_features': 'sqrt', 'criterion': 'entropy', 'bootstrap': True}. Best is trial 0 with value: 0.1546549058399079.
[I 2025-12-03 22:11:27,580] Trial 6 finished with value: 0.15170904439378355 and parameters: {'n_estimators': 200, 'max_depth': 17, 'min_samples_split': 10, 'min_samples_leaf': 14, 'max_features': 'sqrt', 'criterion': 'gini', 'bootstrap': True}. Best is trial 0 with value: 0.1546549058399079.
[I 2025-12-03 22:11:29,862] Trial 7 finished with value: 0.16151590532978433 and parameters: {'n_estimators': 250, 'max_depth': 6, 'min_samples_split': 9, 'min_samples_leaf': 20, 'max_features': 'log2', 'criterion': 'entropy', 'bootstrap': False}. Best is trial 7 with value: 0.16151590532978433.
[I 2025-12-03 22:11:31,114] Trial 8 finished with value: 0.15193024026076402 and parameters: {'n_estimators': 100, 'max_depth': 8, 'min_samples_split': 9, 'min_samples_leaf': 1, 'max_features': 'log2', 'criterion': 'entropy', 'bootstrap': False}. Best is trial 7 with value: 0.16151590532978433.
[I 2025-12-03 22:11:32,543] Trial 9 finished with value: 0.14825927532216854 and parameters: {'n_estimators': 150, 'max_depth': 19, 'min_samples_split': 7, 'min_samples_leaf': 16, 'max_features': 'log2', 'criterion': 'gini', 'bootstrap': True}. Best is trial 7 with value: 0.16151590532978433.
[I 2025-12-03 22:11:34,848] Trial 10 finished with value: 0.1625645561833633 and parameters: {'n_estimators': 300, 'max_depth': 5, 'min_samples_split': 2, 'min_samples_leaf': 20, 'max_features': 'log2', 'criterion': 'log_loss', 'bootstrap': False}. Best is trial 10 with value: 0.1625645561833633.
[I 2025-12-03 22:11:37,178] Trial 11 finished with value: 0.16136144918528217 and parameters: {'n_estimators': 300, 'max_depth': 5, 'min_samples_split': 2, 'min_samples_leaf': 20, 'max_features': 'log2', 'criterion': 'log_loss', 'bootstrap': False}. Best is trial 10 with value: 0.1625645561833633.
[I 2025-12-03 22:11:39,510] Trial 12 finished with value: 0.1649909386670528 and parameters: {'n_estimators': 300, 'max_depth': 5, 'min_samples_split': 2, 'min_samples_leaf': 20, 'max_features': 'log2', 'criterion': 'log_loss', 'bootstrap': False}. Best is trial 12 with value: 0.1649909386670528.
[I 2025-12-03 22:11:42,813] Trial 13 finished with value: 0.1546572639302062 and parameters: {'n_estimators': 275, 'max_depth': 10, 'min_samples_split': 2, 'min_samples_leaf': 8, 'max_features': 'log2', 'criterion': 'log_loss', 'bootstrap': False}. Best is trial 12 with value: 0.1649909386670528.
[I 2025-12-03 22:11:45,402] Trial 14 finished with value: 0.16174788787197847 and parameters: {'n_estimators': 300, 'max_depth': 5, 'min_samples_split': 5, 'min_samples_leaf': 20, 'max_features': 'log2', 'criterion': 'log_loss', 'bootstrap': False}. Best is trial 12 with value: 0.1649909386670528.
[I 2025-12-03 22:11:48,666] Trial 15 finished with value: 0.15997540564601603 and parameters: {'n_estimators': 300, 'max_depth': 9, 'min_samples_split': 4, 'min_samples_leaf': 18, 'max_features': 'log2', 'criterion': 'log_loss', 'bootstrap': False}. Best is trial 12 with value: 0.1649909386670528.
[I 2025-12-03 22:11:51,426] Trial 16 finished with value: 0.14668257423533262 and parameters: {'n_estimators': 200, 'max_depth': 13, 'min_samples_split': 3, 'min_samples_leaf': 6, 'max_features': 'log2', 'criterion': 'log_loss', 'bootstrap': False}. Best is trial 12 with value: 0.1649909386670528.
[I 2025-12-03 22:11:55,433] Trial 17 finished with value: 0.14799404560907584 and parameters: {'n_estimators': 275, 'max_depth': 27, 'min_samples_split': 6, 'min_samples_leaf': 12, 'max_features': 'log2', 'criterion': 'log_loss', 'bootstrap': False}. Best is trial 12 with value: 0.1649909386670528.
[I 2025-12-03 22:11:57,274] Trial 18 finished with value: 0.15794024549975544 and parameters: {'n_estimators': 225, 'max_depth': 8, 'min_samples_split': 20, 'min_samples_leaf': 18, 'max_features': 'log2', 'criterion': 'log_loss', 'bootstrap': True}. Best is trial 12 with value: 0.1649909386670528.
[I 2025-12-03 22:12:20,477] Trial 19 finished with value: 0.08429571109577583 and parameters: {'n_estimators': 275, 'max_depth': 24, 'min_samples_split': 8, 'min_samples_leaf': 18, 'max_features': None, 'criterion': 'gini', 'bootstrap': False}. Best is trial 12 with value: 0.1649909386670528.
[I 2025-12-03 22:12:22,827] Trial 20 finished with value: 0.153345007101159 and parameters: {'n_estimators': 150, 'max_depth': 15, 'min_samples_split': 4, 'min_samples_leaf': 11, 'max_features': 'log2', 'criterion': 'log_loss', 'bootstrap': False}. Best is trial 12 with value: 0.1649909386670528.
[I 2025-12-03 22:12:25,118] Trial 21 finished with value: 0.1611026019619473 and parameters: {'n_estimators': 300, 'max_depth': 5, 'min_samples_split': 5, 'min_samples_leaf': 20, 'max_features': 'log2', 'criterion': 'log_loss', 'bootstrap': False}. Best is trial 12 with value: 0.1649909386670528.
[I 2025-12-03 22:12:27,920] Trial 22 finished with value: 0.16324620758826425 and parameters: {'n_estimators': 300, 'max_depth': 7, 'min_samples_split': 2, 'min_samples_leaf': 18, 'max_features': 'log2', 'criterion': 'log_loss', 'bootstrap': False}. Best is trial 12 with value: 0.1649909386670528.
[I 2025-12-03 22:12:31,339] Trial 23 finished with value: 0.1567074669706136 and parameters: {'n_estimators': 275, 'max_depth': 11, 'min_samples_split': 2, 'min_samples_leaf': 18, 'max_features': 'log2', 'criterion': 'log_loss', 'bootstrap': False}. Best is trial 12 with value: 0.1649909386670528.
[I 2025-12-03 22:12:34,157] Trial 24 finished with value: 0.162691620488223 and parameters: {'n_estimators': 300, 'max_depth': 7, 'min_samples_split': 4, 'min_samples_leaf': 18, 'max_features': 'log2', 'criterion': 'log_loss', 'bootstrap': False}. Best is trial 12 with value: 0.1649909386670528.
[I 2025-12-03 22:12:36,510] Trial 25 finished with value: 0.1616295137501756 and parameters: {'n_estimators': 225, 'max_depth': 8, 'min_samples_split': 4, 'min_samples_leaf': 17, 'max_features': 'log2', 'criterion': 'log_loss', 'bootstrap': False}. Best is trial 12 with value: 0.1649909386670528.
[I 2025-12-03 22:12:38,675] Trial 26 finished with value: 0.15200216612549675 and parameters: {'n_estimators': 275, 'max_depth': 7, 'min_samples_split': 7, 'min_samples_leaf': 14, 'max_features': 'log2', 'criterion': 'gini', 'bootstrap': True}. Best is trial 12 with value: 0.1649909386670528.
[I 2025-12-03 22:12:41,435] Trial 27 finished with value: 0.15571494144492903 and parameters: {'n_estimators': 225, 'max_depth': 10, 'min_samples_split': 4, 'min_samples_leaf': 9, 'max_features': 'log2', 'criterion': 'log_loss', 'bootstrap': False}. Best is trial 12 with value: 0.1649909386670528.
[I 2025-12-03 22:12:44,468] Trial 28 finished with value: 0.15764426446187457 and parameters: {'n_estimators': 175, 'max_depth': 14, 'min_samples_split': 3, 'min_samples_leaf': 17, 'max_features': 'sqrt', 'criterion': 'log_loss', 'bootstrap': False}. Best is trial 12 with value: 0.1649909386670528.
[I 2025-12-03 22:13:06,873] Trial 29 finished with value: 0.12579093574051037 and parameters: {'n_estimators': 300, 'max_depth': 7, 'min_samples_split': 16, 'min_samples_leaf': 15, 'max_features': None, 'criterion': 'log_loss', 'bootstrap': False}. Best is trial 12 with value: 0.1649909386670528.
[I 2025-12-03 22:13:08,073] A new study created in memory with name: random_forest_fold_5
[I 2025-12-03 22:13:21,036] Trial 0 finished with value: 0.10412483118046456 and parameters: {'n_estimators': 200, 'max_depth': 12, 'min_samples_split': 16, 'min_samples_leaf': 1, 'max_features': None, 'criterion': 'log_loss', 'bootstrap': True}. Best is trial 0 with value: 0.10412483118046456.
[I 2025-12-03 22:13:23,022] Trial 1 finished with value: 0.13610641487179392 and parameters: {'n_estimators': 200, 'max_depth': 7, 'min_samples_split': 13, 'min_samples_leaf': 17, 'max_features': 'log2', 'criterion': 'entropy', 'bootstrap': False}. Best is trial 1 with value: 0.13610641487179392.
[I 2025-12-03 22:13:25,829] Trial 2 finished with value: 0.1275791854630312 and parameters: {'n_estimators': 300, 'max_depth': 9, 'min_samples_split': 6, 'min_samples_leaf': 9, 'max_features': 'sqrt', 'criterion': 'gini', 'bootstrap': True}. Best is trial 1 with value: 0.13610641487179392.
[I 2025-12-03 22:13:27,870] Trial 3 finished with value: 0.09535394328227473 and parameters: {'n_estimators': 225, 'max_depth': 21, 'min_samples_split': 8, 'min_samples_leaf': 4, 'max_features': 'log2', 'criterion': 'gini', 'bootstrap': True}. Best is trial 1 with value: 0.13610641487179392.
[I 2025-12-03 22:14:05,715] Trial 4 finished with value: 0.06293997624043426 and parameters: {'n_estimators': 275, 'max_depth': 29, 'min_samples_split': 9, 'min_samples_leaf': 4, 'max_features': None, 'criterion': 'entropy', 'bootstrap': False}. Best is trial 1 with value: 0.13610641487179392.
[I 2025-12-03 22:14:06,901] Trial 5 finished with value: 0.12175879924556876 and parameters: {'n_estimators': 100, 'max_depth': 15, 'min_samples_split': 11, 'min_samples_leaf': 11, 'max_features': 'log2', 'criterion': 'entropy', 'bootstrap': True}. Best is trial 1 with value: 0.13610641487179392.
[I 2025-12-03 22:14:09,578] Trial 6 finished with value: 0.11855542470779304 and parameters: {'n_estimators': 250, 'max_depth': 10, 'min_samples_split': 2, 'min_samples_leaf': 5, 'max_features': 'sqrt', 'criterion': 'entropy', 'bootstrap': True}. Best is trial 1 with value: 0.13610641487179392.
[I 2025-12-03 22:14:12,315] Trial 7 finished with value: 0.11956156937533087 and parameters: {'n_estimators': 275, 'max_depth': 9, 'min_samples_split': 17, 'min_samples_leaf': 4, 'max_features': 'sqrt', 'criterion': 'log_loss', 'bootstrap': True}. Best is trial 1 with value: 0.13610641487179392.
[I 2025-12-03 22:14:24,711] Trial 8 finished with value: 0.11171997648466696 and parameters: {'n_estimators': 175, 'max_depth': 29, 'min_samples_split': 5, 'min_samples_leaf': 9, 'max_features': None, 'criterion': 'log_loss', 'bootstrap': True}. Best is trial 1 with value: 0.13610641487179392.
[I 2025-12-03 22:14:28,810] Trial 9 finished with value: 0.10665749121258658 and parameters: {'n_estimators': 250, 'max_depth': 21, 'min_samples_split': 18, 'min_samples_leaf': 3, 'max_features': 'log2', 'criterion': 'entropy', 'bootstrap': False}. Best is trial 1 with value: 0.13610641487179392.
[I 2025-12-03 22:14:30,143] Trial 10 finished with value: 0.14255722972578327 and parameters: {'n_estimators': 150, 'max_depth': 5, 'min_samples_split': 14, 'min_samples_leaf': 20, 'max_features': 'log2', 'criterion': 'entropy', 'bootstrap': False}. Best is trial 10 with value: 0.14255722972578327.
[I 2025-12-03 22:14:31,492] Trial 11 finished with value: 0.14234580587990422 and parameters: {'n_estimators': 150, 'max_depth': 5, 'min_samples_split': 14, 'min_samples_leaf': 20, 'max_features': 'log2', 'criterion': 'entropy', 'bootstrap': False}. Best is trial 10 with value: 0.14255722972578327.
[I 2025-12-03 22:14:32,768] Trial 12 finished with value: 0.14135196578755985 and parameters: {'n_estimators': 125, 'max_depth': 6, 'min_samples_split': 14, 'min_samples_leaf': 20, 'max_features': 'log2', 'criterion': 'entropy', 'bootstrap': False}. Best is trial 10 with value: 0.14255722972578327.
[I 2025-12-03 22:14:34,109] Trial 13 finished with value: 0.13919661986013993 and parameters: {'n_estimators': 150, 'max_depth': 5, 'min_samples_split': 20, 'min_samples_leaf': 17, 'max_features': 'log2', 'criterion': 'entropy', 'bootstrap': False}. Best is trial 10 with value: 0.14255722972578327.
[I 2025-12-03 22:14:36,325] Trial 14 finished with value: 0.137324869161976 and parameters: {'n_estimators': 150, 'max_depth': 14, 'min_samples_split': 13, 'min_samples_leaf': 20, 'max_features': 'log2', 'criterion': 'entropy', 'bootstrap': False}. Best is trial 10 with value: 0.14255722972578327.
[I 2025-12-03 22:14:37,693] Trial 15 finished with value: 0.12837001020177785 and parameters: {'n_estimators': 100, 'max_depth': 19, 'min_samples_split': 15, 'min_samples_leaf': 15, 'max_features': 'log2', 'criterion': 'gini', 'bootstrap': False}. Best is trial 10 with value: 0.14255722972578327.
[I 2025-12-03 22:14:40,047] Trial 16 finished with value: 0.13125132090022623 and parameters: {'n_estimators': 150, 'max_depth': 24, 'min_samples_split': 11, 'min_samples_leaf': 14, 'max_features': 'log2', 'criterion': 'entropy', 'bootstrap': False}. Best is trial 10 with value: 0.14255722972578327.
[I 2025-12-03 22:14:41,526] Trial 17 finished with value: 0.1413878966973096 and parameters: {'n_estimators': 175, 'max_depth': 5, 'min_samples_split': 20, 'min_samples_leaf': 18, 'max_features': 'log2', 'criterion': 'entropy', 'bootstrap': False}. Best is trial 10 with value: 0.14255722972578327.
[I 2025-12-03 22:14:52,369] Trial 18 finished with value: 0.07400904433254014 and parameters: {'n_estimators': 125, 'max_depth': 12, 'min_samples_split': 12, 'min_samples_leaf': 14, 'max_features': None, 'criterion': 'gini', 'bootstrap': False}. Best is trial 10 with value: 0.14255722972578327.
[I 2025-12-03 22:14:55,637] Trial 19 finished with value: 0.12850402724553528 and parameters: {'n_estimators': 175, 'max_depth': 16, 'min_samples_split': 9, 'min_samples_leaf': 12, 'max_features': 'sqrt', 'criterion': 'log_loss', 'bootstrap': False}. Best is trial 10 with value: 0.14255722972578327.
[I 2025-12-03 22:14:57,330] Trial 20 finished with value: 0.1366812601560599 and parameters: {'n_estimators': 125, 'max_depth': 8, 'min_samples_split': 18, 'min_samples_leaf': 19, 'max_features': 'log2', 'criterion': 'entropy', 'bootstrap': False}. Best is trial 10 with value: 0.14255722972578327.
[I 2025-12-03 22:14:58,794] Trial 21 finished with value: 0.14082522936544598 and parameters: {'n_estimators': 175, 'max_depth': 5, 'min_samples_split': 20, 'min_samples_leaf': 18, 'max_features': 'log2', 'criterion': 'entropy', 'bootstrap': False}. Best is trial 10 with value: 0.14255722972578327.
[I 2025-12-03 22:15:01,313] Trial 22 finished with value: 0.13588495751964808 and parameters: {'n_estimators': 200, 'max_depth': 11, 'min_samples_split': 15, 'min_samples_leaf': 16, 'max_features': 'log2', 'criterion': 'entropy', 'bootstrap': False}. Best is trial 10 with value: 0.14255722972578327.
[I 2025-12-03 22:15:02,640] Trial 23 finished with value: 0.142412122714867 and parameters: {'n_estimators': 150, 'max_depth': 5, 'min_samples_split': 18, 'min_samples_leaf': 20, 'max_features': 'log2', 'criterion': 'entropy', 'bootstrap': False}. Best is trial 10 with value: 0.14255722972578327.
[I 2025-12-03 22:15:04,220] Trial 24 finished with value: 0.13660727386380656 and parameters: {'n_estimators': 150, 'max_depth': 7, 'min_samples_split': 17, 'min_samples_leaf': 20, 'max_features': 'log2', 'criterion': 'entropy', 'bootstrap': False}. Best is trial 10 with value: 0.14255722972578327.
[I 2025-12-03 22:15:05,809] Trial 25 finished with value: 0.13380136449142585 and parameters: {'n_estimators': 125, 'max_depth': 8, 'min_samples_split': 14, 'min_samples_leaf': 18, 'max_features': 'log2', 'criterion': 'entropy', 'bootstrap': False}. Best is trial 10 with value: 0.14255722972578327.
[I 2025-12-03 22:15:07,473] Trial 26 finished with value: 0.12566011760780288 and parameters: {'n_estimators': 100, 'max_depth': 13, 'min_samples_split': 18, 'min_samples_leaf': 13, 'max_features': 'log2', 'criterion': 'entropy', 'bootstrap': False}. Best is trial 10 with value: 0.14255722972578327.
[I 2025-12-03 22:15:09,401] Trial 27 finished with value: 0.1330362326862115 and parameters: {'n_estimators': 150, 'max_depth': 10, 'min_samples_split': 16, 'min_samples_leaf': 16, 'max_features': 'log2', 'criterion': 'entropy', 'bootstrap': False}. Best is trial 10 with value: 0.14255722972578327.
[I 2025-12-03 22:15:17,271] Trial 28 finished with value: 0.09269463397379715 and parameters: {'n_estimators': 125, 'max_depth': 7, 'min_samples_split': 12, 'min_samples_leaf': 19, 'max_features': None, 'criterion': 'gini', 'bootstrap': False}. Best is trial 10 with value: 0.14255722972578327.
[I 2025-12-03 22:15:21,477] Trial 29 finished with value: 0.11294377823722987 and parameters: {'n_estimators': 200, 'max_depth': 25, 'min_samples_split': 16, 'min_samples_leaf': 7, 'max_features': 'sqrt', 'criterion': 'log_loss', 'bootstrap': False}. Best is trial 10 with value: 0.14255722972578327.
[I 2025-12-03 22:15:35,939] A new study created in memory with name: gradient_boosting_fold_1
[I 2025-12-03 22:16:01,566] Trial 0 finished with value: 0.12957931761390173 and parameters: {'n_estimators': 150, 'learning_rate': 0.08855445852869713, 'max_depth': 14, 'min_samples_split': 18, 'min_samples_leaf': 15, 'subsample': 0.8164566451285562, 'max_features': 'sqrt'}. Best is trial 0 with value: 0.12957931761390173.
