[I 2025-12-03 21:55:54,407] A new study created in memory with name: k_nearest_neighbors_fold_1
[I 2025-12-03 21:55:54,784] Trial 0 finished with value: 0.08197892104138955 and parameters: {'n_neighbors': 4, 'weights': 'distance', 'algorithm': 'brute', 'p': 1, 'leaf_size': 35}. Best is trial 0 with value: 0.08197892104138955.
[I 2025-12-03 21:55:55,208] Trial 1 finished with value: 0.09705614975911696 and parameters: {'n_neighbors': 15, 'weights': 'distance', 'algorithm': 'brute', 'p': 1, 'leaf_size': 40}. Best is trial 1 with value: 0.09705614975911696.
[I 2025-12-03 21:55:55,391] Trial 2 finished with value: 0.08694200091995449 and parameters: {'n_neighbors': 7, 'weights': 'uniform', 'algorithm': 'brute', 'p': 2, 'leaf_size': 29}. Best is trial 1 with value: 0.09705614975911696.
[I 2025-12-03 21:55:55,828] Trial 3 finished with value: 0.1035647616479485 and parameters: {'n_neighbors': 20, 'weights': 'distance', 'algorithm': 'brute', 'p': 1, 'leaf_size': 22}. Best is trial 3 with value: 0.1035647616479485.
[I 2025-12-03 21:55:56,019] Trial 4 finished with value: 0.11650046581762523 and parameters: {'n_neighbors': 16, 'weights': 'distance', 'algorithm': 'auto', 'p': 2, 'leaf_size': 37}. Best is trial 4 with value: 0.11650046581762523.
[I 2025-12-03 21:56:00,140] Trial 5 finished with value: 0.11199471804873085 and parameters: {'n_neighbors': 13, 'weights': 'distance', 'algorithm': 'kd_tree', 'p': 2, 'leaf_size': 28}. Best is trial 4 with value: 0.11650046581762523.
[I 2025-12-03 21:56:03,125] Trial 6 finished with value: 0.1180040399241219 and parameters: {'n_neighbors': 17, 'weights': 'distance', 'algorithm': 'ball_tree', 'p': 2, 'leaf_size': 26}. Best is trial 6 with value: 0.1180040399241219.
[I 2025-12-03 21:56:06,047] Trial 7 finished with value: 0.09068766658785321 and parameters: {'n_neighbors': 10, 'weights': 'uniform', 'algorithm': 'ball_tree', 'p': 2, 'leaf_size': 25}. Best is trial 6 with value: 0.1180040399241219.
[I 2025-12-03 21:56:06,227] Trial 8 finished with value: 0.07712689142154913 and parameters: {'n_neighbors': 3, 'weights': 'uniform', 'algorithm': 'auto', 'p': 2, 'leaf_size': 35}. Best is trial 6 with value: 0.1180040399241219.
[I 2025-12-03 21:56:10,551] Trial 9 finished with value: 0.08390049367901427 and parameters: {'n_neighbors': 15, 'weights': 'uniform', 'algorithm': 'kd_tree', 'p': 1, 'leaf_size': 21}. Best is trial 6 with value: 0.1180040399241219.
[I 2025-12-03 21:56:13,429] Trial 10 finished with value: 0.12017816020804069 and parameters: {'n_neighbors': 19, 'weights': 'distance', 'algorithm': 'ball_tree', 'p': 2, 'leaf_size': 32}. Best is trial 10 with value: 0.12017816020804069.
[I 2025-12-03 21:56:16,240] Trial 11 finished with value: 0.1213972350746052 and parameters: {'n_neighbors': 20, 'weights': 'distance', 'algorithm': 'ball_tree', 'p': 2, 'leaf_size': 32}. Best is trial 11 with value: 0.1213972350746052.
[I 2025-12-03 21:56:19,118] Trial 12 finished with value: 0.1213972350746052 and parameters: {'n_neighbors': 20, 'weights': 'distance', 'algorithm': 'ball_tree', 'p': 2, 'leaf_size': 32}. Best is trial 11 with value: 0.1213972350746052.
[I 2025-12-03 21:56:21,910] Trial 13 finished with value: 0.1213972350746052 and parameters: {'n_neighbors': 20, 'weights': 'distance', 'algorithm': 'ball_tree', 'p': 2, 'leaf_size': 31}. Best is trial 11 with value: 0.1213972350746052.
[I 2025-12-03 21:56:24,757] Trial 14 finished with value: 0.11130196876250815 and parameters: {'n_neighbors': 11, 'weights': 'distance', 'algorithm': 'ball_tree', 'p': 2, 'leaf_size': 34}. Best is trial 11 with value: 0.1213972350746052.
[I 2025-12-03 21:56:27,550] Trial 15 finished with value: 0.11819422420579051 and parameters: {'n_neighbors': 18, 'weights': 'distance', 'algorithm': 'ball_tree', 'p': 2, 'leaf_size': 32}. Best is trial 11 with value: 0.1213972350746052.
[I 2025-12-03 21:56:30,288] Trial 16 finished with value: 0.11171655144214868 and parameters: {'n_neighbors': 13, 'weights': 'distance', 'algorithm': 'ball_tree', 'p': 2, 'leaf_size': 38}. Best is trial 11 with value: 0.1213972350746052.
[I 2025-12-03 21:56:33,358] Trial 17 finished with value: 0.08723013683744203 and parameters: {'n_neighbors': 9, 'weights': 'distance', 'algorithm': 'ball_tree', 'p': 1, 'leaf_size': 27}. Best is trial 11 with value: 0.1213972350746052.
[I 2025-12-03 21:56:37,404] Trial 18 finished with value: 0.0842434158616094 and parameters: {'n_neighbors': 6, 'weights': 'uniform', 'algorithm': 'kd_tree', 'p': 2, 'leaf_size': 24}. Best is trial 11 with value: 0.1213972350746052.
[I 2025-12-03 21:56:37,572] Trial 19 finished with value: 0.06058493299403208 and parameters: {'n_neighbors': 1, 'weights': 'distance', 'algorithm': 'auto', 'p': 2, 'leaf_size': 30}. Best is trial 11 with value: 0.1213972350746052.
[I 2025-12-03 21:56:40,567] Trial 20 finished with value: 0.09543488911740369 and parameters: {'n_neighbors': 13, 'weights': 'distance', 'algorithm': 'ball_tree', 'p': 1, 'leaf_size': 33}. Best is trial 11 with value: 0.1213972350746052.
[I 2025-12-03 21:56:43,803] Trial 21 finished with value: 0.1213972350746052 and parameters: {'n_neighbors': 20, 'weights': 'distance', 'algorithm': 'ball_tree', 'p': 2, 'leaf_size': 31}. Best is trial 11 with value: 0.1213972350746052.
[I 2025-12-03 21:56:46,885] Trial 22 finished with value: 0.11819422420579051 and parameters: {'n_neighbors': 18, 'weights': 'distance', 'algorithm': 'ball_tree', 'p': 2, 'leaf_size': 29}. Best is trial 11 with value: 0.1213972350746052.
[I 2025-12-03 21:56:49,823] Trial 23 finished with value: 0.12135716144121753 and parameters: {'n_neighbors': 20, 'weights': 'distance', 'algorithm': 'ball_tree', 'p': 2, 'leaf_size': 36}. Best is trial 11 with value: 0.1213972350746052.
[I 2025-12-03 21:56:52,699] Trial 24 finished with value: 0.1180040399241219 and parameters: {'n_neighbors': 17, 'weights': 'distance', 'algorithm': 'ball_tree', 'p': 2, 'leaf_size': 31}. Best is trial 11 with value: 0.1213972350746052.
[I 2025-12-03 21:56:55,578] Trial 25 finished with value: 0.11819422420579051 and parameters: {'n_neighbors': 18, 'weights': 'distance', 'algorithm': 'ball_tree', 'p': 2, 'leaf_size': 33}. Best is trial 11 with value: 0.1213972350746052.
[I 2025-12-03 21:56:58,558] Trial 26 finished with value: 0.09727279637266603 and parameters: {'n_neighbors': 15, 'weights': 'uniform', 'algorithm': 'ball_tree', 'p': 2, 'leaf_size': 29}. Best is trial 11 with value: 0.1213972350746052.
[I 2025-12-03 21:56:58,786] Trial 27 finished with value: 0.12145592965043898 and parameters: {'n_neighbors': 20, 'weights': 'distance', 'algorithm': 'auto', 'p': 2, 'leaf_size': 31}. Best is trial 27 with value: 0.12145592965043898.
[I 2025-12-03 21:56:58,985] Trial 28 finished with value: 0.11833936895501543 and parameters: {'n_neighbors': 17, 'weights': 'distance', 'algorithm': 'auto', 'p': 2, 'leaf_size': 39}. Best is trial 27 with value: 0.12145592965043898.
[I 2025-12-03 21:56:59,422] Trial 29 finished with value: 0.09954355004682447 and parameters: {'n_neighbors': 19, 'weights': 'distance', 'algorithm': 'auto', 'p': 1, 'leaf_size': 35}. Best is trial 27 with value: 0.12145592965043898.
[I 2025-12-03 21:57:00,402] A new study created in memory with name: k_nearest_neighbors_fold_2
[I 2025-12-03 21:57:04,650] Trial 0 finished with value: 0.09998619792752342 and parameters: {'n_neighbors': 17, 'weights': 'uniform', 'algorithm': 'kd_tree', 'p': 2, 'leaf_size': 20}. Best is trial 0 with value: 0.09998619792752342.
[I 2025-12-03 21:57:04,847] Trial 1 finished with value: 0.09699866545041312 and parameters: {'n_neighbors': 16, 'weights': 'uniform', 'algorithm': 'auto', 'p': 2, 'leaf_size': 27}. Best is trial 0 with value: 0.09998619792752342.
[I 2025-12-03 21:57:08,233] Trial 2 finished with value: 0.07624769402549944 and parameters: {'n_neighbors': 5, 'weights': 'uniform', 'algorithm': 'kd_tree', 'p': 2, 'leaf_size': 37}. Best is trial 0 with value: 0.09998619792752342.
[I 2025-12-03 21:57:11,782] Trial 3 finished with value: 0.0871810345926097 and parameters: {'n_neighbors': 18, 'weights': 'uniform', 'algorithm': 'kd_tree', 'p': 1, 'leaf_size': 37}. Best is trial 0 with value: 0.09998619792752342.
[I 2025-12-03 21:57:12,198] Trial 4 finished with value: 0.08294531016376845 and parameters: {'n_neighbors': 13, 'weights': 'uniform', 'algorithm': 'brute', 'p': 1, 'leaf_size': 27}. Best is trial 0 with value: 0.09998619792752342.
[I 2025-12-03 21:57:12,609] Trial 5 finished with value: 0.07309324582710555 and parameters: {'n_neighbors': 5, 'weights': 'uniform', 'algorithm': 'brute', 'p': 1, 'leaf_size': 32}. Best is trial 0 with value: 0.09998619792752342.
[I 2025-12-03 21:57:13,031] Trial 6 finished with value: 0.09312645449374546 and parameters: {'n_neighbors': 11, 'weights': 'distance', 'algorithm': 'auto', 'p': 1, 'leaf_size': 39}. Best is trial 0 with value: 0.09998619792752342.
[I 2025-12-03 21:57:13,213] Trial 7 finished with value: 0.08269316709979252 and parameters: {'n_neighbors': 7, 'weights': 'uniform', 'algorithm': 'auto', 'p': 2, 'leaf_size': 31}. Best is trial 0 with value: 0.09998619792752342.
[I 2025-12-03 21:57:13,566] Trial 8 finished with value: 0.10088645695242975 and parameters: {'n_neighbors': 18, 'weights': 'distance', 'algorithm': 'brute', 'p': 1, 'leaf_size': 24}. Best is trial 8 with value: 0.10088645695242975.
[I 2025-12-03 21:57:13,756] Trial 9 finished with value: 0.09775828821188268 and parameters: {'n_neighbors': 10, 'weights': 'distance', 'algorithm': 'auto', 'p': 2, 'leaf_size': 38}. Best is trial 8 with value: 0.10088645695242975.
[I 2025-12-03 21:57:16,949] Trial 10 finished with value: 0.10019001120039675 and parameters: {'n_neighbors': 20, 'weights': 'distance', 'algorithm': 'ball_tree', 'p': 1, 'leaf_size': 20}. Best is trial 8 with value: 0.10088645695242975.
[I 2025-12-03 21:57:20,126] Trial 11 finished with value: 0.10019001120039675 and parameters: {'n_neighbors': 20, 'weights': 'distance', 'algorithm': 'ball_tree', 'p': 1, 'leaf_size': 20}. Best is trial 8 with value: 0.10088645695242975.
[I 2025-12-03 21:57:23,263] Trial 12 finished with value: 0.10019001120039675 and parameters: {'n_neighbors': 20, 'weights': 'distance', 'algorithm': 'ball_tree', 'p': 1, 'leaf_size': 24}. Best is trial 8 with value: 0.10088645695242975.
[I 2025-12-03 21:57:26,536] Trial 13 finished with value: 0.05678178804425621 and parameters: {'n_neighbors': 1, 'weights': 'distance', 'algorithm': 'ball_tree', 'p': 1, 'leaf_size': 23}. Best is trial 8 with value: 0.10088645695242975.
[I 2025-12-03 21:57:26,973] Trial 14 finished with value: 0.09698156605046643 and parameters: {'n_neighbors': 14, 'weights': 'distance', 'algorithm': 'brute', 'p': 1, 'leaf_size': 24}. Best is trial 8 with value: 0.10088645695242975.
[I 2025-12-03 21:57:30,162] Trial 15 finished with value: 0.10071905093924267 and parameters: {'n_neighbors': 16, 'weights': 'distance', 'algorithm': 'ball_tree', 'p': 1, 'leaf_size': 27}. Best is trial 8 with value: 0.10088645695242975.
[I 2025-12-03 21:57:30,600] Trial 16 finished with value: 0.09698156605046643 and parameters: {'n_neighbors': 14, 'weights': 'distance', 'algorithm': 'brute', 'p': 1, 'leaf_size': 28}. Best is trial 8 with value: 0.10088645695242975.
[I 2025-12-03 21:57:31,039] Trial 17 finished with value: 0.10102383072572216 and parameters: {'n_neighbors': 16, 'weights': 'distance', 'algorithm': 'brute', 'p': 1, 'leaf_size': 33}. Best is trial 17 with value: 0.10102383072572216.
[I 2025-12-03 21:57:31,480] Trial 18 finished with value: 0.09312645449374546 and parameters: {'n_neighbors': 11, 'weights': 'distance', 'algorithm': 'brute', 'p': 1, 'leaf_size': 34}. Best is trial 17 with value: 0.10102383072572216.
[I 2025-12-03 21:57:31,936] Trial 19 finished with value: 0.10162282237407572 and parameters: {'n_neighbors': 17, 'weights': 'distance', 'algorithm': 'brute', 'p': 1, 'leaf_size': 34}. Best is trial 19 with value: 0.10162282237407572.
[I 2025-12-03 21:57:32,154] Trial 20 finished with value: 0.10454615128263697 and parameters: {'n_neighbors': 13, 'weights': 'distance', 'algorithm': 'brute', 'p': 2, 'leaf_size': 34}. Best is trial 20 with value: 0.10454615128263697.
[I 2025-12-03 21:57:32,372] Trial 21 finished with value: 0.10454615128263697 and parameters: {'n_neighbors': 13, 'weights': 'distance', 'algorithm': 'brute', 'p': 2, 'leaf_size': 35}. Best is trial 20 with value: 0.10454615128263697.
[I 2025-12-03 21:57:32,580] Trial 22 finished with value: 0.10454615128263697 and parameters: {'n_neighbors': 13, 'weights': 'distance', 'algorithm': 'brute', 'p': 2, 'leaf_size': 34}. Best is trial 20 with value: 0.10454615128263697.
[I 2025-12-03 21:57:32,783] Trial 23 finished with value: 0.0951621384024068 and parameters: {'n_neighbors': 9, 'weights': 'distance', 'algorithm': 'brute', 'p': 2, 'leaf_size': 35}. Best is trial 20 with value: 0.10454615128263697.
[I 2025-12-03 21:57:33,001] Trial 24 finished with value: 0.10454615128263697 and parameters: {'n_neighbors': 13, 'weights': 'distance', 'algorithm': 'brute', 'p': 2, 'leaf_size': 36}. Best is trial 20 with value: 0.10454615128263697.
[I 2025-12-03 21:57:33,217] Trial 25 finished with value: 0.10328721497634652 and parameters: {'n_neighbors': 12, 'weights': 'distance', 'algorithm': 'brute', 'p': 2, 'leaf_size': 40}. Best is trial 20 with value: 0.10454615128263697.
[I 2025-12-03 21:57:33,427] Trial 26 finished with value: 0.09579923437927974 and parameters: {'n_neighbors': 8, 'weights': 'distance', 'algorithm': 'brute', 'p': 2, 'leaf_size': 30}. Best is trial 20 with value: 0.10454615128263697.
[I 2025-12-03 21:57:33,644] Trial 27 finished with value: 0.10699927155777995 and parameters: {'n_neighbors': 14, 'weights': 'distance', 'algorithm': 'brute', 'p': 2, 'leaf_size': 30}. Best is trial 27 with value: 0.10699927155777995.
[I 2025-12-03 21:57:33,849] Trial 28 finished with value: 0.107884612074064 and parameters: {'n_neighbors': 15, 'weights': 'distance', 'algorithm': 'brute', 'p': 2, 'leaf_size': 30}. Best is trial 28 with value: 0.107884612074064.
[I 2025-12-03 21:57:38,115] Trial 29 finished with value: 0.1073795187209107 and parameters: {'n_neighbors': 15, 'weights': 'distance', 'algorithm': 'kd_tree', 'p': 2, 'leaf_size': 29}. Best is trial 28 with value: 0.107884612074064.
[I 2025-12-03 21:57:38,801] A new study created in memory with name: k_nearest_neighbors_fold_3
[I 2025-12-03 21:57:42,096] Trial 0 finished with value: 0.06155422099261593 and parameters: {'n_neighbors': 1, 'weights': 'uniform', 'algorithm': 'kd_tree', 'p': 2, 'leaf_size': 40}. Best is trial 0 with value: 0.06155422099261593.
[I 2025-12-03 21:57:42,300] Trial 1 finished with value: 0.09711067782987606 and parameters: {'n_neighbors': 11, 'weights': 'uniform', 'algorithm': 'brute', 'p': 2, 'leaf_size': 31}. Best is trial 1 with value: 0.09711067782987606.
[I 2025-12-03 21:57:42,490] Trial 2 finished with value: 0.10568092091506572 and parameters: {'n_neighbors': 18, 'weights': 'uniform', 'algorithm': 'brute', 'p': 2, 'leaf_size': 40}. Best is trial 2 with value: 0.10568092091506572.
[I 2025-12-03 21:57:42,690] Trial 3 finished with value: 0.09480235841214266 and parameters: {'n_neighbors': 10, 'weights': 'uniform', 'algorithm': 'brute', 'p': 2, 'leaf_size': 26}. Best is trial 2 with value: 0.10568092091506572.
[I 2025-12-03 21:57:45,925] Trial 4 finished with value: 0.09627044574007147 and parameters: {'n_neighbors': 17, 'weights': 'distance', 'algorithm': 'ball_tree', 'p': 1, 'leaf_size': 36}. Best is trial 2 with value: 0.10568092091506572.
[I 2025-12-03 21:57:46,126] Trial 5 finished with value: 0.10568092091506572 and parameters: {'n_neighbors': 18, 'weights': 'uniform', 'algorithm': 'auto', 'p': 2, 'leaf_size': 38}. Best is trial 2 with value: 0.10568092091506572.
[I 2025-12-03 21:57:49,586] Trial 6 finished with value: 0.09220067330490261 and parameters: {'n_neighbors': 12, 'weights': 'distance', 'algorithm': 'ball_tree', 'p': 1, 'leaf_size': 29}. Best is trial 2 with value: 0.10568092091506572.
[I 2025-12-03 21:57:53,084] Trial 7 finished with value: 0.11008076210093601 and parameters: {'n_neighbors': 11, 'weights': 'distance', 'algorithm': 'kd_tree', 'p': 2, 'leaf_size': 36}. Best is trial 7 with value: 0.11008076210093601.
[I 2025-12-03 21:57:57,451] Trial 8 finished with value: 0.06955932593568095 and parameters: {'n_neighbors': 5, 'weights': 'uniform', 'algorithm': 'kd_tree', 'p': 1, 'leaf_size': 26}. Best is trial 7 with value: 0.11008076210093601.
[I 2025-12-03 21:58:00,967] Trial 9 finished with value: 0.10237059420735158 and parameters: {'n_neighbors': 14, 'weights': 'uniform', 'algorithm': 'kd_tree', 'p': 2, 'leaf_size': 40}. Best is trial 7 with value: 0.11008076210093601.
[I 2025-12-03 21:58:01,374] Trial 10 finished with value: 0.08341273135166002 and parameters: {'n_neighbors': 7, 'weights': 'distance', 'algorithm': 'auto', 'p': 1, 'leaf_size': 21}. Best is trial 7 with value: 0.11008076210093601.
[I 2025-12-03 21:58:01,586] Trial 11 finished with value: 0.1232379457875499 and parameters: {'n_neighbors': 20, 'weights': 'distance', 'algorithm': 'brute', 'p': 2, 'leaf_size': 34}. Best is trial 11 with value: 0.1232379457875499.
[I 2025-12-03 21:58:05,938] Trial 12 finished with value: 0.12310615855905052 and parameters: {'n_neighbors': 20, 'weights': 'distance', 'algorithm': 'kd_tree', 'p': 2, 'leaf_size': 34}. Best is trial 11 with value: 0.1232379457875499.
[I 2025-12-03 21:58:06,164] Trial 13 finished with value: 0.12179542047065046 and parameters: {'n_neighbors': 19, 'weights': 'distance', 'algorithm': 'brute', 'p': 2, 'leaf_size': 33}. Best is trial 11 with value: 0.1232379457875499.
[I 2025-12-03 21:58:10,543] Trial 14 finished with value: 0.12310615855905052 and parameters: {'n_neighbors': 20, 'weights': 'distance', 'algorithm': 'kd_tree', 'p': 2, 'leaf_size': 33}. Best is trial 11 with value: 0.1232379457875499.
[I 2025-12-03 21:58:10,766] Trial 15 finished with value: 0.11817521302318135 and parameters: {'n_neighbors': 15, 'weights': 'distance', 'algorithm': 'brute', 'p': 2, 'leaf_size': 34}. Best is trial 11 with value: 0.1232379457875499.
[I 2025-12-03 21:58:10,983] Trial 16 finished with value: 0.11817521302318135 and parameters: {'n_neighbors': 15, 'weights': 'distance', 'algorithm': 'auto', 'p': 2, 'leaf_size': 29}. Best is trial 11 with value: 0.1232379457875499.
[I 2025-12-03 21:58:14,065] Trial 17 finished with value: 0.0981488637361406 and parameters: {'n_neighbors': 20, 'weights': 'distance', 'algorithm': 'ball_tree', 'p': 1, 'leaf_size': 36}. Best is trial 11 with value: 0.1232379457875499.
[I 2025-12-03 21:58:14,284] Trial 18 finished with value: 0.11817521302318135 and parameters: {'n_neighbors': 15, 'weights': 'distance', 'algorithm': 'brute', 'p': 2, 'leaf_size': 31}. Best is trial 11 with value: 0.1232379457875499.
[I 2025-12-03 21:58:18,623] Trial 19 finished with value: 0.11713641608379013 and parameters: {'n_neighbors': 17, 'weights': 'distance', 'algorithm': 'kd_tree', 'p': 2, 'leaf_size': 26}. Best is trial 11 with value: 0.1232379457875499.
[I 2025-12-03 21:58:19,048] Trial 20 finished with value: 0.08677982707759573 and parameters: {'n_neighbors': 8, 'weights': 'distance', 'algorithm': 'brute', 'p': 1, 'leaf_size': 21}. Best is trial 11 with value: 0.1232379457875499.
[I 2025-12-03 21:58:23,397] Trial 21 finished with value: 0.12310615855905052 and parameters: {'n_neighbors': 20, 'weights': 'distance', 'algorithm': 'kd_tree', 'p': 2, 'leaf_size': 33}. Best is trial 11 with value: 0.1232379457875499.
[I 2025-12-03 21:58:27,827] Trial 22 finished with value: 0.12310615855905052 and parameters: {'n_neighbors': 20, 'weights': 'distance', 'algorithm': 'kd_tree', 'p': 2, 'leaf_size': 34}. Best is trial 11 with value: 0.1232379457875499.
[I 2025-12-03 21:58:32,229] Trial 23 finished with value: 0.11713641608379013 and parameters: {'n_neighbors': 17, 'weights': 'distance', 'algorithm': 'kd_tree', 'p': 2, 'leaf_size': 32}. Best is trial 11 with value: 0.1232379457875499.
[I 2025-12-03 21:58:35,652] Trial 24 finished with value: 0.1144337599026966 and parameters: {'n_neighbors': 13, 'weights': 'distance', 'algorithm': 'kd_tree', 'p': 2, 'leaf_size': 37}. Best is trial 11 with value: 0.1232379457875499.
[I 2025-12-03 21:58:40,001] Trial 25 finished with value: 0.12004594470323773 and parameters: {'n_neighbors': 18, 'weights': 'distance', 'algorithm': 'kd_tree', 'p': 2, 'leaf_size': 29}. Best is trial 11 with value: 0.1232379457875499.
[I 2025-12-03 21:58:40,229] Trial 26 finished with value: 0.11753530613598857 and parameters: {'n_neighbors': 16, 'weights': 'distance', 'algorithm': 'auto', 'p': 2, 'leaf_size': 35}. Best is trial 11 with value: 0.1232379457875499.
[I 2025-12-03 21:58:43,217] Trial 27 finished with value: 0.12419221244942402 and parameters: {'n_neighbors': 20, 'weights': 'distance', 'algorithm': 'ball_tree', 'p': 2, 'leaf_size': 38}. Best is trial 27 with value: 0.12419221244942402.
[I 2025-12-03 21:58:46,196] Trial 28 finished with value: 0.1223900920230923 and parameters: {'n_neighbors': 19, 'weights': 'distance', 'algorithm': 'ball_tree', 'p': 2, 'leaf_size': 38}. Best is trial 27 with value: 0.12419221244942402.
[I 2025-12-03 21:58:49,064] Trial 29 finished with value: 0.06155422099261593 and parameters: {'n_neighbors': 1, 'weights': 'distance', 'algorithm': 'ball_tree', 'p': 2, 'leaf_size': 38}. Best is trial 27 with value: 0.12419221244942402.
[I 2025-12-03 21:59:01,285] A new study created in memory with name: k_nearest_neighbors_fold_4
[I 2025-12-03 21:59:01,406] Trial 0 finished with value: 0.09748978795207724 and parameters: {'n_neighbors': 7, 'weights': 'uniform', 'algorithm': 'auto', 'p': 2, 'leaf_size': 28}. Best is trial 0 with value: 0.09748978795207724.
[I 2025-12-03 21:59:01,612] Trial 1 finished with value: 0.10821369641774328 and parameters: {'n_neighbors': 18, 'weights': 'uniform', 'algorithm': 'brute', 'p': 2, 'leaf_size': 24}. Best is trial 1 with value: 0.10821369641774328.
