[I 2025-12-04 05:21:14,661] Trial 4 finished with value: 0.08013344209575031 and parameters: {'iterations': 520, 'learning_rate': 0.1878619811137117, 'depth': 7, 'l2_leaf_reg': 6.470132702656023, 'border_count': 124, 'bagging_temperature': 0.47457624548377986, 'random_strength': 0.46499502206623666, 'scale_pos_weight': 50.85938316650825}. Best is trial 1 with value: 0.08828185439283832.
[I 2025-12-04 05:21:17,514] Trial 5 finished with value: 0.08960144806374508 and parameters: {'iterations': 475, 'learning_rate': 0.2385366700549974, 'depth': 4, 'l2_leaf_reg': 6.990556037362833, 'border_count': 130, 'bagging_temperature': 0.9730023650203921, 'random_strength': 0.07278066663570992, 'scale_pos_weight': 28.488254224163825}. Best is trial 5 with value: 0.08960144806374508.
[I 2025-12-04 05:21:19,160] Trial 6 finished with value: 0.08645677458964879 and parameters: {'iterations': 225, 'learning_rate': 0.23110946660052406, 'depth': 4, 'l2_leaf_reg': 1.8481000213770575, 'border_count': 86, 'bagging_temperature': 0.7827253309647968, 'random_strength': 0.2934885040321493, 'scale_pos_weight': 50.55964147023658}. Best is trial 5 with value: 0.08960144806374508.
[I 2025-12-04 05:21:55,131] Trial 7 finished with value: 0.07650425989334844 and parameters: {'iterations': 431, 'learning_rate': 0.13778574332303176, 'depth': 9, 'l2_leaf_reg': 2.8492896656934534, 'border_count': 163, 'bagging_temperature': 0.5647053404114646, 'random_strength': 0.5634830141819044, 'scale_pos_weight': 35.53268737618934}. Best is trial 5 with value: 0.08960144806374508.
[I 2025-12-04 05:22:50,668] Trial 8 finished with value: 0.07666658565144349 and parameters: {'iterations': 810, 'learning_rate': 0.2031094303526969, 'depth': 10, 'l2_leaf_reg': 1.1605116188360676, 'border_count': 133, 'bagging_temperature': 0.5520886500301753, 'random_strength': 0.9855150693152114, 'scale_pos_weight': 41.812855679362556}. Best is trial 5 with value: 0.08960144806374508.
[I 2025-12-04 05:22:55,926] Trial 9 finished with value: 0.091482409657517 and parameters: {'iterations': 866, 'learning_rate': 0.12198779278857709, 'depth': 5, 'l2_leaf_reg': 8.172139464381935, 'border_count': 104, 'bagging_temperature': 0.607222672870192, 'random_strength': 0.9391768266171513, 'scale_pos_weight': 9.097919924385872}. Best is trial 9 with value: 0.091482409657517.
[I 2025-12-04 05:23:02,883] Trial 10 finished with value: 0.12127028230392511 and parameters: {'iterations': 989, 'learning_rate': 0.04615968055354487, 'depth': 5, 'l2_leaf_reg': 9.97297463723047, 'border_count': 248, 'bagging_temperature': 0.7287722877491176, 'random_strength': 0.9719631624196174, 'scale_pos_weight': 5.975032185411308}. Best is trial 10 with value: 0.12127028230392511.
[I 2025-12-04 05:23:09,480] Trial 11 finished with value: 0.11727741622779626 and parameters: {'iterations': 956, 'learning_rate': 0.033500947399398885, 'depth': 5, 'l2_leaf_reg': 9.952340046395985, 'border_count': 241, 'bagging_temperature': 0.7389668767204424, 'random_strength': 0.9533214028979242, 'scale_pos_weight': 7.503171796490171}. Best is trial 10 with value: 0.12127028230392511.
[I 2025-12-04 05:23:16,980] Trial 12 finished with value: 0.11887618447598962 and parameters: {'iterations': 995, 'learning_rate': 0.03355388531785472, 'depth': 5, 'l2_leaf_reg': 9.627752160551193, 'border_count': 252, 'bagging_temperature': 0.7553660964995872, 'random_strength': 0.7521935126226807, 'scale_pos_weight': 7.617667469952797}. Best is trial 10 with value: 0.12127028230392511.
[I 2025-12-04 05:23:23,202] Trial 13 finished with value: 0.1366852386284882 and parameters: {'iterations': 961, 'learning_rate': 0.013052869193744127, 'depth': 5, 'l2_leaf_reg': 9.978174032617376, 'border_count': 194, 'bagging_temperature': 0.7926933599513855, 'random_strength': 0.768123381484285, 'scale_pos_weight': 18.0599116480849}. Best is trial 13 with value: 0.1366852386284882.
[I 2025-12-04 05:23:29,723] Trial 14 finished with value: 0.08986501863377054 and parameters: {'iterations': 798, 'learning_rate': 0.08207497517821175, 'depth': 6, 'l2_leaf_reg': 8.582240923614094, 'border_count': 188, 'bagging_temperature': 0.8107902332777221, 'random_strength': 0.8163994736461028, 'scale_pos_weight': 18.478377816491747}. Best is trial 13 with value: 0.1366852386284882.
[I 2025-12-04 05:24:07,657] Trial 15 finished with value: 0.0937381533671594 and parameters: {'iterations': 919, 'learning_rate': 0.015359799463229944, 'depth': 8, 'l2_leaf_reg': 5.094514889709451, 'border_count': 199, 'bagging_temperature': 0.6728949018277964, 'random_strength': 0.7055134248032595, 'scale_pos_weight': 22.40080802001599}. Best is trial 13 with value: 0.1366852386284882.
[I 2025-12-04 05:24:12,099] Trial 16 finished with value: 0.11596890092144799 and parameters: {'iterations': 689, 'learning_rate': 0.07289239406566225, 'depth': 4, 'l2_leaf_reg': 7.506046353050561, 'border_count': 170, 'bagging_temperature': 0.9120997073683808, 'random_strength': 0.8646358649492429, 'scale_pos_weight': 14.851918913224111}. Best is trial 13 with value: 0.1366852386284882.
[I 2025-12-04 05:24:14,966] Trial 17 finished with value: 0.12855560574421607 and parameters: {'iterations': 371, 'learning_rate': 0.07493306496434958, 'depth': 5, 'l2_leaf_reg': 9.520407562612414, 'border_count': 224, 'bagging_temperature': 0.3771222387365927, 'random_strength': 0.5979339768266421, 'scale_pos_weight': 5.360162760333202}. Best is trial 13 with value: 0.1366852386284882.
[I 2025-12-04 05:24:18,231] Trial 18 finished with value: 0.09061972822192756 and parameters: {'iterations': 339, 'learning_rate': 0.09165129196255227, 'depth': 6, 'l2_leaf_reg': 4.300347163229906, 'border_count': 216, 'bagging_temperature': 0.4147466399101617, 'random_strength': 0.5186520796604331, 'scale_pos_weight': 34.83220841561506}. Best is trial 13 with value: 0.1366852386284882.
[I 2025-12-04 05:24:22,752] Trial 19 finished with value: 0.09759205901690045 and parameters: {'iterations': 338, 'learning_rate': 0.2984157143851892, 'depth': 7, 'l2_leaf_reg': 8.905427748601465, 'border_count': 165, 'bagging_temperature': 0.18883242361076796, 'random_strength': 0.6348338531531835, 'scale_pos_weight': 15.114927305888452}. Best is trial 13 with value: 0.1366852386284882.
[I 2025-12-04 05:24:25,095] Trial 20 finished with value: 0.145799022321711 and parameters: {'iterations': 350, 'learning_rate': 0.01046530734541218, 'depth': 4, 'l2_leaf_reg': 6.185175176045664, 'border_count': 222, 'bagging_temperature': 0.21185192889753438, 'random_strength': 0.4346624949837415, 'scale_pos_weight': 12.337464241911931}. Best is trial 20 with value: 0.145799022321711.
[I 2025-12-04 05:24:27,534] Trial 21 finished with value: 0.14512810544854465 and parameters: {'iterations': 365, 'learning_rate': 0.011948016386384533, 'depth': 4, 'l2_leaf_reg': 6.128740952676484, 'border_count': 220, 'bagging_temperature': 0.16568422413286465, 'random_strength': 0.41629905941812356, 'scale_pos_weight': 12.714207813957607}. Best is trial 20 with value: 0.145799022321711.
[I 2025-12-04 05:24:29,502] Trial 22 finished with value: 0.1474341576953866 and parameters: {'iterations': 276, 'learning_rate': 0.015157575176527951, 'depth': 4, 'l2_leaf_reg': 6.149248326558108, 'border_count': 196, 'bagging_temperature': 0.07717870377421099, 'random_strength': 0.4282631428374576, 'scale_pos_weight': 12.61080123139207}. Best is trial 22 with value: 0.1474341576953866.
[I 2025-12-04 05:24:30,781] Trial 23 finished with value: 0.14060327195420821 and parameters: {'iterations': 127, 'learning_rate': 0.05352941556245938, 'depth': 4, 'l2_leaf_reg': 6.09698433057568, 'border_count': 232, 'bagging_temperature': 0.03736094617534358, 'random_strength': 0.41403886415559626, 'scale_pos_weight': 13.131568203987738}. Best is trial 22 with value: 0.1474341576953866.
[I 2025-12-04 05:24:32,868] Trial 24 finished with value: 0.14227646509416209 and parameters: {'iterations': 293, 'learning_rate': 0.012101423990514218, 'depth': 4, 'l2_leaf_reg': 4.639345917333902, 'border_count': 206, 'bagging_temperature': 0.1703948407675219, 'random_strength': 0.3908150281377839, 'scale_pos_weight': 24.436695977591945}. Best is trial 22 with value: 0.1474341576953866.
[I 2025-12-04 05:24:34,894] Trial 25 finished with value: 0.11594983014611107 and parameters: {'iterations': 258, 'learning_rate': 0.1036300825528745, 'depth': 4, 'l2_leaf_reg': 5.9945947286739765, 'border_count': 182, 'bagging_temperature': 0.10709806019754373, 'random_strength': 0.14945139382588524, 'scale_pos_weight': 17.829361303159505}. Best is trial 22 with value: 0.1474341576953866.
[I 2025-12-04 05:24:37,620] Trial 26 finished with value: 0.13395212101573659 and parameters: {'iterations': 418, 'learning_rate': 0.05201807788202327, 'depth': 4, 'l2_leaf_reg': 7.116634938015323, 'border_count': 152, 'bagging_temperature': 0.3104839734269331, 'random_strength': 0.21385725853679155, 'scale_pos_weight': 11.439828474391112}. Best is trial 22 with value: 0.1474341576953866.
[I 2025-12-04 05:24:42,171] Trial 27 finished with value: 0.1199788548104038 and parameters: {'iterations': 581, 'learning_rate': 0.03191292926915307, 'depth': 5, 'l2_leaf_reg': 3.8496417839626806, 'border_count': 233, 'bagging_temperature': 0.21235188589604528, 'random_strength': 0.3776856753417254, 'scale_pos_weight': 32.28495916045159}. Best is trial 22 with value: 0.1474341576953866.
[I 2025-12-04 05:24:43,478] Trial 28 finished with value: 0.12372884981350718 and parameters: {'iterations': 134, 'learning_rate': 0.17800910707139483, 'depth': 4, 'l2_leaf_reg': 7.684557994056508, 'border_count': 209, 'bagging_temperature': 0.10900992300869795, 'random_strength': 0.48907928194564687, 'scale_pos_weight': 10.851463066239637}. Best is trial 22 with value: 0.1474341576953866.
[I 2025-12-04 05:24:53,962] Trial 29 finished with value: 0.08917518018294243 and parameters: {'iterations': 281, 'learning_rate': 0.06361649924383742, 'depth': 8, 'l2_leaf_reg': 5.672598900815524, 'border_count': 177, 'bagging_temperature': 0.06268860636330656, 'random_strength': 0.22628127743302456, 'scale_pos_weight': 27.96214593296022}. Best is trial 22 with value: 0.1474341576953866.
[I 2025-12-04 05:25:10,805] A new study created in memory with name: multi_layer_perceptron_fold_1
[I 2025-12-04 05:25:15,796] Trial 0 finished with value: 0.12230585600527158 and parameters: {'n_layers': 1, 'layer_0_size': 95, 'activation': 'relu', 'alpha': 0.02239564971027226, 'learning_rate': 'constant', 'solver': 'adam', 'learning_rate_init': 0.0048174205580559844, 'max_iter': 311}. Best is trial 0 with value: 0.12230585600527158.
[I 2025-12-04 05:25:42,237] Trial 1 finished with value: 0.07301931035117888 and parameters: {'n_layers': 3, 'layer_0_size': 123, 'layer_1_size': 164, 'layer_2_size': 89, 'activation': 'logistic', 'alpha': 0.0007290448161997409, 'learning_rate': 'constant', 'solver': 'sgd', 'learning_rate_init': 0.0016135454135442963, 'max_iter': 567}. Best is trial 0 with value: 0.12230585600527158.
[I 2025-12-04 05:25:45,016] Trial 2 finished with value: 0.16760124222650147 and parameters: {'n_layers': 1, 'layer_0_size': 44, 'activation': 'logistic', 'alpha': 1.64373384724312e-05, 'learning_rate': 'constant', 'solver': 'sgd', 'learning_rate_init': 0.006916685835755327, 'max_iter': 806}. Best is trial 2 with value: 0.16760124222650147.
[I 2025-12-04 05:26:04,574] Trial 3 finished with value: 0.12418485698395573 and parameters: {'n_layers': 3, 'layer_0_size': 59, 'layer_1_size': 113, 'layer_2_size': 66, 'activation': 'logistic', 'alpha': 0.0024503825588231354, 'learning_rate': 'adaptive', 'solver': 'sgd', 'learning_rate_init': 0.048876180688728246, 'max_iter': 415}. Best is trial 2 with value: 0.16760124222650147.
[I 2025-12-04 05:26:30,017] Trial 4 finished with value: 0.07655525936878307 and parameters: {'n_layers': 1, 'layer_0_size': 85, 'activation': 'logistic', 'alpha': 0.0001818592531637187, 'learning_rate': 'constant', 'solver': 'lbfgs', 'learning_rate_init': 0.000142733463771295, 'max_iter': 662}. Best is trial 2 with value: 0.16760124222650147.
[I 2025-12-04 05:28:59,723] Trial 5 finished with value: 0.171977964917229 and parameters: {'n_layers': 1, 'layer_0_size': 177, 'activation': 'tanh', 'alpha': 0.0033799994146402543, 'learning_rate': 'adaptive', 'solver': 'sgd', 'learning_rate_init': 0.0015075720260610257, 'max_iter': 708}. Best is trial 5 with value: 0.171977964917229.
[I 2025-12-04 05:32:45,022] Trial 6 finished with value: 0.08723134198238139 and parameters: {'n_layers': 2, 'layer_0_size': 151, 'layer_1_size': 159, 'activation': 'logistic', 'alpha': 0.006300246031152151, 'learning_rate': 'adaptive', 'solver': 'lbfgs', 'learning_rate_init': 0.025651598285068786, 'max_iter': 721}. Best is trial 5 with value: 0.171977964917229.
[I 2025-12-04 05:36:56,231] Trial 7 finished with value: 0.0998208525336979 and parameters: {'n_layers': 3, 'layer_0_size': 106, 'layer_1_size': 69, 'layer_2_size': 72, 'activation': 'relu', 'alpha': 0.00254134506953273, 'learning_rate': 'invscaling', 'solver': 'lbfgs', 'learning_rate_init': 0.020342510548817846, 'max_iter': 879}. Best is trial 5 with value: 0.171977964917229.
[I 2025-12-04 05:42:29,192] Trial 8 finished with value: 0.09635207729029031 and parameters: {'n_layers': 3, 'layer_0_size': 102, 'layer_1_size': 138, 'layer_2_size': 189, 'activation': 'tanh', 'alpha': 3.37300687845729e-05, 'learning_rate': 'constant', 'solver': 'sgd', 'learning_rate_init': 0.019223604223741673, 'max_iter': 968}. Best is trial 5 with value: 0.171977964917229.
[I 2025-12-04 05:47:44,370] Trial 9 finished with value: 0.07457417735591833 and parameters: {'n_layers': 3, 'layer_0_size': 144, 'layer_1_size': 178, 'layer_2_size': 94, 'activation': 'logistic', 'alpha': 6.884712031875386e-05, 'learning_rate': 'invscaling', 'solver': 'sgd', 'learning_rate_init': 0.00030632669891611194, 'max_iter': 775}. Best is trial 5 with value: 0.171977964917229.
[I 2025-12-04 05:50:01,467] Trial 10 finished with value: 0.10208643687168865 and parameters: {'n_layers': 2, 'layer_0_size': 197, 'layer_1_size': 18, 'activation': 'tanh', 'alpha': 0.04296751114809214, 'learning_rate': 'adaptive', 'solver': 'adam', 'learning_rate_init': 0.0010856975441202463, 'max_iter': 566}. Best is trial 5 with value: 0.171977964917229.
[I 2025-12-04 05:50:13,507] Trial 11 finished with value: 0.12789885405570306 and parameters: {'n_layers': 1, 'layer_0_size': 10, 'activation': 'tanh', 'alpha': 0.00029009906334618435, 'learning_rate': 'adaptive', 'solver': 'sgd', 'learning_rate_init': 0.003880193728821919, 'max_iter': 809}. Best is trial 5 with value: 0.171977964917229.
[I 2025-12-04 05:50:18,789] Trial 12 finished with value: 0.1478187897347281 and parameters: {'n_layers': 1, 'layer_0_size': 31, 'activation': 'tanh', 'alpha': 1.1749361995291128e-05, 'learning_rate': 'adaptive', 'solver': 'sgd', 'learning_rate_init': 0.0007307799025301198, 'max_iter': 993}. Best is trial 5 with value: 0.171977964917229.
[I 2025-12-04 05:55:57,789] Trial 13 finished with value: 0.09038243770928822 and parameters: {'n_layers': 2, 'layer_0_size': 192, 'layer_1_size': 13, 'activation': 'tanh', 'alpha': 0.00832941136604566, 'learning_rate': 'constant', 'solver': 'sgd', 'learning_rate_init': 0.007549002785864472, 'max_iter': 486}. Best is trial 5 with value: 0.171977964917229.
[I 2025-12-04 05:56:09,118] Trial 14 finished with value: 0.1051042358657468 and parameters: {'n_layers': 1, 'layer_0_size': 166, 'activation': 'relu', 'alpha': 0.0007430756770294124, 'learning_rate': 'invscaling', 'solver': 'sgd', 'learning_rate_init': 0.009425069191605333, 'max_iter': 886}. Best is trial 5 with value: 0.171977964917229.
[I 2025-12-04 05:56:10,584] Trial 15 finished with value: 0.14463094939558013 and parameters: {'n_layers': 1, 'layer_0_size': 59, 'activation': 'logistic', 'alpha': 0.09559183937349247, 'learning_rate': 'constant', 'solver': 'adam', 'learning_rate_init': 0.09797362962207772, 'max_iter': 669}. Best is trial 5 with value: 0.171977964917229.
[I 2025-12-04 05:57:27,483] Trial 16 finished with value: 0.10725879949260805 and parameters: {'n_layers': 2, 'layer_0_size': 71, 'layer_1_size': 71, 'activation': 'tanh', 'alpha': 0.00019196402088056958, 'learning_rate': 'adaptive', 'solver': 'sgd', 'learning_rate_init': 0.0020499224029604042, 'max_iter': 834}. Best is trial 5 with value: 0.171977964917229.
[I 2025-12-04 05:57:31,911] Trial 17 finished with value: 0.14079317510697603 and parameters: {'n_layers': 1, 'layer_0_size': 43, 'activation': 'logistic', 'alpha': 1.0894515672075158e-05, 'learning_rate': 'adaptive', 'solver': 'sgd', 'learning_rate_init': 0.0005786700903630606, 'max_iter': 201}. Best is trial 5 with value: 0.171977964917229.
[I 2025-12-04 05:57:41,461] Trial 18 finished with value: 0.10438684347966751 and parameters: {'n_layers': 2, 'layer_0_size': 128, 'layer_1_size': 67, 'activation': 'tanh', 'alpha': 0.0020058915290403012, 'learning_rate': 'constant', 'solver': 'adam', 'learning_rate_init': 0.0024478835131522517, 'max_iter': 725}. Best is trial 5 with value: 0.171977964917229.
[I 2025-12-04 05:59:51,019] Trial 19 finished with value: 0.08884331058924422 and parameters: {'n_layers': 1, 'layer_0_size': 173, 'activation': 'relu', 'alpha': 4.1527534759886706e-05, 'learning_rate': 'invscaling', 'solver': 'lbfgs', 'learning_rate_init': 0.00039618409481003775, 'max_iter': 631}. Best is trial 5 with value: 0.171977964917229.
[I 2025-12-04 05:59:54,725] Trial 20 finished with value: 0.1670455472728257 and parameters: {'n_layers': 1, 'layer_0_size': 30, 'activation': 'logistic', 'alpha': 0.008833068024134387, 'learning_rate': 'adaptive', 'solver': 'sgd', 'learning_rate_init': 0.0072513449358976665, 'max_iter': 487}. Best is trial 5 with value: 0.171977964917229.
[I 2025-12-04 05:59:57,208] Trial 21 finished with value: 0.17011545028083458 and parameters: {'n_layers': 1, 'layer_0_size': 10, 'activation': 'logistic', 'alpha': 0.008096321746582407, 'learning_rate': 'adaptive', 'solver': 'sgd', 'learning_rate_init': 0.010672904603521837, 'max_iter': 433}. Best is trial 5 with value: 0.171977964917229.
[I 2025-12-04 05:59:59,919] Trial 22 finished with value: 0.16786866234846515 and parameters: {'n_layers': 1, 'layer_0_size': 12, 'activation': 'logistic', 'alpha': 0.004587358431307049, 'learning_rate': 'adaptive', 'solver': 'sgd', 'learning_rate_init': 0.012765628144963037, 'max_iter': 375}. Best is trial 5 with value: 0.171977964917229.
[I 2025-12-04 06:00:21,043] Trial 23 finished with value: 0.17104982136870833 and parameters: {'n_layers': 2, 'layer_0_size': 28, 'layer_1_size': 200, 'activation': 'logistic', 'alpha': 0.025981463271813856, 'learning_rate': 'adaptive', 'solver': 'sgd', 'learning_rate_init': 0.013233250719028937, 'max_iter': 354}. Best is trial 5 with value: 0.171977964917229.
[I 2025-12-04 06:00:43,832] Trial 24 finished with value: 0.13732961470381838 and parameters: {'n_layers': 2, 'layer_0_size': 24, 'layer_1_size': 197, 'activation': 'logistic', 'alpha': 0.02007164271209284, 'learning_rate': 'adaptive', 'solver': 'sgd', 'learning_rate_init': 0.03999745733164538, 'max_iter': 283}. Best is trial 5 with value: 0.171977964917229.
[I 2025-12-04 06:01:42,107] Trial 25 finished with value: 0.10174747650874379 and parameters: {'n_layers': 2, 'layer_0_size': 76, 'layer_1_size': 120, 'activation': 'tanh', 'alpha': 0.018259697983808804, 'learning_rate': 'adaptive', 'solver': 'sgd', 'learning_rate_init': 0.0034311122593721458, 'max_iter': 481}. Best is trial 5 with value: 0.171977964917229.
[I 2025-12-04 06:02:05,233] Trial 26 finished with value: 0.16920001271396323 and parameters: {'n_layers': 2, 'layer_0_size': 43, 'layer_1_size': 194, 'activation': 'logistic', 'alpha': 0.047377740998372185, 'learning_rate': 'adaptive', 'solver': 'sgd', 'learning_rate_init': 0.013044215894921225, 'max_iter': 387}. Best is trial 5 with value: 0.171977964917229.
[I 2025-12-04 06:02:11,053] Trial 27 finished with value: 0.07879251708158967 and parameters: {'n_layers': 2, 'layer_0_size': 57, 'layer_1_size': 94, 'activation': 'logistic', 'alpha': 0.01175483389101159, 'learning_rate': 'adaptive', 'solver': 'sgd', 'learning_rate_init': 0.0011425293110205823, 'max_iter': 284}. Best is trial 5 with value: 0.171977964917229.
[I 2025-12-04 06:02:14,637] Trial 28 finished with value: 0.15662002379120427 and parameters: {'n_layers': 1, 'layer_0_size': 119, 'activation': 'relu', 'alpha': 0.04054865322822262, 'learning_rate': 'adaptive', 'solver': 'adam', 'learning_rate_init': 0.03545954333680827, 'max_iter': 439}. Best is trial 5 with value: 0.171977964917229.
[I 2025-12-04 06:02:28,643] Trial 29 finished with value: 0.07909095768469236 and parameters: {'n_layers': 1, 'layer_0_size': 20, 'activation': 'tanh', 'alpha': 0.0012285410805465856, 'learning_rate': 'adaptive', 'solver': 'lbfgs', 'learning_rate_init': 0.0048850187037968494, 'max_iter': 325}. Best is trial 5 with value: 0.171977964917229.
[I 2025-12-04 06:02:54,073] A new study created in memory with name: multi_layer_perceptron_fold_2
[I 2025-12-04 06:04:19,451] Trial 0 finished with value: 0.07921246028574312 and parameters: {'n_layers': 3, 'layer_0_size': 62, 'layer_1_size': 19, 'layer_2_size': 68, 'activation': 'relu', 'alpha': 0.00012310473332627695, 'learning_rate': 'adaptive', 'solver': 'lbfgs', 'learning_rate_init': 0.00042034389521712715, 'max_iter': 693}. Best is trial 0 with value: 0.07921246028574312.
[I 2025-12-04 06:06:29,456] Trial 1 finished with value: 0.08180316803893248 and parameters: {'n_layers': 1, 'layer_0_size': 165, 'activation': 'logistic', 'alpha': 0.000622022456434975, 'learning_rate': 'adaptive', 'solver': 'lbfgs', 'learning_rate_init': 0.0007212764647452406, 'max_iter': 466}. Best is trial 1 with value: 0.08180316803893248.
