[I 2025-12-04 05:16:51,483] Trial 29 finished with value: 0.13994220049978162 and parameters: {'iterations': 164, 'learning_rate': 0.07164282796675334, 'depth': 4, 'l2_leaf_reg': 1.0086094876627127, 'border_count': 197, 'bagging_temperature': 0.6325790000938625, 'random_strength': 0.896869752929265, 'scale_pos_weight': 28.62388386711329}. Best is trial 11 with value: 0.14348057729190444.

Evaluating fold 5 best params on holdout set...
  - Testing with balance strategy: none
  - Testing with balance strategy: randomundersampler
  - Testing with balance strategy: smoteenn
  - Testing with balance strategy: tomeklinks
Saving optimization and holdout results...
Detailed results by fold saved to: ./results/20251203_215554_ana_optimized_binary/histogram_gradient_boosting/detailed_results_by_fold.txt
Test predictions for all folds saved to: ./results/20251203_215554_ana_optimized_binary/histogram_gradient_boosting/metrics.json
Saving holdout results...
Holdout evaluation results saved to: ./results/20251203_215554_ana_optimized_binary/histogram_gradient_boosting/holdout_results.txt
Saved!
[OK] Histogram Gradient Boosting executado com sucesso!
Progresso: 6/9 modelos
================================================================================
EXECUTANDO MODELO: XGBoost
================================================================================

Starting Nested Cross-Validation for xgboost...
Configuration: 5 outer folds, 30 trials per fold
Performing 80/20 holdout split...
Holdout split completed:
  - Training set: 14140 samples (80%)
  - Holdout test set: 3536 samples (20%)
Fold 1
Importâncias dos parâmetros para fold 1: {'learning_rate': np.float64(0.8546289789556166), 'scale_pos_weight': np.float64(0.04982624401007138), 'reg_lambda': np.float64(0.02172620926127365), 'n_estimators': np.float64(0.016814564223158187), 'max_depth': np.float64(0.01582429039720795), 'colsample_bytree': np.float64(0.01391546599815723), 'subsample': np.float64(0.008314230205546835), 'gamma': np.float64(0.0067766071535093385), 'reg_alpha': np.float64(0.006217094844258784), 'min_child_weight': np.float64(0.005956314951199982)}
Saved Optuna plots to results/20251203_215554_ana_optimized_binary/xgboost/optuna_plots
Fold 2
Importâncias dos parâmetros para fold 2: {'reg_alpha': np.float64(0.46361250441332885), 'learning_rate': np.float64(0.1412706980079641), 'scale_pos_weight': np.float64(0.13247065907815297), 'gamma': np.float64(0.07279733568130518), 'subsample': np.float64(0.05113162063007805), 'max_depth': np.float64(0.03855786395769834), 'colsample_bytree': np.float64(0.037586018504418325), 'min_child_weight': np.float64(0.031191654008143985), 'reg_lambda': np.float64(0.025391895128314905), 'n_estimators': np.float64(0.005989750590595264)}
Saved Optuna plots to results/20251203_215554_ana_optimized_binary/xgboost/optuna_plots
Fold 3
Importâncias dos parâmetros para fold 3: {'learning_rate': np.float64(0.5527658323342892), 'scale_pos_weight': np.float64(0.28339280212454926), 'subsample': np.float64(0.044409459464462384), 'n_estimators': np.float64(0.03292815839759265), 'min_child_weight': np.float64(0.026997265675530437), 'gamma': np.float64(0.02158530070875327), 'reg_alpha': np.float64(0.011350220520328224), 'colsample_bytree': np.float64(0.010797698954400282), 'max_depth': np.float64(0.00831409743950011), 'reg_lambda': np.float64(0.007459164380594133)}
Saved Optuna plots to results/20251203_215554_ana_optimized_binary/xgboost/optuna_plots
Fold 4
Importâncias dos parâmetros para fold 4: {'scale_pos_weight': np.float64(0.4829712904711843), 'learning_rate': np.float64(0.2604539166458557), 'gamma': np.float64(0.12209206256597095), 'colsample_bytree': np.float64(0.06837043617567294), 'subsample': np.float64(0.029894154330315195), 'n_estimators': np.float64(0.013058099346013444), 'reg_lambda': np.float64(0.010242278493373135), 'reg_alpha': np.float64(0.007913848014332378), 'min_child_weight': np.float64(0.003003409683377478), 'max_depth': np.float64(0.0020005042739043486)}
Saved Optuna plots to results/20251203_215554_ana_optimized_binary/xgboost/optuna_plots
Fold 5
Importâncias dos parâmetros para fold 5: {'reg_lambda': np.float64(0.4059574997739595), 'scale_pos_weight': np.float64(0.20870962643044683), 'learning_rate': np.float64(0.20209447253553275), 'reg_alpha': np.float64(0.05143629964896896), 'n_estimators': np.float64(0.0454205105869463), 'colsample_bytree': np.float64(0.03497445845192594), 'max_depth': np.float64(0.025202814494957752), 'min_child_weight': np.float64(0.011470713176108536), 'gamma': np.float64(0.007617076667981366), 'subsample': np.float64(0.00711652823317221)}
Saved Optuna plots to results/20251203_215554_ana_optimized_binary/xgboost/optuna_plots

Nested CV completed. The 20% holdout set (3536 samples) remains untouched.
This holdout set can be used for final unbiased evaluation.

Training and evaluating 5 best parameter sets on holdout data...
Testing with 4 balancing strategies: none, randomundersampler, smoteenn, tomeklinks

Evaluating fold 1 best params on holdout set...
  - Testing with balance strategy: none
  - Testing with balance strategy: randomundersampler
  - Testing with balance strategy: smoteenn
  - Testing with balance strategy: tomeklinks

Evaluating fold 2 best params on holdout set...
  - Testing with balance strategy: none
  - Testing with balance strategy: randomundersampler
  - Testing with balance strategy: smoteenn
  - Testing with balance strategy: tomeklinks

Evaluating fold 3 best params on holdout set...
  - Testing with balance strategy: none
  - Testing with balance strategy: randomundersampler
  - Testing with balance strategy: smoteenn
  - Testing with balance strategy: tomeklinks

Evaluating fold 4 best params on holdout set...
  - Testing with balance strategy: none
  - Testing with balance strategy: randomundersampler
  - Testing with balance strategy: smoteenn
  - Testing with balance strategy: tomeklinks

Evaluating fold 5 best params on holdout set...
  - Testing with balance strategy: none
  - Testing with balance strategy: randomundersampler
  - Testing with balance strategy: smoteenn
  - Testing with balance strategy: tomeklinks
Saving optimization and holdout results...
Detailed results by fold saved to: ./results/20251203_215554_ana_optimized_binary/xgboost/detailed_results_by_fold.txt
Test predictions for all folds saved to: ./results/20251203_215554_ana_optimized_binary/xgboost/metrics.json
Saving holdout results...
Holdout evaluation results saved to: ./results/20251203_215554_ana_optimized_binary/xgboost/holdout_results.txt
Saved!
[OK] XGBoost executado com sucesso!
Progresso: 7/9 modelos
================================================================================
EXECUTANDO MODELO: CatBoost
================================================================================

Starting Nested Cross-Validation for catboost...
Configuration: 5 outer folds, 30 trials per fold
Performing 80/20 holdout split...
Holdout split completed:
  - Training set: 14140 samples (80%)
  - Holdout test set: 3536 samples (20%)
Fold 1
Importâncias dos parâmetros para fold 1: {'learning_rate': np.float64(0.9146749935209801), 'iterations': np.float64(0.035237571655245846), 'border_count': np.float64(0.019998998939409336), 'l2_leaf_reg': np.float64(0.010678041040558988), 'depth': np.float64(0.006962858253789079), 'scale_pos_weight': np.float64(0.006127079969538516), 'random_strength': np.float64(0.0036505247754083357), 'bagging_temperature': np.float64(0.0026699318450697515)}
Saved Optuna plots to results/20251203_215554_ana_optimized_binary/catboost/optuna_plots
Fold 2
Importâncias dos parâmetros para fold 2: {'learning_rate': np.float64(0.6362492894862177), 'border_count': np.float64(0.1596785467117842), 'iterations': np.float64(0.12404457640083011), 'depth': np.float64(0.02943862972098719), 'scale_pos_weight': np.float64(0.02025082508808733), 'bagging_temperature': np.float64(0.010981502481542999), 'l2_leaf_reg': np.float64(0.010684212677340339), 'random_strength': np.float64(0.00867241743321012)}
Saved Optuna plots to results/20251203_215554_ana_optimized_binary/catboost/optuna_plots
Fold 3
[I 2025-12-04 05:16:53,298] A new study created in memory with name: catboost_fold_4
[I 2025-12-04 05:16:58,708] Trial 0 finished with value: 0.11495338553364287 and parameters: {'iterations': 996, 'learning_rate': 0.2790881276934568, 'depth': 6, 'l2_leaf_reg': 8.693136605215486, 'border_count': 57, 'bagging_temperature': 0.7726921437939565, 'random_strength': 0.04942380995266715, 'scale_pos_weight': 7.540795754945808}. Best is trial 0 with value: 0.11495338553364287.
[I 2025-12-04 05:17:01,059] Trial 1 finished with value: 0.09986095710776008 and parameters: {'iterations': 122, 'learning_rate': 0.20041379639412718, 'depth': 7, 'l2_leaf_reg': 1.9716311238600894, 'border_count': 192, 'bagging_temperature': 0.3247083191082414, 'random_strength': 0.558810800980096, 'scale_pos_weight': 34.66838623722686}. Best is trial 0 with value: 0.11495338553364287.
[I 2025-12-04 05:17:05,222] Trial 2 finished with value: 0.09556485615217283 and parameters: {'iterations': 734, 'learning_rate': 0.19135834784107034, 'depth': 4, 'l2_leaf_reg': 5.272627194743787, 'border_count': 160, 'bagging_temperature': 0.9739100140099195, 'random_strength': 0.1398909770739586, 'scale_pos_weight': 37.68420333054732}. Best is trial 0 with value: 0.11495338553364287.
[I 2025-12-04 05:17:09,570] Trial 3 finished with value: 0.10139725919183395 and parameters: {'iterations': 648, 'learning_rate': 0.1735578705957838, 'depth': 5, 'l2_leaf_reg': 7.0390016752227895, 'border_count': 184, 'bagging_temperature': 0.14897971431109003, 'random_strength': 0.5864397400560042, 'scale_pos_weight': 49.12555545756987}. Best is trial 0 with value: 0.11495338553364287.
[I 2025-12-04 05:17:13,461] Trial 4 finished with value: 0.11803574403164671 and parameters: {'iterations': 541, 'learning_rate': 0.14357949366337075, 'depth': 5, 'l2_leaf_reg': 7.534908644684244, 'border_count': 209, 'bagging_temperature': 0.219093807696785, 'random_strength': 0.07891960039701928, 'scale_pos_weight': 29.164884120542304}. Best is trial 4 with value: 0.11803574403164671.
[I 2025-12-04 05:18:05,302] Trial 5 finished with value: 0.11174297374575307 and parameters: {'iterations': 963, 'learning_rate': 0.15790117728623815, 'depth': 9, 'l2_leaf_reg': 9.757492386553128, 'border_count': 111, 'bagging_temperature': 0.5579663416852771, 'random_strength': 0.39680158006675303, 'scale_pos_weight': 13.492361841876717}. Best is trial 4 with value: 0.11803574403164671.
[I 2025-12-04 05:18:10,822] Trial 6 finished with value: 0.09493295697607808 and parameters: {'iterations': 673, 'learning_rate': 0.2331928077389745, 'depth': 7, 'l2_leaf_reg': 4.5733750207792045, 'border_count': 93, 'bagging_temperature': 0.9272065903673371, 'random_strength': 0.12079460582015922, 'scale_pos_weight': 52.96324932759978}. Best is trial 4 with value: 0.11803574403164671.
[I 2025-12-04 05:18:18,510] Trial 7 finished with value: 0.10481021056005195 and parameters: {'iterations': 903, 'learning_rate': 0.29706807058772955, 'depth': 6, 'l2_leaf_reg': 4.646713720885225, 'border_count': 245, 'bagging_temperature': 0.33805636498269986, 'random_strength': 0.07409219571755299, 'scale_pos_weight': 40.89068260223112}. Best is trial 4 with value: 0.11803574403164671.
[I 2025-12-04 05:19:37,696] Trial 8 finished with value: 0.08692711174795312 and parameters: {'iterations': 815, 'learning_rate': 0.10254885759009845, 'depth': 10, 'l2_leaf_reg': 3.291531387861389, 'border_count': 163, 'bagging_temperature': 0.20407889272278756, 'random_strength': 0.9752826517140594, 'scale_pos_weight': 44.377018116327434}. Best is trial 4 with value: 0.11803574403164671.
[I 2025-12-04 05:19:41,584] Trial 9 finished with value: 0.14389881018220885 and parameters: {'iterations': 532, 'learning_rate': 0.03348138128613078, 'depth': 6, 'l2_leaf_reg': 3.5758972195349523, 'border_count': 115, 'bagging_temperature': 0.7632834509235816, 'random_strength': 0.26889875377952066, 'scale_pos_weight': 11.456339866704816}. Best is trial 9 with value: 0.14389881018220885.
[I 2025-12-04 05:19:46,992] Trial 10 finished with value: 0.10245575806591564 and parameters: {'iterations': 432, 'learning_rate': 0.024515989502410906, 'depth': 9, 'l2_leaf_reg': 1.2912548337753034, 'border_count': 32, 'bagging_temperature': 0.6346007956710067, 'random_strength': 0.3480700258545785, 'scale_pos_weight': 19.643008679618276}. Best is trial 9 with value: 0.14389881018220885.
[I 2025-12-04 05:19:49,682] Trial 11 finished with value: 0.13974415155871375 and parameters: {'iterations': 404, 'learning_rate': 0.07602118435111326, 'depth': 4, 'l2_leaf_reg': 6.615262392544346, 'border_count': 236, 'bagging_temperature': 0.7359725065546808, 'random_strength': 0.27918936848596676, 'scale_pos_weight': 23.912343335789082}. Best is trial 9 with value: 0.14389881018220885.
[I 2025-12-04 05:19:51,837] Trial 12 finished with value: 0.16096115107276285 and parameters: {'iterations': 329, 'learning_rate': 0.0266529002974251, 'depth': 4, 'l2_leaf_reg': 6.535191445089692, 'border_count': 126, 'bagging_temperature': 0.7384837698754845, 'random_strength': 0.30163717121248806, 'scale_pos_weight': 23.297861136246272}. Best is trial 12 with value: 0.16096115107276285.
[I 2025-12-04 05:19:53,784] Trial 13 finished with value: 0.15761311015153293 and parameters: {'iterations': 248, 'learning_rate': 0.031963477866582435, 'depth': 5, 'l2_leaf_reg': 3.2384432034520443, 'border_count': 111, 'bagging_temperature': 0.8401221096457886, 'random_strength': 0.7180911906908412, 'scale_pos_weight': 15.57030730050711}. Best is trial 12 with value: 0.16096115107276285.
[I 2025-12-04 05:19:55,411] Trial 14 finished with value: 0.1577023881077279 and parameters: {'iterations': 217, 'learning_rate': 0.06575764705300202, 'depth': 4, 'l2_leaf_reg': 3.0195544654752733, 'border_count': 125, 'bagging_temperature': 0.8631930239796994, 'random_strength': 0.7635258100695144, 'scale_pos_weight': 21.069663295220444}. Best is trial 12 with value: 0.16096115107276285.
[I 2025-12-04 05:19:57,201] Trial 15 finished with value: 0.15237569913780052 and parameters: {'iterations': 248, 'learning_rate': 0.0735600061060037, 'depth': 4, 'l2_leaf_reg': 6.153002890361628, 'border_count': 145, 'bagging_temperature': 0.6243877807765496, 'random_strength': 0.8267995288279717, 'scale_pos_weight': 24.840585187131925}. Best is trial 12 with value: 0.16096115107276285.
[I 2025-12-04 05:19:59,312] Trial 16 finished with value: 0.11717232023885393 and parameters: {'iterations': 106, 'learning_rate': 0.11455079303780064, 'depth': 8, 'l2_leaf_reg': 8.079105301982713, 'border_count': 84, 'bagging_temperature': 0.4932245070030531, 'random_strength': 0.725144900977321, 'scale_pos_weight': 28.477338350491834}. Best is trial 12 with value: 0.16096115107276285.
[I 2025-12-04 05:20:01,521] Trial 17 finished with value: 0.13755458720566466 and parameters: {'iterations': 294, 'learning_rate': 0.06451070111230334, 'depth': 5, 'l2_leaf_reg': 2.3492360326965396, 'border_count': 128, 'bagging_temperature': 0.8598281403488988, 'random_strength': 0.47849827952115764, 'scale_pos_weight': 17.96530916350907}. Best is trial 12 with value: 0.16096115107276285.
[I 2025-12-04 05:20:03,664] Trial 18 finished with value: 0.15908580868991717 and parameters: {'iterations': 345, 'learning_rate': 0.01500315048036873, 'depth': 4, 'l2_leaf_reg': 5.5879501017189455, 'border_count': 69, 'bagging_temperature': 0.03135823002418381, 'random_strength': 0.9704362979468155, 'scale_pos_weight': 21.776402535469668}. Best is trial 12 with value: 0.16096115107276285.
[I 2025-12-04 05:20:06,964] Trial 19 finished with value: 0.14591215141366498 and parameters: {'iterations': 392, 'learning_rate': 0.020756609094718475, 'depth': 7, 'l2_leaf_reg': 5.6729054058854995, 'border_count': 64, 'bagging_temperature': 0.00016155490405184159, 'random_strength': 0.9749998225396717, 'scale_pos_weight': 33.46534005783433}. Best is trial 12 with value: 0.16096115107276285.
[I 2025-12-04 05:20:09,055] Trial 20 finished with value: 0.17708138360970432 and parameters: {'iterations': 338, 'learning_rate': 0.010370327270368625, 'depth': 4, 'l2_leaf_reg': 4.675632155339413, 'border_count': 37, 'bagging_temperature': 0.4462041431153806, 'random_strength': 0.22687512289577627, 'scale_pos_weight': 6.382963396268112}. Best is trial 20 with value: 0.17708138360970432.
[I 2025-12-04 05:20:11,148] Trial 21 finished with value: 0.1713975829545707 and parameters: {'iterations': 339, 'learning_rate': 0.010899580450312916, 'depth': 4, 'l2_leaf_reg': 4.653545545146647, 'border_count': 32, 'bagging_temperature': 0.44253256753776643, 'random_strength': 0.2295531771433772, 'scale_pos_weight': 6.80295099569503}. Best is trial 20 with value: 0.17708138360970432.
[I 2025-12-04 05:20:14,122] Trial 22 finished with value: 0.14503459606525126 and parameters: {'iterations': 485, 'learning_rate': 0.04708566272787314, 'depth': 5, 'l2_leaf_reg': 4.420436817682642, 'border_count': 35, 'bagging_temperature': 0.4454023405575398, 'random_strength': 0.21787274514814947, 'scale_pos_weight': 5.749049943326877}. Best is trial 20 with value: 0.17708138360970432.
[I 2025-12-04 05:20:16,245] Trial 23 finished with value: 0.14290916007494822 and parameters: {'iterations': 330, 'learning_rate': 0.09891948781894687, 'depth': 4, 'l2_leaf_reg': 4.059093531097934, 'border_count': 49, 'bagging_temperature': 0.38385178535099407, 'random_strength': 0.19916066136710145, 'scale_pos_weight': 10.483977825575838}. Best is trial 20 with value: 0.17708138360970432.
[I 2025-12-04 05:20:17,776] Trial 24 finished with value: 0.1701529670345473 and parameters: {'iterations': 163, 'learning_rate': 0.010614421947548379, 'depth': 6, 'l2_leaf_reg': 5.142460551493109, 'border_count': 79, 'bagging_temperature': 0.6193543128892007, 'random_strength': 0.3848291504663236, 'scale_pos_weight': 8.778399756120471}. Best is trial 20 with value: 0.17708138360970432.
[I 2025-12-04 05:20:19,393] Trial 25 finished with value: 0.1583890892177954 and parameters: {'iterations': 172, 'learning_rate': 0.04867338034379726, 'depth': 6, 'l2_leaf_reg': 5.109414699186981, 'border_count': 74, 'bagging_temperature': 0.5810492096675839, 'random_strength': 0.4372831786766079, 'scale_pos_weight': 8.963222469285654}. Best is trial 20 with value: 0.17708138360970432.
[I 2025-12-04 05:20:20,953] Trial 26 finished with value: 0.138414033201883 and parameters: {'iterations': 193, 'learning_rate': 0.12020284161573795, 'depth': 5, 'l2_leaf_reg': 3.7668513220088644, 'border_count': 48, 'bagging_temperature': 0.4297821926819053, 'random_strength': 0.3785340988332482, 'scale_pos_weight': 5.599709498232863}. Best is trial 20 with value: 0.17708138360970432.
[I 2025-12-04 05:20:28,895] Trial 27 finished with value: 0.11296652972122931 and parameters: {'iterations': 474, 'learning_rate': 0.08599943708914581, 'depth': 8, 'l2_leaf_reg': 5.9592384174246344, 'border_count': 90, 'bagging_temperature': 0.5108635917073034, 'random_strength': 0.004045012632413081, 'scale_pos_weight': 15.339382014993328}. Best is trial 20 with value: 0.17708138360970432.
[I 2025-12-04 05:20:30,994] Trial 28 finished with value: 0.13233402374776343 and parameters: {'iterations': 282, 'learning_rate': 0.04735362432863845, 'depth': 6, 'l2_leaf_reg': 4.879893031732462, 'border_count': 44, 'bagging_temperature': 0.6635366042545643, 'random_strength': 0.19597540821792653, 'scale_pos_weight': 12.108131399310277}. Best is trial 20 with value: 0.17708138360970432.
[I 2025-12-04 05:20:33,034] Trial 29 finished with value: 0.15796947172362913 and parameters: {'iterations': 150, 'learning_rate': 0.011065688493623858, 'depth': 8, 'l2_leaf_reg': 2.7100655274904604, 'border_count': 60, 'bagging_temperature': 0.25055082332429246, 'random_strength': 0.5630273594223596, 'scale_pos_weight': 8.24937625030206}. Best is trial 20 with value: 0.17708138360970432.
[I 2025-12-04 05:20:34,389] A new study created in memory with name: catboost_fold_5
[I 2025-12-04 05:20:59,563] Trial 0 finished with value: 0.08438755401748568 and parameters: {'iterations': 222, 'learning_rate': 0.12805579219670868, 'depth': 9, 'l2_leaf_reg': 5.329874161073251, 'border_count': 216, 'bagging_temperature': 0.009176842079860137, 'random_strength': 0.287889340839668, 'scale_pos_weight': 25.513200501285674}. Best is trial 0 with value: 0.08438755401748568.
[I 2025-12-04 05:21:04,039] Trial 1 finished with value: 0.08828185439283832 and parameters: {'iterations': 700, 'learning_rate': 0.246552596897748, 'depth': 7, 'l2_leaf_reg': 8.525265469556995, 'border_count': 33, 'bagging_temperature': 0.2632032696592118, 'random_strength': 0.3027098471955143, 'scale_pos_weight': 11.124595796662415}. Best is trial 1 with value: 0.08828185439283832.
[I 2025-12-04 05:21:07,735] Trial 2 finished with value: 0.07987165372768248 and parameters: {'iterations': 615, 'learning_rate': 0.26715922324286545, 'depth': 6, 'l2_leaf_reg': 1.2701622422033703, 'border_count': 61, 'bagging_temperature': 0.9164801429276496, 'random_strength': 0.8099530323833084, 'scale_pos_weight': 14.821561386491378}. Best is trial 1 with value: 0.08828185439283832.
[I 2025-12-04 05:21:09,379] Trial 3 finished with value: 0.0855157703613687 and parameters: {'iterations': 178, 'learning_rate': 0.24056011039152297, 'depth': 6, 'l2_leaf_reg': 2.9580336780172964, 'border_count': 75, 'bagging_temperature': 0.34720000185139044, 'random_strength': 0.6593822638470983, 'scale_pos_weight': 20.460530237384845}. Best is trial 1 with value: 0.08828185439283832.
