[I 2025-12-04 11:42:02,331] Trial 29 finished with value: 0.06955861041888761 and parameters: {'kernel': 'linear', 'C': 0.43244254588606235, 'degree': 4, 'shrinking': True}. Best is trial 20 with value: 0.08457799881538801.
Detailed results by fold saved to: ./results/20251203_215554_ana_optimized_binary/multi_layer_perceptron/detailed_results_by_fold.txt
Test predictions for all folds saved to: ./results/20251203_215554_ana_optimized_binary/multi_layer_perceptron/metrics.json
Saving holdout results...
Holdout evaluation results saved to: ./results/20251203_215554_ana_optimized_binary/multi_layer_perceptron/holdout_results.txt
Saved!
[OK] Multi-Layer Perceptron executado com sucesso!
Progresso: 9/9 modelos
================================================================================
EXECUTANDO MODELO: Support Vector Classifier
================================================================================

Starting Nested Cross-Validation for svc...
Configuration: 5 outer folds, 30 trials per fold
Performing 80/20 holdout split...
Holdout split completed:
  - Training set: 14140 samples (80%)
  - Holdout test set: 3536 samples (20%)
Fold 1
Importâncias dos parâmetros para fold 1: {'kernel': np.float64(0.9978846512640787), 'C': np.float64(0.0017557566093671247), 'shrinking': np.float64(0.0002356851027781431), 'degree': np.float64(0.00012390702377599816)}
Saved Optuna plots to results/20251203_215554_ana_optimized_binary/svc/optuna_plots
Fold 2
Importâncias dos parâmetros para fold 2: {'kernel': np.float64(0.9943538819068329), 'C': np.float64(0.004652694554569807), 'degree': np.float64(0.0005318082096235136), 'shrinking': np.float64(0.00046161532897375575)}
Saved Optuna plots to results/20251203_215554_ana_optimized_binary/svc/optuna_plots
Fold 3
Importâncias dos parâmetros para fold 3: {'kernel': np.float64(0.9907190439318181), 'degree': np.float64(0.004989576906866458), 'C': np.float64(0.0033645899491109433), 'shrinking': np.float64(0.0009267892122044131)}
Saved Optuna plots to results/20251203_215554_ana_optimized_binary/svc/optuna_plots
Fold 4
Importâncias dos parâmetros para fold 4: {'kernel': np.float64(0.9976118137867412), 'C': np.float64(0.0013083783416341043), 'degree': np.float64(0.000757962696123405), 'shrinking': np.float64(0.0003218451755012447)}
Saved Optuna plots to results/20251203_215554_ana_optimized_binary/svc/optuna_plots
Fold 5
Importâncias dos parâmetros para fold 5: {'kernel': np.float64(0.9701849007898361), 'C': np.float64(0.01918577239689616), 'shrinking': np.float64(0.006924200669863014), 'degree': np.float64(0.003705126143404718)}
Saved Optuna plots to results/20251203_215554_ana_optimized_binary/svc/optuna_plots

Nested CV completed. The 20% holdout set (3536 samples) remains untouched.
This holdout set can be used for final unbiased evaluation.

Training and evaluating 5 best parameter sets on holdout data...
Testing with 4 balancing strategies: none, randomundersampler, smoteenn, tomeklinks

Evaluating fold 1 best params on holdout set...
  - Testing with balance strategy: none
  - Testing with balance strategy: randomundersampler
  - Testing with balance strategy: smoteenn
  - Testing with balance strategy: tomeklinks

Evaluating fold 2 best params on holdout set...
  - Testing with balance strategy: none
  - Testing with balance strategy: randomundersampler
  - Testing with balance strategy: smoteenn
  - Testing with balance strategy: tomeklinks

Evaluating fold 3 best params on holdout set...
  - Testing with balance strategy: none
  - Testing with balance strategy: randomundersampler
  - Testing with balance strategy: smoteenn
  - Testing with balance strategy: tomeklinks

Evaluating fold 4 best params on holdout set...
  - Testing with balance strategy: none
  - Testing with balance strategy: randomundersampler
  - Testing with balance strategy: smoteenn
  - Testing with balance strategy: tomeklinks

Evaluating fold 5 best params on holdout set...
  - Testing with balance strategy: none
  - Testing with balance strategy: randomundersampler
  - Testing with balance strategy: smoteenn
  - Testing with balance strategy: tomeklinks
Saving optimization and holdout results...
Detailed results by fold saved to: ./results/20251203_215554_ana_optimized_binary/svc/detailed_results_by_fold.txt
Test predictions for all folds saved to: ./results/20251203_215554_ana_optimized_binary/svc/metrics.json
Saving holdout results...
Holdout evaluation results saved to: ./results/20251203_215554_ana_optimized_binary/svc/holdout_results.txt
Saved!
[OK] Support Vector Classifier executado com sucesso!

EXPERIMENTO CONCLUÍDO!
