[I 2025-12-04 00:48:45,524] Trial 4 finished with value: 0.14941735370340975 and parameters: {'n_estimators': 272, 'learning_rate': 0.08089407404483447, 'max_depth': 3, 'min_child_weight': 9, 'subsample': 0.9440288612943931, 'colsample_bytree': 0.7108180094844361, 'reg_alpha': 0.17090871096939453, 'reg_lambda': 9.533866490148121, 'gamma': 0.04058537356024239, 'scale_pos_weight': 7.66149606694382}. Best is trial 4 with value: 0.14941735370340975.
[I 2025-12-04 00:49:50,155] Trial 5 finished with value: 0.10716977014043286 and parameters: {'n_estimators': 513, 'learning_rate': 0.24367732161155392, 'max_depth': 7, 'min_child_weight': 10, 'subsample': 0.6992800047365446, 'colsample_bytree': 0.9123675983639502, 'reg_alpha': 0.1984414085321955, 'reg_lambda': 6.70127893317712, 'gamma': 2.5762844105125953, 'scale_pos_weight': 46.39408607860827}. Best is trial 4 with value: 0.14941735370340975.
[I 2025-12-04 00:50:31,222] Trial 6 finished with value: 0.09042143914701939 and parameters: {'n_estimators': 238, 'learning_rate': 0.27469642954219875, 'max_depth': 5, 'min_child_weight': 1, 'subsample': 0.7477711270106178, 'colsample_bytree': 0.8011282848655271, 'reg_alpha': 0.026306036731684856, 'reg_lambda': 1.4556060217829494, 'gamma': 3.213174770674402, 'scale_pos_weight': 44.601894388456664}. Best is trial 4 with value: 0.14941735370340975.
[I 2025-12-04 00:52:38,225] Trial 7 finished with value: 0.13774519207335162 and parameters: {'n_estimators': 970, 'learning_rate': 0.06538909504686262, 'max_depth': 8, 'min_child_weight': 9, 'subsample': 0.8783282340480899, 'colsample_bytree': 0.7737560407800343, 'reg_alpha': 0.3219072605566371, 'reg_lambda': 4.560986055373255, 'gamma': 3.4405882847310902, 'scale_pos_weight': 10.402051854260518}. Best is trial 4 with value: 0.14941735370340975.
[I 2025-12-04 00:54:28,031] Trial 8 finished with value: 0.10173467367144347 and parameters: {'n_estimators': 647, 'learning_rate': 0.22689236903079527, 'max_depth': 15, 'min_child_weight': 10, 'subsample': 0.8432883567337606, 'colsample_bytree': 0.7020164039129062, 'reg_alpha': 0.862117487833325, 'reg_lambda': 2.3785328063356093, 'gamma': 0.305716240032044, 'scale_pos_weight': 43.94232205867377}. Best is trial 4 with value: 0.14941735370340975.
[I 2025-12-04 00:54:33,661] Trial 9 finished with value: 0.10047924620852858 and parameters: {'n_estimators': 884, 'learning_rate': 0.26979017584422954, 'max_depth': 11, 'min_child_weight': 4, 'subsample': 0.9689864287142325, 'colsample_bytree': 0.8614551229269958, 'reg_alpha': 0.781118818816894, 'reg_lambda': 2.8683002840218506, 'gamma': 2.0058226211310597, 'scale_pos_weight': 31.971214892457283}. Best is trial 4 with value: 0.14941735370340975.
[I 2025-12-04 00:54:37,287] Trial 10 finished with value: 0.16031364319445482 and parameters: {'n_estimators': 177, 'learning_rate': 0.013290990850279377, 'max_depth': 3, 'min_child_weight': 7, 'subsample': 0.9979388864429879, 'colsample_bytree': 0.6847083236021351, 'reg_alpha': 0.5738285127040961, 'reg_lambda': 7.881036876301602, 'gamma': 0.9827561894602295, 'scale_pos_weight': 6.757050143207714}. Best is trial 10 with value: 0.16031364319445482.
[I 2025-12-04 00:54:40,508] Trial 11 finished with value: 0.15612228483674104 and parameters: {'n_estimators': 140, 'learning_rate': 0.010509026791601782, 'max_depth': 3, 'min_child_weight': 7, 'subsample': 0.9895234988673762, 'colsample_bytree': 0.6953605996010757, 'reg_alpha': 0.5892897943967106, 'reg_lambda': 8.504581900693692, 'gamma': 0.9056751266840266, 'scale_pos_weight': 5.418344085169389}. Best is trial 10 with value: 0.16031364319445482.
[I 2025-12-04 00:54:46,810] Trial 12 finished with value: 0.1519194386563293 and parameters: {'n_estimators': 114, 'learning_rate': 0.01226143957602826, 'max_depth': 3, 'min_child_weight': 7, 'subsample': 0.9959722488611102, 'colsample_bytree': 0.6041251874569843, 'reg_alpha': 0.6184158040825437, 'reg_lambda': 7.98594653178392, 'gamma': 1.082688254541063, 'scale_pos_weight': 17.28843254021674}. Best is trial 10 with value: 0.16031364319445482.
[I 2025-12-04 00:55:37,346] Trial 13 finished with value: 0.1607111073595937 and parameters: {'n_estimators': 358, 'learning_rate': 0.010042902026868333, 'max_depth': 5, 'min_child_weight': 7, 'subsample': 0.9059214898434522, 'colsample_bytree': 0.6898869549478293, 'reg_alpha': 0.6613419519121609, 'reg_lambda': 7.705845496036176, 'gamma': 1.1978251719770268, 'scale_pos_weight': 5.428706127481902}. Best is trial 13 with value: 0.1607111073595937.
[I 2025-12-04 00:55:43,492] Trial 14 finished with value: 0.13706098743951628 and parameters: {'n_estimators': 380, 'learning_rate': 0.04576533903718603, 'max_depth': 5, 'min_child_weight': 7, 'subsample': 0.9042993715611722, 'colsample_bytree': 0.6681221129129742, 'reg_alpha': 0.7054631741704083, 'reg_lambda': 7.352792111155978, 'gamma': 1.2161517172408491, 'scale_pos_weight': 15.504245914449228}. Best is trial 13 with value: 0.1607111073595937.
[I 2025-12-04 00:55:52,720] Trial 15 finished with value: 0.11198306888653539 and parameters: {'n_estimators': 337, 'learning_rate': 0.140992200358069, 'max_depth': 5, 'min_child_weight': 6, 'subsample': 0.9199505836259263, 'colsample_bytree': 0.7508441205725372, 'reg_alpha': 0.9806852393082128, 'reg_lambda': 5.6400451692751705, 'gamma': 1.6448368294698912, 'scale_pos_weight': 26.09767160852733}. Best is trial 13 with value: 0.1607111073595937.
[I 2025-12-04 00:56:07,139] Trial 16 finished with value: 0.12547794143709573 and parameters: {'n_estimators': 443, 'learning_rate': 0.034576634506621226, 'max_depth': 8, 'min_child_weight': 8, 'subsample': 0.8254328885349123, 'colsample_bytree': 0.6663354190502055, 'reg_alpha': 0.4366565857379605, 'reg_lambda': 7.612352981500734, 'gamma': 0.8176543362089852, 'scale_pos_weight': 12.65999730984398}. Best is trial 13 with value: 0.1607111073595937.
[I 2025-12-04 00:56:12,641] Trial 17 finished with value: 0.10533153688360963 and parameters: {'n_estimators': 219, 'learning_rate': 0.17745377488552727, 'max_depth': 4, 'min_child_weight': 6, 'subsample': 0.8695987271884652, 'colsample_bytree': 0.7403618607785637, 'reg_alpha': 0.698289297896172, 'reg_lambda': 6.426898182926589, 'gamma': 2.726688044038921, 'scale_pos_weight': 21.669122090386054}. Best is trial 13 with value: 0.1607111073595937.
[I 2025-12-04 00:56:18,559] Trial 18 finished with value: 0.11104289666629197 and parameters: {'n_estimators': 360, 'learning_rate': 0.10220255916016793, 'max_depth': 7, 'min_child_weight': 8, 'subsample': 0.9399540751520655, 'colsample_bytree': 0.6469267310243825, 'reg_alpha': 0.44884734129734477, 'reg_lambda': 3.7900342724268463, 'gamma': 2.076610667489784, 'scale_pos_weight': 35.34697401328693}. Best is trial 13 with value: 0.1607111073595937.
[I 2025-12-04 00:56:22,465] Trial 19 finished with value: 0.15238502655090796 and parameters: {'n_estimators': 187, 'learning_rate': 0.047574836021704044, 'max_depth': 4, 'min_child_weight': 5, 'subsample': 0.8947495190557093, 'colsample_bytree': 0.8313192926146686, 'reg_alpha': 0.5032882332989903, 'reg_lambda': 8.19875990247071, 'gamma': 0.5979463092882269, 'scale_pos_weight': 11.773350521636978}. Best is trial 13 with value: 0.1607111073595937.
[I 2025-12-04 00:56:28,488] Trial 20 finished with value: 0.101630595792256 and parameters: {'n_estimators': 449, 'learning_rate': 0.13053435114068518, 'max_depth': 6, 'min_child_weight': 8, 'subsample': 0.9533890372208199, 'colsample_bytree': 0.7363442208057472, 'reg_alpha': 0.7009027805620188, 'reg_lambda': 5.607125397710053, 'gamma': 1.4122511239060573, 'scale_pos_weight': 37.79023292862837}. Best is trial 13 with value: 0.1607111073595937.
[I 2025-12-04 00:56:32,356] Trial 21 finished with value: 0.157886887200543 and parameters: {'n_estimators': 108, 'learning_rate': 0.017580194872313503, 'max_depth': 3, 'min_child_weight': 7, 'subsample': 0.9881427894331991, 'colsample_bytree': 0.6966313667173414, 'reg_alpha': 0.6153506755114937, 'reg_lambda': 8.707552376912966, 'gamma': 0.8116087476154143, 'scale_pos_weight': 5.424846142721381}. Best is trial 13 with value: 0.1607111073595937.
[I 2025-12-04 00:56:36,698] Trial 22 finished with value: 0.1657362509830733 and parameters: {'n_estimators': 105, 'learning_rate': 0.03443638777664818, 'max_depth': 4, 'min_child_weight': 6, 'subsample': 0.9904626954676592, 'colsample_bytree': 0.6502522073716985, 'reg_alpha': 0.6308752278854162, 'reg_lambda': 8.91840775620838, 'gamma': 0.5761314908788076, 'scale_pos_weight': 6.416299776445138}. Best is trial 22 with value: 0.1657362509830733.
[I 2025-12-04 00:56:40,662] Trial 23 finished with value: 0.14179010792289276 and parameters: {'n_estimators': 292, 'learning_rate': 0.06179228454282749, 'max_depth': 4, 'min_child_weight': 6, 'subsample': 0.9194086550514257, 'colsample_bytree': 0.6386977008373591, 'reg_alpha': 0.4989229728849976, 'reg_lambda': 7.411854077232224, 'gamma': 0.43841736511756313, 'scale_pos_weight': 10.114881025601276}. Best is trial 22 with value: 0.1657362509830733.
[I 2025-12-04 00:56:45,747] Trial 24 finished with value: 0.14072916984978887 and parameters: {'n_estimators': 207, 'learning_rate': 0.030817201045600158, 'max_depth': 6, 'min_child_weight': 5, 'subsample': 0.9561255859745729, 'colsample_bytree': 0.6600645797733579, 'reg_alpha': 0.7441901633776322, 'reg_lambda': 9.216283984118913, 'gamma': 1.3928750372938183, 'scale_pos_weight': 23.40564538036912}. Best is trial 22 with value: 0.1657362509830733.
[I 2025-12-04 00:56:49,897] Trial 25 finished with value: 0.14710462778993194 and parameters: {'n_estimators': 185, 'learning_rate': 0.06145990998692229, 'max_depth': 4, 'min_child_weight': 9, 'subsample': 0.853983943321204, 'colsample_bytree': 0.7756312897001569, 'reg_alpha': 0.38518071952106947, 'reg_lambda': 6.9813404689786225, 'gamma': 2.188979664246842, 'scale_pos_weight': 15.067288507073888}. Best is trial 22 with value: 0.1657362509830733.
[I 2025-12-04 00:57:10,574] Trial 26 finished with value: 0.14174190943422071 and parameters: {'n_estimators': 306, 'learning_rate': 0.030795800672938498, 'max_depth': 13, 'min_child_weight': 4, 'subsample': 0.9946251740497475, 'colsample_bytree': 0.6324652796186285, 'reg_alpha': 0.6392512512041731, 'reg_lambda': 9.9444673391929, 'gamma': 0.5709312601805796, 'scale_pos_weight': 8.323925849057822}. Best is trial 22 with value: 0.1657362509830733.
[I 2025-12-04 00:57:24,745] Trial 27 finished with value: 0.12846262623697507 and parameters: {'n_estimators': 422, 'learning_rate': 0.08265780151499441, 'max_depth': 9, 'min_child_weight': 6, 'subsample': 0.8158046828193664, 'colsample_bytree': 0.6766983680815086, 'reg_alpha': 0.7987333368970778, 'reg_lambda': 8.114349505181048, 'gamma': 1.57785428468914, 'scale_pos_weight': 13.754419721654479}. Best is trial 22 with value: 0.1657362509830733.
[I 2025-12-04 00:57:28,902] Trial 28 finished with value: 0.13908514257591617 and parameters: {'n_estimators': 165, 'learning_rate': 0.04965279537381368, 'max_depth': 5, 'min_child_weight': 8, 'subsample': 0.9297000023036763, 'colsample_bytree': 0.7330141783588484, 'reg_alpha': 0.5394476971456409, 'reg_lambda': 6.087837213902774, 'gamma': 4.6868209175414055, 'scale_pos_weight': 19.336190255129004}. Best is trial 22 with value: 0.1657362509830733.
[I 2025-12-04 00:59:03,965] Trial 29 finished with value: 0.11425826218214401 and parameters: {'n_estimators': 591, 'learning_rate': 0.09932801196002372, 'max_depth': 7, 'min_child_weight': 3, 'subsample': 0.9700069449859359, 'colsample_bytree': 0.6213245273794433, 'reg_alpha': 0.9894584805751818, 'reg_lambda': 4.419943479174968, 'gamma': 0.0653454784069667, 'scale_pos_weight': 8.244577724413947}. Best is trial 22 with value: 0.1657362509830733.
[I 2025-12-04 00:59:07,778] A new study created in memory with name: xgboost_fold_2
[I 2025-12-04 01:00:09,737] Trial 0 finished with value: 0.12178347551032313 and parameters: {'n_estimators': 444, 'learning_rate': 0.12275207252087017, 'max_depth': 10, 'min_child_weight': 10, 'subsample': 0.6702445333045021, 'colsample_bytree': 0.6126066462812376, 'reg_alpha': 0.6945148483230715, 'reg_lambda': 7.534645676422178, 'gamma': 3.820506301569771, 'scale_pos_weight': 5.59679851155174}. Best is trial 0 with value: 0.12178347551032313.
[I 2025-12-04 01:00:37,210] Trial 1 finished with value: 0.09291117580919904 and parameters: {'n_estimators': 341, 'learning_rate': 0.2527784139625963, 'max_depth': 8, 'min_child_weight': 5, 'subsample': 0.6156298105163104, 'colsample_bytree': 0.6161681822377201, 'reg_alpha': 0.2298822136873656, 'reg_lambda': 9.923982675931628, 'gamma': 4.703849500343298, 'scale_pos_weight': 45.359024206119486}. Best is trial 0 with value: 0.12178347551032313.
[I 2025-12-04 01:01:39,603] Trial 2 finished with value: 0.11093082215047523 and parameters: {'n_estimators': 315, 'learning_rate': 0.08533915113936125, 'max_depth': 5, 'min_child_weight': 9, 'subsample': 0.7718918426077117, 'colsample_bytree': 0.8904053610848439, 'reg_alpha': 0.5080578188243584, 'reg_lambda': 9.493954543550512, 'gamma': 4.82826180041739, 'scale_pos_weight': 26.879890763446873}. Best is trial 0 with value: 0.12178347551032313.
[I 2025-12-04 01:02:18,125] Trial 3 finished with value: 0.10749508017881644 and parameters: {'n_estimators': 139, 'learning_rate': 0.21470355492690366, 'max_depth': 11, 'min_child_weight': 3, 'subsample': 0.7055437522754727, 'colsample_bytree': 0.9263172208764655, 'reg_alpha': 0.36428843782919185, 'reg_lambda': 8.03734081325777, 'gamma': 2.409260782148631, 'scale_pos_weight': 9.603355970796231}. Best is trial 0 with value: 0.12178347551032313.
[I 2025-12-04 01:04:54,783] Trial 4 finished with value: 0.09661673115616931 and parameters: {'n_estimators': 573, 'learning_rate': 0.11731240734523267, 'max_depth': 5, 'min_child_weight': 3, 'subsample': 0.8303835428651076, 'colsample_bytree': 0.9532891325544288, 'reg_alpha': 0.7688106289896782, 'reg_lambda': 4.855093575401782, 'gamma': 1.2085644686423898, 'scale_pos_weight': 35.32787106667238}. Best is trial 0 with value: 0.12178347551032313.
[I 2025-12-04 01:05:57,265] Trial 5 finished with value: 0.08723713751547564 and parameters: {'n_estimators': 428, 'learning_rate': 0.1395661559856496, 'max_depth': 8, 'min_child_weight': 3, 'subsample': 0.6002364888512579, 'colsample_bytree': 0.8871831161894519, 'reg_alpha': 0.13641179778770351, 'reg_lambda': 1.3165233550257893, 'gamma': 3.8008645661817004, 'scale_pos_weight': 24.95496241624423}. Best is trial 0 with value: 0.12178347551032313.
[I 2025-12-04 01:06:32,641] Trial 6 finished with value: 0.1267480615647894 and parameters: {'n_estimators': 186, 'learning_rate': 0.0816576215901093, 'max_depth': 4, 'min_child_weight': 6, 'subsample': 0.9476909082373229, 'colsample_bytree': 0.7264235061776846, 'reg_alpha': 0.8510114696169723, 'reg_lambda': 7.6843792863448455, 'gamma': 4.402699165243991, 'scale_pos_weight': 44.65633513859555}. Best is trial 6 with value: 0.1267480615647894.
[I 2025-12-04 01:07:33,968] Trial 7 finished with value: 0.10264281485475402 and parameters: {'n_estimators': 466, 'learning_rate': 0.21002896920785177, 'max_depth': 10, 'min_child_weight': 3, 'subsample': 0.8210026707075987, 'colsample_bytree': 0.7056253573755896, 'reg_alpha': 0.6038069025575405, 'reg_lambda': 7.448286782521981, 'gamma': 1.8856973954258254, 'scale_pos_weight': 38.99624778577625}. Best is trial 6 with value: 0.1267480615647894.
[I 2025-12-04 01:11:39,100] Trial 8 finished with value: 0.09925335199575654 and parameters: {'n_estimators': 956, 'learning_rate': 0.19899054480382242, 'max_depth': 5, 'min_child_weight': 2, 'subsample': 0.6915145549825278, 'colsample_bytree': 0.7274322249901454, 'reg_alpha': 0.44925454286057664, 'reg_lambda': 4.356306220011966, 'gamma': 1.4480818521616419, 'scale_pos_weight': 9.678349818103648}. Best is trial 6 with value: 0.1267480615647894.
[I 2025-12-04 01:12:43,814] Trial 9 finished with value: 0.0929548814505831 and parameters: {'n_estimators': 600, 'learning_rate': 0.25839110692012335, 'max_depth': 13, 'min_child_weight': 9, 'subsample': 0.8141391796743188, 'colsample_bytree': 0.8083490195309554, 'reg_alpha': 0.6523892514935297, 'reg_lambda': 3.68324174107357, 'gamma': 3.4331825641538605, 'scale_pos_weight': 37.30771669623928}. Best is trial 6 with value: 0.1267480615647894.
[I 2025-12-04 01:15:00,096] Trial 10 finished with value: 0.11178459891573636 and parameters: {'n_estimators': 118, 'learning_rate': 0.013429105121665258, 'max_depth': 15, 'min_child_weight': 7, 'subsample': 0.992459807776504, 'colsample_bytree': 0.7871841908638361, 'reg_alpha': 0.9903883785141854, 'reg_lambda': 6.175155843725451, 'gamma': 0.6515592090410114, 'scale_pos_weight': 52.12603007601457}. Best is trial 6 with value: 0.1267480615647894.
[I 2025-12-04 01:15:41,718] Trial 11 finished with value: 0.1316460454782304 and parameters: {'n_estimators': 748, 'learning_rate': 0.05882685008762467, 'max_depth': 3, 'min_child_weight': 7, 'subsample': 0.970433154079828, 'colsample_bytree': 0.601664088511655, 'reg_alpha': 0.8709564540802475, 'reg_lambda': 7.418481711448145, 'gamma': 3.665631529397881, 'scale_pos_weight': 18.42537867240506}. Best is trial 11 with value: 0.1316460454782304.
[I 2025-12-04 01:16:52,094] Trial 12 finished with value: 0.1338384075809008 and parameters: {'n_estimators': 792, 'learning_rate': 0.05162314099795861, 'max_depth': 3, 'min_child_weight': 6, 'subsample': 0.9917740234424062, 'colsample_bytree': 0.6617536982594447, 'reg_alpha': 0.9261813609709766, 'reg_lambda': 6.588944921874982, 'gamma': 2.94045315222667, 'scale_pos_weight': 18.602572254752523}. Best is trial 12 with value: 0.1338384075809008.
[I 2025-12-04 01:18:38,263] Trial 13 finished with value: 0.1491376612371969 and parameters: {'n_estimators': 796, 'learning_rate': 0.015476569221436663, 'max_depth': 3, 'min_child_weight': 7, 'subsample': 0.9112018728325832, 'colsample_bytree': 0.6584800545864772, 'reg_alpha': 0.9937094456913602, 'reg_lambda': 6.108146769372922, 'gamma': 2.894702830742352, 'scale_pos_weight': 20.397866668166024}. Best is trial 13 with value: 0.1491376612371969.
[I 2025-12-04 01:21:55,238] Trial 14 finished with value: 0.11989455145709163 and parameters: {'n_estimators': 849, 'learning_rate': 0.014606090726160675, 'max_depth': 7, 'min_child_weight': 5, 'subsample': 0.9021445307354735, 'colsample_bytree': 0.6702488926143109, 'reg_alpha': 0.993024212730315, 'reg_lambda': 5.9040236872837895, 'gamma': 3.0629982729493554, 'scale_pos_weight': 18.357654124373454}. Best is trial 13 with value: 0.1491376612371969.
[I 2025-12-04 01:23:27,073] Trial 15 finished with value: 0.14038452780374994 and parameters: {'n_estimators': 721, 'learning_rate': 0.044443984644755824, 'max_depth': 3, 'min_child_weight': 7, 'subsample': 0.8894834993128329, 'colsample_bytree': 0.6686547057289906, 'reg_alpha': 0.8450405085662178, 'reg_lambda': 2.7950110844463203, 'gamma': 2.8007332568858043, 'scale_pos_weight': 19.63528886594638}. Best is trial 13 with value: 0.1491376612371969.
[I 2025-12-04 01:26:33,171] Trial 16 finished with value: 0.11003733664744589 and parameters: {'n_estimators': 680, 'learning_rate': 0.040801436993711214, 'max_depth': 6, 'min_child_weight': 8, 'subsample': 0.8806919660535579, 'colsample_bytree': 0.7849950667336584, 'reg_alpha': 0.7856465369171994, 'reg_lambda': 2.5929619312436407, 'gamma': 2.3305753508321905, 'scale_pos_weight': 21.538718176702996}. Best is trial 13 with value: 0.1491376612371969.
[I 2025-12-04 01:27:16,419] Trial 17 finished with value: 0.11370479483824929 and parameters: {'n_estimators': 989, 'learning_rate': 0.2972149318797608, 'max_depth': 3, 'min_child_weight': 8, 'subsample': 0.8907387053671031, 'colsample_bytree': 0.6829276115361747, 'reg_alpha': 0.7544702971457506, 'reg_lambda': 2.9317799612187425, 'gamma': 2.739597408262445, 'scale_pos_weight': 13.451294977997568}. Best is trial 13 with value: 0.1491376612371969.
[I 2025-12-04 01:29:02,602] Trial 18 finished with value: 0.09386505935288932 and parameters: {'n_estimators': 868, 'learning_rate': 0.17341299344789757, 'max_depth': 7, 'min_child_weight': 7, 'subsample': 0.9303520387808007, 'colsample_bytree': 0.7577554922052564, 'reg_alpha': 0.028557228113059607, 'reg_lambda': 1.1683139348279488, 'gamma': 0.31603345682880146, 'scale_pos_weight': 31.382874283109878}. Best is trial 13 with value: 0.1491376612371969.
[I 2025-12-04 01:30:05,415] Trial 19 finished with value: 0.10144454490115098 and parameters: {'n_estimators': 673, 'learning_rate': 0.09132942465866506, 'max_depth': 4, 'min_child_weight': 5, 'subsample': 0.8566103638142025, 'colsample_bytree': 0.6511498146040816, 'reg_alpha': 0.5455234921923835, 'reg_lambda': 4.805036095571867, 'gamma': 1.892709249327389, 'scale_pos_weight': 30.6734471408035}. Best is trial 13 with value: 0.1491376612371969.
[I 2025-12-04 01:33:02,132] Trial 20 finished with value: 0.11083577816608162 and parameters: {'n_estimators': 686, 'learning_rate': 0.046245111068185026, 'max_depth': 12, 'min_child_weight': 10, 'subsample': 0.7514688357267691, 'colsample_bytree': 0.8327660360272034, 'reg_alpha': 0.8797666467622477, 'reg_lambda': 2.321294189997345, 'gamma': 4.191195069900182, 'scale_pos_weight': 23.359321234538125}. Best is trial 13 with value: 0.1491376612371969.
[I 2025-12-04 01:33:51,089] Trial 21 finished with value: 0.1435437560435034 and parameters: {'n_estimators': 800, 'learning_rate': 0.03235207420448093, 'max_depth': 3, 'min_child_weight': 6, 'subsample': 0.9989637794131203, 'colsample_bytree': 0.6450861944757317, 'reg_alpha': 0.9286186073323935, 'reg_lambda': 6.397462936004782, 'gamma': 2.9578475295570934, 'scale_pos_weight': 17.8236853876109}. Best is trial 13 with value: 0.1491376612371969.
