[I 2025-12-03 20:18:51,888] Trial 13 finished with value: 0.3721213189695013 and parameters: {'n_estimators': 225, 'max_depth': 12, 'min_samples_split': 13, 'min_samples_leaf': 18, 'max_features': 'log2', 'criterion': 'entropy', 'bootstrap': False}. Best is trial 3 with value: 0.37422400971387687.
[I 2025-12-03 20:18:52,960] Trial 14 finished with value: 0.37271454394967984 and parameters: {'n_estimators': 100, 'max_depth': 5, 'min_samples_split': 8, 'min_samples_leaf': 5, 'max_features': 'log2', 'criterion': 'entropy', 'bootstrap': False}. Best is trial 3 with value: 0.37422400971387687.
[I 2025-12-03 20:18:56,249] Trial 15 finished with value: 0.3732553262727203 and parameters: {'n_estimators': 225, 'max_depth': 26, 'min_samples_split': 14, 'min_samples_leaf': 20, 'max_features': 'log2', 'criterion': 'entropy', 'bootstrap': False}. Best is trial 3 with value: 0.37422400971387687.
[I 2025-12-03 20:18:57,814] Trial 16 finished with value: 0.3713432700899712 and parameters: {'n_estimators': 125, 'max_depth': 18, 'min_samples_split': 8, 'min_samples_leaf': 13, 'max_features': 'log2', 'criterion': 'entropy', 'bootstrap': True}. Best is trial 3 with value: 0.37422400971387687.
[I 2025-12-03 20:18:59,668] Trial 17 finished with value: 0.3717260503686117 and parameters: {'n_estimators': 125, 'max_depth': 12, 'min_samples_split': 15, 'min_samples_leaf': 18, 'max_features': 'log2', 'criterion': 'log_loss', 'bootstrap': False}. Best is trial 3 with value: 0.37422400971387687.
[I 2025-12-03 20:19:02,331] Trial 18 finished with value: 0.3725453343077073 and parameters: {'n_estimators': 225, 'max_depth': 9, 'min_samples_split': 10, 'min_samples_leaf': 18, 'max_features': 'log2', 'criterion': 'entropy', 'bootstrap': False}. Best is trial 3 with value: 0.37422400971387687.
[I 2025-12-03 20:19:04,103] Trial 19 finished with value: 0.35816084657017094 and parameters: {'n_estimators': 150, 'max_depth': 19, 'min_samples_split': 8, 'min_samples_leaf': 3, 'max_features': 'sqrt', 'criterion': 'gini', 'bootstrap': True}. Best is trial 3 with value: 0.37422400971387687.
[I 2025-12-03 20:19:07,029] Trial 20 finished with value: 0.37095249977911193 and parameters: {'n_estimators': 200, 'max_depth': 14, 'min_samples_split': 17, 'min_samples_leaf': 12, 'max_features': 'log2', 'criterion': 'log_loss', 'bootstrap': False}. Best is trial 3 with value: 0.37422400971387687.
[I 2025-12-03 20:19:08,116] Trial 21 finished with value: 0.37057572128845506 and parameters: {'n_estimators': 100, 'max_depth': 8, 'min_samples_split': 2, 'min_samples_leaf': 14, 'max_features': 'log2', 'criterion': 'log_loss', 'bootstrap': True}. Best is trial 3 with value: 0.37422400971387687.
[I 2025-12-03 20:19:09,538] Trial 22 finished with value: 0.37281795660544714 and parameters: {'n_estimators': 175, 'max_depth': 5, 'min_samples_split': 3, 'min_samples_leaf': 15, 'max_features': 'log2', 'criterion': 'log_loss', 'bootstrap': True}. Best is trial 3 with value: 0.37422400971387687.
[I 2025-12-03 20:19:10,825] Trial 23 finished with value: 0.37312103737627506 and parameters: {'n_estimators': 125, 'max_depth': 7, 'min_samples_split': 8, 'min_samples_leaf': 17, 'max_features': 'log2', 'criterion': 'log_loss', 'bootstrap': True}. Best is trial 3 with value: 0.37422400971387687.
[I 2025-12-03 20:19:12,659] Trial 24 finished with value: 0.3728466786122082 and parameters: {'n_estimators': 200, 'max_depth': 10, 'min_samples_split': 2, 'min_samples_leaf': 20, 'max_features': 'log2', 'criterion': 'log_loss', 'bootstrap': True}. Best is trial 3 with value: 0.37422400971387687.
[I 2025-12-03 20:19:14,294] Trial 25 finished with value: 0.367270798469092 and parameters: {'n_estimators': 150, 'max_depth': 11, 'min_samples_split': 7, 'min_samples_leaf': 8, 'max_features': 'log2', 'criterion': 'entropy', 'bootstrap': True}. Best is trial 3 with value: 0.37422400971387687.
[I 2025-12-03 20:19:15,553] Trial 26 finished with value: 0.37122484287757546 and parameters: {'n_estimators': 125, 'max_depth': 7, 'min_samples_split': 11, 'min_samples_leaf': 18, 'max_features': 'log2', 'criterion': 'log_loss', 'bootstrap': True}. Best is trial 3 with value: 0.37422400971387687.
[I 2025-12-03 20:19:18,026] Trial 27 finished with value: 0.3710493830077176 and parameters: {'n_estimators': 250, 'max_depth': 14, 'min_samples_split': 3, 'min_samples_leaf': 11, 'max_features': 'log2', 'criterion': 'log_loss', 'bootstrap': True}. Best is trial 3 with value: 0.37422400971387687.
[I 2025-12-03 20:19:27,676] Trial 28 finished with value: 0.34389898770393723 and parameters: {'n_estimators': 100, 'max_depth': 22, 'min_samples_split': 6, 'min_samples_leaf': 16, 'max_features': None, 'criterion': 'gini', 'bootstrap': False}. Best is trial 3 with value: 0.37422400971387687.
[I 2025-12-03 20:19:31,235] Trial 29 finished with value: 0.37424382652328936 and parameters: {'n_estimators': 175, 'max_depth': 17, 'min_samples_split': 12, 'min_samples_leaf': 14, 'max_features': 'sqrt', 'criterion': 'entropy', 'bootstrap': False}. Best is trial 29 with value: 0.37424382652328936.
[I 2025-12-03 20:19:32,904] A new study created in memory with name: random_forest_fold_4
[I 2025-12-03 20:19:35,292] Trial 0 finished with value: 0.3726541881955684 and parameters: {'n_estimators': 250, 'max_depth': 25, 'min_samples_split': 13, 'min_samples_leaf': 14, 'max_features': 'sqrt', 'criterion': 'gini', 'bootstrap': True}. Best is trial 0 with value: 0.3726541881955684.
[I 2025-12-03 20:19:45,706] Trial 1 finished with value: 0.357491460967483 and parameters: {'n_estimators': 200, 'max_depth': 11, 'min_samples_split': 2, 'min_samples_leaf': 5, 'max_features': None, 'criterion': 'gini', 'bootstrap': True}. Best is trial 0 with value: 0.3726541881955684.
[I 2025-12-03 20:19:51,378] Trial 2 finished with value: 0.3604018637149361 and parameters: {'n_estimators': 300, 'max_depth': 18, 'min_samples_split': 20, 'min_samples_leaf': 2, 'max_features': 'sqrt', 'criterion': 'log_loss', 'bootstrap': False}. Best is trial 0 with value: 0.3726541881955684.
[I 2025-12-03 20:20:12,764] Trial 3 finished with value: 0.3372182783807453 and parameters: {'n_estimators': 175, 'max_depth': 16, 'min_samples_split': 18, 'min_samples_leaf': 5, 'max_features': None, 'criterion': 'log_loss', 'bootstrap': False}. Best is trial 0 with value: 0.3726541881955684.
[I 2025-12-03 20:20:21,895] Trial 4 finished with value: 0.3649255039763628 and parameters: {'n_estimators': 125, 'max_depth': 23, 'min_samples_split': 12, 'min_samples_leaf': 10, 'max_features': None, 'criterion': 'log_loss', 'bootstrap': True}. Best is trial 0 with value: 0.3726541881955684.
[I 2025-12-03 20:20:24,354] Trial 5 finished with value: 0.36284126823096663 and parameters: {'n_estimators': 150, 'max_depth': 18, 'min_samples_split': 18, 'min_samples_leaf': 4, 'max_features': 'log2', 'criterion': 'log_loss', 'bootstrap': False}. Best is trial 0 with value: 0.3726541881955684.
[I 2025-12-03 20:20:26,320] Trial 6 finished with value: 0.3693501398515383 and parameters: {'n_estimators': 125, 'max_depth': 14, 'min_samples_split': 11, 'min_samples_leaf': 13, 'max_features': 'sqrt', 'criterion': 'gini', 'bootstrap': False}. Best is trial 0 with value: 0.3726541881955684.
[I 2025-12-03 20:20:28,918] Trial 7 finished with value: 0.354137992941581 and parameters: {'n_estimators': 250, 'max_depth': 21, 'min_samples_split': 12, 'min_samples_leaf': 2, 'max_features': 'sqrt', 'criterion': 'gini', 'bootstrap': True}. Best is trial 0 with value: 0.3726541881955684.
[I 2025-12-03 20:20:55,384] Trial 8 finished with value: 0.3383312489583093 and parameters: {'n_estimators': 225, 'max_depth': 16, 'min_samples_split': 14, 'min_samples_leaf': 8, 'max_features': None, 'criterion': 'entropy', 'bootstrap': False}. Best is trial 0 with value: 0.3726541881955684.
[I 2025-12-03 20:20:57,050] Trial 9 finished with value: 0.3709516769354496 and parameters: {'n_estimators': 100, 'max_depth': 20, 'min_samples_split': 19, 'min_samples_leaf': 14, 'max_features': 'sqrt', 'criterion': 'log_loss', 'bootstrap': True}. Best is trial 0 with value: 0.3726541881955684.
[I 2025-12-03 20:20:59,800] Trial 10 finished with value: 0.3768699030760283 and parameters: {'n_estimators': 300, 'max_depth': 28, 'min_samples_split': 6, 'min_samples_leaf': 20, 'max_features': 'log2', 'criterion': 'entropy', 'bootstrap': True}. Best is trial 10 with value: 0.3768699030760283.
[I 2025-12-03 20:21:02,579] Trial 11 finished with value: 0.37459909478547904 and parameters: {'n_estimators': 300, 'max_depth': 30, 'min_samples_split': 6, 'min_samples_leaf': 20, 'max_features': 'log2', 'criterion': 'entropy', 'bootstrap': True}. Best is trial 10 with value: 0.3768699030760283.
[I 2025-12-03 20:21:05,357] Trial 12 finished with value: 0.374194373786113 and parameters: {'n_estimators': 300, 'max_depth': 30, 'min_samples_split': 5, 'min_samples_leaf': 20, 'max_features': 'log2', 'criterion': 'entropy', 'bootstrap': True}. Best is trial 10 with value: 0.3768699030760283.
[I 2025-12-03 20:21:07,953] Trial 13 finished with value: 0.3745663063533382 and parameters: {'n_estimators': 275, 'max_depth': 30, 'min_samples_split': 7, 'min_samples_leaf': 19, 'max_features': 'log2', 'criterion': 'entropy', 'bootstrap': True}. Best is trial 10 with value: 0.3768699030760283.
[I 2025-12-03 20:21:10,147] Trial 14 finished with value: 0.3740847935584523 and parameters: {'n_estimators': 300, 'max_depth': 5, 'min_samples_split': 8, 'min_samples_leaf': 18, 'max_features': 'log2', 'criterion': 'entropy', 'bootstrap': True}. Best is trial 10 with value: 0.3768699030760283.
[I 2025-12-03 20:21:12,547] Trial 15 finished with value: 0.37377518629279216 and parameters: {'n_estimators': 250, 'max_depth': 25, 'min_samples_split': 2, 'min_samples_leaf': 17, 'max_features': 'log2', 'criterion': 'entropy', 'bootstrap': True}. Best is trial 10 with value: 0.3768699030760283.
[I 2025-12-03 20:21:15,162] Trial 16 finished with value: 0.3728602144275587 and parameters: {'n_estimators': 275, 'max_depth': 26, 'min_samples_split': 5, 'min_samples_leaf': 16, 'max_features': 'log2', 'criterion': 'entropy', 'bootstrap': True}. Best is trial 10 with value: 0.3768699030760283.
[I 2025-12-03 20:21:17,222] Trial 17 finished with value: 0.3775742889651014 and parameters: {'n_estimators': 200, 'max_depth': 28, 'min_samples_split': 8, 'min_samples_leaf': 20, 'max_features': 'log2', 'criterion': 'entropy', 'bootstrap': True}. Best is trial 17 with value: 0.3775742889651014.
[I 2025-12-03 20:21:19,306] Trial 18 finished with value: 0.37030741230456954 and parameters: {'n_estimators': 200, 'max_depth': 27, 'min_samples_split': 9, 'min_samples_leaf': 12, 'max_features': 'log2', 'criterion': 'entropy', 'bootstrap': True}. Best is trial 17 with value: 0.3775742889651014.
[I 2025-12-03 20:21:21,306] Trial 19 finished with value: 0.3746741671890893 and parameters: {'n_estimators': 200, 'max_depth': 22, 'min_samples_split': 15, 'min_samples_leaf': 16, 'max_features': 'log2', 'criterion': 'entropy', 'bootstrap': True}. Best is trial 17 with value: 0.3775742889651014.
[I 2025-12-03 20:21:23,187] Trial 20 finished with value: 0.3674143391681455 and parameters: {'n_estimators': 175, 'max_depth': 27, 'min_samples_split': 9, 'min_samples_leaf': 9, 'max_features': 'log2', 'criterion': 'entropy', 'bootstrap': True}. Best is trial 17 with value: 0.3775742889651014.
[I 2025-12-03 20:21:25,428] Trial 21 finished with value: 0.37366837142360926 and parameters: {'n_estimators': 225, 'max_depth': 22, 'min_samples_split': 15, 'min_samples_leaf': 16, 'max_features': 'log2', 'criterion': 'entropy', 'bootstrap': True}. Best is trial 17 with value: 0.3775742889651014.
[I 2025-12-03 20:21:27,254] Trial 22 finished with value: 0.3723666956666388 and parameters: {'n_estimators': 175, 'max_depth': 28, 'min_samples_split': 16, 'min_samples_leaf': 18, 'max_features': 'log2', 'criterion': 'entropy', 'bootstrap': True}. Best is trial 17 with value: 0.3775742889651014.
[I 2025-12-03 20:21:29,345] Trial 23 finished with value: 0.373819496622381 and parameters: {'n_estimators': 200, 'max_depth': 24, 'min_samples_split': 4, 'min_samples_leaf': 16, 'max_features': 'log2', 'criterion': 'entropy', 'bootstrap': True}. Best is trial 17 with value: 0.3775742889651014.
[I 2025-12-03 20:21:31,552] Trial 24 finished with value: 0.37536237102337294 and parameters: {'n_estimators': 225, 'max_depth': 28, 'min_samples_split': 10, 'min_samples_leaf': 20, 'max_features': 'log2', 'criterion': 'entropy', 'bootstrap': True}. Best is trial 17 with value: 0.3775742889651014.
[I 2025-12-03 20:21:33,782] Trial 25 finished with value: 0.3733839046170033 and parameters: {'n_estimators': 225, 'max_depth': 28, 'min_samples_split': 10, 'min_samples_leaf': 20, 'max_features': 'log2', 'criterion': 'entropy', 'bootstrap': True}. Best is trial 17 with value: 0.3775742889651014.
[I 2025-12-03 20:21:37,046] Trial 26 finished with value: 0.3728918587049179 and parameters: {'n_estimators': 275, 'max_depth': 10, 'min_samples_split': 7, 'min_samples_leaf': 18, 'max_features': 'log2', 'criterion': 'entropy', 'bootstrap': False}. Best is trial 17 with value: 0.3775742889651014.
[I 2025-12-03 20:21:38,690] Trial 27 finished with value: 0.37545879067525306 and parameters: {'n_estimators': 150, 'max_depth': 28, 'min_samples_split': 10, 'min_samples_leaf': 19, 'max_features': 'log2', 'criterion': 'entropy', 'bootstrap': True}. Best is trial 17 with value: 0.3775742889651014.
[I 2025-12-03 20:21:46,598] Trial 28 finished with value: 0.36805040763615177 and parameters: {'n_estimators': 150, 'max_depth': 24, 'min_samples_split': 8, 'min_samples_leaf': 18, 'max_features': None, 'criterion': 'gini', 'bootstrap': True}. Best is trial 17 with value: 0.3775742889651014.
[I 2025-12-03 20:21:48,249] Trial 29 finished with value: 0.3701153208489837 and parameters: {'n_estimators': 150, 'max_depth': 25, 'min_samples_split': 4, 'min_samples_leaf': 14, 'max_features': 'log2', 'criterion': 'entropy', 'bootstrap': True}. Best is trial 17 with value: 0.3775742889651014.
[I 2025-12-03 20:21:49,541] A new study created in memory with name: random_forest_fold_5
[I 2025-12-03 20:21:53,003] Trial 0 finished with value: 0.37105428352791525 and parameters: {'n_estimators': 300, 'max_depth': 23, 'min_samples_split': 18, 'min_samples_leaf': 8, 'max_features': 'sqrt', 'criterion': 'entropy', 'bootstrap': True}. Best is trial 0 with value: 0.37105428352791525.
[I 2025-12-03 20:21:54,688] Trial 1 finished with value: 0.3799961503692041 and parameters: {'n_estimators': 100, 'max_depth': 18, 'min_samples_split': 6, 'min_samples_leaf': 15, 'max_features': 'log2', 'criterion': 'log_loss', 'bootstrap': False}. Best is trial 1 with value: 0.3799961503692041.
[I 2025-12-03 20:21:56,389] Trial 2 finished with value: 0.37756138964029484 and parameters: {'n_estimators': 125, 'max_depth': 10, 'min_samples_split': 3, 'min_samples_leaf': 18, 'max_features': 'log2', 'criterion': 'log_loss', 'bootstrap': False}. Best is trial 1 with value: 0.3799961503692041.
[I 2025-12-03 20:22:09,886] Trial 3 finished with value: 0.3714156340925262 and parameters: {'n_estimators': 225, 'max_depth': 10, 'min_samples_split': 6, 'min_samples_leaf': 12, 'max_features': None, 'criterion': 'log_loss', 'bootstrap': True}. Best is trial 1 with value: 0.3799961503692041.
[I 2025-12-03 20:22:13,291] Trial 4 finished with value: 0.3742081071901589 and parameters: {'n_estimators': 175, 'max_depth': 29, 'min_samples_split': 2, 'min_samples_leaf': 12, 'max_features': 'sqrt', 'criterion': 'entropy', 'bootstrap': False}. Best is trial 1 with value: 0.3799961503692041.
[I 2025-12-03 20:22:25,874] Trial 5 finished with value: 0.3487854487269736 and parameters: {'n_estimators': 175, 'max_depth': 9, 'min_samples_split': 16, 'min_samples_leaf': 17, 'max_features': None, 'criterion': 'gini', 'bootstrap': False}. Best is trial 1 with value: 0.3799961503692041.
[I 2025-12-03 20:22:27,578] Trial 6 finished with value: 0.3780231001425923 and parameters: {'n_estimators': 125, 'max_depth': 29, 'min_samples_split': 16, 'min_samples_leaf': 17, 'max_features': 'sqrt', 'criterion': 'log_loss', 'bootstrap': True}. Best is trial 1 with value: 0.3799961503692041.
[I 2025-12-03 20:22:45,996] Trial 7 finished with value: 0.33880569817934175 and parameters: {'n_estimators': 150, 'max_depth': 20, 'min_samples_split': 17, 'min_samples_leaf': 2, 'max_features': None, 'criterion': 'entropy', 'bootstrap': False}. Best is trial 1 with value: 0.3799961503692041.
[I 2025-12-03 20:22:47,232] Trial 8 finished with value: 0.37538241420299506 and parameters: {'n_estimators': 100, 'max_depth': 22, 'min_samples_split': 15, 'min_samples_leaf': 15, 'max_features': 'log2', 'criterion': 'entropy', 'bootstrap': True}. Best is trial 1 with value: 0.3799961503692041.
[I 2025-12-03 20:22:49,326] Trial 9 finished with value: 0.3807266360780546 and parameters: {'n_estimators': 200, 'max_depth': 23, 'min_samples_split': 12, 'min_samples_leaf': 18, 'max_features': 'log2', 'criterion': 'entropy', 'bootstrap': True}. Best is trial 9 with value: 0.3807266360780546.
[I 2025-12-03 20:22:51,474] Trial 10 finished with value: 0.37951031398378376 and parameters: {'n_estimators': 250, 'max_depth': 14, 'min_samples_split': 12, 'min_samples_leaf': 20, 'max_features': 'log2', 'criterion': 'gini', 'bootstrap': True}. Best is trial 9 with value: 0.3807266360780546.
[I 2025-12-03 20:22:55,496] Trial 11 finished with value: 0.3763936479455166 and parameters: {'n_estimators': 275, 'max_depth': 16, 'min_samples_split': 8, 'min_samples_leaf': 8, 'max_features': 'log2', 'criterion': 'log_loss', 'bootstrap': False}. Best is trial 9 with value: 0.3807266360780546.
[I 2025-12-03 20:22:57,578] Trial 12 finished with value: 0.37913360709590854 and parameters: {'n_estimators': 200, 'max_depth': 25, 'min_samples_split': 11, 'min_samples_leaf': 14, 'max_features': 'log2', 'criterion': 'log_loss', 'bootstrap': True}. Best is trial 9 with value: 0.3807266360780546.
[I 2025-12-03 20:22:59,345] Trial 13 finished with value: 0.3783654653955935 and parameters: {'n_estimators': 100, 'max_depth': 18, 'min_samples_split': 9, 'min_samples_leaf': 20, 'max_features': 'log2', 'criterion': 'entropy', 'bootstrap': False}. Best is trial 9 with value: 0.3807266360780546.
[I 2025-12-03 20:23:01,947] Trial 14 finished with value: 0.3771018803091574 and parameters: {'n_estimators': 225, 'max_depth': 14, 'min_samples_split': 5, 'min_samples_leaf': 15, 'max_features': 'log2', 'criterion': 'gini', 'bootstrap': False}. Best is trial 9 with value: 0.3807266360780546.
[I 2025-12-03 20:23:03,319] Trial 15 finished with value: 0.3772932945612713 and parameters: {'n_estimators': 150, 'max_depth': 5, 'min_samples_split': 13, 'min_samples_leaf': 9, 'max_features': 'log2', 'criterion': 'entropy', 'bootstrap': True}. Best is trial 9 with value: 0.3807266360780546.
[I 2025-12-03 20:23:05,507] Trial 16 finished with value: 0.3640678649925876 and parameters: {'n_estimators': 200, 'max_depth': 26, 'min_samples_split': 9, 'min_samples_leaf': 3, 'max_features': 'log2', 'criterion': 'log_loss', 'bootstrap': True}. Best is trial 9 with value: 0.3807266360780546.
[I 2025-12-03 20:23:09,963] Trial 17 finished with value: 0.37574133947793664 and parameters: {'n_estimators': 300, 'max_depth': 19, 'min_samples_split': 20, 'min_samples_leaf': 5, 'max_features': 'log2', 'criterion': 'log_loss', 'bootstrap': False}. Best is trial 9 with value: 0.3807266360780546.
[I 2025-12-03 20:23:26,420] Trial 18 finished with value: 0.36898419869730453 and parameters: {'n_estimators': 250, 'max_depth': 22, 'min_samples_split': 7, 'min_samples_leaf': 12, 'max_features': None, 'criterion': 'entropy', 'bootstrap': True}. Best is trial 9 with value: 0.3807266360780546.
[I 2025-12-03 20:23:28,796] Trial 19 finished with value: 0.38043945825744785 and parameters: {'n_estimators': 150, 'max_depth': 26, 'min_samples_split': 4, 'min_samples_leaf': 18, 'max_features': 'sqrt', 'criterion': 'gini', 'bootstrap': False}. Best is trial 9 with value: 0.3807266360780546.
[I 2025-12-03 20:23:31,609] Trial 20 finished with value: 0.38181576131113754 and parameters: {'n_estimators': 175, 'max_depth': 26, 'min_samples_split': 14, 'min_samples_leaf': 19, 'max_features': 'sqrt', 'criterion': 'gini', 'bootstrap': False}. Best is trial 20 with value: 0.38181576131113754.
[I 2025-12-03 20:23:34,180] Trial 21 finished with value: 0.37974463764543337 and parameters: {'n_estimators': 175, 'max_depth': 26, 'min_samples_split': 13, 'min_samples_leaf': 18, 'max_features': 'sqrt', 'criterion': 'gini', 'bootstrap': False}. Best is trial 20 with value: 0.38181576131113754.
[I 2025-12-03 20:23:36,533] Trial 22 finished with value: 0.37763688168955284 and parameters: {'n_estimators': 150, 'max_depth': 30, 'min_samples_split': 11, 'min_samples_leaf': 20, 'max_features': 'sqrt', 'criterion': 'gini', 'bootstrap': False}. Best is trial 20 with value: 0.38181576131113754.
[I 2025-12-03 20:23:39,140] Trial 23 finished with value: 0.3790699574208911 and parameters: {'n_estimators': 175, 'max_depth': 27, 'min_samples_split': 14, 'min_samples_leaf': 18, 'max_features': 'sqrt', 'criterion': 'gini', 'bootstrap': False}. Best is trial 20 with value: 0.38181576131113754.
[I 2025-12-03 20:23:42,354] Trial 24 finished with value: 0.3791406003702344 and parameters: {'n_estimators': 225, 'max_depth': 23, 'min_samples_split': 10, 'min_samples_leaf': 16, 'max_features': 'sqrt', 'criterion': 'gini', 'bootstrap': False}. Best is trial 20 with value: 0.38181576131113754.
[I 2025-12-03 20:23:45,318] Trial 25 finished with value: 0.3790512586190744 and parameters: {'n_estimators': 200, 'max_depth': 24, 'min_samples_split': 4, 'min_samples_leaf': 19, 'max_features': 'sqrt', 'criterion': 'gini', 'bootstrap': False}. Best is trial 20 with value: 0.38181576131113754.
