[I 2025-12-03 20:23:46,786] Trial 26 finished with value: 0.37512412451839167 and parameters: {'n_estimators': 125, 'max_depth': 28, 'min_samples_split': 19, 'min_samples_leaf': 13, 'max_features': 'sqrt', 'criterion': 'gini', 'bootstrap': True}. Best is trial 20 with value: 0.38181576131113754.
[I 2025-12-03 20:23:49,109] Trial 27 finished with value: 0.3779899125455873 and parameters: {'n_estimators': 150, 'max_depth': 21, 'min_samples_split': 13, 'min_samples_leaf': 17, 'max_features': 'sqrt', 'criterion': 'gini', 'bootstrap': False}. Best is trial 20 with value: 0.38181576131113754.
[I 2025-12-03 20:23:51,157] Trial 28 finished with value: 0.371894702147122 and parameters: {'n_estimators': 200, 'max_depth': 27, 'min_samples_split': 15, 'min_samples_leaf': 10, 'max_features': 'sqrt', 'criterion': 'gini', 'bootstrap': True}. Best is trial 20 with value: 0.38181576131113754.
[I 2025-12-03 20:23:53,428] Trial 29 finished with value: 0.36963288224582264 and parameters: {'n_estimators': 175, 'max_depth': 24, 'min_samples_split': 10, 'min_samples_leaf': 7, 'max_features': 'sqrt', 'criterion': 'entropy', 'bootstrap': True}. Best is trial 20 with value: 0.38181576131113754.
[I 2025-12-03 20:24:26,082] A new study created in memory with name: gradient_boosting_fold_1
[I 2025-12-03 20:25:25,971] Trial 0 finished with value: 0.36447018771759543 and parameters: {'n_estimators': 300, 'learning_rate': 0.2760051211906654, 'max_depth': 6, 'min_samples_split': 20, 'min_samples_leaf': 8, 'subsample': 0.860282320513859, 'max_features': 'log2'}. Best is trial 0 with value: 0.36447018771759543.
[I 2025-12-03 20:37:06,571] Trial 1 finished with value: 0.35626471540837923 and parameters: {'n_estimators': 150, 'learning_rate': 0.2823154852949805, 'max_depth': 15, 'min_samples_split': 4, 'min_samples_leaf': 16, 'subsample': 0.9837244993183476, 'max_features': None}. Best is trial 0 with value: 0.36447018771759543.
[I 2025-12-03 20:38:03,487] Trial 2 finished with value: 0.38073494729549723 and parameters: {'n_estimators': 100, 'learning_rate': 0.049586601193403405, 'max_depth': 14, 'min_samples_split': 13, 'min_samples_leaf': 17, 'subsample': 0.9245169964020894, 'max_features': 'sqrt'}. Best is trial 2 with value: 0.38073494729549723.
[I 2025-12-03 20:39:28,605] Trial 3 finished with value: 0.35712433878018535 and parameters: {'n_estimators': 150, 'learning_rate': 0.258064598412061, 'max_depth': 14, 'min_samples_split': 18, 'min_samples_leaf': 20, 'subsample': 0.9378594416542074, 'max_features': 'sqrt'}. Best is trial 2 with value: 0.38073494729549723.
[I 2025-12-03 20:41:39,976] Trial 4 finished with value: 0.3567511688365982 and parameters: {'n_estimators': 300, 'learning_rate': 0.10427040873492947, 'max_depth': 10, 'min_samples_split': 2, 'min_samples_leaf': 1, 'subsample': 0.8196808785517631, 'max_features': 'sqrt'}. Best is trial 2 with value: 0.38073494729549723.
[I 2025-12-03 20:44:44,061] Trial 5 finished with value: 0.3669808868594302 and parameters: {'n_estimators': 100, 'learning_rate': 0.1821079373881564, 'max_depth': 5, 'min_samples_split': 8, 'min_samples_leaf': 12, 'subsample': 0.9903380159362009, 'max_features': None}. Best is trial 2 with value: 0.38073494729549723.
[I 2025-12-03 20:51:22,058] Trial 6 finished with value: 0.3667221522983063 and parameters: {'n_estimators': 150, 'learning_rate': 0.1416508005771347, 'max_depth': 9, 'min_samples_split': 2, 'min_samples_leaf': 18, 'subsample': 0.860441084113793, 'max_features': None}. Best is trial 2 with value: 0.38073494729549723.
[I 2025-12-03 20:52:39,539] Trial 7 finished with value: 0.38422380208930845 and parameters: {'n_estimators': 150, 'learning_rate': 0.029504231990185002, 'max_depth': 12, 'min_samples_split': 10, 'min_samples_leaf': 14, 'subsample': 0.9393536630589526, 'max_features': 'sqrt'}. Best is trial 7 with value: 0.38422380208930845.
[I 2025-12-03 20:53:31,798] Trial 8 finished with value: 0.36273065090144146 and parameters: {'n_estimators': 100, 'learning_rate': 0.2336510080135473, 'max_depth': 14, 'min_samples_split': 5, 'min_samples_leaf': 15, 'subsample': 0.8634903851390772, 'max_features': 'sqrt'}. Best is trial 7 with value: 0.38422380208930845.
[I 2025-12-03 20:55:34,304] Trial 9 finished with value: 0.3873387101151391 and parameters: {'n_estimators': 100, 'learning_rate': 0.018809616066609962, 'max_depth': 4, 'min_samples_split': 13, 'min_samples_leaf': 13, 'subsample': 0.8202305585091265, 'max_features': None}. Best is trial 9 with value: 0.3873387101151391.
[I 2025-12-03 20:55:59,323] Trial 10 finished with value: 0.38206989520590884 and parameters: {'n_estimators': 250, 'learning_rate': 0.07957159435232697, 'max_depth': 3, 'min_samples_split': 15, 'min_samples_leaf': 8, 'subsample': 0.800758428643503, 'max_features': 'log2'}. Best is trial 9 with value: 0.3873387101151391.
[I 2025-12-03 21:07:56,629] Trial 11 finished with value: 0.3818070597272208 and parameters: {'n_estimators': 200, 'learning_rate': 0.014485073821201792, 'max_depth': 11, 'min_samples_split': 9, 'min_samples_leaf': 10, 'subsample': 0.9339192864560345, 'max_features': None}. Best is trial 9 with value: 0.3873387101151391.
[I 2025-12-03 21:09:06,806] Trial 12 finished with value: 0.38756461432085604 and parameters: {'n_estimators': 200, 'learning_rate': 0.01817575201450203, 'max_depth': 8, 'min_samples_split': 12, 'min_samples_leaf': 13, 'subsample': 0.8946055473996366, 'max_features': 'sqrt'}. Best is trial 12 with value: 0.38756461432085604.
[I 2025-12-03 21:16:32,572] Trial 13 finished with value: 0.37104720434423816 and parameters: {'n_estimators': 200, 'learning_rate': 0.07676288777688149, 'max_depth': 7, 'min_samples_split': 14, 'min_samples_leaf': 5, 'subsample': 0.8885517311388307, 'max_features': None}. Best is trial 12 with value: 0.38756461432085604.
[I 2025-12-03 21:16:57,665] Trial 14 finished with value: 0.37068797280509125 and parameters: {'n_estimators': 250, 'learning_rate': 0.13263277979862048, 'max_depth': 3, 'min_samples_split': 12, 'min_samples_leaf': 12, 'subsample': 0.8312568511198988, 'max_features': 'log2'}. Best is trial 12 with value: 0.38756461432085604.
[I 2025-12-03 21:18:13,617] Trial 15 finished with value: 0.358530724502655 and parameters: {'n_estimators': 250, 'learning_rate': 0.1978760033635628, 'max_depth': 7, 'min_samples_split': 16, 'min_samples_leaf': 12, 'subsample': 0.8966778118163165, 'max_features': 'sqrt'}. Best is trial 12 with value: 0.38756461432085604.
[I 2025-12-03 21:23:18,207] Trial 16 finished with value: 0.37776144288343105 and parameters: {'n_estimators': 200, 'learning_rate': 0.04834764481327378, 'max_depth': 5, 'min_samples_split': 11, 'min_samples_leaf': 9, 'subsample': 0.8356788002903724, 'max_features': None}. Best is trial 12 with value: 0.38756461432085604.
[I 2025-12-03 21:24:34,828] Trial 17 finished with value: 0.3681274941491107 and parameters: {'n_estimators': 200, 'learning_rate': 0.0950316735095672, 'max_depth': 8, 'min_samples_split': 7, 'min_samples_leaf': 6, 'subsample': 0.9697138845920181, 'max_features': 'sqrt'}. Best is trial 12 with value: 0.38756461432085604.
[I 2025-12-03 21:26:46,229] Trial 18 finished with value: 0.3788786585335258 and parameters: {'n_estimators': 100, 'learning_rate': 0.05226761982197893, 'max_depth': 4, 'min_samples_split': 17, 'min_samples_leaf': 14, 'subsample': 0.8798793566485884, 'max_features': None}. Best is trial 12 with value: 0.38756461432085604.
[I 2025-12-03 21:28:01,561] Trial 19 finished with value: 0.3859501640505921 and parameters: {'n_estimators': 250, 'learning_rate': 0.013506837593582066, 'max_depth': 9, 'min_samples_split': 12, 'min_samples_leaf': 19, 'subsample': 0.9170755060872479, 'max_features': 'log2'}. Best is trial 12 with value: 0.38756461432085604.
[I 2025-12-03 21:28:37,789] Trial 20 finished with value: 0.3715900809957173 and parameters: {'n_estimators': 150, 'learning_rate': 0.10969523659141829, 'max_depth': 6, 'min_samples_split': 19, 'min_samples_leaf': 5, 'subsample': 0.804485423901762, 'max_features': 'sqrt'}. Best is trial 12 with value: 0.38756461432085604.
[I 2025-12-03 21:29:52,326] Trial 21 finished with value: 0.385892536665277 and parameters: {'n_estimators': 250, 'learning_rate': 0.012748406646107966, 'max_depth': 9, 'min_samples_split': 13, 'min_samples_leaf': 20, 'subsample': 0.9075904962547627, 'max_features': 'log2'}. Best is trial 12 with value: 0.38756461432085604.
[I 2025-12-03 21:31:57,027] Trial 22 finished with value: 0.3700122617257037 and parameters: {'n_estimators': 300, 'learning_rate': 0.034954745078339955, 'max_depth': 12, 'min_samples_split': 11, 'min_samples_leaf': 13, 'subsample': 0.9649351407072788, 'max_features': 'log2'}. Best is trial 12 with value: 0.38756461432085604.
[I 2025-12-03 21:33:04,798] Trial 23 finished with value: 0.36672771047899355 and parameters: {'n_estimators': 250, 'learning_rate': 0.07920640593324663, 'max_depth': 8, 'min_samples_split': 13, 'min_samples_leaf': 18, 'subsample': 0.9119675632968692, 'max_features': 'log2'}. Best is trial 12 with value: 0.38756461432085604.
[I 2025-12-03 21:34:31,247] Trial 24 finished with value: 0.3889268635769378 and parameters: {'n_estimators': 250, 'learning_rate': 0.010556660799690988, 'max_depth': 10, 'min_samples_split': 15, 'min_samples_leaf': 17, 'subsample': 0.9524199592185486, 'max_features': 'log2'}. Best is trial 24 with value: 0.3889268635769378.
[I 2025-12-03 21:52:20,938] Trial 25 finished with value: 0.3618550850886587 and parameters: {'n_estimators': 300, 'learning_rate': 0.06150786205135168, 'max_depth': 11, 'min_samples_split': 15, 'min_samples_leaf': 16, 'subsample': 0.9561546581054648, 'max_features': None}. Best is trial 24 with value: 0.3889268635769378.
[I 2025-12-03 21:53:26,644] Trial 26 finished with value: 0.3801757786316305 and parameters: {'n_estimators': 200, 'learning_rate': 0.03476980415032867, 'max_depth': 10, 'min_samples_split': 16, 'min_samples_leaf': 11, 'subsample': 0.8766956651480031, 'max_features': 'log2'}. Best is trial 24 with value: 0.3889268635769378.
[I 2025-12-03 21:54:24,507] Trial 27 finished with value: 0.36407350651608733 and parameters: {'n_estimators': 200, 'learning_rate': 0.16442415788085563, 'max_depth': 7, 'min_samples_split': 9, 'min_samples_leaf': 15, 'subsample': 0.8434442939531585, 'max_features': 'sqrt'}. Best is trial 24 with value: 0.3889268635769378.
[I 2025-12-03 21:55:02,384] Trial 28 finished with value: 0.37953992910909357 and parameters: {'n_estimators': 250, 'learning_rate': 0.06727843007682645, 'max_depth': 4, 'min_samples_split': 15, 'min_samples_leaf': 14, 'subsample': 0.9537914204384137, 'max_features': 'log2'}. Best is trial 24 with value: 0.3889268635769378.
[I 2025-12-03 22:04:43,106] Trial 29 finished with value: 0.3678327618251985 and parameters: {'n_estimators': 300, 'learning_rate': 0.12493777777350194, 'max_depth': 6, 'min_samples_split': 19, 'min_samples_leaf': 8, 'subsample': 0.8461265495034069, 'max_features': None}. Best is trial 24 with value: 0.3889268635769378.
[I 2025-12-03 22:05:16,013] A new study created in memory with name: gradient_boosting_fold_2
[I 2025-12-03 22:05:43,647] Trial 0 finished with value: 0.3950118682496822 and parameters: {'n_estimators': 100, 'learning_rate': 0.016542522028287227, 'max_depth': 6, 'min_samples_split': 11, 'min_samples_leaf': 16, 'subsample': 0.8615187869377505, 'max_features': 'log2'}. Best is trial 0 with value: 0.3950118682496822.
[I 2025-12-03 22:11:47,128] Trial 1 finished with value: 0.3755721884668671 and parameters: {'n_estimators': 250, 'learning_rate': 0.11737978918871572, 'max_depth': 3, 'min_samples_split': 2, 'min_samples_leaf': 3, 'subsample': 0.9030498103832917, 'max_features': None}. Best is trial 0 with value: 0.3950118682496822.
[I 2025-12-03 22:25:16,421] Trial 2 finished with value: 0.3682959603810444 and parameters: {'n_estimators': 300, 'learning_rate': 0.2138527511741604, 'max_depth': 7, 'min_samples_split': 15, 'min_samples_leaf': 9, 'subsample': 0.9737095865510106, 'max_features': None}. Best is trial 0 with value: 0.3950118682496822.
[I 2025-12-03 22:26:43,728] Trial 3 finished with value: 0.3653613804916219 and parameters: {'n_estimators': 250, 'learning_rate': 0.09908691767340828, 'max_depth': 8, 'min_samples_split': 8, 'min_samples_leaf': 1, 'subsample': 0.8624969022150646, 'max_features': 'sqrt'}. Best is trial 0 with value: 0.3950118682496822.
[I 2025-12-03 22:27:18,289] Trial 4 finished with value: 0.37525015302101267 and parameters: {'n_estimators': 100, 'learning_rate': 0.09969348763448597, 'max_depth': 10, 'min_samples_split': 11, 'min_samples_leaf': 17, 'subsample': 0.940661536483301, 'max_features': 'log2'}. Best is trial 0 with value: 0.3950118682496822.
[I 2025-12-03 22:33:22,047] Trial 5 finished with value: 0.3773273809570629 and parameters: {'n_estimators': 200, 'learning_rate': 0.10582647402866477, 'max_depth': 5, 'min_samples_split': 4, 'min_samples_leaf': 7, 'subsample': 0.9713448444154423, 'max_features': None}. Best is trial 0 with value: 0.3950118682496822.
[I 2025-12-03 22:34:43,462] Trial 6 finished with value: 0.3626771236721909 and parameters: {'n_estimators': 150, 'learning_rate': 0.22799471657193254, 'max_depth': 14, 'min_samples_split': 17, 'min_samples_leaf': 19, 'subsample': 0.8919800499418092, 'max_features': 'sqrt'}. Best is trial 0 with value: 0.3950118682496822.
[I 2025-12-03 22:36:32,800] Trial 7 finished with value: 0.376725262122927 and parameters: {'n_estimators': 300, 'learning_rate': 0.032665136056976816, 'max_depth': 11, 'min_samples_split': 4, 'min_samples_leaf': 20, 'subsample': 0.938150051466184, 'max_features': 'log2'}. Best is trial 0 with value: 0.3950118682496822.
[I 2025-12-03 22:44:14,742] Trial 8 finished with value: 0.3862312211730775 and parameters: {'n_estimators': 250, 'learning_rate': 0.053064159755587974, 'max_depth': 5, 'min_samples_split': 13, 'min_samples_leaf': 1, 'subsample': 0.9778076259190154, 'max_features': None}. Best is trial 0 with value: 0.3950118682496822.
[I 2025-12-03 22:45:35,707] Trial 9 finished with value: 0.35621937896961264 and parameters: {'n_estimators': 250, 'learning_rate': 0.20459401588152953, 'max_depth': 12, 'min_samples_split': 18, 'min_samples_leaf': 14, 'subsample': 0.8250520023538949, 'max_features': 'log2'}. Best is trial 0 with value: 0.3950118682496822.
[I 2025-12-03 22:45:46,085] Trial 10 finished with value: 0.37750249379863926 and parameters: {'n_estimators': 100, 'learning_rate': 0.2713337915715113, 'max_depth': 3, 'min_samples_split': 8, 'min_samples_leaf': 14, 'subsample': 0.8272737468640123, 'max_features': 'log2'}. Best is trial 0 with value: 0.3950118682496822.
[I 2025-12-03 22:50:38,239] Trial 11 finished with value: 0.39914502376174094 and parameters: {'n_estimators': 150, 'learning_rate': 0.013532539381317932, 'max_depth': 6, 'min_samples_split': 13, 'min_samples_leaf': 5, 'subsample': 0.8706231651678535, 'max_features': None}. Best is trial 11 with value: 0.39914502376174094.
[I 2025-12-03 22:51:08,996] Trial 12 finished with value: 0.3893758763329837 and parameters: {'n_estimators': 150, 'learning_rate': 0.03535277655471995, 'max_depth': 6, 'min_samples_split': 10, 'min_samples_leaf': 6, 'subsample': 0.8645287003939909, 'max_features': 'log2'}. Best is trial 11 with value: 0.39914502376174094.
[I 2025-12-03 22:57:32,014] Trial 13 finished with value: 0.39247685988488856 and parameters: {'n_estimators': 150, 'learning_rate': 0.019626243824663842, 'max_depth': 9, 'min_samples_split': 14, 'min_samples_leaf': 13, 'subsample': 0.8027861085270896, 'max_features': None}. Best is trial 11 with value: 0.39914502376174094.
[I 2025-12-03 22:58:02,282] Trial 14 finished with value: 0.37172673985991467 and parameters: {'n_estimators': 100, 'learning_rate': 0.15363710123113916, 'max_depth': 7, 'min_samples_split': 20, 'min_samples_leaf': 11, 'subsample': 0.8688971958181984, 'max_features': 'sqrt'}. Best is trial 11 with value: 0.39914502376174094.
[I 2025-12-03 23:02:12,451] Trial 15 finished with value: 0.38275589485883976 and parameters: {'n_estimators': 150, 'learning_rate': 0.058558532140336385, 'max_depth': 5, 'min_samples_split': 9, 'min_samples_leaf': 17, 'subsample': 0.8984109148036306, 'max_features': None}. Best is trial 11 with value: 0.39914502376174094.
[I 2025-12-03 23:03:04,429] Trial 16 finished with value: 0.3967341812076277 and parameters: {'n_estimators': 200, 'learning_rate': 0.010275508296967186, 'max_depth': 8, 'min_samples_split': 13, 'min_samples_leaf': 7, 'subsample': 0.8423253783259038, 'max_features': 'log2'}. Best is trial 11 with value: 0.39914502376174094.
[I 2025-12-03 23:04:39,904] Trial 17 finished with value: 0.36414283923968177 and parameters: {'n_estimators': 200, 'learning_rate': 0.07288246881083908, 'max_depth': 15, 'min_samples_split': 13, 'min_samples_leaf': 5, 'subsample': 0.8326049619940408, 'max_features': 'log2'}. Best is trial 11 with value: 0.39914502376174094.
[I 2025-12-03 23:13:31,900] Trial 18 finished with value: 0.3699965820463716 and parameters: {'n_estimators': 200, 'learning_rate': 0.15067170334911914, 'max_depth': 9, 'min_samples_split': 16, 'min_samples_leaf': 9, 'subsample': 0.8431836738612898, 'max_features': None}. Best is trial 11 with value: 0.39914502376174094.
[I 2025-12-03 23:15:10,096] Trial 19 finished with value: 0.36454541571298554 and parameters: {'n_estimators': 200, 'learning_rate': 0.07280552495128345, 'max_depth': 12, 'min_samples_split': 6, 'min_samples_leaf': 4, 'subsample': 0.8074026572990476, 'max_features': 'sqrt'}. Best is trial 11 with value: 0.39914502376174094.
[I 2025-12-03 23:15:52,146] Trial 20 finished with value: 0.3569116005837841 and parameters: {'n_estimators': 150, 'learning_rate': 0.28817563251859946, 'max_depth': 8, 'min_samples_split': 19, 'min_samples_leaf': 8, 'subsample': 0.9163422570730194, 'max_features': 'log2'}. Best is trial 11 with value: 0.39914502376174094.
[I 2025-12-03 23:16:12,077] Trial 21 finished with value: 0.397086764371851 and parameters: {'n_estimators': 100, 'learning_rate': 0.01516826837418438, 'max_depth': 6, 'min_samples_split': 12, 'min_samples_leaf': 3, 'subsample': 0.8514048971774115, 'max_features': 'log2'}. Best is trial 11 with value: 0.39914502376174094.
[I 2025-12-03 23:16:33,228] Trial 22 finished with value: 0.3909204598490488 and parameters: {'n_estimators': 150, 'learning_rate': 0.046446831094592786, 'max_depth': 4, 'min_samples_split': 13, 'min_samples_leaf': 3, 'subsample': 0.8776492406330959, 'max_features': 'log2'}. Best is trial 11 with value: 0.39914502376174094.
[I 2025-12-03 23:16:56,205] Trial 23 finished with value: 0.39576784579788216 and parameters: {'n_estimators': 100, 'learning_rate': 0.011189726720960897, 'max_depth': 7, 'min_samples_split': 12, 'min_samples_leaf': 6, 'subsample': 0.8491133353292948, 'max_features': 'log2'}. Best is trial 11 with value: 0.39914502376174094.
[I 2025-12-03 23:17:48,396] Trial 24 finished with value: 0.3760560278515909 and parameters: {'n_estimators': 200, 'learning_rate': 0.07659101870437876, 'max_depth': 8, 'min_samples_split': 15, 'min_samples_leaf': 3, 'subsample': 0.848399605301229, 'max_features': 'log2'}. Best is trial 11 with value: 0.39914502376174094.
[I 2025-12-03 23:22:19,412] Trial 25 finished with value: 0.39409669174302664 and parameters: {'n_estimators': 150, 'learning_rate': 0.013419310829777507, 'max_depth': 6, 'min_samples_split': 10, 'min_samples_leaf': 11, 'subsample': 0.8171539927860324, 'max_features': None}. Best is trial 11 with value: 0.39914502376174094.
[I 2025-12-03 23:22:33,553] Trial 26 finished with value: 0.38006523903089207 and parameters: {'n_estimators': 100, 'learning_rate': 0.12780351019134312, 'max_depth': 4, 'min_samples_split': 15, 'min_samples_leaf': 4, 'subsample': 0.885794977610135, 'max_features': 'log2'}. Best is trial 11 with value: 0.39914502376174094.
[I 2025-12-03 23:23:44,077] Trial 27 finished with value: 0.37440134252106366 and parameters: {'n_estimators': 200, 'learning_rate': 0.04852274865856356, 'max_depth': 10, 'min_samples_split': 12, 'min_samples_leaf': 7, 'subsample': 0.9161005139779779, 'max_features': 'log2'}. Best is trial 11 with value: 0.39914502376174094.
[I 2025-12-03 23:24:27,884] Trial 28 finished with value: 0.39325233071662197 and parameters: {'n_estimators': 150, 'learning_rate': 0.03340174325413442, 'max_depth': 7, 'min_samples_split': 17, 'min_samples_leaf': 2, 'subsample': 0.8384567118972232, 'max_features': 'sqrt'}. Best is trial 11 with value: 0.39914502376174094.
[I 2025-12-03 23:27:35,185] Trial 29 finished with value: 0.3848892219031038 and parameters: {'n_estimators': 100, 'learning_rate': 0.07989567052772688, 'max_depth': 6, 'min_samples_split': 11, 'min_samples_leaf': 9, 'subsample': 0.8536482596266031, 'max_features': None}. Best is trial 11 with value: 0.39914502376174094.
[I 2025-12-03 23:28:50,008] A new study created in memory with name: gradient_boosting_fold_3
[I 2025-12-03 23:29:58,670] Trial 0 finished with value: 0.35942301446869596 and parameters: {'n_estimators': 200, 'learning_rate': 0.22017536601222532, 'max_depth': 8, 'min_samples_split': 9, 'min_samples_leaf': 4, 'subsample': 0.8576124392226083, 'max_features': 'sqrt'}. Best is trial 0 with value: 0.35942301446869596.
[I 2025-12-03 23:31:53,518] Trial 1 finished with value: 0.38576527630825075 and parameters: {'n_estimators': 250, 'learning_rate': 0.012520825974842716, 'max_depth': 14, 'min_samples_split': 13, 'min_samples_leaf': 16, 'subsample': 0.9577945007732928, 'max_features': 'log2'}. Best is trial 1 with value: 0.38576527630825075.
[I 2025-12-03 23:49:16,664] Trial 2 finished with value: 0.37016748990949694 and parameters: {'n_estimators': 250, 'learning_rate': 0.04452483301375014, 'max_depth': 14, 'min_samples_split': 5, 'min_samples_leaf': 4, 'subsample': 0.8804191968798262, 'max_features': None}. Best is trial 1 with value: 0.38576527630825075.
