[I 2025-12-03 17:16:47,705] A new study created in memory with name: multi_layer_perceptron_fold_1
[I 2025-12-03 17:16:51,853] Trial 0 finished with value: 0.35177529672072133 and parameters: {'n_layers': 1, 'layer_0_size': 147, 'activation': 'tanh', 'alpha': 0.0035463162547721533, 'learning_rate': 'adaptive', 'solver': 'adam', 'learning_rate_init': 0.01595817391557692, 'max_iter': 284}. Best is trial 0 with value: 0.35177529672072133.
[I 2025-12-03 17:17:21,178] Trial 1 finished with value: 0.34470419543650826 and parameters: {'n_layers': 3, 'layer_0_size': 85, 'layer_1_size': 31, 'layer_2_size': 43, 'activation': 'tanh', 'alpha': 0.0031343503355224333, 'learning_rate': 'adaptive', 'solver': 'sgd', 'learning_rate_init': 0.010186056990084562, 'max_iter': 270}. Best is trial 0 with value: 0.35177529672072133.
[I 2025-12-03 17:21:13,896] Trial 2 finished with value: 0.3367897933309944 and parameters: {'n_layers': 2, 'layer_0_size': 121, 'layer_1_size': 32, 'activation': 'logistic', 'alpha': 1.1021264134629889e-05, 'learning_rate': 'invscaling', 'solver': 'lbfgs', 'learning_rate_init': 0.044063031541833046, 'max_iter': 283}. Best is trial 0 with value: 0.35177529672072133.
[I 2025-12-03 17:21:24,392] Trial 3 finished with value: 0.35207196934029045 and parameters: {'n_layers': 1, 'layer_0_size': 198, 'activation': 'tanh', 'alpha': 0.0016634674248413633, 'learning_rate': 'invscaling', 'solver': 'adam', 'learning_rate_init': 0.03080077126420468, 'max_iter': 750}. Best is trial 3 with value: 0.35207196934029045.
[I 2025-12-03 17:26:25,415] Trial 4 finished with value: 0.36822034848954366 and parameters: {'n_layers': 3, 'layer_0_size': 178, 'layer_1_size': 136, 'layer_2_size': 152, 'activation': 'relu', 'alpha': 0.028546462200204483, 'learning_rate': 'constant', 'solver': 'sgd', 'learning_rate_init': 0.00030705633575706716, 'max_iter': 872}. Best is trial 4 with value: 0.36822034848954366.
[I 2025-12-03 17:29:54,809] Trial 5 finished with value: 0.3413946728230086 and parameters: {'n_layers': 2, 'layer_0_size': 150, 'layer_1_size': 39, 'activation': 'logistic', 'alpha': 0.0009531712633832544, 'learning_rate': 'invscaling', 'solver': 'lbfgs', 'learning_rate_init': 0.03709002120745951, 'max_iter': 479}. Best is trial 4 with value: 0.36822034848954366.
[I 2025-12-03 17:29:58,207] Trial 6 finished with value: 0.3811199872065606 and parameters: {'n_layers': 1, 'layer_0_size': 162, 'activation': 'logistic', 'alpha': 0.014336269844376566, 'learning_rate': 'invscaling', 'solver': 'sgd', 'learning_rate_init': 0.06346251075610587, 'max_iter': 628}. Best is trial 6 with value: 0.3811199872065606.
[I 2025-12-03 17:30:04,385] Trial 7 finished with value: 0.3733145252692853 and parameters: {'n_layers': 2, 'layer_0_size': 197, 'layer_1_size': 48, 'activation': 'logistic', 'alpha': 2.29866327017592e-05, 'learning_rate': 'invscaling', 'solver': 'sgd', 'learning_rate_init': 0.060629293889689774, 'max_iter': 450}. Best is trial 6 with value: 0.3811199872065606.
[I 2025-12-03 17:30:09,462] Trial 8 finished with value: 0.38311318187333276 and parameters: {'n_layers': 1, 'layer_0_size': 71, 'activation': 'logistic', 'alpha': 0.013298520155345672, 'learning_rate': 'adaptive', 'solver': 'adam', 'learning_rate_init': 0.00023132360112412104, 'max_iter': 443}. Best is trial 8 with value: 0.38311318187333276.
[I 2025-12-03 17:30:18,620] Trial 9 finished with value: 0.3575949578533239 and parameters: {'n_layers': 3, 'layer_0_size': 39, 'layer_1_size': 83, 'layer_2_size': 55, 'activation': 'logistic', 'alpha': 0.0001540900389479553, 'learning_rate': 'adaptive', 'solver': 'sgd', 'learning_rate_init': 0.010355622490656488, 'max_iter': 956}. Best is trial 8 with value: 0.38311318187333276.
[I 2025-12-03 17:30:31,934] Trial 10 finished with value: 0.36286126620120795 and parameters: {'n_layers': 1, 'layer_0_size': 19, 'activation': 'relu', 'alpha': 0.08871680989430634, 'learning_rate': 'constant', 'solver': 'adam', 'learning_rate_init': 0.00012965173076288835, 'max_iter': 512}. Best is trial 8 with value: 0.38311318187333276.
[I 2025-12-03 17:30:57,892] Trial 11 finished with value: 0.3520420378643096 and parameters: {'n_layers': 1, 'layer_0_size': 72, 'activation': 'logistic', 'alpha': 0.0172295917658729, 'learning_rate': 'adaptive', 'solver': 'adam', 'learning_rate_init': 0.0013591406974679168, 'max_iter': 637}. Best is trial 8 with value: 0.38311318187333276.
[I 2025-12-03 17:31:03,880] Trial 12 finished with value: 0.38260242692389057 and parameters: {'n_layers': 1, 'layer_0_size': 64, 'activation': 'logistic', 'alpha': 0.013873341198641193, 'learning_rate': 'adaptive', 'solver': 'sgd', 'learning_rate_init': 0.001457958785211853, 'max_iter': 681}. Best is trial 8 with value: 0.38311318187333276.
[I 2025-12-03 17:31:31,597] Trial 13 finished with value: 0.34620362978448177 and parameters: {'n_layers': 1, 'layer_0_size': 59, 'activation': 'logistic', 'alpha': 0.0003592390625572415, 'learning_rate': 'adaptive', 'solver': 'adam', 'learning_rate_init': 0.0011834380886623118, 'max_iter': 778}. Best is trial 8 with value: 0.38311318187333276.
[I 2025-12-03 17:36:33,557] Trial 14 finished with value: 0.34743645377342247 and parameters: {'n_layers': 2, 'layer_0_size': 95, 'layer_1_size': 198, 'activation': 'logistic', 'alpha': 0.007846640969096631, 'learning_rate': 'adaptive', 'solver': 'lbfgs', 'learning_rate_init': 0.0005158886289355902, 'max_iter': 393}. Best is trial 8 with value: 0.38311318187333276.
[I 2025-12-03 17:39:31,583] Trial 15 finished with value: 0.3547708567633807 and parameters: {'n_layers': 2, 'layer_0_size': 115, 'layer_1_size': 161, 'activation': 'relu', 'alpha': 0.08319470904399426, 'learning_rate': 'adaptive', 'solver': 'sgd', 'learning_rate_init': 0.0029130814478178007, 'max_iter': 712}. Best is trial 8 with value: 0.38311318187333276.
[I 2025-12-03 17:39:34,984] Trial 16 finished with value: 0.3860110722758393 and parameters: {'n_layers': 1, 'layer_0_size': 42, 'activation': 'logistic', 'alpha': 0.03991780529579538, 'learning_rate': 'adaptive', 'solver': 'adam', 'learning_rate_init': 0.00018992524989961264, 'max_iter': 548}. Best is trial 16 with value: 0.3860110722758393.
[I 2025-12-03 17:39:37,931] Trial 17 finished with value: 0.38639520913652803 and parameters: {'n_layers': 1, 'layer_0_size': 11, 'activation': 'logistic', 'alpha': 0.05134995618782951, 'learning_rate': 'constant', 'solver': 'adam', 'learning_rate_init': 0.00013772332612089653, 'max_iter': 562}. Best is trial 17 with value: 0.38639520913652803.
[I 2025-12-03 17:39:54,810] Trial 18 finished with value: 0.3690400153325558 and parameters: {'n_layers': 1, 'layer_0_size': 19, 'activation': 'relu', 'alpha': 0.0437450602711638, 'learning_rate': 'constant', 'solver': 'adam', 'learning_rate_init': 0.00016258443418724658, 'max_iter': 539}. Best is trial 17 with value: 0.38639520913652803.
[I 2025-12-03 17:40:20,305] Trial 19 finished with value: 0.3446834494440055 and parameters: {'n_layers': 2, 'layer_0_size': 44, 'layer_1_size': 89, 'activation': 'tanh', 'alpha': 8.551421822489826e-05, 'learning_rate': 'constant', 'solver': 'adam', 'learning_rate_init': 0.0005839888375060306, 'max_iter': 561}. Best is trial 17 with value: 0.38639520913652803.
[I 2025-12-03 17:40:32,080] Trial 20 finished with value: 0.3838935792121538 and parameters: {'n_layers': 2, 'layer_0_size': 35, 'layer_1_size': 122, 'activation': 'logistic', 'alpha': 0.00529230459370686, 'learning_rate': 'constant', 'solver': 'adam', 'learning_rate_init': 0.00010366182699300005, 'max_iter': 377}. Best is trial 17 with value: 0.38639520913652803.
[I 2025-12-03 17:40:42,177] Trial 21 finished with value: 0.3850705066106886 and parameters: {'n_layers': 2, 'layer_0_size': 11, 'layer_1_size': 130, 'activation': 'logistic', 'alpha': 0.005967133121357955, 'learning_rate': 'constant', 'solver': 'adam', 'learning_rate_init': 0.00011423871066030326, 'max_iter': 364}. Best is trial 17 with value: 0.38639520913652803.
[I 2025-12-03 17:41:24,506] Trial 22 finished with value: 0.3871007833126537 and parameters: {'n_layers': 3, 'layer_0_size': 12, 'layer_1_size': 170, 'layer_2_size': 191, 'activation': 'logistic', 'alpha': 0.03940601543212651, 'learning_rate': 'constant', 'solver': 'adam', 'learning_rate_init': 0.00035838522659936505, 'max_iter': 352}. Best is trial 22 with value: 0.3871007833126537.
[I 2025-12-03 17:42:31,991] Trial 23 finished with value: 0.3879781274526198 and parameters: {'n_layers': 3, 'layer_0_size': 33, 'layer_1_size': 193, 'layer_2_size': 184, 'activation': 'logistic', 'alpha': 0.04233233359585821, 'learning_rate': 'constant', 'solver': 'adam', 'learning_rate_init': 0.00040851583302627093, 'max_iter': 574}. Best is trial 23 with value: 0.3879781274526198.
[I 2025-12-03 17:43:25,248] Trial 24 finished with value: 0.3876830174445932 and parameters: {'n_layers': 3, 'layer_0_size': 26, 'layer_1_size': 198, 'layer_2_size': 200, 'activation': 'logistic', 'alpha': 0.05011419360912104, 'learning_rate': 'constant', 'solver': 'adam', 'learning_rate_init': 0.00038644567638550855, 'max_iter': 224}. Best is trial 23 with value: 0.3879781274526198.
[I 2025-12-03 17:43:57,041] Trial 25 finished with value: 0.38886821184054376 and parameters: {'n_layers': 3, 'layer_0_size': 29, 'layer_1_size': 197, 'layer_2_size': 200, 'activation': 'logistic', 'alpha': 0.09446065919881363, 'learning_rate': 'constant', 'solver': 'adam', 'learning_rate_init': 0.0004683229394223999, 'max_iter': 203}. Best is trial 25 with value: 0.38886821184054376.
[I 2025-12-03 17:44:09,103] Trial 26 finished with value: 0.34606873170465674 and parameters: {'n_layers': 3, 'layer_0_size': 51, 'layer_1_size': 193, 'layer_2_size': 196, 'activation': 'logistic', 'alpha': 0.09920353184010762, 'learning_rate': 'constant', 'solver': 'lbfgs', 'learning_rate_init': 0.0007297538451336413, 'max_iter': 213}. Best is trial 25 with value: 0.38886821184054376.
[I 2025-12-03 17:45:52,604] Trial 27 finished with value: 0.3563895287379991 and parameters: {'n_layers': 3, 'layer_0_size': 31, 'layer_1_size': 172, 'layer_2_size': 199, 'activation': 'logistic', 'alpha': 0.022850515076747527, 'learning_rate': 'constant', 'solver': 'adam', 'learning_rate_init': 0.00405665402344751, 'max_iter': 211}. Best is trial 25 with value: 0.38886821184054376.
[I 2025-12-03 17:46:21,928] Trial 28 finished with value: 0.34681808389510727 and parameters: {'n_layers': 3, 'layer_0_size': 30, 'layer_1_size': 200, 'layer_2_size': 145, 'activation': 'relu', 'alpha': 0.0006666733025436765, 'learning_rate': 'constant', 'solver': 'adam', 'learning_rate_init': 0.0030204899314937184, 'max_iter': 307}. Best is trial 25 with value: 0.38886821184054376.
[I 2025-12-03 17:48:03,542] Trial 29 finished with value: 0.34286277935852627 and parameters: {'n_layers': 3, 'layer_0_size': 86, 'layer_1_size': 165, 'layer_2_size': 154, 'activation': 'tanh', 'alpha': 0.002578720227347507, 'learning_rate': 'constant', 'solver': 'adam', 'learning_rate_init': 0.0008803799952914126, 'max_iter': 252}. Best is trial 25 with value: 0.38886821184054376.
[I 2025-12-03 17:48:13,519] A new study created in memory with name: multi_layer_perceptron_fold_2
[I 2025-12-03 17:50:03,567] Trial 0 finished with value: 0.34084178944341315 and parameters: {'n_layers': 3, 'layer_0_size': 42, 'layer_1_size': 31, 'layer_2_size': 177, 'activation': 'tanh', 'alpha': 0.007735279386663921, 'learning_rate': 'constant', 'solver': 'sgd', 'learning_rate_init': 0.0021542401615293177, 'max_iter': 783}. Best is trial 0 with value: 0.34084178944341315.
[I 2025-12-03 17:50:22,421] Trial 1 finished with value: 0.34171724128229775 and parameters: {'n_layers': 2, 'layer_0_size': 162, 'layer_1_size': 113, 'activation': 'logistic', 'alpha': 3.051559311769784e-05, 'learning_rate': 'invscaling', 'solver': 'adam', 'learning_rate_init': 0.020864727139242662, 'max_iter': 961}. Best is trial 1 with value: 0.34171724128229775.
[I 2025-12-03 17:54:32,332] Trial 2 finished with value: 0.34117194384275595 and parameters: {'n_layers': 3, 'layer_0_size': 148, 'layer_1_size': 13, 'layer_2_size': 17, 'activation': 'tanh', 'alpha': 0.0011616375879527172, 'learning_rate': 'adaptive', 'solver': 'lbfgs', 'learning_rate_init': 0.03443576330703847, 'max_iter': 588}. Best is trial 1 with value: 0.34171724128229775.
[I 2025-12-03 17:54:33,628] Trial 3 finished with value: 0.33664827977133494 and parameters: {'n_layers': 3, 'layer_0_size': 25, 'layer_1_size': 10, 'layer_2_size': 70, 'activation': 'logistic', 'alpha': 0.004668651415765697, 'learning_rate': 'constant', 'solver': 'sgd', 'learning_rate_init': 0.004158870797967171, 'max_iter': 282}. Best is trial 1 with value: 0.34171724128229775.
[I 2025-12-03 17:54:36,417] Trial 4 finished with value: 0.3495763252848024 and parameters: {'n_layers': 1, 'layer_0_size': 60, 'activation': 'logistic', 'alpha': 3.882512429001605e-05, 'learning_rate': 'adaptive', 'solver': 'adam', 'learning_rate_init': 0.03600716223669055, 'max_iter': 773}. Best is trial 4 with value: 0.3495763252848024.
[I 2025-12-03 17:57:37,293] Trial 5 finished with value: 0.34217196969552777 and parameters: {'n_layers': 3, 'layer_0_size': 92, 'layer_1_size': 196, 'layer_2_size': 106, 'activation': 'tanh', 'alpha': 0.004753893656870992, 'learning_rate': 'invscaling', 'solver': 'lbfgs', 'learning_rate_init': 0.00045080106810269365, 'max_iter': 643}. Best is trial 4 with value: 0.3495763252848024.
[I 2025-12-03 17:58:09,872] Trial 6 finished with value: 0.35300125684313255 and parameters: {'n_layers': 2, 'layer_0_size': 76, 'layer_1_size': 21, 'activation': 'relu', 'alpha': 0.05298763170972786, 'learning_rate': 'adaptive', 'solver': 'sgd', 'learning_rate_init': 0.0029388329707955847, 'max_iter': 491}. Best is trial 6 with value: 0.35300125684313255.
[I 2025-12-03 18:02:33,281] Trial 7 finished with value: 0.3428232231859023 and parameters: {'n_layers': 3, 'layer_0_size': 43, 'layer_1_size': 111, 'layer_2_size': 93, 'activation': 'tanh', 'alpha': 0.010885039353919159, 'learning_rate': 'constant', 'solver': 'sgd', 'learning_rate_init': 0.0015008000142514729, 'max_iter': 948}. Best is trial 6 with value: 0.35300125684313255.
[I 2025-12-03 18:02:41,544] Trial 8 finished with value: 0.3694461035097795 and parameters: {'n_layers': 3, 'layer_0_size': 169, 'layer_1_size': 132, 'layer_2_size': 100, 'activation': 'tanh', 'alpha': 0.010830038102766762, 'learning_rate': 'invscaling', 'solver': 'sgd', 'learning_rate_init': 0.006623965764136711, 'max_iter': 770}. Best is trial 8 with value: 0.3694461035097795.
[I 2025-12-03 18:02:42,876] Trial 9 finished with value: 0.33923106976212647 and parameters: {'n_layers': 2, 'layer_0_size': 52, 'layer_1_size': 73, 'activation': 'logistic', 'alpha': 0.00019042080932832954, 'learning_rate': 'invscaling', 'solver': 'sgd', 'learning_rate_init': 0.0026146605225002098, 'max_iter': 483}. Best is trial 8 with value: 0.3694461035097795.
[I 2025-12-03 18:02:59,293] Trial 10 finished with value: 0.36505141181732953 and parameters: {'n_layers': 1, 'layer_0_size': 199, 'activation': 'relu', 'alpha': 0.09908845869084082, 'learning_rate': 'invscaling', 'solver': 'adam', 'learning_rate_init': 0.010480667015314759, 'max_iter': 202}. Best is trial 8 with value: 0.3694461035097795.
[I 2025-12-03 18:03:09,722] Trial 11 finished with value: 0.3696826908641659 and parameters: {'n_layers': 1, 'layer_0_size': 199, 'activation': 'relu', 'alpha': 0.09645036881916257, 'learning_rate': 'invscaling', 'solver': 'adam', 'learning_rate_init': 0.01035798214717173, 'max_iter': 242}. Best is trial 11 with value: 0.3696826908641659.
[I 2025-12-03 18:03:18,843] Trial 12 finished with value: 0.36702144326228425 and parameters: {'n_layers': 1, 'layer_0_size': 194, 'activation': 'relu', 'alpha': 0.05714137414359006, 'learning_rate': 'invscaling', 'solver': 'adam', 'learning_rate_init': 0.008520653269231399, 'max_iter': 378}. Best is trial 11 with value: 0.3696826908641659.
[I 2025-12-03 18:04:52,314] Trial 13 finished with value: 0.35569094169017246 and parameters: {'n_layers': 2, 'layer_0_size': 126, 'layer_1_size': 172, 'activation': 'relu', 'alpha': 0.031079743665926043, 'learning_rate': 'invscaling', 'solver': 'adam', 'learning_rate_init': 0.0001140611658220259, 'max_iter': 766}. Best is trial 11 with value: 0.3696826908641659.
[I 2025-12-03 18:06:25,101] Trial 14 finished with value: 0.34414408976374816 and parameters: {'n_layers': 1, 'layer_0_size': 172, 'activation': 'tanh', 'alpha': 0.001372012028113112, 'learning_rate': 'invscaling', 'solver': 'lbfgs', 'learning_rate_init': 0.0710380071791073, 'max_iter': 667}. Best is trial 11 with value: 0.3696826908641659.
[I 2025-12-03 18:06:31,629] Trial 15 finished with value: 0.3294271291377294 and parameters: {'n_layers': 2, 'layer_0_size': 123, 'layer_1_size': 142, 'activation': 'relu', 'alpha': 0.017256568101635797, 'learning_rate': 'invscaling', 'solver': 'sgd', 'learning_rate_init': 0.0006800963256479091, 'max_iter': 863}. Best is trial 11 with value: 0.3696826908641659.
[I 2025-12-03 18:06:38,394] Trial 16 finished with value: 0.35241127206000744 and parameters: {'n_layers': 1, 'layer_0_size': 176, 'activation': 'relu', 'alpha': 0.0003935281959910305, 'learning_rate': 'invscaling', 'solver': 'adam', 'learning_rate_init': 0.008312241912918935, 'max_iter': 368}. Best is trial 11 with value: 0.3696826908641659.
[I 2025-12-03 18:06:41,524] Trial 17 finished with value: 0.38301831514642626 and parameters: {'n_layers': 2, 'layer_0_size': 142, 'layer_1_size': 70, 'activation': 'tanh', 'alpha': 0.02376381621466034, 'learning_rate': 'invscaling', 'solver': 'sgd', 'learning_rate_init': 0.015354867330289554, 'max_iter': 542}. Best is trial 17 with value: 0.38301831514642626.
[I 2025-12-03 18:06:45,911] Trial 18 finished with value: 0.3592523783575167 and parameters: {'n_layers': 1, 'layer_0_size': 134, 'activation': 'relu', 'alpha': 0.0026220477555050615, 'learning_rate': 'constant', 'solver': 'adam', 'learning_rate_init': 0.01788818064670936, 'max_iter': 502}. Best is trial 17 with value: 0.38301831514642626.
[I 2025-12-03 18:08:28,664] Trial 19 finished with value: 0.345516664723445 and parameters: {'n_layers': 2, 'layer_0_size': 106, 'layer_1_size': 63, 'activation': 'tanh', 'alpha': 0.02647989991769081, 'learning_rate': 'adaptive', 'solver': 'lbfgs', 'learning_rate_init': 0.09023343277078845, 'max_iter': 366}. Best is trial 17 with value: 0.38301831514642626.
[I 2025-12-03 18:08:30,902] Trial 20 finished with value: 0.3579238908829801 and parameters: {'n_layers': 1, 'layer_0_size': 151, 'activation': 'relu', 'alpha': 0.0995252990206548, 'learning_rate': 'invscaling', 'solver': 'sgd', 'learning_rate_init': 0.015838043157024726, 'max_iter': 264}. Best is trial 17 with value: 0.38301831514642626.
[I 2025-12-03 18:08:36,068] Trial 21 finished with value: 0.37089776239801264 and parameters: {'n_layers': 3, 'layer_0_size': 182, 'layer_1_size': 83, 'layer_2_size': 167, 'activation': 'tanh', 'alpha': 0.016950896268985462, 'learning_rate': 'invscaling', 'solver': 'sgd', 'learning_rate_init': 0.005649058878068414, 'max_iter': 579}. Best is trial 17 with value: 0.38301831514642626.
[I 2025-12-03 18:08:39,337] Trial 22 finished with value: 0.37072289918230134 and parameters: {'n_layers': 2, 'layer_0_size': 187, 'layer_1_size': 72, 'activation': 'tanh', 'alpha': 0.029445380741594064, 'learning_rate': 'invscaling', 'solver': 'sgd', 'learning_rate_init': 0.00511104553456396, 'max_iter': 541}. Best is trial 17 with value: 0.38301831514642626.
[I 2025-12-03 18:09:33,296] Trial 23 finished with value: 0.35844034430364935 and parameters: {'n_layers': 2, 'layer_0_size': 182, 'layer_1_size': 73, 'activation': 'tanh', 'alpha': 0.023972223641679887, 'learning_rate': 'invscaling', 'solver': 'sgd', 'learning_rate_init': 0.001122390525077709, 'max_iter': 567}. Best is trial 17 with value: 0.38301831514642626.
[I 2025-12-03 18:09:35,681] Trial 24 finished with value: 0.36327383898856785 and parameters: {'n_layers': 2, 'layer_0_size': 149, 'layer_1_size': 51, 'activation': 'tanh', 'alpha': 0.00046022734428205866, 'learning_rate': 'invscaling', 'solver': 'sgd', 'learning_rate_init': 0.004194741451014365, 'max_iter': 683}. Best is trial 17 with value: 0.38301831514642626.
[I 2025-12-03 18:09:39,190] Trial 25 finished with value: 0.3663020364998192 and parameters: {'n_layers': 2, 'layer_0_size': 182, 'layer_1_size': 91, 'activation': 'tanh', 'alpha': 0.002610844599197461, 'learning_rate': 'invscaling', 'solver': 'sgd', 'learning_rate_init': 0.004862707196829274, 'max_iter': 428}. Best is trial 17 with value: 0.38301831514642626.
[I 2025-12-03 18:09:49,140] Trial 26 finished with value: 0.38261477956030043 and parameters: {'n_layers': 3, 'layer_0_size': 157, 'layer_1_size': 92, 'layer_2_size': 187, 'activation': 'tanh', 'alpha': 0.039255555429656364, 'learning_rate': 'invscaling', 'solver': 'sgd', 'learning_rate_init': 0.030823613157397855, 'max_iter': 542}. Best is trial 17 with value: 0.38301831514642626.
[I 2025-12-03 18:09:59,623] Trial 27 finished with value: 0.3805961742497125 and parameters: {'n_layers': 3, 'layer_0_size': 109, 'layer_1_size': 88, 'layer_2_size': 198, 'activation': 'tanh', 'alpha': 8.411782404767902e-05, 'learning_rate': 'invscaling', 'solver': 'sgd', 'learning_rate_init': 0.048851731211377585, 'max_iter': 434}. Best is trial 17 with value: 0.38301831514642626.
[I 2025-12-03 18:10:18,225] Trial 28 finished with value: 0.3492382294759843 and parameters: {'n_layers': 3, 'layer_0_size': 103, 'layer_1_size': 45, 'layer_2_size': 197, 'activation': 'tanh', 'alpha': 1.0957935008860046e-05, 'learning_rate': 'constant', 'solver': 'sgd', 'learning_rate_init': 0.039745108948697094, 'max_iter': 641}. Best is trial 17 with value: 0.38301831514642626.
