[I 2025-12-03 19:04:49,942] Trial 29 finished with value: 0.35484831987194865 and parameters: {'n_layers': 1, 'layer_0_size': 33, 'activation': 'tanh', 'alpha': 0.0014141028496256498, 'learning_rate': 'adaptive', 'solver': 'adam', 'learning_rate_init': 0.00018680971398576048, 'max_iter': 664}. Best is trial 28 with value: 0.38503459322943295.
[I 2025-12-03 19:04:53,657] A new study created in memory with name: multi_layer_perceptron_fold_5
[I 2025-12-03 19:05:13,657] Trial 0 finished with value: 0.3500282380249326 and parameters: {'n_layers': 3, 'layer_0_size': 111, 'layer_1_size': 86, 'layer_2_size': 69, 'activation': 'tanh', 'alpha': 1.4227197684917565e-05, 'learning_rate': 'constant', 'solver': 'sgd', 'learning_rate_init': 0.027575478872191892, 'max_iter': 684}. Best is trial 0 with value: 0.3500282380249326.
[I 2025-12-03 19:05:19,224] Trial 1 finished with value: 0.38671063653476195 and parameters: {'n_layers': 1, 'layer_0_size': 45, 'activation': 'tanh', 'alpha': 0.00694916060660427, 'learning_rate': 'constant', 'solver': 'sgd', 'learning_rate_init': 0.0003033216079071383, 'max_iter': 379}. Best is trial 1 with value: 0.38671063653476195.
[I 2025-12-03 19:05:28,283] Trial 2 finished with value: 0.3777937906532478 and parameters: {'n_layers': 3, 'layer_0_size': 52, 'layer_1_size': 42, 'layer_2_size': 39, 'activation': 'logistic', 'alpha': 0.014821148393508203, 'learning_rate': 'invscaling', 'solver': 'adam', 'learning_rate_init': 0.054581527920537776, 'max_iter': 439}. Best is trial 1 with value: 0.38671063653476195.
[I 2025-12-03 19:08:51,974] Trial 3 finished with value: 0.34493312284819266 and parameters: {'n_layers': 2, 'layer_0_size': 128, 'layer_1_size': 57, 'activation': 'logistic', 'alpha': 0.002714929104023932, 'learning_rate': 'adaptive', 'solver': 'lbfgs', 'learning_rate_init': 0.0641037138840909, 'max_iter': 970}. Best is trial 1 with value: 0.38671063653476195.
[I 2025-12-03 19:09:54,311] Trial 4 finished with value: 0.3465845193588548 and parameters: {'n_layers': 3, 'layer_0_size': 83, 'layer_1_size': 82, 'layer_2_size': 91, 'activation': 'tanh', 'alpha': 0.0008595935445878016, 'learning_rate': 'adaptive', 'solver': 'sgd', 'learning_rate_init': 0.004735785585075084, 'max_iter': 927}. Best is trial 1 with value: 0.38671063653476195.
[I 2025-12-03 19:11:43,551] Trial 5 finished with value: 0.3479648817118015 and parameters: {'n_layers': 1, 'layer_0_size': 193, 'activation': 'tanh', 'alpha': 0.05592820692213462, 'learning_rate': 'adaptive', 'solver': 'lbfgs', 'learning_rate_init': 0.0006415303578935225, 'max_iter': 250}. Best is trial 1 with value: 0.38671063653476195.
[I 2025-12-03 19:12:31,935] Trial 6 finished with value: 0.3571258184305577 and parameters: {'n_layers': 1, 'layer_0_size': 146, 'activation': 'tanh', 'alpha': 0.004038920630010415, 'learning_rate': 'constant', 'solver': 'sgd', 'learning_rate_init': 0.008669900995273537, 'max_iter': 748}. Best is trial 1 with value: 0.38671063653476195.
[I 2025-12-03 19:12:51,840] Trial 7 finished with value: 0.34943218906542867 and parameters: {'n_layers': 1, 'layer_0_size': 71, 'activation': 'tanh', 'alpha': 0.01171814688622435, 'learning_rate': 'adaptive', 'solver': 'lbfgs', 'learning_rate_init': 0.07232830486335531, 'max_iter': 927}. Best is trial 1 with value: 0.38671063653476195.
[I 2025-12-03 19:15:56,553] Trial 8 finished with value: 0.3550203414650973 and parameters: {'n_layers': 2, 'layer_0_size': 190, 'layer_1_size': 121, 'activation': 'relu', 'alpha': 3.4233996747258545e-05, 'learning_rate': 'invscaling', 'solver': 'lbfgs', 'learning_rate_init': 0.000581720373420583, 'max_iter': 1000}. Best is trial 1 with value: 0.38671063653476195.
[I 2025-12-03 19:17:09,474] Trial 9 finished with value: 0.3610525207502661 and parameters: {'n_layers': 2, 'layer_0_size': 172, 'layer_1_size': 96, 'activation': 'relu', 'alpha': 0.03422643391652833, 'learning_rate': 'constant', 'solver': 'sgd', 'learning_rate_init': 0.0045091614204943965, 'max_iter': 562}. Best is trial 1 with value: 0.38671063653476195.
[I 2025-12-03 19:17:16,747] Trial 10 finished with value: 0.37296363739547617 and parameters: {'n_layers': 1, 'layer_0_size': 20, 'activation': 'relu', 'alpha': 0.00026985636686122164, 'learning_rate': 'constant', 'solver': 'adam', 'learning_rate_init': 0.00012208874287638894, 'max_iter': 230}. Best is trial 1 with value: 0.38671063653476195.
[I 2025-12-03 19:17:40,981] Trial 11 finished with value: 0.3559332788792323 and parameters: {'n_layers': 3, 'layer_0_size': 31, 'layer_1_size': 12, 'layer_2_size': 14, 'activation': 'logistic', 'alpha': 0.009782793933894479, 'learning_rate': 'invscaling', 'solver': 'adam', 'learning_rate_init': 0.0006186436442886987, 'max_iter': 424}. Best is trial 1 with value: 0.38671063653476195.
[I 2025-12-03 19:19:01,040] Trial 12 finished with value: 0.3850191691268676 and parameters: {'n_layers': 2, 'layer_0_size': 54, 'layer_1_size': 193, 'activation': 'logistic', 'alpha': 0.0006707733963663702, 'learning_rate': 'invscaling', 'solver': 'adam', 'learning_rate_init': 0.0001567435973309759, 'max_iter': 412}. Best is trial 1 with value: 0.38671063653476195.
[I 2025-12-03 19:19:58,897] Trial 13 finished with value: 0.38863156457171466 and parameters: {'n_layers': 2, 'layer_0_size': 54, 'layer_1_size': 195, 'activation': 'logistic', 'alpha': 0.00022708599437207315, 'learning_rate': 'invscaling', 'solver': 'adam', 'learning_rate_init': 0.00013898579044096425, 'max_iter': 384}. Best is trial 13 with value: 0.38863156457171466.
[I 2025-12-03 19:20:02,724] Trial 14 finished with value: 0.3756738026554935 and parameters: {'n_layers': 1, 'layer_0_size': 89, 'activation': 'logistic', 'alpha': 0.0001068888531088233, 'learning_rate': 'constant', 'solver': 'sgd', 'learning_rate_init': 0.0002929067508633406, 'max_iter': 329}. Best is trial 13 with value: 0.38863156457171466.
[I 2025-12-03 19:21:08,253] Trial 15 finished with value: 0.3482327146034771 and parameters: {'n_layers': 2, 'layer_0_size': 10, 'layer_1_size': 196, 'activation': 'tanh', 'alpha': 0.00017949090810974097, 'learning_rate': 'invscaling', 'solver': 'adam', 'learning_rate_init': 0.0015221025500021077, 'max_iter': 542}. Best is trial 13 with value: 0.38863156457171466.
[I 2025-12-03 19:21:09,916] Trial 16 finished with value: 0.3368362159800162 and parameters: {'n_layers': 2, 'layer_0_size': 46, 'layer_1_size': 150, 'activation': 'logistic', 'alpha': 0.002364625473280502, 'learning_rate': 'invscaling', 'solver': 'sgd', 'learning_rate_init': 0.001721075678715507, 'max_iter': 332}. Best is trial 13 with value: 0.38863156457171466.
[I 2025-12-03 19:21:34,646] Trial 17 finished with value: 0.3785737943114319 and parameters: {'n_layers': 1, 'layer_0_size': 65, 'activation': 'logistic', 'alpha': 7.960377476195247e-05, 'learning_rate': 'constant', 'solver': 'adam', 'learning_rate_init': 0.00029581101043046947, 'max_iter': 481}. Best is trial 13 with value: 0.38863156457171466.
[I 2025-12-03 19:21:37,378] Trial 18 finished with value: 0.33662153728678096 and parameters: {'n_layers': 1, 'layer_0_size': 33, 'activation': 'tanh', 'alpha': 0.0004873144368815756, 'learning_rate': 'invscaling', 'solver': 'sgd', 'learning_rate_init': 0.00010245732195842638, 'max_iter': 665}. Best is trial 13 with value: 0.38863156457171466.
[I 2025-12-03 19:22:17,270] Trial 19 finished with value: 0.3535072021993638 and parameters: {'n_layers': 2, 'layer_0_size': 110, 'layer_1_size': 135, 'activation': 'relu', 'alpha': 0.0018956819217642975, 'learning_rate': 'constant', 'solver': 'adam', 'learning_rate_init': 0.00026233250215603637, 'max_iter': 338}. Best is trial 13 with value: 0.38863156457171466.
[I 2025-12-03 19:23:07,018] Trial 20 finished with value: 0.3442867593654191 and parameters: {'n_layers': 2, 'layer_0_size': 94, 'layer_1_size': 164, 'activation': 'logistic', 'alpha': 0.005404566296284547, 'learning_rate': 'constant', 'solver': 'adam', 'learning_rate_init': 0.001186442160932239, 'max_iter': 802}. Best is trial 13 with value: 0.38863156457171466.
[I 2025-12-03 19:24:11,812] Trial 21 finished with value: 0.38615094359600677 and parameters: {'n_layers': 2, 'layer_0_size': 55, 'layer_1_size': 196, 'activation': 'logistic', 'alpha': 0.0007641722135834479, 'learning_rate': 'invscaling', 'solver': 'adam', 'learning_rate_init': 0.0001551732194161694, 'max_iter': 403}. Best is trial 13 with value: 0.38863156457171466.
[I 2025-12-03 19:25:12,313] Trial 22 finished with value: 0.37087418316661674 and parameters: {'n_layers': 2, 'layer_0_size': 40, 'layer_1_size': 174, 'activation': 'logistic', 'alpha': 0.0011876580270122846, 'learning_rate': 'invscaling', 'solver': 'adam', 'learning_rate_init': 0.00023803918498653507, 'max_iter': 519}. Best is trial 13 with value: 0.38863156457171466.
[I 2025-12-03 19:28:34,256] Trial 23 finished with value: 0.3503291443583968 and parameters: {'n_layers': 3, 'layer_0_size': 67, 'layer_1_size': 170, 'layer_2_size': 164, 'activation': 'logistic', 'alpha': 0.00039304832704363746, 'learning_rate': 'invscaling', 'solver': 'adam', 'learning_rate_init': 0.00044332267283985486, 'max_iter': 369}. Best is trial 13 with value: 0.38863156457171466.
[I 2025-12-03 19:28:37,255] Trial 24 finished with value: 0.39017624543744855 and parameters: {'n_layers': 1, 'layer_0_size': 22, 'activation': 'logistic', 'alpha': 0.00011498248990624829, 'learning_rate': 'invscaling', 'solver': 'adam', 'learning_rate_init': 0.0001670806610690469, 'max_iter': 251}. Best is trial 24 with value: 0.39017624543744855.
[I 2025-12-03 19:28:38,864] Trial 25 finished with value: 0.34255092619515815 and parameters: {'n_layers': 1, 'layer_0_size': 20, 'activation': 'tanh', 'alpha': 4.99489025447341e-05, 'learning_rate': 'invscaling', 'solver': 'sgd', 'learning_rate_init': 0.0001030240328557044, 'max_iter': 273}. Best is trial 24 with value: 0.39017624543744855.
[I 2025-12-03 19:28:41,746] Trial 26 finished with value: 0.39230763871335117 and parameters: {'n_layers': 1, 'layer_0_size': 12, 'activation': 'logistic', 'alpha': 2.0834845230297652e-05, 'learning_rate': 'invscaling', 'solver': 'adam', 'learning_rate_init': 0.0002006162078364459, 'max_iter': 274}. Best is trial 26 with value: 0.39230763871335117.
[I 2025-12-03 19:28:49,969] Trial 27 finished with value: 0.3791788807197761 and parameters: {'n_layers': 1, 'layer_0_size': 12, 'activation': 'logistic', 'alpha': 1.281962632163764e-05, 'learning_rate': 'invscaling', 'solver': 'adam', 'learning_rate_init': 0.0009045203273101406, 'max_iter': 287}. Best is trial 26 with value: 0.39230763871335117.
[I 2025-12-03 19:28:57,727] Trial 28 finished with value: 0.3517686692638865 and parameters: {'n_layers': 1, 'layer_0_size': 32, 'activation': 'logistic', 'alpha': 2.7291823469849516e-05, 'learning_rate': 'invscaling', 'solver': 'adam', 'learning_rate_init': 0.0025510864297873543, 'max_iter': 200}. Best is trial 26 with value: 0.39230763871335117.
[I 2025-12-03 19:29:00,751] Trial 29 finished with value: 0.38985144862735865 and parameters: {'n_layers': 1, 'layer_0_size': 24, 'activation': 'logistic', 'alpha': 2.152662412248324e-05, 'learning_rate': 'invscaling', 'solver': 'adam', 'learning_rate_init': 0.00020519120088990952, 'max_iter': 292}. Best is trial 26 with value: 0.39230763871335117.
[I 2025-12-03 19:32:25,110] A new study created in memory with name: svc_fold_1
[I 2025-12-03 19:32:39,920] Trial 0 finished with value: 0.35428151456614326 and parameters: {'kernel': 'sigmoid', 'C': 9.82862319150607, 'degree': 4, 'shrinking': True}. Best is trial 0 with value: 0.35428151456614326.
[I 2025-12-03 19:32:54,801] Trial 1 finished with value: 0.3539468040324994 and parameters: {'kernel': 'sigmoid', 'C': 33.309378404746376, 'degree': 2, 'shrinking': False}. Best is trial 0 with value: 0.35428151456614326.
[I 2025-12-03 19:33:02,021] Trial 2 finished with value: 0.3493483875549745 and parameters: {'kernel': 'linear', 'C': 1.6083559777638983, 'degree': 3, 'shrinking': False}. Best is trial 0 with value: 0.35428151456614326.
[I 2025-12-03 19:33:16,899] Trial 3 finished with value: 0.3540545481049522 and parameters: {'kernel': 'sigmoid', 'C': 2.8530960235773826, 'degree': 5, 'shrinking': True}. Best is trial 0 with value: 0.35428151456614326.
[I 2025-12-03 19:33:24,741] Trial 4 finished with value: 0.3347122569393504 and parameters: {'kernel': 'linear', 'C': 0.27359323168940347, 'degree': 4, 'shrinking': True}. Best is trial 0 with value: 0.35428151456614326.
[I 2025-12-03 19:33:33,891] Trial 5 finished with value: 0.32667305798817164 and parameters: {'kernel': 'poly', 'C': 6.767933520760395, 'degree': 6, 'shrinking': False}. Best is trial 0 with value: 0.35428151456614326.
[I 2025-12-03 19:33:48,779] Trial 6 finished with value: 0.35408321313666086 and parameters: {'kernel': 'sigmoid', 'C': 0.6424700959225127, 'degree': 4, 'shrinking': True}. Best is trial 0 with value: 0.35428151456614326.
[I 2025-12-03 19:34:01,285] Trial 7 finished with value: 0.3388823957684602 and parameters: {'kernel': 'rbf', 'C': 30.668057274977347, 'degree': 4, 'shrinking': True, 'gamma': 'auto'}. Best is trial 0 with value: 0.35428151456614326.
[I 2025-12-03 19:34:16,189] Trial 8 finished with value: 0.35516102958221274 and parameters: {'kernel': 'sigmoid', 'C': 33.05445117598145, 'degree': 6, 'shrinking': True}. Best is trial 8 with value: 0.35516102958221274.
[I 2025-12-03 19:34:25,154] Trial 9 finished with value: 0.3284721178702942 and parameters: {'kernel': 'poly', 'C': 0.1945421285107796, 'degree': 2, 'shrinking': False}. Best is trial 8 with value: 0.35516102958221274.
[I 2025-12-03 19:34:37,093] Trial 10 finished with value: 0.33861613365099485 and parameters: {'kernel': 'rbf', 'C': 91.51056669583336, 'degree': 6, 'shrinking': True, 'gamma': 'scale'}. Best is trial 8 with value: 0.35516102958221274.
[I 2025-12-03 19:34:51,909] Trial 11 finished with value: 0.3543519284241403 and parameters: {'kernel': 'sigmoid', 'C': 10.61687807619705, 'degree': 5, 'shrinking': True}. Best is trial 8 with value: 0.35516102958221274.
[I 2025-12-03 19:35:06,880] Trial 12 finished with value: 0.35360288804894147 and parameters: {'kernel': 'sigmoid', 'C': 15.802790863748285, 'degree': 5, 'shrinking': True}. Best is trial 8 with value: 0.35516102958221274.
[I 2025-12-03 19:35:21,843] Trial 13 finished with value: 0.35497332989243413 and parameters: {'kernel': 'sigmoid', 'C': 85.38722399425416, 'degree': 6, 'shrinking': True}. Best is trial 8 with value: 0.35516102958221274.
[I 2025-12-03 19:35:36,818] Trial 14 finished with value: 0.35404663618637605 and parameters: {'kernel': 'sigmoid', 'C': 82.62658278071613, 'degree': 6, 'shrinking': True}. Best is trial 8 with value: 0.35516102958221274.
[I 2025-12-03 19:35:51,723] Trial 15 finished with value: 0.35369289004257287 and parameters: {'kernel': 'sigmoid', 'C': 37.7285634296572, 'degree': 6, 'shrinking': True}. Best is trial 8 with value: 0.35516102958221274.
[I 2025-12-03 19:35:58,774] Trial 16 finished with value: 0.3428310889157178 and parameters: {'kernel': 'linear', 'C': 96.69605025054871, 'degree': 5, 'shrinking': True}. Best is trial 8 with value: 0.35516102958221274.
[I 2025-12-03 19:36:07,898] Trial 17 finished with value: 0.32880436781403954 and parameters: {'kernel': 'poly', 'C': 21.889996020336877, 'degree': 6, 'shrinking': True}. Best is trial 8 with value: 0.35516102958221274.
[I 2025-12-03 19:36:20,910] Trial 18 finished with value: 0.33333432014084263 and parameters: {'kernel': 'rbf', 'C': 4.681056112518805, 'degree': 5, 'shrinking': False, 'gamma': 'scale'}. Best is trial 8 with value: 0.35516102958221274.
[I 2025-12-03 19:36:35,777] Trial 19 finished with value: 0.3536865129992201 and parameters: {'kernel': 'sigmoid', 'C': 51.06328327217214, 'degree': 6, 'shrinking': True}. Best is trial 8 with value: 0.35516102958221274.
[I 2025-12-03 19:36:50,697] Trial 20 finished with value: 0.35419383495320733 and parameters: {'kernel': 'sigmoid', 'C': 1.513571334428354, 'degree': 5, 'shrinking': True}. Best is trial 8 with value: 0.35516102958221274.
[I 2025-12-03 19:37:05,504] Trial 21 finished with value: 0.3535339419598792 and parameters: {'kernel': 'sigmoid', 'C': 12.865734010153536, 'degree': 5, 'shrinking': True}. Best is trial 8 with value: 0.35516102958221274.
[I 2025-12-03 19:37:20,342] Trial 22 finished with value: 0.35370242276184577 and parameters: {'kernel': 'sigmoid', 'C': 49.65982688490613, 'degree': 6, 'shrinking': True}. Best is trial 8 with value: 0.35516102958221274.
[I 2025-12-03 19:37:35,151] Trial 23 finished with value: 0.3533367773791291 and parameters: {'kernel': 'sigmoid', 'C': 17.37017011089406, 'degree': 5, 'shrinking': True}. Best is trial 8 with value: 0.35516102958221274.
[I 2025-12-03 19:37:50,056] Trial 24 finished with value: 0.35656042033895485 and parameters: {'kernel': 'sigmoid', 'C': 9.040831115520177, 'degree': 6, 'shrinking': True}. Best is trial 24 with value: 0.35656042033895485.
[I 2025-12-03 19:38:05,058] Trial 25 finished with value: 0.3537894636720669 and parameters: {'kernel': 'sigmoid', 'C': 4.649067886403413, 'degree': 3, 'shrinking': True}. Best is trial 24 with value: 0.35656042033895485.
[I 2025-12-03 19:38:17,194] Trial 26 finished with value: 0.3411589698232968 and parameters: {'kernel': 'rbf', 'C': 58.00518302716522, 'degree': 6, 'shrinking': False, 'gamma': 'auto'}. Best is trial 24 with value: 0.35656042033895485.
[I 2025-12-03 19:38:24,277] Trial 27 finished with value: 0.3435401643125894 and parameters: {'kernel': 'linear', 'C': 22.01548140851275, 'degree': 6, 'shrinking': True}. Best is trial 24 with value: 0.35656042033895485.
[I 2025-12-03 19:38:33,561] Trial 28 finished with value: 0.330183638030221 and parameters: {'kernel': 'poly', 'C': 7.63099982155944, 'degree': 3, 'shrinking': True}. Best is trial 24 with value: 0.35656042033895485.
[I 2025-12-03 19:38:48,395] Trial 29 finished with value: 0.353256085591005 and parameters: {'kernel': 'sigmoid', 'C': 24.94871734842955, 'degree': 6, 'shrinking': True}. Best is trial 24 with value: 0.35656042033895485.
[I 2025-12-03 19:38:54,171] A new study created in memory with name: svc_fold_2
[I 2025-12-03 19:39:02,200] Trial 0 finished with value: 0.3353017057481999 and parameters: {'kernel': 'linear', 'C': 7.64643310039911, 'degree': 2, 'shrinking': False}. Best is trial 0 with value: 0.3353017057481999.
[I 2025-12-03 19:39:16,576] Trial 1 finished with value: 0.3316651414694606 and parameters: {'kernel': 'rbf', 'C': 2.2670819769382327, 'degree': 6, 'shrinking': False, 'gamma': 'auto'}. Best is trial 0 with value: 0.3353017057481999.
[I 2025-12-03 19:39:30,508] Trial 2 finished with value: 0.32791793450994433 and parameters: {'kernel': 'rbf', 'C': 0.77204919011823, 'degree': 2, 'shrinking': True, 'gamma': 'scale'}. Best is trial 0 with value: 0.3353017057481999.
[I 2025-12-03 19:39:40,639] Trial 3 finished with value: 0.3255856761125672 and parameters: {'kernel': 'poly', 'C': 0.12937024034263778, 'degree': 5, 'shrinking': True}. Best is trial 0 with value: 0.3353017057481999.
[I 2025-12-03 19:39:48,803] Trial 4 finished with value: 0.33251531138769974 and parameters: {'kernel': 'linear', 'C': 2.9493470961706234, 'degree': 5, 'shrinking': False}. Best is trial 0 with value: 0.3353017057481999.
[I 2025-12-03 19:39:57,034] Trial 5 finished with value: 0.33168721543599833 and parameters: {'kernel': 'linear', 'C': 1.525693024081858, 'degree': 4, 'shrinking': False}. Best is trial 0 with value: 0.3353017057481999.
[I 2025-12-03 19:40:11,382] Trial 6 finished with value: 0.3386256545111991 and parameters: {'kernel': 'rbf', 'C': 21.443093454734313, 'degree': 5, 'shrinking': False, 'gamma': 'auto'}. Best is trial 6 with value: 0.3386256545111991.
[I 2025-12-03 19:40:25,023] Trial 7 finished with value: 0.32892033183545627 and parameters: {'kernel': 'rbf', 'C': 0.1922840202226285, 'degree': 3, 'shrinking': False, 'gamma': 'auto'}. Best is trial 6 with value: 0.3386256545111991.
[I 2025-12-03 19:40:39,461] Trial 8 finished with value: 0.3279979953182312 and parameters: {'kernel': 'rbf', 'C': 2.0209335992833948, 'degree': 2, 'shrinking': False, 'gamma': 'scale'}. Best is trial 6 with value: 0.3386256545111991.
[I 2025-12-03 19:40:54,566] Trial 9 finished with value: 0.3352361320308944 and parameters: {'kernel': 'rbf', 'C': 6.9674950764066885, 'degree': 3, 'shrinking': False, 'gamma': 'auto'}. Best is trial 6 with value: 0.3386256545111991.
[I 2025-12-03 19:41:10,676] Trial 10 finished with value: 0.355405035096363 and parameters: {'kernel': 'sigmoid', 'C': 99.81430742868172, 'degree': 6, 'shrinking': True}. Best is trial 10 with value: 0.355405035096363.
[I 2025-12-03 19:41:26,824] Trial 11 finished with value: 0.35501883727840033 and parameters: {'kernel': 'sigmoid', 'C': 99.58853499490525, 'degree': 6, 'shrinking': True}. Best is trial 10 with value: 0.355405035096363.
[I 2025-12-03 19:41:42,849] Trial 12 finished with value: 0.35596217032385125 and parameters: {'kernel': 'sigmoid', 'C': 60.8410365311521, 'degree': 6, 'shrinking': True}. Best is trial 12 with value: 0.35596217032385125.
[I 2025-12-03 19:41:58,814] Trial 13 finished with value: 0.3551172580718911 and parameters: {'kernel': 'sigmoid', 'C': 96.89763706957885, 'degree': 6, 'shrinking': True}. Best is trial 12 with value: 0.35596217032385125.
[I 2025-12-03 19:42:14,967] Trial 14 finished with value: 0.3560079509885265 and parameters: {'kernel': 'sigmoid', 'C': 33.47601477830864, 'degree': 6, 'shrinking': True}. Best is trial 14 with value: 0.3560079509885265.
[I 2025-12-03 19:42:30,905] Trial 15 finished with value: 0.35497250338063235 and parameters: {'kernel': 'sigmoid', 'C': 29.333513346674895, 'degree': 5, 'shrinking': True}. Best is trial 14 with value: 0.3560079509885265.
[I 2025-12-03 19:42:46,888] Trial 16 finished with value: 0.3549365022856636 and parameters: {'kernel': 'sigmoid', 'C': 27.08044683807295, 'degree': 4, 'shrinking': True}. Best is trial 14 with value: 0.3560079509885265.
