[I 2025-12-03 18:11:05,932] Trial 29 finished with value: 0.3487131099245796 and parameters: {'n_layers': 3, 'layer_0_size': 113, 'layer_1_size': 98, 'layer_2_size': 150, 'activation': 'tanh', 'alpha': 9.734255296690282e-05, 'learning_rate': 'adaptive', 'solver': 'sgd', 'learning_rate_init': 0.06800807598755451, 'max_iter': 416}. Best is trial 17 with value: 0.38301831514642626.
[I 2025-12-03 18:11:07,920] A new study created in memory with name: multi_layer_perceptron_fold_3
[I 2025-12-03 18:12:45,409] Trial 0 finished with value: 0.3480996801692884 and parameters: {'n_layers': 1, 'layer_0_size': 169, 'activation': 'tanh', 'alpha': 1.1596836010385997e-05, 'learning_rate': 'adaptive', 'solver': 'lbfgs', 'learning_rate_init': 0.00013303264453249904, 'max_iter': 243}. Best is trial 0 with value: 0.3480996801692884.
[I 2025-12-03 18:13:19,259] Trial 1 finished with value: 0.350487025580733 and parameters: {'n_layers': 1, 'layer_0_size': 139, 'activation': 'logistic', 'alpha': 0.005145936510379393, 'learning_rate': 'invscaling', 'solver': 'adam', 'learning_rate_init': 0.0012060370263093456, 'max_iter': 569}. Best is trial 1 with value: 0.350487025580733.
[I 2025-12-03 18:13:35,321] Trial 2 finished with value: 0.3442653276186943 and parameters: {'n_layers': 3, 'layer_0_size': 53, 'layer_1_size': 138, 'layer_2_size': 163, 'activation': 'relu', 'alpha': 2.3477753016298695e-05, 'learning_rate': 'invscaling', 'solver': 'adam', 'learning_rate_init': 0.01205568248600745, 'max_iter': 996}. Best is trial 1 with value: 0.350487025580733.
[I 2025-12-03 18:13:39,923] Trial 3 finished with value: 0.37259196698615094 and parameters: {'n_layers': 3, 'layer_0_size': 163, 'layer_1_size': 124, 'layer_2_size': 82, 'activation': 'tanh', 'alpha': 9.731375731870439e-05, 'learning_rate': 'invscaling', 'solver': 'sgd', 'learning_rate_init': 0.004179338235070462, 'max_iter': 968}. Best is trial 3 with value: 0.37259196698615094.
[I 2025-12-03 18:15:07,894] Trial 4 finished with value: 0.35074282280213753 and parameters: {'n_layers': 1, 'layer_0_size': 181, 'activation': 'tanh', 'alpha': 0.0017239589536250772, 'learning_rate': 'adaptive', 'solver': 'lbfgs', 'learning_rate_init': 0.08738357030676594, 'max_iter': 834}. Best is trial 3 with value: 0.37259196698615094.
[I 2025-12-03 18:15:40,279] Trial 5 finished with value: 0.3742003049668525 and parameters: {'n_layers': 1, 'layer_0_size': 161, 'activation': 'logistic', 'alpha': 0.006986502350232816, 'learning_rate': 'adaptive', 'solver': 'sgd', 'learning_rate_init': 0.021729941249393467, 'max_iter': 303}. Best is trial 5 with value: 0.3742003049668525.
[I 2025-12-03 18:15:41,347] Trial 6 finished with value: 0.33227081335534797 and parameters: {'n_layers': 1, 'layer_0_size': 43, 'activation': 'relu', 'alpha': 0.0003749055978170789, 'learning_rate': 'invscaling', 'solver': 'sgd', 'learning_rate_init': 0.0022267084796308164, 'max_iter': 897}. Best is trial 5 with value: 0.3742003049668525.
[I 2025-12-03 18:16:00,935] Trial 7 finished with value: 0.3513320608233624 and parameters: {'n_layers': 3, 'layer_0_size': 122, 'layer_1_size': 121, 'layer_2_size': 129, 'activation': 'tanh', 'alpha': 4.29855219374235e-05, 'learning_rate': 'invscaling', 'solver': 'adam', 'learning_rate_init': 0.0029784756016630405, 'max_iter': 973}. Best is trial 5 with value: 0.3742003049668525.
[I 2025-12-03 18:16:26,749] Trial 8 finished with value: 0.3490896985145017 and parameters: {'n_layers': 1, 'layer_0_size': 84, 'activation': 'relu', 'alpha': 0.005450370150367585, 'learning_rate': 'constant', 'solver': 'lbfgs', 'learning_rate_init': 0.00036375612741880404, 'max_iter': 490}. Best is trial 5 with value: 0.3742003049668525.
[I 2025-12-03 18:19:29,625] Trial 9 finished with value: 0.35729710578587714 and parameters: {'n_layers': 3, 'layer_0_size': 135, 'layer_1_size': 181, 'layer_2_size': 43, 'activation': 'relu', 'alpha': 0.020451638703687144, 'learning_rate': 'constant', 'solver': 'sgd', 'learning_rate_init': 0.001267706895881839, 'max_iter': 514}. Best is trial 5 with value: 0.3742003049668525.
[I 2025-12-03 18:19:43,465] Trial 10 finished with value: 0.3867630774199029 and parameters: {'n_layers': 2, 'layer_0_size': 88, 'layer_1_size': 17, 'activation': 'logistic', 'alpha': 0.0598929585395997, 'learning_rate': 'adaptive', 'solver': 'sgd', 'learning_rate_init': 0.044739320348196714, 'max_iter': 216}. Best is trial 10 with value: 0.3867630774199029.
[I 2025-12-03 18:19:58,491] Trial 11 finished with value: 0.38675387893324464 and parameters: {'n_layers': 2, 'layer_0_size': 92, 'layer_1_size': 19, 'activation': 'logistic', 'alpha': 0.0793258183950967, 'learning_rate': 'adaptive', 'solver': 'sgd', 'learning_rate_init': 0.05444611957681946, 'max_iter': 212}. Best is trial 10 with value: 0.3867630774199029.
[I 2025-12-03 18:20:11,447] Trial 12 finished with value: 0.38553704095456715 and parameters: {'n_layers': 2, 'layer_0_size': 86, 'layer_1_size': 17, 'activation': 'logistic', 'alpha': 0.08455034071917977, 'learning_rate': 'adaptive', 'solver': 'sgd', 'learning_rate_init': 0.08684216279696025, 'max_iter': 363}. Best is trial 10 with value: 0.3867630774199029.
[I 2025-12-03 18:20:24,868] Trial 13 finished with value: 0.38533768367840177 and parameters: {'n_layers': 2, 'layer_0_size': 85, 'layer_1_size': 11, 'activation': 'logistic', 'alpha': 0.07611952307205265, 'learning_rate': 'adaptive', 'solver': 'sgd', 'learning_rate_init': 0.022869368603209806, 'max_iter': 217}. Best is trial 10 with value: 0.3867630774199029.
[I 2025-12-03 18:20:53,454] Trial 14 finished with value: 0.3588428201489561 and parameters: {'n_layers': 2, 'layer_0_size': 17, 'layer_1_size': 57, 'activation': 'logistic', 'alpha': 0.038907400271782376, 'learning_rate': 'adaptive', 'solver': 'sgd', 'learning_rate_init': 0.03731146812399818, 'max_iter': 719}. Best is trial 10 with value: 0.3867630774199029.
[I 2025-12-03 18:21:14,869] Trial 15 finished with value: 0.3845398512294658 and parameters: {'n_layers': 2, 'layer_0_size': 104, 'layer_1_size': 58, 'activation': 'logistic', 'alpha': 0.01867441662803997, 'learning_rate': 'adaptive', 'solver': 'sgd', 'learning_rate_init': 0.010122529252544192, 'max_iter': 389}. Best is trial 10 with value: 0.3867630774199029.
[I 2025-12-03 18:21:48,185] Trial 16 finished with value: 0.34936879113515257 and parameters: {'n_layers': 2, 'layer_0_size': 60, 'layer_1_size': 60, 'activation': 'logistic', 'alpha': 0.0006654667682879545, 'learning_rate': 'adaptive', 'solver': 'sgd', 'learning_rate_init': 0.042838590304884246, 'max_iter': 422}. Best is trial 10 with value: 0.3867630774199029.
[I 2025-12-03 18:21:57,128] Trial 17 finished with value: 0.3813946276172296 and parameters: {'n_layers': 2, 'layer_0_size': 107, 'layer_1_size': 37, 'activation': 'logistic', 'alpha': 0.01846875564458594, 'learning_rate': 'constant', 'solver': 'sgd', 'learning_rate_init': 0.008229395857456792, 'max_iter': 684}. Best is trial 10 with value: 0.3867630774199029.
[I 2025-12-03 18:22:59,720] Trial 18 finished with value: 0.34072334059769344 and parameters: {'n_layers': 2, 'layer_0_size': 25, 'layer_1_size': 90, 'activation': 'logistic', 'alpha': 0.0014989274679375888, 'learning_rate': 'adaptive', 'solver': 'lbfgs', 'learning_rate_init': 0.09967392573592443, 'max_iter': 202}. Best is trial 10 with value: 0.3867630774199029.
[I 2025-12-03 18:23:06,085] Trial 19 finished with value: 0.34296793149568794 and parameters: {'n_layers': 2, 'layer_0_size': 80, 'layer_1_size': 94, 'activation': 'logistic', 'alpha': 0.00019470218258311572, 'learning_rate': 'adaptive', 'solver': 'adam', 'learning_rate_init': 0.04230102734002854, 'max_iter': 303}. Best is trial 10 with value: 0.3867630774199029.
[I 2025-12-03 18:23:09,926] Trial 20 finished with value: 0.34030807154001097 and parameters: {'n_layers': 3, 'layer_0_size': 108, 'layer_1_size': 32, 'layer_2_size': 194, 'activation': 'logistic', 'alpha': 0.04873608486029298, 'learning_rate': 'constant', 'solver': 'sgd', 'learning_rate_init': 0.005915086149544731, 'max_iter': 297}. Best is trial 10 with value: 0.3867630774199029.
[I 2025-12-03 18:23:20,512] Trial 21 finished with value: 0.38646345659097314 and parameters: {'n_layers': 2, 'layer_0_size': 74, 'layer_1_size': 10, 'activation': 'logistic', 'alpha': 0.09749468096147834, 'learning_rate': 'adaptive', 'solver': 'sgd', 'learning_rate_init': 0.06426093966577427, 'max_iter': 386}. Best is trial 10 with value: 0.3867630774199029.
[I 2025-12-03 18:23:32,466] Trial 22 finished with value: 0.3856685022219368 and parameters: {'n_layers': 2, 'layer_0_size': 65, 'layer_1_size': 10, 'activation': 'logistic', 'alpha': 0.09270229061256993, 'learning_rate': 'adaptive', 'solver': 'sgd', 'learning_rate_init': 0.022893746125155184, 'max_iter': 447}. Best is trial 10 with value: 0.3867630774199029.
[I 2025-12-03 18:23:55,331] Trial 23 finished with value: 0.35456328665293896 and parameters: {'n_layers': 2, 'layer_0_size': 68, 'layer_1_size': 43, 'activation': 'logistic', 'alpha': 0.029009209066455693, 'learning_rate': 'adaptive', 'solver': 'sgd', 'learning_rate_init': 0.05252224399191492, 'max_iter': 306}. Best is trial 10 with value: 0.3867630774199029.
[I 2025-12-03 18:24:10,898] Trial 24 finished with value: 0.3864856911128299 and parameters: {'n_layers': 2, 'layer_0_size': 39, 'layer_1_size': 74, 'activation': 'logistic', 'alpha': 0.009115129155233567, 'learning_rate': 'adaptive', 'solver': 'sgd', 'learning_rate_init': 0.015546795469869121, 'max_iter': 351}. Best is trial 10 with value: 0.3867630774199029.
[I 2025-12-03 18:24:27,350] Trial 25 finished with value: 0.3860810261749768 and parameters: {'n_layers': 2, 'layer_0_size': 36, 'layer_1_size': 77, 'activation': 'logistic', 'alpha': 0.008047069076985868, 'learning_rate': 'adaptive', 'solver': 'sgd', 'learning_rate_init': 0.013592034271006243, 'max_iter': 260}. Best is trial 10 with value: 0.3867630774199029.
[I 2025-12-03 18:24:55,090] Trial 26 finished with value: 0.37417708106428565 and parameters: {'n_layers': 3, 'layer_0_size': 96, 'layer_1_size': 163, 'layer_2_size': 23, 'activation': 'logistic', 'alpha': 0.01057353875587938, 'learning_rate': 'adaptive', 'solver': 'sgd', 'learning_rate_init': 0.022065500868638895, 'max_iter': 355}. Best is trial 10 with value: 0.3867630774199029.
[I 2025-12-03 18:25:11,129] Trial 27 finished with value: 0.3801315041388824 and parameters: {'n_layers': 2, 'layer_0_size': 43, 'layer_1_size': 74, 'activation': 'logistic', 'alpha': 0.0034852799607031277, 'learning_rate': 'adaptive', 'solver': 'sgd', 'learning_rate_init': 0.02994109761297459, 'max_iter': 209}. Best is trial 10 with value: 0.3867630774199029.
[I 2025-12-03 18:28:49,786] Trial 28 finished with value: 0.34894388847704083 and parameters: {'n_layers': 2, 'layer_0_size': 121, 'layer_1_size': 29, 'activation': 'relu', 'alpha': 0.043168390086554646, 'learning_rate': 'adaptive', 'solver': 'lbfgs', 'learning_rate_init': 0.0158653768095445, 'max_iter': 598}. Best is trial 10 with value: 0.3867630774199029.
[I 2025-12-03 18:28:57,654] Trial 29 finished with value: 0.36850916499897535 and parameters: {'n_layers': 1, 'layer_0_size': 11, 'activation': 'tanh', 'alpha': 0.002707411513333016, 'learning_rate': 'constant', 'solver': 'adam', 'learning_rate_init': 0.0002694804408980945, 'max_iter': 261}. Best is trial 10 with value: 0.3867630774199029.
[I 2025-12-03 18:29:02,015] A new study created in memory with name: multi_layer_perceptron_fold_4
[I 2025-12-03 18:29:19,558] Trial 0 finished with value: 0.3430040732857295 and parameters: {'n_layers': 1, 'layer_0_size': 29, 'activation': 'tanh', 'alpha': 0.0012937436963288483, 'learning_rate': 'invscaling', 'solver': 'lbfgs', 'learning_rate_init': 0.0025627899422491097, 'max_iter': 659}. Best is trial 0 with value: 0.3430040732857295.
[I 2025-12-03 18:30:10,817] Trial 1 finished with value: 0.34724626411184 and parameters: {'n_layers': 1, 'layer_0_size': 138, 'activation': 'logistic', 'alpha': 0.0013887620540196566, 'learning_rate': 'adaptive', 'solver': 'lbfgs', 'learning_rate_init': 0.0004772092681444254, 'max_iter': 913}. Best is trial 1 with value: 0.34724626411184.
[I 2025-12-03 18:36:04,492] Trial 2 finished with value: 0.36628351252604235 and parameters: {'n_layers': 3, 'layer_0_size': 179, 'layer_1_size': 152, 'layer_2_size': 194, 'activation': 'relu', 'alpha': 0.0014084660622033394, 'learning_rate': 'constant', 'solver': 'sgd', 'learning_rate_init': 0.00035465252218955544, 'max_iter': 965}. Best is trial 2 with value: 0.36628351252604235.
[I 2025-12-03 18:38:44,714] Trial 3 finished with value: 0.34763200514640624 and parameters: {'n_layers': 1, 'layer_0_size': 178, 'activation': 'logistic', 'alpha': 0.0026975507168277846, 'learning_rate': 'invscaling', 'solver': 'lbfgs', 'learning_rate_init': 0.0009502417064780153, 'max_iter': 482}. Best is trial 2 with value: 0.36628351252604235.
[I 2025-12-03 18:39:12,317] Trial 4 finished with value: 0.34996201998816406 and parameters: {'n_layers': 1, 'layer_0_size': 87, 'activation': 'tanh', 'alpha': 0.01998959824588652, 'learning_rate': 'invscaling', 'solver': 'sgd', 'learning_rate_init': 0.0016474060583512057, 'max_iter': 846}. Best is trial 2 with value: 0.36628351252604235.
[I 2025-12-03 18:44:25,897] Trial 5 finished with value: 0.35107968606878825 and parameters: {'n_layers': 2, 'layer_0_size': 76, 'layer_1_size': 133, 'activation': 'logistic', 'alpha': 0.055538999340246746, 'learning_rate': 'constant', 'solver': 'lbfgs', 'learning_rate_init': 0.0007569268522771031, 'max_iter': 737}. Best is trial 2 with value: 0.36628351252604235.
[I 2025-12-03 18:46:19,954] Trial 6 finished with value: 0.3470253179826026 and parameters: {'n_layers': 2, 'layer_0_size': 174, 'layer_1_size': 82, 'activation': 'tanh', 'alpha': 1.752825429984366e-05, 'learning_rate': 'constant', 'solver': 'lbfgs', 'learning_rate_init': 0.009520762243314017, 'max_iter': 365}. Best is trial 2 with value: 0.36628351252604235.
[I 2025-12-03 18:46:47,010] Trial 7 finished with value: 0.3471845893612612 and parameters: {'n_layers': 3, 'layer_0_size': 79, 'layer_1_size': 65, 'layer_2_size': 61, 'activation': 'tanh', 'alpha': 0.016519596776967047, 'learning_rate': 'constant', 'solver': 'adam', 'learning_rate_init': 0.0003924556828094374, 'max_iter': 790}. Best is trial 2 with value: 0.36628351252604235.
[I 2025-12-03 18:46:52,429] Trial 8 finished with value: 0.3370743516993417 and parameters: {'n_layers': 3, 'layer_0_size': 123, 'layer_1_size': 104, 'layer_2_size': 129, 'activation': 'logistic', 'alpha': 2.2761975786020725e-05, 'learning_rate': 'constant', 'solver': 'sgd', 'learning_rate_init': 0.0002630715053973328, 'max_iter': 990}. Best is trial 2 with value: 0.36628351252604235.
[I 2025-12-03 18:51:33,074] Trial 9 finished with value: 0.34742918092953323 and parameters: {'n_layers': 3, 'layer_0_size': 119, 'layer_1_size': 186, 'layer_2_size': 45, 'activation': 'relu', 'alpha': 5.9826898331740084e-05, 'learning_rate': 'constant', 'solver': 'lbfgs', 'learning_rate_init': 0.0002836321555887113, 'max_iter': 362}. Best is trial 2 with value: 0.36628351252604235.
[I 2025-12-03 18:52:12,986] Trial 10 finished with value: 0.34877550217912495 and parameters: {'n_layers': 3, 'layer_0_size': 200, 'layer_1_size': 10, 'layer_2_size': 194, 'activation': 'relu', 'alpha': 0.0001885401350855259, 'learning_rate': 'adaptive', 'solver': 'sgd', 'learning_rate_init': 0.07553157504591781, 'max_iter': 206}. Best is trial 2 with value: 0.36628351252604235.
[I 2025-12-03 18:53:28,907] Trial 11 finished with value: 0.3514184315578089 and parameters: {'n_layers': 2, 'layer_0_size': 50, 'layer_1_size': 168, 'activation': 'relu', 'alpha': 0.09772688026241058, 'learning_rate': 'constant', 'solver': 'adam', 'learning_rate_init': 0.0001332287200828019, 'max_iter': 721}. Best is trial 2 with value: 0.36628351252604235.
[I 2025-12-03 18:54:08,351] Trial 12 finished with value: 0.3640630505473706 and parameters: {'n_layers': 2, 'layer_0_size': 10, 'layer_1_size': 176, 'activation': 'relu', 'alpha': 0.09197666496472902, 'learning_rate': 'constant', 'solver': 'adam', 'learning_rate_init': 0.00011290703828254241, 'max_iter': 583}. Best is trial 2 with value: 0.36628351252604235.
[I 2025-12-03 18:54:57,858] Trial 13 finished with value: 0.35848906009707726 and parameters: {'n_layers': 2, 'layer_0_size': 18, 'layer_1_size': 154, 'activation': 'relu', 'alpha': 0.0003121236129114156, 'learning_rate': 'constant', 'solver': 'adam', 'learning_rate_init': 0.00010695871220141605, 'max_iter': 561}. Best is trial 2 with value: 0.36628351252604235.
[I 2025-12-03 18:55:08,496] Trial 14 finished with value: 0.3584357627518845 and parameters: {'n_layers': 2, 'layer_0_size': 150, 'layer_1_size': 200, 'activation': 'relu', 'alpha': 0.006231404822865172, 'learning_rate': 'constant', 'solver': 'adam', 'learning_rate_init': 0.009763857829007742, 'max_iter': 553}. Best is trial 2 with value: 0.36628351252604235.
[I 2025-12-03 18:56:35,722] Trial 15 finished with value: 0.35681138834762527 and parameters: {'n_layers': 3, 'layer_0_size': 101, 'layer_1_size': 137, 'layer_2_size': 197, 'activation': 'relu', 'alpha': 0.00040401563372639626, 'learning_rate': 'adaptive', 'solver': 'sgd', 'learning_rate_init': 0.006482419722930354, 'max_iter': 452}. Best is trial 2 with value: 0.36628351252604235.
[I 2025-12-03 18:57:38,755] Trial 16 finished with value: 0.3520109457511721 and parameters: {'n_layers': 2, 'layer_0_size': 54, 'layer_1_size': 164, 'activation': 'relu', 'alpha': 0.005484917233786773, 'learning_rate': 'constant', 'solver': 'adam', 'learning_rate_init': 0.00012923408998057832, 'max_iter': 620}. Best is trial 2 with value: 0.36628351252604235.
[I 2025-12-03 18:57:59,213] Trial 17 finished with value: 0.35977191033945155 and parameters: {'n_layers': 2, 'layer_0_size': 161, 'layer_1_size': 121, 'activation': 'relu', 'alpha': 0.020221793840076736, 'learning_rate': 'constant', 'solver': 'sgd', 'learning_rate_init': 0.03735255141713674, 'max_iter': 1000}. Best is trial 2 with value: 0.36628351252604235.
[I 2025-12-03 18:58:43,726] Trial 18 finished with value: 0.34929800080399886 and parameters: {'n_layers': 3, 'layer_0_size': 56, 'layer_1_size': 177, 'layer_2_size': 126, 'activation': 'relu', 'alpha': 7.440806307280948e-05, 'learning_rate': 'adaptive', 'solver': 'adam', 'learning_rate_init': 0.00023325488701210985, 'max_iter': 869}. Best is trial 2 with value: 0.36628351252604235.
[I 2025-12-03 18:58:55,704] Trial 19 finished with value: 0.3279254082381467 and parameters: {'n_layers': 3, 'layer_0_size': 192, 'layer_1_size': 150, 'layer_2_size': 157, 'activation': 'relu', 'alpha': 0.005050523818257999, 'learning_rate': 'invscaling', 'solver': 'sgd', 'learning_rate_init': 0.0008387138094816836, 'max_iter': 661}. Best is trial 2 with value: 0.36628351252604235.
[I 2025-12-03 18:59:06,773] Trial 20 finished with value: 0.34714965704524586 and parameters: {'n_layers': 2, 'layer_0_size': 10, 'layer_1_size': 102, 'activation': 'relu', 'alpha': 0.0005841437566358502, 'learning_rate': 'constant', 'solver': 'adam', 'learning_rate_init': 0.004150462146136017, 'max_iter': 232}. Best is trial 2 with value: 0.36628351252604235.
[I 2025-12-03 18:59:28,982] Trial 21 finished with value: 0.3560456047981328 and parameters: {'n_layers': 2, 'layer_0_size': 164, 'layer_1_size': 128, 'activation': 'relu', 'alpha': 0.03362878535814055, 'learning_rate': 'constant', 'solver': 'sgd', 'learning_rate_init': 0.03939043133673041, 'max_iter': 994}. Best is trial 2 with value: 0.36628351252604235.
[I 2025-12-03 18:59:49,956] Trial 22 finished with value: 0.35800308713794665 and parameters: {'n_layers': 2, 'layer_0_size': 144, 'layer_1_size': 116, 'activation': 'relu', 'alpha': 0.013529653840912686, 'learning_rate': 'constant', 'solver': 'sgd', 'learning_rate_init': 0.025744235990041733, 'max_iter': 936}. Best is trial 2 with value: 0.36628351252604235.
[I 2025-12-03 19:00:29,604] Trial 23 finished with value: 0.3593435419032416 and parameters: {'n_layers': 2, 'layer_0_size': 171, 'layer_1_size': 197, 'activation': 'relu', 'alpha': 0.053678013329843476, 'learning_rate': 'constant', 'solver': 'sgd', 'learning_rate_init': 0.023520299569171857, 'max_iter': 817}. Best is trial 2 with value: 0.36628351252604235.
[I 2025-12-03 19:00:43,073] Trial 24 finished with value: 0.36056807591536433 and parameters: {'n_layers': 2, 'layer_0_size': 159, 'layer_1_size': 149, 'activation': 'relu', 'alpha': 0.09864620215005022, 'learning_rate': 'constant', 'solver': 'sgd', 'learning_rate_init': 0.08739813434772825, 'max_iter': 921}. Best is trial 2 with value: 0.36628351252604235.
[I 2025-12-03 19:02:24,731] Trial 25 finished with value: 0.3640053473974557 and parameters: {'n_layers': 1, 'layer_0_size': 187, 'activation': 'relu', 'alpha': 0.08858089794299791, 'learning_rate': 'constant', 'solver': 'sgd', 'learning_rate_init': 0.0017175290495007956, 'max_iter': 905}. Best is trial 2 with value: 0.36628351252604235.
[I 2025-12-03 19:03:57,883] Trial 26 finished with value: 0.35773217366395144 and parameters: {'n_layers': 1, 'layer_0_size': 189, 'activation': 'relu', 'alpha': 0.010226057177133095, 'learning_rate': 'constant', 'solver': 'sgd', 'learning_rate_init': 0.0020652245833941278, 'max_iter': 743}. Best is trial 2 with value: 0.36628351252604235.
[I 2025-12-03 19:04:09,960] Trial 27 finished with value: 0.35657900036165 and parameters: {'n_layers': 1, 'layer_0_size': 124, 'activation': 'relu', 'alpha': 0.03623097738496899, 'learning_rate': 'constant', 'solver': 'adam', 'learning_rate_init': 0.0012794219114367286, 'max_iter': 496}. Best is trial 2 with value: 0.36628351252604235.
[I 2025-12-03 19:04:22,250] Trial 28 finished with value: 0.38503459322943295 and parameters: {'n_layers': 1, 'layer_0_size': 106, 'activation': 'tanh', 'alpha': 0.0023281651044743984, 'learning_rate': 'adaptive', 'solver': 'sgd', 'learning_rate_init': 0.0005232121335747056, 'max_iter': 885}. Best is trial 28 with value: 0.38503459322943295.
