[I 2025-12-03 19:42:57,196] Trial 17 finished with value: 0.32620399420186974 and parameters: {'kernel': 'poly', 'C': 10.266677358506264, 'degree': 4, 'shrinking': True}. Best is trial 14 with value: 0.3560079509885265.
[I 2025-12-03 19:43:13,243] Trial 18 finished with value: 0.35546568512956045 and parameters: {'kernel': 'sigmoid', 'C': 46.76614593193774, 'degree': 6, 'shrinking': True}. Best is trial 14 with value: 0.3560079509885265.
[I 2025-12-03 19:43:29,277] Trial 19 finished with value: 0.3551772361416912 and parameters: {'kernel': 'sigmoid', 'C': 12.46018838180255, 'degree': 5, 'shrinking': True}. Best is trial 14 with value: 0.3560079509885265.
[I 2025-12-03 19:43:45,314] Trial 20 finished with value: 0.35510831290001593 and parameters: {'kernel': 'sigmoid', 'C': 42.74094946296981, 'degree': 6, 'shrinking': True}. Best is trial 14 with value: 0.3560079509885265.
[I 2025-12-03 19:44:01,311] Trial 21 finished with value: 0.35488294256137 and parameters: {'kernel': 'sigmoid', 'C': 51.7971718088576, 'degree': 6, 'shrinking': True}. Best is trial 14 with value: 0.3560079509885265.
[I 2025-12-03 19:44:17,312] Trial 22 finished with value: 0.3558302289021442 and parameters: {'kernel': 'sigmoid', 'C': 50.32637170497851, 'degree': 6, 'shrinking': True}. Best is trial 14 with value: 0.3560079509885265.
[I 2025-12-03 19:44:33,324] Trial 23 finished with value: 0.35581354427221035 and parameters: {'kernel': 'sigmoid', 'C': 20.058643468460964, 'degree': 5, 'shrinking': True}. Best is trial 14 with value: 0.3560079509885265.
[I 2025-12-03 19:44:43,463] Trial 24 finished with value: 0.32699142001027853 and parameters: {'kernel': 'poly', 'C': 57.53920337463477, 'degree': 6, 'shrinking': True}. Best is trial 14 with value: 0.3560079509885265.
[I 2025-12-03 19:44:59,492] Trial 25 finished with value: 0.35510513464116633 and parameters: {'kernel': 'sigmoid', 'C': 19.453567243012543, 'degree': 5, 'shrinking': True}. Best is trial 14 with value: 0.3560079509885265.
[I 2025-12-03 19:45:15,754] Trial 26 finished with value: 0.3550893653107316 and parameters: {'kernel': 'sigmoid', 'C': 0.48407366390239726, 'degree': 6, 'shrinking': True}. Best is trial 14 with value: 0.3560079509885265.
[I 2025-12-03 19:45:31,753] Trial 27 finished with value: 0.35510701052864946 and parameters: {'kernel': 'sigmoid', 'C': 4.815195191053261, 'degree': 3, 'shrinking': True}. Best is trial 14 with value: 0.3560079509885265.
[I 2025-12-03 19:45:47,776] Trial 28 finished with value: 0.35497319217717965 and parameters: {'kernel': 'sigmoid', 'C': 14.011329766672649, 'degree': 4, 'shrinking': True}. Best is trial 14 with value: 0.3560079509885265.
[I 2025-12-03 19:45:55,923] Trial 29 finished with value: 0.33654115019001135 and parameters: {'kernel': 'linear', 'C': 6.3894695997474535, 'degree': 6, 'shrinking': True}. Best is trial 14 with value: 0.3560079509885265.
[I 2025-12-03 19:46:01,650] A new study created in memory with name: svc_fold_3
[I 2025-12-03 19:46:09,562] Trial 0 finished with value: 0.3371997263143144 and parameters: {'kernel': 'linear', 'C': 87.51339012527417, 'degree': 5, 'shrinking': False}. Best is trial 0 with value: 0.3371997263143144.
[I 2025-12-03 19:46:25,486] Trial 1 finished with value: 0.3527633949334529 and parameters: {'kernel': 'sigmoid', 'C': 18.146794513073043, 'degree': 2, 'shrinking': True}. Best is trial 1 with value: 0.3527633949334529.
[I 2025-12-03 19:46:33,652] Trial 2 finished with value: 0.3404207588983665 and parameters: {'kernel': 'linear', 'C': 1.5528356108522288, 'degree': 6, 'shrinking': False}. Best is trial 1 with value: 0.3527633949334529.
[I 2025-12-03 19:46:42,618] Trial 3 finished with value: 0.3361588278170396 and parameters: {'kernel': 'linear', 'C': 0.24502474841516692, 'degree': 6, 'shrinking': False}. Best is trial 1 with value: 0.3527633949334529.
[I 2025-12-03 19:46:50,620] Trial 4 finished with value: 0.3400276777593827 and parameters: {'kernel': 'linear', 'C': 21.964327788472332, 'degree': 3, 'shrinking': False}. Best is trial 1 with value: 0.3527633949334529.
[I 2025-12-03 19:46:59,584] Trial 5 finished with value: 0.32863136399950366 and parameters: {'kernel': 'linear', 'C': 0.2273393396707384, 'degree': 3, 'shrinking': True}. Best is trial 1 with value: 0.3527633949334529.
[I 2025-12-03 19:47:15,406] Trial 6 finished with value: 0.35223202617554616 and parameters: {'kernel': 'sigmoid', 'C': 37.24785263316617, 'degree': 4, 'shrinking': False}. Best is trial 1 with value: 0.3527633949334529.
[I 2025-12-03 19:47:25,607] Trial 7 finished with value: 0.33615076605010835 and parameters: {'kernel': 'poly', 'C': 10.879147731145002, 'degree': 6, 'shrinking': False}. Best is trial 1 with value: 0.3527633949334529.
[I 2025-12-03 19:47:41,477] Trial 8 finished with value: 0.3522470821651561 and parameters: {'kernel': 'sigmoid', 'C': 0.9842368013740881, 'degree': 6, 'shrinking': True}. Best is trial 1 with value: 0.3527633949334529.
[I 2025-12-03 19:47:49,515] Trial 9 finished with value: 0.3350554182589867 and parameters: {'kernel': 'linear', 'C': 7.986909039754803, 'degree': 6, 'shrinking': True}. Best is trial 1 with value: 0.3527633949334529.
[I 2025-12-03 19:48:04,558] Trial 10 finished with value: 0.3335506659208106 and parameters: {'kernel': 'rbf', 'C': 3.721777423746245, 'degree': 2, 'shrinking': True, 'gamma': 'auto'}. Best is trial 1 with value: 0.3527633949334529.
[I 2025-12-03 19:48:20,563] Trial 11 finished with value: 0.3530694436403843 and parameters: {'kernel': 'sigmoid', 'C': 0.9456432990262404, 'degree': 2, 'shrinking': True}. Best is trial 11 with value: 0.3530694436403843.
[I 2025-12-03 19:48:37,036] Trial 12 finished with value: 0.35264829745313564 and parameters: {'kernel': 'sigmoid', 'C': 0.5834889693767551, 'degree': 2, 'shrinking': True}. Best is trial 11 with value: 0.3530694436403843.
[I 2025-12-03 19:48:53,375] Trial 13 finished with value: 0.35359628904786466 and parameters: {'kernel': 'sigmoid', 'C': 2.844232273170911, 'degree': 3, 'shrinking': True}. Best is trial 13 with value: 0.35359628904786466.
[I 2025-12-03 19:49:09,757] Trial 14 finished with value: 0.352313744842854 and parameters: {'kernel': 'sigmoid', 'C': 3.164558354691987, 'degree': 3, 'shrinking': True}. Best is trial 13 with value: 0.35359628904786466.
[I 2025-12-03 19:49:23,392] Trial 15 finished with value: 0.329353468680024 and parameters: {'kernel': 'rbf', 'C': 0.641110913568412, 'degree': 4, 'shrinking': True, 'gamma': 'scale'}. Best is trial 13 with value: 0.35359628904786466.
[I 2025-12-03 19:49:33,368] Trial 16 finished with value: 0.32832614171781316 and parameters: {'kernel': 'poly', 'C': 0.11913843373063379, 'degree': 3, 'shrinking': True}. Best is trial 13 with value: 0.35359628904786466.
[I 2025-12-03 19:49:49,255] Trial 17 finished with value: 0.3523904352647397 and parameters: {'kernel': 'sigmoid', 'C': 1.8134367038495405, 'degree': 2, 'shrinking': True}. Best is trial 13 with value: 0.35359628904786466.
[I 2025-12-03 19:50:05,065] Trial 18 finished with value: 0.3531732338909013 and parameters: {'kernel': 'sigmoid', 'C': 6.507263018274692, 'degree': 3, 'shrinking': True}. Best is trial 13 with value: 0.35359628904786466.
[I 2025-12-03 19:50:20,863] Trial 19 finished with value: 0.35219393125522286 and parameters: {'kernel': 'sigmoid', 'C': 4.544110333933656, 'degree': 4, 'shrinking': True}. Best is trial 13 with value: 0.35359628904786466.
[I 2025-12-03 19:50:31,685] Trial 20 finished with value: 0.3341020853647473 and parameters: {'kernel': 'poly', 'C': 5.914795049532447, 'degree': 5, 'shrinking': True}. Best is trial 13 with value: 0.35359628904786466.
[I 2025-12-03 19:50:47,454] Trial 21 finished with value: 0.3518373879929118 and parameters: {'kernel': 'sigmoid', 'C': 1.684330650766651, 'degree': 3, 'shrinking': True}. Best is trial 13 with value: 0.35359628904786466.
[I 2025-12-03 19:51:03,814] Trial 22 finished with value: 0.35299021127870833 and parameters: {'kernel': 'sigmoid', 'C': 2.4153030463330705, 'degree': 2, 'shrinking': True}. Best is trial 13 with value: 0.35359628904786466.
[I 2025-12-03 19:51:20,303] Trial 23 finished with value: 0.3527141257244596 and parameters: {'kernel': 'sigmoid', 'C': 0.84074702237055, 'degree': 3, 'shrinking': True}. Best is trial 13 with value: 0.35359628904786466.
[I 2025-12-03 19:51:33,225] Trial 24 finished with value: 0.33057636219382813 and parameters: {'kernel': 'rbf', 'C': 0.40036476307116836, 'degree': 3, 'shrinking': True, 'gamma': 'auto'}. Best is trial 13 with value: 0.35359628904786466.
[I 2025-12-03 19:51:49,522] Trial 25 finished with value: 0.3530337052122945 and parameters: {'kernel': 'sigmoid', 'C': 13.093608041493797, 'degree': 2, 'shrinking': True}. Best is trial 13 with value: 0.35359628904786466.
[I 2025-12-03 19:52:05,354] Trial 26 finished with value: 0.35214456482431394 and parameters: {'kernel': 'sigmoid', 'C': 1.1276390422559384, 'degree': 4, 'shrinking': True}. Best is trial 13 with value: 0.35359628904786466.
[I 2025-12-03 19:52:21,243] Trial 27 finished with value: 0.3531364236399355 and parameters: {'kernel': 'sigmoid', 'C': 6.0757311906975655, 'degree': 3, 'shrinking': True}. Best is trial 13 with value: 0.35359628904786466.
[I 2025-12-03 19:52:37,628] Trial 28 finished with value: 0.35242229736535846 and parameters: {'kernel': 'sigmoid', 'C': 34.22422985891011, 'degree': 4, 'shrinking': True}. Best is trial 13 with value: 0.35359628904786466.
[I 2025-12-03 19:52:52,872] Trial 29 finished with value: 0.33589698633707166 and parameters: {'kernel': 'rbf', 'C': 6.919354662185456, 'degree': 5, 'shrinking': False, 'gamma': 'scale'}. Best is trial 13 with value: 0.35359628904786466.
CLASSIFICAÇÃO DE GENES-ALVO USANDO DADOS ÔMICOS
================================================================================
Timestamp do experimento: 20251203_171647
 Usando dados da ANA:
   Features: data/UNION_features.tsv
   Labels: data/processed/UNION_labels.tsv
   Formato labels: genes, 2class (binary), 3class (multiclass)

Arquivos encontrados com sucesso!
Carregando e preparando dados...
============================================================
PREPARANDO DATASET PARA CLASSIFICAÇÃO (MULTICLASS)
============================================================
Carregando UNION_features.tsv
Features carregadas: 19602 genes x 64 features
Tipos de dados das features: {dtype('float64'): 64}
Range das features: [0.0000, 1.0000]
----------------------------------------
Carregando UNION_labels.tsv (classificação: multiclass)
Labels carregados: 19680 genes
Valores únicos em 3class: label
0.0    16727
NaN     1997
1.0      515
2.0      441
Name: count, dtype: int64
Genes with NaN dropped: 1997
Distribuição das classes:
  Classe 0 (passenger): 16727 genes
  Classe 1 (TSG): 515 genes
  Classe 2 (Oncogene): 441 genes
----------------------------------------
Alinhando features e labels
Genes comuns entre features e labels: 17676
Dataset final: 17676 genes x 64 features
Distribuição final das classes: [16727   514   435]
----------------------------------------
DATASET PREPARADO COM SUCESSO!
Shape final: X=(17676, 64), y=(17676,)
Genes: 17676
Features: 64
============================================================

CONFIGURAÇÃO DO EXPERIMENTO (OTIMIZAÇÃO):
  Modelo: Multi-Layer Perceptron
  Trials: 30
  Tipo: multiclass
  Parâmetros: Completo
  Balanceamento: none
================================================================================
EXECUTANDO MODELO: Multi-Layer Perceptron
================================================================================

Starting Nested Cross-Validation for multi_layer_perceptron...
Configuration: 5 outer folds, 30 trials per fold
Performing 80/20 holdout split...
Holdout split completed:
  - Training set: 14140 samples (80%)
  - Holdout test set: 3536 samples (20%)
Fold 1
Importâncias dos parâmetros para fold 1: {'learning_rate_init': np.float64(0.29715513213167216), 'solver': np.float64(0.24846369219437495), 'max_iter': np.float64(0.11471929936733678), 'activation': np.float64(0.10386204744622167), 'alpha': np.float64(0.08689133960206846), 'layer_0_size': np.float64(0.06718673087693042), 'n_layers': np.float64(0.06370463469244292), 'learning_rate': np.float64(0.018017123688952627)}
Saved Optuna plots to results/20251203_171647_ana_optimized_multiclass/multi_layer_perceptron/optuna_plots
Fold 2
Importâncias dos parâmetros para fold 2: {'layer_0_size': np.float64(0.36267561855262426), 'max_iter': np.float64(0.17453577823791738), 'alpha': np.float64(0.130478015530013), 'learning_rate_init': np.float64(0.12843458500742078), 'learning_rate': np.float64(0.09120837221153262), 'activation': np.float64(0.05956692487391178), 'solver': np.float64(0.03446294924913377), 'n_layers': np.float64(0.01863775633744643)}
Saved Optuna plots to results/20251203_171647_ana_optimized_multiclass/multi_layer_perceptron/optuna_plots
Fold 3
Importâncias dos parâmetros para fold 3: {'alpha': np.float64(0.36031591334301977), 'solver': np.float64(0.17630674793414064), 'layer_0_size': np.float64(0.16438020831474637), 'max_iter': np.float64(0.12227808102613985), 'learning_rate_init': np.float64(0.10237343075086286), 'learning_rate': np.float64(0.041058699931283235), 'activation': np.float64(0.022424720876094286), 'n_layers': np.float64(0.010862197823713279)}
Saved Optuna plots to results/20251203_171647_ana_optimized_multiclass/multi_layer_perceptron/optuna_plots
Fold 4
Importâncias dos parâmetros para fold 4: {'learning_rate': np.float64(0.2663416654242357), 'layer_0_size': np.float64(0.18735509298103553), 'max_iter': np.float64(0.18157064774550682), 'activation': np.float64(0.11633804868488895), 'alpha': np.float64(0.10106227143135853), 'solver': np.float64(0.09686144646185298), 'n_layers': np.float64(0.042692737331523435), 'learning_rate_init': np.float64(0.007778089939598265)}
Saved Optuna plots to results/20251203_171647_ana_optimized_multiclass/multi_layer_perceptron/optuna_plots
Fold 5
Importâncias dos parâmetros para fold 5: {'layer_0_size': np.float64(0.22284604814352257), 'max_iter': np.float64(0.1746070224909602), 'alpha': np.float64(0.15644555705807348), 'solver': np.float64(0.1198691033729383), 'learning_rate': np.float64(0.10887459371245542), 'activation': np.float64(0.10516807291358506), 'learning_rate_init': np.float64(0.07522584373384116), 'n_layers': np.float64(0.036963758574623896)}
Saved Optuna plots to results/20251203_171647_ana_optimized_multiclass/multi_layer_perceptron/optuna_plots

Nested CV completed. The 20% holdout set (3536 samples) remains untouched.
This holdout set can be used for final unbiased evaluation.

Training and evaluating 5 best parameter sets on holdout data...
Testing with 4 balancing strategies: none, randomundersampler, smoteenn, tomeklinks

Evaluating fold 1 best params on holdout set...
  - Testing with balance strategy: none
  - Testing with balance strategy: randomundersampler
  - Testing with balance strategy: smoteenn
  - Testing with balance strategy: tomeklinks

Evaluating fold 2 best params on holdout set...
  - Testing with balance strategy: none
  - Testing with balance strategy: randomundersampler
  - Testing with balance strategy: smoteenn
  - Testing with balance strategy: tomeklinks

Evaluating fold 3 best params on holdout set...
  - Testing with balance strategy: none
  - Testing with balance strategy: randomundersampler
  - Testing with balance strategy: smoteenn
  - Testing with balance strategy: tomeklinks

Evaluating fold 4 best params on holdout set...
  - Testing with balance strategy: none
  - Testing with balance strategy: randomundersampler
  - Testing with balance strategy: smoteenn
  - Testing with balance strategy: tomeklinks

Evaluating fold 5 best params on holdout set...
  - Testing with balance strategy: none
  - Testing with balance strategy: randomundersampler
  - Testing with balance strategy: smoteenn
  - Testing with balance strategy: tomeklinks
Saving optimization and holdout results...
Detailed results by fold saved to: ./results/20251203_171647_ana_optimized_multiclass/multi_layer_perceptron/detailed_results_by_fold.txt
Test predictions for all folds saved to: ./results/20251203_171647_ana_optimized_multiclass/multi_layer_perceptron/metrics.json
Saving holdout results...
Holdout evaluation results saved to: ./results/20251203_171647_ana_optimized_multiclass/multi_layer_perceptron/holdout_results.txt
Saved!
[OK] Multi-Layer Perceptron executado com sucesso!

CONFIGURAÇÃO DO EXPERIMENTO (OTIMIZAÇÃO):
  Modelo: Support Vector Classifier
  Trials: 30
  Tipo: multiclass
  Parâmetros: Completo
  Balanceamento: none
================================================================================
EXECUTANDO MODELO: Support Vector Classifier
================================================================================

Starting Nested Cross-Validation for svc...
Configuration: 5 outer folds, 30 trials per fold
Performing 80/20 holdout split...
Holdout split completed:
  - Training set: 14140 samples (80%)
  - Holdout test set: 3536 samples (20%)
Fold 1
Importâncias dos parâmetros para fold 1: {'kernel': np.float64(0.9650115328217047), 'C': np.float64(0.024048294849362568), 'degree': np.float64(0.008753731752287998), 'shrinking': np.float64(0.002186440576644861)}
Saved Optuna plots to results/20251203_171647_ana_optimized_multiclass/svc/optuna_plots
Fold 2
Importâncias dos parâmetros para fold 2: {'kernel': np.float64(0.9843143483230905), 'shrinking': np.float64(0.008657955817181043), 'C': np.float64(0.005864923112519352), 'degree': np.float64(0.001162772747209027)}
Saved Optuna plots to results/20251203_171647_ana_optimized_multiclass/svc/optuna_plots
Fold 3
[I 2025-12-03 19:52:58,887] A new study created in memory with name: svc_fold_4
[I 2025-12-03 19:53:15,107] Trial 0 finished with value: 0.3541078537604491 and parameters: {'kernel': 'sigmoid', 'C': 0.1109764639934624, 'degree': 6, 'shrinking': False}. Best is trial 0 with value: 0.3541078537604491.
[I 2025-12-03 19:53:29,356] Trial 1 finished with value: 0.3356016125756233 and parameters: {'kernel': 'rbf', 'C': 16.23123563315037, 'degree': 3, 'shrinking': True, 'gamma': 'auto'}. Best is trial 0 with value: 0.3541078537604491.
[I 2025-12-03 19:53:44,994] Trial 2 finished with value: 0.35320476997691225 and parameters: {'kernel': 'sigmoid', 'C': 1.9726326714141258, 'degree': 2, 'shrinking': False}. Best is trial 0 with value: 0.3541078537604491.
[I 2025-12-03 19:53:55,090] Trial 3 finished with value: 0.3309539848476197 and parameters: {'kernel': 'poly', 'C': 34.36991717495639, 'degree': 4, 'shrinking': False}. Best is trial 0 with value: 0.3541078537604491.
[I 2025-12-03 19:54:02,397] Trial 4 finished with value: 0.3306481844770094 and parameters: {'kernel': 'linear', 'C': 43.77965518733962, 'degree': 4, 'shrinking': False}. Best is trial 0 with value: 0.3541078537604491.
[I 2025-12-03 19:54:15,724] Trial 5 finished with value: 0.3333298510427156 and parameters: {'kernel': 'rbf', 'C': 0.47147533376224354, 'degree': 5, 'shrinking': False, 'gamma': 'scale'}. Best is trial 0 with value: 0.3541078537604491.
[I 2025-12-03 19:54:25,925] Trial 6 finished with value: 0.3311358893161673 and parameters: {'kernel': 'poly', 'C': 14.414713303034066, 'degree': 3, 'shrinking': False}. Best is trial 0 with value: 0.3541078537604491.
[I 2025-12-03 19:54:34,026] Trial 7 finished with value: 0.3298061047958024 and parameters: {'kernel': 'linear', 'C': 0.5932346322785665, 'degree': 5, 'shrinking': False}. Best is trial 0 with value: 0.3541078537604491.
[I 2025-12-03 19:54:41,327] Trial 8 finished with value: 0.32926038858072854 and parameters: {'kernel': 'linear', 'C': 81.00373272416871, 'degree': 2, 'shrinking': True}. Best is trial 0 with value: 0.3541078537604491.
[I 2025-12-03 19:54:54,322] Trial 9 finished with value: 0.3334807451539207 and parameters: {'kernel': 'rbf', 'C': 0.12790390475596955, 'degree': 6, 'shrinking': False, 'gamma': 'scale'}. Best is trial 0 with value: 0.3541078537604491.
[I 2025-12-03 19:55:09,676] Trial 10 finished with value: 0.35325485898259457 and parameters: {'kernel': 'sigmoid', 'C': 0.20911582218430896, 'degree': 6, 'shrinking': True}. Best is trial 0 with value: 0.3541078537604491.
[I 2025-12-03 19:55:25,146] Trial 11 finished with value: 0.3542544097316126 and parameters: {'kernel': 'sigmoid', 'C': 0.10209230488119829, 'degree': 6, 'shrinking': True}. Best is trial 11 with value: 0.3542544097316126.
[I 2025-12-03 19:55:40,525] Trial 12 finished with value: 0.3536629358300315 and parameters: {'kernel': 'sigmoid', 'C': 0.10791385574103313, 'degree': 6, 'shrinking': True}. Best is trial 11 with value: 0.3542544097316126.
[I 2025-12-03 19:55:55,557] Trial 13 finished with value: 0.3537358058573986 and parameters: {'kernel': 'sigmoid', 'C': 1.800583181986653, 'degree': 5, 'shrinking': True}. Best is trial 11 with value: 0.3542544097316126.
[I 2025-12-03 19:56:10,681] Trial 14 finished with value: 0.3547779615434127 and parameters: {'kernel': 'sigmoid', 'C': 0.4167989493404079, 'degree': 6, 'shrinking': True}. Best is trial 14 with value: 0.3547779615434127.
[I 2025-12-03 19:56:25,682] Trial 15 finished with value: 0.3540775507836035 and parameters: {'kernel': 'sigmoid', 'C': 0.4509081468277972, 'degree': 5, 'shrinking': True}. Best is trial 14 with value: 0.3547779615434127.
[I 2025-12-03 19:56:41,149] Trial 16 finished with value: 0.3537016847938796 and parameters: {'kernel': 'sigmoid', 'C': 1.1800419933592081, 'degree': 6, 'shrinking': True}. Best is trial 14 with value: 0.3547779615434127.
[I 2025-12-03 19:56:57,130] Trial 17 finished with value: 0.3538332001380437 and parameters: {'kernel': 'sigmoid', 'C': 5.895552494210736, 'degree': 5, 'shrinking': True}. Best is trial 14 with value: 0.3547779615434127.
[I 2025-12-03 19:57:07,970] Trial 18 finished with value: 0.33025635463957353 and parameters: {'kernel': 'poly', 'C': 0.2615790191975173, 'degree': 4, 'shrinking': True}. Best is trial 14 with value: 0.3547779615434127.
