[I 2025-12-03 19:57:24,266] Trial 19 finished with value: 0.3543138984802668 and parameters: {'kernel': 'sigmoid', 'C': 0.8404258814329237, 'degree': 6, 'shrinking': True}. Best is trial 14 with value: 0.3547779615434127.
[I 2025-12-03 19:57:41,002] Trial 20 finished with value: 0.35347606886742367 and parameters: {'kernel': 'sigmoid', 'C': 4.539443456763958, 'degree': 4, 'shrinking': True}. Best is trial 14 with value: 0.3547779615434127.
[I 2025-12-03 19:57:57,220] Trial 21 finished with value: 0.3541406468915978 and parameters: {'kernel': 'sigmoid', 'C': 0.808767694501452, 'degree': 6, 'shrinking': True}. Best is trial 14 with value: 0.3547779615434127.
[I 2025-12-03 19:58:13,594] Trial 22 finished with value: 0.3549153293106924 and parameters: {'kernel': 'sigmoid', 'C': 0.274766376154514, 'degree': 6, 'shrinking': True}. Best is trial 22 with value: 0.3549153293106924.
[I 2025-12-03 19:58:30,031] Trial 23 finished with value: 0.35424012778385006 and parameters: {'kernel': 'sigmoid', 'C': 0.2877083496094121, 'degree': 5, 'shrinking': True}. Best is trial 22 with value: 0.3549153293106924.
[I 2025-12-03 19:58:46,268] Trial 24 finished with value: 0.353548980911251 and parameters: {'kernel': 'sigmoid', 'C': 1.0498616468096726, 'degree': 6, 'shrinking': True}. Best is trial 22 with value: 0.3549153293106924.
[I 2025-12-03 19:59:02,522] Trial 25 finished with value: 0.35332943150243995 and parameters: {'kernel': 'sigmoid', 'C': 2.252444045406619, 'degree': 5, 'shrinking': True}. Best is trial 22 with value: 0.3549153293106924.
[I 2025-12-03 19:59:16,062] Trial 26 finished with value: 0.3322958714496707 and parameters: {'kernel': 'rbf', 'C': 0.3730188398830458, 'degree': 6, 'shrinking': True, 'gamma': 'auto'}. Best is trial 22 with value: 0.3549153293106924.
[I 2025-12-03 19:59:26,796] Trial 27 finished with value: 0.32739110587766723 and parameters: {'kernel': 'poly', 'C': 0.21575485025396327, 'degree': 3, 'shrinking': True}. Best is trial 22 with value: 0.3549153293106924.
[I 2025-12-03 19:59:35,503] Trial 28 finished with value: 0.3358577730022013 and parameters: {'kernel': 'linear', 'C': 0.6971912056996079, 'degree': 5, 'shrinking': True}. Best is trial 22 with value: 0.3549153293106924.
[I 2025-12-03 19:59:52,403] Trial 29 finished with value: 0.3543759422468641 and parameters: {'kernel': 'sigmoid', 'C': 1.272074269046692, 'degree': 6, 'shrinking': True}. Best is trial 22 with value: 0.3549153293106924.
[I 2025-12-03 19:59:58,390] A new study created in memory with name: svc_fold_5
[I 2025-12-03 20:00:13,487] Trial 0 finished with value: 0.3413533773943524 and parameters: {'kernel': 'rbf', 'C': 9.094628247608483, 'degree': 2, 'shrinking': True, 'gamma': 'auto'}. Best is trial 0 with value: 0.3413533773943524.
[I 2025-12-03 20:00:29,848] Trial 1 finished with value: 0.35601467988299007 and parameters: {'kernel': 'sigmoid', 'C': 10.411373425599281, 'degree': 6, 'shrinking': True}. Best is trial 1 with value: 0.35601467988299007.
[I 2025-12-03 20:00:44,131] Trial 2 finished with value: 0.3299087456165416 and parameters: {'kernel': 'rbf', 'C': 0.18621927658932746, 'degree': 5, 'shrinking': False, 'gamma': 'auto'}. Best is trial 1 with value: 0.35601467988299007.
[I 2025-12-03 20:01:00,560] Trial 3 finished with value: 0.3552140652598459 and parameters: {'kernel': 'sigmoid', 'C': 12.992026750006906, 'degree': 3, 'shrinking': True}. Best is trial 1 with value: 0.35601467988299007.
[I 2025-12-03 20:01:16,857] Trial 4 finished with value: 0.35620476527618034 and parameters: {'kernel': 'sigmoid', 'C': 68.17597422978349, 'degree': 3, 'shrinking': True}. Best is trial 4 with value: 0.35620476527618034.
[I 2025-12-03 20:01:31,140] Trial 5 finished with value: 0.3282303630344022 and parameters: {'kernel': 'rbf', 'C': 1.299895876910199, 'degree': 2, 'shrinking': False, 'gamma': 'scale'}. Best is trial 4 with value: 0.35620476527618034.
[I 2025-12-03 20:01:45,154] Trial 6 finished with value: 0.3405750092842419 and parameters: {'kernel': 'rbf', 'C': 24.967620296431424, 'degree': 2, 'shrinking': True, 'gamma': 'auto'}. Best is trial 4 with value: 0.35620476527618034.
[I 2025-12-03 20:02:01,434] Trial 7 finished with value: 0.3553387513386559 and parameters: {'kernel': 'sigmoid', 'C': 90.1361822971107, 'degree': 2, 'shrinking': False}. Best is trial 4 with value: 0.35620476527618034.
[I 2025-12-03 20:02:17,947] Trial 8 finished with value: 0.3562506508344571 and parameters: {'kernel': 'sigmoid', 'C': 0.3002964736130433, 'degree': 3, 'shrinking': True}. Best is trial 8 with value: 0.3562506508344571.
[I 2025-12-03 20:02:31,687] Trial 9 finished with value: 0.33000071097087585 and parameters: {'kernel': 'rbf', 'C': 0.18249560883762198, 'degree': 4, 'shrinking': True, 'gamma': 'auto'}. Best is trial 8 with value: 0.3562506508344571.
[I 2025-12-03 20:02:42,201] Trial 10 finished with value: 0.33244636453918563 and parameters: {'kernel': 'poly', 'C': 1.306552138374941, 'degree': 4, 'shrinking': False}. Best is trial 8 with value: 0.3562506508344571.
[I 2025-12-03 20:02:50,529] Trial 11 finished with value: 0.32592416519620737 and parameters: {'kernel': 'linear', 'C': 0.5621021522957195, 'degree': 3, 'shrinking': True}. Best is trial 8 with value: 0.3562506508344571.
[I 2025-12-03 20:03:06,814] Trial 12 finished with value: 0.3557608093767591 and parameters: {'kernel': 'sigmoid', 'C': 83.73941925798059, 'degree': 3, 'shrinking': True}. Best is trial 8 with value: 0.3562506508344571.
[I 2025-12-03 20:03:23,151] Trial 13 finished with value: 0.3566490328699661 and parameters: {'kernel': 'sigmoid', 'C': 2.680738604852237, 'degree': 3, 'shrinking': True}. Best is trial 13 with value: 0.3566490328699661.
[I 2025-12-03 20:03:33,669] Trial 14 finished with value: 0.33242006541989233 and parameters: {'kernel': 'poly', 'C': 3.6411086909030317, 'degree': 5, 'shrinking': True}. Best is trial 13 with value: 0.3566490328699661.
[I 2025-12-03 20:03:43,808] Trial 15 finished with value: 0.32792508545590626 and parameters: {'kernel': 'linear', 'C': 0.10027178394137638, 'degree': 4, 'shrinking': True}. Best is trial 13 with value: 0.3566490328699661.
[I 2025-12-03 20:04:00,021] Trial 16 finished with value: 0.3552585360005103 and parameters: {'kernel': 'sigmoid', 'C': 0.5186503729542808, 'degree': 4, 'shrinking': True}. Best is trial 13 with value: 0.3566490328699661.
[I 2025-12-03 20:04:17,093] Trial 17 finished with value: 0.35651186429635306 and parameters: {'kernel': 'sigmoid', 'C': 3.239066366249757, 'degree': 3, 'shrinking': True}. Best is trial 13 with value: 0.3566490328699661.
[I 2025-12-03 20:04:34,010] Trial 18 finished with value: 0.35739225168127675 and parameters: {'kernel': 'sigmoid', 'C': 2.9533307266803805, 'degree': 5, 'shrinking': False}. Best is trial 18 with value: 0.35739225168127675.
[I 2025-12-03 20:04:44,539] Trial 19 finished with value: 0.3323175857275477 and parameters: {'kernel': 'poly', 'C': 1.7638729688367674, 'degree': 5, 'shrinking': False}. Best is trial 18 with value: 0.35739225168127675.
[I 2025-12-03 20:04:53,071] Trial 20 finished with value: 0.3370876432348131 and parameters: {'kernel': 'linear', 'C': 5.684819380479698, 'degree': 6, 'shrinking': False}. Best is trial 18 with value: 0.35739225168127675.
[I 2025-12-03 20:05:09,446] Trial 21 finished with value: 0.3546817841028431 and parameters: {'kernel': 'sigmoid', 'C': 2.724822994661369, 'degree': 5, 'shrinking': False}. Best is trial 18 with value: 0.35739225168127675.
[I 2025-12-03 20:05:26,424] Trial 22 finished with value: 0.35697408869394753 and parameters: {'kernel': 'sigmoid', 'C': 3.687671884242787, 'degree': 3, 'shrinking': False}. Best is trial 18 with value: 0.35739225168127675.
[I 2025-12-03 20:05:43,438] Trial 23 finished with value: 0.35556982497205214 and parameters: {'kernel': 'sigmoid', 'C': 0.7194729896040485, 'degree': 4, 'shrinking': False}. Best is trial 18 with value: 0.35739225168127675.
[I 2025-12-03 20:06:00,406] Trial 24 finished with value: 0.35594550882911224 and parameters: {'kernel': 'sigmoid', 'C': 5.529940671018481, 'degree': 4, 'shrinking': False}. Best is trial 18 with value: 0.35739225168127675.
[I 2025-12-03 20:06:17,348] Trial 25 finished with value: 0.3548197547400521 and parameters: {'kernel': 'sigmoid', 'C': 23.112563351796343, 'degree': 6, 'shrinking': False}. Best is trial 18 with value: 0.35739225168127675.
[I 2025-12-03 20:06:33,537] Trial 26 finished with value: 0.3550320885499548 and parameters: {'kernel': 'sigmoid', 'C': 1.7490128131121443, 'degree': 5, 'shrinking': False}. Best is trial 18 with value: 0.35739225168127675.
[I 2025-12-03 20:06:49,919] Trial 27 finished with value: 0.35606658214829784 and parameters: {'kernel': 'sigmoid', 'C': 4.9414627708775205, 'degree': 3, 'shrinking': False}. Best is trial 18 with value: 0.35739225168127675.
[I 2025-12-03 20:06:58,546] Trial 28 finished with value: 0.3387609433317413 and parameters: {'kernel': 'linear', 'C': 1.036457156412209, 'degree': 2, 'shrinking': False}. Best is trial 18 with value: 0.35739225168127675.
[I 2025-12-03 20:07:09,480] Trial 29 finished with value: 0.32973226255334737 and parameters: {'kernel': 'poly', 'C': 16.097380360053272, 'degree': 2, 'shrinking': False}. Best is trial 18 with value: 0.35739225168127675.
Importâncias dos parâmetros para fold 3: {'kernel': np.float64(0.9773133346376519), 'shrinking': np.float64(0.014775068597362405), 'degree': np.float64(0.004818796178990421), 'C': np.float64(0.0030928005859951935)}
Saved Optuna plots to results/20251203_171647_ana_optimized_multiclass/svc/optuna_plots
Fold 4
Importâncias dos parâmetros para fold 4: {'kernel': np.float64(0.9931195042788387), 'degree': np.float64(0.004375752323223738), 'shrinking': np.float64(0.0013261083799576514), 'C': np.float64(0.0011786350179799371)}
Saved Optuna plots to results/20251203_171647_ana_optimized_multiclass/svc/optuna_plots
Fold 5
Importâncias dos parâmetros para fold 5: {'kernel': np.float64(0.9886624545297145), 'C': np.float64(0.005857385881698423), 'degree': np.float64(0.0030384552013032018), 'shrinking': np.float64(0.002441704387283863)}
Saved Optuna plots to results/20251203_171647_ana_optimized_multiclass/svc/optuna_plots

Nested CV completed. The 20% holdout set (3536 samples) remains untouched.
This holdout set can be used for final unbiased evaluation.

Training and evaluating 5 best parameter sets on holdout data...
Testing with 4 balancing strategies: none, randomundersampler, smoteenn, tomeklinks

Evaluating fold 1 best params on holdout set...
  - Testing with balance strategy: none
  - Testing with balance strategy: randomundersampler
  - Testing with balance strategy: smoteenn
  - Testing with balance strategy: tomeklinks

Evaluating fold 2 best params on holdout set...
  - Testing with balance strategy: none
  - Testing with balance strategy: randomundersampler
  - Testing with balance strategy: smoteenn
  - Testing with balance strategy: tomeklinks

Evaluating fold 3 best params on holdout set...
  - Testing with balance strategy: none
  - Testing with balance strategy: randomundersampler
  - Testing with balance strategy: smoteenn
  - Testing with balance strategy: tomeklinks

Evaluating fold 4 best params on holdout set...
  - Testing with balance strategy: none
  - Testing with balance strategy: randomundersampler
  - Testing with balance strategy: smoteenn
  - Testing with balance strategy: tomeklinks

Evaluating fold 5 best params on holdout set...
  - Testing with balance strategy: none
  - Testing with balance strategy: randomundersampler
  - Testing with balance strategy: smoteenn
  - Testing with balance strategy: tomeklinks
Saving optimization and holdout results...
Detailed results by fold saved to: ./results/20251203_171647_ana_optimized_multiclass/svc/detailed_results_by_fold.txt
Test predictions for all folds saved to: ./results/20251203_171647_ana_optimized_multiclass/svc/metrics.json
Saving holdout results...
Holdout evaluation results saved to: ./results/20251203_171647_ana_optimized_multiclass/svc/holdout_results.txt
Saved!
[OK] Support Vector Classifier executado com sucesso!

EXPERIMENTO CONCLUÍDO!
