[I 2025-12-03 07:53:50,834] Trial 5 finished with value: 0.3394822251173505 and parameters: {'n_layers': 3, 'layer_0_size': 12, 'layer_1_size': 168, 'layer_2_size': 134, 'activation': 'logistic', 'alpha': 0.00017003045688579756, 'learning_rate': 'invscaling', 'solver': 'lbfgs', 'learning_rate_init': 0.002520153824887862, 'max_iter': 888}. Best is trial 3 with value: 0.35561154333287714.
[I 2025-12-03 08:03:04,781] Trial 6 finished with value: 0.3552141964291644 and parameters: {'n_layers': 3, 'layer_0_size': 70, 'layer_1_size': 143, 'layer_2_size': 40, 'activation': 'tanh', 'alpha': 0.0006098129635527465, 'learning_rate': 'constant', 'solver': 'adam', 'learning_rate_init': 0.002778006949953418, 'max_iter': 421}. Best is trial 3 with value: 0.35561154333287714.
[I 2025-12-03 08:09:12,162] Trial 7 finished with value: 0.35217344318171906 and parameters: {'n_layers': 1, 'layer_0_size': 147, 'activation': 'logistic', 'alpha': 0.006511493230327427, 'learning_rate': 'adaptive', 'solver': 'sgd', 'learning_rate_init': 0.029287621314008177, 'max_iter': 673}. Best is trial 3 with value: 0.35561154333287714.
[I 2025-12-03 08:09:19,312] Trial 8 finished with value: 0.3679352818897188 and parameters: {'n_layers': 1, 'layer_0_size': 21, 'activation': 'tanh', 'alpha': 3.160527230825883e-05, 'learning_rate': 'adaptive', 'solver': 'sgd', 'learning_rate_init': 0.000532187232947495, 'max_iter': 221}. Best is trial 8 with value: 0.3679352818897188.
[I 2025-12-03 08:10:17,277] Trial 9 finished with value: 0.3503356997174186 and parameters: {'n_layers': 2, 'layer_0_size': 19, 'layer_1_size': 189, 'activation': 'tanh', 'alpha': 0.00014343782310622183, 'learning_rate': 'invscaling', 'solver': 'adam', 'learning_rate_init': 0.0002824352773625486, 'max_iter': 202}. Best is trial 8 with value: 0.3679352818897188.
[I 2025-12-03 08:34:04,956] Trial 10 finished with value: 0.3848434325466289 and parameters: {'n_layers': 2, 'layer_0_size': 196, 'layer_1_size': 19, 'activation': 'tanh', 'alpha': 1.4168956739808733e-05, 'learning_rate': 'adaptive', 'solver': 'sgd', 'learning_rate_init': 0.0004933522227600856, 'max_iter': 203}. Best is trial 10 with value: 0.3848434325466289.
[I 2025-12-03 09:04:13,029] Trial 11 finished with value: 0.38129168731044166 and parameters: {'n_layers': 2, 'layer_0_size': 191, 'layer_1_size': 23, 'activation': 'tanh', 'alpha': 1.1579136885879809e-05, 'learning_rate': 'adaptive', 'solver': 'sgd', 'learning_rate_init': 0.0007117098228200452, 'max_iter': 223}. Best is trial 10 with value: 0.3848434325466289.
[I 2025-12-03 09:42:28,214] Trial 12 finished with value: 0.37900809542487224 and parameters: {'n_layers': 2, 'layer_0_size': 189, 'layer_1_size': 16, 'activation': 'tanh', 'alpha': 3.591067655280803e-05, 'learning_rate': 'adaptive', 'solver': 'sgd', 'learning_rate_init': 0.0009094089895373715, 'max_iter': 309}. Best is trial 10 with value: 0.3848434325466289.
[I 2025-12-03 09:59:48,930] Trial 13 finished with value: 0.3770923450396678 and parameters: {'n_layers': 2, 'layer_0_size': 186, 'layer_1_size': 14, 'activation': 'tanh', 'alpha': 1.1400237484721756e-05, 'learning_rate': 'adaptive', 'solver': 'sgd', 'learning_rate_init': 0.00019077037701021205, 'max_iter': 339}. Best is trial 10 with value: 0.3848434325466289.
[I 2025-12-03 10:55:07,510] Trial 14 finished with value: 0.3539226293142347 and parameters: {'n_layers': 2, 'layer_0_size': 159, 'layer_1_size': 71, 'activation': 'tanh', 'alpha': 4.339367371122871e-05, 'learning_rate': 'adaptive', 'solver': 'sgd', 'learning_rate_init': 0.005145302377411242, 'max_iter': 326}. Best is trial 10 with value: 0.3848434325466289.
