[I 2025-12-03 02:27:24,696] Trial 8 finished with value: 0.3397929175236181 and parameters: {'n_neighbors': 4, 'weights': 'uniform', 'algorithm': 'brute', 'p': 1, 'leaf_size': 21}. Best is trial 2 with value: 0.3655870910659625.
[I 2025-12-03 02:27:25,205] Trial 9 finished with value: 0.3404468014426146 and parameters: {'n_neighbors': 2, 'weights': 'distance', 'algorithm': 'auto', 'p': 1, 'leaf_size': 39}. Best is trial 2 with value: 0.3655870910659625.
[I 2025-12-03 02:27:29,313] Trial 10 finished with value: 0.36058796521060055 and parameters: {'n_neighbors': 12, 'weights': 'distance', 'algorithm': 'ball_tree', 'p': 2, 'leaf_size': 22}. Best is trial 2 with value: 0.3655870910659625.
[I 2025-12-03 02:28:06,969] Trial 11 finished with value: 0.3665900426148507 and parameters: {'n_neighbors': 20, 'weights': 'distance', 'algorithm': 'kd_tree', 'p': 2, 'leaf_size': 31}. Best is trial 11 with value: 0.3665900426148507.
[I 2025-12-03 02:28:44,697] Trial 12 finished with value: 0.3665900426148507 and parameters: {'n_neighbors': 20, 'weights': 'distance', 'algorithm': 'kd_tree', 'p': 2, 'leaf_size': 33}. Best is trial 11 with value: 0.3665900426148507.
[I 2025-12-03 02:29:21,087] Trial 13 finished with value: 0.3665900426148507 and parameters: {'n_neighbors': 20, 'weights': 'distance', 'algorithm': 'kd_tree', 'p': 2, 'leaf_size': 32}. Best is trial 11 with value: 0.3665900426148507.
[I 2025-12-03 02:29:58,247] Trial 14 finished with value: 0.3613423735679462 and parameters: {'n_neighbors': 13, 'weights': 'distance', 'algorithm': 'kd_tree', 'p': 2, 'leaf_size': 25}. Best is trial 11 with value: 0.3665900426148507.
[I 2025-12-03 02:30:34,758] Trial 15 finished with value: 0.3665900426148507 and parameters: {'n_neighbors': 20, 'weights': 'distance', 'algorithm': 'kd_tree', 'p': 2, 'leaf_size': 31}. Best is trial 11 with value: 0.3665900426148507.
[I 2025-12-03 02:31:14,541] Trial 16 finished with value: 0.3584702851435109 and parameters: {'n_neighbors': 9, 'weights': 'distance', 'algorithm': 'kd_tree', 'p': 2, 'leaf_size': 35}. Best is trial 11 with value: 0.3665900426148507.
[I 2025-12-03 02:31:53,204] Trial 17 finished with value: 0.3619270933692351 and parameters: {'n_neighbors': 14, 'weights': 'distance', 'algorithm': 'kd_tree', 'p': 2, 'leaf_size': 25}. Best is trial 11 with value: 0.3665900426148507.
[I 2025-12-03 02:31:54,723] Trial 18 finished with value: 0.36448247800769323 and parameters: {'n_neighbors': 17, 'weights': 'distance', 'algorithm': 'auto', 'p': 2, 'leaf_size': 36}. Best is trial 11 with value: 0.3665900426148507.
[I 2025-12-03 02:31:56,188] Trial 19 finished with value: 0.358974050369367 and parameters: {'n_neighbors': 11, 'weights': 'distance', 'algorithm': 'brute', 'p': 2, 'leaf_size': 30}. Best is trial 11 with value: 0.3665900426148507.
[I 2025-12-03 02:32:32,630] Trial 20 finished with value: 0.34607223929068165 and parameters: {'n_neighbors': 6, 'weights': 'distance', 'algorithm': 'kd_tree', 'p': 1, 'leaf_size': 40}. Best is trial 11 with value: 0.3665900426148507.
[I 2025-12-03 02:33:10,400] Trial 21 finished with value: 0.3665900426148507 and parameters: {'n_neighbors': 20, 'weights': 'distance', 'algorithm': 'kd_tree', 'p': 2, 'leaf_size': 32}. Best is trial 11 with value: 0.3665900426148507.
[I 2025-12-03 02:33:46,448] Trial 22 finished with value: 0.3665900426148507 and parameters: {'n_neighbors': 20, 'weights': 'distance', 'algorithm': 'kd_tree', 'p': 2, 'leaf_size': 32}. Best is trial 11 with value: 0.3665900426148507.
[I 2025-12-03 02:34:25,272] Trial 23 finished with value: 0.3655550217879947 and parameters: {'n_neighbors': 18, 'weights': 'distance', 'algorithm': 'kd_tree', 'p': 2, 'leaf_size': 34}. Best is trial 11 with value: 0.3665900426148507.
[I 2025-12-03 02:34:54,774] Trial 24 finished with value: 0.36260292878854866 and parameters: {'n_neighbors': 15, 'weights': 'distance', 'algorithm': 'kd_tree', 'p': 2, 'leaf_size': 30}. Best is trial 11 with value: 0.3665900426148507.
[I 2025-12-03 02:35:17,040] Trial 25 finished with value: 0.3655550217879947 and parameters: {'n_neighbors': 18, 'weights': 'distance', 'algorithm': 'kd_tree', 'p': 2, 'leaf_size': 26}. Best is trial 11 with value: 0.3665900426148507.
[I 2025-12-03 02:35:23,384] Trial 26 finished with value: 0.3588196444910995 and parameters: {'n_neighbors': 20, 'weights': 'uniform', 'algorithm': 'kd_tree', 'p': 2, 'leaf_size': 32}. Best is trial 11 with value: 0.3665900426148507.
[I 2025-12-03 02:35:24,495] Trial 27 finished with value: 0.3637613955095368 and parameters: {'n_neighbors': 16, 'weights': 'distance', 'algorithm': 'brute', 'p': 2, 'leaf_size': 35}. Best is trial 11 with value: 0.3665900426148507.
[I 2025-12-03 02:35:26,115] Trial 28 finished with value: 0.36558600040316774 and parameters: {'n_neighbors': 18, 'weights': 'distance', 'algorithm': 'auto', 'p': 2, 'leaf_size': 28}. Best is trial 11 with value: 0.3665900426148507.
[I 2025-12-03 02:36:07,104] Trial 29 finished with value: 0.34621994526176053 and parameters: {'n_neighbors': 7, 'weights': 'distance', 'algorithm': 'kd_tree', 'p': 1, 'leaf_size': 34}. Best is trial 11 with value: 0.3665900426148507.
[I 2025-12-03 02:38:17,733] A new study created in memory with name: k_nearest_neighbors_fold_2
[I 2025-12-03 02:38:18,683] Trial 0 finished with value: 0.3401702634610627 and parameters: {'n_neighbors': 2, 'weights': 'distance', 'algorithm': 'auto', 'p': 2, 'leaf_size': 28}. Best is trial 0 with value: 0.3401702634610627.
[I 2025-12-03 02:38:20,619] Trial 1 finished with value: 0.33865644802416883 and parameters: {'n_neighbors': 3, 'weights': 'distance', 'algorithm': 'brute', 'p': 1, 'leaf_size': 20}. Best is trial 0 with value: 0.3401702634610627.
[I 2025-12-03 02:38:22,016] Trial 2 finished with value: 0.33894887093302706 and parameters: {'n_neighbors': 5, 'weights': 'uniform', 'algorithm': 'brute', 'p': 1, 'leaf_size': 29}. Best is trial 0 with value: 0.3401702634610627.
[I 2025-12-03 02:38:56,086] Trial 3 finished with value: 0.34352554333247426 and parameters: {'n_neighbors': 3, 'weights': 'distance', 'algorithm': 'ball_tree', 'p': 2, 'leaf_size': 23}. Best is trial 3 with value: 0.34352554333247426.
[I 2025-12-03 02:39:33,165] Trial 4 finished with value: 0.343524137250254 and parameters: {'n_neighbors': 3, 'weights': 'distance', 'algorithm': 'kd_tree', 'p': 2, 'leaf_size': 28}. Best is trial 3 with value: 0.34352554333247426.
[I 2025-12-03 02:39:35,021] Trial 5 finished with value: 0.3356290310506746 and parameters: {'n_neighbors': 1, 'weights': 'distance', 'algorithm': 'brute', 'p': 1, 'leaf_size': 31}. Best is trial 3 with value: 0.34352554333247426.
[I 2025-12-03 02:39:36,446] Trial 6 finished with value: 0.34915293626456545 and parameters: {'n_neighbors': 5, 'weights': 'distance', 'algorithm': 'brute', 'p': 2, 'leaf_size': 26}. Best is trial 6 with value: 0.34915293626456545.
[I 2025-12-03 02:39:38,022] Trial 7 finished with value: 0.3425068493305488 and parameters: {'n_neighbors': 11, 'weights': 'uniform', 'algorithm': 'brute', 'p': 1, 'leaf_size': 35}. Best is trial 6 with value: 0.34915293626456545.
[I 2025-12-03 02:39:39,538] Trial 8 finished with value: 0.3567727947916645 and parameters: {'n_neighbors': 13, 'weights': 'distance', 'algorithm': 'auto', 'p': 2, 'leaf_size': 23}. Best is trial 8 with value: 0.3567727947916645.
[I 2025-12-03 02:39:41,201] Trial 9 finished with value: 0.3579351949264182 and parameters: {'n_neighbors': 14, 'weights': 'distance', 'algorithm': 'brute', 'p': 2, 'leaf_size': 30}. Best is trial 9 with value: 0.3579351949264182.
[I 2025-12-03 02:40:16,418] Trial 10 finished with value: 0.35546396764818006 and parameters: {'n_neighbors': 20, 'weights': 'uniform', 'algorithm': 'kd_tree', 'p': 2, 'leaf_size': 39}. Best is trial 9 with value: 0.3579351949264182.
[I 2025-12-03 02:40:18,002] Trial 11 finished with value: 0.3579351949264182 and parameters: {'n_neighbors': 14, 'weights': 'distance', 'algorithm': 'auto', 'p': 2, 'leaf_size': 33}. Best is trial 9 with value: 0.3579351949264182.
[I 2025-12-03 02:40:19,725] Trial 12 finished with value: 0.3593088267663024 and parameters: {'n_neighbors': 16, 'weights': 'distance', 'algorithm': 'auto', 'p': 2, 'leaf_size': 35}. Best is trial 12 with value: 0.3593088267663024.
[I 2025-12-03 02:40:56,577] Trial 13 finished with value: 0.36012029234002096 and parameters: {'n_neighbors': 19, 'weights': 'distance', 'algorithm': 'ball_tree', 'p': 2, 'leaf_size': 36}. Best is trial 13 with value: 0.36012029234002096.
[I 2025-12-03 02:41:32,437] Trial 14 finished with value: 0.3555307684497564 and parameters: {'n_neighbors': 20, 'weights': 'uniform', 'algorithm': 'ball_tree', 'p': 2, 'leaf_size': 38}. Best is trial 13 with value: 0.36012029234002096.
[I 2025-12-03 02:42:07,133] Trial 15 finished with value: 0.35902366029352367 and parameters: {'n_neighbors': 17, 'weights': 'distance', 'algorithm': 'ball_tree', 'p': 2, 'leaf_size': 36}. Best is trial 13 with value: 0.36012029234002096.
[I 2025-12-03 02:42:08,625] Trial 16 finished with value: 0.35936285410349267 and parameters: {'n_neighbors': 17, 'weights': 'distance', 'algorithm': 'auto', 'p': 2, 'leaf_size': 40}. Best is trial 13 with value: 0.36012029234002096.
[I 2025-12-03 02:42:46,795] Trial 17 finished with value: 0.35303880021618717 and parameters: {'n_neighbors': 18, 'weights': 'distance', 'algorithm': 'ball_tree', 'p': 1, 'leaf_size': 40}. Best is trial 13 with value: 0.36012029234002096.
[I 2025-12-03 02:42:48,323] Trial 18 finished with value: 0.3492647460773882 and parameters: {'n_neighbors': 8, 'weights': 'uniform', 'algorithm': 'auto', 'p': 2, 'leaf_size': 37}. Best is trial 13 with value: 0.36012029234002096.
[I 2025-12-03 02:43:26,169] Trial 19 finished with value: 0.36066671824901253 and parameters: {'n_neighbors': 18, 'weights': 'distance', 'algorithm': 'ball_tree', 'p': 2, 'leaf_size': 33}. Best is trial 19 with value: 0.36066671824901253.
[I 2025-12-03 02:43:32,563] Trial 20 finished with value: 0.3449346362186409 and parameters: {'n_neighbors': 10, 'weights': 'distance', 'algorithm': 'ball_tree', 'p': 1, 'leaf_size': 32}. Best is trial 19 with value: 0.36066671824901253.
[I 2025-12-03 02:43:36,684] Trial 21 finished with value: 0.36066671824901253 and parameters: {'n_neighbors': 18, 'weights': 'distance', 'algorithm': 'ball_tree', 'p': 2, 'leaf_size': 34}. Best is trial 19 with value: 0.36066671824901253.
[I 2025-12-03 02:43:44,910] Trial 22 finished with value: 0.36042340438562415 and parameters: {'n_neighbors': 19, 'weights': 'distance', 'algorithm': 'ball_tree', 'p': 2, 'leaf_size': 34}. Best is trial 19 with value: 0.36066671824901253.
[I 2025-12-03 02:44:12,382] Trial 23 finished with value: 0.359312208486838 and parameters: {'n_neighbors': 16, 'weights': 'distance', 'algorithm': 'ball_tree', 'p': 2, 'leaf_size': 33}. Best is trial 19 with value: 0.36066671824901253.
[I 2025-12-03 02:44:40,542] Trial 24 finished with value: 0.35852065653633003 and parameters: {'n_neighbors': 15, 'weights': 'distance', 'algorithm': 'ball_tree', 'p': 2, 'leaf_size': 34}. Best is trial 19 with value: 0.36066671824901253.
[I 2025-12-03 02:45:09,738] Trial 25 finished with value: 0.36066671824901253 and parameters: {'n_neighbors': 18, 'weights': 'distance', 'algorithm': 'ball_tree', 'p': 2, 'leaf_size': 32}. Best is trial 19 with value: 0.36066671824901253.
[I 2025-12-03 02:45:37,760] Trial 26 finished with value: 0.35163835695124157 and parameters: {'n_neighbors': 12, 'weights': 'uniform', 'algorithm': 'ball_tree', 'p': 2, 'leaf_size': 31}. Best is trial 19 with value: 0.36066671824901253.
[I 2025-12-03 02:46:10,822] Trial 27 finished with value: 0.36069501688321054 and parameters: {'n_neighbors': 18, 'weights': 'distance', 'algorithm': 'kd_tree', 'p': 2, 'leaf_size': 26}. Best is trial 27 with value: 0.36069501688321054.
[I 2025-12-03 02:46:42,872] Trial 28 finished with value: 0.35856685061724186 and parameters: {'n_neighbors': 15, 'weights': 'distance', 'algorithm': 'kd_tree', 'p': 2, 'leaf_size': 26}. Best is trial 27 with value: 0.36069501688321054.
[I 2025-12-03 02:47:15,023] Trial 29 finished with value: 0.35562920402224873 and parameters: {'n_neighbors': 9, 'weights': 'distance', 'algorithm': 'kd_tree', 'p': 2, 'leaf_size': 27}. Best is trial 27 with value: 0.36069501688321054.
[I 2025-12-03 02:49:18,906] A new study created in memory with name: k_nearest_neighbors_fold_3
[I 2025-12-03 02:49:55,259] Trial 0 finished with value: 0.3350207070242055 and parameters: {'n_neighbors': 1, 'weights': 'distance', 'algorithm': 'kd_tree', 'p': 1, 'leaf_size': 33}. Best is trial 0 with value: 0.3350207070242055.
[I 2025-12-03 02:50:33,884] Trial 1 finished with value: 0.35689047309676164 and parameters: {'n_neighbors': 19, 'weights': 'distance', 'algorithm': 'kd_tree', 'p': 1, 'leaf_size': 27}. Best is trial 1 with value: 0.35689047309676164.
[I 2025-12-03 02:51:12,834] Trial 2 finished with value: 0.3388433897699775 and parameters: {'n_neighbors': 2, 'weights': 'uniform', 'algorithm': 'kd_tree', 'p': 1, 'leaf_size': 32}. Best is trial 1 with value: 0.35689047309676164.
[I 2025-12-03 02:51:45,760] Trial 3 finished with value: 0.3483993872655943 and parameters: {'n_neighbors': 4, 'weights': 'distance', 'algorithm': 'ball_tree', 'p': 2, 'leaf_size': 23}. Best is trial 1 with value: 0.35689047309676164.
[I 2025-12-03 02:51:47,246] Trial 4 finished with value: 0.3576339967045664 and parameters: {'n_neighbors': 12, 'weights': 'distance', 'algorithm': 'brute', 'p': 2, 'leaf_size': 37}. Best is trial 4 with value: 0.3576339967045664.
[I 2025-12-03 02:52:21,886] Trial 5 finished with value: 0.3568196893588784 and parameters: {'n_neighbors': 20, 'weights': 'distance', 'algorithm': 'ball_tree', 'p': 1, 'leaf_size': 39}. Best is trial 4 with value: 0.3576339967045664.
[I 2025-12-03 02:52:55,496] Trial 6 finished with value: 0.35745213135176646 and parameters: {'n_neighbors': 12, 'weights': 'distance', 'algorithm': 'ball_tree', 'p': 2, 'leaf_size': 36}. Best is trial 4 with value: 0.3576339967045664.
[I 2025-12-03 02:53:27,466] Trial 7 finished with value: 0.35176780698447024 and parameters: {'n_neighbors': 6, 'weights': 'distance', 'algorithm': 'ball_tree', 'p': 2, 'leaf_size': 36}. Best is trial 4 with value: 0.3576339967045664.
[I 2025-12-03 02:53:29,266] Trial 8 finished with value: 0.34022661180530644 and parameters: {'n_neighbors': 2, 'weights': 'distance', 'algorithm': 'brute', 'p': 1, 'leaf_size': 39}. Best is trial 4 with value: 0.3576339967045664.
[I 2025-12-03 02:54:03,189] Trial 9 finished with value: 0.3652029424954456 and parameters: {'n_neighbors': 20, 'weights': 'distance', 'algorithm': 'ball_tree', 'p': 2, 'leaf_size': 26}. Best is trial 9 with value: 0.3652029424954456.
[I 2025-12-03 02:54:04,615] Trial 10 finished with value: 0.35352845447057 and parameters: {'n_neighbors': 16, 'weights': 'uniform', 'algorithm': 'auto', 'p': 2, 'leaf_size': 20}. Best is trial 9 with value: 0.3652029424954456.
[I 2025-12-03 02:54:06,043] Trial 11 finished with value: 0.3495890129261096 and parameters: {'n_neighbors': 11, 'weights': 'uniform', 'algorithm': 'brute', 'p': 2, 'leaf_size': 27}. Best is trial 9 with value: 0.3652029424954456.
[I 2025-12-03 02:54:07,523] Trial 12 finished with value: 0.3619324239021253 and parameters: {'n_neighbors': 15, 'weights': 'distance', 'algorithm': 'brute', 'p': 2, 'leaf_size': 27}. Best is trial 9 with value: 0.3652029424954456.
[I 2025-12-03 02:54:08,288] Trial 13 finished with value: 0.3623128735995605 and parameters: {'n_neighbors': 16, 'weights': 'distance', 'algorithm': 'auto', 'p': 2, 'leaf_size': 27}. Best is trial 9 with value: 0.3652029424954456.
[I 2025-12-03 02:54:08,723] Trial 14 finished with value: 0.35554517185599155 and parameters: {'n_neighbors': 17, 'weights': 'uniform', 'algorithm': 'auto', 'p': 2, 'leaf_size': 24}. Best is trial 9 with value: 0.3652029424954456.
[I 2025-12-03 02:54:09,373] Trial 15 finished with value: 0.3602953850447764 and parameters: {'n_neighbors': 14, 'weights': 'distance', 'algorithm': 'auto', 'p': 2, 'leaf_size': 30}. Best is trial 9 with value: 0.3652029424954456.
[I 2025-12-03 02:54:10,134] Trial 16 finished with value: 0.3546334312066371 and parameters: {'n_neighbors': 8, 'weights': 'distance', 'algorithm': 'auto', 'p': 2, 'leaf_size': 23}. Best is trial 9 with value: 0.3652029424954456.
[I 2025-12-03 02:54:23,040] Trial 17 finished with value: 0.36355130876620795 and parameters: {'n_neighbors': 17, 'weights': 'distance', 'algorithm': 'ball_tree', 'p': 2, 'leaf_size': 29}. Best is trial 9 with value: 0.3652029424954456.
[I 2025-12-03 02:54:35,443] Trial 18 finished with value: 0.35625124882248976 and parameters: {'n_neighbors': 18, 'weights': 'uniform', 'algorithm': 'ball_tree', 'p': 2, 'leaf_size': 30}. Best is trial 9 with value: 0.3652029424954456.
[I 2025-12-03 02:54:48,248] Trial 19 finished with value: 0.3652029424954456 and parameters: {'n_neighbors': 20, 'weights': 'distance', 'algorithm': 'ball_tree', 'p': 2, 'leaf_size': 20}. Best is trial 9 with value: 0.3652029424954456.
[I 2025-12-03 02:55:01,932] Trial 20 finished with value: 0.35026476273530116 and parameters: {'n_neighbors': 9, 'weights': 'distance', 'algorithm': 'ball_tree', 'p': 1, 'leaf_size': 20}. Best is trial 9 with value: 0.3652029424954456.
[I 2025-12-03 02:55:13,461] Trial 21 finished with value: 0.3652029424954456 and parameters: {'n_neighbors': 20, 'weights': 'distance', 'algorithm': 'ball_tree', 'p': 2, 'leaf_size': 24}. Best is trial 9 with value: 0.3652029424954456.
[I 2025-12-03 02:55:16,921] Trial 22 finished with value: 0.3652029424954456 and parameters: {'n_neighbors': 20, 'weights': 'distance', 'algorithm': 'ball_tree', 'p': 2, 'leaf_size': 24}. Best is trial 9 with value: 0.3652029424954456.
[I 2025-12-03 02:55:20,727] Trial 23 finished with value: 0.3652029424954456 and parameters: {'n_neighbors': 20, 'weights': 'distance', 'algorithm': 'ball_tree', 'p': 2, 'leaf_size': 22}. Best is trial 9 with value: 0.3652029424954456.
[I 2025-12-03 02:55:24,153] Trial 24 finished with value: 0.36446066570292074 and parameters: {'n_neighbors': 18, 'weights': 'distance', 'algorithm': 'ball_tree', 'p': 2, 'leaf_size': 25}. Best is trial 9 with value: 0.3652029424954456.
[I 2025-12-03 02:55:28,163] Trial 25 finished with value: 0.3602976354622484 and parameters: {'n_neighbors': 14, 'weights': 'distance', 'algorithm': 'ball_tree', 'p': 2, 'leaf_size': 21}. Best is trial 9 with value: 0.3652029424954456.
[I 2025-12-03 02:55:32,368] Trial 26 finished with value: 0.35625124882248976 and parameters: {'n_neighbors': 18, 'weights': 'uniform', 'algorithm': 'ball_tree', 'p': 2, 'leaf_size': 26}. Best is trial 9 with value: 0.3652029424954456.
[I 2025-12-03 02:55:36,562] Trial 27 finished with value: 0.3652029424954456 and parameters: {'n_neighbors': 20, 'weights': 'distance', 'algorithm': 'ball_tree', 'p': 2, 'leaf_size': 22}. Best is trial 9 with value: 0.3652029424954456.
[I 2025-12-03 02:55:40,569] Trial 28 finished with value: 0.36446066570292074 and parameters: {'n_neighbors': 18, 'weights': 'distance', 'algorithm': 'ball_tree', 'p': 2, 'leaf_size': 25}. Best is trial 9 with value: 0.3652029424954456.
[I 2025-12-03 02:55:50,637] Trial 29 finished with value: 0.35208674929613476 and parameters: {'n_neighbors': 14, 'weights': 'distance', 'algorithm': 'kd_tree', 'p': 1, 'leaf_size': 29}. Best is trial 9 with value: 0.3652029424954456.
[I 2025-12-03 02:58:07,918] A new study created in memory with name: k_nearest_neighbors_fold_4
[I 2025-12-03 02:58:08,905] Trial 0 finished with value: 0.3563546978821978 and parameters: {'n_neighbors': 18, 'weights': 'uniform', 'algorithm': 'auto', 'p': 2, 'leaf_size': 29}. Best is trial 0 with value: 0.3563546978821978.
[I 2025-12-03 02:58:10,411] Trial 1 finished with value: 0.3524761248265206 and parameters: {'n_neighbors': 11, 'weights': 'uniform', 'algorithm': 'auto', 'p': 2, 'leaf_size': 32}. Best is trial 0 with value: 0.3563546978821978.
[I 2025-12-03 02:58:46,493] Trial 2 finished with value: 0.3550897753327441 and parameters: {'n_neighbors': 18, 'weights': 'distance', 'algorithm': 'kd_tree', 'p': 1, 'leaf_size': 37}. Best is trial 0 with value: 0.3563546978821978.
[I 2025-12-03 02:59:22,694] Trial 3 finished with value: 0.3609700377467416 and parameters: {'n_neighbors': 12, 'weights': 'distance', 'algorithm': 'kd_tree', 'p': 2, 'leaf_size': 25}. Best is trial 3 with value: 0.3609700377467416.
[I 2025-12-03 02:59:24,210] Trial 4 finished with value: 0.3376247124982496 and parameters: {'n_neighbors': 1, 'weights': 'distance', 'algorithm': 'auto', 'p': 2, 'leaf_size': 40}. Best is trial 3 with value: 0.3609700377467416.
[I 2025-12-03 02:59:25,916] Trial 5 finished with value: 0.35346105803063 and parameters: {'n_neighbors': 9, 'weights': 'uniform', 'algorithm': 'brute', 'p': 2, 'leaf_size': 23}. Best is trial 3 with value: 0.3609700377467416.
[I 2025-12-03 03:00:03,787] Trial 6 finished with value: 0.3496975076703653 and parameters: {'n_neighbors': 13, 'weights': 'distance', 'algorithm': 'ball_tree', 'p': 1, 'leaf_size': 34}. Best is trial 3 with value: 0.3609700377467416.
[I 2025-12-03 03:00:05,308] Trial 7 finished with value: 0.3544340857461472 and parameters: {'n_neighbors': 5, 'weights': 'distance', 'algorithm': 'brute', 'p': 2, 'leaf_size': 26}. Best is trial 3 with value: 0.3609700377467416.
[I 2025-12-03 03:00:06,984] Trial 8 finished with value: 0.35467098055751567 and parameters: {'n_neighbors': 3, 'weights': 'distance', 'algorithm': 'brute', 'p': 2, 'leaf_size': 23}. Best is trial 3 with value: 0.3609700377467416.
[I 2025-12-03 03:00:42,901] Trial 9 finished with value: 0.36268992840939174 and parameters: {'n_neighbors': 16, 'weights': 'distance', 'algorithm': 'ball_tree', 'p': 2, 'leaf_size': 27}. Best is trial 9 with value: 0.36268992840939174.
