[I 2025-11-27 05:54:56,454] Trial 2 finished with value: 0.3757129046667099 and parameters: {'min_samples_leaf': 48, 'max_features': 'sqrt', 'max_depth': 19}. Best is trial 2 with value: 0.3757129046667099.
[I 2025-11-27 05:55:05,523] Trial 3 finished with value: 0.3693195366465095 and parameters: {'min_samples_leaf': 11, 'max_features': None, 'max_depth': 50}. Best is trial 2 with value: 0.3757129046667099.
[I 2025-11-27 05:55:14,250] Trial 4 finished with value: 0.370182012484335 and parameters: {'min_samples_leaf': 14, 'max_features': None, 'max_depth': 29}. Best is trial 2 with value: 0.3757129046667099.
[I 2025-11-27 05:55:15,748] Trial 5 finished with value: 0.3704676009668968 and parameters: {'min_samples_leaf': 12, 'max_features': 'sqrt', 'max_depth': 33}. Best is trial 2 with value: 0.3757129046667099.
[I 2025-11-27 05:55:16,980] Trial 6 finished with value: 0.36771729111400037 and parameters: {'min_samples_leaf': 9, 'max_features': 'log2', 'max_depth': 19}. Best is trial 2 with value: 0.3757129046667099.
[I 2025-11-27 05:55:18,289] Trial 7 finished with value: 0.3719038125904201 and parameters: {'min_samples_leaf': 36, 'max_features': 'sqrt', 'max_depth': 32}. Best is trial 2 with value: 0.3757129046667099.
[I 2025-11-27 05:55:25,153] Trial 8 finished with value: 0.3599184729137924 and parameters: {'min_samples_leaf': 3, 'max_features': 0.7, 'max_depth': 22}. Best is trial 2 with value: 0.3757129046667099.
[I 2025-11-27 05:55:26,737] Trial 9 finished with value: 0.35892879458300997 and parameters: {'min_samples_leaf': 3, 'max_features': 'sqrt', 'max_depth': 38}. Best is trial 2 with value: 0.3757129046667099.
[I 2025-11-27 05:55:28,361] Trial 10 finished with value: 0.3750223930191277 and parameters: {'min_samples_leaf': 48, 'max_features': 0.3, 'max_depth': 5}. Best is trial 2 with value: 0.3757129046667099.
[I 2025-11-27 05:55:30,040] Trial 11 finished with value: 0.3754591328999118 and parameters: {'min_samples_leaf': 50, 'max_features': 0.3, 'max_depth': 5}. Best is trial 2 with value: 0.3757129046667099.
[I 2025-11-27 05:55:31,692] Trial 12 finished with value: 0.3724923222322589 and parameters: {'min_samples_leaf': 50, 'max_features': 0.3, 'max_depth': 5}. Best is trial 2 with value: 0.3757129046667099.
[I 2025-11-27 05:55:35,670] Trial 13 finished with value: 0.3772905228314784 and parameters: {'min_samples_leaf': 39, 'max_features': 0.5, 'max_depth': 14}. Best is trial 13 with value: 0.3772905228314784.
[I 2025-11-27 05:55:39,738] Trial 14 finished with value: 0.3736301738651804 and parameters: {'min_samples_leaf': 38, 'max_features': 0.5, 'max_depth': 17}. Best is trial 13 with value: 0.3772905228314784.
[I 2025-11-27 05:55:43,657] Trial 15 finished with value: 0.37300120323457586 and parameters: {'min_samples_leaf': 39, 'max_features': 0.5, 'max_depth': 13}. Best is trial 13 with value: 0.3772905228314784.
[I 2025-11-27 05:55:47,957] Trial 16 finished with value: 0.3730637178622819 and parameters: {'min_samples_leaf': 28, 'max_features': 0.5, 'max_depth': 24}. Best is trial 13 with value: 0.3772905228314784.
[I 2025-11-27 05:55:49,009] Trial 17 finished with value: 0.3714723065819633 and parameters: {'min_samples_leaf': 43, 'max_features': 'log2', 'max_depth': 14}. Best is trial 13 with value: 0.3772905228314784.
[I 2025-11-27 05:55:53,187] Trial 18 finished with value: 0.37476421402173166 and parameters: {'min_samples_leaf': 32, 'max_features': 0.5, 'max_depth': 25}. Best is trial 13 with value: 0.3772905228314784.
[I 2025-11-27 05:55:54,530] Trial 19 finished with value: 0.37337797705806786 and parameters: {'min_samples_leaf': 20, 'max_features': 'sqrt', 'max_depth': 11}. Best is trial 13 with value: 0.3772905228314784.
[I 2025-11-27 05:55:58,401] Trial 20 finished with value: 0.37282880801649676 and parameters: {'min_samples_leaf': 44, 'max_features': 0.5, 'max_depth': 19}. Best is trial 13 with value: 0.3772905228314784.
[I 2025-11-27 05:56:00,527] Trial 21 finished with value: 0.3747855604709058 and parameters: {'min_samples_leaf': 44, 'max_features': 0.3, 'max_depth': 8}. Best is trial 13 with value: 0.3772905228314784.
[I 2025-11-27 05:56:02,691] Trial 22 finished with value: 0.3742370573730411 and parameters: {'min_samples_leaf': 50, 'max_features': 0.3, 'max_depth': 8}. Best is trial 13 with value: 0.3772905228314784.
[I 2025-11-27 05:56:05,140] Trial 23 finished with value: 0.3778168985449036 and parameters: {'min_samples_leaf': 45, 'max_features': 0.3, 'max_depth': 16}. Best is trial 23 with value: 0.3778168985449036.
[I 2025-11-27 05:56:06,450] Trial 24 finished with value: 0.3743407458754808 and parameters: {'min_samples_leaf': 33, 'max_features': 'sqrt', 'max_depth': 17}. Best is trial 23 with value: 0.3778168985449036.
[I 2025-11-27 05:56:07,493] Trial 25 finished with value: 0.3719596302068697 and parameters: {'min_samples_leaf': 41, 'max_features': 'log2', 'max_depth': 22}. Best is trial 23 with value: 0.3778168985449036.
[I 2025-11-27 05:56:14,887] Trial 26 finished with value: 0.3731433702319774 and parameters: {'min_samples_leaf': 46, 'max_features': None, 'max_depth': 16}. Best is trial 23 with value: 0.3778168985449036.
[I 2025-11-27 05:56:19,206] Trial 27 finished with value: 0.3747848774352561 and parameters: {'min_samples_leaf': 24, 'max_features': 0.5, 'max_depth': 27}. Best is trial 23 with value: 0.3778168985449036.
[I 2025-11-27 05:56:20,515] Trial 28 finished with value: 0.3742240748078861 and parameters: {'min_samples_leaf': 34, 'max_features': 'sqrt', 'max_depth': 21}. Best is trial 23 with value: 0.3778168985449036.
[I 2025-11-27 05:56:25,788] Trial 29 finished with value: 0.37310188791484034 and parameters: {'min_samples_leaf': 28, 'max_features': 0.7, 'max_depth': 10}. Best is trial 23 with value: 0.3778168985449036.
[I 2025-11-27 05:56:30,678] A new study created in memory with name: random_forest_fold_3
[I 2025-11-27 05:56:33,198] Trial 0 finished with value: 0.3724566696773516 and parameters: {'min_samples_leaf': 40, 'max_features': 0.3, 'max_depth': 50}. Best is trial 0 with value: 0.3724566696773516.
[I 2025-11-27 05:56:38,403] Trial 1 finished with value: 0.3680147850515449 and parameters: {'min_samples_leaf': 48, 'max_features': 0.7, 'max_depth': 20}. Best is trial 0 with value: 0.3724566696773516.
[I 2025-11-27 05:56:39,546] Trial 2 finished with value: 0.3718782629122576 and parameters: {'min_samples_leaf': 23, 'max_features': 'log2', 'max_depth': 16}. Best is trial 0 with value: 0.3724566696773516.
[I 2025-11-27 05:56:43,907] Trial 3 finished with value: 0.370561175371928 and parameters: {'min_samples_leaf': 22, 'max_features': 0.5, 'max_depth': 36}. Best is trial 0 with value: 0.3724566696773516.
[I 2025-11-27 05:56:46,405] Trial 4 finished with value: 0.371667582810771 and parameters: {'min_samples_leaf': 41, 'max_features': 0.3, 'max_depth': 13}. Best is trial 0 with value: 0.3724566696773516.
[I 2025-11-27 05:56:48,011] Trial 5 finished with value: 0.35465566403851756 and parameters: {'min_samples_leaf': 3, 'max_features': 'sqrt', 'max_depth': 45}. Best is trial 0 with value: 0.3724566696773516.
[I 2025-11-27 05:56:50,400] Trial 6 finished with value: 0.3708874795311875 and parameters: {'min_samples_leaf': 50, 'max_features': 0.3, 'max_depth': 43}. Best is trial 0 with value: 0.3724566696773516.
[I 2025-11-27 05:56:55,708] Trial 7 finished with value: 0.36861368282928414 and parameters: {'min_samples_leaf': 42, 'max_features': 0.7, 'max_depth': 16}. Best is trial 0 with value: 0.3724566696773516.
[I 2025-11-27 05:56:56,724] Trial 8 finished with value: 0.37024297330883493 and parameters: {'min_samples_leaf': 31, 'max_features': 'sqrt', 'max_depth': 6}. Best is trial 0 with value: 0.3724566696773516.
[I 2025-11-27 05:57:02,154] Trial 9 finished with value: 0.3721513052393391 and parameters: {'min_samples_leaf': 34, 'max_features': 0.7, 'max_depth': 43}. Best is trial 0 with value: 0.3724566696773516.
[I 2025-11-27 05:57:05,204] Trial 10 finished with value: 0.3635546144423978 and parameters: {'min_samples_leaf': 8, 'max_features': 0.3, 'max_depth': 31}. Best is trial 0 with value: 0.3724566696773516.
[I 2025-11-27 05:57:13,129] Trial 11 finished with value: 0.36881842764808265 and parameters: {'min_samples_leaf': 33, 'max_features': None, 'max_depth': 50}. Best is trial 0 with value: 0.3724566696773516.
[I 2025-11-27 05:57:18,573] Trial 12 finished with value: 0.3692658986919465 and parameters: {'min_samples_leaf': 35, 'max_features': 0.7, 'max_depth': 38}. Best is trial 0 with value: 0.3724566696773516.
[I 2025-11-27 05:57:27,207] Trial 13 finished with value: 0.3649963044291779 and parameters: {'min_samples_leaf': 16, 'max_features': None, 'max_depth': 50}. Best is trial 0 with value: 0.3724566696773516.
[I 2025-11-27 05:57:31,145] Trial 14 finished with value: 0.36967376194421037 and parameters: {'min_samples_leaf': 40, 'max_features': 0.5, 'max_depth': 29}. Best is trial 0 with value: 0.3724566696773516.
[I 2025-11-27 05:57:33,771] Trial 15 finished with value: 0.3719089895482967 and parameters: {'min_samples_leaf': 28, 'max_features': 0.3, 'max_depth': 42}. Best is trial 0 with value: 0.3724566696773516.
[I 2025-11-27 05:57:34,833] Trial 16 finished with value: 0.3724390136276444 and parameters: {'min_samples_leaf': 38, 'max_features': 'log2', 'max_depth': 35}. Best is trial 0 with value: 0.3724566696773516.
[I 2025-11-27 05:57:35,868] Trial 17 finished with value: 0.3725729135841884 and parameters: {'min_samples_leaf': 44, 'max_features': 'log2', 'max_depth': 24}. Best is trial 17 with value: 0.3725729135841884.
[I 2025-11-27 05:57:36,934] Trial 18 finished with value: 0.3724506043287706 and parameters: {'min_samples_leaf': 46, 'max_features': 'log2', 'max_depth': 21}. Best is trial 17 with value: 0.3725729135841884.
[I 2025-11-27 05:57:37,981] Trial 19 finished with value: 0.37278529206749905 and parameters: {'min_samples_leaf': 45, 'max_features': 'log2', 'max_depth': 24}. Best is trial 19 with value: 0.37278529206749905.
[I 2025-11-27 05:57:39,011] Trial 20 finished with value: 0.37326471358526675 and parameters: {'min_samples_leaf': 45, 'max_features': 'log2', 'max_depth': 24}. Best is trial 20 with value: 0.37326471358526675.
[I 2025-11-27 05:57:40,067] Trial 21 finished with value: 0.3744937272960758 and parameters: {'min_samples_leaf': 45, 'max_features': 'log2', 'max_depth': 25}. Best is trial 21 with value: 0.3744937272960758.
[I 2025-11-27 05:57:41,108] Trial 22 finished with value: 0.3734239565459319 and parameters: {'min_samples_leaf': 50, 'max_features': 'log2', 'max_depth': 25}. Best is trial 21 with value: 0.3744937272960758.
[I 2025-11-27 05:57:42,145] Trial 23 finished with value: 0.3713291808230525 and parameters: {'min_samples_leaf': 50, 'max_features': 'log2', 'max_depth': 26}. Best is trial 21 with value: 0.3744937272960758.
[I 2025-11-27 05:57:43,194] Trial 24 finished with value: 0.3747500311462465 and parameters: {'min_samples_leaf': 46, 'max_features': 'log2', 'max_depth': 33}. Best is trial 24 with value: 0.3747500311462465.
[I 2025-11-27 05:57:44,237] Trial 25 finished with value: 0.3719821221564273 and parameters: {'min_samples_leaf': 50, 'max_features': 'log2', 'max_depth': 32}. Best is trial 24 with value: 0.3747500311462465.
[I 2025-11-27 05:57:45,337] Trial 26 finished with value: 0.3735574649689294 and parameters: {'min_samples_leaf': 37, 'max_features': 'log2', 'max_depth': 28}. Best is trial 24 with value: 0.3747500311462465.
[I 2025-11-27 05:57:46,422] Trial 27 finished with value: 0.37204469272591656 and parameters: {'min_samples_leaf': 37, 'max_features': 'log2', 'max_depth': 33}. Best is trial 24 with value: 0.3747500311462465.
[I 2025-11-27 05:57:47,518] Trial 28 finished with value: 0.37149015223915105 and parameters: {'min_samples_leaf': 30, 'max_features': 'log2', 'max_depth': 29}. Best is trial 24 with value: 0.3747500311462465.
[I 2025-11-27 05:57:54,943] Trial 29 finished with value: 0.36957118038692854 and parameters: {'min_samples_leaf': 39, 'max_features': None, 'max_depth': 38}. Best is trial 24 with value: 0.3747500311462465.
[I 2025-11-27 05:57:56,796] A new study created in memory with name: random_forest_fold_4
[I 2025-11-27 05:58:02,514] Trial 0 finished with value: 0.37298110286063485 and parameters: {'min_samples_leaf': 26, 'max_features': 0.7, 'max_depth': 39}. Best is trial 0 with value: 0.37298110286063485.
[I 2025-11-27 05:58:03,857] Trial 1 finished with value: 0.37296803355154295 and parameters: {'min_samples_leaf': 30, 'max_features': 'sqrt', 'max_depth': 16}. Best is trial 0 with value: 0.37298110286063485.
[I 2025-11-27 05:58:12,668] Trial 2 finished with value: 0.35737731090980773 and parameters: {'min_samples_leaf': 4, 'max_features': None, 'max_depth': 11}. Best is trial 0 with value: 0.37298110286063485.
[I 2025-11-27 05:58:13,990] Trial 3 finished with value: 0.3779078541162779 and parameters: {'min_samples_leaf': 36, 'max_features': 'sqrt', 'max_depth': 27}. Best is trial 3 with value: 0.3779078541162779.
[I 2025-11-27 05:58:22,774] Trial 4 finished with value: 0.3645236417421581 and parameters: {'min_samples_leaf': 14, 'max_features': None, 'max_depth': 20}. Best is trial 3 with value: 0.3779078541162779.
[I 2025-11-27 05:58:25,739] Trial 5 finished with value: 0.36856467266469817 and parameters: {'min_samples_leaf': 13, 'max_features': 0.3, 'max_depth': 43}. Best is trial 3 with value: 0.3779078541162779.
[I 2025-11-27 05:58:26,658] Trial 6 finished with value: 0.37428336323055006 and parameters: {'min_samples_leaf': 25, 'max_features': 'log2', 'max_depth': 7}. Best is trial 3 with value: 0.3779078541162779.
[I 2025-11-27 05:58:32,825] Trial 7 finished with value: 0.36656611296549374 and parameters: {'min_samples_leaf': 14, 'max_features': 0.7, 'max_depth': 22}. Best is trial 3 with value: 0.3779078541162779.
[I 2025-11-27 05:58:35,121] Trial 8 finished with value: 0.3707079252212041 and parameters: {'min_samples_leaf': 15, 'max_features': 0.3, 'max_depth': 8}. Best is trial 3 with value: 0.3779078541162779.
[I 2025-11-27 05:58:42,455] Trial 9 finished with value: 0.37302461849523494 and parameters: {'min_samples_leaf': 44, 'max_features': None, 'max_depth': 34}. Best is trial 3 with value: 0.3779078541162779.
[I 2025-11-27 05:58:43,704] Trial 10 finished with value: 0.37733377988962064 and parameters: {'min_samples_leaf': 50, 'max_features': 'sqrt', 'max_depth': 50}. Best is trial 3 with value: 0.3779078541162779.
[I 2025-11-27 05:58:44,998] Trial 11 finished with value: 0.37645041924114253 and parameters: {'min_samples_leaf': 49, 'max_features': 'sqrt', 'max_depth': 50}. Best is trial 3 with value: 0.3779078541162779.
[I 2025-11-27 05:58:49,056] Trial 12 finished with value: 0.37580254937560625 and parameters: {'min_samples_leaf': 38, 'max_features': 0.5, 'max_depth': 28}. Best is trial 3 with value: 0.3779078541162779.
[I 2025-11-27 05:58:50,366] Trial 13 finished with value: 0.37605919979333063 and parameters: {'min_samples_leaf': 38, 'max_features': 'sqrt', 'max_depth': 30}. Best is trial 3 with value: 0.3779078541162779.
[I 2025-11-27 05:58:51,645] Trial 14 finished with value: 0.3778137917002939 and parameters: {'min_samples_leaf': 49, 'max_features': 'sqrt', 'max_depth': 49}. Best is trial 3 with value: 0.3779078541162779.
[I 2025-11-27 05:58:52,960] Trial 15 finished with value: 0.37385276550375746 and parameters: {'min_samples_leaf': 38, 'max_features': 'sqrt', 'max_depth': 37}. Best is trial 3 with value: 0.3779078541162779.
[I 2025-11-27 05:58:56,869] Trial 16 finished with value: 0.3763270904537881 and parameters: {'min_samples_leaf': 45, 'max_features': 0.5, 'max_depth': 25}. Best is trial 3 with value: 0.3779078541162779.
[I 2025-11-27 05:58:57,982] Trial 17 finished with value: 0.3767931795485876 and parameters: {'min_samples_leaf': 32, 'max_features': 'log2', 'max_depth': 43}. Best is trial 3 with value: 0.3779078541162779.
[I 2025-11-27 05:58:59,302] Trial 18 finished with value: 0.3757610389311036 and parameters: {'min_samples_leaf': 45, 'max_features': 'sqrt', 'max_depth': 32}. Best is trial 3 with value: 0.3779078541162779.
[I 2025-11-27 05:59:00,677] Trial 19 finished with value: 0.37474091292165157 and parameters: {'min_samples_leaf': 41, 'max_features': 'sqrt', 'max_depth': 16}. Best is trial 3 with value: 0.3779078541162779.
[I 2025-11-27 05:59:02,066] Trial 20 finished with value: 0.37630075350355907 and parameters: {'min_samples_leaf': 33, 'max_features': 'sqrt', 'max_depth': 41}. Best is trial 3 with value: 0.3779078541162779.
[I 2025-11-27 05:59:03,346] Trial 21 finished with value: 0.3754115457730649 and parameters: {'min_samples_leaf': 48, 'max_features': 'sqrt', 'max_depth': 50}. Best is trial 3 with value: 0.3779078541162779.
[I 2025-11-27 05:59:04,656] Trial 22 finished with value: 0.3745520448912164 and parameters: {'min_samples_leaf': 50, 'max_features': 'sqrt', 'max_depth': 47}. Best is trial 3 with value: 0.3779078541162779.
[I 2025-11-27 05:59:05,967] Trial 23 finished with value: 0.37673807419275207 and parameters: {'min_samples_leaf': 41, 'max_features': 'sqrt', 'max_depth': 45}. Best is trial 3 with value: 0.3779078541162779.
[I 2025-11-27 05:59:07,377] Trial 24 finished with value: 0.3742798856683708 and parameters: {'min_samples_leaf': 21, 'max_features': 'sqrt', 'max_depth': 35}. Best is trial 3 with value: 0.3779078541162779.
[I 2025-11-27 05:59:10,003] Trial 25 finished with value: 0.3744105121862692 and parameters: {'min_samples_leaf': 35, 'max_features': 0.3, 'max_depth': 25}. Best is trial 3 with value: 0.3779078541162779.
[I 2025-11-27 05:59:15,319] Trial 26 finished with value: 0.3770758772763979 and parameters: {'min_samples_leaf': 43, 'max_features': 0.7, 'max_depth': 46}. Best is trial 3 with value: 0.3779078541162779.
[I 2025-11-27 05:59:16,388] Trial 27 finished with value: 0.3735618382787656 and parameters: {'min_samples_leaf': 48, 'max_features': 'log2', 'max_depth': 39}. Best is trial 3 with value: 0.3779078541162779.
[I 2025-11-27 05:59:20,593] Trial 28 finished with value: 0.3735274972324615 and parameters: {'min_samples_leaf': 29, 'max_features': 0.5, 'max_depth': 50}. Best is trial 3 with value: 0.3779078541162779.
[I 2025-11-27 05:59:26,335] Trial 29 finished with value: 0.370326840455324 and parameters: {'min_samples_leaf': 24, 'max_features': 0.7, 'max_depth': 39}. Best is trial 3 with value: 0.3779078541162779.
[I 2025-11-27 05:59:28,749] A new study created in memory with name: random_forest_fold_5
[I 2025-11-27 05:59:29,802] Trial 0 finished with value: 0.3787150960857208 and parameters: {'min_samples_leaf': 30, 'max_features': 'log2', 'max_depth': 13}. Best is trial 0 with value: 0.3787150960857208.
[I 2025-11-27 05:59:31,017] Trial 1 finished with value: 0.37306117478807715 and parameters: {'min_samples_leaf': 10, 'max_features': 'log2', 'max_depth': 47}. Best is trial 0 with value: 0.3787150960857208.
[I 2025-11-27 05:59:31,978] Trial 2 finished with value: 0.3742980698701947 and parameters: {'min_samples_leaf': 27, 'max_features': 'log2', 'max_depth': 8}. Best is trial 0 with value: 0.3787150960857208.
[I 2025-11-27 05:59:39,267] Trial 3 finished with value: 0.37657946595599084 and parameters: {'min_samples_leaf': 35, 'max_features': None, 'max_depth': 15}. Best is trial 0 with value: 0.3787150960857208.
[I 2025-11-27 05:59:46,075] Trial 4 finished with value: 0.3545536855370657 and parameters: {'min_samples_leaf': 1, 'max_features': 0.7, 'max_depth': 23}. Best is trial 0 with value: 0.3787150960857208.
[I 2025-11-27 05:59:48,554] Trial 5 finished with value: 0.37627791735677485 and parameters: {'min_samples_leaf': 38, 'max_features': 0.3, 'max_depth': 25}. Best is trial 0 with value: 0.3787150960857208.
[I 2025-11-27 05:59:55,439] Trial 6 finished with value: 0.3763368476725977 and parameters: {'min_samples_leaf': 45, 'max_features': None, 'max_depth': 10}. Best is trial 0 with value: 0.3787150960857208.
[I 2025-11-27 06:00:00,238] Trial 7 finished with value: 0.36296349325789246 and parameters: {'min_samples_leaf': 5, 'max_features': 0.5, 'max_depth': 17}. Best is trial 0 with value: 0.3787150960857208.
[I 2025-11-27 06:00:04,006] Trial 8 finished with value: 0.3745556901544612 and parameters: {'min_samples_leaf': 28, 'max_features': 0.5, 'max_depth': 9}. Best is trial 0 with value: 0.3787150960857208.
[I 2025-11-27 06:00:07,098] Trial 9 finished with value: 0.35919760110954435 and parameters: {'min_samples_leaf': 4, 'max_features': 0.3, 'max_depth': 32}. Best is trial 0 with value: 0.3787150960857208.
[I 2025-11-27 06:00:08,553] Trial 10 finished with value: 0.37594867892527073 and parameters: {'min_samples_leaf': 17, 'max_features': 'sqrt', 'max_depth': 35}. Best is trial 0 with value: 0.3787150960857208.
[I 2025-11-27 06:00:16,042] Trial 11 finished with value: 0.37535609622759747 and parameters: {'min_samples_leaf': 36, 'max_features': None, 'max_depth': 15}. Best is trial 0 with value: 0.3787150960857208.
[I 2025-11-27 06:00:23,064] Trial 12 finished with value: 0.3764593007221309 and parameters: {'min_samples_leaf': 49, 'max_features': None, 'max_depth': 18}. Best is trial 0 with value: 0.3787150960857208.
[I 2025-11-27 06:00:23,851] Trial 13 finished with value: 0.3752146105398677 and parameters: {'min_samples_leaf': 20, 'max_features': 'log2', 'max_depth': 5}. Best is trial 0 with value: 0.3787150960857208.
[I 2025-11-27 06:00:29,175] Trial 14 finished with value: 0.3767475912910619 and parameters: {'min_samples_leaf': 35, 'max_features': 0.7, 'max_depth': 15}. Best is trial 0 with value: 0.3787150960857208.
[I 2025-11-27 06:00:34,507] Trial 15 finished with value: 0.377749524835003 and parameters: {'min_samples_leaf': 32, 'max_features': 0.7, 'max_depth': 22}. Best is trial 0 with value: 0.3787150960857208.
[I 2025-11-27 06:00:40,213] Trial 16 finished with value: 0.3750275011069449 and parameters: {'min_samples_leaf': 22, 'max_features': 0.7, 'max_depth': 30}. Best is trial 0 with value: 0.3787150960857208.
