[I 2025-11-27 15:29:53,771] Trial 5 finished with value: 0.38197061521276005 and parameters: {'learning_rate': 0.011510512321795025, 'max_depth': 7}. Best is trial 5 with value: 0.38197061521276005.
[I 2025-11-27 15:43:43,597] Trial 6 finished with value: 0.3580247023547397 and parameters: {'learning_rate': 0.01947048691866002, 'max_depth': 29}. Best is trial 5 with value: 0.38197061521276005.
[I 2025-11-27 15:51:58,467] Trial 7 finished with value: 0.36662843755473956 and parameters: {'learning_rate': 0.012523565399786944, 'max_depth': 16}. Best is trial 5 with value: 0.38197061521276005.
[I 2025-11-27 15:58:16,656] Trial 8 finished with value: 0.3720591132413556 and parameters: {'learning_rate': 0.018253886633222555, 'max_depth': 12}. Best is trial 5 with value: 0.38197061521276005.
[I 2025-11-27 16:12:24,964] Trial 9 finished with value: 0.3574161440667849 and parameters: {'learning_rate': 0.04982239116067743, 'max_depth': 30}. Best is trial 5 with value: 0.38197061521276005.
[I 2025-11-27 16:13:33,049] Trial 10 finished with value: 0.37640803796157923 and parameters: {'learning_rate': 0.005978357405394617, 'max_depth': 2}. Best is trial 5 with value: 0.38197061521276005.
[I 2025-11-27 16:14:41,096] Trial 11 finished with value: 0.3763859150922558 and parameters: {'learning_rate': 0.005907113889997813, 'max_depth': 2}. Best is trial 5 with value: 0.38197061521276005.
[I 2025-11-27 16:15:49,292] Trial 12 finished with value: 0.3757263391221946 and parameters: {'learning_rate': 0.005282165579523872, 'max_depth': 2}. Best is trial 5 with value: 0.38197061521276005.
[I 2025-11-27 16:19:39,325] Trial 13 finished with value: 0.38153114250608966 and parameters: {'learning_rate': 0.008955721958188353, 'max_depth': 7}. Best is trial 5 with value: 0.38197061521276005.
[I 2025-11-27 16:24:00,097] Trial 14 finished with value: 0.37650541578944463 and parameters: {'learning_rate': 0.010525890588054697, 'max_depth': 8}. Best is trial 5 with value: 0.38197061521276005.
[I 2025-11-27 16:28:21,361] Trial 15 finished with value: 0.3774788523927052 and parameters: {'learning_rate': 0.013857186467650615, 'max_depth': 8}. Best is trial 5 with value: 0.38197061521276005.
[I 2025-11-27 16:32:42,478] Trial 16 finished with value: 0.37872636204375354 and parameters: {'learning_rate': 0.00958339999813569, 'max_depth': 8}. Best is trial 5 with value: 0.38197061521276005.
[I 2025-11-27 16:36:00,767] Trial 17 finished with value: 0.38379132393125126 and parameters: {'learning_rate': 0.007268229460650928, 'max_depth': 6}. Best is trial 17 with value: 0.38379132393125126.
[I 2025-11-27 16:38:47,164] Trial 18 finished with value: 0.3830020708611583 and parameters: {'learning_rate': 0.007252939071330554, 'max_depth': 5}. Best is trial 17 with value: 0.38379132393125126.
[I 2025-11-27 16:41:33,344] Trial 19 finished with value: 0.3826042245124236 and parameters: {'learning_rate': 0.00766885398141838, 'max_depth': 5}. Best is trial 17 with value: 0.38379132393125126.
[I 2025-11-27 16:47:22,493] Trial 20 finished with value: 0.3745231519268521 and parameters: {'learning_rate': 0.015823895273277228, 'max_depth': 11}. Best is trial 17 with value: 0.38379132393125126.
[I 2025-11-27 16:50:08,979] Trial 21 finished with value: 0.38254257822576365 and parameters: {'learning_rate': 0.007286340485663229, 'max_depth': 5}. Best is trial 17 with value: 0.38379132393125126.
[I 2025-11-27 16:52:55,432] Trial 22 finished with value: 0.382429534709324 and parameters: {'learning_rate': 0.006794607939201861, 'max_depth': 5}. Best is trial 17 with value: 0.38379132393125126.
[I 2025-11-27 16:55:42,047] Trial 23 finished with value: 0.3817433347840421 and parameters: {'learning_rate': 0.005070136922644053, 'max_depth': 5}. Best is trial 17 with value: 0.38379132393125126.
[I 2025-11-27 17:01:35,574] Trial 24 finished with value: 0.37700123253250595 and parameters: {'learning_rate': 0.0071621497045151125, 'max_depth': 11}. Best is trial 17 with value: 0.38379132393125126.
[I 2025-11-27 17:10:06,667] Trial 25 finished with value: 0.36068593502395935 and parameters: {'learning_rate': 0.035500649810945376, 'max_depth': 17}. Best is trial 17 with value: 0.38379132393125126.
[I 2025-11-27 17:12:20,423] Trial 26 finished with value: 0.38192562127668916 and parameters: {'learning_rate': 0.008436535549371352, 'max_depth': 4}. Best is trial 17 with value: 0.38379132393125126.
[I 2025-11-27 17:24:58,307] Trial 27 finished with value: 0.36035657601430515 and parameters: {'learning_rate': 0.011885630155971057, 'max_depth': 26}. Best is trial 17 with value: 0.38379132393125126.
[I 2025-11-27 17:30:19,856] Trial 28 finished with value: 0.3773532496909124 and parameters: {'learning_rate': 0.015154068098397123, 'max_depth': 10}. Best is trial 17 with value: 0.38379132393125126.
[I 2025-11-27 17:39:46,458] Trial 29 finished with value: 0.3590375838912945 and parameters: {'learning_rate': 0.03459362068886572, 'max_depth': 19}. Best is trial 17 with value: 0.38379132393125126.
[I 2025-11-27 17:40:37,117] A new study created in memory with name: gradient_boosting_fold_5
[I 2025-11-27 17:46:20,103] Trial 0 finished with value: 0.37593049884331753 and parameters: {'learning_rate': 0.05398995417401224, 'max_depth': 11}. Best is trial 0 with value: 0.37593049884331753.
[I 2025-11-27 17:51:08,798] Trial 1 finished with value: 0.3726506089006579 and parameters: {'learning_rate': 0.07734556342466177, 'max_depth': 9}. Best is trial 0 with value: 0.37593049884331753.
[I 2025-11-27 17:55:01,748] Trial 2 finished with value: 0.38501333442960506 and parameters: {'learning_rate': 0.008178511568523615, 'max_depth': 7}. Best is trial 2 with value: 0.38501333442960506.
[I 2025-11-27 17:56:43,740] Trial 3 finished with value: 0.3879299928094292 and parameters: {'learning_rate': 0.013616871070903518, 'max_depth': 3}. Best is trial 3 with value: 0.3879299928094292.
[I 2025-11-27 18:08:34,007] Trial 4 finished with value: 0.3538189672643039 and parameters: {'learning_rate': 0.024510646072194366, 'max_depth': 24}. Best is trial 3 with value: 0.3879299928094292.
[I 2025-11-27 18:16:19,451] Trial 5 finished with value: 0.36901647920161995 and parameters: {'learning_rate': 0.011999646344676873, 'max_depth': 15}. Best is trial 3 with value: 0.3879299928094292.
[I 2025-11-27 18:22:28,677] Trial 6 finished with value: 0.3695172881916989 and parameters: {'learning_rate': 0.05277080266578349, 'max_depth': 12}. Best is trial 3 with value: 0.3879299928094292.
[I 2025-11-27 18:32:05,291] Trial 7 finished with value: 0.36238021525115377 and parameters: {'learning_rate': 0.012353138709782429, 'max_depth': 19}. Best is trial 3 with value: 0.3879299928094292.
[I 2025-11-27 18:45:51,244] Trial 8 finished with value: 0.3569639362622846 and parameters: {'learning_rate': 0.007535589194166724, 'max_depth': 29}. Best is trial 3 with value: 0.3879299928094292.
[I 2025-11-27 18:55:00,022] Trial 9 finished with value: 0.3636533031867665 and parameters: {'learning_rate': 0.013119454048967952, 'max_depth': 18}. Best is trial 3 with value: 0.3879299928094292.
[I 2025-11-27 18:56:07,881] Trial 10 finished with value: 0.38891022484605137 and parameters: {'learning_rate': 0.026641237480142705, 'max_depth': 2}. Best is trial 10 with value: 0.38891022484605137.
[I 2025-11-27 18:57:48,989] Trial 11 finished with value: 0.38998313313355204 and parameters: {'learning_rate': 0.027292388302268482, 'max_depth': 3}. Best is trial 11 with value: 0.38998313313355204.
[I 2025-11-27 18:58:56,992] Trial 12 finished with value: 0.38892991379946734 and parameters: {'learning_rate': 0.028392265828670295, 'max_depth': 2}. Best is trial 11 with value: 0.38998313313355204.
[I 2025-11-27 19:02:13,325] Trial 13 finished with value: 0.3935408295736905 and parameters: {'learning_rate': 0.03562990152594699, 'max_depth': 6}. Best is trial 13 with value: 0.3935408295736905.
[I 2025-11-27 19:05:29,067] Trial 14 finished with value: 0.3932807733824168 and parameters: {'learning_rate': 0.03867917615640385, 'max_depth': 6}. Best is trial 13 with value: 0.3935408295736905.
[I 2025-11-27 19:09:15,256] Trial 15 finished with value: 0.3893758069404825 and parameters: {'learning_rate': 0.04216112278778065, 'max_depth': 7}. Best is trial 13 with value: 0.3935408295736905.
[I 2025-11-27 19:12:59,166] Trial 16 finished with value: 0.38038803333814547 and parameters: {'learning_rate': 0.09885437704757306, 'max_depth': 7}. Best is trial 13 with value: 0.3935408295736905.
[I 2025-11-27 19:20:06,017] Trial 17 finished with value: 0.3652004392141983 and parameters: {'learning_rate': 0.04714947130432449, 'max_depth': 14}. Best is trial 13 with value: 0.3935408295736905.
[I 2025-11-27 19:30:55,219] Trial 18 finished with value: 0.3560897801136418 and parameters: {'learning_rate': 0.03633367780242464, 'max_depth': 22}. Best is trial 13 with value: 0.3935408295736905.
[I 2025-11-27 19:34:12,329] Trial 19 finished with value: 0.39234767739301224 and parameters: {'learning_rate': 0.02043641188500188, 'max_depth': 6}. Best is trial 13 with value: 0.3935408295736905.
[I 2025-11-27 19:39:54,757] Trial 20 finished with value: 0.369180482456718 and parameters: {'learning_rate': 0.06857177352021242, 'max_depth': 11}. Best is trial 13 with value: 0.3935408295736905.
[I 2025-11-27 19:43:43,230] Trial 21 finished with value: 0.3903772143075716 and parameters: {'learning_rate': 0.018467208399365286, 'max_depth': 7}. Best is trial 13 with value: 0.3935408295736905.
[I 2025-11-27 19:46:28,726] Trial 22 finished with value: 0.3953295399695411 and parameters: {'learning_rate': 0.01781069181742756, 'max_depth': 5}. Best is trial 22 with value: 0.3953295399695411.
[I 2025-11-27 19:49:14,630] Trial 23 finished with value: 0.3913785408316398 and parameters: {'learning_rate': 0.005047287965005419, 'max_depth': 5}. Best is trial 22 with value: 0.3953295399695411.
[I 2025-11-27 19:54:01,557] Trial 24 finished with value: 0.3861394677768303 and parameters: {'learning_rate': 0.03665120763767041, 'max_depth': 9}. Best is trial 22 with value: 0.3953295399695411.
[I 2025-11-27 19:56:14,586] Trial 25 finished with value: 0.39296018879234973 and parameters: {'learning_rate': 0.01834391965196021, 'max_depth': 4}. Best is trial 22 with value: 0.3953295399695411.
[I 2025-11-27 20:01:02,197] Trial 26 finished with value: 0.3856871374327361 and parameters: {'learning_rate': 0.033166634972879604, 'max_depth': 9}. Best is trial 22 with value: 0.3953295399695411.
[I 2025-11-27 20:07:11,872] Trial 27 finished with value: 0.3654624108311786 and parameters: {'learning_rate': 0.06576070168695047, 'max_depth': 12}. Best is trial 22 with value: 0.3953295399695411.
[I 2025-11-27 20:15:49,793] Trial 28 finished with value: 0.36352666475532314 and parameters: {'learning_rate': 0.017340635340931033, 'max_depth': 17}. Best is trial 22 with value: 0.3953295399695411.
[I 2025-11-27 20:21:04,434] Trial 29 finished with value: 0.37643832454751974 and parameters: {'learning_rate': 0.05602905060939383, 'max_depth': 10}. Best is trial 22 with value: 0.3953295399695411.
[I 2025-11-27 20:27:10,544] A new study created in memory with name: histogram_gradient_boosting_fold_1
[I 2025-11-27 20:27:18,056] Trial 0 finished with value: 0.3488220512839407 and parameters: {'learning_rate': 0.3234433336601815, 'max_depth': 12}. Best is trial 0 with value: 0.3488220512839407.
[I 2025-11-27 20:27:28,226] Trial 1 finished with value: 0.3646778623003519 and parameters: {'learning_rate': 0.12951173604113048, 'max_depth': 5}. Best is trial 1 with value: 0.3646778623003519.
[I 2025-11-27 20:27:37,442] Trial 2 finished with value: 0.38242828732020107 and parameters: {'learning_rate': 0.02164543926233334, 'max_depth': 23}. Best is trial 2 with value: 0.38242828732020107.
[I 2025-11-27 20:27:44,490] Trial 3 finished with value: 0.37090261499598215 and parameters: {'learning_rate': 0.05715190475741925, 'max_depth': 20}. Best is trial 2 with value: 0.38242828732020107.
[I 2025-11-27 20:27:51,310] Trial 4 finished with value: 0.35557750932202614 and parameters: {'learning_rate': 0.23093636147746466, 'max_depth': 10}. Best is trial 2 with value: 0.38242828732020107.
[I 2025-11-27 20:27:58,693] Trial 5 finished with value: 0.3727576926776482 and parameters: {'learning_rate': 0.040367388927318414, 'max_depth': 20}. Best is trial 2 with value: 0.38242828732020107.
[I 2025-11-27 20:28:05,158] Trial 6 finished with value: 0.3480404176974651 and parameters: {'learning_rate': 0.34011765215182915, 'max_depth': 23}. Best is trial 2 with value: 0.38242828732020107.
[I 2025-11-27 20:28:13,033] Trial 7 finished with value: 0.37669112837439245 and parameters: {'learning_rate': 0.03770416399626428, 'max_depth': 25}. Best is trial 2 with value: 0.38242828732020107.
[I 2025-11-27 20:28:20,611] Trial 8 finished with value: 0.36124316731678036 and parameters: {'learning_rate': 0.11212244114686509, 'max_depth': 28}. Best is trial 2 with value: 0.38242828732020107.
[I 2025-11-27 20:28:24,518] Trial 9 finished with value: 0.3753976968368259 and parameters: {'learning_rate': 0.0457093062669224, 'max_depth': 5}. Best is trial 2 with value: 0.38242828732020107.
[I 2025-11-27 20:28:31,176] Trial 10 finished with value: 0.3815491185615874 and parameters: {'learning_rate': 0.007022810401693666, 'max_depth': 15}. Best is trial 2 with value: 0.38242828732020107.
[I 2025-11-27 20:28:38,540] Trial 11 finished with value: 0.3810232000157263 and parameters: {'learning_rate': 0.007935855282726426, 'max_depth': 15}. Best is trial 2 with value: 0.38242828732020107.
[I 2025-11-27 20:28:45,633] Trial 12 finished with value: 0.3823130858348913 and parameters: {'learning_rate': 0.007208311968723477, 'max_depth': 17}. Best is trial 2 with value: 0.38242828732020107.
[I 2025-11-27 20:28:52,095] Trial 13 finished with value: 0.3830005042566472 and parameters: {'learning_rate': 0.013768955372374056, 'max_depth': 30}. Best is trial 13 with value: 0.3830005042566472.
[I 2025-11-27 20:28:58,847] Trial 14 finished with value: 0.3827054100768062 and parameters: {'learning_rate': 0.01605278166800078, 'max_depth': 30}. Best is trial 13 with value: 0.3830005042566472.
[I 2025-11-27 20:29:05,369] Trial 15 finished with value: 0.38197909887528614 and parameters: {'learning_rate': 0.017556681457733907, 'max_depth': 30}. Best is trial 13 with value: 0.3830005042566472.
[I 2025-11-27 20:29:11,863] Trial 16 finished with value: 0.38091165423412277 and parameters: {'learning_rate': 0.014875957600766553, 'max_depth': 27}. Best is trial 13 with value: 0.3830005042566472.
[I 2025-11-27 20:29:18,498] Trial 17 finished with value: 0.3844381629007608 and parameters: {'learning_rate': 0.01185866376882842, 'max_depth': 29}. Best is trial 17 with value: 0.3844381629007608.
[I 2025-11-27 20:29:24,901] Trial 18 finished with value: 0.3815170288315901 and parameters: {'learning_rate': 0.010860493712538718, 'max_depth': 26}. Best is trial 17 with value: 0.3844381629007608.
[I 2025-11-27 20:29:31,699] Trial 19 finished with value: 0.38015185256889367 and parameters: {'learning_rate': 0.023525623211415804, 'max_depth': 23}. Best is trial 17 with value: 0.3844381629007608.
[I 2025-11-27 20:29:38,295] Trial 20 finished with value: 0.3809552040468773 and parameters: {'learning_rate': 0.00543086652302287, 'max_depth': 20}. Best is trial 17 with value: 0.3844381629007608.
[I 2025-11-27 20:29:44,593] Trial 21 finished with value: 0.3824614971819892 and parameters: {'learning_rate': 0.011918960539669473, 'max_depth': 30}. Best is trial 17 with value: 0.3844381629007608.
[I 2025-11-27 20:29:51,216] Trial 22 finished with value: 0.37759609211897394 and parameters: {'learning_rate': 0.028000227635197796, 'max_depth': 30}. Best is trial 17 with value: 0.3844381629007608.
[I 2025-11-27 20:29:57,819] Trial 23 finished with value: 0.38320351755244797 and parameters: {'learning_rate': 0.011603967723504766, 'max_depth': 28}. Best is trial 17 with value: 0.3844381629007608.
[I 2025-11-27 20:30:04,379] Trial 24 finished with value: 0.38217549325300204 and parameters: {'learning_rate': 0.010922903887949375, 'max_depth': 27}. Best is trial 17 with value: 0.3844381629007608.
[I 2025-11-27 20:30:10,629] Trial 25 finished with value: 0.38035536843896856 and parameters: {'learning_rate': 0.005292574916625978, 'max_depth': 25}. Best is trial 17 with value: 0.3844381629007608.
[I 2025-11-27 20:30:11,762] Trial 26 finished with value: 0.3813605957777189 and parameters: {'learning_rate': 0.065774216043662, 'max_depth': 2}. Best is trial 17 with value: 0.3844381629007608.
[I 2025-11-27 20:30:18,548] Trial 27 finished with value: 0.3783292784475706 and parameters: {'learning_rate': 0.028421323926641148, 'max_depth': 24}. Best is trial 17 with value: 0.3844381629007608.
[I 2025-11-27 20:30:24,900] Trial 28 finished with value: 0.382063766735988 and parameters: {'learning_rate': 0.009751755951865547, 'max_depth': 28}. Best is trial 17 with value: 0.3844381629007608.
[I 2025-11-27 20:30:31,382] Trial 29 finished with value: 0.38237848122327983 and parameters: {'learning_rate': 0.016154511359402525, 'max_depth': 12}. Best is trial 17 with value: 0.3844381629007608.
[I 2025-11-27 20:30:32,914] A new study created in memory with name: histogram_gradient_boosting_fold_2
[I 2025-11-27 20:30:39,708] Trial 0 finished with value: 0.3783998374913736 and parameters: {'learning_rate': 0.04087025480888836, 'max_depth': 29}. Best is trial 0 with value: 0.3783998374913736.
[I 2025-11-27 20:30:46,952] Trial 1 finished with value: 0.3794605218240363 and parameters: {'learning_rate': 0.03459965969358022, 'max_depth': 30}. Best is trial 1 with value: 0.3794605218240363.
[I 2025-11-27 20:30:53,569] Trial 2 finished with value: 0.37326873189092813 and parameters: {'learning_rate': 0.047738207990507785, 'max_depth': 10}. Best is trial 1 with value: 0.3794605218240363.
[I 2025-11-27 20:31:00,798] Trial 3 finished with value: 0.3796399085056344 and parameters: {'learning_rate': 0.015355144811024209, 'max_depth': 24}. Best is trial 3 with value: 0.3796399085056344.
[I 2025-11-27 20:31:07,753] Trial 4 finished with value: 0.3819014077513193 and parameters: {'learning_rate': 0.022214774376382754, 'max_depth': 12}. Best is trial 4 with value: 0.3819014077513193.
[I 2025-11-27 20:31:14,815] Trial 5 finished with value: 0.35735124183807987 and parameters: {'learning_rate': 0.2615018785375261, 'max_depth': 17}. Best is trial 4 with value: 0.3819014077513193.
[I 2025-11-27 20:31:16,661] Trial 6 finished with value: 0.38387492662855055 and parameters: {'learning_rate': 0.047875177273890054, 'max_depth': 3}. Best is trial 6 with value: 0.38387492662855055.
[I 2025-11-27 20:31:25,286] Trial 7 finished with value: 0.3808570449328055 and parameters: {'learning_rate': 0.0276953398228079, 'max_depth': 28}. Best is trial 6 with value: 0.38387492662855055.
[I 2025-11-27 20:31:35,357] Trial 8 finished with value: 0.38249115205825307 and parameters: {'learning_rate': 0.009219985274020981, 'max_depth': 17}. Best is trial 6 with value: 0.38387492662855055.
[I 2025-11-27 20:31:41,834] Trial 9 finished with value: 0.383109270831892 and parameters: {'learning_rate': 0.010639830142500417, 'max_depth': 23}. Best is trial 6 with value: 0.38387492662855055.
[I 2025-11-27 20:31:43,071] Trial 10 finished with value: 0.3698509127669524 and parameters: {'learning_rate': 0.24845750112458556, 'max_depth': 2}. Best is trial 6 with value: 0.38387492662855055.
[I 2025-11-27 20:31:44,465] Trial 11 finished with value: 0.38196705482994625 and parameters: {'learning_rate': 0.005263855910484268, 'max_depth': 2}. Best is trial 6 with value: 0.38387492662855055.
[I 2025-11-27 20:31:51,451] Trial 12 finished with value: 0.3639551529612387 and parameters: {'learning_rate': 0.11701711637089206, 'max_depth': 22}. Best is trial 6 with value: 0.38387492662855055.
[I 2025-11-27 20:31:57,383] Trial 13 finished with value: 0.36802128251366295 and parameters: {'learning_rate': 0.09552998009546725, 'max_depth': 7}. Best is trial 6 with value: 0.38387492662855055.
[I 2025-11-27 20:32:04,309] Trial 14 finished with value: 0.36435645135804057 and parameters: {'learning_rate': 0.0958612569404162, 'max_depth': 22}. Best is trial 6 with value: 0.38387492662855055.
[I 2025-11-27 20:32:10,722] Trial 15 finished with value: 0.38314279998664935 and parameters: {'learning_rate': 0.011768729386895996, 'max_depth': 13}. Best is trial 6 with value: 0.38387492662855055.
[I 2025-11-27 20:32:17,600] Trial 16 finished with value: 0.3826475001943127 and parameters: {'learning_rate': 0.0050556514588734214, 'max_depth': 6}. Best is trial 6 with value: 0.38387492662855055.
[I 2025-11-27 20:32:29,568] Trial 17 finished with value: 0.37020193002375085 and parameters: {'learning_rate': 0.07011439596044643, 'max_depth': 13}. Best is trial 6 with value: 0.38387492662855055.
[I 2025-11-27 20:32:40,840] Trial 18 finished with value: 0.38184450750856913 and parameters: {'learning_rate': 0.01677877618945339, 'max_depth': 6}. Best is trial 6 with value: 0.38387492662855055.
[I 2025-11-27 20:32:55,418] Trial 19 finished with value: 0.3819622520973788 and parameters: {'learning_rate': 0.009421284685850002, 'max_depth': 10}. Best is trial 6 with value: 0.38387492662855055.
[I 2025-11-27 20:33:08,766] Trial 20 finished with value: 0.3623328386474716 and parameters: {'learning_rate': 0.1496106664465155, 'max_depth': 15}. Best is trial 6 with value: 0.38387492662855055.
[I 2025-11-27 20:33:18,508] Trial 21 finished with value: 0.3333283050177732 and parameters: {'learning_rate': 0.4492254988362935, 'max_depth': 19}. Best is trial 6 with value: 0.38387492662855055.
[I 2025-11-27 20:33:30,252] Trial 22 finished with value: 0.3821396458856512 and parameters: {'learning_rate': 0.009786382956178914, 'max_depth': 26}. Best is trial 6 with value: 0.38387492662855055.
