[I 2025-11-27 21:07:01,554] Trial 10 finished with value: 0.3802853980127522 and parameters: {'learning_rate': 0.024910605531750608, 'max_depth': 30}. Best is trial 0 with value: 0.3845176737466717.
[I 2025-11-27 21:07:16,811] Trial 11 finished with value: 0.3828633328646191 and parameters: {'learning_rate': 0.034162169652359395, 'max_depth': 28}. Best is trial 0 with value: 0.3845176737466717.
[I 2025-11-27 21:07:32,255] Trial 12 finished with value: 0.3828857834164779 and parameters: {'learning_rate': 0.03357271671310543, 'max_depth': 27}. Best is trial 0 with value: 0.3845176737466717.
[I 2025-11-27 21:07:47,352] Trial 13 finished with value: 0.37755076083726935 and parameters: {'learning_rate': 0.021851581813673148, 'max_depth': 24}. Best is trial 0 with value: 0.3845176737466717.
[I 2025-11-27 21:07:59,413] Trial 14 finished with value: 0.38082190109063424 and parameters: {'learning_rate': 0.06280313092974996, 'max_depth': 23}. Best is trial 0 with value: 0.3845176737466717.
[I 2025-11-27 21:08:14,298] Trial 15 finished with value: 0.3828698774321056 and parameters: {'learning_rate': 0.0433110514907914, 'max_depth': 25}. Best is trial 0 with value: 0.3845176737466717.
[I 2025-11-27 21:08:24,197] Trial 16 finished with value: 0.3752094520075878 and parameters: {'learning_rate': 0.11107276742191298, 'max_depth': 21}. Best is trial 0 with value: 0.3845176737466717.
[I 2025-11-27 21:08:32,250] Trial 17 finished with value: 0.3827527251330319 and parameters: {'learning_rate': 0.02605607124929148, 'max_depth': 10}. Best is trial 0 with value: 0.3845176737466717.
[I 2025-11-27 21:08:48,170] Trial 18 finished with value: 0.3793350661226599 and parameters: {'learning_rate': 0.016228470674972975, 'max_depth': 26}. Best is trial 0 with value: 0.3845176737466717.
[I 2025-11-27 21:09:02,577] Trial 19 finished with value: 0.38440698471514334 and parameters: {'learning_rate': 0.04621833675330787, 'max_depth': 30}. Best is trial 0 with value: 0.3845176737466717.
[I 2025-11-27 21:09:11,517] Trial 20 finished with value: 0.3733121075444492 and parameters: {'learning_rate': 0.15089482893600978, 'max_depth': 30}. Best is trial 0 with value: 0.3845176737466717.
[I 2025-11-27 21:09:25,229] Trial 21 finished with value: 0.38155433487346924 and parameters: {'learning_rate': 0.04803894622267912, 'max_depth': 27}. Best is trial 0 with value: 0.3845176737466717.
[I 2025-11-27 21:09:39,681] Trial 22 finished with value: 0.3828621237838445 and parameters: {'learning_rate': 0.03494782286398567, 'max_depth': 21}. Best is trial 0 with value: 0.3845176737466717.
[I 2025-11-27 21:09:56,394] Trial 23 finished with value: 0.37956287254511406 and parameters: {'learning_rate': 0.019126085110334336, 'max_depth': 28}. Best is trial 0 with value: 0.3845176737466717.
[I 2025-11-27 21:10:08,873] Trial 24 finished with value: 0.38168200547947884 and parameters: {'learning_rate': 0.055368153111194834, 'max_depth': 22}. Best is trial 0 with value: 0.3845176737466717.
[I 2025-11-27 21:10:23,695] Trial 25 finished with value: 0.3805216592554973 and parameters: {'learning_rate': 0.033246768921394346, 'max_depth': 30}. Best is trial 0 with value: 0.3845176737466717.
[I 2025-11-27 21:10:34,709] Trial 26 finished with value: 0.37879641563983857 and parameters: {'learning_rate': 0.09100994189357423, 'max_depth': 25}. Best is trial 0 with value: 0.3845176737466717.
[I 2025-11-27 21:10:50,006] Trial 27 finished with value: 0.3789486066162935 and parameters: {'learning_rate': 0.01589438240696734, 'max_depth': 20}. Best is trial 0 with value: 0.3845176737466717.
[I 2025-11-27 21:10:59,876] Trial 28 finished with value: 0.37965685201536503 and parameters: {'learning_rate': 0.12662248101780482, 'max_depth': 28}. Best is trial 0 with value: 0.3845176737466717.
