[I 2025-11-27 06:00:41,274] Trial 17 finished with value: 0.37862384180771236 and parameters: {'min_samples_leaf': 42, 'max_features': 'log2', 'max_depth': 23}. Best is trial 0 with value: 0.3787150960857208.
[I 2025-11-27 06:00:42,350] Trial 18 finished with value: 0.3769389679589469 and parameters: {'min_samples_leaf': 45, 'max_features': 'log2', 'max_depth': 38}. Best is trial 0 with value: 0.3787150960857208.
[I 2025-11-27 06:00:43,427] Trial 19 finished with value: 0.37798283844611136 and parameters: {'min_samples_leaf': 42, 'max_features': 'log2', 'max_depth': 44}. Best is trial 0 with value: 0.3787150960857208.
[I 2025-11-27 06:00:44,667] Trial 20 finished with value: 0.3797142597476507 and parameters: {'min_samples_leaf': 50, 'max_features': 'sqrt', 'max_depth': 20}. Best is trial 20 with value: 0.3797142597476507.
[I 2025-11-27 06:00:45,899] Trial 21 finished with value: 0.3755471208703253 and parameters: {'min_samples_leaf': 50, 'max_features': 'sqrt', 'max_depth': 20}. Best is trial 20 with value: 0.3797142597476507.
[I 2025-11-27 06:00:47,146] Trial 22 finished with value: 0.37638319640278095 and parameters: {'min_samples_leaf': 42, 'max_features': 'sqrt', 'max_depth': 23}. Best is trial 20 with value: 0.3797142597476507.
[I 2025-11-27 06:00:48,419] Trial 23 finished with value: 0.3798796555234579 and parameters: {'min_samples_leaf': 40, 'max_features': 'sqrt', 'max_depth': 26}. Best is trial 23 with value: 0.3798796555234579.
[I 2025-11-27 06:00:49,711] Trial 24 finished with value: 0.376258463431653 and parameters: {'min_samples_leaf': 30, 'max_features': 'sqrt', 'max_depth': 11}. Best is trial 23 with value: 0.3798796555234579.
[I 2025-11-27 06:00:50,976] Trial 25 finished with value: 0.37767048415191634 and parameters: {'min_samples_leaf': 46, 'max_features': 'sqrt', 'max_depth': 28}. Best is trial 23 with value: 0.3798796555234579.
[I 2025-11-27 06:00:52,248] Trial 26 finished with value: 0.3765483831380369 and parameters: {'min_samples_leaf': 39, 'max_features': 'sqrt', 'max_depth': 26}. Best is trial 23 with value: 0.3798796555234579.
[I 2025-11-27 06:00:53,596] Trial 27 finished with value: 0.376978808546413 and parameters: {'min_samples_leaf': 23, 'max_features': 'sqrt', 'max_depth': 12}. Best is trial 23 with value: 0.3798796555234579.
[I 2025-11-27 06:00:54,967] Trial 28 finished with value: 0.37708837660294586 and parameters: {'min_samples_leaf': 33, 'max_features': 'sqrt', 'max_depth': 33}. Best is trial 23 with value: 0.3798796555234579.
[I 2025-11-27 06:00:57,792] Trial 29 finished with value: 0.373322032042369 and parameters: {'min_samples_leaf': 15, 'max_features': 0.3, 'max_depth': 49}. Best is trial 23 with value: 0.3798796555234579.
[I 2025-11-27 06:01:23,677] A new study created in memory with name: gradient_boosting_fold_1
[I 2025-11-27 06:08:10,312] Trial 0 finished with value: 0.3720833367709842 and parameters: {'learning_rate': 0.017361227740532226, 'max_depth': 13}. Best is trial 0 with value: 0.3720833367709842.
[I 2025-11-27 06:19:40,432] Trial 1 finished with value: 0.3554091316031659 and parameters: {'learning_rate': 0.010138728991690313, 'max_depth': 23}. Best is trial 0 with value: 0.3720833367709842.
[I 2025-11-27 06:25:51,324] Trial 2 finished with value: 0.37404097308612994 and parameters: {'learning_rate': 0.04000141704354786, 'max_depth': 12}. Best is trial 2 with value: 0.37404097308612994.
[I 2025-11-27 06:33:26,716] Trial 3 finished with value: 0.3625942393936906 and parameters: {'learning_rate': 0.03603430599665458, 'max_depth': 15}. Best is trial 2 with value: 0.37404097308612994.
[I 2025-11-27 06:44:19,966] Trial 4 finished with value: 0.3566606475221309 and parameters: {'learning_rate': 0.027058280348106208, 'max_depth': 22}. Best is trial 2 with value: 0.37404097308612994.
[I 2025-11-27 06:48:10,216] Trial 5 finished with value: 0.375848306664156 and parameters: {'learning_rate': 0.010033171864530286, 'max_depth': 7}. Best is trial 5 with value: 0.375848306664156.
[I 2025-11-27 06:49:18,194] Trial 6 finished with value: 0.37965717211134453 and parameters: {'learning_rate': 0.008349414285979977, 'max_depth': 2}. Best is trial 6 with value: 0.37965717211134453.
[I 2025-11-27 07:01:14,654] Trial 7 finished with value: 0.355885900776315 and parameters: {'learning_rate': 0.006294189022602011, 'max_depth': 24}. Best is trial 6 with value: 0.37965717211134453.
[I 2025-11-27 07:04:33,167] Trial 8 finished with value: 0.3817696652413169 and parameters: {'learning_rate': 0.010723492812507703, 'max_depth': 6}. Best is trial 8 with value: 0.3817696652413169.
[I 2025-11-27 07:18:52,616] Trial 9 finished with value: 0.348629570524438 and parameters: {'learning_rate': 0.031122221443724247, 'max_depth': 30}. Best is trial 8 with value: 0.3817696652413169.
[I 2025-11-27 07:20:00,507] Trial 10 finished with value: 0.38289539014927787 and parameters: {'learning_rate': 0.08958399678174203, 'max_depth': 2}. Best is trial 10 with value: 0.38289539014927787.
[I 2025-11-27 07:21:08,103] Trial 11 finished with value: 0.37992753240330174 and parameters: {'learning_rate': 0.09978006565808076, 'max_depth': 2}. Best is trial 10 with value: 0.38289539014927787.
[I 2025-11-27 07:24:56,223] Trial 12 finished with value: 0.37732313398331024 and parameters: {'learning_rate': 0.01782004487530042, 'max_depth': 7}. Best is trial 10 with value: 0.38289539014927787.
[I 2025-11-27 07:29:12,657] Trial 13 finished with value: 0.37405351456435504 and parameters: {'learning_rate': 0.06770663374378641, 'max_depth': 8}. Best is trial 10 with value: 0.38289539014927787.
[I 2025-11-27 07:30:20,351] Trial 14 finished with value: 0.38453039349095797 and parameters: {'learning_rate': 0.058634402227921725, 'max_depth': 2}. Best is trial 14 with value: 0.38453039349095797.
[I 2025-11-27 07:31:28,255] Trial 15 finished with value: 0.3850033280337827 and parameters: {'learning_rate': 0.06257338891116204, 'max_depth': 2}. Best is trial 15 with value: 0.3850033280337827.
[I 2025-11-27 07:37:10,034] Trial 16 finished with value: 0.3734056699963107 and parameters: {'learning_rate': 0.05386404993364088, 'max_depth': 11}. Best is trial 15 with value: 0.3850033280337827.
[I 2025-11-27 07:46:29,950] Trial 17 finished with value: 0.3598276412816359 and parameters: {'learning_rate': 0.0552284232343232, 'max_depth': 19}. Best is trial 15 with value: 0.3850033280337827.
[I 2025-11-27 07:51:15,031] Trial 18 finished with value: 0.36708523233146667 and parameters: {'learning_rate': 0.06814029750764189, 'max_depth': 9}. Best is trial 15 with value: 0.3850033280337827.
[I 2025-11-27 07:53:27,887] Trial 19 finished with value: 0.38633418099298406 and parameters: {'learning_rate': 0.04518309794503315, 'max_depth': 4}. Best is trial 19 with value: 0.38633418099298406.
[I 2025-11-27 07:56:12,950] Trial 20 finished with value: 0.38467758530332385 and parameters: {'learning_rate': 0.04300092523687697, 'max_depth': 5}. Best is trial 19 with value: 0.38633418099298406.
[I 2025-11-27 07:58:58,429] Trial 21 finished with value: 0.38483602453938254 and parameters: {'learning_rate': 0.041243765116815864, 'max_depth': 5}. Best is trial 19 with value: 0.38633418099298406.
[I 2025-11-27 08:01:44,525] Trial 22 finished with value: 0.3873035736362634 and parameters: {'learning_rate': 0.023613974294809405, 'max_depth': 5}. Best is trial 22 with value: 0.3873035736362634.
[I 2025-11-27 08:03:58,564] Trial 23 finished with value: 0.3879509546187034 and parameters: {'learning_rate': 0.022046720685747003, 'max_depth': 4}. Best is trial 23 with value: 0.3879509546187034.
[I 2025-11-27 08:09:18,792] Trial 24 finished with value: 0.37465072664149096 and parameters: {'learning_rate': 0.020501896587097865, 'max_depth': 10}. Best is trial 23 with value: 0.3879509546187034.
[I 2025-11-27 08:12:05,244] Trial 25 finished with value: 0.38705718534868083 and parameters: {'learning_rate': 0.013541909253471552, 'max_depth': 5}. Best is trial 23 with value: 0.3879509546187034.
[I 2025-11-27 08:20:20,228] Trial 26 finished with value: 0.3648838279565654 and parameters: {'learning_rate': 0.014684959659692442, 'max_depth': 16}. Best is trial 23 with value: 0.3879509546187034.
[I 2025-11-27 08:27:31,424] Trial 27 finished with value: 0.36764860901091706 and parameters: {'learning_rate': 0.026560310463438354, 'max_depth': 14}. Best is trial 23 with value: 0.3879509546187034.
[I 2025-11-27 08:36:41,463] Trial 28 finished with value: 0.3620926547001099 and parameters: {'learning_rate': 0.013882371384104059, 'max_depth': 18}. Best is trial 23 with value: 0.3879509546187034.
[I 2025-11-27 08:41:30,549] Trial 29 finished with value: 0.37631434674284503 and parameters: {'learning_rate': 0.021337751303996018, 'max_depth': 9}. Best is trial 23 with value: 0.3879509546187034.
[I 2025-11-27 08:42:04,685] A new study created in memory with name: gradient_boosting_fold_2
[I 2025-11-27 08:48:30,810] Trial 0 finished with value: 0.3806157476261883 and parameters: {'learning_rate': 0.0068508275736115795, 'max_depth': 12}. Best is trial 0 with value: 0.3806157476261883.
[I 2025-11-27 09:00:01,468] Trial 1 finished with value: 0.3690120875819746 and parameters: {'learning_rate': 0.010908398372245207, 'max_depth': 23}. Best is trial 0 with value: 0.3806157476261883.
[I 2025-11-27 09:04:25,787] Trial 2 finished with value: 0.38565050973769865 and parameters: {'learning_rate': 0.009803496252978331, 'max_depth': 8}. Best is trial 2 with value: 0.38565050973769865.
[I 2025-11-27 09:08:42,497] Trial 3 finished with value: 0.3811156147827125 and parameters: {'learning_rate': 0.062468009324976356, 'max_depth': 8}. Best is trial 2 with value: 0.38565050973769865.
[I 2025-11-27 09:18:56,334] Trial 4 finished with value: 0.37358221599228403 and parameters: {'learning_rate': 0.005703312447959275, 'max_depth': 20}. Best is trial 2 with value: 0.38565050973769865.
[I 2025-11-27 09:25:57,527] Trial 5 finished with value: 0.3659110332153426 and parameters: {'learning_rate': 0.08860431663280906, 'max_depth': 14}. Best is trial 2 with value: 0.38565050973769865.
[I 2025-11-27 09:29:17,487] Trial 6 finished with value: 0.38863935700318547 and parameters: {'learning_rate': 0.009998106642918234, 'max_depth': 6}. Best is trial 6 with value: 0.38863935700318547.
[I 2025-11-27 09:36:32,984] Trial 7 finished with value: 0.3762339711550742 and parameters: {'learning_rate': 0.018971152259358054, 'max_depth': 14}. Best is trial 6 with value: 0.38863935700318547.
[I 2025-11-27 09:44:18,801] Trial 8 finished with value: 0.3763951823683619 and parameters: {'learning_rate': 0.015976007762435667, 'max_depth': 15}. Best is trial 6 with value: 0.38863935700318547.
[I 2025-11-27 09:49:58,809] Trial 9 finished with value: 0.3652581125147001 and parameters: {'learning_rate': 0.092375680897729, 'max_depth': 11}. Best is trial 6 with value: 0.38863935700318547.
[I 2025-11-27 09:51:06,540] Trial 10 finished with value: 0.3880384106856407 and parameters: {'learning_rate': 0.039628802297436816, 'max_depth': 2}. Best is trial 6 with value: 0.38863935700318547.
[I 2025-11-27 09:52:14,627] Trial 11 finished with value: 0.38791554008525003 and parameters: {'learning_rate': 0.03861249931393762, 'max_depth': 2}. Best is trial 6 with value: 0.38863935700318547.
[I 2025-11-27 09:53:55,152] Trial 12 finished with value: 0.39339079674833216 and parameters: {'learning_rate': 0.033727288051493644, 'max_depth': 3}. Best is trial 12 with value: 0.39339079674833216.
[I 2025-11-27 10:07:49,286] Trial 13 finished with value: 0.3662576998776631 and parameters: {'learning_rate': 0.032557826499197765, 'max_depth': 29}. Best is trial 12 with value: 0.39339079674833216.
[I 2025-11-27 10:11:06,121] Trial 14 finished with value: 0.38891099556173814 and parameters: {'learning_rate': 0.022802343898513985, 'max_depth': 6}. Best is trial 12 with value: 0.39339079674833216.
[I 2025-11-27 10:13:50,891] Trial 15 finished with value: 0.3942580244583091 and parameters: {'learning_rate': 0.027106626472814123, 'max_depth': 5}. Best is trial 15 with value: 0.3942580244583091.
[I 2025-11-27 10:23:19,815] Trial 16 finished with value: 0.36984575535398545 and parameters: {'learning_rate': 0.028546132003221696, 'max_depth': 19}. Best is trial 15 with value: 0.3942580244583091.
[I 2025-11-27 10:25:32,380] Trial 17 finished with value: 0.3876544580786125 and parameters: {'learning_rate': 0.05304678649327179, 'max_depth': 4}. Best is trial 15 with value: 0.3942580244583091.
[I 2025-11-27 10:30:48,457] Trial 18 finished with value: 0.37949051067460404 and parameters: {'learning_rate': 0.0536979674110934, 'max_depth': 10}. Best is trial 15 with value: 0.3942580244583091.
[I 2025-11-27 10:33:34,323] Trial 19 finished with value: 0.3950825116672326 and parameters: {'learning_rate': 0.013977646696354255, 'max_depth': 5}. Best is trial 19 with value: 0.3950825116672326.
[I 2025-11-27 10:47:34,379] Trial 20 finished with value: 0.36624291548325305 and parameters: {'learning_rate': 0.01469423243175614, 'max_depth': 29}. Best is trial 19 with value: 0.3950825116672326.
[I 2025-11-27 10:50:19,777] Trial 21 finished with value: 0.3960359149632156 and parameters: {'learning_rate': 0.022403171265023114, 'max_depth': 5}. Best is trial 21 with value: 0.3960359149632156.
[I 2025-11-27 10:53:36,323] Trial 22 finished with value: 0.3894867828268194 and parameters: {'learning_rate': 0.023878624834988125, 'max_depth': 6}. Best is trial 21 with value: 0.3960359149632156.
[I 2025-11-27 10:57:57,367] Trial 23 finished with value: 0.3877615482610482 and parameters: {'learning_rate': 0.013841335297427246, 'max_depth': 8}. Best is trial 21 with value: 0.3960359149632156.
[I 2025-11-27 11:00:42,710] Trial 24 finished with value: 0.3958041346997886 and parameters: {'learning_rate': 0.019667823614371156, 'max_depth': 5}. Best is trial 21 with value: 0.3960359149632156.
[I 2025-11-27 11:05:32,615] Trial 25 finished with value: 0.3859144527817265 and parameters: {'learning_rate': 0.01883606062697365, 'max_depth': 9}. Best is trial 21 with value: 0.3960359149632156.
[I 2025-11-27 11:14:46,207] Trial 26 finished with value: 0.37397213655056477 and parameters: {'learning_rate': 0.012401639251782958, 'max_depth': 18}. Best is trial 21 with value: 0.3960359149632156.
[I 2025-11-27 11:27:09,392] Trial 27 finished with value: 0.3659080422241926 and parameters: {'learning_rate': 0.007308969956612155, 'max_depth': 25}. Best is trial 21 with value: 0.3960359149632156.
[I 2025-11-27 11:33:28,570] Trial 28 finished with value: 0.37932619737809287 and parameters: {'learning_rate': 0.01906300540844702, 'max_depth': 12}. Best is trial 21 with value: 0.3960359149632156.
[I 2025-11-27 11:36:15,203] Trial 29 finished with value: 0.3922803137234436 and parameters: {'learning_rate': 0.007693995314842231, 'max_depth': 5}. Best is trial 21 with value: 0.3960359149632156.
[I 2025-11-27 11:36:57,294] A new study created in memory with name: gradient_boosting_fold_3
[I 2025-11-27 11:39:09,995] Trial 0 finished with value: 0.37950776029452793 and parameters: {'learning_rate': 0.020872150850426686, 'max_depth': 4}. Best is trial 0 with value: 0.37950776029452793.
[I 2025-11-27 11:50:27,901] Trial 1 finished with value: 0.3609514328425628 and parameters: {'learning_rate': 0.027470904479747232, 'max_depth': 23}. Best is trial 0 with value: 0.37950776029452793.
[I 2025-11-27 12:03:37,506] Trial 2 finished with value: 0.35744054286424776 and parameters: {'learning_rate': 0.013069803100635597, 'max_depth': 27}. Best is trial 0 with value: 0.37950776029452793.
[I 2025-11-27 12:09:17,784] Trial 3 finished with value: 0.3674084135384604 and parameters: {'learning_rate': 0.0661875475430356, 'max_depth': 11}. Best is trial 0 with value: 0.37950776029452793.
[I 2025-11-27 12:19:29,218] Trial 4 finished with value: 0.3633074152821988 and parameters: {'learning_rate': 0.00594404566129157, 'max_depth': 20}. Best is trial 0 with value: 0.37950776029452793.
[I 2025-11-27 12:33:16,847] Trial 5 finished with value: 0.35691112099054156 and parameters: {'learning_rate': 0.04905425598182868, 'max_depth': 29}. Best is trial 0 with value: 0.37950776029452793.
[I 2025-11-27 12:45:15,847] Trial 6 finished with value: 0.3605486151329673 and parameters: {'learning_rate': 0.007877724906344368, 'max_depth': 24}. Best is trial 0 with value: 0.37950776029452793.
[I 2025-11-27 12:50:27,925] Trial 7 finished with value: 0.37733265342528 and parameters: {'learning_rate': 0.0129689871176264, 'max_depth': 9}. Best is trial 0 with value: 0.37950776029452793.
[I 2025-11-27 13:02:11,487] Trial 8 finished with value: 0.3622472079124702 and parameters: {'learning_rate': 0.012367327162892678, 'max_depth': 23}. Best is trial 0 with value: 0.37950776029452793.
[I 2025-11-27 13:16:06,053] Trial 9 finished with value: 0.3601824115568276 and parameters: {'learning_rate': 0.009587405619028044, 'max_depth': 29}. Best is trial 0 with value: 0.37950776029452793.
[I 2025-11-27 13:17:13,834] Trial 10 finished with value: 0.37936950317271323 and parameters: {'learning_rate': 0.028445414227074226, 'max_depth': 2}. Best is trial 0 with value: 0.37950776029452793.
[I 2025-11-27 13:18:21,811] Trial 11 finished with value: 0.37993514535740347 and parameters: {'learning_rate': 0.028613723932031463, 'max_depth': 2}. Best is trial 11 with value: 0.37993514535740347.
[I 2025-11-27 13:20:02,333] Trial 12 finished with value: 0.3814851781355709 and parameters: {'learning_rate': 0.03854916735093956, 'max_depth': 3}. Best is trial 12 with value: 0.3814851781355709.
[I 2025-11-27 13:24:47,606] Trial 13 finished with value: 0.3742752320926226 and parameters: {'learning_rate': 0.0415275386370302, 'max_depth': 9}. Best is trial 12 with value: 0.3814851781355709.
[I 2025-11-27 13:27:32,235] Trial 14 finished with value: 0.3761104025648116 and parameters: {'learning_rate': 0.09952262655819773, 'max_depth': 5}. Best is trial 12 with value: 0.3814851781355709.
[I 2025-11-27 13:35:11,940] Trial 15 finished with value: 0.3637807127072993 and parameters: {'learning_rate': 0.022026941218234373, 'max_depth': 15}. Best is trial 12 with value: 0.3814851781355709.
[I 2025-11-27 13:38:27,302] Trial 16 finished with value: 0.3830135177157006 and parameters: {'learning_rate': 0.04884893703613933, 'max_depth': 6}. Best is trial 16 with value: 0.3830135177157006.
[I 2025-11-27 13:45:30,596] Trial 17 finished with value: 0.36153291369134133 and parameters: {'learning_rate': 0.052578625547257354, 'max_depth': 14}. Best is trial 16 with value: 0.3830135177157006.
[I 2025-11-27 13:49:15,631] Trial 18 finished with value: 0.37545267463921084 and parameters: {'learning_rate': 0.07686365274833257, 'max_depth': 7}. Best is trial 16 with value: 0.3830135177157006.
[I 2025-11-27 13:55:25,583] Trial 19 finished with value: 0.3667353555649177 and parameters: {'learning_rate': 0.03893426653693392, 'max_depth': 12}. Best is trial 16 with value: 0.3830135177157006.
[I 2025-11-27 14:04:32,559] Trial 20 finished with value: 0.36126613711818056 and parameters: {'learning_rate': 0.01714663577149627, 'max_depth': 18}. Best is trial 16 with value: 0.3830135177157006.
[I 2025-11-27 14:05:40,350] Trial 21 finished with value: 0.3791324045375896 and parameters: {'learning_rate': 0.03229452110488363, 'max_depth': 2}. Best is trial 16 with value: 0.3830135177157006.
[I 2025-11-27 14:08:55,414] Trial 22 finished with value: 0.3803335656434125 and parameters: {'learning_rate': 0.06081156631777999, 'max_depth': 6}. Best is trial 16 with value: 0.3830135177157006.
[I 2025-11-27 14:12:10,100] Trial 23 finished with value: 0.37903371371694944 and parameters: {'learning_rate': 0.06460439391753155, 'max_depth': 6}. Best is trial 16 with value: 0.3830135177157006.
[I 2025-11-27 14:16:24,491] Trial 24 finished with value: 0.3709975671295995 and parameters: {'learning_rate': 0.09743897403021569, 'max_depth': 8}. Best is trial 16 with value: 0.3830135177157006.
[I 2025-11-27 14:22:05,461] Trial 25 finished with value: 0.3664785641187264 and parameters: {'learning_rate': 0.05375136821377952, 'max_depth': 11}. Best is trial 16 with value: 0.3830135177157006.
[I 2025-11-27 14:24:50,026] Trial 26 finished with value: 0.3817959290644212 and parameters: {'learning_rate': 0.039320304511014585, 'max_depth': 5}. Best is trial 16 with value: 0.3830135177157006.
[I 2025-11-27 14:27:02,761] Trial 27 finished with value: 0.38059998449479393 and parameters: {'learning_rate': 0.038426130166923214, 'max_depth': 4}. Best is trial 16 with value: 0.3830135177157006.
[I 2025-11-27 14:33:42,050] Trial 28 finished with value: 0.36523982478875916 and parameters: {'learning_rate': 0.04169440642197589, 'max_depth': 13}. Best is trial 16 with value: 0.3830135177157006.
[I 2025-11-27 14:35:55,079] Trial 29 finished with value: 0.37975754764328745 and parameters: {'learning_rate': 0.01730057079342415, 'max_depth': 4}. Best is trial 16 with value: 0.3830135177157006.
[I 2025-11-27 14:36:45,276] A new study created in memory with name: gradient_boosting_fold_4
[I 2025-11-27 14:48:03,453] Trial 0 finished with value: 0.3601983105996051 and parameters: {'learning_rate': 0.027585474512780775, 'max_depth': 23}. Best is trial 0 with value: 0.3601983105996051.
[I 2025-11-27 15:02:16,139] Trial 1 finished with value: 0.3573145582230404 and parameters: {'learning_rate': 0.025445908563708493, 'max_depth': 30}. Best is trial 0 with value: 0.3601983105996051.
[I 2025-11-27 15:08:51,779] Trial 2 finished with value: 0.3580439520443058 and parameters: {'learning_rate': 0.07724246585669059, 'max_depth': 13}. Best is trial 0 with value: 0.3601983105996051.
[I 2025-11-27 15:16:12,797] Trial 3 finished with value: 0.37026502111454074 and parameters: {'learning_rate': 0.008414299215387661, 'max_depth': 14}. Best is trial 3 with value: 0.37026502111454074.
[I 2025-11-27 15:26:03,194] Trial 4 finished with value: 0.35729525937154216 and parameters: {'learning_rate': 0.051581238963784415, 'max_depth': 20}. Best is trial 3 with value: 0.37026502111454074.
