[I 2025-11-27 20:47:53,953] Trial 29 finished with value: 0.3846442036583216 and parameters: {'learning_rate': 0.01902898776541015, 'max_depth': 22}. Best is trial 14 with value: 0.3861836081622122.
CLASSIFICAÇÃO DE GENES-ALVO USANDO DADOS ÔMICOS
================================================================================
Timestamp do experimento: 20251127_044704
 Usando dados da ANA:
   Features: data/UNION_features.tsv
   Labels: data/processed/UNION_labels.tsv
   Formato labels: genes, 2class (binary), 3class (multiclass)

Arquivos encontrados com sucesso!
Carregando e preparando dados...
============================================================
PREPARANDO DATASET PARA CLASSIFICAÇÃO (MULTICLASS)
============================================================
Carregando UNION_features.tsv
Features carregadas: 19602 genes x 64 features
Tipos de dados das features: {dtype('float64'): 64}
Range das features: [0.0000, 1.0000]
----------------------------------------
Carregando UNION_labels.tsv (classificação: multiclass)
Labels carregados: 19680 genes
Valores únicos em 3class: label
0.0    16727
NaN     1997
1.0      515
2.0      441
Name: count, dtype: int64
Genes with NaN dropped: 1997
Distribuição das classes:
  Classe 0 (passenger): 16727 genes
  Classe 1 (TSG): 515 genes
  Classe 2 (Oncogene): 441 genes
----------------------------------------
Alinhando features e labels
Genes comuns entre features e labels: 17676
Dataset final: 17676 genes x 64 features
Distribuição final das classes: [16727   514   435]
----------------------------------------
DATASET PREPARADO COM SUCESSO!
Shape final: X=(17676, 64), y=(17676,)
Genes: 17676
Features: 64
============================================================

CONFIGURAÇÃO DO EXPERIMENTO (OTIMIZAÇÃO):
  Executando: Todos os modelos
  Trials por modelo: 30
  Tipo: multiclass
  Parâmetros: Reduzido
INICIANDO EXPERIMENTAÇÃO COM TODOS OS MODELOS
Dataset: 17676 amostras x 64 features
Número de trials por modelo: 30
Conjunto de parâmetros: Reduzido
Progresso: 1/9 modelos
================================================================================
EXECUTANDO MODELO: Decision Tree
================================================================================

Starting Nested Cross-Validation for decision_tree...
Configuration: 5 outer folds, 30 trials per fold
Performing 80/20 holdout split...
Holdout split completed:
  - Training set: 14140 samples (80%)
  - Holdout test set: 3536 samples (20%)
Fold 1
Importâncias dos parâmetros para fold 1: {'max_depth': np.float64(0.9722348359405119), 'min_samples_split': np.float64(0.027765164059488184)}
Saved Optuna plots to results/20251127_044704_ana_optimized_multiclass/decision_tree/optuna_plots
Fold 2
Importâncias dos parâmetros para fold 2: {'max_depth': np.float64(0.8095373584039532), 'min_samples_split': np.float64(0.1904626415960467)}
Saved Optuna plots to results/20251127_044704_ana_optimized_multiclass/decision_tree/optuna_plots
Fold 3
Importâncias dos parâmetros para fold 3: {'max_depth': np.float64(0.9519547950329559), 'min_samples_split': np.float64(0.04804520496704413)}
Saved Optuna plots to results/20251127_044704_ana_optimized_multiclass/decision_tree/optuna_plots
Fold 4
Importâncias dos parâmetros para fold 4: {'max_depth': np.float64(0.7516376244045464), 'min_samples_split': np.float64(0.24836237559545357)}
Saved Optuna plots to results/20251127_044704_ana_optimized_multiclass/decision_tree/optuna_plots
Fold 5
Importâncias dos parâmetros para fold 5: {'max_depth': np.float64(0.9273241334049972), 'min_samples_split': np.float64(0.07267586659500279)}
Saved Optuna plots to results/20251127_044704_ana_optimized_multiclass/decision_tree/optuna_plots

Nested CV completed. The 20% holdout set (3536 samples) remains untouched.
This holdout set can be used for final unbiased evaluation.

Training and evaluating 5 best parameter sets on holdout data...
Evaluating fold 1 best params on holdout set...
Evaluating fold 2 best params on holdout set...
Evaluating fold 3 best params on holdout set...
Evaluating fold 4 best params on holdout set...
Evaluating fold 5 best params on holdout set...
Saving optimization and holdout results...
Detailed results by fold saved to: ./results/20251127_044704_ana_optimized_multiclass/decision_tree/detailed_results_by_fold.txt
Test predictions for all folds saved to: ./results/20251127_044704_ana_optimized_multiclass/decision_tree/metrics.json
Saving holdout results...
Holdout evaluation results saved to: ./results/20251127_044704_ana_optimized_multiclass/decision_tree/holdout_results.txt
Saved!
✓ Decision Tree executado com sucesso!
Progresso: 2/9 modelos
================================================================================
EXECUTANDO MODELO: K-Nearest Neighbors
================================================================================

Starting Nested Cross-Validation for k_nearest_neighbors...
Configuration: 5 outer folds, 30 trials per fold
Performing 80/20 holdout split...
Holdout split completed:
  - Training set: 14140 samples (80%)
  - Holdout test set: 3536 samples (20%)
Fold 1
Importâncias dos parâmetros para fold 1: {'n_neighbors': np.float64(0.961607630999538), 'p': np.float64(0.03839236900046192)}
Saved Optuna plots to results/20251127_044704_ana_optimized_multiclass/k_nearest_neighbors/optuna_plots
Fold 2
Importâncias dos parâmetros para fold 2: {'n_neighbors': np.float64(0.8195394237976362), 'p': np.float64(0.1804605762023638)}
Saved Optuna plots to results/20251127_044704_ana_optimized_multiclass/k_nearest_neighbors/optuna_plots
Fold 3
Importâncias dos parâmetros para fold 3: {'n_neighbors': np.float64(0.9683631500484488), 'p': np.float64(0.03163684995155125)}
Saved Optuna plots to results/20251127_044704_ana_optimized_multiclass/k_nearest_neighbors/optuna_plots
Fold 4
Importâncias dos parâmetros para fold 4: {'n_neighbors': np.float64(0.7417593709520139), 'p': np.float64(0.25824062904798606)}
Saved Optuna plots to results/20251127_044704_ana_optimized_multiclass/k_nearest_neighbors/optuna_plots
Fold 5
Importâncias dos parâmetros para fold 5: {'n_neighbors': np.float64(0.7970326402513042), 'p': np.float64(0.20296735974869584)}
Saved Optuna plots to results/20251127_044704_ana_optimized_multiclass/k_nearest_neighbors/optuna_plots

Nested CV completed. The 20% holdout set (3536 samples) remains untouched.
This holdout set can be used for final unbiased evaluation.

Training and evaluating 5 best parameter sets on holdout data...
Evaluating fold 1 best params on holdout set...
Evaluating fold 2 best params on holdout set...
Evaluating fold 3 best params on holdout set...
Evaluating fold 4 best params on holdout set...
Evaluating fold 5 best params on holdout set...
Saving optimization and holdout results...
Detailed results by fold saved to: ./results/20251127_044704_ana_optimized_multiclass/k_nearest_neighbors/detailed_results_by_fold.txt
Test predictions for all folds saved to: ./results/20251127_044704_ana_optimized_multiclass/k_nearest_neighbors/metrics.json
Saving holdout results...
Holdout evaluation results saved to: ./results/20251127_044704_ana_optimized_multiclass/k_nearest_neighbors/holdout_results.txt
Saved!
✓ K-Nearest Neighbors executado com sucesso!
Progresso: 3/9 modelos
================================================================================
EXECUTANDO MODELO: Support Vector Classifier
================================================================================

Starting Nested Cross-Validation for svc...
Configuration: 5 outer folds, 5 trials per fold
Performing 80/20 holdout split...
Holdout split completed:
  - Training set: 14140 samples (80%)
  - Holdout test set: 3536 samples (20%)
Fold 1
Importâncias dos parâmetros para fold 1: {'kernel': np.float64(1.0)}
Saved Optuna plots to results/20251127_044704_ana_optimized_multiclass/svc/optuna_plots
Fold 2
Importâncias dos parâmetros para fold 2: {'kernel': np.float64(1.0)}
Saved Optuna plots to results/20251127_044704_ana_optimized_multiclass/svc/optuna_plots
Fold 3
Importâncias dos parâmetros para fold 3: {'kernel': np.float64(1.0)}
Saved Optuna plots to results/20251127_044704_ana_optimized_multiclass/svc/optuna_plots
Fold 4
Importâncias dos parâmetros para fold 4: {'kernel': np.float64(1.0)}
Saved Optuna plots to results/20251127_044704_ana_optimized_multiclass/svc/optuna_plots[I 2025-11-27 20:48:07,131] A new study created in memory with name: multi_layer_perceptron_fold_1
[I 2025-11-27 20:48:09,988] Trial 0 finished with value: 0.38140671539853965 and parameters: {'layer_0_size': 390, 'activation': 'logistic', 'max_iter': 165}. Best is trial 0 with value: 0.38140671539853965.
[I 2025-11-27 20:48:12,301] Trial 1 finished with value: 0.3636987311879181 and parameters: {'layer_0_size': 357, 'activation': 'relu', 'max_iter': 953}. Best is trial 0 with value: 0.38140671539853965.
[I 2025-11-27 20:48:13,781] Trial 2 finished with value: 0.37987499065680125 and parameters: {'layer_0_size': 164, 'activation': 'tanh', 'max_iter': 1180}. Best is trial 0 with value: 0.38140671539853965.
[I 2025-11-27 20:48:16,472] Trial 3 finished with value: 0.35992427504492575 and parameters: {'layer_0_size': 314, 'activation': 'relu', 'max_iter': 955}. Best is trial 0 with value: 0.38140671539853965.
[I 2025-11-27 20:48:18,095] Trial 4 finished with value: 0.3781867918095879 and parameters: {'layer_0_size': 199, 'activation': 'logistic', 'max_iter': 555}. Best is trial 0 with value: 0.38140671539853965.
[I 2025-11-27 20:48:20,125] Trial 5 finished with value: 0.3636779811261549 and parameters: {'layer_0_size': 292, 'activation': 'relu', 'max_iter': 1466}. Best is trial 0 with value: 0.38140671539853965.
[I 2025-11-27 20:48:21,122] Trial 6 finished with value: 0.35330380683917395 and parameters: {'layer_0_size': 83, 'activation': 'relu', 'max_iter': 358}. Best is trial 0 with value: 0.38140671539853965.
[I 2025-11-27 20:48:22,187] Trial 7 finished with value: 0.3767485932582463 and parameters: {'layer_0_size': 91, 'activation': 'logistic', 'max_iter': 1202}. Best is trial 0 with value: 0.38140671539853965.
[I 2025-11-27 20:48:23,952] Trial 8 finished with value: 0.3809788831244073 and parameters: {'layer_0_size': 256, 'activation': 'tanh', 'max_iter': 465}. Best is trial 0 with value: 0.38140671539853965.
[I 2025-11-27 20:48:26,345] Trial 9 finished with value: 0.3845674475052268 and parameters: {'layer_0_size': 369, 'activation': 'tanh', 'max_iter': 1405}. Best is trial 9 with value: 0.3845674475052268.
[I 2025-11-27 20:48:27,929] Trial 10 finished with value: 0.3785319747991288 and parameters: {'layer_0_size': 233, 'activation': 'tanh', 'max_iter': 1477}. Best is trial 9 with value: 0.3845674475052268.
[I 2025-11-27 20:48:30,507] Trial 11 finished with value: 0.3811611685165547 and parameters: {'layer_0_size': 398, 'activation': 'logistic', 'max_iter': 151}. Best is trial 9 with value: 0.3845674475052268.
[I 2025-11-27 20:48:33,300] Trial 12 finished with value: 0.3812517381452672 and parameters: {'layer_0_size': 400, 'activation': 'tanh', 'max_iter': 692}. Best is trial 9 with value: 0.3845674475052268.
[I 2025-11-27 20:48:35,631] Trial 13 finished with value: 0.3790415127676837 and parameters: {'layer_0_size': 332, 'activation': 'logistic', 'max_iter': 134}. Best is trial 9 with value: 0.3845674475052268.
[I 2025-11-27 20:48:38,018] Trial 14 finished with value: 0.38193742153106935 and parameters: {'layer_0_size': 349, 'activation': 'logistic', 'max_iter': 815}. Best is trial 9 with value: 0.3845674475052268.
[I 2025-11-27 20:48:38,885] Trial 15 finished with value: 0.3661425353467013 and parameters: {'layer_0_size': 15, 'activation': 'tanh', 'max_iter': 1275}. Best is trial 9 with value: 0.3845674475052268.
[I 2025-11-27 20:48:40,907] Trial 16 finished with value: 0.3816256022876826 and parameters: {'layer_0_size': 277, 'activation': 'logistic', 'max_iter': 851}. Best is trial 9 with value: 0.3845674475052268.
[I 2025-11-27 20:48:43,505] Trial 17 finished with value: 0.3805829192336071 and parameters: {'layer_0_size': 348, 'activation': 'tanh', 'max_iter': 695}. Best is trial 9 with value: 0.3845674475052268.
[I 2025-11-27 20:48:45,139] Trial 18 finished with value: 0.37874685492952453 and parameters: {'layer_0_size': 201, 'activation': 'tanh', 'max_iter': 1071}. Best is trial 9 with value: 0.3845674475052268.
[I 2025-11-27 20:48:46,572] Trial 19 finished with value: 0.3797460897234587 and parameters: {'layer_0_size': 158, 'activation': 'logistic', 'max_iter': 1326}. Best is trial 9 with value: 0.3845674475052268.
[I 2025-11-27 20:48:48,706] Trial 20 finished with value: 0.3825589074888869 and parameters: {'layer_0_size': 356, 'activation': 'tanh', 'max_iter': 721}. Best is trial 9 with value: 0.3845674475052268.
[I 2025-11-27 20:48:50,712] Trial 21 finished with value: 0.37670810147498 and parameters: {'layer_0_size': 361, 'activation': 'tanh', 'max_iter': 719}. Best is trial 9 with value: 0.3845674475052268.
[I 2025-11-27 20:48:52,919] Trial 22 finished with value: 0.3843502399722993 and parameters: {'layer_0_size': 298, 'activation': 'tanh', 'max_iter': 547}. Best is trial 9 with value: 0.3845674475052268.
[I 2025-11-27 20:48:54,975] Trial 23 finished with value: 0.3761524401334023 and parameters: {'layer_0_size': 294, 'activation': 'tanh', 'max_iter': 542}. Best is trial 9 with value: 0.3845674475052268.
[I 2025-11-27 20:48:57,465] Trial 24 finished with value: 0.38108529090650645 and parameters: {'layer_0_size': 317, 'activation': 'tanh', 'max_iter': 331}. Best is trial 9 with value: 0.3845674475052268.
[I 2025-11-27 20:49:00,014] Trial 25 finished with value: 0.3808607939260109 and parameters: {'layer_0_size': 375, 'activation': 'tanh', 'max_iter': 624}. Best is trial 9 with value: 0.3845674475052268.
[I 2025-11-27 20:49:01,610] Trial 26 finished with value: 0.3762673816158638 and parameters: {'layer_0_size': 255, 'activation': 'tanh', 'max_iter': 365}. Best is trial 9 with value: 0.3845674475052268.
[I 2025-11-27 20:49:03,896] Trial 27 finished with value: 0.3780585605524673 and parameters: {'layer_0_size': 323, 'activation': 'tanh', 'max_iter': 949}. Best is trial 9 with value: 0.3845674475052268.
[I 2025-11-27 20:49:05,908] Trial 28 finished with value: 0.38172800333446577 and parameters: {'layer_0_size': 269, 'activation': 'tanh', 'max_iter': 486}. Best is trial 9 with value: 0.3845674475052268.
[I 2025-11-27 20:49:08,519] Trial 29 finished with value: 0.38167478114075143 and parameters: {'layer_0_size': 372, 'activation': 'tanh', 'max_iter': 1071}. Best is trial 9 with value: 0.3845674475052268.
[I 2025-11-27 20:49:08,764] A new study created in memory with name: multi_layer_perceptron_fold_2
[I 2025-11-27 20:49:09,571] Trial 0 finished with value: 0.36871836848529127 and parameters: {'layer_0_size': 46, 'activation': 'logistic', 'max_iter': 1164}. Best is trial 0 with value: 0.36871836848529127.
[I 2025-11-27 20:49:10,375] Trial 1 finished with value: 0.36751033212913087 and parameters: {'layer_0_size': 44, 'activation': 'logistic', 'max_iter': 345}. Best is trial 0 with value: 0.36871836848529127.
[I 2025-11-27 20:49:12,042] Trial 2 finished with value: 0.38231797524856803 and parameters: {'layer_0_size': 157, 'activation': 'tanh', 'max_iter': 1081}. Best is trial 2 with value: 0.38231797524856803.
[I 2025-11-27 20:49:13,244] Trial 3 finished with value: 0.3716001033544533 and parameters: {'layer_0_size': 135, 'activation': 'tanh', 'max_iter': 801}. Best is trial 2 with value: 0.38231797524856803.
[I 2025-11-27 20:49:15,823] Trial 4 finished with value: 0.37832008755176394 and parameters: {'layer_0_size': 371, 'activation': 'relu', 'max_iter': 132}. Best is trial 2 with value: 0.38231797524856803.
[I 2025-11-27 20:49:17,851] Trial 5 finished with value: 0.37757375336745663 and parameters: {'layer_0_size': 284, 'activation': 'logistic', 'max_iter': 702}. Best is trial 2 with value: 0.38231797524856803.
[I 2025-11-27 20:49:18,903] Trial 6 finished with value: 0.37674459469495725 and parameters: {'layer_0_size': 65, 'activation': 'tanh', 'max_iter': 1096}. Best is trial 2 with value: 0.38231797524856803.
[I 2025-11-27 20:49:19,898] Trial 7 finished with value: 0.3742075228628049 and parameters: {'layer_0_size': 77, 'activation': 'logistic', 'max_iter': 712}. Best is trial 2 with value: 0.38231797524856803.
[I 2025-11-27 20:49:21,872] Trial 8 finished with value: 0.3837399026255838 and parameters: {'layer_0_size': 187, 'activation': 'tanh', 'max_iter': 1198}. Best is trial 8 with value: 0.3837399026255838.
[I 2025-11-27 20:49:23,672] Trial 9 finished with value: 0.37847879298629533 and parameters: {'layer_0_size': 192, 'activation': 'tanh', 'max_iter': 515}. Best is trial 8 with value: 0.3837399026255838.
[I 2025-11-27 20:49:25,759] Trial 10 finished with value: 0.3676496499445072 and parameters: {'layer_0_size': 259, 'activation': 'relu', 'max_iter': 1435}. Best is trial 8 with value: 0.3837399026255838.
[I 2025-11-27 20:49:27,357] Trial 11 finished with value: 0.37307025894365703 and parameters: {'layer_0_size': 174, 'activation': 'tanh', 'max_iter': 1109}. Best is trial 8 with value: 0.3837399026255838.
[I 2025-11-27 20:49:29,239] Trial 12 finished with value: 0.3845213592362845 and parameters: {'layer_0_size': 251, 'activation': 'tanh', 'max_iter': 1363}. Best is trial 12 with value: 0.3845213592362845.
[I 2025-11-27 20:49:31,272] Trial 13 finished with value: 0.37981485783461694 and parameters: {'layer_0_size': 261, 'activation': 'tanh', 'max_iter': 1499}. Best is trial 12 with value: 0.3845213592362845.
[I 2025-11-27 20:49:33,504] Trial 14 finished with value: 0.388744404229467 and parameters: {'layer_0_size': 338, 'activation': 'tanh', 'max_iter': 1314}. Best is trial 14 with value: 0.388744404229467.
[I 2025-11-27 20:49:36,086] Trial 15 finished with value: 0.37813983476495827 and parameters: {'layer_0_size': 387, 'activation': 'tanh', 'max_iter': 1314}. Best is trial 14 with value: 0.388744404229467.
[I 2025-11-27 20:49:38,259] Trial 16 finished with value: 0.3678899851776175 and parameters: {'layer_0_size': 329, 'activation': 'relu', 'max_iter': 952}. Best is trial 14 with value: 0.388744404229467.
[I 2025-11-27 20:49:40,273] Trial 17 finished with value: 0.38103793820678034 and parameters: {'layer_0_size': 311, 'activation': 'tanh', 'max_iter': 1326}. Best is trial 14 with value: 0.388744404229467.
[I 2025-11-27 20:49:41,938] Trial 18 finished with value: 0.39130068972462123 and parameters: {'layer_0_size': 232, 'activation': 'tanh', 'max_iter': 900}. Best is trial 18 with value: 0.39130068972462123.
[I 2025-11-27 20:49:44,761] Trial 19 finished with value: 0.36723907388528043 and parameters: {'layer_0_size': 351, 'activation': 'relu', 'max_iter': 876}. Best is trial 18 with value: 0.39130068972462123.
[I 2025-11-27 20:49:46,747] Trial 20 finished with value: 0.38783354763042666 and parameters: {'layer_0_size': 222, 'activation': 'tanh', 'max_iter': 515}. Best is trial 18 with value: 0.39130068972462123.
[I 2025-11-27 20:49:48,576] Trial 21 finished with value: 0.3804658466255377 and parameters: {'layer_0_size': 225, 'activation': 'tanh', 'max_iter': 522}. Best is trial 18 with value: 0.39130068972462123.
[I 2025-11-27 20:49:50,051] Trial 22 finished with value: 0.3770781735141092 and parameters: {'layer_0_size': 110, 'activation': 'tanh', 'max_iter': 463}. Best is trial 18 with value: 0.39130068972462123.
[I 2025-11-27 20:49:51,729] Trial 23 finished with value: 0.37792782162980454 and parameters: {'layer_0_size': 223, 'activation': 'tanh', 'max_iter': 263}. Best is trial 18 with value: 0.39130068972462123.
[I 2025-11-27 20:49:54,010] Trial 24 finished with value: 0.38782661009779185 and parameters: {'layer_0_size': 297, 'activation': 'tanh', 'max_iter': 595}. Best is trial 18 with value: 0.39130068972462123.
[I 2025-11-27 20:49:56,540] Trial 25 finished with value: 0.3762407141335152 and parameters: {'layer_0_size': 338, 'activation': 'tanh', 'max_iter': 1011}. Best is trial 18 with value: 0.39130068972462123.
[I 2025-11-27 20:49:57,455] Trial 26 finished with value: 0.37224554917518266 and parameters: {'layer_0_size': 10, 'activation': 'tanh', 'max_iter': 680}. Best is trial 18 with value: 0.39130068972462123.
[I 2025-11-27 20:49:59,074] Trial 27 finished with value: 0.37593007281745516 and parameters: {'layer_0_size': 217, 'activation': 'tanh', 'max_iter': 366}. Best is trial 18 with value: 0.39130068972462123.
[I 2025-11-27 20:50:01,054] Trial 28 finished with value: 0.37161183887031557 and parameters: {'layer_0_size': 281, 'activation': 'relu', 'max_iter': 882}. Best is trial 18 with value: 0.39130068972462123.
[I 2025-11-27 20:50:02,384] Trial 29 finished with value: 0.3740048551943759 and parameters: {'layer_0_size': 143, 'activation': 'logistic', 'max_iter': 1226}. Best is trial 18 with value: 0.39130068972462123.
[I 2025-11-27 20:50:02,657] A new study created in memory with name: multi_layer_perceptron_fold_3
[I 2025-11-27 20:50:03,627] Trial 0 finished with value: 0.3515297581629312 and parameters: {'layer_0_size': 52, 'activation': 'relu', 'max_iter': 990}. Best is trial 0 with value: 0.3515297581629312.
[I 2025-11-27 20:50:05,206] Trial 1 finished with value: 0.37830875358417176 and parameters: {'layer_0_size': 190, 'activation': 'logistic', 'max_iter': 919}. Best is trial 1 with value: 0.37830875358417176.
[I 2025-11-27 20:50:08,222] Trial 2 finished with value: 0.3667472755751067 and parameters: {'layer_0_size': 400, 'activation': 'relu', 'max_iter': 653}. Best is trial 1 with value: 0.37830875358417176.
[I 2025-11-27 20:50:10,497] Trial 3 finished with value: 0.3817845200642612 and parameters: {'layer_0_size': 360, 'activation': 'tanh', 'max_iter': 315}. Best is trial 3 with value: 0.3817845200642612.
[I 2025-11-27 20:50:12,901] Trial 4 finished with value: 0.3699735588833605 and parameters: {'layer_0_size': 310, 'activation': 'relu', 'max_iter': 800}. Best is trial 3 with value: 0.3817845200642612.
