[I 2025-11-27 04:47:04,902] A new study created in memory with name: decision_tree_fold_1
[I 2025-11-27 04:47:06,256] Trial 0 finished with value: 0.33917153169729614 and parameters: {'max_depth': 35, 'min_samples_split': 15}. Best is trial 0 with value: 0.33917153169729614.
[I 2025-11-27 04:47:06,545] Trial 1 finished with value: 0.3453332569468584 and parameters: {'max_depth': 2, 'min_samples_split': 41}. Best is trial 1 with value: 0.3453332569468584.
[I 2025-11-27 04:47:07,849] Trial 2 finished with value: 0.3413202467482055 and parameters: {'max_depth': 27, 'min_samples_split': 46}. Best is trial 1 with value: 0.3453332569468584.
[I 2025-11-27 04:47:09,169] Trial 3 finished with value: 0.34085716935779337 and parameters: {'max_depth': 30, 'min_samples_split': 37}. Best is trial 1 with value: 0.3453332569468584.
[I 2025-11-27 04:47:10,357] Trial 4 finished with value: 0.3441786935999052 and parameters: {'max_depth': 14, 'min_samples_split': 43}. Best is trial 1 with value: 0.3453332569468584.
[I 2025-11-27 04:47:11,633] Trial 5 finished with value: 0.33930876847341496 and parameters: {'max_depth': 17, 'min_samples_split': 6}. Best is trial 1 with value: 0.3453332569468584.
[I 2025-11-27 04:47:12,983] Trial 6 finished with value: 0.34091977003417223 and parameters: {'max_depth': 40, 'min_samples_split': 33}. Best is trial 1 with value: 0.3453332569468584.
[I 2025-11-27 04:47:13,273] Trial 7 finished with value: 0.3453332569468584 and parameters: {'max_depth': 2, 'min_samples_split': 6}. Best is trial 1 with value: 0.3453332569468584.
[I 2025-11-27 04:47:14,650] Trial 8 finished with value: 0.33866633570840116 and parameters: {'max_depth': 38, 'min_samples_split': 19}. Best is trial 1 with value: 0.3453332569468584.
[I 2025-11-27 04:47:15,991] Trial 9 finished with value: 0.3392054320125099 and parameters: {'max_depth': 26, 'min_samples_split': 12}. Best is trial 1 with value: 0.3453332569468584.
[I 2025-11-27 04:47:16,282] Trial 10 finished with value: 0.3453332569468584 and parameters: {'max_depth': 2, 'min_samples_split': 27}. Best is trial 1 with value: 0.3453332569468584.
[I 2025-11-27 04:47:16,797] Trial 11 finished with value: 0.3494256871572113 and parameters: {'max_depth': 4, 'min_samples_split': 3}. Best is trial 11 with value: 0.3494256871572113.
[I 2025-11-27 04:47:17,882] Trial 12 finished with value: 0.3472781038868994 and parameters: {'max_depth': 11, 'min_samples_split': 27}. Best is trial 11 with value: 0.3494256871572113.
[I 2025-11-27 04:47:18,911] Trial 13 finished with value: 0.3477071977152395 and parameters: {'max_depth': 10, 'min_samples_split': 25}. Best is trial 11 with value: 0.3494256871572113.
[I 2025-11-27 04:47:19,883] Trial 14 finished with value: 0.34707682603064854 and parameters: {'max_depth': 9, 'min_samples_split': 21}. Best is trial 11 with value: 0.3494256871572113.
[I 2025-11-27 04:47:20,790] Trial 15 finished with value: 0.34899546492600986 and parameters: {'max_depth': 8, 'min_samples_split': 10}. Best is trial 11 with value: 0.3494256871572113.
[I 2025-11-27 04:47:22,111] Trial 16 finished with value: 0.3381385342633771 and parameters: {'max_depth': 20, 'min_samples_split': 3}. Best is trial 11 with value: 0.3494256871572113.
[I 2025-11-27 04:47:22,932] Trial 17 finished with value: 0.35051135184577037 and parameters: {'max_depth': 7, 'min_samples_split': 13}. Best is trial 17 with value: 0.35051135184577037.
[I 2025-11-27 04:47:23,755] Trial 18 finished with value: 0.34983805159821535 and parameters: {'max_depth': 7, 'min_samples_split': 3}. Best is trial 17 with value: 0.35051135184577037.
[I 2025-11-27 04:47:24,999] Trial 19 finished with value: 0.34188475189475975 and parameters: {'max_depth': 15, 'min_samples_split': 15}. Best is trial 17 with value: 0.35051135184577037.
[I 2025-11-27 04:47:25,720] Trial 20 finished with value: 0.35134478651166423 and parameters: {'max_depth': 6, 'min_samples_split': 9}. Best is trial 20 with value: 0.35134478651166423.
[I 2025-11-27 04:47:26,543] Trial 21 finished with value: 0.3498568527829898 and parameters: {'max_depth': 7, 'min_samples_split': 9}. Best is trial 20 with value: 0.35134478651166423.
[I 2025-11-27 04:47:27,272] Trial 22 finished with value: 0.35144261865456394 and parameters: {'max_depth': 6, 'min_samples_split': 10}. Best is trial 22 with value: 0.35144261865456394.
[I 2025-11-27 04:47:28,458] Trial 23 finished with value: 0.34104964604441956 and parameters: {'max_depth': 13, 'min_samples_split': 16}. Best is trial 22 with value: 0.35144261865456394.
[I 2025-11-27 04:47:29,084] Trial 24 finished with value: 0.3508576702391687 and parameters: {'max_depth': 5, 'min_samples_split': 12}. Best is trial 22 with value: 0.35144261865456394.
[I 2025-11-27 04:47:30,391] Trial 25 finished with value: 0.3401063619192498 and parameters: {'max_depth': 19, 'min_samples_split': 9}. Best is trial 22 with value: 0.35144261865456394.
[I 2025-11-27 04:47:31,017] Trial 26 finished with value: 0.3505491532103522 and parameters: {'max_depth': 5, 'min_samples_split': 20}. Best is trial 22 with value: 0.35144261865456394.
[I 2025-11-27 04:47:32,159] Trial 27 finished with value: 0.343592238610898 and parameters: {'max_depth': 12, 'min_samples_split': 23}. Best is trial 22 with value: 0.35144261865456394.
[I 2025-11-27 04:47:32,785] Trial 28 finished with value: 0.35089289528436507 and parameters: {'max_depth': 5, 'min_samples_split': 32}. Best is trial 22 with value: 0.35144261865456394.
[I 2025-11-27 04:47:34,101] Trial 29 finished with value: 0.3399666471515338 and parameters: {'max_depth': 24, 'min_samples_split': 30}. Best is trial 22 with value: 0.35144261865456394.
[I 2025-11-27 04:47:34,726] A new study created in memory with name: decision_tree_fold_2
[I 2025-11-27 04:47:35,991] Trial 0 finished with value: 0.3420859940936899 and parameters: {'max_depth': 27, 'min_samples_split': 23}. Best is trial 0 with value: 0.3420859940936899.
[I 2025-11-27 04:47:36,286] Trial 1 finished with value: 0.34625552916703195 and parameters: {'max_depth': 2, 'min_samples_split': 2}. Best is trial 1 with value: 0.34625552916703195.
[I 2025-11-27 04:47:37,265] Trial 2 finished with value: 0.3474643985258786 and parameters: {'max_depth': 9, 'min_samples_split': 7}. Best is trial 2 with value: 0.3474643985258786.
[I 2025-11-27 04:47:38,494] Trial 3 finished with value: 0.34366769956765664 and parameters: {'max_depth': 18, 'min_samples_split': 40}. Best is trial 2 with value: 0.3474643985258786.
[I 2025-11-27 04:47:39,756] Trial 4 finished with value: 0.34561044478719005 and parameters: {'max_depth': 30, 'min_samples_split': 43}. Best is trial 2 with value: 0.3474643985258786.
[I 2025-11-27 04:47:41,039] Trial 5 finished with value: 0.3428748492201631 and parameters: {'max_depth': 39, 'min_samples_split': 36}. Best is trial 2 with value: 0.3474643985258786.
[I 2025-11-27 04:47:42,007] Trial 6 finished with value: 0.3512954481393782 and parameters: {'max_depth': 9, 'min_samples_split': 47}. Best is trial 6 with value: 0.3512954481393782.
[I 2025-11-27 04:47:43,315] Trial 7 finished with value: 0.33921128099220715 and parameters: {'max_depth': 34, 'min_samples_split': 19}. Best is trial 6 with value: 0.3512954481393782.
[I 2025-11-27 04:47:44,605] Trial 8 finished with value: 0.340453484078524 and parameters: {'max_depth': 23, 'min_samples_split': 19}. Best is trial 6 with value: 0.3512954481393782.
[I 2025-11-27 04:47:45,894] Trial 9 finished with value: 0.3429763320929643 and parameters: {'max_depth': 38, 'min_samples_split': 35}. Best is trial 6 with value: 0.3512954481393782.
[I 2025-11-27 04:47:47,040] Trial 10 finished with value: 0.34732317462102924 and parameters: {'max_depth': 13, 'min_samples_split': 50}. Best is trial 6 with value: 0.3512954481393782.
[I 2025-11-27 04:47:47,950] Trial 11 finished with value: 0.3489131946649113 and parameters: {'max_depth': 8, 'min_samples_split': 5}. Best is trial 6 with value: 0.3512954481393782.
[I 2025-11-27 04:47:48,579] Trial 12 finished with value: 0.35341557290031134 and parameters: {'max_depth': 5, 'min_samples_split': 14}. Best is trial 12 with value: 0.35341557290031134.
[I 2025-11-27 04:47:48,876] Trial 13 finished with value: 0.34625552916703195 and parameters: {'max_depth': 2, 'min_samples_split': 11}. Best is trial 12 with value: 0.35341557290031134.
[I 2025-11-27 04:47:50,086] Trial 14 finished with value: 0.3433991055942175 and parameters: {'max_depth': 15, 'min_samples_split': 28}. Best is trial 12 with value: 0.35341557290031134.
[I 2025-11-27 04:47:50,994] Trial 15 finished with value: 0.34950120376217375 and parameters: {'max_depth': 8, 'min_samples_split': 14}. Best is trial 12 with value: 0.35341557290031134.
[I 2025-11-27 04:47:52,084] Trial 16 finished with value: 0.34481250979004424 and parameters: {'max_depth': 11, 'min_samples_split': 28}. Best is trial 12 with value: 0.35341557290031134.
[I 2025-11-27 04:47:52,713] Trial 17 finished with value: 0.3537491817040117 and parameters: {'max_depth': 5, 'min_samples_split': 50}. Best is trial 17 with value: 0.3537491817040117.
[I 2025-11-27 04:47:53,968] Trial 18 finished with value: 0.344917695675373 and parameters: {'max_depth': 21, 'min_samples_split': 33}. Best is trial 17 with value: 0.3537491817040117.
[I 2025-11-27 04:47:54,603] Trial 19 finished with value: 0.35335114569137194 and parameters: {'max_depth': 5, 'min_samples_split': 16}. Best is trial 17 with value: 0.3537491817040117.
[I 2025-11-27 04:47:55,830] Trial 20 finished with value: 0.3418283585900408 and parameters: {'max_depth': 16, 'min_samples_split': 24}. Best is trial 17 with value: 0.3537491817040117.
[I 2025-11-27 04:47:56,356] Trial 21 finished with value: 0.3525902262060886 and parameters: {'max_depth': 4, 'min_samples_split': 15}. Best is trial 17 with value: 0.3537491817040117.
[I 2025-11-27 04:47:56,987] Trial 22 finished with value: 0.3534560601853224 and parameters: {'max_depth': 5, 'min_samples_split': 10}. Best is trial 17 with value: 0.3537491817040117.
[I 2025-11-27 04:47:57,623] Trial 23 finished with value: 0.3527182062609725 and parameters: {'max_depth': 5, 'min_samples_split': 10}. Best is trial 17 with value: 0.3537491817040117.
[I 2025-11-27 04:47:58,758] Trial 24 finished with value: 0.33985927890995715 and parameters: {'max_depth': 12, 'min_samples_split': 8}. Best is trial 17 with value: 0.3537491817040117.
[I 2025-11-27 04:47:59,489] Trial 25 finished with value: 0.3518071917689049 and parameters: {'max_depth': 6, 'min_samples_split': 2}. Best is trial 17 with value: 0.3537491817040117.
[I 2025-11-27 04:48:00,756] Trial 26 finished with value: 0.3405447963366424 and parameters: {'max_depth': 19, 'min_samples_split': 19}. Best is trial 17 with value: 0.3537491817040117.
[I 2025-11-27 04:48:01,926] Trial 27 finished with value: 0.34093841415652737 and parameters: {'max_depth': 13, 'min_samples_split': 12}. Best is trial 17 with value: 0.3537491817040117.
[I 2025-11-27 04:48:02,222] Trial 28 finished with value: 0.34625552916703195 and parameters: {'max_depth': 2, 'min_samples_split': 30}. Best is trial 17 with value: 0.3537491817040117.
[I 2025-11-27 04:48:03,505] Trial 29 finished with value: 0.342721026441334 and parameters: {'max_depth': 23, 'min_samples_split': 22}. Best is trial 17 with value: 0.3537491817040117.
[I 2025-11-27 04:48:03,767] A new study created in memory with name: decision_tree_fold_3
[I 2025-11-27 04:48:04,467] Trial 0 finished with value: 0.34908939377053216 and parameters: {'max_depth': 6, 'min_samples_split': 13}. Best is trial 0 with value: 0.34908939377053216.
[I 2025-11-27 04:48:05,844] Trial 1 finished with value: 0.3341280921314531 and parameters: {'max_depth': 31, 'min_samples_split': 4}. Best is trial 0 with value: 0.34908939377053216.
[I 2025-11-27 04:48:07,185] Trial 2 finished with value: 0.3378439363196054 and parameters: {'max_depth': 35, 'min_samples_split': 35}. Best is trial 0 with value: 0.34908939377053216.
[I 2025-11-27 04:48:08,454] Trial 3 finished with value: 0.34296442068394156 and parameters: {'max_depth': 11, 'min_samples_split': 49}. Best is trial 0 with value: 0.34908939377053216.
[I 2025-11-27 04:48:09,754] Trial 4 finished with value: 0.3382628107137878 and parameters: {'max_depth': 27, 'min_samples_split': 46}. Best is trial 0 with value: 0.34908939377053216.
[I 2025-11-27 04:48:11,134] Trial 5 finished with value: 0.33484640843633656 and parameters: {'max_depth': 33, 'min_samples_split': 7}. Best is trial 0 with value: 0.34908939377053216.
[I 2025-11-27 04:48:12,441] Trial 6 finished with value: 0.33716740774030574 and parameters: {'max_depth': 20, 'min_samples_split': 19}. Best is trial 0 with value: 0.34908939377053216.
[I 2025-11-27 04:48:13,796] Trial 7 finished with value: 0.33428706292102583 and parameters: {'max_depth': 26, 'min_samples_split': 6}. Best is trial 0 with value: 0.34908939377053216.
[I 2025-11-27 04:48:15,175] Trial 8 finished with value: 0.33466247206118654 and parameters: {'max_depth': 40, 'min_samples_split': 13}. Best is trial 0 with value: 0.34908939377053216.
[I 2025-11-27 04:48:16,538] Trial 9 finished with value: 0.3350350005903103 and parameters: {'max_depth': 32, 'min_samples_split': 19}. Best is trial 0 with value: 0.34908939377053216.
[I 2025-11-27 04:48:16,833] Trial 10 finished with value: 0.3458602218351358 and parameters: {'max_depth': 2, 'min_samples_split': 30}. Best is trial 0 with value: 0.34908939377053216.
[I 2025-11-27 04:48:17,129] Trial 11 finished with value: 0.3458602218351358 and parameters: {'max_depth': 2, 'min_samples_split': 31}. Best is trial 0 with value: 0.34908939377053216.
[I 2025-11-27 04:48:17,425] Trial 12 finished with value: 0.3458602218351358 and parameters: {'max_depth': 2, 'min_samples_split': 25}. Best is trial 0 with value: 0.34908939377053216.
[I 2025-11-27 04:48:18,469] Trial 13 finished with value: 0.34399073426850524 and parameters: {'max_depth': 10, 'min_samples_split': 39}. Best is trial 0 with value: 0.34908939377053216.
[I 2025-11-27 04:48:19,446] Trial 14 finished with value: 0.34249621332159247 and parameters: {'max_depth': 9, 'min_samples_split': 25}. Best is trial 0 with value: 0.34908939377053216.
[I 2025-11-27 04:48:20,693] Trial 15 finished with value: 0.33923611114437635 and parameters: {'max_depth': 15, 'min_samples_split': 14}. Best is trial 0 with value: 0.34908939377053216.
[I 2025-11-27 04:48:21,420] Trial 16 finished with value: 0.34862118843254 and parameters: {'max_depth': 6, 'min_samples_split': 29}. Best is trial 0 with value: 0.34908939377053216.
[I 2025-11-27 04:48:22,658] Trial 17 finished with value: 0.34125807640925926 and parameters: {'max_depth': 16, 'min_samples_split': 42}. Best is trial 0 with value: 0.34908939377053216.
[I 2025-11-27 04:48:23,474] Trial 18 finished with value: 0.3475254195219388 and parameters: {'max_depth': 7, 'min_samples_split': 19}. Best is trial 0 with value: 0.34908939377053216.
[I 2025-11-27 04:48:24,725] Trial 19 finished with value: 0.338071963170774 and parameters: {'max_depth': 15, 'min_samples_split': 13}. Best is trial 0 with value: 0.34908939377053216.
[I 2025-11-27 04:48:25,453] Trial 20 finished with value: 0.349059665925283 and parameters: {'max_depth': 6, 'min_samples_split': 29}. Best is trial 0 with value: 0.34908939377053216.
[I 2025-11-27 04:48:26,357] Trial 21 finished with value: 0.34504303973851935 and parameters: {'max_depth': 8, 'min_samples_split': 30}. Best is trial 0 with value: 0.34908939377053216.
[I 2025-11-27 04:48:27,087] Trial 22 finished with value: 0.3488156750583064 and parameters: {'max_depth': 6, 'min_samples_split': 34}. Best is trial 0 with value: 0.34908939377053216.
[I 2025-11-27 04:48:28,264] Trial 23 finished with value: 0.3421426534920013 and parameters: {'max_depth': 13, 'min_samples_split': 36}. Best is trial 0 with value: 0.34908939377053216.
[I 2025-11-27 04:48:28,893] Trial 24 finished with value: 0.35033678214670627 and parameters: {'max_depth': 5, 'min_samples_split': 22}. Best is trial 24 with value: 0.35033678214670627.
[I 2025-11-27 04:48:30,189] Trial 25 finished with value: 0.33701009102873103 and parameters: {'max_depth': 19, 'min_samples_split': 23}. Best is trial 24 with value: 0.35033678214670627.
[I 2025-11-27 04:48:30,819] Trial 26 finished with value: 0.3503765153541132 and parameters: {'max_depth': 5, 'min_samples_split': 10}. Best is trial 26 with value: 0.3503765153541132.
[I 2025-11-27 04:48:31,448] Trial 27 finished with value: 0.35004091024987594 and parameters: {'max_depth': 5, 'min_samples_split': 9}. Best is trial 26 with value: 0.3503765153541132.
[I 2025-11-27 04:48:32,607] Trial 28 finished with value: 0.33919857719715696 and parameters: {'max_depth': 12, 'min_samples_split': 9}. Best is trial 26 with value: 0.3503765153541132.
[I 2025-11-27 04:48:33,019] Trial 29 finished with value: 0.3486853755704813 and parameters: {'max_depth': 3, 'min_samples_split': 3}. Best is trial 26 with value: 0.3503765153541132.
[I 2025-11-27 04:48:33,282] A new study created in memory with name: decision_tree_fold_4
[I 2025-11-27 04:48:34,599] Trial 0 finished with value: 0.33954773194076476 and parameters: {'max_depth': 33, 'min_samples_split': 22}. Best is trial 0 with value: 0.33954773194076476.
[I 2025-11-27 04:48:35,591] Trial 1 finished with value: 0.3494939629429567 and parameters: {'max_depth': 9, 'min_samples_split': 37}. Best is trial 1 with value: 0.3494939629429567.
[I 2025-11-27 04:48:36,960] Trial 2 finished with value: 0.3374051694503952 and parameters: {'max_depth': 40, 'min_samples_split': 17}. Best is trial 1 with value: 0.3494939629429567.
[I 2025-11-27 04:48:38,300] Trial 3 finished with value: 0.3379157232748956 and parameters: {'max_depth': 31, 'min_samples_split': 17}. Best is trial 1 with value: 0.3494939629429567.
[I 2025-11-27 04:48:39,633] Trial 4 finished with value: 0.341076575492825 and parameters: {'max_depth': 35, 'min_samples_split': 31}. Best is trial 1 with value: 0.3494939629429567.
[I 2025-11-27 04:48:40,961] Trial 5 finished with value: 0.33700455482342717 and parameters: {'max_depth': 24, 'min_samples_split': 9}. Best is trial 1 with value: 0.3494939629429567.
[I 2025-11-27 04:48:42,272] Trial 6 finished with value: 0.33995010690579414 and parameters: {'max_depth': 25, 'min_samples_split': 20}. Best is trial 1 with value: 0.3494939629429567.
[I 2025-11-27 04:48:43,506] Trial 7 finished with value: 0.3455843868825675 and parameters: {'max_depth': 18, 'min_samples_split': 43}. Best is trial 1 with value: 0.3494939629429567.
[I 2025-11-27 04:48:44,860] Trial 8 finished with value: 0.3381612544830778 and parameters: {'max_depth': 33, 'min_samples_split': 16}. Best is trial 1 with value: 0.3494939629429567.
[I 2025-11-27 04:48:46,138] Trial 9 finished with value: 0.34516600338387776 and parameters: {'max_depth': 28, 'min_samples_split': 49}. Best is trial 1 with value: 0.3494939629429567.
[I 2025-11-27 04:48:46,669] Trial 10 finished with value: 0.35335164223024307 and parameters: {'max_depth': 4, 'min_samples_split': 35}. Best is trial 10 with value: 0.35335164223024307.
[I 2025-11-27 04:48:47,199] Trial 11 finished with value: 0.35335164223024307 and parameters: {'max_depth': 4, 'min_samples_split': 33}. Best is trial 10 with value: 0.35335164223024307.
[I 2025-11-27 04:48:47,498] Trial 12 finished with value: 0.34722781741440284 and parameters: {'max_depth': 2, 'min_samples_split': 34}. Best is trial 10 with value: 0.35335164223024307.
[I 2025-11-27 04:48:48,641] Trial 13 finished with value: 0.3436706121070258 and parameters: {'max_depth': 12, 'min_samples_split': 28}. Best is trial 10 with value: 0.35335164223024307.
[I 2025-11-27 04:48:48,941] Trial 14 finished with value: 0.34722781741440284 and parameters: {'max_depth': 2, 'min_samples_split': 42}. Best is trial 10 with value: 0.35335164223024307.
[I 2025-11-27 04:48:49,853] Trial 15 finished with value: 0.3487635160952975 and parameters: {'max_depth': 8, 'min_samples_split': 37}. Best is trial 10 with value: 0.35335164223024307.
[I 2025-11-27 04:48:51,073] Trial 16 finished with value: 0.34137722433270856 and parameters: {'max_depth': 15, 'min_samples_split': 25}. Best is trial 10 with value: 0.35335164223024307.
[I 2025-11-27 04:48:51,812] Trial 17 finished with value: 0.3506322180930025 and parameters: {'max_depth': 6, 'min_samples_split': 3}. Best is trial 10 with value: 0.35335164223024307.
[I 2025-11-27 04:48:52,997] Trial 18 finished with value: 0.3463451911188708 and parameters: {'max_depth': 14, 'min_samples_split': 50}. Best is trial 10 with value: 0.35335164223024307.
[I 2025-11-27 04:48:53,633] Trial 19 finished with value: 0.35319466215016576 and parameters: {'max_depth': 5, 'min_samples_split': 42}. Best is trial 10 with value: 0.35335164223024307.
[I 2025-11-27 04:48:54,899] Trial 20 finished with value: 0.3426477603648642 and parameters: {'max_depth': 19, 'min_samples_split': 31}. Best is trial 10 with value: 0.35335164223024307.
[I 2025-11-27 04:48:55,533] Trial 21 finished with value: 0.3537702127629191 and parameters: {'max_depth': 5, 'min_samples_split': 42}. Best is trial 21 with value: 0.3537702127629191.
[I 2025-11-27 04:48:56,517] Trial 22 finished with value: 0.3503708999728778 and parameters: {'max_depth': 9, 'min_samples_split': 39}. Best is trial 21 with value: 0.3537702127629191.
[I 2025-11-27 04:48:57,047] Trial 23 finished with value: 0.3533404960255949 and parameters: {'max_depth': 4, 'min_samples_split': 45}. Best is trial 21 with value: 0.3537702127629191.
[I 2025-11-27 04:48:58,153] Trial 24 finished with value: 0.34526915848258893 and parameters: {'max_depth': 11, 'min_samples_split': 34}. Best is trial 21 with value: 0.3537702127629191.
[I 2025-11-27 04:48:58,982] Trial 25 finished with value: 0.35226707596270435 and parameters: {'max_depth': 7, 'min_samples_split': 46}. Best is trial 21 with value: 0.3537702127629191.
