[I 2025-11-27 20:50:13,654] Trial 5 finished with value: 0.36708355200174986 and parameters: {'layer_0_size': 34, 'activation': 'logistic', 'max_iter': 103}. Best is trial 3 with value: 0.3817845200642612.
[I 2025-11-27 20:50:15,730] Trial 6 finished with value: 0.374708123982149 and parameters: {'layer_0_size': 314, 'activation': 'tanh', 'max_iter': 972}. Best is trial 3 with value: 0.3817845200642612.
[I 2025-11-27 20:50:17,055] Trial 7 finished with value: 0.3583589695153658 and parameters: {'layer_0_size': 133, 'activation': 'relu', 'max_iter': 1406}. Best is trial 3 with value: 0.3817845200642612.
[I 2025-11-27 20:50:17,737] Trial 8 finished with value: 0.362392535296559 and parameters: {'layer_0_size': 22, 'activation': 'logistic', 'max_iter': 146}. Best is trial 3 with value: 0.3817845200642612.
[I 2025-11-27 20:50:20,114] Trial 9 finished with value: 0.36051626418424937 and parameters: {'layer_0_size': 322, 'activation': 'relu', 'max_iter': 1091}. Best is trial 3 with value: 0.3817845200642612.
[I 2025-11-27 20:50:22,403] Trial 10 finished with value: 0.3835847720179498 and parameters: {'layer_0_size': 395, 'activation': 'tanh', 'max_iter': 439}. Best is trial 10 with value: 0.3835847720179498.
[I 2025-11-27 20:50:24,588] Trial 11 finished with value: 0.3770074159774902 and parameters: {'layer_0_size': 382, 'activation': 'tanh', 'max_iter': 454}. Best is trial 10 with value: 0.3835847720179498.
[I 2025-11-27 20:50:27,370] Trial 12 finished with value: 0.37436578310998503 and parameters: {'layer_0_size': 250, 'activation': 'tanh', 'max_iter': 406}. Best is trial 10 with value: 0.3835847720179498.
[I 2025-11-27 20:50:29,780] Trial 13 finished with value: 0.38065578756126706 and parameters: {'layer_0_size': 356, 'activation': 'tanh', 'max_iter': 388}. Best is trial 10 with value: 0.3835847720179498.
[I 2025-11-27 20:50:31,326] Trial 14 finished with value: 0.37472783586095526 and parameters: {'layer_0_size': 256, 'activation': 'tanh', 'max_iter': 598}. Best is trial 10 with value: 0.3835847720179498.
[I 2025-11-27 20:50:33,971] Trial 15 finished with value: 0.37456414350378786 and parameters: {'layer_0_size': 271, 'activation': 'tanh', 'max_iter': 315}. Best is trial 10 with value: 0.3835847720179498.
[I 2025-11-27 20:50:35,649] Trial 16 finished with value: 0.3779153816585913 and parameters: {'layer_0_size': 185, 'activation': 'tanh', 'max_iter': 578}. Best is trial 10 with value: 0.3835847720179498.
[I 2025-11-27 20:50:38,207] Trial 17 finished with value: 0.3785130794367385 and parameters: {'layer_0_size': 363, 'activation': 'tanh', 'max_iter': 254}. Best is trial 10 with value: 0.3835847720179498.
[I 2025-11-27 20:50:39,683] Trial 18 finished with value: 0.37611396251068363 and parameters: {'layer_0_size': 93, 'activation': 'tanh', 'max_iter': 718}. Best is trial 10 with value: 0.3835847720179498.
[I 2025-11-27 20:50:42,054] Trial 19 finished with value: 0.3741814785135481 and parameters: {'layer_0_size': 341, 'activation': 'tanh', 'max_iter': 519}. Best is trial 10 with value: 0.3835847720179498.
[I 2025-11-27 20:50:44,056] Trial 20 finished with value: 0.3792533595460958 and parameters: {'layer_0_size': 281, 'activation': 'logistic', 'max_iter': 230}. Best is trial 10 with value: 0.3835847720179498.
[I 2025-11-27 20:50:47,028] Trial 21 finished with value: 0.38134302100878337 and parameters: {'layer_0_size': 360, 'activation': 'tanh', 'max_iter': 345}. Best is trial 10 with value: 0.3835847720179498.
[I 2025-11-27 20:50:50,330] Trial 22 finished with value: 0.3858717014411909 and parameters: {'layer_0_size': 393, 'activation': 'tanh', 'max_iter': 318}. Best is trial 22 with value: 0.3858717014411909.
[I 2025-11-27 20:50:52,877] Trial 23 finished with value: 0.37732318851616886 and parameters: {'layer_0_size': 400, 'activation': 'tanh', 'max_iter': 211}. Best is trial 22 with value: 0.3858717014411909.
[I 2025-11-27 20:50:54,592] Trial 24 finished with value: 0.3818647762342328 and parameters: {'layer_0_size': 225, 'activation': 'tanh', 'max_iter': 447}. Best is trial 22 with value: 0.3858717014411909.
[I 2025-11-27 20:50:56,864] Trial 25 finished with value: 0.3790136482478062 and parameters: {'layer_0_size': 227, 'activation': 'tanh', 'max_iter': 467}. Best is trial 22 with value: 0.3858717014411909.
[I 2025-11-27 20:50:58,327] Trial 26 finished with value: 0.37001596655790014 and parameters: {'layer_0_size': 154, 'activation': 'tanh', 'max_iter': 780}. Best is trial 22 with value: 0.3858717014411909.
[I 2025-11-27 20:51:00,446] Trial 27 finished with value: 0.38075122882329077 and parameters: {'layer_0_size': 293, 'activation': 'tanh', 'max_iter': 1208}. Best is trial 22 with value: 0.3858717014411909.
[I 2025-11-27 20:51:02,453] Trial 28 finished with value: 0.377614007561234 and parameters: {'layer_0_size': 227, 'activation': 'tanh', 'max_iter': 543}. Best is trial 22 with value: 0.3858717014411909.
[I 2025-11-27 20:51:03,450] Trial 29 finished with value: 0.37230883953451005 and parameters: {'layer_0_size': 78, 'activation': 'logistic', 'max_iter': 662}. Best is trial 22 with value: 0.3858717014411909.
[I 2025-11-27 20:51:03,733] A new study created in memory with name: multi_layer_perceptron_fold_4
[I 2025-11-27 20:51:05,768] Trial 0 finished with value: 0.38096820446414803 and parameters: {'layer_0_size': 296, 'activation': 'logistic', 'max_iter': 1286}. Best is trial 0 with value: 0.38096820446414803.
[I 2025-11-27 20:51:07,158] Trial 1 finished with value: 0.3784061695182047 and parameters: {'layer_0_size': 143, 'activation': 'logistic', 'max_iter': 1272}. Best is trial 0 with value: 0.38096820446414803.
[I 2025-11-27 20:51:09,095] Trial 2 finished with value: 0.38601615706760106 and parameters: {'layer_0_size': 278, 'activation': 'tanh', 'max_iter': 410}. Best is trial 2 with value: 0.38601615706760106.
[I 2025-11-27 20:51:09,838] Trial 3 finished with value: 0.36832455971568956 and parameters: {'layer_0_size': 10, 'activation': 'tanh', 'max_iter': 587}. Best is trial 2 with value: 0.38601615706760106.
[I 2025-11-27 20:51:12,174] Trial 4 finished with value: 0.3811744669764837 and parameters: {'layer_0_size': 344, 'activation': 'logistic', 'max_iter': 1313}. Best is trial 2 with value: 0.38601615706760106.
[I 2025-11-27 20:51:14,495] Trial 5 finished with value: 0.36471275148770543 and parameters: {'layer_0_size': 284, 'activation': 'relu', 'max_iter': 627}. Best is trial 2 with value: 0.38601615706760106.
[I 2025-11-27 20:51:15,468] Trial 6 finished with value: 0.35607079773635975 and parameters: {'layer_0_size': 36, 'activation': 'relu', 'max_iter': 938}. Best is trial 2 with value: 0.38601615706760106.
[I 2025-11-27 20:51:16,202] Trial 7 finished with value: 0.3460169583577243 and parameters: {'layer_0_size': 24, 'activation': 'relu', 'max_iter': 550}. Best is trial 2 with value: 0.38601615706760106.
[I 2025-11-27 20:51:18,126] Trial 8 finished with value: 0.38138693527685485 and parameters: {'layer_0_size': 268, 'activation': 'logistic', 'max_iter': 1007}. Best is trial 2 with value: 0.38601615706760106.
[I 2025-11-27 20:51:19,180] Trial 9 finished with value: 0.3697352040086212 and parameters: {'layer_0_size': 111, 'activation': 'tanh', 'max_iter': 1011}. Best is trial 2 with value: 0.38601615706760106.
[I 2025-11-27 20:51:22,390] Trial 10 finished with value: 0.3860540030291265 and parameters: {'layer_0_size': 386, 'activation': 'tanh', 'max_iter': 119}. Best is trial 10 with value: 0.3860540030291265.
[I 2025-11-27 20:51:24,891] Trial 11 finished with value: 0.37834027268563364 and parameters: {'layer_0_size': 398, 'activation': 'tanh', 'max_iter': 155}. Best is trial 10 with value: 0.3860540030291265.
[I 2025-11-27 20:51:27,726] Trial 12 finished with value: 0.3807022048976255 and parameters: {'layer_0_size': 399, 'activation': 'tanh', 'max_iter': 134}. Best is trial 10 with value: 0.3860540030291265.
[I 2025-11-27 20:51:29,320] Trial 13 finished with value: 0.3829993332437234 and parameters: {'layer_0_size': 237, 'activation': 'tanh', 'max_iter': 353}. Best is trial 10 with value: 0.3860540030291265.
[I 2025-11-27 20:51:31,971] Trial 14 finished with value: 0.38187754165591387 and parameters: {'layer_0_size': 335, 'activation': 'tanh', 'max_iter': 352}. Best is trial 10 with value: 0.3860540030291265.
[I 2025-11-27 20:51:33,634] Trial 15 finished with value: 0.37829212704432524 and parameters: {'layer_0_size': 198, 'activation': 'tanh', 'max_iter': 341}. Best is trial 10 with value: 0.3860540030291265.
[I 2025-11-27 20:51:35,791] Trial 16 finished with value: 0.38210664619832185 and parameters: {'layer_0_size': 343, 'activation': 'tanh', 'max_iter': 248}. Best is trial 10 with value: 0.3860540030291265.
[I 2025-11-27 20:51:37,273] Trial 17 finished with value: 0.38035091381479036 and parameters: {'layer_0_size': 195, 'activation': 'tanh', 'max_iter': 726}. Best is trial 10 with value: 0.3860540030291265.
[I 2025-11-27 20:51:39,428] Trial 18 finished with value: 0.3829180921531535 and parameters: {'layer_0_size': 319, 'activation': 'tanh', 'max_iter': 511}. Best is trial 10 with value: 0.3860540030291265.
[I 2025-11-27 20:51:42,116] Trial 19 finished with value: 0.37037507311291396 and parameters: {'layer_0_size': 371, 'activation': 'relu', 'max_iter': 101}. Best is trial 10 with value: 0.3860540030291265.
[I 2025-11-27 20:51:43,881] Trial 20 finished with value: 0.3774228240126344 and parameters: {'layer_0_size': 228, 'activation': 'tanh', 'max_iter': 443}. Best is trial 10 with value: 0.3860540030291265.
[I 2025-11-27 20:51:46,033] Trial 21 finished with value: 0.38988169744533796 and parameters: {'layer_0_size': 234, 'activation': 'tanh', 'max_iter': 278}. Best is trial 21 with value: 0.38988169744533796.
[I 2025-11-27 20:51:47,461] Trial 22 finished with value: 0.38018270663535475 and parameters: {'layer_0_size': 159, 'activation': 'tanh', 'max_iter': 228}. Best is trial 21 with value: 0.38988169744533796.
[I 2025-11-27 20:51:49,569] Trial 23 finished with value: 0.38228287933353744 and parameters: {'layer_0_size': 258, 'activation': 'tanh', 'max_iter': 248}. Best is trial 21 with value: 0.38988169744533796.
[I 2025-11-27 20:51:51,918] Trial 24 finished with value: 0.38116847675477117 and parameters: {'layer_0_size': 306, 'activation': 'tanh', 'max_iter': 1499}. Best is trial 21 with value: 0.38988169744533796.
[I 2025-11-27 20:51:53,059] Trial 25 finished with value: 0.3780806048250659 and parameters: {'layer_0_size': 78, 'activation': 'tanh', 'max_iter': 434}. Best is trial 21 with value: 0.38988169744533796.
[I 2025-11-27 20:51:54,636] Trial 26 finished with value: 0.37673679839356866 and parameters: {'layer_0_size': 174, 'activation': 'tanh', 'max_iter': 757}. Best is trial 21 with value: 0.38988169744533796.
[I 2025-11-27 20:51:56,601] Trial 27 finished with value: 0.37613035487966234 and parameters: {'layer_0_size': 232, 'activation': 'tanh', 'max_iter': 279}. Best is trial 21 with value: 0.38988169744533796.
[I 2025-11-27 20:51:59,341] Trial 28 finished with value: 0.3662771437532607 and parameters: {'layer_0_size': 364, 'activation': 'relu', 'max_iter': 466}. Best is trial 21 with value: 0.38988169744533796.
[I 2025-11-27 20:52:01,443] Trial 29 finished with value: 0.38080713456564186 and parameters: {'layer_0_size': 291, 'activation': 'logistic', 'max_iter': 661}. Best is trial 21 with value: 0.38988169744533796.
[I 2025-11-27 20:52:01,699] A new study created in memory with name: multi_layer_perceptron_fold_5
[I 2025-11-27 20:52:04,135] Trial 0 finished with value: 0.3645971428076643 and parameters: {'layer_0_size': 340, 'activation': 'relu', 'max_iter': 842}. Best is trial 0 with value: 0.3645971428076643.
[I 2025-11-27 20:52:06,878] Trial 1 finished with value: 0.3804120927498328 and parameters: {'layer_0_size': 400, 'activation': 'logistic', 'max_iter': 468}. Best is trial 1 with value: 0.3804120927498328.
[I 2025-11-27 20:52:09,166] Trial 2 finished with value: 0.38596260805811045 and parameters: {'layer_0_size': 340, 'activation': 'tanh', 'max_iter': 1146}. Best is trial 2 with value: 0.38596260805811045.
[I 2025-11-27 20:52:10,086] Trial 3 finished with value: 0.3429350040113318 and parameters: {'layer_0_size': 55, 'activation': 'relu', 'max_iter': 964}. Best is trial 2 with value: 0.38596260805811045.
[I 2025-11-27 20:52:12,433] Trial 4 finished with value: 0.3834496266944042 and parameters: {'layer_0_size': 323, 'activation': 'logistic', 'max_iter': 155}. Best is trial 2 with value: 0.38596260805811045.
[I 2025-11-27 20:52:13,469] Trial 5 finished with value: 0.3748938481795503 and parameters: {'layer_0_size': 71, 'activation': 'logistic', 'max_iter': 339}. Best is trial 2 with value: 0.38596260805811045.
[I 2025-11-27 20:52:14,601] Trial 6 finished with value: 0.3837726961303435 and parameters: {'layer_0_size': 68, 'activation': 'tanh', 'max_iter': 1020}. Best is trial 2 with value: 0.38596260805811045.
[I 2025-11-27 20:52:16,487] Trial 7 finished with value: 0.38348958164479396 and parameters: {'layer_0_size': 242, 'activation': 'logistic', 'max_iter': 1011}. Best is trial 2 with value: 0.38596260805811045.
[I 2025-11-27 20:52:18,055] Trial 8 finished with value: 0.3602367633051221 and parameters: {'layer_0_size': 157, 'activation': 'relu', 'max_iter': 1435}. Best is trial 2 with value: 0.38596260805811045.
[I 2025-11-27 20:52:19,665] Trial 9 finished with value: 0.38403169158977246 and parameters: {'layer_0_size': 211, 'activation': 'tanh', 'max_iter': 797}. Best is trial 2 with value: 0.38596260805811045.
[I 2025-11-27 20:52:21,556] Trial 10 finished with value: 0.3846680873771279 and parameters: {'layer_0_size': 301, 'activation': 'tanh', 'max_iter': 1402}. Best is trial 2 with value: 0.38596260805811045.
[I 2025-11-27 20:52:23,811] Trial 11 finished with value: 0.38480864452343627 and parameters: {'layer_0_size': 293, 'activation': 'tanh', 'max_iter': 1492}. Best is trial 2 with value: 0.38596260805811045.
[I 2025-11-27 20:52:26,539] Trial 12 finished with value: 0.3822598569941117 and parameters: {'layer_0_size': 399, 'activation': 'tanh', 'max_iter': 1248}. Best is trial 2 with value: 0.38596260805811045.
[I 2025-11-27 20:52:28,272] Trial 13 finished with value: 0.3898816301665399 and parameters: {'layer_0_size': 266, 'activation': 'tanh', 'max_iter': 1230}. Best is trial 13 with value: 0.3898816301665399.
[I 2025-11-27 20:52:30,003] Trial 14 finished with value: 0.385208001603853 and parameters: {'layer_0_size': 158, 'activation': 'tanh', 'max_iter': 1206}. Best is trial 13 with value: 0.3898816301665399.
[I 2025-11-27 20:52:31,939] Trial 15 finished with value: 0.3833054775957921 and parameters: {'layer_0_size': 257, 'activation': 'tanh', 'max_iter': 1200}. Best is trial 13 with value: 0.3898816301665399.
[I 2025-11-27 20:52:33,365] Trial 16 finished with value: 0.38589043401760387 and parameters: {'layer_0_size': 155, 'activation': 'tanh', 'max_iter': 1275}. Best is trial 13 with value: 0.3898816301665399.
[I 2025-11-27 20:52:35,519] Trial 17 finished with value: 0.3875574092905889 and parameters: {'layer_0_size': 362, 'activation': 'tanh', 'max_iter': 639}. Best is trial 13 with value: 0.3898816301665399.
[I 2025-11-27 20:52:37,799] Trial 18 finished with value: 0.3914998646430305 and parameters: {'layer_0_size': 361, 'activation': 'tanh', 'max_iter': 576}. Best is trial 18 with value: 0.3914998646430305.
[I 2025-11-27 20:52:40,047] Trial 19 finished with value: 0.3713512051107897 and parameters: {'layer_0_size': 272, 'activation': 'relu', 'max_iter': 531}. Best is trial 18 with value: 0.3914998646430305.
[I 2025-11-27 20:52:41,745] Trial 20 finished with value: 0.38615839104470817 and parameters: {'layer_0_size': 209, 'activation': 'tanh', 'max_iter': 711}. Best is trial 18 with value: 0.3914998646430305.
[I 2025-11-27 20:52:44,057] Trial 21 finished with value: 0.3872050211665673 and parameters: {'layer_0_size': 366, 'activation': 'tanh', 'max_iter': 602}. Best is trial 18 with value: 0.3914998646430305.
[I 2025-11-27 20:52:46,607] Trial 22 finished with value: 0.38617906810075053 and parameters: {'layer_0_size': 368, 'activation': 'tanh', 'max_iter': 371}. Best is trial 18 with value: 0.3914998646430305.
[I 2025-11-27 20:52:49,271] Trial 23 finished with value: 0.3868960994992917 and parameters: {'layer_0_size': 309, 'activation': 'tanh', 'max_iter': 681}. Best is trial 18 with value: 0.3914998646430305.
[I 2025-11-27 20:52:52,075] Trial 24 finished with value: 0.386113729136099 and parameters: {'layer_0_size': 362, 'activation': 'tanh', 'max_iter': 884}. Best is trial 18 with value: 0.3914998646430305.
[I 2025-11-27 20:52:54,152] Trial 25 finished with value: 0.38275682153924306 and parameters: {'layer_0_size': 236, 'activation': 'tanh', 'max_iter': 289}. Best is trial 18 with value: 0.3914998646430305.
[I 2025-11-27 20:52:56,190] Trial 26 finished with value: 0.38492538345495503 and parameters: {'layer_0_size': 279, 'activation': 'tanh', 'max_iter': 664}. Best is trial 18 with value: 0.3914998646430305.
[I 2025-11-27 20:52:58,318] Trial 27 finished with value: 0.39456042645516143 and parameters: {'layer_0_size': 331, 'activation': 'tanh', 'max_iter': 475}. Best is trial 27 with value: 0.39456042645516143.
[I 2025-11-27 20:53:00,540] Trial 28 finished with value: 0.3671750363616619 and parameters: {'layer_0_size': 320, 'activation': 'relu', 'max_iter': 167}. Best is trial 27 with value: 0.39456042645516143.
[I 2025-11-27 20:53:02,864] Trial 29 finished with value: 0.37927663708347414 and parameters: {'layer_0_size': 344, 'activation': 'logistic', 'max_iter': 439}. Best is trial 27 with value: 0.39456042645516143.
[I 2025-11-27 20:53:03,949] A new study created in memory with name: xgboost_fold_1
[I 2025-11-27 20:53:13,604] Trial 0 finished with value: 0.37368256946000444 and parameters: {'learning_rate': 0.10947143803527554, 'max_depth': 25}. Best is trial 0 with value: 0.37368256946000444.
[I 2025-11-27 20:53:16,276] Trial 1 finished with value: 0.38565054186261705 and parameters: {'learning_rate': 0.07883027603087073, 'max_depth': 5}. Best is trial 1 with value: 0.38565054186261705.
[I 2025-11-27 20:53:24,000] Trial 2 finished with value: 0.38070747319670956 and parameters: {'learning_rate': 0.01775533917079501, 'max_depth': 11}. Best is trial 1 with value: 0.38565054186261705.
[I 2025-11-27 20:53:32,403] Trial 3 finished with value: 0.36891168026833177 and parameters: {'learning_rate': 0.00797377147704141, 'max_depth': 13}. Best is trial 1 with value: 0.38565054186261705.
[I 2025-11-27 20:53:38,744] Trial 4 finished with value: 0.37113452255930657 and parameters: {'learning_rate': 0.2654517243447307, 'max_depth': 17}. Best is trial 1 with value: 0.38565054186261705.
[I 2025-11-27 20:53:44,025] Trial 5 finished with value: 0.3822547199713342 and parameters: {'learning_rate': 0.028039623603070517, 'max_depth': 8}. Best is trial 1 with value: 0.38565054186261705.
[I 2025-11-27 20:53:56,881] Trial 6 finished with value: 0.3826581227591221 and parameters: {'learning_rate': 0.053770655955837444, 'max_depth': 25}. Best is trial 1 with value: 0.38565054186261705.
[I 2025-11-27 20:54:05,184] Trial 7 finished with value: 0.3734796737017997 and parameters: {'learning_rate': 0.15320524481953077, 'max_depth': 18}. Best is trial 1 with value: 0.38565054186261705.
[I 2025-11-27 20:54:09,150] Trial 8 finished with value: 0.3753527812932092 and parameters: {'learning_rate': 0.14694496286073228, 'max_depth': 7}. Best is trial 1 with value: 0.38565054186261705.
[I 2025-11-27 20:54:10,365] Trial 9 finished with value: 0.38805163746204946 and parameters: {'learning_rate': 0.09056317641503948, 'max_depth': 2}. Best is trial 9 with value: 0.38805163746204946.
[I 2025-11-27 20:54:11,590] Trial 10 finished with value: 0.3765110722143032 and parameters: {'learning_rate': 0.005919583552127065, 'max_depth': 2}. Best is trial 9 with value: 0.38805163746204946.
[I 2025-11-27 20:54:12,826] Trial 11 finished with value: 0.387426794307523 and parameters: {'learning_rate': 0.06854186836497234, 'max_depth': 2}. Best is trial 9 with value: 0.38805163746204946.
[I 2025-11-27 20:54:14,055] Trial 12 finished with value: 0.38689688312883697 and parameters: {'learning_rate': 0.041669586124644865, 'max_depth': 2}. Best is trial 9 with value: 0.38805163746204946.
[I 2025-11-27 20:54:29,706] Trial 13 finished with value: 0.3731475405529387 and parameters: {'learning_rate': 0.02194702611599061, 'max_depth': 30}. Best is trial 9 with value: 0.38805163746204946.
[I 2025-11-27 20:54:37,343] Trial 14 finished with value: 0.3809571635928336 and parameters: {'learning_rate': 0.06638993405569181, 'max_depth': 11}. Best is trial 9 with value: 0.38805163746204946.
[I 2025-11-27 20:54:39,978] Trial 15 finished with value: 0.3704554041047674 and parameters: {'learning_rate': 0.23008053835704004, 'max_depth': 5}. Best is trial 9 with value: 0.38805163746204946.
[I 2025-11-27 20:54:41,196] Trial 16 finished with value: 0.38870082791970806 and parameters: {'learning_rate': 0.09158617192919083, 'max_depth': 2}. Best is trial 16 with value: 0.38870082791970806.
[I 2025-11-27 20:54:45,970] Trial 17 finished with value: 0.3758556709668159 and parameters: {'learning_rate': 0.10478817032722543, 'max_depth': 8}. Best is trial 16 with value: 0.38870082791970806.
[I 2025-11-27 20:54:55,690] Trial 18 finished with value: 0.37232355122336913 and parameters: {'learning_rate': 0.011826094928675986, 'max_depth': 14}. Best is trial 16 with value: 0.38870082791970806.
[I 2025-11-27 20:55:08,302] Trial 19 finished with value: 0.380034798275495 and parameters: {'learning_rate': 0.03707947951827094, 'max_depth': 19}. Best is trial 16 with value: 0.38870082791970806.
[I 2025-11-27 20:55:10,936] Trial 20 finished with value: 0.36972413475160054 and parameters: {'learning_rate': 0.19671432718723803, 'max_depth': 5}. Best is trial 16 with value: 0.38870082791970806.
