[I 2025-12-02 11:44:22,647] Trial 19 finished with value: 0.11634367716779126 and parameters: {'n_neighbors': 115, 'algorithm': 'brute', 'p': 1, 'leaf_size': 25}. Best is trial 16 with value: 0.14563681364486375.
[D 2025-12-02 11:44:22,714] Sample trial#20 with TPESampler.
[I 2025-12-02 11:44:22,914] Trial 20 finished with value: 0.14472534787936908 and parameters: {'n_neighbors': 65, 'algorithm': 'auto', 'p': 2, 'leaf_size': 23}. Best is trial 16 with value: 0.14563681364486375.
[D 2025-12-02 11:44:22,983] Sample trial#21 with TPESampler.
[I 2025-12-02 11:44:23,187] Trial 21 finished with value: 0.14472534787936908 and parameters: {'n_neighbors': 65, 'algorithm': 'auto', 'p': 2, 'leaf_size': 21}. Best is trial 16 with value: 0.14563681364486375.
[D 2025-12-02 11:44:23,254] Sample trial#22 with TPESampler.
[I 2025-12-02 11:44:27,302] Trial 22 finished with value: 0.14362339224291937 and parameters: {'n_neighbors': 85, 'algorithm': 'kd_tree', 'p': 2, 'leaf_size': 21}. Best is trial 16 with value: 0.14563681364486375.
[D 2025-12-02 11:44:27,369] Sample trial#23 with TPESampler.
[I 2025-12-02 11:44:30,071] Trial 23 finished with value: 0.14567550909478552 and parameters: {'n_neighbors': 55, 'algorithm': 'ball_tree', 'p': 2, 'leaf_size': 27}. Best is trial 23 with value: 0.14567550909478552.
[D 2025-12-02 11:44:30,138] Sample trial#24 with TPESampler.
[I 2025-12-02 11:44:32,852] Trial 24 finished with value: 0.14567550909478552 and parameters: {'n_neighbors': 55, 'algorithm': 'ball_tree', 'p': 2, 'leaf_size': 26}. Best is trial 23 with value: 0.14567550909478552.
[D 2025-12-02 11:44:32,919] Sample trial#25 with TPESampler.
[I 2025-12-02 11:44:35,604] Trial 25 finished with value: 0.1391528285177915 and parameters: {'n_neighbors': 45, 'algorithm': 'ball_tree', 'p': 2, 'leaf_size': 25}. Best is trial 23 with value: 0.14567550909478552.
[D 2025-12-02 11:44:35,672] Sample trial#26 with TPESampler.
[I 2025-12-02 11:44:38,430] Trial 26 finished with value: 0.1446224537202977 and parameters: {'n_neighbors': 75, 'algorithm': 'ball_tree', 'p': 2, 'leaf_size': 29}. Best is trial 23 with value: 0.14567550909478552.
[D 2025-12-02 11:44:38,496] Sample trial#27 with TPESampler.
[I 2025-12-02 11:44:41,268] Trial 27 finished with value: 0.1446224537202977 and parameters: {'n_neighbors': 75, 'algorithm': 'ball_tree', 'p': 2, 'leaf_size': 20}. Best is trial 23 with value: 0.14567550909478552.
[D 2025-12-02 11:44:41,335] Sample trial#28 with TPESampler.
[I 2025-12-02 11:44:44,024] Trial 28 finished with value: 0.1344347138300958 and parameters: {'n_neighbors': 35, 'algorithm': 'ball_tree', 'p': 2, 'leaf_size': 32}. Best is trial 23 with value: 0.14567550909478552.
[D 2025-12-02 11:44:44,091] Sample trial#29 with TPESampler.
[I 2025-12-02 11:44:48,218] Trial 29 finished with value: 0.11412352949376899 and parameters: {'n_neighbors': 85, 'algorithm': 'kd_tree', 'p': 1, 'leaf_size': 33}. Best is trial 23 with value: 0.14567550909478552.
[I 2025-12-02 11:44:59,307] A new study created in memory with name: k_nearest_neighbors_fold_4
[D 2025-12-02 11:44:59,308] Sample trial#0 with RandomSampler.
[I 2025-12-02 11:44:59,482] Trial 0 finished with value: 0.1460678788840169 and parameters: {'n_neighbors': 45, 'algorithm': 'auto', 'p': 2, 'leaf_size': 37}. Best is trial 0 with value: 0.1460678788840169.
[D 2025-12-02 11:44:59,551] Sample trial#1 with TPESampler.
[I 2025-12-02 11:45:02,101] Trial 1 finished with value: 0.142092582190386 and parameters: {'n_neighbors': 35, 'algorithm': 'ball_tree', 'p': 2, 'leaf_size': 36}. Best is trial 0 with value: 0.1460678788840169.
[D 2025-12-02 11:45:02,168] Sample trial#2 with TPESampler.
[I 2025-12-02 11:45:06,263] Trial 2 finished with value: 0.15264898869055588 and parameters: {'n_neighbors': 65, 'algorithm': 'kd_tree', 'p': 2, 'leaf_size': 35}. Best is trial 2 with value: 0.15264898869055588.
[D 2025-12-02 11:45:06,331] Sample trial#3 with TPESampler.
[I 2025-12-02 11:45:09,143] Trial 3 finished with value: 0.12666416621686322 and parameters: {'n_neighbors': 45, 'algorithm': 'ball_tree', 'p': 1, 'leaf_size': 28}. Best is trial 2 with value: 0.15264898869055588.
[D 2025-12-02 11:45:09,211] Sample trial#4 with TPESampler.
[I 2025-12-02 11:45:09,477] Trial 4 finished with value: 0.1551187490899319 and parameters: {'n_neighbors': 115, 'algorithm': 'auto', 'p': 2, 'leaf_size': 40}. Best is trial 4 with value: 0.1551187490899319.
[D 2025-12-02 11:45:09,549] Sample trial#5 with TPESampler.
[I 2025-12-02 11:45:09,790] Trial 5 finished with value: 0.14973199316009023 and parameters: {'n_neighbors': 95, 'algorithm': 'auto', 'p': 2, 'leaf_size': 21}. Best is trial 4 with value: 0.1551187490899319.
[D 2025-12-02 11:45:09,858] Sample trial#6 with TPESampler.
[I 2025-12-02 11:45:10,388] Trial 6 finished with value: 0.13392396654307187 and parameters: {'n_neighbors': 115, 'algorithm': 'brute', 'p': 1, 'leaf_size': 35}. Best is trial 4 with value: 0.1551187490899319.
[D 2025-12-02 11:45:10,457] Sample trial#7 with TPESampler.
[I 2025-12-02 11:45:13,206] Trial 7 finished with value: 0.15362624440324416 and parameters: {'n_neighbors': 55, 'algorithm': 'ball_tree', 'p': 2, 'leaf_size': 33}. Best is trial 4 with value: 0.1551187490899319.
[D 2025-12-02 11:45:13,274] Sample trial#8 with TPESampler.
[I 2025-12-02 11:45:16,054] Trial 8 finished with value: 0.12792683945135916 and parameters: {'n_neighbors': 65, 'algorithm': 'ball_tree', 'p': 1, 'leaf_size': 22}. Best is trial 4 with value: 0.1551187490899319.
[D 2025-12-02 11:45:16,122] Sample trial#9 with TPESampler.
[I 2025-12-02 11:45:16,322] Trial 9 finished with value: 0.15283178019216315 and parameters: {'n_neighbors': 65, 'algorithm': 'auto', 'p': 2, 'leaf_size': 39}. Best is trial 4 with value: 0.1551187490899319.
[D 2025-12-02 11:45:16,392] Sample trial#10 with TPESampler.
[I 2025-12-02 11:45:16,670] Trial 10 finished with value: 0.1571957536774328 and parameters: {'n_neighbors': 125, 'algorithm': 'auto', 'p': 2, 'leaf_size': 40}. Best is trial 10 with value: 0.1571957536774328.
[D 2025-12-02 11:45:16,739] Sample trial#11 with TPESampler.
[I 2025-12-02 11:45:17,004] Trial 11 finished with value: 0.1551187490899319 and parameters: {'n_neighbors': 115, 'algorithm': 'auto', 'p': 2, 'leaf_size': 37}. Best is trial 10 with value: 0.1571957536774328.
[D 2025-12-02 11:45:17,076] Sample trial#12 with TPESampler.
[I 2025-12-02 11:45:19,825] Trial 12 finished with value: 0.157070253839598 and parameters: {'n_neighbors': 125, 'algorithm': 'ball_tree', 'p': 2, 'leaf_size': 39}. Best is trial 10 with value: 0.1571957536774328.
[D 2025-12-02 11:45:19,894] Sample trial#13 with TPESampler.
[I 2025-12-02 11:45:22,758] Trial 13 finished with value: 0.1546916703754281 and parameters: {'n_neighbors': 115, 'algorithm': 'ball_tree', 'p': 2, 'leaf_size': 33}. Best is trial 10 with value: 0.1571957536774328.
[D 2025-12-02 11:45:22,827] Sample trial#14 with TPESampler.
[I 2025-12-02 11:45:25,514] Trial 14 finished with value: 0.15006611259778752 and parameters: {'n_neighbors': 95, 'algorithm': 'ball_tree', 'p': 2, 'leaf_size': 40}. Best is trial 10 with value: 0.1571957536774328.
[D 2025-12-02 11:45:25,582] Sample trial#15 with TPESampler.
[I 2025-12-02 11:45:28,318] Trial 15 finished with value: 0.157070253839598 and parameters: {'n_neighbors': 125, 'algorithm': 'ball_tree', 'p': 2, 'leaf_size': 39}. Best is trial 10 with value: 0.1571957536774328.
[D 2025-12-02 11:45:28,387] Sample trial#16 with TPESampler.
[I 2025-12-02 11:45:32,602] Trial 16 finished with value: 0.15486541934507492 and parameters: {'n_neighbors': 115, 'algorithm': 'kd_tree', 'p': 2, 'leaf_size': 30}. Best is trial 10 with value: 0.1571957536774328.
[D 2025-12-02 11:45:32,671] Sample trial#17 with TPESampler.
[I 2025-12-02 11:45:35,989] Trial 17 finished with value: 0.15711233482175616 and parameters: {'n_neighbors': 125, 'algorithm': 'kd_tree', 'p': 2, 'leaf_size': 40}. Best is trial 10 with value: 0.1571957536774328.
[D 2025-12-02 11:45:36,057] Sample trial#18 with TPESampler.
[I 2025-12-02 11:45:39,405] Trial 18 finished with value: 0.1330232609914992 and parameters: {'n_neighbors': 115, 'algorithm': 'kd_tree', 'p': 1, 'leaf_size': 40}. Best is trial 10 with value: 0.1571957536774328.
[D 2025-12-02 11:45:39,473] Sample trial#19 with TPESampler.
[I 2025-12-02 11:45:39,991] Trial 19 finished with value: 0.13254623882880043 and parameters: {'n_neighbors': 105, 'algorithm': 'auto', 'p': 1, 'leaf_size': 29}. Best is trial 10 with value: 0.1571957536774328.
[D 2025-12-02 11:45:40,060] Sample trial#20 with TPESampler.
[I 2025-12-02 11:45:43,403] Trial 20 finished with value: 0.15711233482175616 and parameters: {'n_neighbors': 125, 'algorithm': 'kd_tree', 'p': 2, 'leaf_size': 38}. Best is trial 10 with value: 0.1571957536774328.
[D 2025-12-02 11:45:43,472] Sample trial#21 with TPESampler.
[I 2025-12-02 11:45:46,804] Trial 21 finished with value: 0.15711233482175616 and parameters: {'n_neighbors': 125, 'algorithm': 'kd_tree', 'p': 2, 'leaf_size': 40}. Best is trial 10 with value: 0.1571957536774328.
[D 2025-12-02 11:45:46,875] Sample trial#22 with TPESampler.
[I 2025-12-02 11:45:50,132] Trial 22 finished with value: 0.1499778597547006 and parameters: {'n_neighbors': 95, 'algorithm': 'kd_tree', 'p': 2, 'leaf_size': 40}. Best is trial 10 with value: 0.1571957536774328.
[D 2025-12-02 11:45:50,200] Sample trial#23 with TPESampler.
[I 2025-12-02 11:45:50,479] Trial 23 finished with value: 0.1571957536774328 and parameters: {'n_neighbors': 125, 'algorithm': 'brute', 'p': 2, 'leaf_size': 39}. Best is trial 10 with value: 0.1571957536774328.
[D 2025-12-02 11:45:50,548] Sample trial#24 with TPESampler.
[I 2025-12-02 11:45:50,827] Trial 24 finished with value: 0.1571957536774328 and parameters: {'n_neighbors': 125, 'algorithm': 'brute', 'p': 2, 'leaf_size': 36}. Best is trial 10 with value: 0.1571957536774328.
[D 2025-12-02 11:45:50,897] Sample trial#25 with TPESampler.
[I 2025-12-02 11:45:51,174] Trial 25 finished with value: 0.1571957536774328 and parameters: {'n_neighbors': 125, 'algorithm': 'brute', 'p': 2, 'leaf_size': 34}. Best is trial 10 with value: 0.1571957536774328.
[D 2025-12-02 11:45:51,243] Sample trial#26 with TPESampler.
[I 2025-12-02 11:45:51,487] Trial 26 finished with value: 0.14973199316009023 and parameters: {'n_neighbors': 95, 'algorithm': 'brute', 'p': 2, 'leaf_size': 37}. Best is trial 10 with value: 0.1571957536774328.
[D 2025-12-02 11:45:51,557] Sample trial#27 with TPESampler.
[I 2025-12-02 11:45:51,826] Trial 27 finished with value: 0.1551187490899319 and parameters: {'n_neighbors': 115, 'algorithm': 'brute', 'p': 2, 'leaf_size': 38}. Best is trial 10 with value: 0.1571957536774328.
[D 2025-12-02 11:45:51,898] Sample trial#28 with TPESampler.
[I 2025-12-02 11:45:52,073] Trial 28 finished with value: 0.14230274102734813 and parameters: {'n_neighbors': 35, 'algorithm': 'brute', 'p': 2, 'leaf_size': 25}. Best is trial 10 with value: 0.1571957536774328.
[D 2025-12-02 11:45:52,146] Sample trial#29 with TPESampler.
[I 2025-12-02 11:45:52,650] Trial 29 finished with value: 0.13366448125736047 and parameters: {'n_neighbors': 95, 'algorithm': 'auto', 'p': 1, 'leaf_size': 40}. Best is trial 10 with value: 0.1571957536774328.
[I 2025-12-02 11:45:53,685] A new study created in memory with name: k_nearest_neighbors_fold_5
[D 2025-12-02 11:45:53,685] Sample trial#0 with RandomSampler.
[I 2025-12-02 11:45:53,965] Trial 0 finished with value: 0.12698248571270251 and parameters: {'n_neighbors': 125, 'algorithm': 'brute', 'p': 2, 'leaf_size': 40}. Best is trial 0 with value: 0.12698248571270251.
[D 2025-12-02 11:45:54,039] Sample trial#1 with TPESampler.
[I 2025-12-02 11:45:58,201] Trial 1 finished with value: 0.11801710957515801 and parameters: {'n_neighbors': 115, 'algorithm': 'kd_tree', 'p': 1, 'leaf_size': 24}. Best is trial 0 with value: 0.12698248571270251.
[D 2025-12-02 11:45:58,270] Sample trial#2 with TPESampler.
[I 2025-12-02 11:45:58,809] Trial 2 finished with value: 0.11650426457633548 and parameters: {'n_neighbors': 115, 'algorithm': 'auto', 'p': 1, 'leaf_size': 23}. Best is trial 0 with value: 0.12698248571270251.
[D 2025-12-02 11:45:58,884] Sample trial#3 with TPESampler.
[I 2025-12-02 11:45:59,411] Trial 3 finished with value: 0.11575404095257151 and parameters: {'n_neighbors': 105, 'algorithm': 'brute', 'p': 1, 'leaf_size': 29}. Best is trial 0 with value: 0.12698248571270251.
[D 2025-12-02 11:45:59,482] Sample trial#4 with TPESampler.
[I 2025-12-02 11:45:59,709] Trial 4 finished with value: 0.12332141687054184 and parameters: {'n_neighbors': 85, 'algorithm': 'brute', 'p': 2, 'leaf_size': 22}. Best is trial 0 with value: 0.12698248571270251.
[D 2025-12-02 11:45:59,782] Sample trial#5 with TPESampler.
[I 2025-12-02 11:46:00,207] Trial 5 finished with value: 0.11104487633280058 and parameters: {'n_neighbors': 45, 'algorithm': 'brute', 'p': 1, 'leaf_size': 23}. Best is trial 0 with value: 0.12698248571270251.
[D 2025-12-02 11:46:00,276] Sample trial#6 with TPESampler.
[I 2025-12-02 11:46:00,765] Trial 6 finished with value: 0.11487786161497002 and parameters: {'n_neighbors': 85, 'algorithm': 'auto', 'p': 1, 'leaf_size': 28}. Best is trial 0 with value: 0.12698248571270251.
[D 2025-12-02 11:46:00,837] Sample trial#7 with TPESampler.
[I 2025-12-02 11:46:04,882] Trial 7 finished with value: 0.12406768325496742 and parameters: {'n_neighbors': 85, 'algorithm': 'kd_tree', 'p': 2, 'leaf_size': 32}. Best is trial 0 with value: 0.12698248571270251.
[D 2025-12-02 11:46:04,952] Sample trial#8 with TPESampler.
[I 2025-12-02 11:46:07,645] Trial 8 finished with value: 0.11193205497320266 and parameters: {'n_neighbors': 55, 'algorithm': 'ball_tree', 'p': 1, 'leaf_size': 22}. Best is trial 0 with value: 0.12698248571270251.
[D 2025-12-02 11:46:07,715] Sample trial#9 with TPESampler.
[I 2025-12-02 11:46:11,735] Trial 9 finished with value: 0.11234675651579165 and parameters: {'n_neighbors': 55, 'algorithm': 'kd_tree', 'p': 1, 'leaf_size': 21}. Best is trial 0 with value: 0.12698248571270251.
[D 2025-12-02 11:46:11,805] Sample trial#10 with TPESampler.
[I 2025-12-02 11:46:12,087] Trial 10 finished with value: 0.12698248571270251 and parameters: {'n_neighbors': 125, 'algorithm': 'brute', 'p': 2, 'leaf_size': 33}. Best is trial 0 with value: 0.12698248571270251.
[D 2025-12-02 11:46:12,158] Sample trial#11 with TPESampler.
[I 2025-12-02 11:46:12,427] Trial 11 finished with value: 0.12476914656628701 and parameters: {'n_neighbors': 115, 'algorithm': 'brute', 'p': 2, 'leaf_size': 36}. Best is trial 0 with value: 0.12698248571270251.
[D 2025-12-02 11:46:12,499] Sample trial#12 with TPESampler.
[I 2025-12-02 11:46:13,049] Trial 12 finished with value: 0.11800273928244283 and parameters: {'n_neighbors': 125, 'algorithm': 'brute', 'p': 1, 'leaf_size': 39}. Best is trial 0 with value: 0.12698248571270251.
[D 2025-12-02 11:46:13,120] Sample trial#13 with TPESampler.
[I 2025-12-02 11:46:13,401] Trial 13 finished with value: 0.12698248571270251 and parameters: {'n_neighbors': 125, 'algorithm': 'brute', 'p': 2, 'leaf_size': 25}. Best is trial 0 with value: 0.12698248571270251.
[D 2025-12-02 11:46:13,474] Sample trial#14 with TPESampler.
[I 2025-12-02 11:46:16,093] Trial 14 finished with value: 0.12372425997599348 and parameters: {'n_neighbors': 85, 'algorithm': 'ball_tree', 'p': 2, 'leaf_size': 40}. Best is trial 0 with value: 0.12698248571270251.
[D 2025-12-02 11:46:16,163] Sample trial#15 with TPESampler.
[I 2025-12-02 11:46:16,392] Trial 15 finished with value: 0.12332141687054184 and parameters: {'n_neighbors': 85, 'algorithm': 'brute', 'p': 2, 'leaf_size': 40}. Best is trial 0 with value: 0.12698248571270251.
[D 2025-12-02 11:46:16,465] Sample trial#16 with TPESampler.
[I 2025-12-02 11:46:16,744] Trial 16 finished with value: 0.12698248571270251 and parameters: {'n_neighbors': 125, 'algorithm': 'auto', 'p': 2, 'leaf_size': 38}. Best is trial 0 with value: 0.12698248571270251.
[D 2025-12-02 11:46:16,816] Sample trial#17 with TPESampler.
[I 2025-12-02 11:46:17,071] Trial 17 finished with value: 0.12357116962790378 and parameters: {'n_neighbors': 105, 'algorithm': 'auto', 'p': 2, 'leaf_size': 30}. Best is trial 0 with value: 0.12698248571270251.
[D 2025-12-02 11:46:17,142] Sample trial#18 with TPESampler.
[I 2025-12-02 11:46:19,907] Trial 18 finished with value: 0.1255859005645717 and parameters: {'n_neighbors': 115, 'algorithm': 'ball_tree', 'p': 2, 'leaf_size': 33}. Best is trial 0 with value: 0.12698248571270251.
[D 2025-12-02 11:46:19,977] Sample trial#19 with TPESampler.
[I 2025-12-02 11:46:20,261] Trial 19 finished with value: 0.12698248571270251 and parameters: {'n_neighbors': 125, 'algorithm': 'brute', 'p': 2, 'leaf_size': 40}. Best is trial 0 with value: 0.12698248571270251.
[D 2025-12-02 11:46:20,334] Sample trial#20 with TPESampler.
[I 2025-12-02 11:46:20,762] Trial 20 finished with value: 0.11104487633280058 and parameters: {'n_neighbors': 45, 'algorithm': 'auto', 'p': 1, 'leaf_size': 37}. Best is trial 0 with value: 0.12698248571270251.
[D 2025-12-02 11:46:20,834] Sample trial#21 with TPESampler.
[I 2025-12-02 11:46:21,114] Trial 21 finished with value: 0.12698248571270251 and parameters: {'n_neighbors': 125, 'algorithm': 'brute', 'p': 2, 'leaf_size': 28}. Best is trial 0 with value: 0.12698248571270251.
[D 2025-12-02 11:46:21,186] Sample trial#22 with TPESampler.
[I 2025-12-02 11:46:23,986] Trial 22 finished with value: 0.1255859005645717 and parameters: {'n_neighbors': 115, 'algorithm': 'ball_tree', 'p': 2, 'leaf_size': 22}. Best is trial 0 with value: 0.12698248571270251.
[D 2025-12-02 11:46:24,057] Sample trial#23 with TPESampler.
[I 2025-12-02 11:46:24,338] Trial 23 finished with value: 0.12698248571270251 and parameters: {'n_neighbors': 125, 'algorithm': 'brute', 'p': 2, 'leaf_size': 24}. Best is trial 0 with value: 0.12698248571270251.
[D 2025-12-02 11:46:24,410] Sample trial#24 with TPESampler.
[I 2025-12-02 11:46:27,020] Trial 24 finished with value: 0.11968865311569746 and parameters: {'n_neighbors': 25, 'algorithm': 'ball_tree', 'p': 2, 'leaf_size': 32}. Best is trial 0 with value: 0.12698248571270251.
[D 2025-12-02 11:46:27,090] Sample trial#25 with TPESampler.
[I 2025-12-02 11:46:31,161] Trial 25 finished with value: 0.12733471453528972 and parameters: {'n_neighbors': 125, 'algorithm': 'kd_tree', 'p': 2, 'leaf_size': 30}. Best is trial 25 with value: 0.12733471453528972.
[D 2025-12-02 11:46:31,233] Sample trial#26 with TPESampler.
[I 2025-12-02 11:46:31,460] Trial 26 finished with value: 0.12332141687054184 and parameters: {'n_neighbors': 85, 'algorithm': 'brute', 'p': 2, 'leaf_size': 31}. Best is trial 25 with value: 0.12733471453528972.
[D 2025-12-02 11:46:31,531] Sample trial#27 with TPESampler.
[I 2025-12-02 11:46:35,579] Trial 27 finished with value: 0.1260155953507705 and parameters: {'n_neighbors': 115, 'algorithm': 'kd_tree', 'p': 2, 'leaf_size': 32}. Best is trial 25 with value: 0.12733471453528972.
[D 2025-12-02 11:46:35,650] Sample trial#28 with TPESampler.
[I 2025-12-02 11:46:38,855] Trial 28 finished with value: 0.12441243726273658 and parameters: {'n_neighbors': 105, 'algorithm': 'kd_tree', 'p': 2, 'leaf_size': 38}. Best is trial 25 with value: 0.12733471453528972.
[D 2025-12-02 11:46:38,926] Sample trial#29 with TPESampler.
[I 2025-12-02 11:46:42,998] Trial 29 finished with value: 0.12733471453528972 and parameters: {'n_neighbors': 125, 'algorithm': 'kd_tree', 'p': 2, 'leaf_size': 26}. Best is trial 25 with value: 0.12733471453528972.
[I 2025-12-02 11:48:01,813] A new study created in memory with name: decision_tree_fold_1
[D 2025-12-02 11:48:01,814] Sample trial#0 with RandomSampler.
[I 2025-12-02 11:48:01,958] Trial 0 finished with value: 0.09780794135710658 and parameters: {'max_depth': 9, 'min_samples_split': 11, 'min_samples_leaf': 19, 'criterion': 'log_loss', 'max_features': 'log2', 'splitter': 'best'}. Best is trial 0 with value: 0.09780794135710658.
[D 2025-12-02 11:48:02,031] Sample trial#1 with TPESampler.
[I 2025-12-02 11:48:02,220] Trial 1 finished with value: 0.09108724060067461 and parameters: {'max_depth': 31, 'min_samples_split': 7, 'min_samples_leaf': 20, 'criterion': 'gini', 'max_features': 'sqrt', 'splitter': 'best'}. Best is trial 0 with value: 0.09780794135710658.
[D 2025-12-02 11:48:02,293] Sample trial#2 with TPESampler.
[I 2025-12-02 11:48:02,331] Trial 2 finished with value: 0.06660579514780038 and parameters: {'max_depth': 2, 'min_samples_split': 10, 'min_samples_leaf': 19, 'criterion': 'gini', 'max_features': 'sqrt', 'splitter': 'random'}. Best is trial 0 with value: 0.09780794135710658.
[D 2025-12-02 11:48:02,404] Sample trial#3 with TPESampler.
[I 2025-12-02 11:48:02,451] Trial 3 finished with value: 0.08902661644538182 and parameters: {'max_depth': 22, 'min_samples_split': 18, 'min_samples_leaf': 16, 'criterion': 'gini', 'max_features': 'log2', 'splitter': 'random'}. Best is trial 0 with value: 0.09780794135710658.
[D 2025-12-02 11:48:02,524] Sample trial#4 with TPESampler.
[I 2025-12-02 11:48:02,734] Trial 4 finished with value: 0.0870796057595061 and parameters: {'max_depth': 28, 'min_samples_split': 7, 'min_samples_leaf': 17, 'criterion': 'gini', 'max_features': 'sqrt', 'splitter': 'best'}. Best is trial 0 with value: 0.09780794135710658.
[D 2025-12-02 11:48:02,806] Sample trial#5 with TPESampler.
[I 2025-12-02 11:48:03,004] Trial 5 finished with value: 0.07727005319316313 and parameters: {'max_depth': 30, 'min_samples_split': 11, 'min_samples_leaf': 15, 'criterion': 'entropy', 'max_features': 'log2', 'splitter': 'best'}. Best is trial 0 with value: 0.09780794135710658.
[D 2025-12-02 11:48:03,077] Sample trial#6 with TPESampler.
