[I 2025-12-02 13:35:50,263] Trial 0 finished with value: 0.14649128124084393 and parameters: {'max_iter': 160, 'learning_rate': 0.06852581113031882, 'max_depth': 2, 'min_samples_leaf': 20, 'l2_regularization': 0.975403070536636}. Best is trial 0 with value: 0.14649128124084393.
[D 2025-12-02 13:35:50,382] Sample trial#1 with GPSampler.
[I 2025-12-02 13:35:50,849] Trial 1 finished with value: 0.1539841687289291 and parameters: {'max_iter': 61, 'learning_rate': 0.08586174277796436, 'max_depth': 3, 'min_samples_leaf': 25, 'l2_regularization': 0.759907518049226}. Best is trial 1 with value: 0.1539841687289291.
[D 2025-12-02 13:35:50,965] Sample trial#2 with GPSampler.
[I 2025-12-02 13:35:51,427] Trial 2 finished with value: 0.14613599787288792 and parameters: {'max_iter': 93, 'learning_rate': 0.089847679145849, 'max_depth': 2, 'min_samples_leaf': 30, 'l2_regularization': 0.5593999535500088}. Best is trial 1 with value: 0.1539841687289291.
[D 2025-12-02 13:35:51,541] Sample trial#3 with GPSampler.
[I 2025-12-02 13:35:52,337] Trial 3 finished with value: 0.1478608376849043 and parameters: {'max_iter': 174, 'learning_rate': 0.028722990243811426, 'max_depth': 4, 'min_samples_leaf': 17, 'l2_regularization': 0.4476171413958291}. Best is trial 1 with value: 0.1539841687289291.
[D 2025-12-02 13:35:52,449] Sample trial#4 with GPSampler.
[I 2025-12-02 13:35:52,917] Trial 4 finished with value: 0.1467510282442948 and parameters: {'max_iter': 126, 'learning_rate': 0.060535383570488946, 'max_depth': 2, 'min_samples_leaf': 28, 'l2_regularization': 0.0463630569390352}. Best is trial 1 with value: 0.1539841687289291.
[D 2025-12-02 13:35:53,036] Sample trial#5 with GPSampler.
[I 2025-12-02 13:35:53,536] Trial 5 finished with value: 0.14292582926973435 and parameters: {'max_iter': 66, 'learning_rate': 0.022682925403797176, 'max_depth': 4, 'min_samples_leaf': 28, 'l2_regularization': 0.4636204577352212}. Best is trial 1 with value: 0.1539841687289291.
[D 2025-12-02 13:35:53,648] Sample trial#6 with GPSampler.
[I 2025-12-02 13:35:54,125] Trial 6 finished with value: 0.14701690596178127 and parameters: {'max_iter': 139, 'learning_rate': 0.08594965478265448, 'max_depth': 2, 'min_samples_leaf': 26, 'l2_regularization': 0.568444047313562}. Best is trial 1 with value: 0.1539841687289291.
[D 2025-12-02 13:35:54,242] Sample trial#7 with GPSampler.
[I 2025-12-02 13:35:55,142] Trial 7 finished with value: 0.14424805038693345 and parameters: {'max_iter': 140, 'learning_rate': 0.009004679979806592, 'max_depth': 4, 'min_samples_leaf': 7, 'l2_regularization': 0.09497314686061964}. Best is trial 1 with value: 0.1539841687289291.
[D 2025-12-02 13:35:55,260] Sample trial#8 with GPSampler.
[I 2025-12-02 13:35:56,149] Trial 8 finished with value: 0.12891725061901033 and parameters: {'max_iter': 144, 'learning_rate': 0.09583950411336414, 'max_depth': 5, 'min_samples_leaf': 20, 'l2_regularization': 0.0006164050177939195}. Best is trial 1 with value: 0.1539841687289291.
[D 2025-12-02 13:35:56,263] Sample trial#9 with GPSampler.
[I 2025-12-02 13:35:56,863] Trial 9 finished with value: 0.149044181371138 and parameters: {'max_iter': 104, 'learning_rate': 0.0332439667608915, 'max_depth': 4, 'min_samples_leaf': 30, 'l2_regularization': 0.0956841241530586}. Best is trial 1 with value: 0.1539841687289291.
[D 2025-12-02 13:35:56,980] Sample trial#10 with GPSampler.
[I 2025-12-02 13:35:57,490] Trial 10 finished with value: 0.14079042520752277 and parameters: {'max_iter': 50, 'learning_rate': 0.09309727959164454, 'max_depth': 4, 'min_samples_leaf': 20, 'l2_regularization': 0.9095264783260105}. Best is trial 1 with value: 0.1539841687289291.
[D 2025-12-02 13:35:57,603] Sample trial#11 with GPSampler.
[I 2025-12-02 13:35:58,285] Trial 11 finished with value: 0.14477276019479032 and parameters: {'max_iter': 152, 'learning_rate': 0.06742260326541832, 'max_depth': 3, 'min_samples_leaf': 29, 'l2_regularization': 0.0939684008044716}. Best is trial 1 with value: 0.1539841687289291.
[D 2025-12-02 13:35:58,406] Sample trial#12 with GPSampler.
[I 2025-12-02 13:35:58,901] Trial 12 finished with value: 0.15233178061448754 and parameters: {'max_iter': 50, 'learning_rate': 0.08353442171817593, 'max_depth': 3, 'min_samples_leaf': 9, 'l2_regularization': 1.0}. Best is trial 1 with value: 0.1539841687289291.
[D 2025-12-02 13:35:59,021] Sample trial#13 with GPSampler.
[I 2025-12-02 13:35:59,450] Trial 13 finished with value: 0.14632884240306746 and parameters: {'max_iter': 50, 'learning_rate': 0.09274733227735169, 'max_depth': 3, 'min_samples_leaf': 30, 'l2_regularization': 1.0}. Best is trial 1 with value: 0.1539841687289291.
[D 2025-12-02 13:35:59,564] Sample trial#14 with GPSampler.
[I 2025-12-02 13:36:00,022] Trial 14 finished with value: 0.14731030648162766 and parameters: {'max_iter': 50, 'learning_rate': 0.0766804912710578, 'max_depth': 3, 'min_samples_leaf': 13, 'l2_regularization': 0.7146546376727508}. Best is trial 1 with value: 0.1539841687289291.
[D 2025-12-02 13:36:00,140] Sample trial#15 with GPSampler.
[I 2025-12-02 13:36:00,748] Trial 15 finished with value: 0.1521758830984415 and parameters: {'max_iter': 50, 'learning_rate': 0.08358513558084577, 'max_depth': 3, 'min_samples_leaf': 30, 'l2_regularization': 1.0}. Best is trial 1 with value: 0.1539841687289291.
[D 2025-12-02 13:36:00,863] Sample trial#16 with GPSampler.
[I 2025-12-02 13:36:02,554] Trial 16 finished with value: 0.14330436219784948 and parameters: {'max_iter': 200, 'learning_rate': 0.04312542758294042, 'max_depth': 5, 'min_samples_leaf': 1, 'l2_regularization': 0.0}. Best is trial 1 with value: 0.1539841687289291.
[D 2025-12-02 13:36:02,666] Sample trial#17 with GPSampler.
[I 2025-12-02 13:36:03,365] Trial 17 finished with value: 0.14753517105724454 and parameters: {'max_iter': 200, 'learning_rate': 0.03591878393205172, 'max_depth': 2, 'min_samples_leaf': 30, 'l2_regularization': 0.0}. Best is trial 1 with value: 0.1539841687289291.
[D 2025-12-02 13:36:03,480] Sample trial#18 with GPSampler.
[I 2025-12-02 13:36:03,918] Trial 18 finished with value: 0.14884428899009988 and parameters: {'max_iter': 50, 'learning_rate': 0.08542875998195912, 'max_depth': 3, 'min_samples_leaf': 19, 'l2_regularization': 0.12294626452465635}. Best is trial 1 with value: 0.1539841687289291.
[D 2025-12-02 13:36:04,030] Sample trial#19 with GPSampler.
[I 2025-12-02 13:36:04,849] Trial 19 finished with value: 0.14751997316401871 and parameters: {'max_iter': 200, 'learning_rate': 0.04329308932278047, 'max_depth': 3, 'min_samples_leaf': 30, 'l2_regularization': 1.0}. Best is trial 1 with value: 0.1539841687289291.
[D 2025-12-02 13:36:04,968] Sample trial#20 with GPSampler.
[I 2025-12-02 13:36:05,696] Trial 20 finished with value: 0.13826860160832039 and parameters: {'max_iter': 200, 'learning_rate': 0.009, 'max_depth': 2, 'min_samples_leaf': 1, 'l2_regularization': 1.0}. Best is trial 1 with value: 0.1539841687289291.
[D 2025-12-02 13:36:05,812] Sample trial#21 with GPSampler.
[I 2025-12-02 13:36:06,561] Trial 21 finished with value: 0.1464636653496802 and parameters: {'max_iter': 181, 'learning_rate': 0.08397595307271208, 'max_depth': 3, 'min_samples_leaf': 20, 'l2_regularization': 0.9999999999999999}. Best is trial 1 with value: 0.1539841687289291.
[D 2025-12-02 13:36:06,674] Sample trial#22 with GPSampler.
[I 2025-12-02 13:36:07,125] Trial 22 finished with value: 0.14774362046814166 and parameters: {'max_iter': 50, 'learning_rate': 0.042440674608869806, 'max_depth': 2, 'min_samples_leaf': 1, 'l2_regularization': 0.0}. Best is trial 1 with value: 0.1539841687289291.
[D 2025-12-02 13:36:07,240] Sample trial#23 with GPSampler.
[I 2025-12-02 13:36:07,815] Trial 23 finished with value: 0.14846402383267102 and parameters: {'max_iter': 50, 'learning_rate': 0.04352911539015623, 'max_depth': 5, 'min_samples_leaf': 30, 'l2_regularization': 1.0}. Best is trial 1 with value: 0.1539841687289291.
[D 2025-12-02 13:36:07,934] Sample trial#24 with GPSampler.
[I 2025-12-02 13:36:08,373] Trial 24 finished with value: 0.1457470120404308 and parameters: {'max_iter': 50, 'learning_rate': 0.08429860819563337, 'max_depth': 2, 'min_samples_leaf': 1, 'l2_regularization': 1.0}. Best is trial 1 with value: 0.1539841687289291.
[D 2025-12-02 13:36:08,485] Sample trial#25 with GPSampler.
[I 2025-12-02 13:36:08,956] Trial 25 finished with value: 0.1468337421309219 and parameters: {'max_iter': 50, 'learning_rate': 0.04529339941444631, 'max_depth': 3, 'min_samples_leaf': 30, 'l2_regularization': 0.0}. Best is trial 1 with value: 0.1539841687289291.
[D 2025-12-02 13:36:09,068] Sample trial#26 with GPSampler.
[I 2025-12-02 13:36:09,678] Trial 26 finished with value: 0.14505997480776817 and parameters: {'max_iter': 50, 'learning_rate': 0.0620623051354932, 'max_depth': 5, 'min_samples_leaf': 30, 'l2_regularization': 1.0}. Best is trial 1 with value: 0.1539841687289291.
[D 2025-12-02 13:36:09,792] Sample trial#27 with GPSampler.
[I 2025-12-02 13:36:10,512] Trial 27 finished with value: 0.14649887122644958 and parameters: {'max_iter': 200, 'learning_rate': 0.04998713323118027, 'max_depth': 2, 'min_samples_leaf': 1, 'l2_regularization': 1.0}. Best is trial 1 with value: 0.1539841687289291.
[D 2025-12-02 13:36:10,628] Sample trial#28 with GPSampler.
[I 2025-12-02 13:36:11,197] Trial 28 finished with value: 0.14374190050532196 and parameters: {'max_iter': 50, 'learning_rate': 0.038980415622260144, 'max_depth': 4, 'min_samples_leaf': 1, 'l2_regularization': 1.0}. Best is trial 1 with value: 0.1539841687289291.
[D 2025-12-02 13:36:11,310] Sample trial#29 with GPSampler.
[I 2025-12-02 13:36:12,696] Trial 29 finished with value: 0.1471965551493331 and parameters: {'max_iter': 200, 'learning_rate': 0.025240479300310127, 'max_depth': 5, 'min_samples_leaf': 30, 'l2_regularization': 0.0}. Best is trial 1 with value: 0.1539841687289291.
[I 2025-12-02 13:36:13,248] A new study created in memory with name: histogram_gradient_boosting_fold_3
[D 2025-12-02 13:36:13,249] Sample trial#0 with RandomSampler.
[I 2025-12-02 13:36:13,693] Trial 0 finished with value: 0.14862045284602535 and parameters: {'max_iter': 53, 'learning_rate': 0.09219243531264319, 'max_depth': 2, 'min_samples_leaf': 26, 'l2_regularization': 0.20498535711652388}. Best is trial 0 with value: 0.14862045284602535.
[D 2025-12-02 13:36:13,815] Sample trial#1 with GPSampler.
[I 2025-12-02 13:36:14,603] Trial 1 finished with value: 0.15529829888875307 and parameters: {'max_iter': 192, 'learning_rate': 0.055090418881965746, 'max_depth': 3, 'min_samples_leaf': 30, 'l2_regularization': 0.5903011520537591}. Best is trial 1 with value: 0.15529829888875307.
[D 2025-12-02 13:36:14,720] Sample trial#2 with GPSampler.
[I 2025-12-02 13:36:15,150] Trial 2 finished with value: 0.1434018283354475 and parameters: {'max_iter': 98, 'learning_rate': 0.021759779696480838, 'max_depth': 2, 'min_samples_leaf': 27, 'l2_regularization': 0.6554466476568662}. Best is trial 1 with value: 0.15529829888875307.
[D 2025-12-02 13:36:15,272] Sample trial#3 with GPSampler.
[I 2025-12-02 13:36:16,185] Trial 3 finished with value: 0.137367410673724 and parameters: {'max_iter': 121, 'learning_rate': 0.07384643203999618, 'max_depth': 5, 'min_samples_leaf': 9, 'l2_regularization': 0.887936270213917}. Best is trial 1 with value: 0.15529829888875307.
[D 2025-12-02 13:36:16,304] Sample trial#4 with GPSampler.
[I 2025-12-02 13:36:17,578] Trial 4 finished with value: 0.14167679828703783 and parameters: {'max_iter': 193, 'learning_rate': 0.05324721882483905, 'max_depth': 5, 'min_samples_leaf': 10, 'l2_regularization': 0.3589000196331874}. Best is trial 1 with value: 0.15529829888875307.
[D 2025-12-02 13:36:17,694] Sample trial#5 with GPSampler.
[I 2025-12-02 13:36:18,329] Trial 5 finished with value: 0.15660987100921353 and parameters: {'max_iter': 143, 'learning_rate': 0.08286823314091764, 'max_depth': 3, 'min_samples_leaf': 21, 'l2_regularization': 0.49895539022069546}. Best is trial 5 with value: 0.15660987100921353.
[D 2025-12-02 13:36:18,451] Sample trial#6 with GPSampler.
[I 2025-12-02 13:36:20,025] Trial 6 finished with value: 0.14665512589038926 and parameters: {'max_iter': 189, 'learning_rate': 0.012917282470825419, 'max_depth': 5, 'min_samples_leaf': 15, 'l2_regularization': 0.5586932990563463}. Best is trial 5 with value: 0.15660987100921353.
[D 2025-12-02 13:36:20,144] Sample trial#7 with GPSampler.
[I 2025-12-02 13:36:20,718] Trial 7 finished with value: 0.15038380913528165 and parameters: {'max_iter': 132, 'learning_rate': 0.018909741718397016, 'max_depth': 3, 'min_samples_leaf': 21, 'l2_regularization': 0.2682194712764402}. Best is trial 5 with value: 0.15660987100921353.
[D 2025-12-02 13:36:20,836] Sample trial#8 with GPSampler.
[I 2025-12-02 13:36:21,454] Trial 8 finished with value: 0.15053751120704997 and parameters: {'max_iter': 173, 'learning_rate': 0.05097241441001749, 'max_depth': 2, 'min_samples_leaf': 24, 'l2_regularization': 0.44028922934463166}. Best is trial 5 with value: 0.15660987100921353.
[D 2025-12-02 13:36:21,577] Sample trial#9 with GPSampler.
[I 2025-12-02 13:36:22,118] Trial 9 finished with value: 0.15226070602693217 and parameters: {'max_iter': 121, 'learning_rate': 0.03509724299116375, 'max_depth': 2, 'min_samples_leaf': 4, 'l2_regularization': 0.5064813293228304}. Best is trial 5 with value: 0.15660987100921353.
[D 2025-12-02 13:36:22,235] Sample trial#10 with GPSampler.
[I 2025-12-02 13:36:22,981] Trial 10 finished with value: 0.14748543869564348 and parameters: {'max_iter': 200, 'learning_rate': 0.09088616647022943, 'max_depth': 3, 'min_samples_leaf': 20, 'l2_regularization': 0.25332588181236815}. Best is trial 5 with value: 0.15660987100921353.
[D 2025-12-02 13:36:23,096] Sample trial#11 with GPSampler.
[I 2025-12-02 13:36:23,782] Trial 11 finished with value: 0.15234757363041573 and parameters: {'max_iter': 147, 'learning_rate': 0.08272949957671684, 'max_depth': 3, 'min_samples_leaf': 29, 'l2_regularization': 0.7761463786475129}. Best is trial 5 with value: 0.15660987100921353.
[D 2025-12-02 13:36:23,896] Sample trial#12 with GPSampler.
[I 2025-12-02 13:36:24,704] Trial 12 finished with value: 0.15323989074665895 and parameters: {'max_iter': 182, 'learning_rate': 0.07376866001076524, 'max_depth': 3, 'min_samples_leaf': 14, 'l2_regularization': 0.5871855924900112}. Best is trial 5 with value: 0.15660987100921353.
[D 2025-12-02 13:36:24,822] Sample trial#13 with GPSampler.
[I 2025-12-02 13:36:25,557] Trial 13 finished with value: 0.15186779130130404 and parameters: {'max_iter': 146, 'learning_rate': 0.1, 'max_depth': 3, 'min_samples_leaf': 30, 'l2_regularization': 0.49356511130884173}. Best is trial 5 with value: 0.15660987100921353.
[D 2025-12-02 13:36:25,674] Sample trial#14 with GPSampler.
[I 2025-12-02 13:36:26,437] Trial 14 finished with value: 0.15528209656133787 and parameters: {'max_iter': 125, 'learning_rate': 0.07688413686426435, 'max_depth': 3, 'min_samples_leaf': 14, 'l2_regularization': 0.4126454894507078}. Best is trial 5 with value: 0.15660987100921353.
[D 2025-12-02 13:36:26,555] Sample trial#15 with GPSampler.
[I 2025-12-02 13:36:27,341] Trial 15 finished with value: 0.15458044583680491 and parameters: {'max_iter': 148, 'learning_rate': 0.06499596159822854, 'max_depth': 3, 'min_samples_leaf': 21, 'l2_regularization': 0.5072080267397119}. Best is trial 5 with value: 0.15660987100921353.
[D 2025-12-02 13:36:27,464] Sample trial#16 with GPSampler.
[I 2025-12-02 13:36:28,128] Trial 16 finished with value: 0.15380162817862675 and parameters: {'max_iter': 134, 'learning_rate': 0.1, 'max_depth': 2, 'min_samples_leaf': 8, 'l2_regularization': 0.7745134404362175}. Best is trial 5 with value: 0.15660987100921353.
[D 2025-12-02 13:36:28,250] Sample trial#17 with GPSampler.
[I 2025-12-02 13:36:28,971] Trial 17 finished with value: 0.14893152467690288 and parameters: {'max_iter': 200, 'learning_rate': 0.018250834514705876, 'max_depth': 3, 'min_samples_leaf': 30, 'l2_regularization': 0.9996589139862634}. Best is trial 5 with value: 0.15660987100921353.
[D 2025-12-02 13:36:29,086] Sample trial#18 with GPSampler.
[I 2025-12-02 13:36:29,775] Trial 18 finished with value: 0.1554149609567165 and parameters: {'max_iter': 123, 'learning_rate': 0.09637052591525871, 'max_depth': 3, 'min_samples_leaf': 16, 'l2_regularization': 0.5800819617674616}. Best is trial 5 with value: 0.15660987100921353.
[D 2025-12-02 13:36:29,891] Sample trial#19 with GPSampler.
[I 2025-12-02 13:36:30,433] Trial 19 finished with value: 0.15386825011268151 and parameters: {'max_iter': 101, 'learning_rate': 0.09920737036918308, 'max_depth': 2, 'min_samples_leaf': 1, 'l2_regularization': 0.2919666598711237}. Best is trial 5 with value: 0.15660987100921353.
[D 2025-12-02 13:36:30,549] Sample trial#20 with GPSampler.
[I 2025-12-02 13:36:30,952] Trial 20 finished with value: 0.1488861947882066 and parameters: {'max_iter': 50, 'learning_rate': 0.1, 'max_depth': 2, 'min_samples_leaf': 1, 'l2_regularization': 0.8872773907303498}. Best is trial 5 with value: 0.15660987100921353.
[D 2025-12-02 13:36:31,072] Sample trial#21 with GPSampler.
[I 2025-12-02 13:36:31,727] Trial 21 finished with value: 0.14650965279931633 and parameters: {'max_iter': 200, 'learning_rate': 0.009, 'max_depth': 2, 'min_samples_leaf': 1, 'l2_regularization': 0.0}. Best is trial 5 with value: 0.15660987100921353.
[D 2025-12-02 13:36:31,846] Sample trial#22 with GPSampler.
[I 2025-12-02 13:36:32,375] Trial 22 finished with value: 0.1450477894148706 and parameters: {'max_iter': 50, 'learning_rate': 0.06440341015640558, 'max_depth': 3, 'min_samples_leaf': 1, 'l2_regularization': 0.0}. Best is trial 5 with value: 0.15660987100921353.
[D 2025-12-02 13:36:32,491] Sample trial#23 with GPSampler.
[I 2025-12-02 13:36:33,013] Trial 23 finished with value: 0.1545045421247882 and parameters: {'max_iter': 134, 'learning_rate': 0.09419944682494523, 'max_depth': 2, 'min_samples_leaf': 12, 'l2_regularization': 0.39780308048538127}. Best is trial 5 with value: 0.15660987100921353.
[D 2025-12-02 13:36:33,129] Sample trial#24 with GPSampler.
[I 2025-12-02 13:36:33,687] Trial 24 finished with value: 0.15184680745313409 and parameters: {'max_iter': 144, 'learning_rate': 0.07760950880590205, 'max_depth': 2, 'min_samples_leaf': 1, 'l2_regularization': 0.5285028325464431}. Best is trial 5 with value: 0.15660987100921353.
[D 2025-12-02 13:36:33,801] Sample trial#25 with GPSampler.
[I 2025-12-02 13:36:34,886] Trial 25 finished with value: 0.1599546156424899 and parameters: {'max_iter': 136, 'learning_rate': 0.08787997623331949, 'max_depth': 3, 'min_samples_leaf': 17, 'l2_regularization': 0.02116630227904794}. Best is trial 25 with value: 0.1599546156424899.
[D 2025-12-02 13:36:35,005] Sample trial#26 with GPSampler.
[I 2025-12-02 13:36:35,831] Trial 26 finished with value: 0.15441712494408294 and parameters: {'max_iter': 141, 'learning_rate': 0.09250105110147594, 'max_depth': 3, 'min_samples_leaf': 11, 'l2_regularization': 0.0}. Best is trial 25 with value: 0.1599546156424899.
[D 2025-12-02 13:36:35,950] Sample trial#27 with GPSampler.
[I 2025-12-02 13:36:36,613] Trial 27 finished with value: 0.15747682158696147 and parameters: {'max_iter': 130, 'learning_rate': 0.09584752552983437, 'max_depth': 3, 'min_samples_leaf': 19, 'l2_regularization': 0.0}. Best is trial 25 with value: 0.1599546156424899.
[D 2025-12-02 13:36:36,729] Sample trial#28 with GPSampler.
[I 2025-12-02 13:36:37,458] Trial 28 finished with value: 0.15458439809209468 and parameters: {'max_iter': 147, 'learning_rate': 0.08367719943579992, 'max_depth': 3, 'min_samples_leaf': 17, 'l2_regularization': 0.0}. Best is trial 25 with value: 0.1599546156424899.
[D 2025-12-02 13:36:37,572] Sample trial#29 with GPSampler.
[I 2025-12-02 13:36:38,229] Trial 29 finished with value: 0.131441087941915 and parameters: {'max_iter': 50, 'learning_rate': 0.009, 'max_depth': 5, 'min_samples_leaf': 30, 'l2_regularization': 0.0}. Best is trial 25 with value: 0.1599546156424899.
[I 2025-12-02 13:36:38,788] A new study created in memory with name: histogram_gradient_boosting_fold_4
[D 2025-12-02 13:36:38,788] Sample trial#0 with RandomSampler.
[I 2025-12-02 13:36:39,400] Trial 0 finished with value: 0.17102324717040518 and parameters: {'max_iter': 160, 'learning_rate': 0.08933981688532694, 'max_depth': 2, 'min_samples_leaf': 6, 'l2_regularization': 0.5389750030971248}. Best is trial 0 with value: 0.17102324717040518.
[D 2025-12-02 13:36:39,523] Sample trial#1 with GPSampler.
[I 2025-12-02 13:36:40,063] Trial 1 finished with value: 0.1712201485977797 and parameters: {'max_iter': 86, 'learning_rate': 0.050513152318861596, 'max_depth': 3, 'min_samples_leaf': 21, 'l2_regularization': 0.2011962313140021}. Best is trial 1 with value: 0.1712201485977797.
[D 2025-12-02 13:36:40,189] Sample trial#2 with GPSampler.
[I 2025-12-02 13:36:40,773] Trial 2 finished with value: 0.16902089878420962 and parameters: {'max_iter': 66, 'learning_rate': 0.04187636181575195, 'max_depth': 4, 'min_samples_leaf': 14, 'l2_regularization': 0.92656697257516}. Best is trial 1 with value: 0.1712201485977797.
[D 2025-12-02 13:36:40,895] Sample trial#3 with GPSampler.
[I 2025-12-02 13:36:41,522] Trial 3 finished with value: 0.16696134617455 and parameters: {'max_iter': 174, 'learning_rate': 0.05635245960041239, 'max_depth': 2, 'min_samples_leaf': 27, 'l2_regularization': 0.691986508752479}. Best is trial 1 with value: 0.1712201485977797.
[D 2025-12-02 13:36:41,645] Sample trial#4 with GPSampler.
[I 2025-12-02 13:36:42,661] Trial 4 finished with value: 0.16275532696877842 and parameters: {'max_iter': 184, 'learning_rate': 0.051168009544845613, 'max_depth': 4, 'min_samples_leaf': 28, 'l2_regularization': 0.9059055616752959}. Best is trial 1 with value: 0.1712201485977797.
[D 2025-12-02 13:36:42,785] Sample trial#5 with GPSampler.
