[I 2025-12-02 13:37:31,915] Trial 29 finished with value: 0.15066370166987583 and parameters: {'max_iter': 200, 'learning_rate': 0.05186812234869762, 'max_depth': 3, 'min_samples_leaf': 1, 'l2_regularization': 0.6468090704556985}. Best is trial 17 with value: 0.15427117182829542.
Saved Optuna plots to results/20251202_114155_ana_optimized_binary_less/gradient_boosting/optuna_plots
Fold 2
Importâncias dos parâmetros para fold 2: {'learning_rate': np.float64(0.6551242252091594), 'min_samples_leaf': np.float64(0.11030978675469258), 'subsample': np.float64(0.08465287258505612), 'min_samples_split': np.float64(0.055672142409640135), 'max_features': np.float64(0.03398308107332252), 'max_depth': np.float64(0.03153745183940456), 'n_estimators': np.float64(0.028720440128724833)}
Saved Optuna plots to results/20251202_114155_ana_optimized_binary_less/gradient_boosting/optuna_plots
Fold 3
Importâncias dos parâmetros para fold 3: {'max_depth': np.float64(0.6473089010999162), 'learning_rate': np.float64(0.22870245658281327), 'min_samples_leaf': np.float64(0.04992987793820294), 'subsample': np.float64(0.04522334179838841), 'max_features': np.float64(0.017330251294444488), 'min_samples_split': np.float64(0.008676562828680536), 'n_estimators': np.float64(0.002828608457554084)}
Saved Optuna plots to results/20251202_114155_ana_optimized_binary_less/gradient_boosting/optuna_plots
Fold 4
Importâncias dos parâmetros para fold 4: {'learning_rate': np.float64(0.3965406651566787), 'max_features': np.float64(0.16919352114037645), 'max_depth': np.float64(0.15788976473695143), 'min_samples_leaf': np.float64(0.13551298094161157), 'subsample': np.float64(0.08393261387016268), 'min_samples_split': np.float64(0.03209332338898832), 'n_estimators': np.float64(0.02483713076523079)}
Saved Optuna plots to results/20251202_114155_ana_optimized_binary_less/gradient_boosting/optuna_plots
Fold 5
Importâncias dos parâmetros para fold 5: {'min_samples_leaf': np.float64(0.2523795187801059), 'learning_rate': np.float64(0.252216614285337), 'max_depth': np.float64(0.22378909853245546), 'min_samples_split': np.float64(0.09275743641051003), 'subsample': np.float64(0.08838194363823947), 'max_features': np.float64(0.07502831920090774), 'n_estimators': np.float64(0.01544706915244447)}
Saved Optuna plots to results/20251202_114155_ana_optimized_binary_less/gradient_boosting/optuna_plots

Nested CV completed. The 20% holdout set (3536 samples) remains untouched.
This holdout set can be used for final unbiased evaluation.

Training and evaluating 5 best parameter sets on holdout data...
Testing with 4 balancing strategies: none, randomundersampler, smoteenn, tomeklinks

Evaluating fold 1 best params on holdout set...
  - Testing with balance strategy: none
  - Testing with balance strategy: randomundersampler
  - Testing with balance strategy: smoteenn
  - Testing with balance strategy: tomeklinks

Evaluating fold 2 best params on holdout set...
  - Testing with balance strategy: none
  - Testing with balance strategy: randomundersampler
  - Testing with balance strategy: smoteenn
  - Testing with balance strategy: tomeklinks

Evaluating fold 3 best params on holdout set...
  - Testing with balance strategy: none
  - Testing with balance strategy: randomundersampler
  - Testing with balance strategy: smoteenn
  - Testing with balance strategy: tomeklinks

Evaluating fold 4 best params on holdout set...
  - Testing with balance strategy: none
  - Testing with balance strategy: randomundersampler
  - Testing with balance strategy: smoteenn
  - Testing with balance strategy: tomeklinks

Evaluating fold 5 best params on holdout set...
  - Testing with balance strategy: none
  - Testing with balance strategy: randomundersampler
  - Testing with balance strategy: smoteenn
  - Testing with balance strategy: tomeklinks
Saving optimization and holdout results...
Detailed results by fold saved to: ./results/20251202_114155_ana_optimized_binary_less/gradient_boosting/detailed_results_by_fold.txt
Test predictions for all folds saved to: ./results/20251202_114155_ana_optimized_binary_less/gradient_boosting/metrics.json
Saving holdout results...
Holdout evaluation results saved to: ./results/20251202_114155_ana_optimized_binary_less/gradient_boosting/holdout_results.txt
Saved!
[OK] Gradient Boosting executado com sucesso!
Progresso: 5/9 modelos
================================================================================
EXECUTANDO MODELO: Histogram Gradient Boosting
================================================================================

Starting Nested Cross-Validation for histogram_gradient_boosting...
Configuration: 5 outer folds, 30 trials per fold
Performing 80/20 holdout split...
Holdout split completed:
  - Training set: 14140 samples (80%)
  - Holdout test set: 3536 samples (20%)
Fold 1
Importâncias dos parâmetros para fold 1: {'learning_rate': np.float64(0.516265993256592), 'max_depth': np.float64(0.3905649748444977), 'min_samples_leaf': np.float64(0.0410449944335227), 'max_iter': np.float64(0.02757841575142854), 'l2_regularization': np.float64(0.024545621713959204)}
Saved Optuna plots to results/20251202_114155_ana_optimized_binary_less/histogram_gradient_boosting/optuna_plots
Fold 2
Importâncias dos parâmetros para fold 2: {'learning_rate': np.float64(0.7975776799231851), 'max_depth': np.float64(0.08653614484622772), 'min_samples_leaf': np.float64(0.05367175364671186), 'max_iter': np.float64(0.042583613461983284), 'l2_regularization': np.float64(0.019630808121891958)}
Saved Optuna plots to results/20251202_114155_ana_optimized_binary_less/histogram_gradient_boosting/optuna_plots
Fold 3
Importâncias dos parâmetros para fold 3: {'max_depth': np.float64(0.49002657660241594), 'max_iter': np.float64(0.2370593648713958), 'learning_rate': np.float64(0.20651349612235353), 'l2_regularization': np.float64(0.043698060472043346), 'min_samples_leaf': np.float64(0.022702501931791155)}
Saved Optuna plots to results/20251202_114155_ana_optimized_binary_less/histogram_gradient_boosting/optuna_plots
Fold 4
Importâncias dos parâmetros para fold 4: {'min_samples_leaf': np.float64(0.2917552949836271), 'l2_regularization': np.float64(0.2465148718385369), 'learning_rate': np.float64(0.2360650669402089), 'max_depth': np.float64(0.21570982276399436), 'max_iter': np.float64(0.009954943473632684)}
Saved Optuna plots to results/20251202_114155_ana_optimized_binary_less/histogram_gradient_boosting/optuna_plots
Fold 5
Importâncias dos parâmetros para fold 5: {'max_iter': np.float64(0.4393932686535216), 'max_depth': np.float64(0.3163793351917981), 'learning_rate': np.float64(0.12335032364242195), 'l2_regularization': np.float64(0.09681109056026818), 'min_samples_leaf': np.float64(0.024065981951990053)}
Saved Optuna plots to results/20251202_114155_ana_optimized_binary_less/histogram_gradient_boosting/optuna_plots

Nested CV completed. The 20% holdout set (3536 samples) remains untouched.
This holdout set can be used for final unbiased evaluation.

Training and evaluating 5 best parameter sets on holdout data...
Testing with 4 balancing strategies: none, randomundersampler, smoteenn, tomeklinks

Evaluating fold 1 best params on holdout set...
  - Testing with balance strategy: none
  - Testing with balance strategy: randomundersampler
  - Testing with balance strategy: smoteenn
  - Testing with balance strategy: tomeklinks

Evaluating fold 2 best params on holdout set...
  - Testing with balance strategy: none
  - Testing with balance strategy: randomundersampler
  - Testing with balance strategy: smoteenn
  - Testing with balance strategy: tomeklinks

Evaluating fold 3 best params on holdout set...
  - Testing with balance strategy: none
  - Testing with balance strategy: randomundersampler
  - Testing with balance strategy: smoteenn
  - Testing with balance strategy: tomeklinks

Evaluating fold 4 best params on holdout set...
  - Testing with balance strategy: none
  - Testing with balance strategy: randomundersampler
  - Testing with balance strategy: smoteenn
  - Testing with balance strategy: tomeklinks

Evaluating fold 5 best params on holdout set...
  - Testing with balance strategy: none
  - Testing with balance strategy: randomundersampler
  - Testing with balance strategy: smoteenn
  - Testing with balance strategy: tomeklinks
Saving optimization and holdout results...
[I 2025-12-02 13:37:36,689] A new study created in memory with name: xgboost_fold_1
[D 2025-12-02 13:37:36,689] Sample trial#0 with RandomSampler.
[I 2025-12-02 13:38:06,843] Trial 0 finished with value: 0.1346381432716544 and parameters: {'n_estimators': 950, 'learning_rate': 0.04133031982506045, 'max_depth': 8, 'min_child_weight': 10, 'subsample': 0.9086114235859334, 'colsample_bytree': 0.4990192406510801, 'reg_alpha': 0.9283908502684417, 'reg_lambda': 4.473111088389945, 'gamma': 1.0, 'scale_pos_weight': 5.5558525760113024}. Best is trial 0 with value: 0.1346381432716544.
[D 2025-12-02 13:38:06,970] Sample trial#1 with GPSampler.
[I 2025-12-02 13:38:17,583] Trial 1 finished with value: 0.156999403515563 and parameters: {'n_estimators': 900, 'learning_rate': 0.046044018590941566, 'max_depth': 20, 'min_child_weight': 4, 'subsample': 0.9301720537768121, 'colsample_bytree': 0.5202755069801147, 'reg_alpha': 0.4046049178355907, 'reg_lambda': 4.186108781487366, 'gamma': 4.0, 'scale_pos_weight': 5.616150464262334}. Best is trial 1 with value: 0.156999403515563.
[D 2025-12-02 13:38:17,711] Sample trial#2 with GPSampler.
[I 2025-12-02 13:38:23,167] Trial 2 finished with value: 0.15478961789761744 and parameters: {'n_estimators': 150, 'learning_rate': 0.041572606525088256, 'max_depth': 18, 'min_child_weight': 5, 'subsample': 0.9162369638753165, 'colsample_bytree': 0.4488295716605772, 'reg_alpha': 0.9719422369300269, 'reg_lambda': 1.6105440650253664, 'gamma': 5.0, 'scale_pos_weight': 5.193791675340586}. Best is trial 1 with value: 0.156999403515563.
[D 2025-12-02 13:38:23,289] Sample trial#3 with GPSampler.
[I 2025-12-02 13:38:29,989] Trial 3 finished with value: 0.1336784392661048 and parameters: {'n_estimators': 250, 'learning_rate': 0.07107536291236485, 'max_depth': 12, 'min_child_weight': 2, 'subsample': 0.9220070026185884, 'colsample_bytree': 0.4523081318098572, 'reg_alpha': 0.8480033047454709, 'reg_lambda': 5.440048631015086, 'gamma': 1.0, 'scale_pos_weight': 5.276520259238167}. Best is trial 1 with value: 0.156999403515563.
[D 2025-12-02 13:38:30,112] Sample trial#4 with GPSampler.
[I 2025-12-02 13:38:35,759] Trial 4 finished with value: 0.14317704272102913 and parameters: {'n_estimators': 200, 'learning_rate': 0.08337252630518334, 'max_depth': 20, 'min_child_weight': 7, 'subsample': 0.9640881267648912, 'colsample_bytree': 0.41405161352164427, 'reg_alpha': 0.3605987307436421, 'reg_lambda': 3.0330623094642144, 'gamma': 2.0, 'scale_pos_weight': 5.072253455301406}. Best is trial 1 with value: 0.156999403515563.
[D 2025-12-02 13:38:35,886] Sample trial#5 with GPSampler.
[I 2025-12-02 13:38:50,806] Trial 5 finished with value: 0.12318130261163714 and parameters: {'n_estimators': 550, 'learning_rate': 0.08465116481260442, 'max_depth': 18, 'min_child_weight': 3, 'subsample': 0.9158864468624162, 'colsample_bytree': 0.4939365485671897, 'reg_alpha': 0.0721972108240907, 'reg_lambda': 1.280796808614928, 'gamma': 0.0, 'scale_pos_weight': 5.231161386145076}. Best is trial 1 with value: 0.156999403515563.
[D 2025-12-02 13:38:50,933] Sample trial#6 with GPSampler.
[I 2025-12-02 13:39:01,079] Trial 6 finished with value: 0.1377103045809442 and parameters: {'n_estimators': 800, 'learning_rate': 0.05556982120742935, 'max_depth': 6, 'min_child_weight': 10, 'subsample': 0.9731602894674583, 'colsample_bytree': 0.5188949727750639, 'reg_alpha': 0.5660890624401094, 'reg_lambda': 9.240896475307258, 'gamma': 1.0, 'scale_pos_weight': 5.909409923991472}. Best is trial 1 with value: 0.156999403515563.
[D 2025-12-02 13:39:01,209] Sample trial#7 with GPSampler.
[I 2025-12-02 13:39:15,510] Trial 7 finished with value: 0.11986910549526775 and parameters: {'n_estimators': 250, 'learning_rate': 0.09367201315361168, 'max_depth': 14, 'min_child_weight': 1, 'subsample': 0.9224225839200371, 'colsample_bytree': 0.5940105057499181, 'reg_alpha': 0.9742509886500994, 'reg_lambda': 2.0442913300137837, 'gamma': 0.0, 'scale_pos_weight': 5.768498092004166}. Best is trial 1 with value: 0.156999403515563.
[D 2025-12-02 13:39:15,637] Sample trial#8 with GPSampler.
[I 2025-12-02 13:39:24,347] Trial 8 finished with value: 0.14981254287645301 and parameters: {'n_estimators': 950, 'learning_rate': 0.053564696638945586, 'max_depth': 10, 'min_child_weight': 3, 'subsample': 0.9641360291968166, 'colsample_bytree': 0.5099188118070459, 'reg_alpha': 0.6883352043123844, 'reg_lambda': 4.566052195280608, 'gamma': 2.0, 'scale_pos_weight': 5.551112006312602}. Best is trial 1 with value: 0.156999403515563.
[D 2025-12-02 13:39:24,472] Sample trial#9 with GPSampler.
[I 2025-12-02 13:39:36,952] Trial 9 finished with value: 0.14394673788169401 and parameters: {'n_estimators': 400, 'learning_rate': 0.033998772856349224, 'max_depth': 16, 'min_child_weight': 2, 'subsample': 0.976924744085661, 'colsample_bytree': 0.5126509308187406, 'reg_alpha': 0.14136732321671175, 'reg_lambda': 9.061890969638599, 'gamma': 1.0, 'scale_pos_weight': 5.0843214485019885}. Best is trial 1 with value: 0.156999403515563.
[D 2025-12-02 13:39:37,081] Sample trial#10 with GPSampler.
[I 2025-12-02 13:39:45,045] Trial 10 finished with value: 0.14914533183726095 and parameters: {'n_estimators': 800, 'learning_rate': 0.03211639157297955, 'max_depth': 12, 'min_child_weight': 1, 'subsample': 0.9756148457454076, 'colsample_bytree': 0.47420766393323155, 'reg_alpha': 0.644861715109965, 'reg_lambda': 5.241544725278691, 'gamma': 4.0, 'scale_pos_weight': 5.268673219791197}. Best is trial 1 with value: 0.156999403515563.
[D 2025-12-02 13:39:45,170] Sample trial#11 with GPSampler.
[I 2025-12-02 13:39:51,603] Trial 11 finished with value: 0.14993719709387218 and parameters: {'n_estimators': 900, 'learning_rate': 0.057566470385531116, 'max_depth': 20, 'min_child_weight': 6, 'subsample': 0.9014966852564869, 'colsample_bytree': 0.5285165333568098, 'reg_alpha': 0.5221878948512826, 'reg_lambda': 1.915636684272003, 'gamma': 5.0, 'scale_pos_weight': 5.801901741886903}. Best is trial 1 with value: 0.156999403515563.
[D 2025-12-02 13:39:51,736] Sample trial#12 with GPSampler.
[I 2025-12-02 13:40:04,754] Trial 12 finished with value: 0.16038505617336496 and parameters: {'n_estimators': 400, 'learning_rate': 0.021975858916048405, 'max_depth': 20, 'min_child_weight': 4, 'subsample': 0.9157983890648802, 'colsample_bytree': 0.49699858759753607, 'reg_alpha': 0.5136191199153755, 'reg_lambda': 5.089994607165178, 'gamma': 4.0, 'scale_pos_weight': 5.251570437140866}. Best is trial 12 with value: 0.16038505617336496.
[D 2025-12-02 13:40:04,882] Sample trial#13 with GPSampler.
[I 2025-12-02 13:40:17,991] Trial 13 finished with value: 0.1560824651732084 and parameters: {'n_estimators': 100, 'learning_rate': 0.009, 'max_depth': 20, 'min_child_weight': 1, 'subsample': 0.9033353277878007, 'colsample_bytree': 0.43272121387342505, 'reg_alpha': 0.3700531446568111, 'reg_lambda': 7.131854863672105, 'gamma': 4.0, 'scale_pos_weight': 5.698024524675506}. Best is trial 12 with value: 0.16038505617336496.
[D 2025-12-02 13:40:18,116] Sample trial#14 with GPSampler.
[I 2025-12-02 13:40:35,784] Trial 14 finished with value: 0.16043026726673731 and parameters: {'n_estimators': 450, 'learning_rate': 0.009, 'max_depth': 20, 'min_child_weight': 5, 'subsample': 0.909533476629387, 'colsample_bytree': 0.6, 'reg_alpha': 1.0, 'reg_lambda': 6.527001572171025, 'gamma': 4.0, 'scale_pos_weight': 5.0}. Best is trial 14 with value: 0.16043026726673731.
[D 2025-12-02 13:40:35,908] Sample trial#15 with GPSampler.
[I 2025-12-02 13:41:05,791] Trial 15 finished with value: 0.1624025363325905 and parameters: {'n_estimators': 200, 'learning_rate': 0.009, 'max_depth': 20, 'min_child_weight': 7, 'subsample': 0.9138264583816738, 'colsample_bytree': 0.6, 'reg_alpha': 0.1840639007042843, 'reg_lambda': 3.245250452456881, 'gamma': 4.0, 'scale_pos_weight': 5.0}. Best is trial 15 with value: 0.1624025363325905.
[D 2025-12-02 13:41:05,909] Sample trial#16 with GPSampler.
[I 2025-12-02 13:41:29,571] Trial 16 finished with value: 0.16059473592286191 and parameters: {'n_estimators': 450, 'learning_rate': 0.009, 'max_depth': 20, 'min_child_weight': 1, 'subsample': 0.9007122065028759, 'colsample_bytree': 0.6, 'reg_alpha': 0.15056600903953474, 'reg_lambda': 1.0, 'gamma': 4.0, 'scale_pos_weight': 5.0}. Best is trial 15 with value: 0.1624025363325905.
[D 2025-12-02 13:41:29,696] Sample trial#17 with GPSampler.
[I 2025-12-02 13:42:02,285] Trial 17 finished with value: 0.16301751372860954 and parameters: {'n_estimators': 450, 'learning_rate': 0.009, 'max_depth': 20, 'min_child_weight': 10, 'subsample': 0.9006439128517024, 'colsample_bytree': 0.5204616687087171, 'reg_alpha': 0.5216718278323837, 'reg_lambda': 1.0, 'gamma': 4.0, 'scale_pos_weight': 5.0}. Best is trial 17 with value: 0.16301751372860954.
[D 2025-12-02 13:42:02,411] Sample trial#18 with GPSampler.
[I 2025-12-02 13:42:34,203] Trial 18 finished with value: 0.15815461255569094 and parameters: {'n_estimators': 850, 'learning_rate': 0.009, 'max_depth': 20, 'min_child_weight': 10, 'subsample': 0.9, 'colsample_bytree': 0.5469921347531639, 'reg_alpha': 0.0, 'reg_lambda': 5.640392572640854, 'gamma': 4.0, 'scale_pos_weight': 5.0}. Best is trial 17 with value: 0.16301751372860954.
[D 2025-12-02 13:42:34,331] Sample trial#19 with GPSampler.
[I 2025-12-02 13:42:45,230] Trial 19 finished with value: 0.15466908446872688 and parameters: {'n_estimators': 100, 'learning_rate': 0.016974140936172645, 'max_depth': 20, 'min_child_weight': 10, 'subsample': 0.9069449959362916, 'colsample_bytree': 0.5944114371094515, 'reg_alpha': 0.930468775718265, 'reg_lambda': 1.0, 'gamma': 4.0, 'scale_pos_weight': 5.0}. Best is trial 17 with value: 0.16301751372860954.
[D 2025-12-02 13:42:45,355] Sample trial#20 with GPSampler.
[I 2025-12-02 13:43:10,143] Trial 20 finished with value: 0.16551212553539468 and parameters: {'n_estimators': 350, 'learning_rate': 0.009, 'max_depth': 20, 'min_child_weight': 9, 'subsample': 0.9020243196454609, 'colsample_bytree': 0.4653062201628248, 'reg_alpha': 0.0, 'reg_lambda': 1.2168041700638903, 'gamma': 4.0, 'scale_pos_weight': 5.0}. Best is trial 20 with value: 0.16551212553539468.
[D 2025-12-02 13:43:10,280] Sample trial#21 with GPSampler.
[I 2025-12-02 13:43:35,898] Trial 21 finished with value: 0.16357717652030035 and parameters: {'n_estimators': 400, 'learning_rate': 0.009, 'max_depth': 20, 'min_child_weight': 10, 'subsample': 0.9334352336621099, 'colsample_bytree': 0.4, 'reg_alpha': 0.0, 'reg_lambda': 1.0, 'gamma': 4.0, 'scale_pos_weight': 5.0}. Best is trial 20 with value: 0.16551212553539468.
[D 2025-12-02 13:43:36,018] Sample trial#22 with GPSampler.
[I 2025-12-02 13:43:54,473] Trial 22 finished with value: 0.16220609444677853 and parameters: {'n_estimators': 250, 'learning_rate': 0.009, 'max_depth': 20, 'min_child_weight': 10, 'subsample': 0.9, 'colsample_bytree': 0.4, 'reg_alpha': 0.0, 'reg_lambda': 6.603042180748554, 'gamma': 4.0, 'scale_pos_weight': 5.0}. Best is trial 20 with value: 0.16551212553539468.
[D 2025-12-02 13:43:54,600] Sample trial#23 with GPSampler.
[I 2025-12-02 13:44:16,366] Trial 23 finished with value: 0.1637562279255429 and parameters: {'n_estimators': 400, 'learning_rate': 0.009, 'max_depth': 20, 'min_child_weight': 9, 'subsample': 0.9, 'colsample_bytree': 0.5005468571856418, 'reg_alpha': 0.0, 'reg_lambda': 1.0, 'gamma': 4.0, 'scale_pos_weight': 5.640055035137127}. Best is trial 20 with value: 0.16551212553539468.
[D 2025-12-02 13:44:16,495] Sample trial#24 with GPSampler.
[I 2025-12-02 13:44:40,165] Trial 24 finished with value: 0.15815689081597892 and parameters: {'n_estimators': 500, 'learning_rate': 0.009, 'max_depth': 20, 'min_child_weight': 7, 'subsample': 0.9, 'colsample_bytree': 0.4840167391996764, 'reg_alpha': 0.0, 'reg_lambda': 1.0, 'gamma': 3.0, 'scale_pos_weight': 5.0}. Best is trial 20 with value: 0.16551212553539468.
[D 2025-12-02 13:44:40,290] Sample trial#25 with GPSampler.
[I 2025-12-02 13:44:56,509] Trial 25 finished with value: 0.16568515384008017 and parameters: {'n_estimators': 250, 'learning_rate': 0.009, 'max_depth': 20, 'min_child_weight': 10, 'subsample': 0.9, 'colsample_bytree': 0.446434748022377, 'reg_alpha': 0.0, 'reg_lambda': 1.0, 'gamma': 5.0, 'scale_pos_weight': 5.0}. Best is trial 25 with value: 0.16568515384008017.
[D 2025-12-02 13:44:56,638] Sample trial#26 with GPSampler.
[I 2025-12-02 13:45:21,813] Trial 26 finished with value: 0.16225073782335064 and parameters: {'n_estimators': 300, 'learning_rate': 0.009, 'max_depth': 20, 'min_child_weight': 10, 'subsample': 0.9, 'colsample_bytree': 0.5854358006803997, 'reg_alpha': 0.0, 'reg_lambda': 3.371609677958624, 'gamma': 5.0, 'scale_pos_weight': 5.0}. Best is trial 25 with value: 0.16568515384008017.
[D 2025-12-02 13:45:21,934] Sample trial#27 with GPSampler.
[I 2025-12-02 13:45:30,303] Trial 27 finished with value: 0.165605724711906 and parameters: {'n_estimators': 100, 'learning_rate': 0.009, 'max_depth': 20, 'min_child_weight': 8, 'subsample': 0.9, 'colsample_bytree': 0.4, 'reg_alpha': 0.0, 'reg_lambda': 1.0, 'gamma': 5.0, 'scale_pos_weight': 5.0}. Best is trial 25 with value: 0.16568515384008017.
[D 2025-12-02 13:45:30,427] Sample trial#28 with GPSampler.
[I 2025-12-02 13:45:43,534] Trial 28 finished with value: 0.1639198673112566 and parameters: {'n_estimators': 100, 'learning_rate': 0.009, 'max_depth': 12, 'min_child_weight': 10, 'subsample': 0.9, 'colsample_bytree': 0.4, 'reg_alpha': 0.0, 'reg_lambda': 1.0, 'gamma': 5.0, 'scale_pos_weight': 5.0}. Best is trial 25 with value: 0.16568515384008017.
[D 2025-12-02 13:45:43,655] Sample trial#29 with GPSampler.
