[I 2025-12-02 14:15:04,783] Trial 27 finished with value: 0.1541422514775174 and parameters: {'iterations': 1000, 'learning_rate': 0.011572713517006145, 'depth': 4, 'l2_leaf_reg': 6.812833064037459, 'border_count': 179, 'bagging_temperature': 0.3920665847190452, 'random_strength': 0.5616899065916006, 'scale_pos_weight': 5.465132930790566}. Best is trial 10 with value: 0.15735908669139667.
[D 2025-12-02 14:15:04,929] Sample trial#28 with GPSampler.
[I 2025-12-02 14:15:09,607] Trial 28 finished with value: 0.15419747480307508 and parameters: {'iterations': 1000, 'learning_rate': 0.011772273489590708, 'depth': 3, 'l2_leaf_reg': 7.189786362297591, 'border_count': 150, 'bagging_temperature': 0.6616412400590129, 'random_strength': 0.40896222130494114, 'scale_pos_weight': 5.362250645447529}. Best is trial 10 with value: 0.15735908669139667.
[D 2025-12-02 14:15:09,747] Sample trial#29 with GPSampler.
[I 2025-12-02 14:15:14,911] Trial 29 finished with value: 0.1335755845249179 and parameters: {'iterations': 1000, 'learning_rate': 0.02, 'depth': 4, 'l2_leaf_reg': 1.0, 'border_count': 150, 'bagging_temperature': 0.18594192578319324, 'random_strength': 0.0, 'scale_pos_weight': 6.0}. Best is trial 10 with value: 0.15735908669139667.
[I 2025-12-02 14:15:40,313] A new study created in memory with name: multi_layer_perceptron_fold_1
[D 2025-12-02 14:15:40,313] Sample trial#0 with RandomSampler.
[I 2025-12-02 14:16:12,720] Trial 0 finished with value: 0.090960459020618 and parameters: {'n_layers': 1, 'layer_0_size': 100, 'activation': 'tanh', 'alpha': 0.0014098911387126203, 'learning_rate': 'constant', 'solver': 'lbfgs', 'learning_rate_init': 0.0013903692946786329, 'max_iter': 661}. Best is trial 0 with value: 0.090960459020618.
[D 2025-12-02 14:16:12,883] Sample trial#1 with TPESampler.
[I 2025-12-02 14:16:15,068] Trial 1 finished with value: 0.09848088730849522 and parameters: {'n_layers': 2, 'layer_0_size': 100, 'layer_1_size': 100, 'activation': 'logistic', 'alpha': 0.00018121444765091006, 'learning_rate': 'invscaling', 'solver': 'sgd', 'learning_rate_init': 0.03566782879803274, 'max_iter': 805}. Best is trial 1 with value: 0.09848088730849522.
[D 2025-12-02 14:16:15,222] Sample trial#2 with TPESampler.
[I 2025-12-02 14:19:07,388] Trial 2 finished with value: 0.07587052083051489 and parameters: {'n_layers': 2, 'layer_0_size': 150, 'layer_1_size': 100, 'activation': 'logistic', 'alpha': 0.0012913731037324718, 'learning_rate': 'constant', 'solver': 'lbfgs', 'learning_rate_init': 0.0006587842550140754, 'max_iter': 1465}. Best is trial 1 with value: 0.09848088730849522.
[D 2025-12-02 14:19:07,576] Sample trial#3 with TPESampler.
[I 2025-12-02 14:21:59,881] Trial 3 finished with value: 0.08768101341070836 and parameters: {'n_layers': 2, 'layer_0_size': 125, 'layer_1_size': 150, 'activation': 'logistic', 'alpha': 0.00018448844680415293, 'learning_rate': 'adaptive', 'solver': 'lbfgs', 'learning_rate_init': 0.007326384172547227, 'max_iter': 525}. Best is trial 1 with value: 0.09848088730849522.
[D 2025-12-02 14:22:00,059] Sample trial#4 with TPESampler.
[I 2025-12-02 14:23:02,725] Trial 4 finished with value: 0.1093986282610125 and parameters: {'n_layers': 1, 'layer_0_size': 100, 'activation': 'tanh', 'alpha': 0.0016639303758772728, 'learning_rate': 'constant', 'solver': 'adam', 'learning_rate_init': 0.000146358862984839, 'max_iter': 1426}. Best is trial 4 with value: 0.1093986282610125.
[D 2025-12-02 14:23:02,878] Sample trial#5 with TPESampler.
[I 2025-12-02 14:23:22,406] Trial 5 finished with value: 0.16600684515721884 and parameters: {'n_layers': 1, 'layer_0_size': 150, 'activation': 'logistic', 'alpha': 0.0022337898603667986, 'learning_rate': 'constant', 'solver': 'sgd', 'learning_rate_init': 0.024854604267477754, 'max_iter': 1201}. Best is trial 5 with value: 0.16600684515721884.
[D 2025-12-02 14:23:22,558] Sample trial#6 with TPESampler.
[I 2025-12-02 14:25:57,153] Trial 6 finished with value: 0.09485093304781529 and parameters: {'n_layers': 2, 'layer_0_size': 125, 'layer_1_size': 150, 'activation': 'tanh', 'alpha': 0.0007810664021901593, 'learning_rate': 'constant', 'solver': 'sgd', 'learning_rate_init': 0.002305482691564695, 'max_iter': 897}. Best is trial 5 with value: 0.16600684515721884.
[D 2025-12-02 14:25:57,305] Sample trial#7 with TPESampler.
[I 2025-12-02 14:27:46,466] Trial 7 finished with value: 0.09376598432130921 and parameters: {'n_layers': 2, 'layer_0_size': 125, 'layer_1_size': 175, 'activation': 'tanh', 'alpha': 0.0004883619258412762, 'learning_rate': 'adaptive', 'solver': 'lbfgs', 'learning_rate_init': 0.012172750457716796, 'max_iter': 851}. Best is trial 5 with value: 0.16600684515721884.
[D 2025-12-02 14:27:46,638] Sample trial#8 with TPESampler.
[I 2025-12-02 14:27:50,773] Trial 8 finished with value: 0.06481660703052117 and parameters: {'n_layers': 2, 'layer_0_size': 200, 'layer_1_size': 150, 'activation': 'logistic', 'alpha': 0.00011492328746503436, 'learning_rate': 'invscaling', 'solver': 'sgd', 'learning_rate_init': 0.01257459501442169, 'max_iter': 1413}. Best is trial 5 with value: 0.16600684515721884.
[D 2025-12-02 14:27:50,926] Sample trial#9 with TPESampler.
[I 2025-12-02 14:28:29,593] Trial 9 finished with value: 0.07666458128585497 and parameters: {'n_layers': 1, 'layer_0_size': 125, 'activation': 'logistic', 'alpha': 0.00015131815885595351, 'learning_rate': 'invscaling', 'solver': 'lbfgs', 'learning_rate_init': 0.03803552564236745, 'max_iter': 1487}. Best is trial 5 with value: 0.16600684515721884.
[D 2025-12-02 14:28:29,752] Sample trial#10 with TPESampler.
[I 2025-12-02 14:29:16,169] Trial 10 finished with value: 0.1419481905399363 and parameters: {'n_layers': 1, 'layer_0_size': 175, 'activation': 'logistic', 'alpha': 0.00880906636224842, 'learning_rate': 'constant', 'solver': 'sgd', 'learning_rate_init': 0.049629724857139394, 'max_iter': 1246}. Best is trial 5 with value: 0.16600684515721884.
[D 2025-12-02 14:29:16,323] Sample trial#11 with TPESampler.
[I 2025-12-02 14:30:04,607] Trial 11 finished with value: 0.10802074315489521 and parameters: {'n_layers': 1, 'layer_0_size': 175, 'activation': 'logistic', 'alpha': 0.004262868912904724, 'learning_rate': 'constant', 'solver': 'sgd', 'learning_rate_init': 0.06706610390400934, 'max_iter': 1449}. Best is trial 5 with value: 0.16600684515721884.
[D 2025-12-02 14:30:04,759] Sample trial#12 with TPESampler.
[I 2025-12-02 14:30:23,626] Trial 12 finished with value: 0.15707990941290273 and parameters: {'n_layers': 1, 'layer_0_size': 125, 'activation': 'logistic', 'alpha': 0.006127526945955348, 'learning_rate': 'adaptive', 'solver': 'sgd', 'learning_rate_init': 0.02737413501125664, 'max_iter': 890}. Best is trial 5 with value: 0.16600684515721884.
[D 2025-12-02 14:30:23,779] Sample trial#13 with TPESampler.
[I 2025-12-02 14:30:33,798] Trial 13 finished with value: 0.16995433632939994 and parameters: {'n_layers': 1, 'layer_0_size': 125, 'activation': 'logistic', 'alpha': 0.0023161560404747618, 'learning_rate': 'adaptive', 'solver': 'sgd', 'learning_rate_init': 0.006734630613366581, 'max_iter': 986}. Best is trial 13 with value: 0.16995433632939994.
[D 2025-12-02 14:30:33,950] Sample trial#14 with TPESampler.
[I 2025-12-02 14:30:40,330] Trial 14 finished with value: 0.16002067831967204 and parameters: {'n_layers': 1, 'layer_0_size': 100, 'activation': 'logistic', 'alpha': 0.0004869485482690305, 'learning_rate': 'adaptive', 'solver': 'sgd', 'learning_rate_init': 0.0019606409001546045, 'max_iter': 1007}. Best is trial 13 with value: 0.16995433632939994.
[D 2025-12-02 14:30:40,483] Sample trial#15 with TPESampler.
[I 2025-12-02 14:30:52,148] Trial 15 finished with value: 0.09332729010436516 and parameters: {'n_layers': 1, 'layer_0_size': 150, 'activation': 'logistic', 'alpha': 0.0013110836544466058, 'learning_rate': 'adaptive', 'solver': 'adam', 'learning_rate_init': 0.007269271542335438, 'max_iter': 1101}. Best is trial 13 with value: 0.16995433632939994.
[D 2025-12-02 14:30:52,303] Sample trial#16 with TPESampler.
[I 2025-12-02 14:30:58,294] Trial 16 finished with value: 0.16962482567806147 and parameters: {'n_layers': 1, 'layer_0_size': 150, 'activation': 'logistic', 'alpha': 0.0007472610627597412, 'learning_rate': 'constant', 'solver': 'sgd', 'learning_rate_init': 0.009036253970556648, 'max_iter': 877}. Best is trial 13 with value: 0.16995433632939994.
[D 2025-12-02 14:30:58,447] Sample trial#17 with TPESampler.
[I 2025-12-02 14:31:22,286] Trial 17 finished with value: 0.10089136020999975 and parameters: {'n_layers': 1, 'layer_0_size': 150, 'activation': 'logistic', 'alpha': 0.0016401509754324, 'learning_rate': 'constant', 'solver': 'sgd', 'learning_rate_init': 0.05923903927706386, 'max_iter': 336}. Best is trial 13 with value: 0.16995433632939994.
[D 2025-12-02 14:31:22,440] Sample trial#18 with TPESampler.
[I 2025-12-02 14:31:31,791] Trial 18 finished with value: 0.16327549009435538 and parameters: {'n_layers': 1, 'layer_0_size': 175, 'activation': 'logistic', 'alpha': 0.0005014607076186265, 'learning_rate': 'constant', 'solver': 'sgd', 'learning_rate_init': 0.0018050285819817117, 'max_iter': 556}. Best is trial 13 with value: 0.16995433632939994.
[D 2025-12-02 14:31:31,944] Sample trial#19 with TPESampler.
[I 2025-12-02 14:31:33,552] Trial 19 finished with value: 0.11847027105314871 and parameters: {'n_layers': 1, 'layer_0_size': 150, 'activation': 'logistic', 'alpha': 0.0009243167629793635, 'learning_rate': 'invscaling', 'solver': 'sgd', 'learning_rate_init': 0.007264383492575856, 'max_iter': 829}. Best is trial 13 with value: 0.16995433632939994.
[D 2025-12-02 14:31:33,705] Sample trial#20 with TPESampler.
[I 2025-12-02 14:33:56,633] Trial 20 finished with value: 0.09034877599361443 and parameters: {'n_layers': 1, 'layer_0_size': 200, 'activation': 'logistic', 'alpha': 0.00021845591419393897, 'learning_rate': 'constant', 'solver': 'lbfgs', 'learning_rate_init': 0.01573994196105917, 'max_iter': 774}. Best is trial 13 with value: 0.16995433632939994.
[D 2025-12-02 14:33:56,811] Sample trial#21 with TPESampler.
[I 2025-12-02 14:34:29,961] Trial 21 finished with value: 0.16556764606145752 and parameters: {'n_layers': 2, 'layer_0_size': 150, 'layer_1_size': 200, 'activation': 'logistic', 'alpha': 0.0008597599345075573, 'learning_rate': 'constant', 'solver': 'sgd', 'learning_rate_init': 0.01437365224977479, 'max_iter': 1214}. Best is trial 13 with value: 0.16995433632939994.
[D 2025-12-02 14:34:30,114] Sample trial#22 with TPESampler.
[I 2025-12-02 14:35:41,861] Trial 22 finished with value: 0.1101371778603838 and parameters: {'n_layers': 1, 'layer_0_size': 200, 'activation': 'tanh', 'alpha': 0.0006045241253714192, 'learning_rate': 'constant', 'solver': 'sgd', 'learning_rate_init': 0.012085738410872387, 'max_iter': 1252}. Best is trial 13 with value: 0.16995433632939994.
[D 2025-12-02 14:35:42,013] Sample trial#23 with TPESampler.
[I 2025-12-02 14:36:28,897] Trial 23 finished with value: 0.0870316411178953 and parameters: {'n_layers': 1, 'layer_0_size': 150, 'activation': 'logistic', 'alpha': 0.0001388038609138851, 'learning_rate': 'constant', 'solver': 'sgd', 'learning_rate_init': 0.04613772507938286, 'max_iter': 1025}. Best is trial 13 with value: 0.16995433632939994.
[D 2025-12-02 14:36:29,054] Sample trial#24 with TPESampler.
[I 2025-12-02 14:36:35,960] Trial 24 finished with value: 0.17454563357437874 and parameters: {'n_layers': 1, 'layer_0_size': 150, 'activation': 'logistic', 'alpha': 0.0014278204119043327, 'learning_rate': 'constant', 'solver': 'sgd', 'learning_rate_init': 0.018063406984903198, 'max_iter': 935}. Best is trial 24 with value: 0.17454563357437874.
[D 2025-12-02 14:36:36,118] Sample trial#25 with TPESampler.
[I 2025-12-02 14:36:38,849] Trial 25 finished with value: 0.09978450842507751 and parameters: {'n_layers': 1, 'layer_0_size': 100, 'activation': 'logistic', 'alpha': 0.0006344932969350319, 'learning_rate': 'constant', 'solver': 'adam', 'learning_rate_init': 0.029060876354327653, 'max_iter': 759}. Best is trial 24 with value: 0.17454563357437874.
[D 2025-12-02 14:36:39,007] Sample trial#26 with TPESampler.
[I 2025-12-02 14:37:23,440] Trial 26 finished with value: 0.08384446988260504 and parameters: {'n_layers': 1, 'layer_0_size': 150, 'activation': 'logistic', 'alpha': 0.0010397411377843417, 'learning_rate': 'constant', 'solver': 'lbfgs', 'learning_rate_init': 0.011891317220511942, 'max_iter': 931}. Best is trial 24 with value: 0.17454563357437874.
[D 2025-12-02 14:37:23,593] Sample trial#27 with TPESampler.
[I 2025-12-02 14:38:40,921] Trial 27 finished with value: 0.11210369420879832 and parameters: {'n_layers': 1, 'layer_0_size': 150, 'activation': 'tanh', 'alpha': 0.0013048351285431085, 'learning_rate': 'adaptive', 'solver': 'sgd', 'learning_rate_init': 0.0038019288796943326, 'max_iter': 881}. Best is trial 24 with value: 0.17454563357437874.
[D 2025-12-02 14:38:41,073] Sample trial#28 with TPESampler.
[I 2025-12-02 14:39:17,060] Trial 28 finished with value: 0.08856600268068088 and parameters: {'n_layers': 1, 'layer_0_size': 100, 'activation': 'logistic', 'alpha': 0.0011145640853096259, 'learning_rate': 'adaptive', 'solver': 'lbfgs', 'learning_rate_init': 0.017965096879271177, 'max_iter': 1224}. Best is trial 24 with value: 0.17454563357437874.
[D 2025-12-02 14:39:17,213] Sample trial#29 with TPESampler.
[I 2025-12-02 14:39:26,113] Trial 29 finished with value: 0.15733188281208588 and parameters: {'n_layers': 1, 'layer_0_size': 125, 'activation': 'logistic', 'alpha': 0.004303513478420057, 'learning_rate': 'adaptive', 'solver': 'sgd', 'learning_rate_init': 0.0009792908064293517, 'max_iter': 1134}. Best is trial 24 with value: 0.17454563357437874.
[I 2025-12-02 14:39:28,811] A new study created in memory with name: multi_layer_perceptron_fold_2
[D 2025-12-02 14:39:28,811] Sample trial#0 with RandomSampler.
[I 2025-12-02 14:42:36,201] Trial 0 finished with value: 0.12890155955135713 and parameters: {'n_layers': 2, 'layer_0_size': 175, 'layer_1_size': 200, 'activation': 'tanh', 'alpha': 0.003823287373399007, 'learning_rate': 'adaptive', 'solver': 'sgd', 'learning_rate_init': 0.001155282004157882, 'max_iter': 614}. Best is trial 0 with value: 0.12890155955135713.
[D 2025-12-02 14:42:36,358] Sample trial#1 with TPESampler.
[I 2025-12-02 14:43:56,015] Trial 1 finished with value: 0.10253630589985863 and parameters: {'n_layers': 1, 'layer_0_size': 175, 'activation': 'tanh', 'alpha': 0.0029399548135403174, 'learning_rate': 'adaptive', 'solver': 'sgd', 'learning_rate_init': 0.008145521460255009, 'max_iter': 612}. Best is trial 0 with value: 0.12890155955135713.
[D 2025-12-02 14:43:56,170] Sample trial#2 with TPESampler.
[I 2025-12-02 14:44:28,366] Trial 2 finished with value: 0.08781272583065511 and parameters: {'n_layers': 1, 'layer_0_size': 150, 'activation': 'tanh', 'alpha': 0.00715949307182031, 'learning_rate': 'invscaling', 'solver': 'lbfgs', 'learning_rate_init': 0.007703029931411037, 'max_iter': 256}. Best is trial 0 with value: 0.12890155955135713.
[D 2025-12-02 14:44:28,526] Sample trial#3 with TPESampler.
[I 2025-12-02 14:45:05,297] Trial 3 finished with value: 0.09064206156489914 and parameters: {'n_layers': 1, 'layer_0_size': 125, 'activation': 'logistic', 'alpha': 0.002764287703550618, 'learning_rate': 'constant', 'solver': 'adam', 'learning_rate_init': 0.0008691391711787041, 'max_iter': 1133}. Best is trial 0 with value: 0.12890155955135713.
[D 2025-12-02 14:45:05,452] Sample trial#4 with TPESampler.
[I 2025-12-02 14:45:08,781] Trial 4 finished with value: 0.09234668618685773 and parameters: {'n_layers': 1, 'layer_0_size': 150, 'activation': 'tanh', 'alpha': 0.0015765466067741184, 'learning_rate': 'invscaling', 'solver': 'adam', 'learning_rate_init': 0.04658060029050247, 'max_iter': 1165}. Best is trial 0 with value: 0.12890155955135713.
[D 2025-12-02 14:45:08,936] Sample trial#5 with TPESampler.
[I 2025-12-02 14:45:17,023] Trial 5 finished with value: 0.12280089790364415 and parameters: {'n_layers': 2, 'layer_0_size': 125, 'layer_1_size': 175, 'activation': 'logistic', 'alpha': 0.0002822197340047984, 'learning_rate': 'adaptive', 'solver': 'adam', 'learning_rate_init': 0.0686033034982494, 'max_iter': 1012}. Best is trial 0 with value: 0.12890155955135713.
[D 2025-12-02 14:45:17,179] Sample trial#6 with TPESampler.
[I 2025-12-02 14:45:38,230] Trial 6 finished with value: 0.16608359975323017 and parameters: {'n_layers': 1, 'layer_0_size': 200, 'activation': 'logistic', 'alpha': 0.00023217216933470056, 'learning_rate': 'adaptive', 'solver': 'sgd', 'learning_rate_init': 0.01702574173153283, 'max_iter': 1218}. Best is trial 6 with value: 0.16608359975323017.
[D 2025-12-02 14:45:38,385] Sample trial#7 with TPESampler.
[I 2025-12-02 14:45:45,016] Trial 7 finished with value: 0.13237808683834057 and parameters: {'n_layers': 2, 'layer_0_size': 200, 'layer_1_size': 150, 'activation': 'tanh', 'alpha': 0.0059173676007271934, 'learning_rate': 'constant', 'solver': 'adam', 'learning_rate_init': 0.043742954639436595, 'max_iter': 518}. Best is trial 6 with value: 0.16608359975323017.
[D 2025-12-02 14:45:45,171] Sample trial#8 with TPESampler.
[I 2025-12-02 14:47:26,189] Trial 8 finished with value: 0.09649796952951056 and parameters: {'n_layers': 2, 'layer_0_size': 175, 'layer_1_size': 100, 'activation': 'tanh', 'alpha': 0.006998195779363542, 'learning_rate': 'adaptive', 'solver': 'lbfgs', 'learning_rate_init': 0.00026198094653938255, 'max_iter': 1141}. Best is trial 6 with value: 0.16608359975323017.
[D 2025-12-02 14:47:26,369] Sample trial#9 with TPESampler.
[I 2025-12-02 14:48:10,415] Trial 9 finished with value: 0.08181375393895794 and parameters: {'n_layers': 1, 'layer_0_size': 150, 'activation': 'logistic', 'alpha': 0.0012717618471010717, 'learning_rate': 'invscaling', 'solver': 'lbfgs', 'learning_rate_init': 0.06234151327120998, 'max_iter': 1382}. Best is trial 6 with value: 0.16608359975323017.
[D 2025-12-02 14:48:10,609] Sample trial#10 with TPESampler.
[I 2025-12-02 14:49:27,490] Trial 10 finished with value: 0.1262905057511578 and parameters: {'n_layers': 1, 'layer_0_size': 175, 'activation': 'logistic', 'alpha': 0.0001273744451180235, 'learning_rate': 'adaptive', 'solver': 'sgd', 'learning_rate_init': 0.026811494479271003, 'max_iter': 1217}. Best is trial 6 with value: 0.16608359975323017.
[D 2025-12-02 14:49:27,645] Sample trial#11 with TPESampler.
[I 2025-12-02 14:49:39,891] Trial 11 finished with value: 0.09658284616218298 and parameters: {'n_layers': 2, 'layer_0_size': 175, 'layer_1_size': 150, 'activation': 'tanh', 'alpha': 0.006264185111284326, 'learning_rate': 'constant', 'solver': 'adam', 'learning_rate_init': 0.005684391665316293, 'max_iter': 551}. Best is trial 6 with value: 0.16608359975323017.
[D 2025-12-02 14:49:40,048] Sample trial#12 with TPESampler.
[I 2025-12-02 14:49:47,098] Trial 12 finished with value: 0.1279568282309081 and parameters: {'n_layers': 2, 'layer_0_size': 200, 'layer_1_size': 125, 'activation': 'tanh', 'alpha': 0.009187315519261025, 'learning_rate': 'constant', 'solver': 'adam', 'learning_rate_init': 0.09856255005932728, 'max_iter': 397}. Best is trial 6 with value: 0.16608359975323017.
[D 2025-12-02 14:49:47,253] Sample trial#13 with TPESampler.
[I 2025-12-02 14:50:05,684] Trial 13 finished with value: 0.15008378958521656 and parameters: {'n_layers': 1, 'layer_0_size': 200, 'activation': 'logistic', 'alpha': 0.0004935580938252577, 'learning_rate': 'adaptive', 'solver': 'sgd', 'learning_rate_init': 0.0009485445789033938, 'max_iter': 1401}. Best is trial 6 with value: 0.16608359975323017.
[D 2025-12-02 14:50:05,840] Sample trial#14 with TPESampler.
[I 2025-12-02 14:50:23,775] Trial 14 finished with value: 0.16268512489226056 and parameters: {'n_layers': 1, 'layer_0_size': 175, 'activation': 'tanh', 'alpha': 0.00018294587829644033, 'learning_rate': 'adaptive', 'solver': 'sgd', 'learning_rate_init': 0.0009067709151418331, 'max_iter': 1415}. Best is trial 6 with value: 0.16608359975323017.
[D 2025-12-02 14:50:23,930] Sample trial#15 with TPESampler.
[I 2025-12-02 14:50:42,727] Trial 15 finished with value: 0.16737574147933595 and parameters: {'n_layers': 1, 'layer_0_size': 175, 'activation': 'tanh', 'alpha': 0.00011413874119966791, 'learning_rate': 'adaptive', 'solver': 'sgd', 'learning_rate_init': 0.001205934299225432, 'max_iter': 969}. Best is trial 15 with value: 0.16737574147933595.
[D 2025-12-02 14:50:42,881] Sample trial#16 with TPESampler.
[I 2025-12-02 14:51:44,784] Trial 16 finished with value: 0.128329382704825 and parameters: {'n_layers': 1, 'layer_0_size': 150, 'activation': 'tanh', 'alpha': 0.00019406798522388316, 'learning_rate': 'constant', 'solver': 'sgd', 'learning_rate_init': 0.001962767077794558, 'max_iter': 709}. Best is trial 15 with value: 0.16737574147933595.
[D 2025-12-02 14:51:44,940] Sample trial#17 with TPESampler.
[I 2025-12-02 14:53:12,523] Trial 17 finished with value: 0.09154699483267367 and parameters: {'n_layers': 1, 'layer_0_size': 200, 'activation': 'tanh', 'alpha': 0.0003134742814024581, 'learning_rate': 'adaptive', 'solver': 'lbfgs', 'learning_rate_init': 0.0011075047257967199, 'max_iter': 874}. Best is trial 15 with value: 0.16737574147933595.
[D 2025-12-02 14:53:12,702] Sample trial#18 with TPESampler.
[I 2025-12-02 14:53:35,784] Trial 18 finished with value: 0.15775767095527463 and parameters: {'n_layers': 1, 'layer_0_size': 200, 'activation': 'tanh', 'alpha': 0.0001463437180712247, 'learning_rate': 'adaptive', 'solver': 'sgd', 'learning_rate_init': 0.00023495794467273223, 'max_iter': 491}. Best is trial 15 with value: 0.16737574147933595.
[D 2025-12-02 14:53:35,939] Sample trial#19 with TPESampler.
