nohup: ignoring input
[I 2025-12-02 11:41:55,180] A new study created in memory with name: k_nearest_neighbors_fold_1
[D 2025-12-02 11:41:55,180] Sample trial#0 with RandomSampler.
[I 2025-12-02 11:41:59,267] Trial 0 finished with value: 0.10323161119335555 and parameters: {'n_neighbors': 25, 'algorithm': 'kd_tree', 'p': 1, 'leaf_size': 30}. Best is trial 0 with value: 0.10323161119335555.
[D 2025-12-02 11:41:59,317] Sample trial#1 with TPESampler.
[I 2025-12-02 11:41:59,776] Trial 1 finished with value: 0.11883895517204768 and parameters: {'n_neighbors': 55, 'algorithm': 'brute', 'p': 1, 'leaf_size': 28}. Best is trial 1 with value: 0.11883895517204768.
[D 2025-12-02 11:41:59,826] Sample trial#2 with TPESampler.
[I 2025-12-02 11:42:00,055] Trial 2 finished with value: 0.14440770060149458 and parameters: {'n_neighbors': 85, 'algorithm': 'auto', 'p': 2, 'leaf_size': 38}. Best is trial 2 with value: 0.14440770060149458.
[D 2025-12-02 11:42:00,104] Sample trial#3 with TPESampler.
[I 2025-12-02 11:42:00,352] Trial 3 finished with value: 0.14471391704457676 and parameters: {'n_neighbors': 95, 'algorithm': 'brute', 'p': 2, 'leaf_size': 23}. Best is trial 3 with value: 0.14471391704457676.
[D 2025-12-02 11:42:00,402] Sample trial#4 with TPESampler.
[I 2025-12-02 11:42:00,636] Trial 4 finished with value: 0.14440770060149458 and parameters: {'n_neighbors': 85, 'algorithm': 'brute', 'p': 2, 'leaf_size': 26}. Best is trial 3 with value: 0.14471391704457676.
[D 2025-12-02 11:42:00,686] Sample trial#5 with TPESampler.
[I 2025-12-02 11:42:00,931] Trial 5 finished with value: 0.14471391704457676 and parameters: {'n_neighbors': 95, 'algorithm': 'brute', 'p': 2, 'leaf_size': 23}. Best is trial 3 with value: 0.14471391704457676.
[D 2025-12-02 11:42:00,980] Sample trial#6 with TPESampler.
[I 2025-12-02 11:42:01,489] Trial 6 finished with value: 0.1291298768563979 and parameters: {'n_neighbors': 95, 'algorithm': 'auto', 'p': 1, 'leaf_size': 28}. Best is trial 3 with value: 0.14471391704457676.
[D 2025-12-02 11:42:01,542] Sample trial#7 with TPESampler.
[I 2025-12-02 11:42:04,565] Trial 7 finished with value: 0.14904851627519014 and parameters: {'n_neighbors': 125, 'algorithm': 'ball_tree', 'p': 2, 'leaf_size': 20}. Best is trial 7 with value: 0.14904851627519014.
[D 2025-12-02 11:42:04,614] Sample trial#8 with TPESampler.
[I 2025-12-02 11:42:07,379] Trial 8 finished with value: 0.1185779342570834 and parameters: {'n_neighbors': 55, 'algorithm': 'ball_tree', 'p': 1, 'leaf_size': 39}. Best is trial 7 with value: 0.14904851627519014.
[D 2025-12-02 11:42:07,430] Sample trial#9 with TPESampler.
[I 2025-12-02 11:42:10,184] Trial 9 finished with value: 0.14413373604575236 and parameters: {'n_neighbors': 65, 'algorithm': 'ball_tree', 'p': 2, 'leaf_size': 40}. Best is trial 7 with value: 0.14904851627519014.
[D 2025-12-02 11:42:10,236] Sample trial#10 with TPESampler.
[I 2025-12-02 11:42:13,150] Trial 10 finished with value: 0.1479481322966575 and parameters: {'n_neighbors': 115, 'algorithm': 'ball_tree', 'p': 2, 'leaf_size': 29}. Best is trial 7 with value: 0.14904851627519014.
[D 2025-12-02 11:42:13,199] Sample trial#11 with TPESampler.
[I 2025-12-02 11:42:16,126] Trial 11 finished with value: 0.14904851627519014 and parameters: {'n_neighbors': 125, 'algorithm': 'ball_tree', 'p': 2, 'leaf_size': 30}. Best is trial 7 with value: 0.14904851627519014.
[D 2025-12-02 11:42:16,176] Sample trial#12 with TPESampler.
[I 2025-12-02 11:42:19,123] Trial 12 finished with value: 0.1479481322966575 and parameters: {'n_neighbors': 115, 'algorithm': 'ball_tree', 'p': 2, 'leaf_size': 21}. Best is trial 7 with value: 0.14904851627519014.
[D 2025-12-02 11:42:19,171] Sample trial#13 with TPESampler.
[I 2025-12-02 11:42:19,423] Trial 13 finished with value: 0.14910772271849054 and parameters: {'n_neighbors': 125, 'algorithm': 'auto', 'p': 2, 'leaf_size': 32}. Best is trial 13 with value: 0.14910772271849054.
[D 2025-12-02 11:42:19,473] Sample trial#14 with TPESampler.
[I 2025-12-02 11:42:23,899] Trial 14 finished with value: 0.132932171881018 and parameters: {'n_neighbors': 125, 'algorithm': 'kd_tree', 'p': 1, 'leaf_size': 20}. Best is trial 13 with value: 0.14910772271849054.
[D 2025-12-02 11:42:23,950] Sample trial#15 with TPESampler.
[I 2025-12-02 11:42:24,196] Trial 15 finished with value: 0.14910772271849054 and parameters: {'n_neighbors': 125, 'algorithm': 'auto', 'p': 2, 'leaf_size': 39}. Best is trial 13 with value: 0.14910772271849054.
[D 2025-12-02 11:42:24,246] Sample trial#16 with TPESampler.
[I 2025-12-02 11:42:24,526] Trial 16 finished with value: 0.14910772271849054 and parameters: {'n_neighbors': 125, 'algorithm': 'brute', 'p': 2, 'leaf_size': 39}. Best is trial 13 with value: 0.14910772271849054.
[D 2025-12-02 11:42:24,578] Sample trial#17 with TPESampler.
[I 2025-12-02 11:42:25,127] Trial 17 finished with value: 0.13305326500045492 and parameters: {'n_neighbors': 125, 'algorithm': 'auto', 'p': 1, 'leaf_size': 34}. Best is trial 13 with value: 0.14910772271849054.
[D 2025-12-02 11:42:25,180] Sample trial#18 with TPESampler.
[I 2025-12-02 11:42:25,467] Trial 18 finished with value: 0.14910772271849054 and parameters: {'n_neighbors': 125, 'algorithm': 'auto', 'p': 2, 'leaf_size': 38}. Best is trial 13 with value: 0.14910772271849054.
[D 2025-12-02 11:42:25,518] Sample trial#19 with TPESampler.
[I 2025-12-02 11:42:25,778] Trial 19 finished with value: 0.14565885315637636 and parameters: {'n_neighbors': 105, 'algorithm': 'auto', 'p': 2, 'leaf_size': 31}. Best is trial 13 with value: 0.14910772271849054.
[D 2025-12-02 11:42:25,828] Sample trial#20 with TPESampler.
[I 2025-12-02 11:42:29,977] Trial 20 finished with value: 0.14509434702605345 and parameters: {'n_neighbors': 85, 'algorithm': 'kd_tree', 'p': 2, 'leaf_size': 34}. Best is trial 13 with value: 0.14910772271849054.
[D 2025-12-02 11:42:30,028] Sample trial#21 with TPESampler.
[I 2025-12-02 11:42:30,318] Trial 21 finished with value: 0.14910772271849054 and parameters: {'n_neighbors': 125, 'algorithm': 'brute', 'p': 2, 'leaf_size': 39}. Best is trial 13 with value: 0.14910772271849054.
[D 2025-12-02 11:42:30,368] Sample trial#22 with TPESampler.
[I 2025-12-02 11:42:30,615] Trial 22 finished with value: 0.14471391704457676 and parameters: {'n_neighbors': 95, 'algorithm': 'brute', 'p': 2, 'leaf_size': 36}. Best is trial 13 with value: 0.14910772271849054.
[D 2025-12-02 11:42:30,665] Sample trial#23 with TPESampler.
[I 2025-12-02 11:42:34,924] Trial 23 finished with value: 0.1492396564459102 and parameters: {'n_neighbors': 125, 'algorithm': 'kd_tree', 'p': 2, 'leaf_size': 35}. Best is trial 23 with value: 0.1492396564459102.
[D 2025-12-02 11:42:34,973] Sample trial#24 with TPESampler.
[I 2025-12-02 11:42:39,167] Trial 24 finished with value: 0.1492396564459102 and parameters: {'n_neighbors': 125, 'algorithm': 'kd_tree', 'p': 2, 'leaf_size': 34}. Best is trial 23 with value: 0.1492396564459102.
[D 2025-12-02 11:42:39,217] Sample trial#25 with TPESampler.
[I 2025-12-02 11:42:43,418] Trial 25 finished with value: 0.1492396564459102 and parameters: {'n_neighbors': 125, 'algorithm': 'kd_tree', 'p': 2, 'leaf_size': 33}. Best is trial 23 with value: 0.1492396564459102.
[D 2025-12-02 11:42:43,467] Sample trial#26 with TPESampler.
[I 2025-12-02 11:42:47,701] Trial 26 finished with value: 0.1492396564459102 and parameters: {'n_neighbors': 125, 'algorithm': 'kd_tree', 'p': 2, 'leaf_size': 34}. Best is trial 23 with value: 0.1492396564459102.
[D 2025-12-02 11:42:47,752] Sample trial#27 with TPESampler.
[I 2025-12-02 11:42:51,955] Trial 27 finished with value: 0.1480352515716134 and parameters: {'n_neighbors': 115, 'algorithm': 'kd_tree', 'p': 2, 'leaf_size': 28}. Best is trial 23 with value: 0.1492396564459102.
[D 2025-12-02 11:42:52,005] Sample trial#28 with TPESampler.
[I 2025-12-02 11:42:55,511] Trial 28 finished with value: 0.13307899140042703 and parameters: {'n_neighbors': 125, 'algorithm': 'kd_tree', 'p': 1, 'leaf_size': 38}. Best is trial 23 with value: 0.1492396564459102.
[D 2025-12-02 11:42:55,562] Sample trial#29 with TPESampler.
[I 2025-12-02 11:42:58,953] Trial 29 finished with value: 0.14815173236347778 and parameters: {'n_neighbors': 115, 'algorithm': 'kd_tree', 'p': 2, 'leaf_size': 39}. Best is trial 23 with value: 0.1492396564459102.
[I 2025-12-02 11:43:13,338] A new study created in memory with name: k_nearest_neighbors_fold_2
[D 2025-12-02 11:43:13,339] Sample trial#0 with RandomSampler.
[I 2025-12-02 11:43:13,800] Trial 0 finished with value: 0.11916823285093421 and parameters: {'n_neighbors': 65, 'algorithm': 'brute', 'p': 1, 'leaf_size': 38}. Best is trial 0 with value: 0.11916823285093421.
[D 2025-12-02 11:43:13,865] Sample trial#1 with TPESampler.
[I 2025-12-02 11:43:14,119] Trial 1 finished with value: 0.1397055513917957 and parameters: {'n_neighbors': 105, 'algorithm': 'brute', 'p': 2, 'leaf_size': 27}. Best is trial 1 with value: 0.1397055513917957.
[D 2025-12-02 11:43:14,185] Sample trial#2 with TPESampler.
[I 2025-12-02 11:43:14,566] Trial 2 finished with value: 0.10533007133363477 and parameters: {'n_neighbors': 25, 'algorithm': 'auto', 'p': 1, 'leaf_size': 36}. Best is trial 1 with value: 0.1397055513917957.
[D 2025-12-02 11:43:14,630] Sample trial#3 with TPESampler.
[I 2025-12-02 11:43:15,148] Trial 3 finished with value: 0.12280323568245197 and parameters: {'n_neighbors': 105, 'algorithm': 'auto', 'p': 1, 'leaf_size': 36}. Best is trial 1 with value: 0.1397055513917957.
[D 2025-12-02 11:43:15,216] Sample trial#4 with TPESampler.
[I 2025-12-02 11:43:15,444] Trial 4 finished with value: 0.14111826137732011 and parameters: {'n_neighbors': 85, 'algorithm': 'auto', 'p': 2, 'leaf_size': 35}. Best is trial 4 with value: 0.14111826137732011.
[D 2025-12-02 11:43:15,509] Sample trial#5 with TPESampler.
[I 2025-12-02 11:43:19,616] Trial 5 finished with value: 0.13984379108436143 and parameters: {'n_neighbors': 65, 'algorithm': 'kd_tree', 'p': 2, 'leaf_size': 27}. Best is trial 4 with value: 0.14111826137732011.
[D 2025-12-02 11:43:19,681] Sample trial#6 with TPESampler.
[I 2025-12-02 11:43:22,446] Trial 6 finished with value: 0.14006083284461232 and parameters: {'n_neighbors': 55, 'algorithm': 'ball_tree', 'p': 2, 'leaf_size': 30}. Best is trial 4 with value: 0.14111826137732011.
[D 2025-12-02 11:43:22,511] Sample trial#7 with TPESampler.
[I 2025-12-02 11:43:26,686] Trial 7 finished with value: 0.11544635944145838 and parameters: {'n_neighbors': 55, 'algorithm': 'kd_tree', 'p': 1, 'leaf_size': 34}. Best is trial 4 with value: 0.14111826137732011.
[D 2025-12-02 11:43:26,751] Sample trial#8 with TPESampler.
[I 2025-12-02 11:43:29,396] Trial 8 finished with value: 0.1052882551371026 and parameters: {'n_neighbors': 25, 'algorithm': 'ball_tree', 'p': 1, 'leaf_size': 39}. Best is trial 4 with value: 0.14111826137732011.
[D 2025-12-02 11:43:29,460] Sample trial#9 with TPESampler.
[I 2025-12-02 11:43:29,874] Trial 9 finished with value: 0.11048462157714252 and parameters: {'n_neighbors': 45, 'algorithm': 'brute', 'p': 1, 'leaf_size': 32}. Best is trial 4 with value: 0.14111826137732011.
[D 2025-12-02 11:43:29,940] Sample trial#10 with TPESampler.
[I 2025-12-02 11:43:30,207] Trial 10 finished with value: 0.1430231676656404 and parameters: {'n_neighbors': 115, 'algorithm': 'auto', 'p': 2, 'leaf_size': 40}. Best is trial 10 with value: 0.1430231676656404.
[D 2025-12-02 11:43:30,272] Sample trial#11 with TPESampler.
[I 2025-12-02 11:43:30,541] Trial 11 finished with value: 0.1430231676656404 and parameters: {'n_neighbors': 115, 'algorithm': 'auto', 'p': 2, 'leaf_size': 39}. Best is trial 10 with value: 0.1430231676656404.
[D 2025-12-02 11:43:30,607] Sample trial#12 with TPESampler.
[I 2025-12-02 11:43:30,886] Trial 12 finished with value: 0.14319235193284577 and parameters: {'n_neighbors': 125, 'algorithm': 'auto', 'p': 2, 'leaf_size': 37}. Best is trial 12 with value: 0.14319235193284577.
[D 2025-12-02 11:43:30,954] Sample trial#13 with TPESampler.
[I 2025-12-02 11:43:31,237] Trial 13 finished with value: 0.14319235193284577 and parameters: {'n_neighbors': 125, 'algorithm': 'auto', 'p': 2, 'leaf_size': 32}. Best is trial 12 with value: 0.14319235193284577.
[D 2025-12-02 11:43:31,305] Sample trial#14 with TPESampler.
[I 2025-12-02 11:43:31,592] Trial 14 finished with value: 0.14319235193284577 and parameters: {'n_neighbors': 125, 'algorithm': 'auto', 'p': 2, 'leaf_size': 32}. Best is trial 12 with value: 0.14319235193284577.
[D 2025-12-02 11:43:31,657] Sample trial#15 with TPESampler.
[I 2025-12-02 11:43:35,930] Trial 15 finished with value: 0.12477525953124849 and parameters: {'n_neighbors': 125, 'algorithm': 'kd_tree', 'p': 1, 'leaf_size': 33}. Best is trial 12 with value: 0.14319235193284577.
[D 2025-12-02 11:43:35,999] Sample trial#16 with TPESampler.
[I 2025-12-02 11:43:36,545] Trial 16 finished with value: 0.12516012981342897 and parameters: {'n_neighbors': 125, 'algorithm': 'auto', 'p': 1, 'leaf_size': 25}. Best is trial 12 with value: 0.14319235193284577.
[D 2025-12-02 11:43:36,612] Sample trial#17 with TPESampler.
[I 2025-12-02 11:43:36,859] Trial 17 finished with value: 0.1407028185685933 and parameters: {'n_neighbors': 95, 'algorithm': 'auto', 'p': 2, 'leaf_size': 26}. Best is trial 12 with value: 0.14319235193284577.
[D 2025-12-02 11:43:36,928] Sample trial#18 with TPESampler.
[I 2025-12-02 11:43:39,761] Trial 18 finished with value: 0.1101881014282425 and parameters: {'n_neighbors': 45, 'algorithm': 'ball_tree', 'p': 1, 'leaf_size': 21}. Best is trial 12 with value: 0.14319235193284577.
[D 2025-12-02 11:43:39,827] Sample trial#19 with TPESampler.
[I 2025-12-02 11:43:42,694] Trial 19 finished with value: 0.1431436756211256 and parameters: {'n_neighbors': 125, 'algorithm': 'ball_tree', 'p': 2, 'leaf_size': 25}. Best is trial 12 with value: 0.14319235193284577.
[D 2025-12-02 11:43:42,759] Sample trial#20 with TPESampler.
[I 2025-12-02 11:43:43,040] Trial 20 finished with value: 0.14319235193284577 and parameters: {'n_neighbors': 125, 'algorithm': 'brute', 'p': 2, 'leaf_size': 34}. Best is trial 12 with value: 0.14319235193284577.
[D 2025-12-02 11:43:43,105] Sample trial#21 with TPESampler.
[I 2025-12-02 11:43:43,386] Trial 21 finished with value: 0.14319235193284577 and parameters: {'n_neighbors': 125, 'algorithm': 'auto', 'p': 2, 'leaf_size': 33}. Best is trial 12 with value: 0.14319235193284577.
[D 2025-12-02 11:43:43,452] Sample trial#22 with TPESampler.
[I 2025-12-02 11:43:47,689] Trial 22 finished with value: 0.14253039241233073 and parameters: {'n_neighbors': 115, 'algorithm': 'kd_tree', 'p': 2, 'leaf_size': 32}. Best is trial 12 with value: 0.14319235193284577.
[D 2025-12-02 11:43:47,754] Sample trial#23 with TPESampler.
[I 2025-12-02 11:43:48,023] Trial 23 finished with value: 0.1430231676656404 and parameters: {'n_neighbors': 115, 'algorithm': 'auto', 'p': 2, 'leaf_size': 30}. Best is trial 12 with value: 0.14319235193284577.
[D 2025-12-02 11:43:48,090] Sample trial#24 with TPESampler.
[I 2025-12-02 11:43:50,800] Trial 24 finished with value: 0.14315946615256975 and parameters: {'n_neighbors': 125, 'algorithm': 'ball_tree', 'p': 2, 'leaf_size': 36}. Best is trial 12 with value: 0.14319235193284577.
[D 2025-12-02 11:43:50,865] Sample trial#25 with TPESampler.
[I 2025-12-02 11:43:55,112] Trial 25 finished with value: 0.12285423710560724 and parameters: {'n_neighbors': 115, 'algorithm': 'kd_tree', 'p': 1, 'leaf_size': 20}. Best is trial 12 with value: 0.14319235193284577.
[D 2025-12-02 11:43:55,177] Sample trial#26 with TPESampler.
[I 2025-12-02 11:43:55,322] Trial 26 finished with value: 0.1267478822510204 and parameters: {'n_neighbors': 25, 'algorithm': 'brute', 'p': 2, 'leaf_size': 22}. Best is trial 12 with value: 0.14319235193284577.
[D 2025-12-02 11:43:55,387] Sample trial#27 with TPESampler.
[I 2025-12-02 11:43:58,682] Trial 27 finished with value: 0.143088297225479 and parameters: {'n_neighbors': 125, 'algorithm': 'kd_tree', 'p': 2, 'leaf_size': 38}. Best is trial 12 with value: 0.14319235193284577.
[D 2025-12-02 11:43:58,748] Sample trial#28 with TPESampler.
[I 2025-12-02 11:44:01,828] Trial 28 finished with value: 0.13524365303842467 and parameters: {'n_neighbors': 35, 'algorithm': 'kd_tree', 'p': 2, 'leaf_size': 39}. Best is trial 12 with value: 0.14319235193284577.
[D 2025-12-02 11:44:01,893] Sample trial#29 with TPESampler.
[I 2025-12-02 11:44:02,172] Trial 29 finished with value: 0.14319235193284577 and parameters: {'n_neighbors': 125, 'algorithm': 'auto', 'p': 2, 'leaf_size': 34}. Best is trial 12 with value: 0.14319235193284577.
[I 2025-12-02 11:44:03,217] A new study created in memory with name: k_nearest_neighbors_fold_3
[D 2025-12-02 11:44:03,217] Sample trial#0 with RandomSampler.
[I 2025-12-02 11:44:07,276] Trial 0 finished with value: 0.09975921929669494 and parameters: {'n_neighbors': 25, 'algorithm': 'kd_tree', 'p': 1, 'leaf_size': 26}. Best is trial 0 with value: 0.09975921929669494.
[D 2025-12-02 11:44:07,344] Sample trial#1 with TPESampler.
[I 2025-12-02 11:44:07,585] Trial 1 finished with value: 0.1424281780957497 and parameters: {'n_neighbors': 95, 'algorithm': 'brute', 'p': 2, 'leaf_size': 39}. Best is trial 1 with value: 0.1424281780957497.
[D 2025-12-02 11:44:07,653] Sample trial#2 with TPESampler.
[I 2025-12-02 11:44:10,467] Trial 2 finished with value: 0.10926951751139588 and parameters: {'n_neighbors': 55, 'algorithm': 'ball_tree', 'p': 1, 'leaf_size': 31}. Best is trial 1 with value: 0.1424281780957497.
[D 2025-12-02 11:44:10,534] Sample trial#3 with TPESampler.
[I 2025-12-02 11:44:13,374] Trial 3 finished with value: 0.11486756078749147 and parameters: {'n_neighbors': 75, 'algorithm': 'ball_tree', 'p': 1, 'leaf_size': 29}. Best is trial 1 with value: 0.1424281780957497.
[D 2025-12-02 11:44:13,441] Sample trial#4 with TPESampler.
[I 2025-12-02 11:44:13,674] Trial 4 finished with value: 0.1439640249564521 and parameters: {'n_neighbors': 85, 'algorithm': 'auto', 'p': 2, 'leaf_size': 36}. Best is trial 4 with value: 0.1439640249564521.
[D 2025-12-02 11:44:13,742] Sample trial#5 with TPESampler.
[I 2025-12-02 11:44:13,916] Trial 5 finished with value: 0.13900052399256263 and parameters: {'n_neighbors': 45, 'algorithm': 'auto', 'p': 2, 'leaf_size': 39}. Best is trial 4 with value: 0.1439640249564521.
[D 2025-12-02 11:44:13,984] Sample trial#6 with TPESampler.
[I 2025-12-02 11:44:14,238] Trial 6 finished with value: 0.14232663985711985 and parameters: {'n_neighbors': 105, 'algorithm': 'auto', 'p': 2, 'leaf_size': 26}. Best is trial 4 with value: 0.1439640249564521.
[D 2025-12-02 11:44:14,307] Sample trial#7 with TPESampler.
[I 2025-12-02 11:44:18,335] Trial 7 finished with value: 0.1390540351583823 and parameters: {'n_neighbors': 45, 'algorithm': 'kd_tree', 'p': 2, 'leaf_size': 24}. Best is trial 4 with value: 0.1439640249564521.
[D 2025-12-02 11:44:18,402] Sample trial#8 with TPESampler.
[I 2025-12-02 11:44:18,551] Trial 8 finished with value: 0.12814127307101897 and parameters: {'n_neighbors': 25, 'algorithm': 'auto', 'p': 2, 'leaf_size': 29}. Best is trial 4 with value: 0.1439640249564521.
[D 2025-12-02 11:44:18,620] Sample trial#9 with TPESampler.
[I 2025-12-02 11:44:19,040] Trial 9 finished with value: 0.10983278111520496 and parameters: {'n_neighbors': 45, 'algorithm': 'auto', 'p': 1, 'leaf_size': 30}. Best is trial 4 with value: 0.1439640249564521.
[D 2025-12-02 11:44:19,110] Sample trial#10 with TPESampler.
[I 2025-12-02 11:44:19,665] Trial 10 finished with value: 0.11723487443428234 and parameters: {'n_neighbors': 125, 'algorithm': 'auto', 'p': 1, 'leaf_size': 38}. Best is trial 4 with value: 0.1439640249564521.
[D 2025-12-02 11:44:19,733] Sample trial#11 with TPESampler.
[I 2025-12-02 11:44:19,961] Trial 11 finished with value: 0.1439640249564521 and parameters: {'n_neighbors': 85, 'algorithm': 'brute', 'p': 2, 'leaf_size': 38}. Best is trial 4 with value: 0.1439640249564521.
[D 2025-12-02 11:44:20,030] Sample trial#12 with TPESampler.
[I 2025-12-02 11:44:20,244] Trial 12 finished with value: 0.14418757696181717 and parameters: {'n_neighbors': 75, 'algorithm': 'brute', 'p': 2, 'leaf_size': 30}. Best is trial 12 with value: 0.14418757696181717.
[D 2025-12-02 11:44:20,311] Sample trial#13 with TPESampler.
[I 2025-12-02 11:44:20,512] Trial 13 finished with value: 0.14472534787936908 and parameters: {'n_neighbors': 65, 'algorithm': 'brute', 'p': 2, 'leaf_size': 29}. Best is trial 13 with value: 0.14472534787936908.
[D 2025-12-02 11:44:20,580] Sample trial#14 with TPESampler.
[I 2025-12-02 11:44:20,753] Trial 14 finished with value: 0.13900052399256263 and parameters: {'n_neighbors': 45, 'algorithm': 'brute', 'p': 2, 'leaf_size': 31}. Best is trial 13 with value: 0.14472534787936908.
[D 2025-12-02 11:44:20,819] Sample trial#15 with TPESampler.
[I 2025-12-02 11:44:21,045] Trial 15 finished with value: 0.1439640249564521 and parameters: {'n_neighbors': 85, 'algorithm': 'brute', 'p': 2, 'leaf_size': 27}. Best is trial 13 with value: 0.14472534787936908.
[D 2025-12-02 11:44:21,112] Sample trial#16 with TPESampler.
[I 2025-12-02 11:44:21,300] Trial 16 finished with value: 0.14563681364486375 and parameters: {'n_neighbors': 55, 'algorithm': 'brute', 'p': 2, 'leaf_size': 20}. Best is trial 16 with value: 0.14563681364486375.
[D 2025-12-02 11:44:21,368] Sample trial#17 with TPESampler.
[I 2025-12-02 11:44:21,809] Trial 17 finished with value: 0.10936135362505003 and parameters: {'n_neighbors': 55, 'algorithm': 'brute', 'p': 1, 'leaf_size': 20}. Best is trial 16 with value: 0.14563681364486375.
[D 2025-12-02 11:44:21,876] Sample trial#18 with TPESampler.
[I 2025-12-02 11:44:22,048] Trial 18 finished with value: 0.13900052399256263 and parameters: {'n_neighbors': 45, 'algorithm': 'brute', 'p': 2, 'leaf_size': 20}. Best is trial 16 with value: 0.14563681364486375.
[D 2025-12-02 11:44:22,115] Sample trial#19 with TPESampler.
