[I 2025-12-02 11:51:25,949] Trial 23 finished with value: 0.15804057859264536 and parameters: {'n_estimators': 100, 'max_depth': 6, 'min_samples_split': 11, 'min_samples_leaf': 23, 'max_features': 'log2', 'criterion': 'log_loss', 'bootstrap': False}. Best is trial 12 with value: 0.16069325707480503.
[D 2025-12-02 11:51:26,034] Sample trial#24 with TPESampler.
[I 2025-12-02 11:51:28,131] Trial 24 finished with value: 0.15758342666165026 and parameters: {'n_estimators': 175, 'max_depth': 11, 'min_samples_split': 19, 'min_samples_leaf': 21, 'max_features': 'sqrt', 'criterion': 'gini', 'bootstrap': False}. Best is trial 12 with value: 0.16069325707480503.
[D 2025-12-02 11:51:28,229] Sample trial#25 with TPESampler.
[I 2025-12-02 11:51:30,194] Trial 25 finished with value: 0.1556447856177468 and parameters: {'n_estimators': 200, 'max_depth': 8, 'min_samples_split': 17, 'min_samples_leaf': 25, 'max_features': 'log2', 'criterion': 'entropy', 'bootstrap': False}. Best is trial 12 with value: 0.16069325707480503.
[D 2025-12-02 11:51:30,284] Sample trial#26 with TPESampler.
[I 2025-12-02 11:51:32,771] Trial 26 finished with value: 0.15616300641650685 and parameters: {'n_estimators': 200, 'max_depth': 15, 'min_samples_split': 19, 'min_samples_leaf': 25, 'max_features': 'log2', 'criterion': 'log_loss', 'bootstrap': False}. Best is trial 12 with value: 0.16069325707480503.
[D 2025-12-02 11:51:32,859] Sample trial#27 with TPESampler.
[I 2025-12-02 11:51:34,435] Trial 27 finished with value: 0.15940965817186797 and parameters: {'n_estimators': 125, 'max_depth': 7, 'min_samples_split': 15, 'min_samples_leaf': 23, 'max_features': 'sqrt', 'criterion': 'entropy', 'bootstrap': False}. Best is trial 12 with value: 0.16069325707480503.
[D 2025-12-02 11:51:34,523] Sample trial#28 with TPESampler.
[I 2025-12-02 11:51:35,432] Trial 28 finished with value: 0.15923628624957073 and parameters: {'n_estimators': 125, 'max_depth': 4, 'min_samples_split': 19, 'min_samples_leaf': 21, 'max_features': 'log2', 'criterion': 'log_loss', 'bootstrap': False}. Best is trial 12 with value: 0.16069325707480503.
[D 2025-12-02 11:51:35,517] Sample trial#29 with TPESampler.
[I 2025-12-02 11:51:43,273] Trial 29 finished with value: 0.1060424412835318 and parameters: {'n_estimators': 275, 'max_depth': 3, 'min_samples_split': 15, 'min_samples_leaf': 25, 'max_features': None, 'criterion': 'gini', 'bootstrap': False}. Best is trial 12 with value: 0.16069325707480503.
[I 2025-12-02 11:51:44,503] A new study created in memory with name: random_forest_fold_2
[D 2025-12-02 11:51:44,504] Sample trial#0 with RandomSampler.
[I 2025-12-02 11:51:46,125] Trial 0 finished with value: 0.1446085483298788 and parameters: {'n_estimators': 225, 'max_depth': 5, 'min_samples_split': 5, 'min_samples_leaf': 15, 'max_features': 'log2', 'criterion': 'log_loss', 'bootstrap': False}. Best is trial 0 with value: 0.1446085483298788.
[D 2025-12-02 11:51:46,218] Sample trial#1 with TPESampler.
[I 2025-12-02 11:51:47,686] Trial 1 finished with value: 0.13596659794389945 and parameters: {'n_estimators': 100, 'max_depth': 18, 'min_samples_split': 17, 'min_samples_leaf': 17, 'max_features': 'sqrt', 'criterion': 'gini', 'bootstrap': False}. Best is trial 0 with value: 0.1446085483298788.
[D 2025-12-02 11:51:47,776] Sample trial#2 with TPESampler.
[I 2025-12-02 11:52:10,998] Trial 2 finished with value: 0.08364473855192253 and parameters: {'n_estimators': 250, 'max_depth': 12, 'min_samples_split': 7, 'min_samples_leaf': 25, 'max_features': None, 'criterion': 'log_loss', 'bootstrap': False}. Best is trial 0 with value: 0.1446085483298788.
[D 2025-12-02 11:52:11,088] Sample trial#3 with TPESampler.
[I 2025-12-02 11:52:12,827] Trial 3 finished with value: 0.14457412331970274 and parameters: {'n_estimators': 100, 'max_depth': 19, 'min_samples_split': 9, 'min_samples_leaf': 25, 'max_features': 'sqrt', 'criterion': 'entropy', 'bootstrap': False}. Best is trial 0 with value: 0.1446085483298788.
[D 2025-12-02 11:52:12,917] Sample trial#4 with TPESampler.
[I 2025-12-02 11:52:15,148] Trial 4 finished with value: 0.14838067930394208 and parameters: {'n_estimators': 275, 'max_depth': 12, 'min_samples_split': 9, 'min_samples_leaf': 23, 'max_features': 'log2', 'criterion': 'entropy', 'bootstrap': True}. Best is trial 4 with value: 0.14838067930394208.
[D 2025-12-02 11:52:15,243] Sample trial#5 with TPESampler.
[I 2025-12-02 11:52:38,314] Trial 5 finished with value: 0.08466993945056701 and parameters: {'n_estimators': 225, 'max_depth': 16, 'min_samples_split': 17, 'min_samples_leaf': 17, 'max_features': None, 'criterion': 'entropy', 'bootstrap': False}. Best is trial 4 with value: 0.14838067930394208.
[D 2025-12-02 11:52:38,400] Sample trial#6 with TPESampler.
[I 2025-12-02 11:52:40,332] Trial 6 finished with value: 0.14762583144499627 and parameters: {'n_estimators': 275, 'max_depth': 7, 'min_samples_split': 17, 'min_samples_leaf': 23, 'max_features': 'log2', 'criterion': 'entropy', 'bootstrap': True}. Best is trial 4 with value: 0.14838067930394208.
[D 2025-12-02 11:52:40,427] Sample trial#7 with TPESampler.
[I 2025-12-02 11:52:42,084] Trial 7 finished with value: 0.15239093696367878 and parameters: {'n_estimators': 150, 'max_depth': 6, 'min_samples_split': 13, 'min_samples_leaf': 21, 'max_features': 'sqrt', 'criterion': 'log_loss', 'bootstrap': False}. Best is trial 7 with value: 0.15239093696367878.
[D 2025-12-02 11:52:42,177] Sample trial#8 with TPESampler.
[I 2025-12-02 11:52:56,867] Trial 8 finished with value: 0.12908207011736214 and parameters: {'n_estimators': 250, 'max_depth': 18, 'min_samples_split': 19, 'min_samples_leaf': 15, 'max_features': None, 'criterion': 'log_loss', 'bootstrap': True}. Best is trial 7 with value: 0.15239093696367878.
[D 2025-12-02 11:52:56,957] Sample trial#9 with TPESampler.
[I 2025-12-02 11:53:11,404] Trial 9 finished with value: 0.09875746141527422 and parameters: {'n_estimators': 175, 'max_depth': 9, 'min_samples_split': 19, 'min_samples_leaf': 17, 'max_features': None, 'criterion': 'log_loss', 'bootstrap': False}. Best is trial 7 with value: 0.15239093696367878.
[D 2025-12-02 11:53:11,504] Sample trial#10 with TPESampler.
[I 2025-12-02 11:53:12,784] Trial 10 finished with value: 0.14755537813797445 and parameters: {'n_estimators': 125, 'max_depth': 5, 'min_samples_split': 11, 'min_samples_leaf': 25, 'max_features': 'sqrt', 'criterion': 'log_loss', 'bootstrap': False}. Best is trial 7 with value: 0.15239093696367878.
[D 2025-12-02 11:53:12,873] Sample trial#11 with TPESampler.
[I 2025-12-02 11:53:14,917] Trial 11 finished with value: 0.1460373105935519 and parameters: {'n_estimators': 250, 'max_depth': 7, 'min_samples_split': 5, 'min_samples_leaf': 25, 'max_features': 'log2', 'criterion': 'entropy', 'bootstrap': True}. Best is trial 7 with value: 0.15239093696367878.
[D 2025-12-02 11:53:15,005] Sample trial#12 with TPESampler.
[I 2025-12-02 11:53:17,147] Trial 12 finished with value: 0.14892621520325933 and parameters: {'n_estimators': 300, 'max_depth': 11, 'min_samples_split': 9, 'min_samples_leaf': 21, 'max_features': 'log2', 'criterion': 'gini', 'bootstrap': True}. Best is trial 7 with value: 0.15239093696367878.
[D 2025-12-02 11:53:17,239] Sample trial#13 with TPESampler.
[I 2025-12-02 11:53:18,833] Trial 13 finished with value: 0.1379014287977411 and parameters: {'n_estimators': 250, 'max_depth': 3, 'min_samples_split': 11, 'min_samples_leaf': 21, 'max_features': 'sqrt', 'criterion': 'log_loss', 'bootstrap': False}. Best is trial 7 with value: 0.15239093696367878.
[D 2025-12-02 11:53:18,925] Sample trial#14 with TPESampler.
[I 2025-12-02 11:53:20,659] Trial 14 finished with value: 0.1449806031102326 and parameters: {'n_estimators': 225, 'max_depth': 13, 'min_samples_split': 5, 'min_samples_leaf': 19, 'max_features': 'log2', 'criterion': 'gini', 'bootstrap': True}. Best is trial 7 with value: 0.15239093696367878.
[D 2025-12-02 11:53:20,751] Sample trial#15 with TPESampler.
[I 2025-12-02 11:53:22,001] Trial 15 finished with value: 0.14417484212423795 and parameters: {'n_estimators': 125, 'max_depth': 6, 'min_samples_split': 13, 'min_samples_leaf': 19, 'max_features': 'sqrt', 'criterion': 'gini', 'bootstrap': False}. Best is trial 7 with value: 0.15239093696367878.
[D 2025-12-02 11:53:22,091] Sample trial#16 with TPESampler.
[I 2025-12-02 11:53:24,177] Trial 16 finished with value: 0.14384904706371043 and parameters: {'n_estimators': 275, 'max_depth': 17, 'min_samples_split': 15, 'min_samples_leaf': 21, 'max_features': 'log2', 'criterion': 'gini', 'bootstrap': True}. Best is trial 7 with value: 0.15239093696367878.
[D 2025-12-02 11:53:24,268] Sample trial#17 with TPESampler.
[I 2025-12-02 11:53:26,086] Trial 17 finished with value: 0.14444277992973614 and parameters: {'n_estimators': 175, 'max_depth': 14, 'min_samples_split': 13, 'min_samples_leaf': 23, 'max_features': 'sqrt', 'criterion': 'log_loss', 'bootstrap': True}. Best is trial 7 with value: 0.15239093696367878.
[D 2025-12-02 11:53:26,178] Sample trial#18 with TPESampler.
[I 2025-12-02 11:53:28,373] Trial 18 finished with value: 0.14739242766890284 and parameters: {'n_estimators': 300, 'max_depth': 11, 'min_samples_split': 9, 'min_samples_leaf': 23, 'max_features': 'log2', 'criterion': 'gini', 'bootstrap': True}. Best is trial 7 with value: 0.15239093696367878.
[D 2025-12-02 11:53:28,475] Sample trial#19 with TPESampler.
[I 2025-12-02 11:53:29,915] Trial 19 finished with value: 0.15059937126489403 and parameters: {'n_estimators': 125, 'max_depth': 9, 'min_samples_split': 17, 'min_samples_leaf': 21, 'max_features': 'log2', 'criterion': 'log_loss', 'bootstrap': False}. Best is trial 7 with value: 0.15239093696367878.
[D 2025-12-02 11:53:30,001] Sample trial#20 with TPESampler.
[I 2025-12-02 11:53:31,292] Trial 20 finished with value: 0.14359762644881638 and parameters: {'n_estimators': 100, 'max_depth': 11, 'min_samples_split': 17, 'min_samples_leaf': 21, 'max_features': 'log2', 'criterion': 'log_loss', 'bootstrap': False}. Best is trial 7 with value: 0.15239093696367878.
[D 2025-12-02 11:53:31,380] Sample trial#21 with TPESampler.
[I 2025-12-02 11:53:32,291] Trial 21 finished with value: 0.14266530437011604 and parameters: {'n_estimators': 100, 'max_depth': 3, 'min_samples_split': 15, 'min_samples_leaf': 21, 'max_features': 'sqrt', 'criterion': 'log_loss', 'bootstrap': True}. Best is trial 7 with value: 0.15239093696367878.
[D 2025-12-02 11:53:32,380] Sample trial#22 with TPESampler.
[I 2025-12-02 11:53:33,597] Trial 22 finished with value: 0.14339843153685258 and parameters: {'n_estimators': 175, 'max_depth': 4, 'min_samples_split': 17, 'min_samples_leaf': 19, 'max_features': 'log2', 'criterion': 'log_loss', 'bootstrap': False}. Best is trial 7 with value: 0.15239093696367878.
[D 2025-12-02 11:53:33,689] Sample trial#23 with TPESampler.
[I 2025-12-02 11:53:35,886] Trial 23 finished with value: 0.1471626725714981 and parameters: {'n_estimators': 300, 'max_depth': 12, 'min_samples_split': 11, 'min_samples_leaf': 17, 'max_features': 'log2', 'criterion': 'gini', 'bootstrap': True}. Best is trial 7 with value: 0.15239093696367878.
[D 2025-12-02 11:53:35,980] Sample trial#24 with TPESampler.
[I 2025-12-02 11:53:38,080] Trial 24 finished with value: 0.14481219240682167 and parameters: {'n_estimators': 150, 'max_depth': 10, 'min_samples_split': 15, 'min_samples_leaf': 19, 'max_features': 'sqrt', 'criterion': 'log_loss', 'bootstrap': False}. Best is trial 7 with value: 0.15239093696367878.
[D 2025-12-02 11:53:38,173] Sample trial#25 with TPESampler.
[I 2025-12-02 11:53:39,873] Trial 25 finished with value: 0.14786018898192202 and parameters: {'n_estimators': 250, 'max_depth': 4, 'min_samples_split': 9, 'min_samples_leaf': 21, 'max_features': 'sqrt', 'criterion': 'gini', 'bootstrap': True}. Best is trial 7 with value: 0.15239093696367878.
[D 2025-12-02 11:53:39,974] Sample trial#26 with TPESampler.
[I 2025-12-02 11:53:48,043] Trial 26 finished with value: 0.10568445579983357 and parameters: {'n_estimators': 150, 'max_depth': 5, 'min_samples_split': 13, 'min_samples_leaf': 21, 'max_features': None, 'criterion': 'log_loss', 'bootstrap': False}. Best is trial 7 with value: 0.15239093696367878.
[D 2025-12-02 11:53:48,132] Sample trial#27 with TPESampler.
[I 2025-12-02 11:53:49,562] Trial 27 finished with value: 0.15012662043173058 and parameters: {'n_estimators': 125, 'max_depth': 11, 'min_samples_split': 13, 'min_samples_leaf': 25, 'max_features': 'log2', 'criterion': 'gini', 'bootstrap': False}. Best is trial 7 with value: 0.15239093696367878.
[D 2025-12-02 11:53:49,657] Sample trial#28 with TPESampler.
[I 2025-12-02 11:53:51,480] Trial 28 finished with value: 0.14445472253085687 and parameters: {'n_estimators': 175, 'max_depth': 14, 'min_samples_split': 9, 'min_samples_leaf': 25, 'max_features': 'log2', 'criterion': 'gini', 'bootstrap': False}. Best is trial 7 with value: 0.15239093696367878.
[D 2025-12-02 11:53:51,567] Sample trial#29 with TPESampler.
[I 2025-12-02 11:53:59,576] Trial 29 finished with value: 0.08616903139959207 and parameters: {'n_estimators': 100, 'max_depth': 13, 'min_samples_split': 11, 'min_samples_leaf': 25, 'max_features': None, 'criterion': 'gini', 'bootstrap': False}. Best is trial 7 with value: 0.15239093696367878.
[I 2025-12-02 11:54:00,756] A new study created in memory with name: random_forest_fold_3
[D 2025-12-02 11:54:00,757] Sample trial#0 with RandomSampler.
[I 2025-12-02 11:54:02,537] Trial 0 finished with value: 0.14294588835302596 and parameters: {'n_estimators': 200, 'max_depth': 16, 'min_samples_split': 11, 'min_samples_leaf': 17, 'max_features': 'log2', 'criterion': 'entropy', 'bootstrap': True}. Best is trial 0 with value: 0.14294588835302596.
[D 2025-12-02 11:54:02,630] Sample trial#1 with TPESampler.
[I 2025-12-02 11:54:36,481] Trial 1 finished with value: 0.08097675301407023 and parameters: {'n_estimators': 300, 'max_depth': 18, 'min_samples_split': 5, 'min_samples_leaf': 19, 'max_features': None, 'criterion': 'entropy', 'bootstrap': False}. Best is trial 0 with value: 0.14294588835302596.
[D 2025-12-02 11:54:36,573] Sample trial#2 with TPESampler.
[I 2025-12-02 11:54:37,686] Trial 2 finished with value: 0.1403219106728728 and parameters: {'n_estimators': 100, 'max_depth': 11, 'min_samples_split': 17, 'min_samples_leaf': 23, 'max_features': 'sqrt', 'criterion': 'log_loss', 'bootstrap': True}. Best is trial 0 with value: 0.14294588835302596.
[D 2025-12-02 11:54:37,781] Sample trial#3 with TPESampler.
[I 2025-12-02 11:54:39,324] Trial 3 finished with value: 0.14098606538908626 and parameters: {'n_estimators': 250, 'max_depth': 5, 'min_samples_split': 9, 'min_samples_leaf': 17, 'max_features': 'log2', 'criterion': 'gini', 'bootstrap': True}. Best is trial 0 with value: 0.14294588835302596.
[D 2025-12-02 11:54:39,427] Sample trial#4 with TPESampler.
[I 2025-12-02 11:54:41,782] Trial 4 finished with value: 0.1408959551180026 and parameters: {'n_estimators': 275, 'max_depth': 8, 'min_samples_split': 13, 'min_samples_leaf': 25, 'max_features': 'sqrt', 'criterion': 'log_loss', 'bootstrap': True}. Best is trial 0 with value: 0.14294588835302596.
[D 2025-12-02 11:54:41,878] Sample trial#5 with TPESampler.
[I 2025-12-02 11:55:08,335] Trial 5 finished with value: 0.08738195128295802 and parameters: {'n_estimators': 275, 'max_depth': 11, 'min_samples_split': 13, 'min_samples_leaf': 21, 'max_features': None, 'criterion': 'log_loss', 'bootstrap': False}. Best is trial 0 with value: 0.14294588835302596.
[D 2025-12-02 11:55:08,429] Sample trial#6 with TPESampler.
[I 2025-12-02 11:55:19,508] Trial 6 finished with value: 0.12795870788508257 and parameters: {'n_estimators': 225, 'max_depth': 19, 'min_samples_split': 17, 'min_samples_leaf': 19, 'max_features': None, 'criterion': 'gini', 'bootstrap': True}. Best is trial 0 with value: 0.14294588835302596.
[D 2025-12-02 11:55:19,606] Sample trial#7 with TPESampler.
[I 2025-12-02 11:55:42,890] Trial 7 finished with value: 0.08225525495681178 and parameters: {'n_estimators': 275, 'max_depth': 13, 'min_samples_split': 13, 'min_samples_leaf': 19, 'max_features': None, 'criterion': 'gini', 'bootstrap': False}. Best is trial 0 with value: 0.14294588835302596.
[D 2025-12-02 11:55:42,995] Sample trial#8 with TPESampler.
[I 2025-12-02 11:55:43,917] Trial 8 finished with value: 0.14237726672054013 and parameters: {'n_estimators': 100, 'max_depth': 4, 'min_samples_split': 19, 'min_samples_leaf': 17, 'max_features': 'sqrt', 'criterion': 'gini', 'bootstrap': False}. Best is trial 0 with value: 0.14294588835302596.
[D 2025-12-02 11:55:44,010] Sample trial#9 with TPESampler.
[I 2025-12-02 11:55:46,800] Trial 9 finished with value: 0.14341206189652672 and parameters: {'n_estimators': 300, 'max_depth': 8, 'min_samples_split': 9, 'min_samples_leaf': 17, 'max_features': 'log2', 'criterion': 'entropy', 'bootstrap': False}. Best is trial 9 with value: 0.14341206189652672.
[D 2025-12-02 11:55:46,893] Sample trial#10 with TPESampler.
[I 2025-12-02 11:55:49,738] Trial 10 finished with value: 0.14590776102250072 and parameters: {'n_estimators': 300, 'max_depth': 8, 'min_samples_split': 7, 'min_samples_leaf': 17, 'max_features': 'log2', 'criterion': 'entropy', 'bootstrap': False}. Best is trial 10 with value: 0.14590776102250072.
[D 2025-12-02 11:55:49,839] Sample trial#11 with TPESampler.
[I 2025-12-02 11:55:51,899] Trial 11 finished with value: 0.141073723846248 and parameters: {'n_estimators': 300, 'max_depth': 3, 'min_samples_split': 5, 'min_samples_leaf': 17, 'max_features': 'log2', 'criterion': 'entropy', 'bootstrap': False}. Best is trial 10 with value: 0.14590776102250072.
[D 2025-12-02 11:55:52,016] Sample trial#12 with TPESampler.
[I 2025-12-02 11:55:54,428] Trial 12 finished with value: 0.14201626353124458 and parameters: {'n_estimators': 225, 'max_depth': 10, 'min_samples_split': 9, 'min_samples_leaf': 19, 'max_features': 'log2', 'criterion': 'entropy', 'bootstrap': False}. Best is trial 10 with value: 0.14590776102250072.
[D 2025-12-02 11:55:54,523] Sample trial#13 with TPESampler.
[I 2025-12-02 11:55:58,000] Trial 13 finished with value: 0.13445851106245565 and parameters: {'n_estimators': 300, 'max_depth': 12, 'min_samples_split': 11, 'min_samples_leaf': 15, 'max_features': 'log2', 'criterion': 'log_loss', 'bootstrap': False}. Best is trial 10 with value: 0.14590776102250072.
[D 2025-12-02 11:55:58,101] Sample trial#14 with TPESampler.
[I 2025-12-02 11:56:01,039] Trial 14 finished with value: 0.14623088087148 and parameters: {'n_estimators': 300, 'max_depth': 6, 'min_samples_split': 15, 'min_samples_leaf': 19, 'max_features': 'sqrt', 'criterion': 'entropy', 'bootstrap': False}. Best is trial 14 with value: 0.14623088087148.
[D 2025-12-02 11:56:01,142] Sample trial#15 with TPESampler.
[I 2025-12-02 11:56:03,586] Trial 15 finished with value: 0.14911102021150838 and parameters: {'n_estimators': 250, 'max_depth': 6, 'min_samples_split': 15, 'min_samples_leaf': 21, 'max_features': 'sqrt', 'criterion': 'entropy', 'bootstrap': False}. Best is trial 15 with value: 0.14911102021150838.
[D 2025-12-02 11:56:03,683] Sample trial#16 with TPESampler.
[I 2025-12-02 11:56:05,699] Trial 16 finished with value: 0.1488608960817061 and parameters: {'n_estimators': 200, 'max_depth': 6, 'min_samples_split': 17, 'min_samples_leaf': 21, 'max_features': 'sqrt', 'criterion': 'entropy', 'bootstrap': False}. Best is trial 15 with value: 0.14911102021150838.
[D 2025-12-02 11:56:05,794] Sample trial#17 with TPESampler.
[I 2025-12-02 11:56:07,376] Trial 17 finished with value: 0.14365526948671312 and parameters: {'n_estimators': 200, 'max_depth': 4, 'min_samples_split': 17, 'min_samples_leaf': 23, 'max_features': 'sqrt', 'criterion': 'entropy', 'bootstrap': False}. Best is trial 15 with value: 0.14911102021150838.
[D 2025-12-02 11:56:07,469] Sample trial#18 with TPESampler.
[I 2025-12-02 11:56:09,231] Trial 18 finished with value: 0.14522985819027512 and parameters: {'n_estimators': 125, 'max_depth': 9, 'min_samples_split': 11, 'min_samples_leaf': 21, 'max_features': 'sqrt', 'criterion': 'entropy', 'bootstrap': False}. Best is trial 15 with value: 0.14911102021150838.
[D 2025-12-02 11:56:09,326] Sample trial#19 with TPESampler.
[I 2025-12-02 11:56:11,455] Trial 19 finished with value: 0.14643497634842156 and parameters: {'n_estimators': 275, 'max_depth': 5, 'min_samples_split': 11, 'min_samples_leaf': 23, 'max_features': 'sqrt', 'criterion': 'gini', 'bootstrap': False}. Best is trial 15 with value: 0.14911102021150838.
[D 2025-12-02 11:56:11,557] Sample trial#20 with TPESampler.
[I 2025-12-02 11:56:14,021] Trial 20 finished with value: 0.13824439861730467 and parameters: {'n_estimators': 175, 'max_depth': 10, 'min_samples_split': 17, 'min_samples_leaf': 17, 'max_features': 'sqrt', 'criterion': 'entropy', 'bootstrap': False}. Best is trial 15 with value: 0.14911102021150838.
[D 2025-12-02 11:56:14,114] Sample trial#21 with TPESampler.
[I 2025-12-02 11:56:16,378] Trial 21 finished with value: 0.14502024311933742 and parameters: {'n_estimators': 300, 'max_depth': 5, 'min_samples_split': 9, 'min_samples_leaf': 23, 'max_features': 'sqrt', 'criterion': 'gini', 'bootstrap': False}. Best is trial 15 with value: 0.14911102021150838.
[D 2025-12-02 11:56:16,476] Sample trial#22 with TPESampler.
[I 2025-12-02 11:56:29,786] Trial 22 finished with value: 0.10056617791651046 and parameters: {'n_estimators': 225, 'max_depth': 7, 'min_samples_split': 11, 'min_samples_leaf': 25, 'max_features': None, 'criterion': 'gini', 'bootstrap': False}. Best is trial 15 with value: 0.14911102021150838.
[D 2025-12-02 11:56:29,880] Sample trial#23 with TPESampler.
