[I 2025-12-05 00:29:52,335] A new study created in memory with name: svc_fold_1
[I 2025-12-05 00:30:00,425] Trial 0 finished with value: 0.0568852193359215 and parameters: {'kernel': 'linear', 'C': 87.49666171831073}. Best is trial 0 with value: 0.0568852193359215.
[I 2025-12-05 00:30:14,390] Trial 1 finished with value: 0.05968026948397488 and parameters: {'kernel': 'rbf', 'C': 94.5963741280049}. Best is trial 1 with value: 0.05968026948397488.
[I 2025-12-05 00:30:28,383] Trial 2 finished with value: 0.04875441254971139 and parameters: {'kernel': 'rbf', 'C': 72.65409580049764}. Best is trial 1 with value: 0.05968026948397488.
[I 2025-12-05 00:30:40,076] Trial 3 finished with value: 0.053465246240098754 and parameters: {'kernel': 'poly', 'C': 72.20147212105934}. Best is trial 1 with value: 0.05968026948397488.
[I 2025-12-05 00:30:53,648] Trial 4 finished with value: 0.052058917239251344 and parameters: {'kernel': 'rbf', 'C': 78.21970220455015}. Best is trial 1 with value: 0.05968026948397488.
[I 2025-12-05 00:31:10,229] Trial 5 finished with value: 0.10465344822005836 and parameters: {'kernel': 'sigmoid', 'C': 73.69814056724077}. Best is trial 5 with value: 0.10465344822005836.
[I 2025-12-05 00:31:19,633] Trial 6 finished with value: 0.07140186351504454 and parameters: {'kernel': 'poly', 'C': 76.01519131931433}. Best is trial 5 with value: 0.10465344822005836.
[I 2025-12-05 00:31:31,756] Trial 7 finished with value: 0.053026309000037464 and parameters: {'kernel': 'rbf', 'C': 77.22997648824794}. Best is trial 5 with value: 0.10465344822005836.
[I 2025-12-05 00:31:42,027] Trial 8 finished with value: 0.053962888377781584 and parameters: {'kernel': 'poly', 'C': 90.20610567686965}. Best is trial 5 with value: 0.10465344822005836.
[I 2025-12-05 00:31:56,734] Trial 9 finished with value: 0.05612225121713278 and parameters: {'kernel': 'rbf', 'C': 71.08861170332806}. Best is trial 5 with value: 0.10465344822005836.
[I 2025-12-05 00:32:10,569] Trial 10 finished with value: 0.10488403454773221 and parameters: {'kernel': 'sigmoid', 'C': 82.51895574334463}. Best is trial 10 with value: 0.10488403454773221.
[I 2025-12-05 00:32:26,134] Trial 11 finished with value: 0.10485098082954465 and parameters: {'kernel': 'sigmoid', 'C': 82.92310560221932}. Best is trial 10 with value: 0.10488403454773221.
[I 2025-12-05 00:32:40,294] Trial 12 finished with value: 0.10487312401571466 and parameters: {'kernel': 'sigmoid', 'C': 82.68172006791102}. Best is trial 10 with value: 0.10488403454773221.
[I 2025-12-05 00:32:54,338] Trial 13 finished with value: 0.1048724259887018 and parameters: {'kernel': 'sigmoid', 'C': 82.75604088452393}. Best is trial 10 with value: 0.10488403454773221.
[I 2025-12-05 00:33:08,170] Trial 14 finished with value: 0.10487109182274465 and parameters: {'kernel': 'sigmoid', 'C': 87.33944116581691}. Best is trial 10 with value: 0.10488403454773221.
[I 2025-12-05 00:33:22,310] Trial 15 finished with value: 0.10489744755288202 and parameters: {'kernel': 'sigmoid', 'C': 80.83272043465129}. Best is trial 15 with value: 0.10489744755288202.
[I 2025-12-05 00:33:29,778] Trial 16 finished with value: 0.05685167581840898 and parameters: {'kernel': 'linear', 'C': 79.94015411665929}. Best is trial 15 with value: 0.10489744755288202.
[I 2025-12-05 00:33:43,900] Trial 17 finished with value: 0.10488112585857001 and parameters: {'kernel': 'sigmoid', 'C': 99.25306558931138}. Best is trial 15 with value: 0.10489744755288202.
[I 2025-12-05 00:33:58,692] Trial 18 finished with value: 0.10488766102088061 and parameters: {'kernel': 'sigmoid', 'C': 86.7136612231273}. Best is trial 15 with value: 0.10489744755288202.
[I 2025-12-05 00:34:11,375] Trial 19 finished with value: 0.10491874162335876 and parameters: {'kernel': 'sigmoid', 'C': 88.74817226142581}. Best is trial 19 with value: 0.10491874162335876.
[I 2025-12-05 00:34:18,452] Trial 20 finished with value: 0.05677650397281914 and parameters: {'kernel': 'linear', 'C': 91.55243786167084}. Best is trial 19 with value: 0.10491874162335876.
[I 2025-12-05 00:34:32,100] Trial 21 finished with value: 0.10488435446706039 and parameters: {'kernel': 'sigmoid', 'C': 88.06705372708082}. Best is trial 19 with value: 0.10491874162335876.
[I 2025-12-05 00:34:47,118] Trial 22 finished with value: 0.10487241277637598 and parameters: {'kernel': 'sigmoid', 'C': 85.24542065874648}. Best is trial 19 with value: 0.10491874162335876.
[I 2025-12-05 00:35:01,258] Trial 23 finished with value: 0.1048954944662859 and parameters: {'kernel': 'sigmoid', 'C': 93.97902903378734}. Best is trial 19 with value: 0.10491874162335876.
[I 2025-12-05 00:35:15,840] Trial 24 finished with value: 0.10492533262787432 and parameters: {'kernel': 'sigmoid', 'C': 94.84809529660808}. Best is trial 24 with value: 0.10492533262787432.
[I 2025-12-05 00:35:29,820] Trial 25 finished with value: 0.1048756226203192 and parameters: {'kernel': 'sigmoid', 'C': 97.09279140831349}. Best is trial 24 with value: 0.10492533262787432.
[I 2025-12-05 00:35:42,897] Trial 26 finished with value: 0.10485821966952587 and parameters: {'kernel': 'sigmoid', 'C': 91.49249668610838}. Best is trial 24 with value: 0.10492533262787432.
[I 2025-12-05 00:35:56,612] Trial 27 finished with value: 0.10488106125693522 and parameters: {'kernel': 'sigmoid', 'C': 94.38465379155876}. Best is trial 24 with value: 0.10492533262787432.
[I 2025-12-05 00:36:06,904] Trial 28 finished with value: 0.0683162792384109 and parameters: {'kernel': 'poly', 'C': 79.59011322568102}. Best is trial 24 with value: 0.10492533262787432.
[I 2025-12-05 00:36:14,764] Trial 29 finished with value: 0.05684144049682123 and parameters: {'kernel': 'linear', 'C': 90.58167607097555}. Best is trial 24 with value: 0.10492533262787432.
[I 2025-12-05 00:36:19,773] A new study created in memory with name: svc_fold_2
[I 2025-12-05 00:36:27,784] Trial 0 finished with value: 0.06941064150237676 and parameters: {'kernel': 'linear', 'C': 72.3327343798273}. Best is trial 0 with value: 0.06941064150237676.
[I 2025-12-05 00:36:39,055] Trial 1 finished with value: 0.05439102029250412 and parameters: {'kernel': 'poly', 'C': 75.00125803367759}. Best is trial 0 with value: 0.06941064150237676.
[I 2025-12-05 00:36:50,080] Trial 2 finished with value: 0.05672232930876151 and parameters: {'kernel': 'poly', 'C': 80.47471537758607}. Best is trial 0 with value: 0.06941064150237676.
[I 2025-12-05 00:36:59,243] Trial 3 finished with value: 0.05059000453843192 and parameters: {'kernel': 'poly', 'C': 80.74962667771442}. Best is trial 0 with value: 0.06941064150237676.
[I 2025-12-05 00:37:14,608] Trial 4 finished with value: 0.09480086227753952 and parameters: {'kernel': 'sigmoid', 'C': 96.47073950414348}. Best is trial 4 with value: 0.09480086227753952.
[I 2025-12-05 00:37:22,586] Trial 5 finished with value: 0.06948762288332754 and parameters: {'kernel': 'linear', 'C': 81.1839574293739}. Best is trial 4 with value: 0.09480086227753952.
[I 2025-12-05 00:37:36,143] Trial 6 finished with value: 0.09480694548333146 and parameters: {'kernel': 'sigmoid', 'C': 70.04338575191743}. Best is trial 6 with value: 0.09480694548333146.
[I 2025-12-05 00:37:48,692] Trial 7 finished with value: 0.05828253360179399 and parameters: {'kernel': 'rbf', 'C': 86.49416990040585}. Best is trial 6 with value: 0.09480694548333146.
[I 2025-12-05 00:38:02,589] Trial 8 finished with value: 0.05798213618129636 and parameters: {'kernel': 'rbf', 'C': 94.38380136706196}. Best is trial 6 with value: 0.09480694548333146.
[I 2025-12-05 00:38:15,259] Trial 9 finished with value: 0.05486776550858904 and parameters: {'kernel': 'rbf', 'C': 85.73609804112867}. Best is trial 6 with value: 0.09480694548333146.
[I 2025-12-05 00:38:30,213] Trial 10 finished with value: 0.09482562626097849 and parameters: {'kernel': 'sigmoid', 'C': 70.54191152632164}. Best is trial 10 with value: 0.09482562626097849.
[I 2025-12-05 00:38:44,913] Trial 11 finished with value: 0.09470509391040732 and parameters: {'kernel': 'sigmoid', 'C': 70.61560346702387}. Best is trial 10 with value: 0.09482562626097849.
[I 2025-12-05 00:39:01,003] Trial 12 finished with value: 0.09471484351114312 and parameters: {'kernel': 'sigmoid', 'C': 75.93384055191979}. Best is trial 10 with value: 0.09482562626097849.
[I 2025-12-05 00:39:17,143] Trial 13 finished with value: 0.09480674708675246 and parameters: {'kernel': 'sigmoid', 'C': 70.10729854049673}. Best is trial 10 with value: 0.09482562626097849.
[I 2025-12-05 00:39:33,201] Trial 14 finished with value: 0.09478213603777234 and parameters: {'kernel': 'sigmoid', 'C': 75.56600166769941}. Best is trial 10 with value: 0.09482562626097849.
[I 2025-12-05 00:39:48,904] Trial 15 finished with value: 0.09499217525704318 and parameters: {'kernel': 'sigmoid', 'C': 90.5212046033361}. Best is trial 15 with value: 0.09499217525704318.
[I 2025-12-05 00:40:03,714] Trial 16 finished with value: 0.09481866861025924 and parameters: {'kernel': 'sigmoid', 'C': 89.82026364238158}. Best is trial 15 with value: 0.09499217525704318.
[I 2025-12-05 00:40:19,067] Trial 17 finished with value: 0.09486951311828866 and parameters: {'kernel': 'sigmoid', 'C': 91.48047678703715}. Best is trial 15 with value: 0.09499217525704318.
[I 2025-12-05 00:40:26,677] Trial 18 finished with value: 0.07021188157933587 and parameters: {'kernel': 'linear', 'C': 91.4087383350779}. Best is trial 15 with value: 0.09499217525704318.
[I 2025-12-05 00:40:40,813] Trial 19 finished with value: 0.09488957616432817 and parameters: {'kernel': 'sigmoid', 'C': 98.43317599332872}. Best is trial 15 with value: 0.09499217525704318.
[I 2025-12-05 00:40:54,049] Trial 20 finished with value: 0.09474268058370947 and parameters: {'kernel': 'sigmoid', 'C': 99.93663306435995}. Best is trial 15 with value: 0.09499217525704318.
[I 2025-12-05 00:41:09,857] Trial 21 finished with value: 0.09475105370928438 and parameters: {'kernel': 'sigmoid', 'C': 99.85848280216914}. Best is trial 15 with value: 0.09499217525704318.
[I 2025-12-05 00:41:24,912] Trial 22 finished with value: 0.09490501389670475 and parameters: {'kernel': 'sigmoid', 'C': 90.89752990630505}. Best is trial 15 with value: 0.09499217525704318.
[I 2025-12-05 00:41:37,243] Trial 23 finished with value: 0.09479551797206505 and parameters: {'kernel': 'sigmoid', 'C': 95.4968234836761}. Best is trial 15 with value: 0.09499217525704318.
[I 2025-12-05 00:41:50,254] Trial 24 finished with value: 0.09485480416160808 and parameters: {'kernel': 'sigmoid', 'C': 88.16173765805489}. Best is trial 15 with value: 0.09499217525704318.
[I 2025-12-05 00:42:03,612] Trial 25 finished with value: 0.09486645491996808 and parameters: {'kernel': 'sigmoid', 'C': 93.41940270151542}. Best is trial 15 with value: 0.09499217525704318.
[I 2025-12-05 00:42:11,785] Trial 26 finished with value: 0.05887886880214056 and parameters: {'kernel': 'poly', 'C': 83.44267161320651}. Best is trial 15 with value: 0.09499217525704318.
[I 2025-12-05 00:42:17,707] Trial 27 finished with value: 0.06768447864516555 and parameters: {'kernel': 'linear', 'C': 97.27522506693677}. Best is trial 15 with value: 0.09499217525704318.
[I 2025-12-05 00:42:31,015] Trial 28 finished with value: 0.05852392627636512 and parameters: {'kernel': 'rbf', 'C': 90.82911653550643}. Best is trial 15 with value: 0.09499217525704318.
[I 2025-12-05 00:42:38,229] Trial 29 finished with value: 0.06850796246497005 and parameters: {'kernel': 'linear', 'C': 88.60321456774723}. Best is trial 15 with value: 0.09499217525704318.
[I 2025-12-05 00:42:43,488] A new study created in memory with name: svc_fold_3
[I 2025-12-05 00:42:56,890] Trial 0 finished with value: 0.05155310348332966 and parameters: {'kernel': 'rbf', 'C': 86.96794920246464}. Best is trial 0 with value: 0.05155310348332966.
[I 2025-12-05 00:43:11,463] Trial 1 finished with value: 0.05712588393459946 and parameters: {'kernel': 'rbf', 'C': 94.23361096863482}. Best is trial 1 with value: 0.05712588393459946.
[I 2025-12-05 00:43:20,195] Trial 2 finished with value: 0.061404186595701835 and parameters: {'kernel': 'poly', 'C': 85.61792294564955}. Best is trial 2 with value: 0.061404186595701835.
[I 2025-12-05 00:43:33,351] Trial 3 finished with value: 0.05618717259338126 and parameters: {'kernel': 'rbf', 'C': 90.00323772118354}. Best is trial 2 with value: 0.061404186595701835.
[I 2025-12-05 00:43:40,930] Trial 4 finished with value: 0.0429655352001759 and parameters: {'kernel': 'linear', 'C': 82.83094227143683}. Best is trial 2 with value: 0.061404186595701835.
[I 2025-12-05 00:43:48,491] Trial 5 finished with value: 0.04278084676350166 and parameters: {'kernel': 'linear', 'C': 86.40740986698287}. Best is trial 2 with value: 0.061404186595701835.
[I 2025-12-05 00:43:57,583] Trial 6 finished with value: 0.0567772940417867 and parameters: {'kernel': 'poly', 'C': 81.40048405934843}. Best is trial 2 with value: 0.061404186595701835.
[I 2025-12-05 00:44:12,295] Trial 7 finished with value: 0.09485647291649399 and parameters: {'kernel': 'sigmoid', 'C': 96.54273686017885}. Best is trial 7 with value: 0.09485647291649399.
[I 2025-12-05 00:44:20,425] Trial 8 finished with value: 0.04270199731178613 and parameters: {'kernel': 'linear', 'C': 75.16570125260381}. Best is trial 7 with value: 0.09485647291649399.
[I 2025-12-05 00:44:37,177] Trial 9 finished with value: 0.09480008096745171 and parameters: {'kernel': 'sigmoid', 'C': 95.4713671294155}. Best is trial 7 with value: 0.09485647291649399.
[I 2025-12-05 00:44:53,337] Trial 10 finished with value: 0.09449015861030827 and parameters: {'kernel': 'sigmoid', 'C': 70.30416478205827}. Best is trial 7 with value: 0.09485647291649399.
[I 2025-12-05 00:45:10,730] Trial 11 finished with value: 0.09484873872167957 and parameters: {'kernel': 'sigmoid', 'C': 99.59375219111453}. Best is trial 7 with value: 0.09485647291649399.
[I 2025-12-05 00:45:27,991] Trial 12 finished with value: 0.09492164444730736 and parameters: {'kernel': 'sigmoid', 'C': 99.30168888941458}. Best is trial 12 with value: 0.09492164444730736.
[I 2025-12-05 00:45:44,440] Trial 13 finished with value: 0.0948384752915004 and parameters: {'kernel': 'sigmoid', 'C': 99.97935094926093}. Best is trial 12 with value: 0.09492164444730736.
[I 2025-12-05 00:46:02,724] Trial 14 finished with value: 0.09495844692586622 and parameters: {'kernel': 'sigmoid', 'C': 92.09313830360938}. Best is trial 14 with value: 0.09495844692586622.
[I 2025-12-05 00:46:19,342] Trial 15 finished with value: 0.09494393566125271 and parameters: {'kernel': 'sigmoid', 'C': 92.08574029693253}. Best is trial 14 with value: 0.09495844692586622.
[I 2025-12-05 00:46:34,782] Trial 16 finished with value: 0.09481407102056949 and parameters: {'kernel': 'sigmoid', 'C': 91.85066206634507}. Best is trial 14 with value: 0.09495844692586622.
[I 2025-12-05 00:46:48,178] Trial 17 finished with value: 0.09492697773008166 and parameters: {'kernel': 'sigmoid', 'C': 78.92367615325986}. Best is trial 14 with value: 0.09495844692586622.
[I 2025-12-05 00:46:56,860] Trial 18 finished with value: 0.05813722270377695 and parameters: {'kernel': 'poly', 'C': 90.01400208385895}. Best is trial 14 with value: 0.09495844692586622.
[I 2025-12-05 00:47:09,981] Trial 19 finished with value: 0.09478275455461753 and parameters: {'kernel': 'sigmoid', 'C': 91.70420948478375}. Best is trial 14 with value: 0.09495844692586622.
[I 2025-12-05 00:47:26,262] Trial 20 finished with value: 0.09488587639064101 and parameters: {'kernel': 'sigmoid', 'C': 88.75740273173601}. Best is trial 14 with value: 0.09495844692586622.
[I 2025-12-05 00:47:41,598] Trial 21 finished with value: 0.09492106362985603 and parameters: {'kernel': 'sigmoid', 'C': 79.00528373761703}. Best is trial 14 with value: 0.09495844692586622.
[I 2025-12-05 00:47:55,822] Trial 22 finished with value: 0.09483640668177871 and parameters: {'kernel': 'sigmoid', 'C': 77.88280842205927}. Best is trial 14 with value: 0.09495844692586622.
[I 2025-12-05 00:48:11,867] Trial 23 finished with value: 0.09454518980688657 and parameters: {'kernel': 'sigmoid', 'C': 74.2370349843954}. Best is trial 14 with value: 0.09495844692586622.
[I 2025-12-05 00:48:27,304] Trial 24 finished with value: 0.09461914274419919 and parameters: {'kernel': 'sigmoid', 'C': 80.9299968725099}. Best is trial 14 with value: 0.09495844692586622.
[I 2025-12-05 00:48:44,227] Trial 25 finished with value: 0.09520740197166364 and parameters: {'kernel': 'sigmoid', 'C': 84.94026974279988}. Best is trial 25 with value: 0.09520740197166364.
[I 2025-12-05 00:48:52,655] Trial 26 finished with value: 0.044615483672427715 and parameters: {'kernel': 'linear', 'C': 93.06696877541683}. Best is trial 25 with value: 0.09520740197166364.
[I 2025-12-05 00:49:02,974] Trial 27 finished with value: 0.059948741934180025 and parameters: {'kernel': 'poly', 'C': 84.90941602849543}. Best is trial 25 with value: 0.09520740197166364.
[I 2025-12-05 00:49:18,610] Trial 28 finished with value: 0.06029053114632064 and parameters: {'kernel': 'rbf', 'C': 88.10216974606335}. Best is trial 25 with value: 0.09520740197166364.
[I 2025-12-05 00:49:33,669] Trial 29 finished with value: 0.06496962961762903 and parameters: {'kernel': 'rbf', 'C': 96.73382274549853}. Best is trial 25 with value: 0.09520740197166364.
[I 2025-12-05 00:49:38,895] A new study created in memory with name: svc_fold_4
[I 2025-12-05 00:49:54,441] Trial 0 finished with value: 0.09795615798705375 and parameters: {'kernel': 'sigmoid', 'C': 73.67093939392959}. Best is trial 0 with value: 0.09795615798705375.
[I 2025-12-05 00:50:09,085] Trial 1 finished with value: 0.0978233776005159 and parameters: {'kernel': 'sigmoid', 'C': 91.3761101210663}. Best is trial 0 with value: 0.09795615798705375.
[I 2025-12-05 00:50:16,896] Trial 2 finished with value: 0.05211828870188743 and parameters: {'kernel': 'linear', 'C': 73.49690512078482}. Best is trial 0 with value: 0.09795615798705375.
[I 2025-12-05 00:50:26,711] Trial 3 finished with value: 0.05318607284286918 and parameters: {'kernel': 'poly', 'C': 70.47861643074683}. Best is trial 0 with value: 0.09795615798705375.
[I 2025-12-05 00:50:41,180] Trial 4 finished with value: 0.09792085939765298 and parameters: {'kernel': 'sigmoid', 'C': 76.67667384958071}. Best is trial 0 with value: 0.09795615798705375.
[I 2025-12-05 00:50:56,434] Trial 5 finished with value: 0.061250240578523664 and parameters: {'kernel': 'rbf', 'C': 99.837751241875}. Best is trial 0 with value: 0.09795615798705375.
[I 2025-12-05 00:51:12,193] Trial 6 finished with value: 0.09811715431427218 and parameters: {'kernel': 'sigmoid', 'C': 78.26006295526608}. Best is trial 6 with value: 0.09811715431427218.
[I 2025-12-05 00:51:22,582] Trial 7 finished with value: 0.05758613324741256 and parameters: {'kernel': 'poly', 'C': 77.18502936273637}. Best is trial 6 with value: 0.09811715431427218.
[I 2025-12-05 00:51:32,298] Trial 8 finished with value: 0.05037900813471859 and parameters: {'kernel': 'poly', 'C': 98.84774866229445}. Best is trial 6 with value: 0.09811715431427218.
[I 2025-12-05 00:51:41,910] Trial 9 finished with value: 0.05710406127204173 and parameters: {'kernel': 'poly', 'C': 78.92479566887843}. Best is trial 6 with value: 0.09811715431427218.
[I 2025-12-05 00:51:56,795] Trial 10 finished with value: 0.049578604042045754 and parameters: {'kernel': 'rbf', 'C': 85.06006933798912}. Best is trial 6 with value: 0.09811715431427218.
[I 2025-12-05 00:52:10,856] Trial 11 finished with value: 0.09794660013918674 and parameters: {'kernel': 'sigmoid', 'C': 83.21070964493714}. Best is trial 6 with value: 0.09811715431427218.
[I 2025-12-05 00:52:23,575] Trial 12 finished with value: 0.09796819268761707 and parameters: {'kernel': 'sigmoid', 'C': 70.86319006851618}. Best is trial 6 with value: 0.09811715431427218.
[I 2025-12-05 00:52:38,254] Trial 13 finished with value: 0.0980212020733003 and parameters: {'kernel': 'sigmoid', 'C': 70.16260520356012}. Best is trial 6 with value: 0.09811715431427218.
[I 2025-12-05 00:52:45,302] Trial 14 finished with value: 0.05398926013066052 and parameters: {'kernel': 'linear', 'C': 81.97309040350298}. Best is trial 6 with value: 0.09811715431427218.
[I 2025-12-05 00:53:03,675] Trial 15 finished with value: 0.09796471195525262 and parameters: {'kernel': 'sigmoid', 'C': 88.11667382383945}. Best is trial 6 with value: 0.09811715431427218.
[I 2025-12-05 00:53:20,351] Trial 16 finished with value: 0.09795674874604592 and parameters: {'kernel': 'sigmoid', 'C': 74.18170003886607}. Best is trial 6 with value: 0.09811715431427218.
[I 2025-12-05 00:53:38,342] Trial 17 finished with value: 0.09810072951807335 and parameters: {'kernel': 'sigmoid', 'C': 79.93166662048915}. Best is trial 6 with value: 0.09811715431427218.
[I 2025-12-05 00:53:54,556] Trial 18 finished with value: 0.05250899871694784 and parameters: {'kernel': 'rbf', 'C': 80.37749990546531}. Best is trial 6 with value: 0.09811715431427218.
[I 2025-12-05 00:54:04,027] Trial 19 finished with value: 0.05388644377341541 and parameters: {'kernel': 'linear', 'C': 94.66498455290298}. Best is trial 6 with value: 0.09811715431427218.
[I 2025-12-05 00:54:20,238] Trial 20 finished with value: 0.09801718907336128 and parameters: {'kernel': 'sigmoid', 'C': 86.14403897260294}. Best is trial 6 with value: 0.09811715431427218.
[I 2025-12-05 00:54:35,166] Trial 21 finished with value: 0.09795285097118853 and parameters: {'kernel': 'sigmoid', 'C': 76.09724217299312}. Best is trial 6 with value: 0.09811715431427218.
[I 2025-12-05 00:54:52,257] Trial 22 finished with value: 0.09793635432910877 and parameters: {'kernel': 'sigmoid', 'C': 81.23545375984345}. Best is trial 6 with value: 0.09811715431427218.
[I 2025-12-05 00:55:12,432] Trial 23 finished with value: 0.09812072215255577 and parameters: {'kernel': 'sigmoid', 'C': 78.90713225184926}. Best is trial 23 with value: 0.09812072215255577.
