[I 2025-12-02 11:48:03,124] Trial 6 finished with value: 0.09001383845273625 and parameters: {'max_depth': 13, 'min_samples_split': 17, 'min_samples_leaf': 18, 'criterion': 'gini', 'max_features': 'sqrt', 'splitter': 'random'}. Best is trial 0 with value: 0.09780794135710658.
[D 2025-12-02 11:48:03,197] Sample trial#7 with TPESampler.
[I 2025-12-02 11:48:04,326] Trial 7 finished with value: 0.09128195509250343 and parameters: {'max_depth': 11, 'min_samples_split': 16, 'min_samples_leaf': 16, 'criterion': 'gini', 'max_features': None, 'splitter': 'best'}. Best is trial 0 with value: 0.09780794135710658.
[D 2025-12-02 11:48:04,399] Sample trial#8 with TPESampler.
[I 2025-12-02 11:48:04,551] Trial 8 finished with value: 0.08658885030543452 and parameters: {'max_depth': 12, 'min_samples_split': 17, 'min_samples_leaf': 18, 'criterion': 'gini', 'max_features': 'log2', 'splitter': 'best'}. Best is trial 0 with value: 0.09780794135710658.
[D 2025-12-02 11:48:04,624] Sample trial#9 with TPESampler.
[I 2025-12-02 11:48:04,679] Trial 9 finished with value: 0.0886137241850206 and parameters: {'max_depth': 3, 'min_samples_split': 7, 'min_samples_leaf': 15, 'criterion': 'entropy', 'max_features': None, 'splitter': 'random'}. Best is trial 0 with value: 0.09780794135710658.
[D 2025-12-02 11:48:04,752] Sample trial#10 with TPESampler.
[I 2025-12-02 11:48:04,876] Trial 10 finished with value: 0.10268902942824956 and parameters: {'max_depth': 7, 'min_samples_split': 13, 'min_samples_leaf': 20, 'criterion': 'log_loss', 'max_features': 'log2', 'splitter': 'best'}. Best is trial 10 with value: 0.10268902942824956.
[D 2025-12-02 11:48:04,949] Sample trial#11 with TPESampler.
[I 2025-12-02 11:48:05,027] Trial 11 finished with value: 0.09536375980844015 and parameters: {'max_depth': 3, 'min_samples_split': 16, 'min_samples_leaf': 20, 'criterion': 'log_loss', 'max_features': 'log2', 'splitter': 'best'}. Best is trial 10 with value: 0.10268902942824956.
[D 2025-12-02 11:48:05,100] Sample trial#12 with TPESampler.
[I 2025-12-02 11:48:05,318] Trial 12 finished with value: 0.09114142222526897 and parameters: {'max_depth': 14, 'min_samples_split': 12, 'min_samples_leaf': 20, 'criterion': 'log_loss', 'max_features': 'sqrt', 'splitter': 'best'}. Best is trial 10 with value: 0.10268902942824956.
[D 2025-12-02 11:48:05,390] Sample trial#13 with TPESampler.
[I 2025-12-02 11:48:05,460] Trial 13 finished with value: 0.08416371721236125 and parameters: {'max_depth': 2, 'min_samples_split': 9, 'min_samples_leaf': 19, 'criterion': 'entropy', 'max_features': 'log2', 'splitter': 'best'}. Best is trial 10 with value: 0.10268902942824956.
[D 2025-12-02 11:48:05,534] Sample trial#14 with TPESampler.
[I 2025-12-02 11:48:05,719] Trial 14 finished with value: 0.09612669450961342 and parameters: {'max_depth': 14, 'min_samples_split': 8, 'min_samples_leaf': 18, 'criterion': 'log_loss', 'max_features': 'log2', 'splitter': 'best'}. Best is trial 10 with value: 0.10268902942824956.
[D 2025-12-02 11:48:05,792] Sample trial#15 with TPESampler.
[I 2025-12-02 11:48:05,933] Trial 15 finished with value: 0.09606391428071615 and parameters: {'max_depth': 10, 'min_samples_split': 11, 'min_samples_leaf': 20, 'criterion': 'gini', 'max_features': 'log2', 'splitter': 'best'}. Best is trial 10 with value: 0.10268902942824956.
[D 2025-12-02 11:48:06,006] Sample trial#16 with TPESampler.
[I 2025-12-02 11:48:06,194] Trial 16 finished with value: 0.08645564807347297 and parameters: {'max_depth': 24, 'min_samples_split': 15, 'min_samples_leaf': 20, 'criterion': 'log_loss', 'max_features': 'log2', 'splitter': 'best'}. Best is trial 10 with value: 0.10268902942824956.
[D 2025-12-02 11:48:06,266] Sample trial#17 with TPESampler.
[I 2025-12-02 11:48:06,306] Trial 17 finished with value: 0.06840753177268771 and parameters: {'max_depth': 3, 'min_samples_split': 7, 'min_samples_leaf': 20, 'criterion': 'log_loss', 'max_features': 'log2', 'splitter': 'random'}. Best is trial 10 with value: 0.10268902942824956.
[D 2025-12-02 11:48:06,380] Sample trial#18 with TPESampler.
[I 2025-12-02 11:48:06,993] Trial 18 finished with value: 0.10590064287996256 and parameters: {'max_depth': 4, 'min_samples_split': 9, 'min_samples_leaf': 18, 'criterion': 'log_loss', 'max_features': None, 'splitter': 'best'}. Best is trial 18 with value: 0.10590064287996256.
[D 2025-12-02 11:48:07,066] Sample trial#19 with TPESampler.
[I 2025-12-02 11:48:07,403] Trial 19 finished with value: 0.0877717097017386 and parameters: {'max_depth': 2, 'min_samples_split': 6, 'min_samples_leaf': 16, 'criterion': 'log_loss', 'max_features': None, 'splitter': 'best'}. Best is trial 18 with value: 0.10590064287996256.
[D 2025-12-02 11:48:07,475] Sample trial#20 with TPESampler.
[I 2025-12-02 11:48:08,756] Trial 20 finished with value: 0.09713221524593255 and parameters: {'max_depth': 11, 'min_samples_split': 7, 'min_samples_leaf': 19, 'criterion': 'log_loss', 'max_features': None, 'splitter': 'best'}. Best is trial 18 with value: 0.10590064287996256.
[D 2025-12-02 11:48:08,827] Sample trial#21 with TPESampler.
[I 2025-12-02 11:48:09,884] Trial 21 finished with value: 0.10307917070486812 and parameters: {'max_depth': 8, 'min_samples_split': 15, 'min_samples_leaf': 19, 'criterion': 'entropy', 'max_features': None, 'splitter': 'best'}. Best is trial 18 with value: 0.10590064287996256.
[D 2025-12-02 11:48:09,957] Sample trial#22 with TPESampler.
[I 2025-12-02 11:48:11,299] Trial 22 finished with value: 0.09772036821420085 and parameters: {'max_depth': 12, 'min_samples_split': 19, 'min_samples_leaf': 19, 'criterion': 'entropy', 'max_features': None, 'splitter': 'best'}. Best is trial 18 with value: 0.10590064287996256.
[D 2025-12-02 11:48:11,373] Sample trial#23 with TPESampler.
[I 2025-12-02 11:48:12,593] Trial 23 finished with value: 0.09782215021736604 and parameters: {'max_depth': 10, 'min_samples_split': 13, 'min_samples_leaf': 18, 'criterion': 'entropy', 'max_features': None, 'splitter': 'best'}. Best is trial 18 with value: 0.10590064287996256.
[D 2025-12-02 11:48:12,668] Sample trial#24 with TPESampler.
[I 2025-12-02 11:48:12,751] Trial 24 finished with value: 0.09899194971368862 and parameters: {'max_depth': 8, 'min_samples_split': 15, 'min_samples_leaf': 19, 'criterion': 'log_loss', 'max_features': None, 'splitter': 'random'}. Best is trial 18 with value: 0.10590064287996256.
[D 2025-12-02 11:48:12,826] Sample trial#25 with TPESampler.
[I 2025-12-02 11:48:13,012] Trial 25 finished with value: 0.11838828137251242 and parameters: {'max_depth': 9, 'min_samples_split': 15, 'min_samples_leaf': 19, 'criterion': 'entropy', 'max_features': 'sqrt', 'splitter': 'best'}. Best is trial 25 with value: 0.11838828137251242.
[D 2025-12-02 11:48:13,085] Sample trial#26 with TPESampler.
[I 2025-12-02 11:48:13,124] Trial 26 finished with value: 0.06245916293908468 and parameters: {'max_depth': 2, 'min_samples_split': 19, 'min_samples_leaf': 18, 'criterion': 'entropy', 'max_features': 'sqrt', 'splitter': 'random'}. Best is trial 25 with value: 0.11838828137251242.
[D 2025-12-02 11:48:13,197] Sample trial#27 with TPESampler.
[I 2025-12-02 11:48:13,341] Trial 27 finished with value: 0.09637892135373596 and parameters: {'max_depth': 6, 'min_samples_split': 15, 'min_samples_leaf': 20, 'criterion': 'entropy', 'max_features': 'sqrt', 'splitter': 'best'}. Best is trial 25 with value: 0.11838828137251242.
[D 2025-12-02 11:48:13,416] Sample trial#28 with TPESampler.
[I 2025-12-02 11:48:14,852] Trial 28 finished with value: 0.0911589239024413 and parameters: {'max_depth': 14, 'min_samples_split': 11, 'min_samples_leaf': 16, 'criterion': 'log_loss', 'max_features': None, 'splitter': 'best'}. Best is trial 25 with value: 0.11838828137251242.
[D 2025-12-02 11:48:14,926] Sample trial#29 with TPESampler.
[I 2025-12-02 11:48:15,783] Trial 29 finished with value: 0.10596259617785109 and parameters: {'max_depth': 7, 'min_samples_split': 12, 'min_samples_leaf': 19, 'criterion': 'gini', 'max_features': None, 'splitter': 'best'}. Best is trial 25 with value: 0.11838828137251242.
[I 2025-12-02 11:48:16,349] A new study created in memory with name: decision_tree_fold_2
[D 2025-12-02 11:48:16,350] Sample trial#0 with RandomSampler.
[I 2025-12-02 11:48:16,570] Trial 0 finished with value: 0.07783402141340859 and parameters: {'max_depth': 19, 'min_samples_split': 15, 'min_samples_leaf': 15, 'criterion': 'log_loss', 'max_features': 'sqrt', 'splitter': 'best'}. Best is trial 0 with value: 0.07783402141340859.
[D 2025-12-02 11:48:16,646] Sample trial#1 with TPESampler.
[I 2025-12-02 11:48:16,766] Trial 1 finished with value: 0.09198535687341233 and parameters: {'max_depth': 25, 'min_samples_split': 9, 'min_samples_leaf': 15, 'criterion': 'entropy', 'max_features': None, 'splitter': 'random'}. Best is trial 1 with value: 0.09198535687341233.
[D 2025-12-02 11:48:16,841] Sample trial#2 with TPESampler.
[I 2025-12-02 11:48:18,079] Trial 2 finished with value: 0.08151547972753329 and parameters: {'max_depth': 27, 'min_samples_split': 8, 'min_samples_leaf': 16, 'criterion': 'gini', 'max_features': None, 'splitter': 'best'}. Best is trial 1 with value: 0.09198535687341233.
[D 2025-12-02 11:48:18,156] Sample trial#3 with TPESampler.
[I 2025-12-02 11:48:18,254] Trial 3 finished with value: 0.08938390197464244 and parameters: {'max_depth': 5, 'min_samples_split': 13, 'min_samples_leaf': 15, 'criterion': 'entropy', 'max_features': 'log2', 'splitter': 'best'}. Best is trial 1 with value: 0.09198535687341233.
[D 2025-12-02 11:48:18,330] Sample trial#4 with TPESampler.
[I 2025-12-02 11:48:18,380] Trial 4 finished with value: 0.08149487437556685 and parameters: {'max_depth': 21, 'min_samples_split': 5, 'min_samples_leaf': 20, 'criterion': 'entropy', 'max_features': 'sqrt', 'splitter': 'random'}. Best is trial 1 with value: 0.09198535687341233.
[D 2025-12-02 11:48:18,455] Sample trial#5 with TPESampler.
[I 2025-12-02 11:48:18,500] Trial 5 finished with value: 0.09635642140111952 and parameters: {'max_depth': 8, 'min_samples_split': 19, 'min_samples_leaf': 16, 'criterion': 'log_loss', 'max_features': 'sqrt', 'splitter': 'random'}. Best is trial 5 with value: 0.09635642140111952.
[D 2025-12-02 11:48:18,575] Sample trial#6 with TPESampler.
[I 2025-12-02 11:48:18,677] Trial 6 finished with value: 0.08537930994482879 and parameters: {'max_depth': 13, 'min_samples_split': 20, 'min_samples_leaf': 18, 'criterion': 'log_loss', 'max_features': None, 'splitter': 'random'}. Best is trial 5 with value: 0.09635642140111952.
[D 2025-12-02 11:48:18,755] Sample trial#7 with TPESampler.
[I 2025-12-02 11:48:18,869] Trial 7 finished with value: 0.09532472373481807 and parameters: {'max_depth': 6, 'min_samples_split': 9, 'min_samples_leaf': 19, 'criterion': 'entropy', 'max_features': 'log2', 'splitter': 'best'}. Best is trial 5 with value: 0.09635642140111952.
[D 2025-12-02 11:48:18,944] Sample trial#8 with TPESampler.
[I 2025-12-02 11:48:19,062] Trial 8 finished with value: 0.09319629200911975 and parameters: {'max_depth': 6, 'min_samples_split': 10, 'min_samples_leaf': 19, 'criterion': 'log_loss', 'max_features': 'log2', 'splitter': 'best'}. Best is trial 5 with value: 0.09635642140111952.
[D 2025-12-02 11:48:19,138] Sample trial#9 with TPESampler.
[I 2025-12-02 11:48:19,180] Trial 9 finished with value: 0.08870751210546132 and parameters: {'max_depth': 8, 'min_samples_split': 12, 'min_samples_leaf': 18, 'criterion': 'entropy', 'max_features': 'log2', 'splitter': 'random'}. Best is trial 5 with value: 0.09635642140111952.
[D 2025-12-02 11:48:19,256] Sample trial#10 with TPESampler.
[I 2025-12-02 11:48:19,297] Trial 10 finished with value: 0.06670827594106273 and parameters: {'max_depth': 3, 'min_samples_split': 17, 'min_samples_leaf': 16, 'criterion': 'entropy', 'max_features': 'sqrt', 'splitter': 'random'}. Best is trial 5 with value: 0.09635642140111952.
[D 2025-12-02 11:48:19,373] Sample trial#11 with TPESampler.
[I 2025-12-02 11:48:19,421] Trial 11 finished with value: 0.09026446435414877 and parameters: {'max_depth': 10, 'min_samples_split': 18, 'min_samples_leaf': 15, 'criterion': 'log_loss', 'max_features': 'sqrt', 'splitter': 'random'}. Best is trial 5 with value: 0.09635642140111952.
[D 2025-12-02 11:48:19,497] Sample trial#12 with TPESampler.
[I 2025-12-02 11:48:19,716] Trial 12 finished with value: 0.0894073285623492 and parameters: {'max_depth': 15, 'min_samples_split': 14, 'min_samples_leaf': 20, 'criterion': 'entropy', 'max_features': 'sqrt', 'splitter': 'best'}. Best is trial 5 with value: 0.09635642140111952.
[D 2025-12-02 11:48:19,792] Sample trial#13 with TPESampler.
[I 2025-12-02 11:48:19,871] Trial 13 finished with value: 0.08289036724175539 and parameters: {'max_depth': 2, 'min_samples_split': 6, 'min_samples_leaf': 19, 'criterion': 'entropy', 'max_features': 'log2', 'splitter': 'best'}. Best is trial 5 with value: 0.09635642140111952.
[D 2025-12-02 11:48:19,950] Sample trial#14 with TPESampler.
[I 2025-12-02 11:48:20,132] Trial 14 finished with value: 0.0747021739547448 and parameters: {'max_depth': 19, 'min_samples_split': 6, 'min_samples_leaf': 18, 'criterion': 'entropy', 'max_features': 'log2', 'splitter': 'best'}. Best is trial 5 with value: 0.09635642140111952.
[D 2025-12-02 11:48:20,207] Sample trial#15 with TPESampler.
[I 2025-12-02 11:48:20,254] Trial 15 finished with value: 0.08977854025566388 and parameters: {'max_depth': 12, 'min_samples_split': 14, 'min_samples_leaf': 18, 'criterion': 'gini', 'max_features': 'sqrt', 'splitter': 'random'}. Best is trial 5 with value: 0.09635642140111952.
[D 2025-12-02 11:48:20,328] Sample trial#16 with TPESampler.
[I 2025-12-02 11:48:20,367] Trial 16 finished with value: 0.060609101741333916 and parameters: {'max_depth': 2, 'min_samples_split': 17, 'min_samples_leaf': 16, 'criterion': 'log_loss', 'max_features': 'log2', 'splitter': 'random'}. Best is trial 5 with value: 0.09635642140111952.
[D 2025-12-02 11:48:20,442] Sample trial#17 with TPESampler.
[I 2025-12-02 11:48:20,544] Trial 17 finished with value: 0.10112582996500344 and parameters: {'max_depth': 5, 'min_samples_split': 18, 'min_samples_leaf': 19, 'criterion': 'gini', 'max_features': 'log2', 'splitter': 'best'}. Best is trial 17 with value: 0.10112582996500344.
[D 2025-12-02 11:48:20,618] Sample trial#18 with TPESampler.
[I 2025-12-02 11:48:20,742] Trial 18 finished with value: 0.10026259692815824 and parameters: {'max_depth': 8, 'min_samples_split': 19, 'min_samples_leaf': 17, 'criterion': 'gini', 'max_features': 'log2', 'splitter': 'best'}. Best is trial 17 with value: 0.10112582996500344.
[D 2025-12-02 11:48:20,816] Sample trial#19 with TPESampler.
[I 2025-12-02 11:48:20,924] Trial 19 finished with value: 0.09967616314645006 and parameters: {'max_depth': 6, 'min_samples_split': 20, 'min_samples_leaf': 18, 'criterion': 'gini', 'max_features': 'log2', 'splitter': 'best'}. Best is trial 17 with value: 0.10112582996500344.
[D 2025-12-02 11:48:21,000] Sample trial#20 with TPESampler.
[I 2025-12-02 11:48:21,684] Trial 20 finished with value: 0.1042477439424021 and parameters: {'max_depth': 5, 'min_samples_split': 16, 'min_samples_leaf': 20, 'criterion': 'gini', 'max_features': None, 'splitter': 'best'}. Best is trial 20 with value: 0.1042477439424021.
[D 2025-12-02 11:48:21,759] Sample trial#21 with TPESampler.
[I 2025-12-02 11:48:22,524] Trial 21 finished with value: 0.10174902345637697 and parameters: {'max_depth': 6, 'min_samples_split': 12, 'min_samples_leaf': 20, 'criterion': 'gini', 'max_features': None, 'splitter': 'best'}. Best is trial 20 with value: 0.1042477439424021.
[D 2025-12-02 11:48:22,600] Sample trial#22 with TPESampler.
[I 2025-12-02 11:48:22,906] Trial 22 finished with value: 0.08747243687624438 and parameters: {'max_depth': 2, 'min_samples_split': 14, 'min_samples_leaf': 20, 'criterion': 'gini', 'max_features': None, 'splitter': 'best'}. Best is trial 20 with value: 0.1042477439424021.
[D 2025-12-02 11:48:22,983] Sample trial#23 with TPESampler.
[I 2025-12-02 11:48:24,182] Trial 23 finished with value: 0.08409839126794655 and parameters: {'max_depth': 15, 'min_samples_split': 13, 'min_samples_leaf': 19, 'criterion': 'gini', 'max_features': None, 'splitter': 'best'}. Best is trial 20 with value: 0.1042477439424021.
[D 2025-12-02 11:48:24,259] Sample trial#24 with TPESampler.
[I 2025-12-02 11:48:24,305] Trial 24 finished with value: 0.08616453781343617 and parameters: {'max_depth': 12, 'min_samples_split': 20, 'min_samples_leaf': 20, 'criterion': 'gini', 'max_features': 'log2', 'splitter': 'random'}. Best is trial 20 with value: 0.1042477439424021.
[D 2025-12-02 11:48:24,381] Sample trial#25 with TPESampler.
[I 2025-12-02 11:48:24,448] Trial 25 finished with value: 0.07524722347904804 and parameters: {'max_depth': 2, 'min_samples_split': 18, 'min_samples_leaf': 20, 'criterion': 'entropy', 'max_features': 'log2', 'splitter': 'best'}. Best is trial 20 with value: 0.1042477439424021.
[D 2025-12-02 11:48:24,523] Sample trial#26 with TPESampler.
[I 2025-12-02 11:48:24,622] Trial 26 finished with value: 0.09303518192443651 and parameters: {'max_depth': 12, 'min_samples_split': 9, 'min_samples_leaf': 20, 'criterion': 'gini', 'max_features': None, 'splitter': 'random'}. Best is trial 20 with value: 0.1042477439424021.
[D 2025-12-02 11:48:24,698] Sample trial#27 with TPESampler.
[I 2025-12-02 11:48:25,317] Trial 27 finished with value: 0.09949764537746213 and parameters: {'max_depth': 4, 'min_samples_split': 18, 'min_samples_leaf': 19, 'criterion': 'log_loss', 'max_features': None, 'splitter': 'best'}. Best is trial 20 with value: 0.1042477439424021.
[D 2025-12-02 11:48:25,394] Sample trial#28 with TPESampler.
[I 2025-12-02 11:48:25,482] Trial 28 finished with value: 0.09175228190582162 and parameters: {'max_depth': 3, 'min_samples_split': 20, 'min_samples_leaf': 20, 'criterion': 'gini', 'max_features': 'sqrt', 'splitter': 'best'}. Best is trial 20 with value: 0.1042477439424021.
[D 2025-12-02 11:48:25,558] Sample trial#29 with TPESampler.
[I 2025-12-02 11:48:26,499] Trial 29 finished with value: 0.09747709150942743 and parameters: {'max_depth': 8, 'min_samples_split': 7, 'min_samples_leaf': 20, 'criterion': 'gini', 'max_features': None, 'splitter': 'best'}. Best is trial 20 with value: 0.1042477439424021.
[I 2025-12-02 11:48:27,206] A new study created in memory with name: decision_tree_fold_3
[D 2025-12-02 11:48:27,206] Sample trial#0 with RandomSampler.
[I 2025-12-02 11:48:27,257] Trial 0 finished with value: 0.07548853011874246 and parameters: {'max_depth': 23, 'min_samples_split': 18, 'min_samples_leaf': 19, 'criterion': 'entropy', 'max_features': 'log2', 'splitter': 'random'}. Best is trial 0 with value: 0.07548853011874246.
[D 2025-12-02 11:48:27,334] Sample trial#1 with TPESampler.
[I 2025-12-02 11:48:27,513] Trial 1 finished with value: 0.08958610674343181 and parameters: {'max_depth': 15, 'min_samples_split': 15, 'min_samples_leaf': 20, 'criterion': 'entropy', 'max_features': 'log2', 'splitter': 'best'}. Best is trial 1 with value: 0.08958610674343181.
[D 2025-12-02 11:48:27,590] Sample trial#2 with TPESampler.
[I 2025-12-02 11:48:27,657] Trial 2 finished with value: 0.10395250590125116 and parameters: {'max_depth': 5, 'min_samples_split': 8, 'min_samples_leaf': 16, 'criterion': 'log_loss', 'max_features': None, 'splitter': 'random'}. Best is trial 2 with value: 0.10395250590125116.
[D 2025-12-02 11:48:27,734] Sample trial#3 with TPESampler.
[I 2025-12-02 11:48:27,977] Trial 3 finished with value: 0.07920960420838448 and parameters: {'max_depth': 30, 'min_samples_split': 15, 'min_samples_leaf': 18, 'criterion': 'entropy', 'max_features': 'sqrt', 'splitter': 'best'}. Best is trial 2 with value: 0.10395250590125116.
[D 2025-12-02 11:48:28,053] Sample trial#4 with TPESampler.
[I 2025-12-02 11:48:28,103] Trial 4 finished with value: 0.09249586276078445 and parameters: {'max_depth': 21, 'min_samples_split': 14, 'min_samples_leaf': 16, 'criterion': 'entropy', 'max_features': 'sqrt', 'splitter': 'random'}. Best is trial 2 with value: 0.10395250590125116.
[D 2025-12-02 11:48:28,179] Sample trial#5 with TPESampler.
[I 2025-12-02 11:48:28,285] Trial 5 finished with value: 0.08641972317364416 and parameters: {'max_depth': 5, 'min_samples_split': 7, 'min_samples_leaf': 19, 'criterion': 'entropy', 'max_features': 'log2', 'splitter': 'best'}. Best is trial 2 with value: 0.10395250590125116.
[D 2025-12-02 11:48:28,363] Sample trial#6 with TPESampler.
[I 2025-12-02 11:48:28,412] Trial 6 finished with value: 0.08440571466723383 and parameters: {'max_depth': 15, 'min_samples_split': 14, 'min_samples_leaf': 16, 'criterion': 'entropy', 'max_features': 'sqrt', 'splitter': 'random'}. Best is trial 2 with value: 0.10395250590125116.
[D 2025-12-02 11:48:28,491] Sample trial#7 with TPESampler.
[I 2025-12-02 11:48:28,531] Trial 7 finished with value: 0.06696054869653315 and parameters: {'max_depth': 4, 'min_samples_split': 20, 'min_samples_leaf': 19, 'criterion': 'gini', 'max_features': 'log2', 'splitter': 'random'}. Best is trial 2 with value: 0.10395250590125116.
[D 2025-12-02 11:48:28,610] Sample trial#8 with TPESampler.
[I 2025-12-02 11:48:29,982] Trial 8 finished with value: 0.07990538173523211 and parameters: {'max_depth': 30, 'min_samples_split': 9, 'min_samples_leaf': 16, 'criterion': 'gini', 'max_features': None, 'splitter': 'best'}. Best is trial 2 with value: 0.10395250590125116.
[D 2025-12-02 11:48:30,059] Sample trial#9 with TPESampler.
[I 2025-12-02 11:48:30,109] Trial 9 finished with value: 0.0777643761718509 and parameters: {'max_depth': 20, 'min_samples_split': 16, 'min_samples_leaf': 17, 'criterion': 'log_loss', 'max_features': 'sqrt', 'splitter': 'random'}. Best is trial 2 with value: 0.10395250590125116.
[D 2025-12-02 11:48:30,188] Sample trial#10 with TPESampler.
