[I 2025-12-05 00:55:26,589] Trial 24 finished with value: 0.09809194450337792 and parameters: {'kernel': 'sigmoid', 'C': 79.47586077605533}. Best is trial 23 with value: 0.09812072215255577.
[I 2025-12-05 00:55:39,317] Trial 25 finished with value: 0.09809622853787844 and parameters: {'kernel': 'sigmoid', 'C': 78.1903190206761}. Best is trial 23 with value: 0.09812072215255577.
[I 2025-12-05 00:55:55,708] Trial 26 finished with value: 0.09795069983510377 and parameters: {'kernel': 'sigmoid', 'C': 75.20517154747158}. Best is trial 23 with value: 0.09812072215255577.
[I 2025-12-05 00:56:04,611] Trial 27 finished with value: 0.05403266110349978 and parameters: {'kernel': 'linear', 'C': 83.88108330940103}. Best is trial 23 with value: 0.09812072215255577.
[I 2025-12-05 00:56:20,381] Trial 28 finished with value: 0.05592572526190831 and parameters: {'kernel': 'rbf', 'C': 87.79353850208646}. Best is trial 23 with value: 0.09812072215255577.
[I 2025-12-05 00:56:36,902] Trial 29 finished with value: 0.09794928042476639 and parameters: {'kernel': 'sigmoid', 'C': 72.99511897630798}. Best is trial 23 with value: 0.09812072215255577.
[I 2025-12-05 00:56:43,385] A new study created in memory with name: svc_fold_5
[I 2025-12-05 00:56:53,037] Trial 0 finished with value: 0.05871987504244898 and parameters: {'kernel': 'poly', 'C': 72.07837368100088}. Best is trial 0 with value: 0.05871987504244898.
[I 2025-12-05 00:57:01,366] Trial 1 finished with value: 0.05542086416043951 and parameters: {'kernel': 'linear', 'C': 70.24922572130096}. Best is trial 0 with value: 0.05871987504244898.
[I 2025-12-05 00:57:13,282] Trial 2 finished with value: 0.05335254193911828 and parameters: {'kernel': 'poly', 'C': 97.27862608650645}. Best is trial 0 with value: 0.05871987504244898.
[I 2025-12-05 00:57:28,717] Trial 3 finished with value: 0.05814393757746148 and parameters: {'kernel': 'rbf', 'C': 73.38331565145774}. Best is trial 0 with value: 0.05871987504244898.
[I 2025-12-05 00:57:45,291] Trial 4 finished with value: 0.08446522832609167 and parameters: {'kernel': 'sigmoid', 'C': 74.41584904497037}. Best is trial 4 with value: 0.08446522832609167.
[I 2025-12-05 00:58:01,639] Trial 5 finished with value: 0.08436720238020076 and parameters: {'kernel': 'sigmoid', 'C': 89.8641840226685}. Best is trial 4 with value: 0.08446522832609167.
[I 2025-12-05 00:58:15,128] Trial 6 finished with value: 0.053466095814174205 and parameters: {'kernel': 'rbf', 'C': 94.9118490663048}. Best is trial 4 with value: 0.08446522832609167.
[I 2025-12-05 00:58:21,521] Trial 7 finished with value: 0.05562253236812986 and parameters: {'kernel': 'linear', 'C': 98.85117346780964}. Best is trial 4 with value: 0.08446522832609167.
[I 2025-12-05 00:58:29,961] Trial 8 finished with value: 0.060129945378934256 and parameters: {'kernel': 'poly', 'C': 74.3299111896629}. Best is trial 4 with value: 0.08446522832609167.
[I 2025-12-05 00:58:42,788] Trial 9 finished with value: 0.055722608054033285 and parameters: {'kernel': 'rbf', 'C': 79.17547067183817}. Best is trial 4 with value: 0.08446522832609167.
[I 2025-12-05 00:58:57,805] Trial 10 finished with value: 0.08455960113092373 and parameters: {'kernel': 'sigmoid', 'C': 82.04025868880636}. Best is trial 10 with value: 0.08455960113092373.
[I 2025-12-05 00:59:14,089] Trial 11 finished with value: 0.08460908771598122 and parameters: {'kernel': 'sigmoid', 'C': 83.06523072726961}. Best is trial 11 with value: 0.08460908771598122.
[I 2025-12-05 00:59:29,947] Trial 12 finished with value: 0.08452804837511507 and parameters: {'kernel': 'sigmoid', 'C': 84.6298313511804}. Best is trial 11 with value: 0.08460908771598122.
[I 2025-12-05 00:59:46,229] Trial 13 finished with value: 0.0844670128047819 and parameters: {'kernel': 'sigmoid', 'C': 81.89217921188596}. Best is trial 11 with value: 0.08460908771598122.
[I 2025-12-05 01:00:01,211] Trial 14 finished with value: 0.0845074796306555 and parameters: {'kernel': 'sigmoid', 'C': 86.82466119865755}. Best is trial 11 with value: 0.08460908771598122.
[I 2025-12-05 01:00:17,150] Trial 15 finished with value: 0.08445378477582673 and parameters: {'kernel': 'sigmoid', 'C': 78.81705960693127}. Best is trial 11 with value: 0.08460908771598122.
[I 2025-12-05 01:00:33,308] Trial 16 finished with value: 0.08437471034252933 and parameters: {'kernel': 'sigmoid', 'C': 88.5222607342985}. Best is trial 11 with value: 0.08460908771598122.
[I 2025-12-05 01:00:48,150] Trial 17 finished with value: 0.08454112269856318 and parameters: {'kernel': 'sigmoid', 'C': 80.64949711534298}. Best is trial 11 with value: 0.08460908771598122.
[I 2025-12-05 01:00:55,068] Trial 18 finished with value: 0.055664647333719786 and parameters: {'kernel': 'linear', 'C': 93.09197754480851}. Best is trial 11 with value: 0.08460908771598122.
[I 2025-12-05 01:01:09,360] Trial 19 finished with value: 0.08451987062708036 and parameters: {'kernel': 'sigmoid', 'C': 77.71211995083127}. Best is trial 11 with value: 0.08460908771598122.
[I 2025-12-05 01:01:25,976] Trial 20 finished with value: 0.08450174875940353 and parameters: {'kernel': 'sigmoid', 'C': 84.27257583778834}. Best is trial 11 with value: 0.08460908771598122.
[I 2025-12-05 01:01:41,725] Trial 21 finished with value: 0.0845344799404325 and parameters: {'kernel': 'sigmoid', 'C': 81.63002037365752}. Best is trial 11 with value: 0.08460908771598122.
[I 2025-12-05 01:01:57,331] Trial 22 finished with value: 0.08447020297527552 and parameters: {'kernel': 'sigmoid', 'C': 76.6090542884844}. Best is trial 11 with value: 0.08460908771598122.
[I 2025-12-05 01:02:13,525] Trial 23 finished with value: 0.08455078131131555 and parameters: {'kernel': 'sigmoid', 'C': 81.20604837953564}. Best is trial 11 with value: 0.08460908771598122.
[I 2025-12-05 01:02:31,700] Trial 24 finished with value: 0.08450926594059291 and parameters: {'kernel': 'sigmoid', 'C': 85.37286889627187}. Best is trial 11 with value: 0.08460908771598122.
[I 2025-12-05 01:02:46,375] Trial 25 finished with value: 0.08452722467970716 and parameters: {'kernel': 'sigmoid', 'C': 82.45184907618619}. Best is trial 11 with value: 0.08460908771598122.
[I 2025-12-05 01:02:54,366] Trial 26 finished with value: 0.0543901854283947 and parameters: {'kernel': 'linear', 'C': 88.56025333937491}. Best is trial 11 with value: 0.08460908771598122.
[I 2025-12-05 01:03:05,944] Trial 27 finished with value: 0.057925592236502066 and parameters: {'kernel': 'poly', 'C': 76.18578793260545}. Best is trial 11 with value: 0.08460908771598122.
[I 2025-12-05 01:03:19,853] Trial 28 finished with value: 0.08448848227510333 and parameters: {'kernel': 'sigmoid', 'C': 80.30172764504773}. Best is trial 11 with value: 0.08460908771598122.
[I 2025-12-05 01:03:35,504] Trial 29 finished with value: 0.06096333368164094 and parameters: {'kernel': 'rbf', 'C': 91.89769817672226}. Best is trial 11 with value: 0.08460908771598122.
CLASSIFICAÇÃO DE GENES-ALVO USANDO DADOS ÔMICOS
================================================================================
Timestamp do experimento: 20251205_002952
 Usando dados da ANA:
   Features: data/UNION_features.tsv
   Labels: data/processed/UNION_labels.tsv
   Formato labels: genes, 2class (binary), 3class (multiclass)

Arquivos encontrados com sucesso!
Carregando e preparando dados...
============================================================
PREPARANDO DATASET PARA CLASSIFICAÇÃO (BINARY)
============================================================
Carregando UNION_features.tsv
Features carregadas: 19602 genes x 64 features
Tipos de dados das features: {dtype('float64'): 64}
Range das features: [0.0000, 1.0000]
----------------------------------------
Carregando UNION_labels.tsv (classificação: binary)
Labels carregados: 19680 genes
Valores únicos em 2class: label
0.0    16727
NaN     1997
1.0      956
Name: count, dtype: int64
Genes with NaN dropped: 1997
Distribuição das classes:
  Classe 0 (passenger): 16727 genes
  Classe 1 (cancer): 956 genes
  Razão cancer/passenger: 0.0572
----------------------------------------
Alinhando features e labels
Genes comuns entre features e labels: 17676
Dataset final: 17676 genes x 64 features
Distribuição final das classes: [16727   949]
----------------------------------------
DATASET PREPARADO COM SUCESSO!
Shape final: X=(17676, 64), y=(17676,)
Genes: 17676
Features: 64
============================================================

CONFIGURAÇÃO DO EXPERIMENTO (OTIMIZAÇÃO):
  Modelo: Support Vector Classifier
  Trials: 30
  Tipo: binary
  Parâmetros: Reduzido
  Balanceamento: none
================================================================================
EXECUTANDO MODELO: Support Vector Classifier
================================================================================

Starting Nested Cross-Validation for svc...
Configuration: 5 outer folds, 30 trials per fold
Performing 80/20 holdout split...
Holdout split completed:
  - Training set: 14140 samples (80%)
  - Holdout test set: 3536 samples (20%)
Fold 1
Importâncias dos parâmetros para fold 1: {'kernel': np.float64(0.9933735626180717), 'C': np.float64(0.006626437381928185)}
Saved Optuna plots to results/20251205_002952_ana_optimized_binary_less/svc/optuna_plots
Fold 2
Importâncias dos parâmetros para fold 2: {'kernel': np.float64(0.9979941796464923), 'C': np.float64(0.002005820353507665)}
Saved Optuna plots to results/20251205_002952_ana_optimized_binary_less/svc/optuna_plots
Fold 3
Importâncias dos parâmetros para fold 3: {'kernel': np.float64(0.9964970302409536), 'C': np.float64(0.003502969759046402)}
Saved Optuna plots to results/20251205_002952_ana_optimized_binary_less/svc/optuna_plots
Fold 4
Importâncias dos parâmetros para fold 4: {'kernel': np.float64(0.9976692762917062), 'C': np.float64(0.0023307237082937334)}
Saved Optuna plots to results/20251205_002952_ana_optimized_binary_less/svc/optuna_plots
Fold 5
Importâncias dos parâmetros para fold 5: {'kernel': np.float64(0.9959701360619497), 'C': np.float64(0.004029863938050226)}
Saved Optuna plots to results/20251205_002952_ana_optimized_binary_less/svc/optuna_plots

Nested CV completed. The 20% holdout set (3536 samples) remains untouched.
This holdout set can be used for final unbiased evaluation.

Training and evaluating 5 best parameter sets on holdout data...
Testing with 4 balancing strategies: none, randomundersampler, smoteenn, tomeklinks

Evaluating fold 1 best params on holdout set...
  - Testing with balance strategy: none
  - Testing with balance strategy: randomundersampler
  - Testing with balance strategy: smoteenn
  - Testing with balance strategy: tomeklinks

Evaluating fold 2 best params on holdout set...
  - Testing with balance strategy: none
  - Testing with balance strategy: randomundersampler
  - Testing with balance strategy: smoteenn
  - Testing with balance strategy: tomeklinks

Evaluating fold 3 best params on holdout set...
  - Testing with balance strategy: none
  - Testing with balance strategy: randomundersampler
  - Testing with balance strategy: smoteenn
  - Testing with balance strategy: tomeklinks

Evaluating fold 4 best params on holdout set...
  - Testing with balance strategy: none
  - Testing with balance strategy: randomundersampler
  - Testing with balance strategy: smoteenn
  - Testing with balance strategy: tomeklinks

Evaluating fold 5 best params on holdout set...
  - Testing with balance strategy: none
  - Testing with balance strategy: randomundersampler
  - Testing with balance strategy: smoteenn
  - Testing with balance strategy: tomeklinks
Saving optimization and holdout results...
Detailed results by fold saved to: ./results/20251205_002952_ana_optimized_binary_less/svc/detailed_results_by_fold.txt
Test predictions for all folds saved to: ./results/20251205_002952_ana_optimized_binary_less/svc/metrics.json
Saving holdout results...
Holdout evaluation results saved to: ./results/20251205_002952_ana_optimized_binary_less/svc/holdout_results.txt
Saved!
[OK] Support Vector Classifier executado com sucesso!

EXPERIMENTO CONCLUÍDO!
