[I 2025-12-02 15:46:24,157] Trial 11 finished with value: 0.09999112957041889 and parameters: {'n_layers': 1, 'layer_0_size': 200, 'activation': 'tanh', 'alpha': 0.000519090450908895, 'learning_rate': 'adaptive', 'solver': 'sgd', 'learning_rate_init': 0.024619024661711092, 'max_iter': 867}. Best is trial 0 with value: 0.12200317933001711.
[D 2025-12-02 15:46:24,317] Sample trial#12 with TPESampler.
[I 2025-12-02 15:46:58,250] Trial 12 finished with value: 0.09761326264166993 and parameters: {'n_layers': 1, 'layer_0_size': 125, 'activation': 'tanh', 'alpha': 0.00025741584945621065, 'learning_rate': 'adaptive', 'solver': 'lbfgs', 'learning_rate_init': 0.016222262518348272, 'max_iter': 332}. Best is trial 0 with value: 0.12200317933001711.
[D 2025-12-02 15:46:58,415] Sample trial#13 with TPESampler.
[I 2025-12-02 15:47:30,932] Trial 13 finished with value: 0.10278598902499633 and parameters: {'n_layers': 1, 'layer_0_size': 175, 'activation': 'tanh', 'alpha': 0.00034404356885966064, 'learning_rate': 'adaptive', 'solver': 'sgd', 'learning_rate_init': 0.0918458807903626, 'max_iter': 260}. Best is trial 0 with value: 0.12200317933001711.
[D 2025-12-02 15:47:31,096] Sample trial#14 with TPESampler.
[I 2025-12-02 15:47:52,991] Trial 14 finished with value: 0.10727432710681557 and parameters: {'n_layers': 2, 'layer_0_size': 175, 'layer_1_size': 175, 'activation': 'tanh', 'alpha': 0.000142979409635373, 'learning_rate': 'adaptive', 'solver': 'adam', 'learning_rate_init': 0.003981598068259681, 'max_iter': 623}. Best is trial 0 with value: 0.12200317933001711.
[D 2025-12-02 15:47:53,151] Sample trial#15 with TPESampler.
[I 2025-12-02 15:49:30,883] Trial 15 finished with value: 0.10189360783867396 and parameters: {'n_layers': 1, 'layer_0_size': 200, 'activation': 'tanh', 'alpha': 0.00020547362321947797, 'learning_rate': 'invscaling', 'solver': 'lbfgs', 'learning_rate_init': 0.01296323238089678, 'max_iter': 1175}. Best is trial 0 with value: 0.12200317933001711.
[D 2025-12-02 15:49:31,075] Sample trial#16 with TPESampler.
[I 2025-12-02 15:49:39,442] Trial 16 finished with value: 0.10804271553955962 and parameters: {'n_layers': 1, 'layer_0_size': 100, 'activation': 'tanh', 'alpha': 0.0012569660525044953, 'learning_rate': 'constant', 'solver': 'sgd', 'learning_rate_init': 0.08469495464568395, 'max_iter': 464}. Best is trial 0 with value: 0.12200317933001711.
[D 2025-12-02 15:49:39,619] Sample trial#17 with TPESampler.
[I 2025-12-02 15:50:07,548] Trial 17 finished with value: 0.09693109590717855 and parameters: {'n_layers': 1, 'layer_0_size': 175, 'activation': 'tanh', 'alpha': 0.00018134323348896353, 'learning_rate': 'invscaling', 'solver': 'sgd', 'learning_rate_init': 0.0011366983171707849, 'max_iter': 614}. Best is trial 0 with value: 0.12200317933001711.
[D 2025-12-02 15:50:07,711] Sample trial#18 with TPESampler.
[I 2025-12-02 15:50:32,049] Trial 18 finished with value: 0.11719873513837942 and parameters: {'n_layers': 1, 'layer_0_size': 150, 'activation': 'tanh', 'alpha': 0.0004871604532601862, 'learning_rate': 'adaptive', 'solver': 'sgd', 'learning_rate_init': 0.043962219980142284, 'max_iter': 1450}. Best is trial 0 with value: 0.12200317933001711.
[D 2025-12-02 15:50:32,211] Sample trial#19 with TPESampler.
[I 2025-12-02 15:51:54,239] Trial 19 finished with value: 0.09204088633801122 and parameters: {'n_layers': 1, 'layer_0_size': 175, 'activation': 'logistic', 'alpha': 0.00013718052666634068, 'learning_rate': 'adaptive', 'solver': 'sgd', 'learning_rate_init': 0.06744286086412711, 'max_iter': 1010}. Best is trial 0 with value: 0.12200317933001711.
[D 2025-12-02 15:51:54,399] Sample trial#20 with TPESampler.
[I 2025-12-02 15:52:02,097] Trial 20 finished with value: 0.17334705716279714 and parameters: {'n_layers': 2, 'layer_0_size': 200, 'layer_1_size': 150, 'activation': 'tanh', 'alpha': 0.0007927373616027117, 'learning_rate': 'invscaling', 'solver': 'sgd', 'learning_rate_init': 0.02938322732338764, 'max_iter': 590}. Best is trial 20 with value: 0.17334705716279714.
[D 2025-12-02 15:52:02,260] Sample trial#21 with TPESampler.
[I 2025-12-02 15:52:07,836] Trial 21 finished with value: 0.16468806415064238 and parameters: {'n_layers': 2, 'layer_0_size': 200, 'layer_1_size': 150, 'activation': 'tanh', 'alpha': 0.002084478670921243, 'learning_rate': 'invscaling', 'solver': 'sgd', 'learning_rate_init': 0.01254596846339466, 'max_iter': 1040}. Best is trial 20 with value: 0.17334705716279714.
[D 2025-12-02 15:52:08,011] Sample trial#22 with TPESampler.
[I 2025-12-02 15:52:13,345] Trial 22 finished with value: 0.15636706245524384 and parameters: {'n_layers': 2, 'layer_0_size': 200, 'layer_1_size': 150, 'activation': 'tanh', 'alpha': 0.0011556859845326052, 'learning_rate': 'invscaling', 'solver': 'sgd', 'learning_rate_init': 0.010151473274175671, 'max_iter': 610}. Best is trial 20 with value: 0.17334705716279714.
[D 2025-12-02 15:52:13,509] Sample trial#23 with TPESampler.
[I 2025-12-02 15:52:19,429] Trial 23 finished with value: 0.15137942555584913 and parameters: {'n_layers': 2, 'layer_0_size': 200, 'layer_1_size': 150, 'activation': 'tanh', 'alpha': 0.001352150365145342, 'learning_rate': 'invscaling', 'solver': 'sgd', 'learning_rate_init': 0.008324613098248819, 'max_iter': 564}. Best is trial 20 with value: 0.17334705716279714.
[D 2025-12-02 15:52:19,602] Sample trial#24 with TPESampler.
[I 2025-12-02 15:52:29,005] Trial 24 finished with value: 0.17196655128013338 and parameters: {'n_layers': 2, 'layer_0_size': 200, 'layer_1_size': 150, 'activation': 'tanh', 'alpha': 0.0012127112441150303, 'learning_rate': 'invscaling', 'solver': 'sgd', 'learning_rate_init': 0.0341026391110138, 'max_iter': 1229}. Best is trial 20 with value: 0.17334705716279714.
[D 2025-12-02 15:52:29,181] Sample trial#25 with TPESampler.
[I 2025-12-02 15:52:37,309] Trial 25 finished with value: 0.16079456730399036 and parameters: {'n_layers': 2, 'layer_0_size': 175, 'layer_1_size': 150, 'activation': 'tanh', 'alpha': 0.0006629409266336726, 'learning_rate': 'invscaling', 'solver': 'sgd', 'learning_rate_init': 0.03821059984710412, 'max_iter': 1329}. Best is trial 20 with value: 0.17334705716279714.
[D 2025-12-02 15:52:37,471] Sample trial#26 with TPESampler.
[I 2025-12-02 15:52:55,682] Trial 26 finished with value: 0.10742318327298468 and parameters: {'n_layers': 2, 'layer_0_size': 200, 'layer_1_size': 125, 'activation': 'tanh', 'alpha': 0.002664620089898448, 'learning_rate': 'invscaling', 'solver': 'adam', 'learning_rate_init': 0.006644841050623227, 'max_iter': 1112}. Best is trial 20 with value: 0.17334705716279714.
[D 2025-12-02 15:52:55,848] Sample trial#27 with TPESampler.
[I 2025-12-02 15:53:04,315] Trial 27 finished with value: 0.08513603269308977 and parameters: {'n_layers': 2, 'layer_0_size': 200, 'layer_1_size': 175, 'activation': 'logistic', 'alpha': 0.0028508668581705933, 'learning_rate': 'invscaling', 'solver': 'sgd', 'learning_rate_init': 0.006198440219297198, 'max_iter': 1114}. Best is trial 20 with value: 0.17334705716279714.
[D 2025-12-02 15:53:04,478] Sample trial#28 with TPESampler.
[I 2025-12-02 15:55:12,697] Trial 28 finished with value: 0.09706197087053547 and parameters: {'n_layers': 2, 'layer_0_size': 200, 'layer_1_size': 150, 'activation': 'tanh', 'alpha': 0.0015603704383606808, 'learning_rate': 'constant', 'solver': 'lbfgs', 'learning_rate_init': 0.015043865153346233, 'max_iter': 772}. Best is trial 20 with value: 0.17334705716279714.
[D 2025-12-02 15:55:12,867] Sample trial#29 with TPESampler.
[I 2025-12-02 15:55:58,285] Trial 29 finished with value: 0.11174321675779782 and parameters: {'n_layers': 2, 'layer_0_size': 200, 'layer_1_size': 125, 'activation': 'tanh', 'alpha': 0.00429974619644489, 'learning_rate': 'constant', 'solver': 'sgd', 'learning_rate_init': 0.02369121061424311, 'max_iter': 1422}. Best is trial 20 with value: 0.17334705716279714.
[I 2025-12-02 15:56:00,937] A new study created in memory with name: multi_layer_perceptron_fold_5
[D 2025-12-02 15:56:00,937] Sample trial#0 with RandomSampler.
[I 2025-12-02 15:56:10,459] Trial 0 finished with value: 0.14498808220484002 and parameters: {'n_layers': 1, 'layer_0_size': 150, 'activation': 'logistic', 'alpha': 0.0014333405927548335, 'learning_rate': 'adaptive', 'solver': 'sgd', 'learning_rate_init': 0.0016361884835291065, 'max_iter': 1051}. Best is trial 0 with value: 0.14498808220484002.
[D 2025-12-02 15:56:10,629] Sample trial#1 with TPESampler.
[I 2025-12-02 15:56:31,508] Trial 1 finished with value: 0.08609673230195386 and parameters: {'n_layers': 1, 'layer_0_size': 175, 'activation': 'logistic', 'alpha': 0.007190991650215557, 'learning_rate': 'adaptive', 'solver': 'adam', 'learning_rate_init': 0.007165944384186739, 'max_iter': 1334}. Best is trial 0 with value: 0.14498808220484002.
[D 2025-12-02 15:56:31,674] Sample trial#2 with TPESampler.
[I 2025-12-02 15:57:05,081] Trial 2 finished with value: 0.09826892666793133 and parameters: {'n_layers': 1, 'layer_0_size': 150, 'activation': 'tanh', 'alpha': 0.003829413676218708, 'learning_rate': 'invscaling', 'solver': 'lbfgs', 'learning_rate_init': 0.00047677156093010924, 'max_iter': 239}. Best is trial 0 with value: 0.14498808220484002.
[D 2025-12-02 15:57:05,245] Sample trial#3 with TPESampler.
[I 2025-12-02 15:57:11,465] Trial 3 finished with value: 0.13351909403288623 and parameters: {'n_layers': 1, 'layer_0_size': 150, 'activation': 'logistic', 'alpha': 0.0005637304378787448, 'learning_rate': 'constant', 'solver': 'sgd', 'learning_rate_init': 0.0005580519079197978, 'max_iter': 1152}. Best is trial 0 with value: 0.14498808220484002.
[D 2025-12-02 15:57:11,633] Sample trial#4 with TPESampler.
[I 2025-12-02 15:57:14,213] Trial 4 finished with value: 0.13787037812347416 and parameters: {'n_layers': 1, 'layer_0_size': 175, 'activation': 'tanh', 'alpha': 0.0004594705345351013, 'learning_rate': 'invscaling', 'solver': 'sgd', 'learning_rate_init': 0.008873777278567077, 'max_iter': 1005}. Best is trial 0 with value: 0.14498808220484002.
[D 2025-12-02 15:57:14,376] Sample trial#5 with TPESampler.
[I 2025-12-02 15:57:33,012] Trial 5 finished with value: 0.08594331667369176 and parameters: {'n_layers': 1, 'layer_0_size': 150, 'activation': 'logistic', 'alpha': 0.0021074832212695095, 'learning_rate': 'adaptive', 'solver': 'adam', 'learning_rate_init': 0.002568070114259639, 'max_iter': 238}. Best is trial 0 with value: 0.14498808220484002.
[D 2025-12-02 15:57:33,176] Sample trial#6 with TPESampler.
[I 2025-12-02 16:00:59,834] Trial 6 finished with value: 0.06964977964028218 and parameters: {'n_layers': 2, 'layer_0_size': 175, 'layer_1_size': 150, 'activation': 'logistic', 'alpha': 0.004118635729668991, 'learning_rate': 'constant', 'solver': 'lbfgs', 'learning_rate_init': 0.000111535971616326, 'max_iter': 563}. Best is trial 0 with value: 0.14498808220484002.
[D 2025-12-02 16:01:00,037] Sample trial#7 with TPESampler.
[I 2025-12-02 16:02:30,566] Trial 7 finished with value: 0.10575403913543449 and parameters: {'n_layers': 1, 'layer_0_size': 200, 'activation': 'tanh', 'alpha': 0.008186782158278923, 'learning_rate': 'adaptive', 'solver': 'adam', 'learning_rate_init': 0.0002618856622589275, 'max_iter': 790}. Best is trial 0 with value: 0.14498808220484002.
[D 2025-12-02 16:02:30,739] Sample trial#8 with TPESampler.
[I 2025-12-02 16:03:34,184] Trial 8 finished with value: 0.09864676770720007 and parameters: {'n_layers': 1, 'layer_0_size': 200, 'activation': 'tanh', 'alpha': 0.00046882724878469147, 'learning_rate': 'constant', 'solver': 'adam', 'learning_rate_init': 0.0003932912822145672, 'max_iter': 394}. Best is trial 0 with value: 0.14498808220484002.
[D 2025-12-02 16:03:34,354] Sample trial#9 with TPESampler.
[I 2025-12-02 16:03:52,901] Trial 9 finished with value: 0.1447796274357211 and parameters: {'n_layers': 1, 'layer_0_size': 200, 'activation': 'tanh', 'alpha': 0.0036798108837967944, 'learning_rate': 'constant', 'solver': 'sgd', 'learning_rate_init': 0.00019049274509127804, 'max_iter': 768}. Best is trial 0 with value: 0.14498808220484002.
[D 2025-12-02 16:03:53,066] Sample trial#10 with TPESampler.
[I 2025-12-02 16:04:49,371] Trial 10 finished with value: 0.15107990864252252 and parameters: {'n_layers': 2, 'layer_0_size': 150, 'layer_1_size': 200, 'activation': 'logistic', 'alpha': 0.0005002832222742279, 'learning_rate': 'adaptive', 'solver': 'sgd', 'learning_rate_init': 0.009714102011113612, 'max_iter': 950}. Best is trial 10 with value: 0.15107990864252252.
[D 2025-12-02 16:04:49,536] Sample trial#11 with TPESampler.
[I 2025-12-02 16:05:41,990] Trial 11 finished with value: 0.14186922047082445 and parameters: {'n_layers': 2, 'layer_0_size': 150, 'layer_1_size': 200, 'activation': 'logistic', 'alpha': 0.0006963215329291265, 'learning_rate': 'adaptive', 'solver': 'sgd', 'learning_rate_init': 0.005131231564961301, 'max_iter': 799}. Best is trial 10 with value: 0.15107990864252252.
[D 2025-12-02 16:05:42,157] Sample trial#12 with TPESampler.
[I 2025-12-02 16:05:49,747] Trial 12 finished with value: 0.1447283044525655 and parameters: {'n_layers': 1, 'layer_0_size': 125, 'activation': 'logistic', 'alpha': 0.0008987744966595769, 'learning_rate': 'adaptive', 'solver': 'sgd', 'learning_rate_init': 0.002056989661953635, 'max_iter': 1236}. Best is trial 10 with value: 0.15107990864252252.
[D 2025-12-02 16:05:49,911] Sample trial#13 with TPESampler.
[I 2025-12-02 16:06:53,101] Trial 13 finished with value: 0.07905521489118647 and parameters: {'n_layers': 2, 'layer_0_size': 125, 'layer_1_size': 200, 'activation': 'tanh', 'alpha': 0.00013804110405988857, 'learning_rate': 'adaptive', 'solver': 'sgd', 'learning_rate_init': 0.0268224660162834, 'max_iter': 1045}. Best is trial 10 with value: 0.15107990864252252.
[D 2025-12-02 16:06:53,281] Sample trial#14 with TPESampler.
[I 2025-12-02 16:07:38,909] Trial 14 finished with value: 0.08433171340168003 and parameters: {'n_layers': 1, 'layer_0_size': 150, 'activation': 'logistic', 'alpha': 0.0003155325195055267, 'learning_rate': 'adaptive', 'solver': 'lbfgs', 'learning_rate_init': 0.031252790882230694, 'max_iter': 936}. Best is trial 10 with value: 0.15107990864252252.
[D 2025-12-02 16:07:39,088] Sample trial#15 with TPESampler.
[I 2025-12-02 16:07:44,258] Trial 15 finished with value: 0.0885265901969797 and parameters: {'n_layers': 1, 'layer_0_size': 150, 'activation': 'logistic', 'alpha': 0.001843908993152133, 'learning_rate': 'adaptive', 'solver': 'sgd', 'learning_rate_init': 0.00026742620464533277, 'max_iter': 719}. Best is trial 10 with value: 0.15107990864252252.
[D 2025-12-02 16:07:44,426] Sample trial#16 with TPESampler.
[I 2025-12-02 16:08:07,639] Trial 16 finished with value: 0.15533110857836166 and parameters: {'n_layers': 1, 'layer_0_size': 200, 'activation': 'logistic', 'alpha': 0.0013494424226067774, 'learning_rate': 'adaptive', 'solver': 'sgd', 'learning_rate_init': 0.01304296335192983, 'max_iter': 1103}. Best is trial 16 with value: 0.15533110857836166.
[D 2025-12-02 16:08:07,802] Sample trial#17 with TPESampler.
[I 2025-12-02 16:10:37,924] Trial 17 finished with value: 0.09249682365334684 and parameters: {'n_layers': 1, 'layer_0_size': 200, 'activation': 'tanh', 'alpha': 0.001284499144335948, 'learning_rate': 'adaptive', 'solver': 'sgd', 'learning_rate_init': 0.007075386096500983, 'max_iter': 655}. Best is trial 16 with value: 0.15533110857836166.
[D 2025-12-02 16:10:38,089] Sample trial#18 with TPESampler.
[I 2025-12-02 16:11:57,562] Trial 18 finished with value: 0.12236263916820542 and parameters: {'n_layers': 1, 'layer_0_size': 200, 'activation': 'logistic', 'alpha': 0.0016883005739919152, 'learning_rate': 'adaptive', 'solver': 'sgd', 'learning_rate_init': 0.042962348362800135, 'max_iter': 1132}. Best is trial 16 with value: 0.15533110857836166.
[D 2025-12-02 16:11:57,725] Sample trial#19 with TPESampler.
[I 2025-12-02 16:12:03,995] Trial 19 finished with value: 0.09012305686658381 and parameters: {'n_layers': 1, 'layer_0_size': 200, 'activation': 'logistic', 'alpha': 0.0003078891293472551, 'learning_rate': 'constant', 'solver': 'adam', 'learning_rate_init': 0.04944616930292706, 'max_iter': 1024}. Best is trial 16 with value: 0.15533110857836166.
[D 2025-12-02 16:12:04,159] Sample trial#20 with TPESampler.
[I 2025-12-02 16:12:47,324] Trial 20 finished with value: 0.1323340412877034 and parameters: {'n_layers': 2, 'layer_0_size': 150, 'layer_1_size': 100, 'activation': 'logistic', 'alpha': 0.0020006258922917043, 'learning_rate': 'constant', 'solver': 'sgd', 'learning_rate_init': 0.05787215198341897, 'max_iter': 1230}. Best is trial 16 with value: 0.15533110857836166.
[D 2025-12-02 16:12:47,488] Sample trial#21 with TPESampler.
[I 2025-12-02 16:15:25,977] Trial 21 finished with value: 0.08439705294005131 and parameters: {'n_layers': 1, 'layer_0_size': 200, 'activation': 'logistic', 'alpha': 0.0008363331167182663, 'learning_rate': 'invscaling', 'solver': 'lbfgs', 'learning_rate_init': 0.00384901995889152, 'max_iter': 1348}. Best is trial 16 with value: 0.15533110857836166.
[D 2025-12-02 16:15:26,172] Sample trial#22 with TPESampler.
[I 2025-12-02 16:15:42,810] Trial 22 finished with value: 0.1476548099595248 and parameters: {'n_layers': 1, 'layer_0_size': 175, 'activation': 'logistic', 'alpha': 0.0005545255424002803, 'learning_rate': 'adaptive', 'solver': 'sgd', 'learning_rate_init': 0.0033432783549064353, 'max_iter': 1035}. Best is trial 16 with value: 0.15533110857836166.
[D 2025-12-02 16:15:42,973] Sample trial#23 with TPESampler.
[I 2025-12-02 16:16:05,407] Trial 23 finished with value: 0.14919520630300265 and parameters: {'n_layers': 1, 'layer_0_size': 200, 'activation': 'logistic', 'alpha': 0.00015830881896997166, 'learning_rate': 'adaptive', 'solver': 'sgd', 'learning_rate_init': 0.006175734580672934, 'max_iter': 1067}. Best is trial 16 with value: 0.15533110857836166.
[D 2025-12-02 16:16:05,570] Sample trial#24 with TPESampler.
[I 2025-12-02 16:16:28,012] Trial 24 finished with value: 0.15694606610044307 and parameters: {'n_layers': 1, 'layer_0_size': 200, 'activation': 'logistic', 'alpha': 0.0001160003429487362, 'learning_rate': 'adaptive', 'solver': 'sgd', 'learning_rate_init': 0.02624431622815209, 'max_iter': 1071}. Best is trial 24 with value: 0.15694606610044307.
[D 2025-12-02 16:16:28,177] Sample trial#25 with TPESampler.
[I 2025-12-02 16:16:56,255] Trial 25 finished with value: 0.13614889026263 and parameters: {'n_layers': 1, 'layer_0_size': 150, 'activation': 'logistic', 'alpha': 0.00010089773480933842, 'learning_rate': 'constant', 'solver': 'sgd', 'learning_rate_init': 0.03105002048597852, 'max_iter': 945}. Best is trial 24 with value: 0.15694606610044307.
[D 2025-12-02 16:16:56,420] Sample trial#26 with TPESampler.
[I 2025-12-02 16:17:14,012] Trial 26 finished with value: 0.07745778845913993 and parameters: {'n_layers': 2, 'layer_0_size': 150, 'layer_1_size': 150, 'activation': 'logistic', 'alpha': 0.00011706702718641547, 'learning_rate': 'adaptive', 'solver': 'adam', 'learning_rate_init': 0.03591804405193576, 'max_iter': 929}. Best is trial 24 with value: 0.15694606610044307.
[D 2025-12-02 16:17:14,176] Sample trial#27 with TPESampler.
[I 2025-12-02 16:17:21,566] Trial 27 finished with value: 0.0782386900984879 and parameters: {'n_layers': 1, 'layer_0_size': 200, 'activation': 'logistic', 'alpha': 0.00010465660009210957, 'learning_rate': 'adaptive', 'solver': 'adam', 'learning_rate_init': 0.0342772925968576, 'max_iter': 1206}. Best is trial 24 with value: 0.15694606610044307.
[D 2025-12-02 16:17:21,731] Sample trial#28 with TPESampler.
[I 2025-12-02 16:18:22,621] Trial 28 finished with value: 0.12930755126146135 and parameters: {'n_layers': 1, 'layer_0_size': 200, 'activation': 'logistic', 'alpha': 0.0032981472244194903, 'learning_rate': 'constant', 'solver': 'sgd', 'learning_rate_init': 0.032961616835619975, 'max_iter': 729}. Best is trial 24 with value: 0.15694606610044307.
[D 2025-12-02 16:18:22,786] Sample trial#29 with TPESampler.
