[I 2025-12-02 11:48:30,250] Trial 10 finished with value: 0.09032970943763578 and parameters: {'max_depth': 4, 'min_samples_split': 14, 'min_samples_leaf': 17, 'criterion': 'log_loss', 'max_features': None, 'splitter': 'random'}. Best is trial 2 with value: 0.10395250590125116.
[D 2025-12-02 11:48:30,328] Sample trial#11 with TPESampler.
[I 2025-12-02 11:48:30,433] Trial 11 finished with value: 0.09783391321518294 and parameters: {'max_depth': 13, 'min_samples_split': 7, 'min_samples_leaf': 16, 'criterion': 'log_loss', 'max_features': None, 'splitter': 'random'}. Best is trial 2 with value: 0.10395250590125116.
[D 2025-12-02 11:48:30,510] Sample trial#12 with TPESampler.
[I 2025-12-02 11:48:30,597] Trial 12 finished with value: 0.0999080180978515 and parameters: {'max_depth': 9, 'min_samples_split': 6, 'min_samples_leaf': 15, 'criterion': 'log_loss', 'max_features': None, 'splitter': 'random'}. Best is trial 2 with value: 0.10395250590125116.
[D 2025-12-02 11:48:30,675] Sample trial#13 with TPESampler.
[I 2025-12-02 11:48:30,818] Trial 13 finished with value: 0.09468744197588361 and parameters: {'max_depth': 6, 'min_samples_split': 10, 'min_samples_leaf': 16, 'criterion': 'log_loss', 'max_features': 'sqrt', 'splitter': 'best'}. Best is trial 2 with value: 0.10395250590125116.
[D 2025-12-02 11:48:30,895] Sample trial#14 with TPESampler.
[I 2025-12-02 11:48:30,956] Trial 14 finished with value: 0.08874774754664665 and parameters: {'max_depth': 4, 'min_samples_split': 8, 'min_samples_leaf': 15, 'criterion': 'gini', 'max_features': None, 'splitter': 'random'}. Best is trial 2 with value: 0.10395250590125116.
[D 2025-12-02 11:48:31,033] Sample trial#15 with TPESampler.
[I 2025-12-02 11:48:32,577] Trial 15 finished with value: 0.08468740287137673 and parameters: {'max_depth': 15, 'min_samples_split': 7, 'min_samples_leaf': 16, 'criterion': 'entropy', 'max_features': None, 'splitter': 'best'}. Best is trial 2 with value: 0.10395250590125116.
[D 2025-12-02 11:48:32,657] Sample trial#16 with TPESampler.
[I 2025-12-02 11:48:32,705] Trial 16 finished with value: 0.08875076129706821 and parameters: {'max_depth': 16, 'min_samples_split': 11, 'min_samples_leaf': 15, 'criterion': 'log_loss', 'max_features': 'log2', 'splitter': 'random'}. Best is trial 2 with value: 0.10395250590125116.
[D 2025-12-02 11:48:32,783] Sample trial#17 with TPESampler.
[I 2025-12-02 11:48:32,875] Trial 17 finished with value: 0.0952512492186399 and parameters: {'max_depth': 10, 'min_samples_split': 6, 'min_samples_leaf': 18, 'criterion': 'entropy', 'max_features': None, 'splitter': 'random'}. Best is trial 2 with value: 0.10395250590125116.
[D 2025-12-02 11:48:32,954] Sample trial#18 with TPESampler.
[I 2025-12-02 11:48:32,999] Trial 18 finished with value: 0.0792890814407932 and parameters: {'max_depth': 9, 'min_samples_split': 6, 'min_samples_leaf': 15, 'criterion': 'entropy', 'max_features': 'sqrt', 'splitter': 'random'}. Best is trial 2 with value: 0.10395250590125116.
[D 2025-12-02 11:48:33,076] Sample trial#19 with TPESampler.
[I 2025-12-02 11:48:33,117] Trial 19 finished with value: 0.0753482337895808 and parameters: {'max_depth': 4, 'min_samples_split': 7, 'min_samples_leaf': 15, 'criterion': 'log_loss', 'max_features': 'log2', 'splitter': 'random'}. Best is trial 2 with value: 0.10395250590125116.
[D 2025-12-02 11:48:33,195] Sample trial#20 with TPESampler.
[I 2025-12-02 11:48:33,247] Trial 20 finished with value: 0.0778196739172348 and parameters: {'max_depth': 2, 'min_samples_split': 9, 'min_samples_leaf': 15, 'criterion': 'log_loss', 'max_features': None, 'splitter': 'random'}. Best is trial 2 with value: 0.10395250590125116.
[D 2025-12-02 11:48:33,326] Sample trial#21 with TPESampler.
[I 2025-12-02 11:48:33,441] Trial 21 finished with value: 0.08754039420940563 and parameters: {'max_depth': 17, 'min_samples_split': 5, 'min_samples_leaf': 15, 'criterion': 'log_loss', 'max_features': None, 'splitter': 'random'}. Best is trial 2 with value: 0.10395250590125116.
[D 2025-12-02 11:48:33,520] Sample trial#22 with TPESampler.
[I 2025-12-02 11:48:33,620] Trial 22 finished with value: 0.08767157552126573 and parameters: {'max_depth': 11, 'min_samples_split': 8, 'min_samples_leaf': 17, 'criterion': 'log_loss', 'max_features': None, 'splitter': 'random'}. Best is trial 2 with value: 0.10395250590125116.
[D 2025-12-02 11:48:33,700] Sample trial#23 with TPESampler.
[I 2025-12-02 11:48:34,698] Trial 23 finished with value: 0.0946843311399346 and parameters: {'max_depth': 7, 'min_samples_split': 5, 'min_samples_leaf': 16, 'criterion': 'log_loss', 'max_features': None, 'splitter': 'best'}. Best is trial 2 with value: 0.10395250590125116.
[D 2025-12-02 11:48:34,777] Sample trial#24 with TPESampler.
[I 2025-12-02 11:48:34,887] Trial 24 finished with value: 0.09058164437031646 and parameters: {'max_depth': 15, 'min_samples_split': 11, 'min_samples_leaf': 15, 'criterion': 'log_loss', 'max_features': None, 'splitter': 'random'}. Best is trial 2 with value: 0.10395250590125116.
[D 2025-12-02 11:48:34,964] Sample trial#25 with TPESampler.
[I 2025-12-02 11:48:35,087] Trial 25 finished with value: 0.0865276142088123 and parameters: {'max_depth': 25, 'min_samples_split': 8, 'min_samples_leaf': 18, 'criterion': 'log_loss', 'max_features': None, 'splitter': 'random'}. Best is trial 2 with value: 0.10395250590125116.
[D 2025-12-02 11:48:35,165] Sample trial#26 with TPESampler.
[I 2025-12-02 11:48:35,212] Trial 26 finished with value: 0.09229923575155988 and parameters: {'max_depth': 10, 'min_samples_split': 5, 'min_samples_leaf': 18, 'criterion': 'log_loss', 'max_features': 'sqrt', 'splitter': 'random'}. Best is trial 2 with value: 0.10395250590125116.
[D 2025-12-02 11:48:35,294] Sample trial#27 with TPESampler.
[I 2025-12-02 11:48:35,492] Trial 27 finished with value: 0.08595587669903768 and parameters: {'max_depth': 18, 'min_samples_split': 8, 'min_samples_leaf': 18, 'criterion': 'log_loss', 'max_features': 'log2', 'splitter': 'best'}. Best is trial 2 with value: 0.10395250590125116.
[D 2025-12-02 11:48:35,573] Sample trial#28 with TPESampler.
[I 2025-12-02 11:48:35,677] Trial 28 finished with value: 0.08853575463048395 and parameters: {'max_depth': 13, 'min_samples_split': 5, 'min_samples_leaf': 16, 'criterion': 'gini', 'max_features': None, 'splitter': 'random'}. Best is trial 2 with value: 0.10395250590125116.
[D 2025-12-02 11:48:35,760] Sample trial#29 with TPESampler.
[I 2025-12-02 11:48:35,833] Trial 29 finished with value: 0.09783120297069467 and parameters: {'max_depth': 6, 'min_samples_split': 5, 'min_samples_leaf': 16, 'criterion': 'log_loss', 'max_features': None, 'splitter': 'random'}. Best is trial 2 with value: 0.10395250590125116.
[I 2025-12-02 11:48:36,374] A new study created in memory with name: decision_tree_fold_4
[D 2025-12-02 11:48:36,375] Sample trial#0 with RandomSampler.
[I 2025-12-02 11:48:36,493] Trial 0 finished with value: 0.0957503252487659 and parameters: {'max_depth': 28, 'min_samples_split': 7, 'min_samples_leaf': 15, 'criterion': 'log_loss', 'max_features': None, 'splitter': 'random'}. Best is trial 0 with value: 0.0957503252487659.
[D 2025-12-02 11:48:36,573] Sample trial#1 with TPESampler.
[I 2025-12-02 11:48:36,611] Trial 1 finished with value: 0.06283989668782779 and parameters: {'max_depth': 2, 'min_samples_split': 13, 'min_samples_leaf': 16, 'criterion': 'entropy', 'max_features': 'sqrt', 'splitter': 'random'}. Best is trial 0 with value: 0.0957503252487659.
[D 2025-12-02 11:48:36,692] Sample trial#2 with TPESampler.
[I 2025-12-02 11:48:36,737] Trial 2 finished with value: 0.08340481822629917 and parameters: {'max_depth': 12, 'min_samples_split': 9, 'min_samples_leaf': 15, 'criterion': 'entropy', 'max_features': 'log2', 'splitter': 'random'}. Best is trial 0 with value: 0.0957503252487659.
[D 2025-12-02 11:48:36,817] Sample trial#3 with TPESampler.
[I 2025-12-02 11:48:36,862] Trial 3 finished with value: 0.08038531480753638 and parameters: {'max_depth': 17, 'min_samples_split': 16, 'min_samples_leaf': 20, 'criterion': 'log_loss', 'max_features': 'log2', 'splitter': 'random'}. Best is trial 0 with value: 0.0957503252487659.
[D 2025-12-02 11:48:36,944] Sample trial#4 with TPESampler.
[I 2025-12-02 11:48:36,986] Trial 4 finished with value: 0.08630569973419186 and parameters: {'max_depth': 5, 'min_samples_split': 19, 'min_samples_leaf': 20, 'criterion': 'entropy', 'max_features': 'sqrt', 'splitter': 'random'}. Best is trial 0 with value: 0.0957503252487659.
[D 2025-12-02 11:48:37,066] Sample trial#5 with TPESampler.
[I 2025-12-02 11:48:38,520] Trial 5 finished with value: 0.09108187236094975 and parameters: {'max_depth': 20, 'min_samples_split': 12, 'min_samples_leaf': 19, 'criterion': 'log_loss', 'max_features': None, 'splitter': 'best'}. Best is trial 0 with value: 0.0957503252487659.
[D 2025-12-02 11:48:38,599] Sample trial#6 with TPESampler.
[I 2025-12-02 11:48:38,806] Trial 6 finished with value: 0.07777013490865246 and parameters: {'max_depth': 31, 'min_samples_split': 18, 'min_samples_leaf': 16, 'criterion': 'gini', 'max_features': 'sqrt', 'splitter': 'best'}. Best is trial 0 with value: 0.0957503252487659.
[D 2025-12-02 11:48:38,886] Sample trial#7 with TPESampler.
[I 2025-12-02 11:48:39,071] Trial 7 finished with value: 0.09051150472567368 and parameters: {'max_depth': 14, 'min_samples_split': 12, 'min_samples_leaf': 20, 'criterion': 'gini', 'max_features': 'sqrt', 'splitter': 'best'}. Best is trial 0 with value: 0.0957503252487659.
[D 2025-12-02 11:48:39,152] Sample trial#8 with TPESampler.
[I 2025-12-02 11:48:39,769] Trial 8 finished with value: 0.11773974508246232 and parameters: {'max_depth': 4, 'min_samples_split': 19, 'min_samples_leaf': 15, 'criterion': 'log_loss', 'max_features': None, 'splitter': 'best'}. Best is trial 8 with value: 0.11773974508246232.
[D 2025-12-02 11:48:39,850] Sample trial#9 with TPESampler.
[I 2025-12-02 11:48:39,899] Trial 9 finished with value: 0.08915587602940137 and parameters: {'max_depth': 22, 'min_samples_split': 7, 'min_samples_leaf': 16, 'criterion': 'entropy', 'max_features': 'sqrt', 'splitter': 'random'}. Best is trial 8 with value: 0.11773974508246232.
[D 2025-12-02 11:48:39,981] Sample trial#10 with TPESampler.
[I 2025-12-02 11:48:41,059] Trial 10 finished with value: 0.12001986593746301 and parameters: {'max_depth': 8, 'min_samples_split': 16, 'min_samples_leaf': 16, 'criterion': 'entropy', 'max_features': None, 'splitter': 'best'}. Best is trial 10 with value: 0.12001986593746301.
[D 2025-12-02 11:48:41,141] Sample trial#11 with TPESampler.
[I 2025-12-02 11:48:42,118] Trial 11 finished with value: 0.11889914868928986 and parameters: {'max_depth': 7, 'min_samples_split': 18, 'min_samples_leaf': 16, 'criterion': 'log_loss', 'max_features': None, 'splitter': 'best'}. Best is trial 10 with value: 0.12001986593746301.
[D 2025-12-02 11:48:42,199] Sample trial#12 with TPESampler.
[I 2025-12-02 11:48:43,276] Trial 12 finished with value: 0.12079001269432185 and parameters: {'max_depth': 8, 'min_samples_split': 14, 'min_samples_leaf': 18, 'criterion': 'entropy', 'max_features': None, 'splitter': 'best'}. Best is trial 12 with value: 0.12079001269432185.
[D 2025-12-02 11:48:43,357] Sample trial#13 with TPESampler.
[I 2025-12-02 11:48:43,839] Trial 13 finished with value: 0.10865539675565779 and parameters: {'max_depth': 3, 'min_samples_split': 16, 'min_samples_leaf': 19, 'criterion': 'entropy', 'max_features': None, 'splitter': 'best'}. Best is trial 12 with value: 0.12079001269432185.
[D 2025-12-02 11:48:43,919] Sample trial#14 with TPESampler.
[I 2025-12-02 11:48:45,373] Trial 14 finished with value: 0.0858108082065419 and parameters: {'max_depth': 16, 'min_samples_split': 17, 'min_samples_leaf': 16, 'criterion': 'entropy', 'max_features': None, 'splitter': 'best'}. Best is trial 12 with value: 0.12079001269432185.
[D 2025-12-02 11:48:45,453] Sample trial#15 with TPESampler.
[I 2025-12-02 11:48:45,643] Trial 15 finished with value: 0.10005482408277151 and parameters: {'max_depth': 10, 'min_samples_split': 17, 'min_samples_leaf': 18, 'criterion': 'entropy', 'max_features': 'sqrt', 'splitter': 'best'}. Best is trial 12 with value: 0.12079001269432185.
[D 2025-12-02 11:48:45,725] Sample trial#16 with TPESampler.
[I 2025-12-02 11:48:46,207] Trial 16 finished with value: 0.10854266208727976 and parameters: {'max_depth': 3, 'min_samples_split': 7, 'min_samples_leaf': 17, 'criterion': 'log_loss', 'max_features': None, 'splitter': 'best'}. Best is trial 12 with value: 0.12079001269432185.
[D 2025-12-02 11:48:46,288] Sample trial#17 with TPESampler.
[I 2025-12-02 11:48:47,490] Trial 17 finished with value: 0.07995045648692685 and parameters: {'max_depth': 15, 'min_samples_split': 12, 'min_samples_leaf': 16, 'criterion': 'gini', 'max_features': None, 'splitter': 'best'}. Best is trial 12 with value: 0.12079001269432185.
[D 2025-12-02 11:48:47,572] Sample trial#18 with TPESampler.
[I 2025-12-02 11:48:48,874] Trial 18 finished with value: 0.10059854645605315 and parameters: {'max_depth': 11, 'min_samples_split': 12, 'min_samples_leaf': 17, 'criterion': 'entropy', 'max_features': None, 'splitter': 'best'}. Best is trial 12 with value: 0.12079001269432185.
[D 2025-12-02 11:48:48,956] Sample trial#19 with TPESampler.
[I 2025-12-02 11:48:50,245] Trial 19 finished with value: 0.10461804803277493 and parameters: {'max_depth': 11, 'min_samples_split': 10, 'min_samples_leaf': 20, 'criterion': 'entropy', 'max_features': None, 'splitter': 'best'}. Best is trial 12 with value: 0.12079001269432185.
[D 2025-12-02 11:48:50,326] Sample trial#20 with TPESampler.
[I 2025-12-02 11:48:51,769] Trial 20 finished with value: 0.09535532369553547 and parameters: {'max_depth': 27, 'min_samples_split': 19, 'min_samples_leaf': 20, 'criterion': 'entropy', 'max_features': None, 'splitter': 'best'}. Best is trial 12 with value: 0.12079001269432185.
[D 2025-12-02 11:48:51,849] Sample trial#21 with TPESampler.
[I 2025-12-02 11:48:52,960] Trial 21 finished with value: 0.08793530455215107 and parameters: {'max_depth': 11, 'min_samples_split': 20, 'min_samples_leaf': 17, 'criterion': 'gini', 'max_features': None, 'splitter': 'best'}. Best is trial 12 with value: 0.12079001269432185.
[D 2025-12-02 11:48:53,040] Sample trial#22 with TPESampler.
[I 2025-12-02 11:48:53,254] Trial 22 finished with value: 0.10447870646548205 and parameters: {'max_depth': 13, 'min_samples_split': 13, 'min_samples_leaf': 16, 'criterion': 'log_loss', 'max_features': 'sqrt', 'splitter': 'best'}. Best is trial 12 with value: 0.12079001269432185.
[D 2025-12-02 11:48:53,333] Sample trial#23 with TPESampler.
[I 2025-12-02 11:48:53,389] Trial 23 finished with value: 0.08899437115021239 and parameters: {'max_depth': 3, 'min_samples_split': 16, 'min_samples_leaf': 18, 'criterion': 'log_loss', 'max_features': None, 'splitter': 'random'}. Best is trial 12 with value: 0.12079001269432185.
[D 2025-12-02 11:48:53,471] Sample trial#24 with TPESampler.
[I 2025-12-02 11:48:53,807] Trial 24 finished with value: 0.09050384811596315 and parameters: {'max_depth': 2, 'min_samples_split': 15, 'min_samples_leaf': 15, 'criterion': 'entropy', 'max_features': None, 'splitter': 'best'}. Best is trial 12 with value: 0.12079001269432185.
[D 2025-12-02 11:48:53,887] Sample trial#25 with TPESampler.
[I 2025-12-02 11:48:53,991] Trial 25 finished with value: 0.09041930263381012 and parameters: {'max_depth': 14, 'min_samples_split': 19, 'min_samples_leaf': 18, 'criterion': 'entropy', 'max_features': None, 'splitter': 'random'}. Best is trial 12 with value: 0.12079001269432185.
[D 2025-12-02 11:48:54,072] Sample trial#26 with TPESampler.
[I 2025-12-02 11:48:55,460] Trial 26 finished with value: 0.08865347221838321 and parameters: {'max_depth': 13, 'min_samples_split': 16, 'min_samples_leaf': 16, 'criterion': 'log_loss', 'max_features': None, 'splitter': 'best'}. Best is trial 12 with value: 0.12079001269432185.
[D 2025-12-02 11:48:55,541] Sample trial#27 with TPESampler.
[I 2025-12-02 11:48:55,643] Trial 27 finished with value: 0.10302312378104647 and parameters: {'max_depth': 4, 'min_samples_split': 19, 'min_samples_leaf': 15, 'criterion': 'gini', 'max_features': 'sqrt', 'splitter': 'best'}. Best is trial 12 with value: 0.12079001269432185.
[D 2025-12-02 11:48:55,723] Sample trial#28 with TPESampler.
[I 2025-12-02 11:48:55,866] Trial 28 finished with value: 0.10201343406715968 and parameters: {'max_depth': 6, 'min_samples_split': 18, 'min_samples_leaf': 18, 'criterion': 'log_loss', 'max_features': 'sqrt', 'splitter': 'best'}. Best is trial 12 with value: 0.12079001269432185.
[D 2025-12-02 11:48:55,946] Sample trial#29 with TPESampler.
[I 2025-12-02 11:48:56,115] Trial 29 finished with value: 0.08010348530348324 and parameters: {'max_depth': 13, 'min_samples_split': 18, 'min_samples_leaf': 15, 'criterion': 'entropy', 'max_features': 'log2', 'splitter': 'best'}. Best is trial 12 with value: 0.12079001269432185.
[I 2025-12-02 11:48:56,914] A new study created in memory with name: decision_tree_fold_5
[D 2025-12-02 11:48:56,914] Sample trial#0 with RandomSampler.
[I 2025-12-02 11:48:56,988] Trial 0 finished with value: 0.10142993309909873 and parameters: {'max_depth': 6, 'min_samples_split': 10, 'min_samples_leaf': 17, 'criterion': 'log_loss', 'max_features': None, 'splitter': 'random'}. Best is trial 0 with value: 0.10142993309909873.
[D 2025-12-02 11:48:57,073] Sample trial#1 with TPESampler.
[I 2025-12-02 11:48:57,137] Trial 1 finished with value: 0.0680853871926598 and parameters: {'max_depth': 2, 'min_samples_split': 6, 'min_samples_leaf': 19, 'criterion': 'entropy', 'max_features': 'log2', 'splitter': 'best'}. Best is trial 0 with value: 0.10142993309909873.
[D 2025-12-02 11:48:57,220] Sample trial#2 with TPESampler.
[I 2025-12-02 11:48:57,393] Trial 2 finished with value: 0.07768174986724073 and parameters: {'max_depth': 15, 'min_samples_split': 11, 'min_samples_leaf': 18, 'criterion': 'log_loss', 'max_features': 'log2', 'splitter': 'best'}. Best is trial 0 with value: 0.10142993309909873.
[D 2025-12-02 11:48:57,475] Sample trial#3 with TPESampler.
[I 2025-12-02 11:48:57,713] Trial 3 finished with value: 0.07047699579355012 and parameters: {'max_depth': 31, 'min_samples_split': 18, 'min_samples_leaf': 18, 'criterion': 'entropy', 'max_features': 'sqrt', 'splitter': 'best'}. Best is trial 0 with value: 0.10142993309909873.
[D 2025-12-02 11:48:57,795] Sample trial#4 with TPESampler.
[I 2025-12-02 11:48:57,908] Trial 4 finished with value: 0.08120665018734943 and parameters: {'max_depth': 31, 'min_samples_split': 15, 'min_samples_leaf': 18, 'criterion': 'gini', 'max_features': None, 'splitter': 'random'}. Best is trial 0 with value: 0.10142993309909873.
[D 2025-12-02 11:48:57,991] Sample trial#5 with TPESampler.
[I 2025-12-02 11:48:58,106] Trial 5 finished with value: 0.09089410673484516 and parameters: {'max_depth': 29, 'min_samples_split': 14, 'min_samples_leaf': 19, 'criterion': 'entropy', 'max_features': None, 'splitter': 'random'}. Best is trial 0 with value: 0.10142993309909873.
[D 2025-12-02 11:48:58,188] Sample trial#6 with TPESampler.
[I 2025-12-02 11:48:58,350] Trial 6 finished with value: 0.07892257533071183 and parameters: {'max_depth': 24, 'min_samples_split': 14, 'min_samples_leaf': 20, 'criterion': 'gini', 'max_features': 'log2', 'splitter': 'best'}. Best is trial 0 with value: 0.10142993309909873.
[D 2025-12-02 11:48:58,434] Sample trial#7 with TPESampler.
[I 2025-12-02 11:48:58,547] Trial 7 finished with value: 0.08284238900085288 and parameters: {'max_depth': 31, 'min_samples_split': 17, 'min_samples_leaf': 17, 'criterion': 'gini', 'max_features': None, 'splitter': 'random'}. Best is trial 0 with value: 0.10142993309909873.
[D 2025-12-02 11:48:58,630] Sample trial#8 with TPESampler.
[I 2025-12-02 11:48:58,842] Trial 8 finished with value: 0.07008559347639892 and parameters: {'max_depth': 28, 'min_samples_split': 20, 'min_samples_leaf': 19, 'criterion': 'gini', 'max_features': 'sqrt', 'splitter': 'best'}. Best is trial 0 with value: 0.10142993309909873.
[D 2025-12-02 11:48:58,925] Sample trial#9 with TPESampler.
[I 2025-12-02 11:49:00,533] Trial 9 finished with value: 0.07875207918939602 and parameters: {'max_depth': 29, 'min_samples_split': 15, 'min_samples_leaf': 20, 'criterion': 'entropy', 'max_features': None, 'splitter': 'best'}. Best is trial 0 with value: 0.10142993309909873.
[D 2025-12-02 11:49:00,616] Sample trial#10 with TPESampler.
[I 2025-12-02 11:49:00,672] Trial 10 finished with value: 0.08556712614185784 and parameters: {'max_depth': 3, 'min_samples_split': 12, 'min_samples_leaf': 18, 'criterion': 'log_loss', 'max_features': None, 'splitter': 'random'}. Best is trial 0 with value: 0.10142993309909873.
[D 2025-12-02 11:49:00,757] Sample trial#11 with TPESampler.
[I 2025-12-02 11:49:01,614] Trial 11 finished with value: 0.09567669914183742 and parameters: {'max_depth': 6, 'min_samples_split': 7, 'min_samples_leaf': 16, 'criterion': 'log_loss', 'max_features': None, 'splitter': 'best'}. Best is trial 0 with value: 0.10142993309909873.
[D 2025-12-02 11:49:01,696] Sample trial#12 with TPESampler.
[I 2025-12-02 11:49:03,119] Trial 12 finished with value: 0.08610235748290226 and parameters: {'max_depth': 13, 'min_samples_split': 6, 'min_samples_leaf': 15, 'criterion': 'log_loss', 'max_features': None, 'splitter': 'best'}. Best is trial 0 with value: 0.10142993309909873.
[D 2025-12-02 11:49:03,202] Sample trial#13 with TPESampler.
[I 2025-12-02 11:49:03,680] Trial 13 finished with value: 0.0896928110504019 and parameters: {'max_depth': 3, 'min_samples_split': 6, 'min_samples_leaf': 18, 'criterion': 'log_loss', 'max_features': None, 'splitter': 'best'}. Best is trial 0 with value: 0.10142993309909873.
[D 2025-12-02 11:49:03,763] Sample trial#14 with TPESampler.
