[I 2025-12-02 14:09:38,167] Trial 7 finished with value: 0.15296215802649415 and parameters: {'iterations': 300, 'learning_rate': 0.014098645921097868, 'depth': 4, 'l2_leaf_reg': 2.3188368439154194, 'border_count': 215, 'bagging_temperature': 0.2638788526256536, 'random_strength': 0.5118237948581816, 'scale_pos_weight': 5.535896647207214}. Best is trial 0 with value: 0.16032867586444444.
[D 2025-12-02 14:09:38,303] Sample trial#8 with GPSampler.
[I 2025-12-02 14:09:42,089] Trial 8 finished with value: 0.15459977110414777 and parameters: {'iterations': 900, 'learning_rate': 0.01340567328218683, 'depth': 2, 'l2_leaf_reg': 7.3291225911554765, 'border_count': 154, 'bagging_temperature': 0.43619797580497943, 'random_strength': 0.18053256439860565, 'scale_pos_weight': 5.335895892739004}. Best is trial 0 with value: 0.16032867586444444.
[D 2025-12-02 14:09:42,224] Sample trial#9 with GPSampler.
[I 2025-12-02 14:09:45,095] Trial 9 finished with value: 0.14672317052996955 and parameters: {'iterations': 700, 'learning_rate': 0.009638127900726236, 'depth': 2, 'l2_leaf_reg': 1.779509374421171, 'border_count': 163, 'bagging_temperature': 0.9558062139427654, 'random_strength': 0.721859609797033, 'scale_pos_weight': 5.664736340534817}. Best is trial 0 with value: 0.16032867586444444.
[D 2025-12-02 14:09:45,231] Sample trial#10 with GPSampler.
[I 2025-12-02 14:09:47,778] Trial 10 finished with value: 0.1549430578300683 and parameters: {'iterations': 400, 'learning_rate': 0.010886666616213628, 'depth': 4, 'l2_leaf_reg': 1.0, 'border_count': 255, 'bagging_temperature': 1.0, 'random_strength': 0.08084377494711234, 'scale_pos_weight': 5.831544279189785}. Best is trial 0 with value: 0.16032867586444444.
[D 2025-12-02 14:09:47,912] Sample trial#11 with GPSampler.
[I 2025-12-02 14:09:51,399] Trial 11 finished with value: 0.15492456798894527 and parameters: {'iterations': 600, 'learning_rate': 0.0032508955891207957, 'depth': 4, 'l2_leaf_reg': 6.081081182469715, 'border_count': 255, 'bagging_temperature': 0.0, 'random_strength': 0.06904180855257264, 'scale_pos_weight': 5.9790473639412784}. Best is trial 0 with value: 0.16032867586444444.
[D 2025-12-02 14:09:51,535] Sample trial#12 with GPSampler.
[I 2025-12-02 14:09:54,037] Trial 12 finished with value: 0.15561707825600138 and parameters: {'iterations': 400, 'learning_rate': 0.008971835169034516, 'depth': 4, 'l2_leaf_reg': 1.8083194184382452, 'border_count': 255, 'bagging_temperature': 0.33591767260593136, 'random_strength': 0.5022412400952899, 'scale_pos_weight': 5.4016264874179445}. Best is trial 0 with value: 0.16032867586444444.
[D 2025-12-02 14:09:54,172] Sample trial#13 with GPSampler.
[I 2025-12-02 14:09:57,248] Trial 13 finished with value: 0.15603057273847476 and parameters: {'iterations': 500, 'learning_rate': 0.014504134522718922, 'depth': 4, 'l2_leaf_reg': 1.0, 'border_count': 255, 'bagging_temperature': 0.3085185900263239, 'random_strength': 0.083727009362607, 'scale_pos_weight': 6.0}. Best is trial 0 with value: 0.16032867586444444.
[D 2025-12-02 14:09:57,385] Sample trial#14 with GPSampler.
[I 2025-12-02 14:09:59,959] Trial 14 finished with value: 0.15821241606309505 and parameters: {'iterations': 400, 'learning_rate': 0.008954704602314557, 'depth': 4, 'l2_leaf_reg': 10.0, 'border_count': 255, 'bagging_temperature': 0.4475776668102079, 'random_strength': 0.21678451764556114, 'scale_pos_weight': 6.0}. Best is trial 0 with value: 0.16032867586444444.
[D 2025-12-02 14:10:00,095] Sample trial#15 with GPSampler.
[I 2025-12-02 14:10:05,488] Trial 15 finished with value: 0.1546939481529204 and parameters: {'iterations': 1000, 'learning_rate': 0.011810819920294636, 'depth': 4, 'l2_leaf_reg': 5.31568118802711, 'border_count': 199, 'bagging_temperature': 0.61529185980383, 'random_strength': 0.0, 'scale_pos_weight': 5.0}. Best is trial 0 with value: 0.16032867586444444.
[D 2025-12-02 14:10:05,624] Sample trial#16 with GPSampler.
[I 2025-12-02 14:10:07,144] Trial 16 finished with value: 0.1515471928903199 and parameters: {'iterations': 200, 'learning_rate': 0.005543921411510143, 'depth': 4, 'l2_leaf_reg': 1.0, 'border_count': 255, 'bagging_temperature': 0.060510868201626516, 'random_strength': 0.06241794826894772, 'scale_pos_weight': 6.0}. Best is trial 0 with value: 0.16032867586444444.
[D 2025-12-02 14:10:07,279] Sample trial#17 with GPSampler.
[I 2025-12-02 14:10:11,160] Trial 17 finished with value: 0.1566465774245483 and parameters: {'iterations': 600, 'learning_rate': 0.005209733080145122, 'depth': 4, 'l2_leaf_reg': 1.0, 'border_count': 255, 'bagging_temperature': 0.3504935909369994, 'random_strength': 0.2738108008067979, 'scale_pos_weight': 5.911542449493382}. Best is trial 0 with value: 0.16032867586444444.
[D 2025-12-02 14:10:11,296] Sample trial#18 with GPSampler.
[I 2025-12-02 14:10:13,824] Trial 18 finished with value: 0.13887717401753683 and parameters: {'iterations': 400, 'learning_rate': 0.001, 'depth': 4, 'l2_leaf_reg': 4.827101360633544, 'border_count': 226, 'bagging_temperature': 0.0, 'random_strength': 0.29578881297346943, 'scale_pos_weight': 6.0}. Best is trial 0 with value: 0.16032867586444444.
[D 2025-12-02 14:10:13,960] Sample trial#19 with GPSampler.
[I 2025-12-02 14:10:18,617] Trial 19 finished with value: 0.15821650135646068 and parameters: {'iterations': 700, 'learning_rate': 0.0095626641762576, 'depth': 4, 'l2_leaf_reg': 5.47557543978584, 'border_count': 247, 'bagging_temperature': 0.03213043120865017, 'random_strength': 0.0, 'scale_pos_weight': 6.0}. Best is trial 0 with value: 0.16032867586444444.
[D 2025-12-02 14:10:18,754] Sample trial#20 with GPSampler.
[I 2025-12-02 14:10:24,360] Trial 20 finished with value: 0.15860077949473111 and parameters: {'iterations': 1000, 'learning_rate': 0.005966579200719825, 'depth': 4, 'l2_leaf_reg': 7.155787994247615, 'border_count': 255, 'bagging_temperature': 1.0, 'random_strength': 0.0, 'scale_pos_weight': 5.0}. Best is trial 0 with value: 0.16032867586444444.
[D 2025-12-02 14:10:24,497] Sample trial#21 with GPSampler.
[I 2025-12-02 14:10:29,690] Trial 21 finished with value: 0.1474359537639502 and parameters: {'iterations': 1000, 'learning_rate': 0.02, 'depth': 4, 'l2_leaf_reg': 10.0, 'border_count': 150, 'bagging_temperature': 0.2513941738910271, 'random_strength': 0.0, 'scale_pos_weight': 5.0}. Best is trial 0 with value: 0.16032867586444444.
[D 2025-12-02 14:10:29,826] Sample trial#22 with GPSampler.
[I 2025-12-02 14:10:34,579] Trial 22 finished with value: 0.15784026435378218 and parameters: {'iterations': 1000, 'learning_rate': 0.004036519040840396, 'depth': 3, 'l2_leaf_reg': 1.0, 'border_count': 255, 'bagging_temperature': 1.0, 'random_strength': 0.0, 'scale_pos_weight': 5.0}. Best is trial 0 with value: 0.16032867586444444.
[D 2025-12-02 14:10:34,716] Sample trial#23 with GPSampler.
[I 2025-12-02 14:10:40,183] Trial 23 finished with value: 0.14680056468806393 and parameters: {'iterations': 1000, 'learning_rate': 0.015298796380098015, 'depth': 4, 'l2_leaf_reg': 1.0, 'border_count': 227, 'bagging_temperature': 1.0, 'random_strength': 1.0, 'scale_pos_weight': 6.0}. Best is trial 0 with value: 0.16032867586444444.
[D 2025-12-02 14:10:40,319] Sample trial#24 with GPSampler.
[I 2025-12-02 14:10:43,560] Trial 24 finished with value: 0.1620377404791737 and parameters: {'iterations': 500, 'learning_rate': 0.00913796595499878, 'depth': 4, 'l2_leaf_reg': 2.6492275104819316, 'border_count': 255, 'bagging_temperature': 0.04757024492912333, 'random_strength': 0.16882008441152174, 'scale_pos_weight': 6.0}. Best is trial 24 with value: 0.1620377404791737.
[D 2025-12-02 14:10:43,696] Sample trial#25 with GPSampler.
[I 2025-12-02 14:10:47,225] Trial 25 finished with value: 0.1614974323682187 and parameters: {'iterations': 600, 'learning_rate': 0.00820681945124481, 'depth': 4, 'l2_leaf_reg': 1.0, 'border_count': 255, 'bagging_temperature': 0.007481579589135738, 'random_strength': 0.09124801855146988, 'scale_pos_weight': 5.0}. Best is trial 24 with value: 0.1620377404791737.
[D 2025-12-02 14:10:47,360] Sample trial#26 with GPSampler.
[I 2025-12-02 14:10:51,438] Trial 26 finished with value: 0.16079260709800766 and parameters: {'iterations': 700, 'learning_rate': 0.009277541449426576, 'depth': 4, 'l2_leaf_reg': 1.0, 'border_count': 255, 'bagging_temperature': 0.41947078555473244, 'random_strength': 0.23722664976262434, 'scale_pos_weight': 5.116460817759621}. Best is trial 24 with value: 0.1620377404791737.
[D 2025-12-02 14:10:51,574] Sample trial#27 with GPSampler.
[I 2025-12-02 14:10:57,062] Trial 27 finished with value: 0.15421270494758554 and parameters: {'iterations': 1000, 'learning_rate': 0.004568966915369162, 'depth': 4, 'l2_leaf_reg': 1.0, 'border_count': 255, 'bagging_temperature': 0.0, 'random_strength': 0.0, 'scale_pos_weight': 5.0}. Best is trial 24 with value: 0.1620377404791737.
[D 2025-12-02 14:10:57,197] Sample trial#28 with GPSampler.
[I 2025-12-02 14:11:00,202] Trial 28 finished with value: 0.16139908563295075 and parameters: {'iterations': 500, 'learning_rate': 0.008854916518379892, 'depth': 4, 'l2_leaf_reg': 3.341801198507427, 'border_count': 255, 'bagging_temperature': 0.15986350202947114, 'random_strength': 0.1382402141582893, 'scale_pos_weight': 5.4198359536104}. Best is trial 24 with value: 0.1620377404791737.
[D 2025-12-02 14:11:00,337] Sample trial#29 with GPSampler.
[I 2025-12-02 14:11:04,347] Trial 29 finished with value: 0.15466832595045027 and parameters: {'iterations': 700, 'learning_rate': 0.006623596105970757, 'depth': 4, 'l2_leaf_reg': 1.0, 'border_count': 255, 'bagging_temperature': 1.0, 'random_strength': 0.0, 'scale_pos_weight': 5.0}. Best is trial 24 with value: 0.1620377404791737.
[I 2025-12-02 14:11:05,939] A new study created in memory with name: catboost_fold_4
[D 2025-12-02 14:11:05,939] Sample trial#0 with RandomSampler.
[I 2025-12-02 14:11:09,839] Trial 0 finished with value: 0.17757728627334896 and parameters: {'iterations': 700, 'learning_rate': 0.017911084152139156, 'depth': 4, 'l2_leaf_reg': 7.14771354988297, 'border_count': 236, 'bagging_temperature': 0.030076460247735803, 'random_strength': 0.8214255966154995, 'scale_pos_weight': 5.171756726314571}. Best is trial 0 with value: 0.17757728627334896.
[D 2025-12-02 14:11:09,979] Sample trial#1 with GPSampler.
[I 2025-12-02 14:11:10,932] Trial 1 finished with value: 0.16343008841862522 and parameters: {'iterations': 100, 'learning_rate': 0.006450269732022047, 'depth': 4, 'l2_leaf_reg': 2.148935439245177, 'border_count': 254, 'bagging_temperature': 0.8818284226242715, 'random_strength': 0.27760307099429793, 'scale_pos_weight': 5.9227212282479975}. Best is trial 0 with value: 0.17757728627334896.
[D 2025-12-02 14:11:11,077] Sample trial#2 with GPSampler.
[I 2025-12-02 14:11:16,537] Trial 2 finished with value: 0.1753471991178122 and parameters: {'iterations': 1000, 'learning_rate': 0.01320363335516353, 'depth': 4, 'l2_leaf_reg': 4.893412988417802, 'border_count': 250, 'bagging_temperature': 0.3407348301247851, 'random_strength': 0.3976832860596421, 'scale_pos_weight': 5.8990698036687075}. Best is trial 0 with value: 0.17757728627334896.
[D 2025-12-02 14:11:16,674] Sample trial#3 with GPSampler.
[I 2025-12-02 14:11:18,530] Trial 3 finished with value: 0.15490229749546883 and parameters: {'iterations': 400, 'learning_rate': 0.004877596729559716, 'depth': 2, 'l2_leaf_reg': 8.547858513820483, 'border_count': 199, 'bagging_temperature': 0.7563105704630885, 'random_strength': 0.6100799570177382, 'scale_pos_weight': 5.603092153502994}. Best is trial 0 with value: 0.17757728627334896.
[D 2025-12-02 14:11:18,668] Sample trial#4 with GPSampler.
[I 2025-12-02 14:11:20,304] Trial 4 finished with value: 0.1549758379197538 and parameters: {'iterations': 300, 'learning_rate': 0.0033712722239679018, 'depth': 3, 'l2_leaf_reg': 3.429628296075604, 'border_count': 175, 'bagging_temperature': 0.33727846666922734, 'random_strength': 0.6337819786648757, 'scale_pos_weight': 5.289895540616432}. Best is trial 0 with value: 0.17757728627334896.
[D 2025-12-02 14:11:20,442] Sample trial#5 with GPSampler.
[I 2025-12-02 14:11:24,019] Trial 5 finished with value: 0.15458748057695626 and parameters: {'iterations': 900, 'learning_rate': 0.0014938761352650668, 'depth': 2, 'l2_leaf_reg': 8.077243865875175, 'border_count': 207, 'bagging_temperature': 0.581543375537743, 'random_strength': 0.5596975135208818, 'scale_pos_weight': 5.518730829106938}. Best is trial 0 with value: 0.17757728627334896.
[D 2025-12-02 14:11:24,157] Sample trial#6 with GPSampler.
[I 2025-12-02 14:11:27,413] Trial 6 finished with value: 0.18209329257244056 and parameters: {'iterations': 600, 'learning_rate': 0.00466634188424862, 'depth': 4, 'l2_leaf_reg': 5.349245275031961, 'border_count': 171, 'bagging_temperature': 0.312932054013208, 'random_strength': 0.09422719083715225, 'scale_pos_weight': 5.528600971283282}. Best is trial 6 with value: 0.18209329257244056.
[D 2025-12-02 14:11:27,551] Sample trial#7 with GPSampler.
[I 2025-12-02 14:11:30,719] Trial 7 finished with value: 0.16046955172432364 and parameters: {'iterations': 800, 'learning_rate': 0.006955256479631208, 'depth': 2, 'l2_leaf_reg': 1.1236482756340438, 'border_count': 193, 'bagging_temperature': 0.33236523524728934, 'random_strength': 0.9332319976389549, 'scale_pos_weight': 5.9024608572858615}. Best is trial 6 with value: 0.18209329257244056.
[D 2025-12-02 14:11:30,856] Sample trial#8 with GPSampler.
[I 2025-12-02 14:11:33,839] Trial 8 finished with value: 0.17437959056905922 and parameters: {'iterations': 600, 'learning_rate': 0.017961608291075824, 'depth': 3, 'l2_leaf_reg': 8.30322166140786, 'border_count': 175, 'bagging_temperature': 0.661768278996059, 'random_strength': 0.9390261731940068, 'scale_pos_weight': 5.1602508356790375}. Best is trial 6 with value: 0.18209329257244056.
[D 2025-12-02 14:11:33,977] Sample trial#9 with GPSampler.
[I 2025-12-02 14:11:35,152] Trial 9 finished with value: 0.16209989476081535 and parameters: {'iterations': 200, 'learning_rate': 0.0181760886968918, 'depth': 2, 'l2_leaf_reg': 7.54150785404443, 'border_count': 154, 'bagging_temperature': 0.9848976379990152, 'random_strength': 0.47467716689233175, 'scale_pos_weight': 5.151075292474209}. Best is trial 6 with value: 0.18209329257244056.
[D 2025-12-02 14:11:35,297] Sample trial#10 with GPSampler.
[I 2025-12-02 14:11:40,058] Trial 10 finished with value: 0.17406202117150663 and parameters: {'iterations': 900, 'learning_rate': 0.008105386184757812, 'depth': 4, 'l2_leaf_reg': 6.75275915666194, 'border_count': 163, 'bagging_temperature': 0.04681809964354125, 'random_strength': 0.0, 'scale_pos_weight': 5.535226782244648}. Best is trial 6 with value: 0.18209329257244056.
[D 2025-12-02 14:11:40,196] Sample trial#11 with GPSampler.
[I 2025-12-02 14:11:43,031] Trial 11 finished with value: 0.16009981286955893 and parameters: {'iterations': 500, 'learning_rate': 0.001, 'depth': 4, 'l2_leaf_reg': 4.566379223546049, 'border_count': 154, 'bagging_temperature': 0.3931797937302893, 'random_strength': 0.0, 'scale_pos_weight': 5.50317381489036}. Best is trial 6 with value: 0.18209329257244056.
[D 2025-12-02 14:11:43,169] Sample trial#12 with GPSampler.
[I 2025-12-02 14:11:46,604] Trial 12 finished with value: 0.17823983500592533 and parameters: {'iterations': 600, 'learning_rate': 0.0056986845712550535, 'depth': 4, 'l2_leaf_reg': 4.670256398327013, 'border_count': 184, 'bagging_temperature': 0.27132769318165745, 'random_strength': 0.0401232832908731, 'scale_pos_weight': 5.352191586082501}. Best is trial 6 with value: 0.18209329257244056.
[D 2025-12-02 14:11:46,742] Sample trial#13 with GPSampler.
[I 2025-12-02 14:11:50,503] Trial 13 finished with value: 0.1808751010947207 and parameters: {'iterations': 700, 'learning_rate': 0.005490943830199134, 'depth': 4, 'l2_leaf_reg': 6.574021834317303, 'border_count': 157, 'bagging_temperature': 0.2643485769296971, 'random_strength': 0.13329938077924933, 'scale_pos_weight': 5.796066049293053}. Best is trial 6 with value: 0.18209329257244056.
[D 2025-12-02 14:11:50,641] Sample trial#14 with GPSampler.
[I 2025-12-02 14:11:53,980] Trial 14 finished with value: 0.18018808150133456 and parameters: {'iterations': 600, 'learning_rate': 0.005150732262807222, 'depth': 4, 'l2_leaf_reg': 10.0, 'border_count': 158, 'bagging_temperature': 0.2854955514729937, 'random_strength': 0.11126292916666668, 'scale_pos_weight': 5.3607217428249925}. Best is trial 6 with value: 0.18209329257244056.
[D 2025-12-02 14:11:54,119] Sample trial#15 with GPSampler.
[I 2025-12-02 14:11:59,641] Trial 15 finished with value: 0.1724633290051138 and parameters: {'iterations': 1000, 'learning_rate': 0.01571439468171339, 'depth': 4, 'l2_leaf_reg': 10.0, 'border_count': 255, 'bagging_temperature': 0.28504707915440947, 'random_strength': 0.9787504236770352, 'scale_pos_weight': 6.0}. Best is trial 6 with value: 0.18209329257244056.
[D 2025-12-02 14:11:59,786] Sample trial#16 with GPSampler.
[I 2025-12-02 14:12:04,969] Trial 16 finished with value: 0.18068921489347914 and parameters: {'iterations': 1000, 'learning_rate': 0.005129817274956996, 'depth': 4, 'l2_leaf_reg': 2.9040489103020803, 'border_count': 150, 'bagging_temperature': 0.4541475004884793, 'random_strength': 0.10282530724969156, 'scale_pos_weight': 5.380643996565766}. Best is trial 6 with value: 0.18209329257244056.
[D 2025-12-02 14:12:05,107] Sample trial#17 with GPSampler.
[I 2025-12-02 14:12:10,323] Trial 17 finished with value: 0.1763151241211885 and parameters: {'iterations': 1000, 'learning_rate': 0.004758453394142475, 'depth': 4, 'l2_leaf_reg': 5.705562251984088, 'border_count': 159, 'bagging_temperature': 0.0, 'random_strength': 0.05808055318277093, 'scale_pos_weight': 5.760229183531963}. Best is trial 6 with value: 0.18209329257244056.
[D 2025-12-02 14:12:10,460] Sample trial#18 with GPSampler.
[I 2025-12-02 14:12:12,344] Trial 18 finished with value: 0.17846368962059303 and parameters: {'iterations': 300, 'learning_rate': 0.005561679015617283, 'depth': 4, 'l2_leaf_reg': 2.0223503633439313, 'border_count': 156, 'bagging_temperature': 0.38174564661895305, 'random_strength': 0.14820415691127864, 'scale_pos_weight': 5.341584612570539}. Best is trial 6 with value: 0.18209329257244056.
[D 2025-12-02 14:12:12,482] Sample trial#19 with GPSampler.
[I 2025-12-02 14:12:16,299] Trial 19 finished with value: 0.17718204066337256 and parameters: {'iterations': 700, 'learning_rate': 0.005496659533775852, 'depth': 4, 'l2_leaf_reg': 8.04215411679688, 'border_count': 151, 'bagging_temperature': 0.6229977817096487, 'random_strength': 0.04421064934959163, 'scale_pos_weight': 5.946970193708074}. Best is trial 6 with value: 0.18209329257244056.
[D 2025-12-02 14:12:16,437] Sample trial#20 with GPSampler.
[I 2025-12-02 14:12:20,725] Trial 20 finished with value: 0.17075181941869672 and parameters: {'iterations': 1000, 'learning_rate': 0.02, 'depth': 2, 'l2_leaf_reg': 1.0, 'border_count': 255, 'bagging_temperature': 0.0, 'random_strength': 1.0, 'scale_pos_weight': 5.0}. Best is trial 6 with value: 0.18209329257244056.
[D 2025-12-02 14:12:20,863] Sample trial#21 with GPSampler.
[I 2025-12-02 14:12:26,372] Trial 21 finished with value: 0.16809119026591057 and parameters: {'iterations': 1000, 'learning_rate': 0.017688233304604513, 'depth': 4, 'l2_leaf_reg': 1.0, 'border_count': 255, 'bagging_temperature': 0.0, 'random_strength': 0.5207974190889385, 'scale_pos_weight': 6.0}. Best is trial 6 with value: 0.18209329257244056.
[D 2025-12-02 14:12:26,510] Sample trial#22 with GPSampler.
[I 2025-12-02 14:12:31,364] Trial 22 finished with value: 0.18259379447901955 and parameters: {'iterations': 900, 'learning_rate': 0.0051376020534963426, 'depth': 4, 'l2_leaf_reg': 6.020447928667287, 'border_count': 183, 'bagging_temperature': 0.42488406883761287, 'random_strength': 0.15013730456399418, 'scale_pos_weight': 5.331938645405089}. Best is trial 22 with value: 0.18259379447901955.
[D 2025-12-02 14:12:31,503] Sample trial#23 with GPSampler.
[I 2025-12-02 14:12:35,387] Trial 23 finished with value: 0.1801308024278558 and parameters: {'iterations': 800, 'learning_rate': 0.005070208019029605, 'depth': 3, 'l2_leaf_reg': 5.352361491483277, 'border_count': 179, 'bagging_temperature': 0.398310945602155, 'random_strength': 0.13462978525066693, 'scale_pos_weight': 5.304321075597002}. Best is trial 22 with value: 0.18259379447901955.
[D 2025-12-02 14:12:35,526] Sample trial#24 with GPSampler.
[I 2025-12-02 14:12:41,101] Trial 24 finished with value: 0.16818412152765203 and parameters: {'iterations': 1000, 'learning_rate': 0.01562858919320236, 'depth': 4, 'l2_leaf_reg': 10.0, 'border_count': 255, 'bagging_temperature': 0.0, 'random_strength': 0.0, 'scale_pos_weight': 6.0}. Best is trial 22 with value: 0.18259379447901955.
[D 2025-12-02 14:12:41,240] Sample trial#25 with GPSampler.
[I 2025-12-02 14:12:46,549] Trial 25 finished with value: 0.18174518773110465 and parameters: {'iterations': 1000, 'learning_rate': 0.005320051100692457, 'depth': 4, 'l2_leaf_reg': 4.166047734340758, 'border_count': 183, 'bagging_temperature': 0.0, 'random_strength': 0.17704890737150727, 'scale_pos_weight': 5.0}. Best is trial 22 with value: 0.18259379447901955.
[D 2025-12-02 14:12:46,686] Sample trial#26 with GPSampler.
[I 2025-12-02 14:12:50,964] Trial 26 finished with value: 0.18118148078189936 and parameters: {'iterations': 800, 'learning_rate': 0.0048641696481708, 'depth': 4, 'l2_leaf_reg': 4.2997279135680575, 'border_count': 172, 'bagging_temperature': 0.4355869470087885, 'random_strength': 0.14728737093514377, 'scale_pos_weight': 5.0}. Best is trial 22 with value: 0.18259379447901955.
[D 2025-12-02 14:12:51,102] Sample trial#27 with GPSampler.
