[I 2025-12-02 13:36:43,260] Trial 5 finished with value: 0.1689379174757606 and parameters: {'max_iter': 70, 'learning_rate': 0.06642713311331734, 'max_depth': 3, 'min_samples_leaf': 11, 'l2_regularization': 0.30666001229003625}. Best is trial 1 with value: 0.1712201485977797.
[D 2025-12-02 13:36:43,383] Sample trial#6 with GPSampler.
[I 2025-12-02 13:36:43,854] Trial 6 finished with value: 0.16028418304737432 and parameters: {'max_iter': 95, 'learning_rate': 0.020415973687845732, 'max_depth': 2, 'min_samples_leaf': 18, 'l2_regularization': 0.2736376802271814}. Best is trial 1 with value: 0.1712201485977797.
[D 2025-12-02 13:36:43,979] Sample trial#7 with GPSampler.
[I 2025-12-02 13:36:44,562] Trial 7 finished with value: 0.16371830942709337 and parameters: {'max_iter': 111, 'learning_rate': 0.08626602967365249, 'max_depth': 3, 'min_samples_leaf': 27, 'l2_regularization': 0.6838694007285425}. Best is trial 1 with value: 0.1712201485977797.
[D 2025-12-02 13:36:44,682] Sample trial#8 with GPSampler.
[I 2025-12-02 13:36:45,663] Trial 8 finished with value: 0.1683105323493191 and parameters: {'max_iter': 184, 'learning_rate': 0.0285049217998612, 'max_depth': 4, 'min_samples_leaf': 7, 'l2_regularization': 0.7529173376003641}. Best is trial 1 with value: 0.1712201485977797.
[D 2025-12-02 13:36:45,781] Sample trial#9 with GPSampler.
[I 2025-12-02 13:36:46,727] Trial 9 finished with value: 0.17035669610846604 and parameters: {'max_iter': 161, 'learning_rate': 0.02518879311233215, 'max_depth': 4, 'min_samples_leaf': 20, 'l2_regularization': 0.17890172735349053}. Best is trial 1 with value: 0.1712201485977797.
[D 2025-12-02 13:36:46,852] Sample trial#10 with GPSampler.
[I 2025-12-02 13:36:47,641] Trial 10 finished with value: 0.17163003276227431 and parameters: {'max_iter': 52, 'learning_rate': 0.04073676607315032, 'max_depth': 4, 'min_samples_leaf': 15, 'l2_regularization': 0.0}. Best is trial 10 with value: 0.17163003276227431.
[D 2025-12-02 13:36:47,766] Sample trial#11 with GPSampler.
[I 2025-12-02 13:36:48,527] Trial 11 finished with value: 0.1707627643283001 and parameters: {'max_iter': 200, 'learning_rate': 0.09445790108290725, 'max_depth': 2, 'min_samples_leaf': 1, 'l2_regularization': 0.0}. Best is trial 10 with value: 0.17163003276227431.
[D 2025-12-02 13:36:48,647] Sample trial#12 with GPSampler.
[I 2025-12-02 13:36:49,253] Trial 12 finished with value: 0.1783680210323884 and parameters: {'max_iter': 50, 'learning_rate': 0.020575640176529228, 'max_depth': 4, 'min_samples_leaf': 2, 'l2_regularization': 0.0}. Best is trial 12 with value: 0.1783680210323884.
[D 2025-12-02 13:36:49,374] Sample trial#13 with GPSampler.
[I 2025-12-02 13:36:49,895] Trial 13 finished with value: 0.17384527886311335 and parameters: {'max_iter': 50, 'learning_rate': 0.009, 'max_depth': 4, 'min_samples_leaf': 1, 'l2_regularization': 0.0}. Best is trial 12 with value: 0.1783680210323884.
[D 2025-12-02 13:36:50,015] Sample trial#14 with GPSampler.
[I 2025-12-02 13:36:50,810] Trial 14 finished with value: 0.17033195174464993 and parameters: {'max_iter': 50, 'learning_rate': 0.02161205272755292, 'max_depth': 5, 'min_samples_leaf': 1, 'l2_regularization': 0.0}. Best is trial 12 with value: 0.1783680210323884.
[D 2025-12-02 13:36:50,932] Sample trial#15 with GPSampler.
[I 2025-12-02 13:36:51,420] Trial 15 finished with value: 0.1789912279866127 and parameters: {'max_iter': 50, 'learning_rate': 0.02472260171665954, 'max_depth': 4, 'min_samples_leaf': 1, 'l2_regularization': 0.0}. Best is trial 15 with value: 0.1789912279866127.
[D 2025-12-02 13:36:51,538] Sample trial#16 with GPSampler.
[I 2025-12-02 13:36:52,046] Trial 16 finished with value: 0.17921904432129243 and parameters: {'max_iter': 50, 'learning_rate': 0.03277441326825018, 'max_depth': 3, 'min_samples_leaf': 1, 'l2_regularization': 0.0}. Best is trial 16 with value: 0.17921904432129243.
[D 2025-12-02 13:36:52,164] Sample trial#17 with GPSampler.
[I 2025-12-02 13:36:52,622] Trial 17 finished with value: 0.1755876673967211 and parameters: {'max_iter': 50, 'learning_rate': 0.03970826457549736, 'max_depth': 3, 'min_samples_leaf': 1, 'l2_regularization': 0.0}. Best is trial 16 with value: 0.17921904432129243.
[D 2025-12-02 13:36:52,741] Sample trial#18 with GPSampler.
[I 2025-12-02 13:36:53,353] Trial 18 finished with value: 0.17607072930408865 and parameters: {'max_iter': 50, 'learning_rate': 0.025655040836438554, 'max_depth': 3, 'min_samples_leaf': 1, 'l2_regularization': 0.0}. Best is trial 16 with value: 0.17921904432129243.
[D 2025-12-02 13:36:53,474] Sample trial#19 with GPSampler.
[I 2025-12-02 13:36:54,515] Trial 19 finished with value: 0.15619749279978162 and parameters: {'max_iter': 50, 'learning_rate': 0.1, 'max_depth': 5, 'min_samples_leaf': 1, 'l2_regularization': 0.0}. Best is trial 16 with value: 0.17921904432129243.
[D 2025-12-02 13:36:54,637] Sample trial#20 with GPSampler.
[I 2025-12-02 13:36:55,052] Trial 20 finished with value: 0.1670423608495596 and parameters: {'max_iter': 50, 'learning_rate': 0.032165198206378934, 'max_depth': 3, 'min_samples_leaf': 1, 'l2_regularization': 1.0}. Best is trial 16 with value: 0.17921904432129243.
[D 2025-12-02 13:36:55,170] Sample trial#21 with GPSampler.
[I 2025-12-02 13:36:55,675] Trial 21 finished with value: 0.17466305819493208 and parameters: {'max_iter': 50, 'learning_rate': 0.02858829375415734, 'max_depth': 4, 'min_samples_leaf': 1, 'l2_regularization': 0.0}. Best is trial 16 with value: 0.17921904432129243.
[D 2025-12-02 13:36:55,793] Sample trial#22 with GPSampler.
[I 2025-12-02 13:36:56,351] Trial 22 finished with value: 0.15224055456735347 and parameters: {'max_iter': 50, 'learning_rate': 0.009, 'max_depth': 5, 'min_samples_leaf': 30, 'l2_regularization': 1.0}. Best is trial 16 with value: 0.17921904432129243.
[D 2025-12-02 13:36:56,469] Sample trial#23 with GPSampler.
[I 2025-12-02 13:36:57,220] Trial 23 finished with value: 0.17445377856161332 and parameters: {'max_iter': 200, 'learning_rate': 0.0365406746206467, 'max_depth': 3, 'min_samples_leaf': 1, 'l2_regularization': 0.0}. Best is trial 16 with value: 0.17921904432129243.
[D 2025-12-02 13:36:57,337] Sample trial#24 with GPSampler.
[I 2025-12-02 13:36:57,745] Trial 24 finished with value: 0.17037458012136555 and parameters: {'max_iter': 50, 'learning_rate': 0.06083032385799465, 'max_depth': 2, 'min_samples_leaf': 1, 'l2_regularization': 0.0}. Best is trial 16 with value: 0.17921904432129243.
[D 2025-12-02 13:36:57,870] Sample trial#25 with GPSampler.
[I 2025-12-02 13:36:58,852] Trial 25 finished with value: 0.1765318219856824 and parameters: {'max_iter': 200, 'learning_rate': 0.022644764748315657, 'max_depth': 4, 'min_samples_leaf': 1, 'l2_regularization': 0.0}. Best is trial 16 with value: 0.17921904432129243.
[D 2025-12-02 13:36:58,969] Sample trial#26 with GPSampler.
[I 2025-12-02 13:36:59,376] Trial 26 finished with value: 0.16333081532306032 and parameters: {'max_iter': 50, 'learning_rate': 0.09999999999999999, 'max_depth': 2, 'min_samples_leaf': 30, 'l2_regularization': 0.0}. Best is trial 16 with value: 0.17921904432129243.
[D 2025-12-02 13:36:59,497] Sample trial#27 with GPSampler.
[I 2025-12-02 13:36:59,875] Trial 27 finished with value: 0.16491658588276079 and parameters: {'max_iter': 50, 'learning_rate': 0.1, 'max_depth': 2, 'min_samples_leaf': 1, 'l2_regularization': 1.0}. Best is trial 16 with value: 0.17921904432129243.
[D 2025-12-02 13:36:59,993] Sample trial#28 with GPSampler.
[I 2025-12-02 13:37:01,133] Trial 28 finished with value: 0.17525936169251005 and parameters: {'max_iter': 200, 'learning_rate': 0.04118677159282641, 'max_depth': 4, 'min_samples_leaf': 1, 'l2_regularization': 0.0}. Best is trial 16 with value: 0.17921904432129243.
[D 2025-12-02 13:37:01,260] Sample trial#29 with GPSampler.
[I 2025-12-02 13:37:02,448] Trial 29 finished with value: 0.17848198718724473 and parameters: {'max_iter': 200, 'learning_rate': 0.009, 'max_depth': 4, 'min_samples_leaf': 1, 'l2_regularization': 0.0}. Best is trial 16 with value: 0.17921904432129243.
[I 2025-12-02 13:37:03,006] A new study created in memory with name: histogram_gradient_boosting_fold_5
[D 2025-12-02 13:37:03,006] Sample trial#0 with RandomSampler.
[I 2025-12-02 13:37:03,743] Trial 0 finished with value: 0.1449876869693171 and parameters: {'max_iter': 164, 'learning_rate': 0.09493517126356614, 'max_depth': 3, 'min_samples_leaf': 9, 'l2_regularization': 0.8788723606562803}. Best is trial 0 with value: 0.1449876869693171.
[D 2025-12-02 13:37:03,866] Sample trial#1 with GPSampler.
[I 2025-12-02 13:37:04,285] Trial 1 finished with value: 0.13534663074034717 and parameters: {'max_iter': 74, 'learning_rate': 0.019887669259705722, 'max_depth': 2, 'min_samples_leaf': 30, 'l2_regularization': 0.7751565186984491}. Best is trial 0 with value: 0.1449876869693171.
[D 2025-12-02 13:37:04,410] Sample trial#2 with GPSampler.
[I 2025-12-02 13:37:05,431] Trial 2 finished with value: 0.12994512844146192 and parameters: {'max_iter': 143, 'learning_rate': 0.07889463535711798, 'max_depth': 5, 'min_samples_leaf': 22, 'l2_regularization': 0.18858020726201163}. Best is trial 0 with value: 0.1449876869693171.
[D 2025-12-02 13:37:05,557] Sample trial#3 with GPSampler.
[I 2025-12-02 13:37:06,685] Trial 3 finished with value: 0.13729915556077354 and parameters: {'max_iter': 124, 'learning_rate': 0.05268967522663361, 'max_depth': 5, 'min_samples_leaf': 4, 'l2_regularization': 0.4788470199071446}. Best is trial 0 with value: 0.1449876869693171.
[D 2025-12-02 13:37:06,812] Sample trial#4 with GPSampler.
[I 2025-12-02 13:37:08,041] Trial 4 finished with value: 0.14712692741615788 and parameters: {'max_iter': 144, 'learning_rate': 0.025493869644790543, 'max_depth': 5, 'min_samples_leaf': 9, 'l2_regularization': 0.35124372065697884}. Best is trial 4 with value: 0.14712692741615788.
[D 2025-12-02 13:37:08,166] Sample trial#5 with GPSampler.
[I 2025-12-02 13:37:08,711] Trial 5 finished with value: 0.14841781198206688 and parameters: {'max_iter': 153, 'learning_rate': 0.06042541061826411, 'max_depth': 2, 'min_samples_leaf': 21, 'l2_regularization': 0.9782114870091748}. Best is trial 5 with value: 0.14841781198206688.
[D 2025-12-02 13:37:08,837] Sample trial#6 with GPSampler.
[I 2025-12-02 13:37:09,522] Trial 6 finished with value: 0.15046739181181734 and parameters: {'max_iter': 170, 'learning_rate': 0.09397834855943384, 'max_depth': 3, 'min_samples_leaf': 27, 'l2_regularization': 0.8505310008527959}. Best is trial 6 with value: 0.15046739181181734.
[D 2025-12-02 13:37:09,642] Sample trial#7 with GPSampler.
[I 2025-12-02 13:37:10,260] Trial 7 finished with value: 0.15221014783349815 and parameters: {'max_iter': 131, 'learning_rate': 0.05007899205013411, 'max_depth': 3, 'min_samples_leaf': 20, 'l2_regularization': 0.18887260785680116}. Best is trial 7 with value: 0.15221014783349815.
[D 2025-12-02 13:37:10,383] Sample trial#8 with GPSampler.
[I 2025-12-02 13:37:11,032] Trial 8 finished with value: 0.1477518509698143 and parameters: {'max_iter': 96, 'learning_rate': 0.012253869353362267, 'max_depth': 4, 'min_samples_leaf': 28, 'l2_regularization': 0.18273877183894183}. Best is trial 7 with value: 0.15221014783349815.
[D 2025-12-02 13:37:11,155] Sample trial#9 with GPSampler.
[I 2025-12-02 13:37:12,145] Trial 9 finished with value: 0.147255216608941 and parameters: {'max_iter': 177, 'learning_rate': 0.03367704372773102, 'max_depth': 4, 'min_samples_leaf': 13, 'l2_regularization': 0.7709688635622055}. Best is trial 7 with value: 0.15221014783349815.
[D 2025-12-02 13:37:12,270] Sample trial#10 with GPSampler.
[I 2025-12-02 13:37:13,368] Trial 10 finished with value: 0.14587547488203606 and parameters: {'max_iter': 200, 'learning_rate': 0.061915035454715245, 'max_depth': 3, 'min_samples_leaf': 30, 'l2_regularization': 0.09562075789781188}. Best is trial 7 with value: 0.15221014783349815.
[D 2025-12-02 13:37:13,495] Sample trial#11 with GPSampler.
[I 2025-12-02 13:37:14,162] Trial 11 finished with value: 0.1508684460205819 and parameters: {'max_iter': 128, 'learning_rate': 0.09455735880669656, 'max_depth': 2, 'min_samples_leaf': 30, 'l2_regularization': 0.5265507172970265}. Best is trial 7 with value: 0.15221014783349815.
[D 2025-12-02 13:37:14,289] Sample trial#12 with GPSampler.
[I 2025-12-02 13:37:15,094] Trial 12 finished with value: 0.14925544373566954 and parameters: {'max_iter': 139, 'learning_rate': 0.03580610490001321, 'max_depth': 3, 'min_samples_leaf': 2, 'l2_regularization': 0.0}. Best is trial 7 with value: 0.15221014783349815.
[D 2025-12-02 13:37:15,222] Sample trial#13 with GPSampler.
[I 2025-12-02 13:37:15,893] Trial 13 finished with value: 0.1485196957842184 and parameters: {'max_iter': 200, 'learning_rate': 0.1, 'max_depth': 2, 'min_samples_leaf': 30, 'l2_regularization': 0.9999999999999999}. Best is trial 7 with value: 0.15221014783349815.
[D 2025-12-02 13:37:16,019] Sample trial#14 with GPSampler.
[I 2025-12-02 13:37:16,610] Trial 14 finished with value: 0.14756923541104996 and parameters: {'max_iter': 97, 'learning_rate': 0.07254599026532794, 'max_depth': 3, 'min_samples_leaf': 30, 'l2_regularization': 0.6387604558927137}. Best is trial 7 with value: 0.15221014783349815.
[D 2025-12-02 13:37:16,737] Sample trial#15 with GPSampler.
[I 2025-12-02 13:37:17,325] Trial 15 finished with value: 0.15122037998515764 and parameters: {'max_iter': 135, 'learning_rate': 0.06919913286331345, 'max_depth': 2, 'min_samples_leaf': 23, 'l2_regularization': 0.0}. Best is trial 7 with value: 0.15221014783349815.
[D 2025-12-02 13:37:17,447] Sample trial#16 with GPSampler.
[I 2025-12-02 13:37:18,384] Trial 16 finished with value: 0.14863666094476993 and parameters: {'max_iter': 166, 'learning_rate': 0.009, 'max_depth': 4, 'min_samples_leaf': 22, 'l2_regularization': 0.0}. Best is trial 7 with value: 0.15221014783349815.
[D 2025-12-02 13:37:18,507] Sample trial#17 with GPSampler.
[I 2025-12-02 13:37:19,120] Trial 17 finished with value: 0.15427117182829542 and parameters: {'max_iter': 159, 'learning_rate': 0.1, 'max_depth': 2, 'min_samples_leaf': 30, 'l2_regularization': 0.0}. Best is trial 17 with value: 0.15427117182829542.
[D 2025-12-02 13:37:19,242] Sample trial#18 with GPSampler.
[I 2025-12-02 13:37:21,095] Trial 18 finished with value: 0.14740010575762189 and parameters: {'max_iter': 200, 'learning_rate': 0.009, 'max_depth': 5, 'min_samples_leaf': 1, 'l2_regularization': 1.0}. Best is trial 17 with value: 0.15427117182829542.
[D 2025-12-02 13:37:21,215] Sample trial#19 with GPSampler.
[I 2025-12-02 13:37:21,909] Trial 19 finished with value: 0.13850869318096365 and parameters: {'max_iter': 147, 'learning_rate': 0.1, 'max_depth': 3, 'min_samples_leaf': 30, 'l2_regularization': 0.0}. Best is trial 17 with value: 0.15427117182829542.
[D 2025-12-02 13:37:22,034] Sample trial#20 with GPSampler.
[I 2025-12-02 13:37:22,793] Trial 20 finished with value: 0.1497250217408116 and parameters: {'max_iter': 200, 'learning_rate': 0.1, 'max_depth': 2, 'min_samples_leaf': 17, 'l2_regularization': 0.0}. Best is trial 17 with value: 0.15427117182829542.
[D 2025-12-02 13:37:22,911] Sample trial#21 with GPSampler.
[I 2025-12-02 13:37:23,353] Trial 21 finished with value: 0.1460842248278721 and parameters: {'max_iter': 50, 'learning_rate': 0.1, 'max_depth': 2, 'min_samples_leaf': 30, 'l2_regularization': 0.0}. Best is trial 17 with value: 0.15427117182829542.
[D 2025-12-02 13:37:23,479] Sample trial#22 with GPSampler.
[I 2025-12-02 13:37:24,141] Trial 22 finished with value: 0.14837992538665867 and parameters: {'max_iter': 181, 'learning_rate': 0.08821532512770025, 'max_depth': 2, 'min_samples_leaf': 30, 'l2_regularization': 0.1678304826774287}. Best is trial 17 with value: 0.15427117182829542.
[D 2025-12-02 13:37:24,265] Sample trial#23 with GPSampler.
[I 2025-12-02 13:37:25,008] Trial 23 finished with value: 0.1479945929973279 and parameters: {'max_iter': 136, 'learning_rate': 0.1, 'max_depth': 2, 'min_samples_leaf': 20, 'l2_regularization': 0.0}. Best is trial 17 with value: 0.15427117182829542.
[D 2025-12-02 13:37:25,133] Sample trial#24 with GPSampler.
[I 2025-12-02 13:37:25,852] Trial 24 finished with value: 0.14534516418453702 and parameters: {'max_iter': 106, 'learning_rate': 0.05019737886518811, 'max_depth': 2, 'min_samples_leaf': 17, 'l2_regularization': 0.0}. Best is trial 17 with value: 0.15427117182829542.
[D 2025-12-02 13:37:25,973] Sample trial#25 with GPSampler.
[I 2025-12-02 13:37:27,154] Trial 25 finished with value: 0.15116598764450653 and parameters: {'max_iter': 158, 'learning_rate': 0.1, 'max_depth': 2, 'min_samples_leaf': 30, 'l2_regularization': 0.7232425088820373}. Best is trial 17 with value: 0.15427117182829542.
[D 2025-12-02 13:37:27,275] Sample trial#26 with GPSampler.
[I 2025-12-02 13:37:28,272] Trial 26 finished with value: 0.15336149730040316 and parameters: {'max_iter': 200, 'learning_rate': 0.1, 'max_depth': 2, 'min_samples_leaf': 30, 'l2_regularization': 0.0}. Best is trial 17 with value: 0.15427117182829542.
[D 2025-12-02 13:37:28,396] Sample trial#27 with GPSampler.
[I 2025-12-02 13:37:29,007] Trial 27 finished with value: 0.1382315022147067 and parameters: {'max_iter': 50, 'learning_rate': 0.009, 'max_depth': 5, 'min_samples_leaf': 1, 'l2_regularization': 0.0}. Best is trial 17 with value: 0.15427117182829542.
[D 2025-12-02 13:37:29,132] Sample trial#28 with GPSampler.
[I 2025-12-02 13:37:30,831] Trial 28 finished with value: 0.1480469983594524 and parameters: {'max_iter': 200, 'learning_rate': 0.009, 'max_depth': 5, 'min_samples_leaf': 30, 'l2_regularization': 0.7086620349913996}. Best is trial 17 with value: 0.15427117182829542.
[D 2025-12-02 13:37:30,958] Sample trial#29 with GPSampler.
