[I 2025-12-02 11:49:04,192] Trial 14 finished with value: 0.08914689403921186 and parameters: {'max_depth': 3, 'min_samples_split': 11, 'min_samples_leaf': 15, 'criterion': 'gini', 'max_features': None, 'splitter': 'best'}. Best is trial 0 with value: 0.10142993309909873.
[D 2025-12-02 11:49:04,276] Sample trial#15 with TPESampler.
[I 2025-12-02 11:49:04,377] Trial 15 finished with value: 0.099792523143751 and parameters: {'max_depth': 12, 'min_samples_split': 7, 'min_samples_leaf': 17, 'criterion': 'gini', 'max_features': None, 'splitter': 'random'}. Best is trial 0 with value: 0.10142993309909873.
[D 2025-12-02 11:49:04,459] Sample trial#16 with TPESampler.
[I 2025-12-02 11:49:04,564] Trial 16 finished with value: 0.08302521042821664 and parameters: {'max_depth': 14, 'min_samples_split': 11, 'min_samples_leaf': 17, 'criterion': 'gini', 'max_features': None, 'splitter': 'random'}. Best is trial 0 with value: 0.10142993309909873.
[D 2025-12-02 11:49:04,647] Sample trial#17 with TPESampler.
[I 2025-12-02 11:49:04,698] Trial 17 finished with value: 0.08553085079708941 and parameters: {'max_depth': 13, 'min_samples_split': 7, 'min_samples_leaf': 17, 'criterion': 'entropy', 'max_features': 'sqrt', 'splitter': 'random'}. Best is trial 0 with value: 0.10142993309909873.
[D 2025-12-02 11:49:04,780] Sample trial#18 with TPESampler.
[I 2025-12-02 11:49:04,900] Trial 18 finished with value: 0.08957685112269831 and parameters: {'max_depth': 21, 'min_samples_split': 6, 'min_samples_leaf': 17, 'criterion': 'log_loss', 'max_features': None, 'splitter': 'random'}. Best is trial 0 with value: 0.10142993309909873.
[D 2025-12-02 11:49:04,982] Sample trial#19 with TPESampler.
[I 2025-12-02 11:49:05,032] Trial 19 finished with value: 0.08159807977583554 and parameters: {'max_depth': 20, 'min_samples_split': 7, 'min_samples_leaf': 18, 'criterion': 'gini', 'max_features': 'log2', 'splitter': 'random'}. Best is trial 0 with value: 0.10142993309909873.
[D 2025-12-02 11:49:05,115] Sample trial#20 with TPESampler.
[I 2025-12-02 11:49:05,194] Trial 20 finished with value: 0.0916955257956735 and parameters: {'max_depth': 7, 'min_samples_split': 6, 'min_samples_leaf': 20, 'criterion': 'gini', 'max_features': None, 'splitter': 'random'}. Best is trial 0 with value: 0.10142993309909873.
[D 2025-12-02 11:49:05,293] Sample trial#21 with TPESampler.
[I 2025-12-02 11:49:05,355] Trial 21 finished with value: 0.08277552904256376 and parameters: {'max_depth': 4, 'min_samples_split': 9, 'min_samples_leaf': 15, 'criterion': 'log_loss', 'max_features': None, 'splitter': 'random'}. Best is trial 0 with value: 0.10142993309909873.
[D 2025-12-02 11:49:05,436] Sample trial#22 with TPESampler.
[I 2025-12-02 11:49:05,481] Trial 22 finished with value: 0.0962588086485943 and parameters: {'max_depth': 10, 'min_samples_split': 8, 'min_samples_leaf': 17, 'criterion': 'log_loss', 'max_features': 'log2', 'splitter': 'random'}. Best is trial 0 with value: 0.10142993309909873.
[D 2025-12-02 11:49:05,565] Sample trial#23 with TPESampler.
[I 2025-12-02 11:49:05,613] Trial 23 finished with value: 0.08461248723819535 and parameters: {'max_depth': 14, 'min_samples_split': 10, 'min_samples_leaf': 16, 'criterion': 'log_loss', 'max_features': 'log2', 'splitter': 'random'}. Best is trial 0 with value: 0.10142993309909873.
[D 2025-12-02 11:49:05,696] Sample trial#24 with TPESampler.
[I 2025-12-02 11:49:05,803] Trial 24 finished with value: 0.08175873027284425 and parameters: {'max_depth': 15, 'min_samples_split': 6, 'min_samples_leaf': 15, 'criterion': 'gini', 'max_features': None, 'splitter': 'random'}. Best is trial 0 with value: 0.10142993309909873.
[D 2025-12-02 11:49:05,887] Sample trial#25 with TPESampler.
[I 2025-12-02 11:49:05,935] Trial 25 finished with value: 0.08566474335838399 and parameters: {'max_depth': 11, 'min_samples_split': 7, 'min_samples_leaf': 18, 'criterion': 'log_loss', 'max_features': 'sqrt', 'splitter': 'random'}. Best is trial 0 with value: 0.10142993309909873.
[D 2025-12-02 11:49:06,019] Sample trial#26 with TPESampler.
[I 2025-12-02 11:49:06,064] Trial 26 finished with value: 0.08330050327239909 and parameters: {'max_depth': 8, 'min_samples_split': 5, 'min_samples_leaf': 16, 'criterion': 'entropy', 'max_features': 'log2', 'splitter': 'random'}. Best is trial 0 with value: 0.10142993309909873.
[D 2025-12-02 11:49:06,148] Sample trial#27 with TPESampler.
[I 2025-12-02 11:49:06,191] Trial 27 finished with value: 0.08273016563583337 and parameters: {'max_depth': 8, 'min_samples_split': 5, 'min_samples_leaf': 17, 'criterion': 'log_loss', 'max_features': 'log2', 'splitter': 'random'}. Best is trial 0 with value: 0.10142993309909873.
[D 2025-12-02 11:49:06,274] Sample trial#28 with TPESampler.
[I 2025-12-02 11:49:07,435] Trial 28 finished with value: 0.09274256836731284 and parameters: {'max_depth': 9, 'min_samples_split': 12, 'min_samples_leaf': 18, 'criterion': 'entropy', 'max_features': None, 'splitter': 'best'}. Best is trial 0 with value: 0.10142993309909873.
[D 2025-12-02 11:49:07,519] Sample trial#29 with TPESampler.
[I 2025-12-02 11:49:07,619] Trial 29 finished with value: 0.09051080996563025 and parameters: {'max_depth': 12, 'min_samples_split': 10, 'min_samples_leaf': 17, 'criterion': 'log_loss', 'max_features': None, 'splitter': 'random'}. Best is trial 0 with value: 0.10142993309909873.
CLASSIFICAÇÃO DE GENES-ALVO USANDO DADOS ÔMICOS
================================================================================
Timestamp do experimento: 20251202_114155
 Usando dados da ANA:
   Features: data/UNION_features.tsv
   Labels: data/processed/UNION_labels.tsv
   Formato labels: genes, 2class (binary), 3class (multiclass)

Arquivos encontrados com sucesso!
Carregando e preparando dados...
============================================================
PREPARANDO DATASET PARA CLASSIFICAÇÃO (BINARY)
============================================================
Carregando UNION_features.tsv
Features carregadas: 19602 genes x 64 features
Tipos de dados das features: {dtype('float64'): 64}
Range das features: [0.0000, 1.0000]
----------------------------------------
Carregando UNION_labels.tsv (classificação: binary)
Labels carregados: 19680 genes
Valores únicos em 2class: label
0.0    16727
NaN     1997
1.0      956
Name: count, dtype: int64
Genes with NaN dropped: 1997
Distribuição das classes:
  Classe 0 (passenger): 16727 genes
  Classe 1 (cancer): 956 genes
  Razão cancer/passenger: 0.0572
----------------------------------------
Alinhando features e labels
Genes comuns entre features e labels: 17676
Dataset final: 17676 genes x 64 features
Distribuição final das classes: [16727   949]
----------------------------------------
DATASET PREPARADO COM SUCESSO!
Shape final: X=(17676, 64), y=(17676,)
Genes: 17676
Features: 64
============================================================

CONFIGURAÇÃO DO EXPERIMENTO (OTIMIZAÇÃO):
  Executando: Todos os modelos
  Trials por modelo: 30
  Tipo: binary
  Parâmetros: Reduzido
  Balanceamento: none
INICIANDO EXPERIMENTAÇÃO COM TODOS OS MODELOS
Dataset: 17676 amostras x 64 features
Número de trials por modelo: 30
Conjunto de parâmetros: Reduzido
Progresso: 1/9 modelos
================================================================================
EXECUTANDO MODELO: K-Nearest Neighbors
================================================================================

Starting Nested Cross-Validation for k_nearest_neighbors...
Configuration: 5 outer folds, 30 trials per fold
Performing 80/20 holdout split...
Holdout split completed:
  - Training set: 14140 samples (80%)
  - Holdout test set: 3536 samples (20%)
Fold 1
Importâncias dos parâmetros para fold 1: {'p': np.float64(0.5535494486921116), 'n_neighbors': np.float64(0.42989873617272284), 'algorithm': np.float64(0.013653586878564824), 'leaf_size': np.float64(0.0028982282566007026)}
Saved Optuna plots to results/20251202_114155_ana_optimized_binary_less/k_nearest_neighbors/optuna_plots
Fold 2
Importâncias dos parâmetros para fold 2: {'p': np.float64(0.8419698894064483), 'n_neighbors': np.float64(0.13831272050826496), 'leaf_size': np.float64(0.012348003832284356), 'algorithm': np.float64(0.007369386253002314)}
Saved Optuna plots to results/20251202_114155_ana_optimized_binary_less/k_nearest_neighbors/optuna_plots
Fold 3
Importâncias dos parâmetros para fold 3: {'p': np.float64(0.9423521036818825), 'n_neighbors': np.float64(0.05004368114676512), 'algorithm': np.float64(0.005250387565811882), 'leaf_size': np.float64(0.002353827605540453)}
Saved Optuna plots to results/20251202_114155_ana_optimized_binary_less/k_nearest_neighbors/optuna_plots
Fold 4
Importâncias dos parâmetros para fold 4: {'p': np.float64(0.9027069740919056), 'n_neighbors': np.float64(0.0724262073748655), 'algorithm': np.float64(0.01753118295023908), 'leaf_size': np.float64(0.007335635582989969)}
Saved Optuna plots to results/20251202_114155_ana_optimized_binary_less/k_nearest_neighbors/optuna_plots
Fold 5
Importâncias dos parâmetros para fold 5: {'p': np.float64(0.837742203547362), 'n_neighbors': np.float64(0.15091811697628948), 'algorithm': np.float64(0.0058102168087415616), 'leaf_size': np.float64(0.005529462667607105)}
Saved Optuna plots to results/20251202_114155_ana_optimized_binary_less/k_nearest_neighbors/optuna_plots

Nested CV completed. The 20% holdout set (3536 samples) remains untouched.
This holdout set can be used for final unbiased evaluation.

Training and evaluating 5 best parameter sets on holdout data...
Testing with 4 balancing strategies: none, randomundersampler, smoteenn, tomeklinks

Evaluating fold 1 best params on holdout set...
  - Testing with balance strategy: none
  - Testing with balance strategy: randomundersampler
  - Testing with balance strategy: smoteenn
  - Testing with balance strategy: tomeklinks

Evaluating fold 2 best params on holdout set...
  - Testing with balance strategy: none
  - Testing with balance strategy: randomundersampler
  - Testing with balance strategy: smoteenn
  - Testing with balance strategy: tomeklinks

Evaluating fold 3 best params on holdout set...
  - Testing with balance strategy: none
  - Testing with balance strategy: randomundersampler
  - Testing with balance strategy: smoteenn
  - Testing with balance strategy: tomeklinks

Evaluating fold 4 best params on holdout set...
  - Testing with balance strategy: none
  - Testing with balance strategy: randomundersampler
  - Testing with balance strategy: smoteenn
  - Testing with balance strategy: tomeklinks

Evaluating fold 5 best params on holdout set...
  - Testing with balance strategy: none
  - Testing with balance strategy: randomundersampler
  - Testing with balance strategy: smoteenn
  - Testing with balance strategy: tomeklinks
Saving optimization and holdout results...
Detailed results by fold saved to: ./results/20251202_114155_ana_optimized_binary_less/k_nearest_neighbors/detailed_results_by_fold.txt
Test predictions for all folds saved to: ./results/20251202_114155_ana_optimized_binary_less/k_nearest_neighbors/metrics.json
Saving holdout results...
Holdout evaluation results saved to: ./results/20251202_114155_ana_optimized_binary_less/k_nearest_neighbors/holdout_results.txt
Saved!
[OK] K-Nearest Neighbors executado com sucesso!
Progresso: 2/9 modelos
================================================================================
EXECUTANDO MODELO: Decision Tree
================================================================================

Starting Nested Cross-Validation for decision_tree...
Configuration: 5 outer folds, 30 trials per fold
Performing 80/20 holdout split...
Holdout split completed:
  - Training set: 14140 samples (80%)
  - Holdout test set: 3536 samples (20%)
Fold 1
Importâncias dos parâmetros para fold 1: {'max_depth': np.float64(0.6714371126776288), 'min_samples_leaf': np.float64(0.1013206171015435), 'min_samples_split': np.float64(0.06887852206149445), 'splitter': np.float64(0.055976210293196556), 'criterion': np.float64(0.05592823720003124), 'max_features': np.float64(0.046459300666105534)}
Saved Optuna plots to results/20251202_114155_ana_optimized_binary_less/decision_tree/optuna_plots
Fold 2
Importâncias dos parâmetros para fold 2: {'max_depth': np.float64(0.5861721571486243), 'min_samples_split': np.float64(0.19041000538833688), 'criterion': np.float64(0.0899623783880959), 'splitter': np.float64(0.047434199898106995), 'min_samples_leaf': np.float64(0.047407293457392356), 'max_features': np.float64(0.03861396571944377)}
Saved Optuna plots to results/20251202_114155_ana_optimized_binary_less/decision_tree/optuna_plots
Fold 3
Importâncias dos parâmetros para fold 3: {'min_samples_split': np.float64(0.452207461749955), 'max_depth': np.float64(0.33274486036955636), 'max_features': np.float64(0.0874751789060266), 'criterion': np.float64(0.08093791958789834), 'splitter': np.float64(0.02430225420883264), 'min_samples_leaf': np.float64(0.022332325177731087)}
Saved Optuna plots to results/20251202_114155_ana_optimized_binary_less/decision_tree/optuna_plots
Fold 4
Importâncias dos parâmetros para fold 4: {'max_depth': np.float64(0.5380553472682132), 'splitter': np.float64(0.1938321436777901), 'max_features': np.float64(0.1176328793423784), 'min_samples_split': np.float64(0.05258062907649501), 'criterion': np.float64(0.05061833705141772), 'min_samples_leaf': np.float64(0.047280663583705466)}
Saved Optuna plots to results/20251202_114155_ana_optimized_binary_less/decision_tree/optuna_plots
Fold 5
[I 2025-12-02 11:49:12,868] A new study created in memory with name: random_forest_fold_1
[D 2025-12-02 11:49:12,868] Sample trial#0 with RandomSampler.
[I 2025-12-02 11:49:25,141] Trial 0 finished with value: 0.15101831314360809 and parameters: {'n_estimators': 225, 'max_depth': 12, 'min_samples_split': 19, 'min_samples_leaf': 23, 'max_features': None, 'criterion': 'entropy', 'bootstrap': True}. Best is trial 0 with value: 0.15101831314360809.
[D 2025-12-02 11:49:25,238] Sample trial#1 with TPESampler.
[I 2025-12-02 11:49:27,331] Trial 1 finished with value: 0.15504173081474626 and parameters: {'n_estimators': 200, 'max_depth': 18, 'min_samples_split': 9, 'min_samples_leaf': 21, 'max_features': 'sqrt', 'criterion': 'log_loss', 'bootstrap': True}. Best is trial 1 with value: 0.15504173081474626.
[D 2025-12-02 11:49:27,417] Sample trial#2 with TPESampler.
[I 2025-12-02 11:49:35,811] Trial 2 finished with value: 0.10476163926353743 and parameters: {'n_estimators': 250, 'max_depth': 3, 'min_samples_split': 7, 'min_samples_leaf': 21, 'max_features': None, 'criterion': 'entropy', 'bootstrap': False}. Best is trial 1 with value: 0.15504173081474626.
[D 2025-12-02 11:49:35,896] Sample trial#3 with TPESampler.
[I 2025-12-02 11:49:54,773] Trial 3 finished with value: 0.08887069491957539 and parameters: {'n_estimators': 175, 'max_depth': 16, 'min_samples_split': 5, 'min_samples_leaf': 19, 'max_features': None, 'criterion': 'entropy', 'bootstrap': False}. Best is trial 1 with value: 0.15504173081474626.
[D 2025-12-02 11:49:54,870] Sample trial#4 with TPESampler.
[I 2025-12-02 11:49:57,222] Trial 4 finished with value: 0.15793926169691758 and parameters: {'n_estimators': 300, 'max_depth': 11, 'min_samples_split': 7, 'min_samples_leaf': 21, 'max_features': 'log2', 'criterion': 'log_loss', 'bootstrap': True}. Best is trial 4 with value: 0.15793926169691758.
[D 2025-12-02 11:49:57,311] Sample trial#5 with TPESampler.
[I 2025-12-02 11:50:24,133] Trial 5 finished with value: 0.0917624321581821 and parameters: {'n_estimators': 250, 'max_depth': 18, 'min_samples_split': 7, 'min_samples_leaf': 23, 'max_features': None, 'criterion': 'log_loss', 'bootstrap': False}. Best is trial 4 with value: 0.15793926169691758.
[D 2025-12-02 11:50:24,226] Sample trial#6 with TPESampler.
[I 2025-12-02 11:50:25,627] Trial 6 finished with value: 0.15945448693685985 and parameters: {'n_estimators': 200, 'max_depth': 5, 'min_samples_split': 15, 'min_samples_leaf': 23, 'max_features': 'log2', 'criterion': 'entropy', 'bootstrap': True}. Best is trial 6 with value: 0.15945448693685985.
[D 2025-12-02 11:50:25,722] Sample trial#7 with TPESampler.
[I 2025-12-02 11:50:31,754] Trial 7 finished with value: 0.1534145079518276 and parameters: {'n_estimators': 125, 'max_depth': 8, 'min_samples_split': 19, 'min_samples_leaf': 25, 'max_features': None, 'criterion': 'log_loss', 'bootstrap': True}. Best is trial 6 with value: 0.15945448693685985.
[D 2025-12-02 11:50:31,839] Sample trial#8 with TPESampler.
[I 2025-12-02 11:50:35,366] Trial 8 finished with value: 0.1565910450063398 and parameters: {'n_estimators': 275, 'max_depth': 19, 'min_samples_split': 7, 'min_samples_leaf': 21, 'max_features': 'log2', 'criterion': 'entropy', 'bootstrap': False}. Best is trial 6 with value: 0.15945448693685985.
[D 2025-12-02 11:50:35,454] Sample trial#9 with TPESampler.
[I 2025-12-02 11:50:36,724] Trial 9 finished with value: 0.1583832067410253 and parameters: {'n_estimators': 100, 'max_depth': 7, 'min_samples_split': 13, 'min_samples_leaf': 19, 'max_features': 'sqrt', 'criterion': 'log_loss', 'bootstrap': False}. Best is trial 6 with value: 0.15945448693685985.
[D 2025-12-02 11:50:36,810] Sample trial#10 with TPESampler.
[I 2025-12-02 11:50:37,826] Trial 10 finished with value: 0.15806676551311927 and parameters: {'n_estimators': 125, 'max_depth': 5, 'min_samples_split': 9, 'min_samples_leaf': 23, 'max_features': 'log2', 'criterion': 'entropy', 'bootstrap': True}. Best is trial 6 with value: 0.15945448693685985.
[D 2025-12-02 11:50:37,912] Sample trial#11 with TPESampler.
[I 2025-12-02 11:50:39,104] Trial 11 finished with value: 0.16034554561950748 and parameters: {'n_estimators': 100, 'max_depth': 6, 'min_samples_split': 13, 'min_samples_leaf': 21, 'max_features': 'sqrt', 'criterion': 'log_loss', 'bootstrap': False}. Best is trial 11 with value: 0.16034554561950748.
[D 2025-12-02 11:50:39,189] Sample trial#12 with TPESampler.
[I 2025-12-02 11:50:40,691] Trial 12 finished with value: 0.16069325707480503 and parameters: {'n_estimators': 200, 'max_depth': 5, 'min_samples_split': 17, 'min_samples_leaf': 21, 'max_features': 'log2', 'criterion': 'entropy', 'bootstrap': False}. Best is trial 12 with value: 0.16069325707480503.
[D 2025-12-02 11:50:40,785] Sample trial#13 with TPESampler.
[I 2025-12-02 11:50:42,007] Trial 13 finished with value: 0.15275649724690105 and parameters: {'n_estimators': 200, 'max_depth': 3, 'min_samples_split': 17, 'min_samples_leaf': 19, 'max_features': 'log2', 'criterion': 'entropy', 'bootstrap': False}. Best is trial 12 with value: 0.16069325707480503.
[D 2025-12-02 11:50:42,096] Sample trial#14 with TPESampler.
[I 2025-12-02 11:50:43,969] Trial 14 finished with value: 0.1587103057900505 and parameters: {'n_estimators': 150, 'max_depth': 12, 'min_samples_split': 15, 'min_samples_leaf': 21, 'max_features': 'log2', 'criterion': 'entropy', 'bootstrap': False}. Best is trial 12 with value: 0.16069325707480503.
[D 2025-12-02 11:50:44,059] Sample trial#15 with TPESampler.
[I 2025-12-02 11:50:45,770] Trial 15 finished with value: 0.15775465543483053 and parameters: {'n_estimators': 275, 'max_depth': 4, 'min_samples_split': 13, 'min_samples_leaf': 23, 'max_features': 'log2', 'criterion': 'log_loss', 'bootstrap': False}. Best is trial 12 with value: 0.16069325707480503.
[D 2025-12-02 11:50:45,866] Sample trial#16 with TPESampler.
[I 2025-12-02 11:50:47,865] Trial 16 finished with value: 0.1595120915091405 and parameters: {'n_estimators': 225, 'max_depth': 9, 'min_samples_split': 19, 'min_samples_leaf': 25, 'max_features': 'log2', 'criterion': 'gini', 'bootstrap': False}. Best is trial 12 with value: 0.16069325707480503.
[D 2025-12-02 11:50:47,958] Sample trial#17 with TPESampler.
[I 2025-12-02 11:50:49,361] Trial 17 finished with value: 0.15848935925773794 and parameters: {'n_estimators': 175, 'max_depth': 4, 'min_samples_split': 13, 'min_samples_leaf': 25, 'max_features': 'sqrt', 'criterion': 'log_loss', 'bootstrap': False}. Best is trial 12 with value: 0.16069325707480503.
[D 2025-12-02 11:50:49,461] Sample trial#18 with TPESampler.
[I 2025-12-02 11:51:12,274] Trial 18 finished with value: 0.09979644007428327 and parameters: {'n_estimators': 275, 'max_depth': 9, 'min_samples_split': 19, 'min_samples_leaf': 17, 'max_features': None, 'criterion': 'entropy', 'bootstrap': False}. Best is trial 12 with value: 0.16069325707480503.
[D 2025-12-02 11:51:12,366] Sample trial#19 with TPESampler.
[I 2025-12-02 11:51:19,092] Trial 19 finished with value: 0.1098246356992388 and parameters: {'n_estimators': 100, 'max_depth': 6, 'min_samples_split': 13, 'min_samples_leaf': 19, 'max_features': None, 'criterion': 'entropy', 'bootstrap': False}. Best is trial 12 with value: 0.16069325707480503.
[D 2025-12-02 11:51:19,178] Sample trial#20 with TPESampler.
[I 2025-12-02 11:51:20,925] Trial 20 finished with value: 0.15587323538621733 and parameters: {'n_estimators': 100, 'max_depth': 15, 'min_samples_split': 13, 'min_samples_leaf': 25, 'max_features': 'sqrt', 'criterion': 'log_loss', 'bootstrap': False}. Best is trial 12 with value: 0.16069325707480503.
[D 2025-12-02 11:51:21,010] Sample trial#21 with TPESampler.
[I 2025-12-02 11:51:22,473] Trial 21 finished with value: 0.15523600374027574 and parameters: {'n_estimators': 200, 'max_depth': 10, 'min_samples_split': 19, 'min_samples_leaf': 25, 'max_features': 'log2', 'criterion': 'gini', 'bootstrap': True}. Best is trial 12 with value: 0.16069325707480503.
[D 2025-12-02 11:51:22,563] Sample trial#22 with TPESampler.
[I 2025-12-02 11:51:24,906] Trial 22 finished with value: 0.15507235770988825 and parameters: {'n_estimators': 250, 'max_depth': 11, 'min_samples_split': 19, 'min_samples_leaf': 23, 'max_features': 'log2', 'criterion': 'gini', 'bootstrap': False}. Best is trial 12 with value: 0.16069325707480503.
[D 2025-12-02 11:51:24,997] Sample trial#23 with TPESampler.
