[I 2025-12-02 13:46:04,670] Trial 29 finished with value: 0.16377589124707292 and parameters: {'n_estimators': 350, 'learning_rate': 0.009, 'max_depth': 20, 'min_child_weight': 8, 'subsample': 0.9, 'colsample_bytree': 0.4, 'reg_alpha': 0.0, 'reg_lambda': 1.0, 'gamma': 5.0, 'scale_pos_weight': 5.0}. Best is trial 25 with value: 0.16568515384008017.
[I 2025-12-02 13:46:10,557] A new study created in memory with name: xgboost_fold_2
[D 2025-12-02 13:46:10,558] Sample trial#0 with RandomSampler.
[I 2025-12-02 13:46:26,735] Trial 0 finished with value: 0.13391125297952086 and parameters: {'n_estimators': 650, 'learning_rate': 0.07333904101235107, 'max_depth': 10, 'min_child_weight': 10, 'subsample': 0.9792204169549636, 'colsample_bytree': 0.4155004134378104, 'reg_alpha': 0.9078435015395914, 'reg_lambda': 7.647038838128775, 'gamma': 2.0, 'scale_pos_weight': 5.919613992820274}. Best is trial 0 with value: 0.13391125297952086.
[D 2025-12-02 13:46:26,866] Sample trial#1 with GPSampler.
[I 2025-12-02 13:46:39,236] Trial 1 finished with value: 0.13370874042371889 and parameters: {'n_estimators': 500, 'learning_rate': 0.03329166733284852, 'max_depth': 18, 'min_child_weight': 3, 'subsample': 0.907833593185602, 'colsample_bytree': 0.5402735959785475, 'reg_alpha': 0.7158365689312592, 'reg_lambda': 6.409035790878156, 'gamma': 2.0, 'scale_pos_weight': 5.781188286691815}. Best is trial 0 with value: 0.13391125297952086.
[D 2025-12-02 13:46:39,369] Sample trial#2 with GPSampler.
[I 2025-12-02 13:46:52,996] Trial 2 finished with value: 0.14721889605104094 and parameters: {'n_estimators': 750, 'learning_rate': 0.016116823676389558, 'max_depth': 16, 'min_child_weight': 1, 'subsample': 0.9151489036897051, 'colsample_bytree': 0.4694876218674586, 'reg_alpha': 0.9575414402881154, 'reg_lambda': 4.036398088380553, 'gamma': 4.0, 'scale_pos_weight': 5.226929581476482}. Best is trial 2 with value: 0.14721889605104094.
[D 2025-12-02 13:46:53,128] Sample trial#3 with GPSampler.
[I 2025-12-02 13:47:09,343] Trial 3 finished with value: 0.14000062033808766 and parameters: {'n_estimators': 550, 'learning_rate': 0.031641376763204915, 'max_depth': 16, 'min_child_weight': 9, 'subsample': 0.9591041291650374, 'colsample_bytree': 0.5187452447036887, 'reg_alpha': 0.23495800501586606, 'reg_lambda': 5.785956589629657, 'gamma': 2.0, 'scale_pos_weight': 5.573177780469863}. Best is trial 2 with value: 0.14721889605104094.
[D 2025-12-02 13:47:09,476] Sample trial#4 with GPSampler.
[I 2025-12-02 13:47:16,710] Trial 4 finished with value: 0.14511742421182072 and parameters: {'n_estimators': 950, 'learning_rate': 0.06154787905410442, 'max_depth': 16, 'min_child_weight': 7, 'subsample': 0.9239764428822455, 'colsample_bytree': 0.42113635015375334, 'reg_alpha': 0.2301647741216878, 'reg_lambda': 3.785797890048154, 'gamma': 5.0, 'scale_pos_weight': 5.446441889499885}. Best is trial 2 with value: 0.14721889605104094.
[D 2025-12-02 13:47:16,838] Sample trial#5 with GPSampler.
[I 2025-12-02 13:47:22,286] Trial 5 finished with value: 0.151341919332297 and parameters: {'n_estimators': 150, 'learning_rate': 0.028781723715766594, 'max_depth': 4, 'min_child_weight': 10, 'subsample': 0.9761607626901624, 'colsample_bytree': 0.554700988543093, 'reg_alpha': 0.5445254258536885, 'reg_lambda': 8.955556908487416, 'gamma': 1.0, 'scale_pos_weight': 5.375569111783327}. Best is trial 5 with value: 0.151341919332297.
[D 2025-12-02 13:47:22,415] Sample trial#6 with GPSampler.
[I 2025-12-02 13:47:29,824] Trial 6 finished with value: 0.14276457575882645 and parameters: {'n_estimators': 700, 'learning_rate': 0.03375080568023813, 'max_depth': 10, 'min_child_weight': 9, 'subsample': 0.9591046641288935, 'colsample_bytree': 0.40966715024127387, 'reg_alpha': 0.7536856901553928, 'reg_lambda': 3.8557647182121784, 'gamma': 5.0, 'scale_pos_weight': 5.925407545300937}. Best is trial 5 with value: 0.151341919332297.
[D 2025-12-02 13:47:29,953] Sample trial#7 with GPSampler.
[I 2025-12-02 13:47:47,284] Trial 7 finished with value: 0.12734241294303555 and parameters: {'n_estimators': 950, 'learning_rate': 0.025170865594664825, 'max_depth': 6, 'min_child_weight': 2, 'subsample': 0.9939218266931127, 'colsample_bytree': 0.4627343472143191, 'reg_alpha': 0.09494661850805641, 'reg_lambda': 3.0305126575921655, 'gamma': 0.0, 'scale_pos_weight': 5.100892360264346}. Best is trial 5 with value: 0.151341919332297.
[D 2025-12-02 13:47:47,417] Sample trial#8 with GPSampler.
[I 2025-12-02 13:47:52,633] Trial 8 finished with value: 0.1442994834026401 and parameters: {'n_estimators': 550, 'learning_rate': 0.0934262759014632, 'max_depth': 2, 'min_child_weight': 10, 'subsample': 0.991527851482286, 'colsample_bytree': 0.577076402667387, 'reg_alpha': 0.4878014284860793, 'reg_lambda': 7.490529633772365, 'gamma': 1.0, 'scale_pos_weight': 5.127354326312865}. Best is trial 5 with value: 0.151341919332297.
[D 2025-12-02 13:47:52,763] Sample trial#9 with GPSampler.
[I 2025-12-02 13:48:36,214] Trial 9 finished with value: 0.11707257928013007 and parameters: {'n_estimators': 800, 'learning_rate': 0.026792114596925064, 'max_depth': 14, 'min_child_weight': 10, 'subsample': 0.9100914807044991, 'colsample_bytree': 0.41099439805951943, 'reg_alpha': 0.19238331193997027, 'reg_lambda': 2.336760366044372, 'gamma': 0.0, 'scale_pos_weight': 5.423228428294797}. Best is trial 5 with value: 0.151341919332297.
[D 2025-12-02 13:48:36,346] Sample trial#10 with GPSampler.
[I 2025-12-02 13:48:42,474] Trial 10 finished with value: 0.13517649701326095 and parameters: {'n_estimators': 100, 'learning_rate': 0.01074863330829638, 'max_depth': 2, 'min_child_weight': 10, 'subsample': 1.0, 'colsample_bytree': 0.5882444523481838, 'reg_alpha': 0.4309233335079868, 'reg_lambda': 10.0, 'gamma': 2.0, 'scale_pos_weight': 5.156247074862313}. Best is trial 5 with value: 0.151341919332297.
[D 2025-12-02 13:48:42,603] Sample trial#11 with GPSampler.
[I 2025-12-02 13:48:48,264] Trial 11 finished with value: 0.1448717555776086 and parameters: {'n_estimators': 100, 'learning_rate': 0.04138920649478795, 'max_depth': 2, 'min_child_weight': 10, 'subsample': 0.9746591513924796, 'colsample_bytree': 0.5490192388112717, 'reg_alpha': 0.6428372744270957, 'reg_lambda': 9.545711188119025, 'gamma': 0.0, 'scale_pos_weight': 5.516471185698402}. Best is trial 5 with value: 0.151341919332297.
[D 2025-12-02 13:48:48,391] Sample trial#12 with GPSampler.
[I 2025-12-02 13:48:53,903] Trial 12 finished with value: 0.149990302010726 and parameters: {'n_estimators': 100, 'learning_rate': 0.03930426135835111, 'max_depth': 4, 'min_child_weight': 10, 'subsample': 0.962035888912264, 'colsample_bytree': 0.5345329400871659, 'reg_alpha': 0.8700506175984019, 'reg_lambda': 8.542455922617428, 'gamma': 1.0, 'scale_pos_weight': 5.151624359193549}. Best is trial 5 with value: 0.151341919332297.
[D 2025-12-02 13:48:54,033] Sample trial#13 with GPSampler.
[I 2025-12-02 13:48:59,554] Trial 13 finished with value: 0.1507583388892116 and parameters: {'n_estimators': 100, 'learning_rate': 0.04817158742034066, 'max_depth': 4, 'min_child_weight': 10, 'subsample': 0.9585476556470875, 'colsample_bytree': 0.5348281359572883, 'reg_alpha': 0.023559938580325675, 'reg_lambda': 9.784852233911053, 'gamma': 1.0, 'scale_pos_weight': 5.352731019086833}. Best is trial 5 with value: 0.151341919332297.
[D 2025-12-02 13:48:59,680] Sample trial#14 with GPSampler.
[I 2025-12-02 13:49:03,568] Trial 14 finished with value: 0.1479848795064396 and parameters: {'n_estimators': 100, 'learning_rate': 0.05062176305371429, 'max_depth': 6, 'min_child_weight': 10, 'subsample': 1.0, 'colsample_bytree': 0.5360362945807482, 'reg_alpha': 0.562666374275171, 'reg_lambda': 10.0, 'gamma': 1.0, 'scale_pos_weight': 5.669288887803941}. Best is trial 5 with value: 0.151341919332297.
[D 2025-12-02 13:49:03,702] Sample trial#15 with GPSampler.
[I 2025-12-02 13:49:06,500] Trial 15 finished with value: 0.1350502984795645 and parameters: {'n_estimators': 100, 'learning_rate': 0.009907824875845858, 'max_depth': 2, 'min_child_weight': 10, 'subsample': 0.9551604466934273, 'colsample_bytree': 0.5486294456674967, 'reg_alpha': 0.012391240686043793, 'reg_lambda': 7.067046634992078, 'gamma': 1.0, 'scale_pos_weight': 5.390011951016305}. Best is trial 5 with value: 0.151341919332297.
[D 2025-12-02 13:49:06,621] Sample trial#16 with GPSampler.
[I 2025-12-02 13:49:18,952] Trial 16 finished with value: 0.1284065571052304 and parameters: {'n_estimators': 300, 'learning_rate': 0.055470571338713665, 'max_depth': 8, 'min_child_weight': 10, 'subsample': 0.9563704700209061, 'colsample_bytree': 0.5858524153091568, 'reg_alpha': 0.6034104153224439, 'reg_lambda': 9.46803355436598, 'gamma': 1.0, 'scale_pos_weight': 5.054726927435374}. Best is trial 5 with value: 0.151341919332297.
[D 2025-12-02 13:49:19,074] Sample trial#17 with GPSampler.
[I 2025-12-02 13:49:23,382] Trial 17 finished with value: 0.14562342170937326 and parameters: {'n_estimators': 200, 'learning_rate': 0.04867582098691279, 'max_depth': 4, 'min_child_weight': 10, 'subsample': 0.9943680401139042, 'colsample_bytree': 0.5237788016939567, 'reg_alpha': 0.6650208075292464, 'reg_lambda': 9.166739288987422, 'gamma': 2.0, 'scale_pos_weight': 5.359683471477374}. Best is trial 5 with value: 0.151341919332297.
[D 2025-12-02 13:49:23,511] Sample trial#18 with GPSampler.
[I 2025-12-02 13:49:32,657] Trial 18 finished with value: 0.1506456665516186 and parameters: {'n_estimators': 100, 'learning_rate': 0.037909241198567104, 'max_depth': 4, 'min_child_weight': 10, 'subsample': 0.9870851147518765, 'colsample_bytree': 0.5040164263927895, 'reg_alpha': 0.07567215820041402, 'reg_lambda': 9.513390774070663, 'gamma': 2.0, 'scale_pos_weight': 5.571909931255096}. Best is trial 5 with value: 0.151341919332297.
[D 2025-12-02 13:49:32,795] Sample trial#19 with GPSampler.
[I 2025-12-02 13:49:37,028] Trial 19 finished with value: 0.14520786461320692 and parameters: {'n_estimators': 100, 'learning_rate': 0.03670635060754125, 'max_depth': 6, 'min_child_weight': 10, 'subsample': 0.9983601161658835, 'colsample_bytree': 0.5164140329152296, 'reg_alpha': 0.2200273751050575, 'reg_lambda': 9.462705498953154, 'gamma': 1.0, 'scale_pos_weight': 5.299242531745719}. Best is trial 5 with value: 0.151341919332297.
[D 2025-12-02 13:49:37,160] Sample trial#20 with GPSampler.
[I 2025-12-02 13:49:42,011] Trial 20 finished with value: 0.14913894605669153 and parameters: {'n_estimators': 100, 'learning_rate': 0.03726262175792043, 'max_depth': 2, 'min_child_weight': 10, 'subsample': 0.9491663189049814, 'colsample_bytree': 0.543585812360522, 'reg_alpha': 0.5586080274643213, 'reg_lambda': 8.964856011304388, 'gamma': 2.0, 'scale_pos_weight': 5.6963195176321095}. Best is trial 5 with value: 0.151341919332297.
[D 2025-12-02 13:49:42,140] Sample trial#21 with GPSampler.
[I 2025-12-02 13:49:44,763] Trial 21 finished with value: 0.14942998958411663 and parameters: {'n_estimators': 100, 'learning_rate': 0.05233356448698386, 'max_depth': 2, 'min_child_weight': 10, 'subsample': 0.9778809075879983, 'colsample_bytree': 0.5103164128269032, 'reg_alpha': 0.0, 'reg_lambda': 10.0, 'gamma': 2.0, 'scale_pos_weight': 5.870149792265292}. Best is trial 5 with value: 0.151341919332297.
[D 2025-12-02 13:49:44,895] Sample trial#22 with GPSampler.
[I 2025-12-02 13:49:53,116] Trial 22 finished with value: 0.14174825182322598 and parameters: {'n_estimators': 100, 'learning_rate': 0.03347229054037033, 'max_depth': 10, 'min_child_weight': 10, 'subsample': 0.9836014255418971, 'colsample_bytree': 0.5279780946823903, 'reg_alpha': 1.0, 'reg_lambda': 6.694156600353234, 'gamma': 2.0, 'scale_pos_weight': 5.780207406748245}. Best is trial 5 with value: 0.151341919332297.
[D 2025-12-02 13:49:53,252] Sample trial#23 with GPSampler.
[I 2025-12-02 13:49:58,570] Trial 23 finished with value: 0.14735175445132526 and parameters: {'n_estimators': 100, 'learning_rate': 0.03792860350059604, 'max_depth': 4, 'min_child_weight': 10, 'subsample': 0.9552161318965012, 'colsample_bytree': 0.5445659906905516, 'reg_alpha': 0.6356624664469016, 'reg_lambda': 10.0, 'gamma': 1.0, 'scale_pos_weight': 5.8166320203156205}. Best is trial 5 with value: 0.151341919332297.
[D 2025-12-02 13:49:58,708] Sample trial#24 with GPSampler.
[I 2025-12-02 13:50:17,136] Trial 24 finished with value: 0.14532271350765 and parameters: {'n_estimators': 650, 'learning_rate': 0.017514025217115453, 'max_depth': 18, 'min_child_weight': 9, 'subsample': 1.0, 'colsample_bytree': 0.51386971214313, 'reg_alpha': 0.07551323183635196, 'reg_lambda': 4.790261697832232, 'gamma': 5.0, 'scale_pos_weight': 5.297095363071299}. Best is trial 5 with value: 0.151341919332297.
[D 2025-12-02 13:50:17,280] Sample trial#25 with GPSampler.
[I 2025-12-02 13:50:20,168] Trial 25 finished with value: 0.14816136471208086 and parameters: {'n_estimators': 100, 'learning_rate': 0.05072546028401044, 'max_depth': 2, 'min_child_weight': 3, 'subsample': 0.9396449074550944, 'colsample_bytree': 0.6, 'reg_alpha': 0.0, 'reg_lambda': 10.0, 'gamma': 2.0, 'scale_pos_weight': 5.533977886493503}. Best is trial 5 with value: 0.151341919332297.
[D 2025-12-02 13:50:20,314] Sample trial#26 with GPSampler.
[I 2025-12-02 13:50:40,588] Trial 26 finished with value: 0.15020676172677278 and parameters: {'n_estimators': 1000, 'learning_rate': 0.009, 'max_depth': 20, 'min_child_weight': 1, 'subsample': 0.9, 'colsample_bytree': 0.6, 'reg_alpha': 1.0, 'reg_lambda': 1.0, 'gamma': 5.0, 'scale_pos_weight': 5.0}. Best is trial 5 with value: 0.151341919332297.
[D 2025-12-02 13:50:40,716] Sample trial#27 with GPSampler.
[I 2025-12-02 13:50:56,519] Trial 27 finished with value: 0.14429537104104986 and parameters: {'n_estimators': 1000, 'learning_rate': 0.009, 'max_depth': 18, 'min_child_weight': 1, 'subsample': 0.9, 'colsample_bytree': 0.6, 'reg_alpha': 1.0, 'reg_lambda': 10.0, 'gamma': 5.0, 'scale_pos_weight': 5.0}. Best is trial 5 with value: 0.151341919332297.
[D 2025-12-02 13:50:56,643] Sample trial#28 with GPSampler.
[I 2025-12-02 13:51:06,576] Trial 28 finished with value: 0.15098466619455325 and parameters: {'n_estimators': 1000, 'learning_rate': 0.027659961261892213, 'max_depth': 20, 'min_child_weight': 1, 'subsample': 0.9, 'colsample_bytree': 0.4, 'reg_alpha': 1.0, 'reg_lambda': 1.0, 'gamma': 5.0, 'scale_pos_weight': 5.0}. Best is trial 5 with value: 0.151341919332297.
[D 2025-12-02 13:51:06,705] Sample trial#29 with GPSampler.
[I 2025-12-02 13:51:18,282] Trial 29 finished with value: 0.15071644547408933 and parameters: {'n_estimators': 550, 'learning_rate': 0.01054796485002611, 'max_depth': 20, 'min_child_weight': 1, 'subsample': 0.9, 'colsample_bytree': 0.4, 'reg_alpha': 1.0, 'reg_lambda': 1.0, 'gamma': 5.0, 'scale_pos_weight': 5.0}. Best is trial 5 with value: 0.151341919332297.
[I 2025-12-02 13:51:19,257] A new study created in memory with name: xgboost_fold_3
[D 2025-12-02 13:51:19,258] Sample trial#0 with RandomSampler.
[I 2025-12-02 13:51:27,250] Trial 0 finished with value: 0.14643354839212858 and parameters: {'n_estimators': 550, 'learning_rate': 0.03531596308342327, 'max_depth': 4, 'min_child_weight': 9, 'subsample': 0.9275456940945347, 'colsample_bytree': 0.42462554626478133, 'reg_alpha': 0.44240283681673576, 'reg_lambda': 7.7483339928707835, 'gamma': 5.0, 'scale_pos_weight': 5.438241836906829}. Best is trial 0 with value: 0.14643354839212858.
[D 2025-12-02 13:51:27,383] Sample trial#1 with GPSampler.
[I 2025-12-02 13:51:40,283] Trial 1 finished with value: 0.1502563418672713 and parameters: {'n_estimators': 600, 'learning_rate': 0.011162511002050356, 'max_depth': 20, 'min_child_weight': 8, 'subsample': 0.9885260954930473, 'colsample_bytree': 0.4281824050912593, 'reg_alpha': 0.22162809034766384, 'reg_lambda': 3.0295584417299706, 'gamma': 5.0, 'scale_pos_weight': 5.299313552707846}. Best is trial 1 with value: 0.1502563418672713.
[D 2025-12-02 13:51:40,411] Sample trial#2 with GPSampler.
[I 2025-12-02 13:51:50,541] Trial 2 finished with value: 0.13436721743316485 and parameters: {'n_estimators': 900, 'learning_rate': 0.018067160211514964, 'max_depth': 16, 'min_child_weight': 4, 'subsample': 0.9756917046643332, 'colsample_bytree': 0.5110106220380917, 'reg_alpha': 0.801962319945925, 'reg_lambda': 1.1815734490433623, 'gamma': 3.0, 'scale_pos_weight': 5.910109955517676}. Best is trial 1 with value: 0.1502563418672713.
[D 2025-12-02 13:51:50,669] Sample trial#3 with GPSampler.
[I 2025-12-02 13:52:04,341] Trial 3 finished with value: 0.12793202590685906 and parameters: {'n_estimators': 400, 'learning_rate': 0.03154411863806792, 'max_depth': 16, 'min_child_weight': 3, 'subsample': 0.9516755796935128, 'colsample_bytree': 0.599471270125473, 'reg_alpha': 0.8027733530255069, 'reg_lambda': 9.621441245209928, 'gamma': 1.0, 'scale_pos_weight': 5.354722889003863}. Best is trial 1 with value: 0.1502563418672713.
[D 2025-12-02 13:52:04,468] Sample trial#4 with GPSampler.
[I 2025-12-02 13:52:13,336] Trial 4 finished with value: 0.13018796943583405 and parameters: {'n_estimators': 900, 'learning_rate': 0.07239863440251604, 'max_depth': 6, 'min_child_weight': 5, 'subsample': 0.9464845748890447, 'colsample_bytree': 0.5254634965470815, 'reg_alpha': 0.1575045125903739, 'reg_lambda': 3.210993226630538, 'gamma': 1.0, 'scale_pos_weight': 5.42624539518266}. Best is trial 1 with value: 0.1502563418672713.
[D 2025-12-02 13:52:13,466] Sample trial#5 with GPSampler.
[I 2025-12-02 13:52:20,053] Trial 5 finished with value: 0.13081106211957697 and parameters: {'n_estimators': 150, 'learning_rate': 0.05769339788948009, 'max_depth': 8, 'min_child_weight': 4, 'subsample': 0.9837521457681189, 'colsample_bytree': 0.47217262353855316, 'reg_alpha': 0.28528594633218174, 'reg_lambda': 4.598208050382052, 'gamma': 2.0, 'scale_pos_weight': 5.635005886789355}. Best is trial 1 with value: 0.1502563418672713.
[D 2025-12-02 13:52:20,182] Sample trial#6 with GPSampler.
[I 2025-12-02 13:52:31,410] Trial 6 finished with value: 0.14300426197975563 and parameters: {'n_estimators': 650, 'learning_rate': 0.01465924931059286, 'max_depth': 10, 'min_child_weight': 8, 'subsample': 0.9541581276179137, 'colsample_bytree': 0.41319309605603866, 'reg_alpha': 0.8828038517406744, 'reg_lambda': 4.5303849776303995, 'gamma': 3.0, 'scale_pos_weight': 5.72044544563725}. Best is trial 1 with value: 0.1502563418672713.
[D 2025-12-02 13:52:31,539] Sample trial#7 with GPSampler.
[I 2025-12-02 13:52:38,217] Trial 7 finished with value: 0.1456110258192877 and parameters: {'n_estimators': 850, 'learning_rate': 0.027990452035838498, 'max_depth': 18, 'min_child_weight': 1, 'subsample': 0.9645091476689335, 'colsample_bytree': 0.44862305260077073, 'reg_alpha': 0.13841083167471502, 'reg_lambda': 6.860371737652799, 'gamma': 5.0, 'scale_pos_weight': 5.369600048512776}. Best is trial 1 with value: 0.1502563418672713.
[D 2025-12-02 13:52:38,347] Sample trial#8 with GPSampler.
[I 2025-12-02 13:52:43,071] Trial 8 finished with value: 0.14934232224019145 and parameters: {'n_estimators': 200, 'learning_rate': 0.04613521883216661, 'max_depth': 4, 'min_child_weight': 10, 'subsample': 0.9774509555562566, 'colsample_bytree': 0.5748059008316915, 'reg_alpha': 0.3915839730188043, 'reg_lambda': 7.198784292402702, 'gamma': 0.0, 'scale_pos_weight': 5.0543677952738175}. Best is trial 1 with value: 0.1502563418672713.
[D 2025-12-02 13:52:43,202] Sample trial#9 with GPSampler.
[I 2025-12-02 13:52:47,746] Trial 9 finished with value: 0.1398979468762672 and parameters: {'n_estimators': 550, 'learning_rate': 0.06037200639803966, 'max_depth': 6, 'min_child_weight': 5, 'subsample': 0.956065613757802, 'colsample_bytree': 0.4706556785629911, 'reg_alpha': 0.9292592655699429, 'reg_lambda': 1.3580750088796059, 'gamma': 4.0, 'scale_pos_weight': 5.747595670616106}. Best is trial 1 with value: 0.1502563418672713.
[D 2025-12-02 13:52:47,879] Sample trial#10 with GPSampler.
[I 2025-12-02 13:53:07,401] Trial 10 finished with value: 0.14966657980688772 and parameters: {'n_estimators': 300, 'learning_rate': 0.009, 'max_depth': 20, 'min_child_weight': 10, 'subsample': 1.0, 'colsample_bytree': 0.45761730181279514, 'reg_alpha': 0.2710916879196363, 'reg_lambda': 2.0380067421825068, 'gamma': 5.0, 'scale_pos_weight': 5.0}. Best is trial 1 with value: 0.1502563418672713.
[D 2025-12-02 13:53:07,526] Sample trial#11 with GPSampler.
[I 2025-12-02 13:53:29,040] Trial 11 finished with value: 0.14941545725475563 and parameters: {'n_estimators': 1000, 'learning_rate': 0.009, 'max_depth': 20, 'min_child_weight': 9, 'subsample': 1.0, 'colsample_bytree': 0.4, 'reg_alpha': 0.0, 'reg_lambda': 7.680709757431006, 'gamma': 5.0, 'scale_pos_weight': 5.0}. Best is trial 1 with value: 0.1502563418672713.
[D 2025-12-02 13:53:29,167] Sample trial#12 with GPSampler.
[I 2025-12-02 13:53:45,240] Trial 12 finished with value: 0.15121608215883692 and parameters: {'n_estimators': 800, 'learning_rate': 0.009, 'max_depth': 20, 'min_child_weight': 10, 'subsample': 1.0, 'colsample_bytree': 0.4, 'reg_alpha': 0.0, 'reg_lambda': 1.0, 'gamma': 5.0, 'scale_pos_weight': 5.780067258103886}. Best is trial 12 with value: 0.15121608215883692.
[D 2025-12-02 13:53:45,365] Sample trial#13 with GPSampler.
[I 2025-12-02 13:53:55,261] Trial 13 finished with value: 0.12715663132716773 and parameters: {'n_estimators': 650, 'learning_rate': 0.09306856595422153, 'max_depth': 20, 'min_child_weight': 10, 'subsample': 1.0, 'colsample_bytree': 0.4, 'reg_alpha': 0.0, 'reg_lambda': 1.0, 'gamma': 5.0, 'scale_pos_weight': 5.687279170326275}. Best is trial 12 with value: 0.15121608215883692.
[D 2025-12-02 13:53:55,386] Sample trial#14 with GPSampler.
