[I 2025-12-02 13:54:03,057] Trial 14 finished with value: 0.1630571291287127 and parameters: {'n_estimators': 600, 'learning_rate': 0.009, 'max_depth': 4, 'min_child_weight': 10, 'subsample': 0.9983183860021263, 'colsample_bytree': 0.4, 'reg_alpha': 0.0, 'reg_lambda': 1.0, 'gamma': 5.0, 'scale_pos_weight': 5.500183249802891}. Best is trial 14 with value: 0.1630571291287127.
[D 2025-12-02 13:54:03,187] Sample trial#15 with GPSampler.
[I 2025-12-02 13:54:10,925] Trial 15 finished with value: 0.13874675079066937 and parameters: {'n_estimators': 100, 'learning_rate': 0.009, 'max_depth': 2, 'min_child_weight': 10, 'subsample': 1.0, 'colsample_bytree': 0.4, 'reg_alpha': 0.0, 'reg_lambda': 1.0, 'gamma': 5.0, 'scale_pos_weight': 5.152320151534211}. Best is trial 14 with value: 0.1630571291287127.
[D 2025-12-02 13:54:11,052] Sample trial#16 with GPSampler.
[I 2025-12-02 13:54:18,955] Trial 16 finished with value: 0.15258519576337976 and parameters: {'n_estimators': 750, 'learning_rate': 0.009, 'max_depth': 2, 'min_child_weight': 10, 'subsample': 1.0, 'colsample_bytree': 0.4, 'reg_alpha': 0.0, 'reg_lambda': 1.0, 'gamma': 5.0, 'scale_pos_weight': 5.271725151427224}. Best is trial 14 with value: 0.1630571291287127.
[D 2025-12-02 13:54:19,082] Sample trial#17 with GPSampler.
[I 2025-12-02 13:54:26,456] Trial 17 finished with value: 0.1496070602208324 and parameters: {'n_estimators': 550, 'learning_rate': 0.009, 'max_depth': 2, 'min_child_weight': 10, 'subsample': 1.0, 'colsample_bytree': 0.4, 'reg_alpha': 0.0, 'reg_lambda': 1.0, 'gamma': 5.0, 'scale_pos_weight': 5.814936244152213}. Best is trial 14 with value: 0.1630571291287127.
[D 2025-12-02 13:54:26,581] Sample trial#18 with GPSampler.
[I 2025-12-02 13:54:33,750] Trial 18 finished with value: 0.15362812147158927 and parameters: {'n_estimators': 1000, 'learning_rate': 0.009, 'max_depth': 2, 'min_child_weight': 10, 'subsample': 1.0, 'colsample_bytree': 0.4, 'reg_alpha': 0.0, 'reg_lambda': 1.0, 'gamma': 5.0, 'scale_pos_weight': 5.518159763195683}. Best is trial 14 with value: 0.1630571291287127.
[D 2025-12-02 13:54:33,880] Sample trial#19 with GPSampler.
[I 2025-12-02 13:54:49,250] Trial 19 finished with value: 0.1510593251439058 and parameters: {'n_estimators': 550, 'learning_rate': 0.009, 'max_depth': 12, 'min_child_weight': 10, 'subsample': 1.0, 'colsample_bytree': 0.4, 'reg_alpha': 0.0, 'reg_lambda': 1.0, 'gamma': 5.0, 'scale_pos_weight': 5.540623171355786}. Best is trial 14 with value: 0.1630571291287127.
[D 2025-12-02 13:54:49,380] Sample trial#20 with GPSampler.
[I 2025-12-02 13:54:59,338] Trial 20 finished with value: 0.15153894049720154 and parameters: {'n_estimators': 550, 'learning_rate': 0.009, 'max_depth': 2, 'min_child_weight': 7, 'subsample': 1.0, 'colsample_bytree': 0.4, 'reg_alpha': 0.0, 'reg_lambda': 1.0, 'gamma': 5.0, 'scale_pos_weight': 5.514001197960771}. Best is trial 14 with value: 0.1630571291287127.
[D 2025-12-02 13:54:59,468] Sample trial#21 with GPSampler.
[I 2025-12-02 13:55:13,021] Trial 21 finished with value: 0.1604498177518006 and parameters: {'n_estimators': 600, 'learning_rate': 0.009, 'max_depth': 4, 'min_child_weight': 10, 'subsample': 1.0, 'colsample_bytree': 0.4, 'reg_alpha': 0.3789121398125288, 'reg_lambda': 1.0, 'gamma': 5.0, 'scale_pos_weight': 5.5060369665255475}. Best is trial 14 with value: 0.1630571291287127.
[D 2025-12-02 13:55:13,146] Sample trial#22 with GPSampler.
[I 2025-12-02 13:55:22,819] Trial 22 finished with value: 0.15883781476451092 and parameters: {'n_estimators': 600, 'learning_rate': 0.009, 'max_depth': 4, 'min_child_weight': 10, 'subsample': 1.0, 'colsample_bytree': 0.47026140361494995, 'reg_alpha': 0.0, 'reg_lambda': 1.0, 'gamma': 5.0, 'scale_pos_weight': 5.505313298525873}. Best is trial 14 with value: 0.1630571291287127.
[D 2025-12-02 13:55:22,944] Sample trial#23 with GPSampler.
[I 2025-12-02 13:55:34,269] Trial 23 finished with value: 0.16096699957279223 and parameters: {'n_estimators': 600, 'learning_rate': 0.009, 'max_depth': 4, 'min_child_weight': 10, 'subsample': 0.958003521577055, 'colsample_bytree': 0.4, 'reg_alpha': 0.0, 'reg_lambda': 1.0, 'gamma': 5.0, 'scale_pos_weight': 5.510482246501379}. Best is trial 14 with value: 0.1630571291287127.
[D 2025-12-02 13:55:34,393] Sample trial#24 with GPSampler.
[I 2025-12-02 13:55:43,966] Trial 24 finished with value: 0.1611410046371639 and parameters: {'n_estimators': 600, 'learning_rate': 0.009, 'max_depth': 4, 'min_child_weight': 10, 'subsample': 1.0, 'colsample_bytree': 0.4, 'reg_alpha': 0.0, 'reg_lambda': 1.0, 'gamma': 4.0, 'scale_pos_weight': 5.501391999389916}. Best is trial 14 with value: 0.1630571291287127.
[D 2025-12-02 13:55:44,095] Sample trial#25 with GPSampler.
[I 2025-12-02 13:55:50,882] Trial 25 finished with value: 0.1499884834149449 and parameters: {'n_estimators': 550, 'learning_rate': 0.009, 'max_depth': 2, 'min_child_weight': 10, 'subsample': 1.0, 'colsample_bytree': 0.4, 'reg_alpha': 0.0, 'reg_lambda': 1.0, 'gamma': 5.0, 'scale_pos_weight': 5.513857194830884}. Best is trial 14 with value: 0.1630571291287127.
[D 2025-12-02 13:55:51,010] Sample trial#26 with GPSampler.
[I 2025-12-02 13:55:59,240] Trial 26 finished with value: 0.15663241001237632 and parameters: {'n_estimators': 800, 'learning_rate': 0.009, 'max_depth': 6, 'min_child_weight': 8, 'subsample': 1.0, 'colsample_bytree': 0.4, 'reg_alpha': 0.0, 'reg_lambda': 1.0, 'gamma': 5.0, 'scale_pos_weight': 5.441726410333574}. Best is trial 14 with value: 0.1630571291287127.
[D 2025-12-02 13:55:59,372] Sample trial#27 with GPSampler.
[I 2025-12-02 13:56:04,895] Trial 27 finished with value: 0.16223448440391555 and parameters: {'n_estimators': 800, 'learning_rate': 0.009, 'max_depth': 4, 'min_child_weight': 7, 'subsample': 1.0, 'colsample_bytree': 0.4, 'reg_alpha': 0.0, 'reg_lambda': 1.0, 'gamma': 5.0, 'scale_pos_weight': 5.492100186903947}. Best is trial 14 with value: 0.1630571291287127.
[D 2025-12-02 13:56:05,019] Sample trial#28 with GPSampler.
[I 2025-12-02 13:56:17,817] Trial 28 finished with value: 0.16122452713055407 and parameters: {'n_estimators': 750, 'learning_rate': 0.009, 'max_depth': 4, 'min_child_weight': 10, 'subsample': 1.0, 'colsample_bytree': 0.4, 'reg_alpha': 0.0, 'reg_lambda': 1.0, 'gamma': 5.0, 'scale_pos_weight': 5.068252389489804}. Best is trial 14 with value: 0.1630571291287127.
[D 2025-12-02 13:56:17,945] Sample trial#29 with GPSampler.
[I 2025-12-02 13:56:27,162] Trial 29 finished with value: 0.1606389870049639 and parameters: {'n_estimators': 600, 'learning_rate': 0.009, 'max_depth': 4, 'min_child_weight': 6, 'subsample': 1.0, 'colsample_bytree': 0.4, 'reg_alpha': 0.0, 'reg_lambda': 1.0, 'gamma': 5.0, 'scale_pos_weight': 5.6810644719370895}. Best is trial 14 with value: 0.1630571291287127.
[I 2025-12-02 13:56:28,391] A new study created in memory with name: xgboost_fold_4
[D 2025-12-02 13:56:28,391] Sample trial#0 with RandomSampler.
[I 2025-12-02 13:56:37,826] Trial 0 finished with value: 0.14660946153898666 and parameters: {'n_estimators': 850, 'learning_rate': 0.09050630001679164, 'max_depth': 10, 'min_child_weight': 9, 'subsample': 0.9332814576331946, 'colsample_bytree': 0.5917645502698125, 'reg_alpha': 0.5304709445322052, 'reg_lambda': 9.138017852841402, 'gamma': 2.0, 'scale_pos_weight': 5.847982541323286}. Best is trial 0 with value: 0.14660946153898666.
[D 2025-12-02 13:56:37,961] Sample trial#1 with GPSampler.
[I 2025-12-02 13:56:42,154] Trial 1 finished with value: 0.16616066204727295 and parameters: {'n_estimators': 750, 'learning_rate': 0.08511916167221172, 'max_depth': 16, 'min_child_weight': 4, 'subsample': 0.9803475547219467, 'colsample_bytree': 0.41719437829081857, 'reg_alpha': 0.26401318573946353, 'reg_lambda': 9.634035504076891, 'gamma': 4.0, 'scale_pos_weight': 5.876835613765168}. Best is trial 1 with value: 0.16616066204727295.
[D 2025-12-02 13:56:42,288] Sample trial#2 with GPSampler.
[I 2025-12-02 13:56:54,795] Trial 2 finished with value: 0.16081836730215673 and parameters: {'n_estimators': 800, 'learning_rate': 0.0117214293938749, 'max_depth': 6, 'min_child_weight': 6, 'subsample': 0.9095027820911107, 'colsample_bytree': 0.4837549218344704, 'reg_alpha': 0.8311171810918534, 'reg_lambda': 9.350697499915764, 'gamma': 0.0, 'scale_pos_weight': 5.258122213139772}. Best is trial 1 with value: 0.16616066204727295.
[D 2025-12-02 13:56:54,928] Sample trial#3 with GPSampler.
[I 2025-12-02 13:57:06,713] Trial 3 finished with value: 0.14746452036071567 and parameters: {'n_estimators': 450, 'learning_rate': 0.06541198881927543, 'max_depth': 4, 'min_child_weight': 2, 'subsample': 0.9028260802570554, 'colsample_bytree': 0.4761470292119958, 'reg_alpha': 0.15304185710902074, 'reg_lambda': 1.826669513093269, 'gamma': 0.0, 'scale_pos_weight': 5.867900281853644}. Best is trial 1 with value: 0.16616066204727295.
[D 2025-12-02 13:57:06,845] Sample trial#4 with GPSampler.
[I 2025-12-02 13:57:15,285] Trial 4 finished with value: 0.14878867501414011 and parameters: {'n_estimators': 200, 'learning_rate': 0.07195969749641372, 'max_depth': 12, 'min_child_weight': 9, 'subsample': 0.9679552151774211, 'colsample_bytree': 0.4886097551740958, 'reg_alpha': 0.37743973222707095, 'reg_lambda': 4.27821916342671, 'gamma': 2.0, 'scale_pos_weight': 5.176814745747054}. Best is trial 1 with value: 0.16616066204727295.
[D 2025-12-02 13:57:15,411] Sample trial#5 with GPSampler.
[I 2025-12-02 13:57:27,298] Trial 5 finished with value: 0.1549606012180325 and parameters: {'n_estimators': 500, 'learning_rate': 0.02803238610238147, 'max_depth': 20, 'min_child_weight': 9, 'subsample': 0.9171576066150358, 'colsample_bytree': 0.4426317048686657, 'reg_alpha': 0.6367240967538039, 'reg_lambda': 7.030517371512946, 'gamma': 3.0, 'scale_pos_weight': 5.181297505145578}. Best is trial 1 with value: 0.16616066204727295.
[D 2025-12-02 13:57:27,431] Sample trial#6 with GPSampler.
[I 2025-12-02 13:57:35,207] Trial 6 finished with value: 0.1595648108417725 and parameters: {'n_estimators': 550, 'learning_rate': 0.0993345894568912, 'max_depth': 2, 'min_child_weight': 8, 'subsample': 0.9537599978073892, 'colsample_bytree': 0.4442456743244031, 'reg_alpha': 0.25658042298417516, 'reg_lambda': 7.0056202722533545, 'gamma': 4.0, 'scale_pos_weight': 5.909182400813131}. Best is trial 1 with value: 0.16616066204727295.
[D 2025-12-02 13:57:35,336] Sample trial#7 with GPSampler.
[I 2025-12-02 13:57:53,685] Trial 7 finished with value: 0.16219036971442963 and parameters: {'n_estimators': 800, 'learning_rate': 0.009577308412232173, 'max_depth': 14, 'min_child_weight': 9, 'subsample': 0.9507370345346661, 'colsample_bytree': 0.43899622754527545, 'reg_alpha': 0.21922698399968676, 'reg_lambda': 7.726340272869917, 'gamma': 4.0, 'scale_pos_weight': 5.282236149924207}. Best is trial 1 with value: 0.16616066204727295.
[D 2025-12-02 13:57:53,821] Sample trial#8 with GPSampler.
[I 2025-12-02 13:57:57,289] Trial 8 finished with value: 0.16440697378169494 and parameters: {'n_estimators': 150, 'learning_rate': 0.0764794395178844, 'max_depth': 2, 'min_child_weight': 4, 'subsample': 0.9763517618271226, 'colsample_bytree': 0.45375449921636624, 'reg_alpha': 0.8629686217530443, 'reg_lambda': 2.1620755666068954, 'gamma': 1.0, 'scale_pos_weight': 5.6865305225999325}. Best is trial 1 with value: 0.16616066204727295.
[D 2025-12-02 13:57:57,420] Sample trial#9 with GPSampler.
[I 2025-12-02 13:58:03,520] Trial 9 finished with value: 0.1477451078961678 and parameters: {'n_estimators': 350, 'learning_rate': 0.06024509970046964, 'max_depth': 6, 'min_child_weight': 6, 'subsample': 0.9385520694953005, 'colsample_bytree': 0.5732486894508724, 'reg_alpha': 0.3321433634517351, 'reg_lambda': 4.844203823694633, 'gamma': 2.0, 'scale_pos_weight': 5.941506608335879}. Best is trial 1 with value: 0.16616066204727295.
[D 2025-12-02 13:58:03,650] Sample trial#10 with GPSampler.
[I 2025-12-02 13:58:09,452] Trial 10 finished with value: 0.15901168001351648 and parameters: {'n_estimators': 1000, 'learning_rate': 0.04928312199099344, 'max_depth': 16, 'min_child_weight': 4, 'subsample': 0.9915147421353824, 'colsample_bytree': 0.4, 'reg_alpha': 0.20274469856037708, 'reg_lambda': 10.0, 'gamma': 5.0, 'scale_pos_weight': 5.839325314609839}. Best is trial 1 with value: 0.16616066204727295.
[D 2025-12-02 13:58:09,581] Sample trial#11 with GPSampler.
[I 2025-12-02 13:58:18,217] Trial 11 finished with value: 0.16533812869561526 and parameters: {'n_estimators': 250, 'learning_rate': 0.05141330355197395, 'max_depth': 2, 'min_child_weight': 2, 'subsample': 0.9775276711685279, 'colsample_bytree': 0.41887954352123075, 'reg_alpha': 1.0, 'reg_lambda': 4.0537536172835775, 'gamma': 0.0, 'scale_pos_weight': 5.620915230805808}. Best is trial 1 with value: 0.16616066204727295.
[D 2025-12-02 13:58:18,351] Sample trial#12 with GPSampler.
[I 2025-12-02 13:58:22,439] Trial 12 finished with value: 0.15695361206119457 and parameters: {'n_estimators': 400, 'learning_rate': 0.1, 'max_depth': 20, 'min_child_weight': 1, 'subsample': 0.9623763295167241, 'colsample_bytree': 0.4, 'reg_alpha': 0.23334937435673014, 'reg_lambda': 9.999999999999998, 'gamma': 4.0, 'scale_pos_weight': 5.811035533798637}. Best is trial 1 with value: 0.16616066204727295.
[D 2025-12-02 13:58:22,567] Sample trial#13 with GPSampler.
[I 2025-12-02 13:58:31,026] Trial 13 finished with value: 0.15602781068703725 and parameters: {'n_estimators': 750, 'learning_rate': 0.09050715717123503, 'max_depth': 8, 'min_child_weight': 6, 'subsample': 0.9944121940867446, 'colsample_bytree': 0.4, 'reg_alpha': 0.47961118433695066, 'reg_lambda': 9.960558607931826, 'gamma': 3.0, 'scale_pos_weight': 5.8225719139080985}. Best is trial 1 with value: 0.16616066204727295.
[D 2025-12-02 13:58:31,159] Sample trial#14 with GPSampler.
[I 2025-12-02 13:58:41,202] Trial 14 finished with value: 0.1510400861238282 and parameters: {'n_estimators': 750, 'learning_rate': 0.09999999999999999, 'max_depth': 20, 'min_child_weight': 7, 'subsample': 0.9968185402376678, 'colsample_bytree': 0.4, 'reg_alpha': 0.15814416640729576, 'reg_lambda': 9.347797893383433, 'gamma': 4.0, 'scale_pos_weight': 5.82253523187067}. Best is trial 1 with value: 0.16616066204727295.
[D 2025-12-02 13:58:41,337] Sample trial#15 with GPSampler.
[I 2025-12-02 13:58:45,093] Trial 15 finished with value: 0.15372470469607252 and parameters: {'n_estimators': 650, 'learning_rate': 0.09151833768192429, 'max_depth': 14, 'min_child_weight': 1, 'subsample': 0.9576004286865593, 'colsample_bytree': 0.4091992171683307, 'reg_alpha': 0.2975813062114318, 'reg_lambda': 10.0, 'gamma': 4.0, 'scale_pos_weight': 5.934058308675528}. Best is trial 1 with value: 0.16616066204727295.
[D 2025-12-02 13:58:45,227] Sample trial#16 with GPSampler.
[I 2025-12-02 13:58:50,282] Trial 16 finished with value: 0.15388828804335866 and parameters: {'n_estimators': 400, 'learning_rate': 0.0828285506213354, 'max_depth': 12, 'min_child_weight': 3, 'subsample': 0.9808604235675215, 'colsample_bytree': 0.42678943635424593, 'reg_alpha': 0.6044915205044809, 'reg_lambda': 7.252234976274712, 'gamma': 2.0, 'scale_pos_weight': 5.803003131238571}. Best is trial 1 with value: 0.16616066204727295.
[D 2025-12-02 13:58:50,409] Sample trial#17 with GPSampler.
[I 2025-12-02 13:58:56,661] Trial 17 finished with value: 0.16338193737425272 and parameters: {'n_estimators': 100, 'learning_rate': 0.05425308766615241, 'max_depth': 2, 'min_child_weight': 4, 'subsample': 0.9730075741856283, 'colsample_bytree': 0.441170708542438, 'reg_alpha': 1.0, 'reg_lambda': 1.0, 'gamma': 0.0, 'scale_pos_weight': 5.53738777142612}. Best is trial 1 with value: 0.16616066204727295.
[D 2025-12-02 13:58:56,804] Sample trial#18 with GPSampler.
[I 2025-12-02 13:59:03,502] Trial 18 finished with value: 0.16667033010975046 and parameters: {'n_estimators': 100, 'learning_rate': 0.08669330950364544, 'max_depth': 2, 'min_child_weight': 2, 'subsample': 0.9859262577191309, 'colsample_bytree': 0.4543803410752594, 'reg_alpha': 1.0, 'reg_lambda': 1.0, 'gamma': 1.0, 'scale_pos_weight': 5.87818541664345}. Best is trial 18 with value: 0.16667033010975046.
[D 2025-12-02 13:59:03,636] Sample trial#19 with GPSampler.
[I 2025-12-02 13:59:12,000] Trial 19 finished with value: 0.16277786503556815 and parameters: {'n_estimators': 700, 'learning_rate': 0.05647272476586029, 'max_depth': 2, 'min_child_weight': 3, 'subsample': 0.9856938831064046, 'colsample_bytree': 0.4327200313164414, 'reg_alpha': 1.0, 'reg_lambda': 1.0, 'gamma': 1.0, 'scale_pos_weight': 6.0}. Best is trial 18 with value: 0.16667033010975046.
[D 2025-12-02 13:59:12,130] Sample trial#20 with GPSampler.
[I 2025-12-02 13:59:19,929] Trial 20 finished with value: 0.16375935866966407 and parameters: {'n_estimators': 100, 'learning_rate': 0.1, 'max_depth': 2, 'min_child_weight': 1, 'subsample': 0.9787112630318031, 'colsample_bytree': 0.48700975824456205, 'reg_alpha': 1.0, 'reg_lambda': 2.3956597761964327, 'gamma': 1.0, 'scale_pos_weight': 5.335733026588242}. Best is trial 18 with value: 0.16667033010975046.
[D 2025-12-02 13:59:20,065] Sample trial#21 with GPSampler.
[I 2025-12-02 13:59:26,656] Trial 21 finished with value: 0.16187892657048225 and parameters: {'n_estimators': 100, 'learning_rate': 0.1, 'max_depth': 2, 'min_child_weight': 2, 'subsample': 0.987155932760524, 'colsample_bytree': 0.4073357068878854, 'reg_alpha': 0.9395685008858987, 'reg_lambda': 1.4528133395015763, 'gamma': 0.0, 'scale_pos_weight': 6.0}. Best is trial 18 with value: 0.16667033010975046.
[D 2025-12-02 13:59:26,787] Sample trial#22 with GPSampler.
[I 2025-12-02 13:59:29,236] Trial 22 finished with value: 0.1586394083471159 and parameters: {'n_estimators': 100, 'learning_rate': 0.03266980048001, 'max_depth': 2, 'min_child_weight': 2, 'subsample': 0.9803519491069195, 'colsample_bytree': 0.4836162545118605, 'reg_alpha': 1.0, 'reg_lambda': 2.904603394200387, 'gamma': 1.0, 'scale_pos_weight': 5.93603738978343}. Best is trial 18 with value: 0.16667033010975046.
[D 2025-12-02 13:59:29,364] Sample trial#23 with GPSampler.
[I 2025-12-02 13:59:35,410] Trial 23 finished with value: 0.16089794776479335 and parameters: {'n_estimators': 100, 'learning_rate': 0.07352366182326169, 'max_depth': 2, 'min_child_weight': 2, 'subsample': 0.9863114366591832, 'colsample_bytree': 0.4346975657977352, 'reg_alpha': 0.9999999999999999, 'reg_lambda': 2.603942088911288, 'gamma': 1.0, 'scale_pos_weight': 5.2935232973660975}. Best is trial 18 with value: 0.16667033010975046.
[D 2025-12-02 13:59:35,546] Sample trial#24 with GPSampler.
[I 2025-12-02 13:59:41,860] Trial 24 finished with value: 0.16144297238738278 and parameters: {'n_estimators': 300, 'learning_rate': 0.08061996560384806, 'max_depth': 2, 'min_child_weight': 2, 'subsample': 0.9672996101069132, 'colsample_bytree': 0.5094258549025954, 'reg_alpha': 0.9999999999999999, 'reg_lambda': 2.3260885941497262, 'gamma': 0.0, 'scale_pos_weight': 5.758696224514178}. Best is trial 18 with value: 0.16667033010975046.
[D 2025-12-02 13:59:41,988] Sample trial#25 with GPSampler.
[I 2025-12-02 13:59:52,810] Trial 25 finished with value: 0.1605292626465984 and parameters: {'n_estimators': 100, 'learning_rate': 0.1, 'max_depth': 2, 'min_child_weight': 3, 'subsample': 0.993212362771322, 'colsample_bytree': 0.45503873332654077, 'reg_alpha': 1.0, 'reg_lambda': 1.0, 'gamma': 2.0, 'scale_pos_weight': 6.0}. Best is trial 18 with value: 0.16667033010975046.
[D 2025-12-02 13:59:52,936] Sample trial#26 with GPSampler.
[I 2025-12-02 14:00:03,198] Trial 26 finished with value: 0.16339950619417093 and parameters: {'n_estimators': 100, 'learning_rate': 0.05787435257211731, 'max_depth': 2, 'min_child_weight': 3, 'subsample': 1.0, 'colsample_bytree': 0.4, 'reg_alpha': 1.0, 'reg_lambda': 9.303643132160776, 'gamma': 0.0, 'scale_pos_weight': 5.870983820827144}. Best is trial 18 with value: 0.16667033010975046.
[D 2025-12-02 14:00:03,324] Sample trial#27 with GPSampler.
[I 2025-12-02 14:00:10,339] Trial 27 finished with value: 0.16490222183365527 and parameters: {'n_estimators': 100, 'learning_rate': 0.09223748641800177, 'max_depth': 2, 'min_child_weight': 3, 'subsample': 0.9556916527174765, 'colsample_bytree': 0.4, 'reg_alpha': 1.0, 'reg_lambda': 1.0, 'gamma': 1.0, 'scale_pos_weight': 5.95442000261513}. Best is trial 18 with value: 0.16667033010975046.
[D 2025-12-02 14:00:10,472] Sample trial#28 with GPSampler.
[I 2025-12-02 14:00:15,902] Trial 28 finished with value: 0.16857038293995563 and parameters: {'n_estimators': 100, 'learning_rate': 0.09687399264977378, 'max_depth': 2, 'min_child_weight': 1, 'subsample': 1.0, 'colsample_bytree': 0.40555183697498115, 'reg_alpha': 1.0, 'reg_lambda': 1.0, 'gamma': 1.0, 'scale_pos_weight': 6.0}. Best is trial 28 with value: 0.16857038293995563.
[D 2025-12-02 14:00:16,035] Sample trial#29 with GPSampler.
[I 2025-12-02 14:00:27,225] Trial 29 finished with value: 0.132336295240213 and parameters: {'n_estimators': 100, 'learning_rate': 0.09999999999999999, 'max_depth': 8, 'min_child_weight': 1, 'subsample': 1.0, 'colsample_bytree': 0.4, 'reg_alpha': 1.0, 'reg_lambda': 1.0, 'gamma': 1.0, 'scale_pos_weight': 6.0}. Best is trial 28 with value: 0.16857038293995563.
[I 2025-12-02 14:00:28,146] A new study created in memory with name: xgboost_fold_5
[D 2025-12-02 14:00:28,146] Sample trial#0 with RandomSampler.
[I 2025-12-02 14:00:39,320] Trial 0 finished with value: 0.13448020211837108 and parameters: {'n_estimators': 300, 'learning_rate': 0.021964979047893803, 'max_depth': 16, 'min_child_weight': 6, 'subsample': 0.9477922195278338, 'colsample_bytree': 0.42935002595091204, 'reg_alpha': 0.05971662338251704, 'reg_lambda': 2.896278100720459, 'gamma': 0.0, 'scale_pos_weight': 5.218028263968566}. Best is trial 0 with value: 0.13448020211837108.
[D 2025-12-02 14:00:39,457] Sample trial#1 with GPSampler.
