[I 2025-12-02 11:56:34,895] Trial 23 finished with value: 0.13420915866875455 and parameters: {'n_estimators': 225, 'max_depth': 3, 'min_samples_split': 15, 'min_samples_leaf': 21, 'max_features': None, 'criterion': 'entropy', 'bootstrap': True}. Best is trial 15 with value: 0.14911102021150838.
[D 2025-12-02 11:56:34,990] Sample trial#24 with TPESampler.
[I 2025-12-02 11:56:36,689] Trial 24 finished with value: 0.1434367450814549 and parameters: {'n_estimators': 225, 'max_depth': 4, 'min_samples_split': 13, 'min_samples_leaf': 19, 'max_features': 'sqrt', 'criterion': 'log_loss', 'bootstrap': False}. Best is trial 15 with value: 0.14911102021150838.
[D 2025-12-02 11:56:36,781] Sample trial#25 with TPESampler.
[I 2025-12-02 11:56:39,474] Trial 25 finished with value: 0.14766358351463732 and parameters: {'n_estimators': 275, 'max_depth': 6, 'min_samples_split': 11, 'min_samples_leaf': 25, 'max_features': 'sqrt', 'criterion': 'entropy', 'bootstrap': False}. Best is trial 15 with value: 0.14911102021150838.
[D 2025-12-02 11:56:39,567] Sample trial#26 with TPESampler.
[I 2025-12-02 11:56:43,571] Trial 26 finished with value: 0.14420026373690872 and parameters: {'n_estimators': 275, 'max_depth': 12, 'min_samples_split': 11, 'min_samples_leaf': 23, 'max_features': 'sqrt', 'criterion': 'entropy', 'bootstrap': False}. Best is trial 15 with value: 0.14911102021150838.
[D 2025-12-02 11:56:43,666] Sample trial#27 with TPESampler.
[I 2025-12-02 11:56:45,530] Trial 27 finished with value: 0.14508148225647594 and parameters: {'n_estimators': 250, 'max_depth': 4, 'min_samples_split': 9, 'min_samples_leaf': 25, 'max_features': 'sqrt', 'criterion': 'entropy', 'bootstrap': False}. Best is trial 15 with value: 0.14911102021150838.
[D 2025-12-02 11:56:45,623] Sample trial#28 with TPESampler.
[I 2025-12-02 11:56:58,926] Trial 28 finished with value: 0.0956840637253899 and parameters: {'n_estimators': 300, 'max_depth': 4, 'min_samples_split': 13, 'min_samples_leaf': 23, 'max_features': None, 'criterion': 'entropy', 'bootstrap': False}. Best is trial 15 with value: 0.14911102021150838.
[D 2025-12-02 11:56:59,025] Sample trial#29 with TPESampler.
[I 2025-12-02 11:57:00,397] Trial 29 finished with value: 0.1445304876665205 and parameters: {'n_estimators': 200, 'max_depth': 4, 'min_samples_split': 19, 'min_samples_leaf': 21, 'max_features': 'log2', 'criterion': 'entropy', 'bootstrap': False}. Best is trial 15 with value: 0.14911102021150838.
[I 2025-12-02 11:57:01,874] A new study created in memory with name: random_forest_fold_4
[D 2025-12-02 11:57:01,874] Sample trial#0 with RandomSampler.
[I 2025-12-02 11:57:04,132] Trial 0 finished with value: 0.16383967809769712 and parameters: {'n_estimators': 250, 'max_depth': 10, 'min_samples_split': 13, 'min_samples_leaf': 21, 'max_features': 'log2', 'criterion': 'gini', 'bootstrap': False}. Best is trial 0 with value: 0.16383967809769712.
[D 2025-12-02 11:57:04,230] Sample trial#1 with TPESampler.
[I 2025-12-02 11:57:05,072] Trial 1 finished with value: 0.1566765660938584 and parameters: {'n_estimators': 100, 'max_depth': 3, 'min_samples_split': 9, 'min_samples_leaf': 21, 'max_features': 'sqrt', 'criterion': 'gini', 'bootstrap': True}. Best is trial 0 with value: 0.16383967809769712.
[D 2025-12-02 11:57:05,167] Sample trial#2 with TPESampler.
[I 2025-12-02 11:57:07,998] Trial 2 finished with value: 0.15971037354114717 and parameters: {'n_estimators': 200, 'max_depth': 11, 'min_samples_split': 15, 'min_samples_leaf': 23, 'max_features': 'sqrt', 'criterion': 'log_loss', 'bootstrap': False}. Best is trial 0 with value: 0.16383967809769712.
[D 2025-12-02 11:57:08,091] Sample trial#3 with TPESampler.
[I 2025-12-02 11:57:10,249] Trial 3 finished with value: 0.15733434075109642 and parameters: {'n_estimators': 225, 'max_depth': 12, 'min_samples_split': 9, 'min_samples_leaf': 23, 'max_features': 'sqrt', 'criterion': 'entropy', 'bootstrap': True}. Best is trial 0 with value: 0.16383967809769712.
[D 2025-12-02 11:57:10,342] Sample trial#4 with TPESampler.
[I 2025-12-02 11:57:23,980] Trial 4 finished with value: 0.08829430103277575 and parameters: {'n_estimators': 125, 'max_depth': 19, 'min_samples_split': 19, 'min_samples_leaf': 17, 'max_features': None, 'criterion': 'log_loss', 'bootstrap': False}. Best is trial 0 with value: 0.16383967809769712.
[D 2025-12-02 11:57:24,080] Sample trial#5 with TPESampler.
[I 2025-12-02 11:57:25,973] Trial 5 finished with value: 0.1559683176971772 and parameters: {'n_estimators': 225, 'max_depth': 13, 'min_samples_split': 7, 'min_samples_leaf': 23, 'max_features': 'sqrt', 'criterion': 'gini', 'bootstrap': True}. Best is trial 0 with value: 0.16383967809769712.
[D 2025-12-02 11:57:26,067] Sample trial#6 with TPESampler.
[I 2025-12-02 11:57:27,347] Trial 6 finished with value: 0.1550733086562665 and parameters: {'n_estimators': 125, 'max_depth': 16, 'min_samples_split': 9, 'min_samples_leaf': 19, 'max_features': 'log2', 'criterion': 'entropy', 'bootstrap': True}. Best is trial 0 with value: 0.16383967809769712.
[D 2025-12-02 11:57:27,438] Sample trial#7 with TPESampler.
[I 2025-12-02 11:57:28,942] Trial 7 finished with value: 0.15471126969253823 and parameters: {'n_estimators': 125, 'max_depth': 10, 'min_samples_split': 13, 'min_samples_leaf': 19, 'max_features': 'log2', 'criterion': 'entropy', 'bootstrap': False}. Best is trial 0 with value: 0.16383967809769712.
[D 2025-12-02 11:57:29,036] Sample trial#8 with TPESampler.
[I 2025-12-02 11:57:32,463] Trial 8 finished with value: 0.1580793479782308 and parameters: {'n_estimators': 250, 'max_depth': 11, 'min_samples_split': 5, 'min_samples_leaf': 25, 'max_features': 'sqrt', 'criterion': 'log_loss', 'bootstrap': False}. Best is trial 0 with value: 0.16383967809769712.
[D 2025-12-02 11:57:32,564] Sample trial#9 with TPESampler.
[I 2025-12-02 11:57:35,177] Trial 9 finished with value: 0.16161523894863078 and parameters: {'n_estimators': 275, 'max_depth': 8, 'min_samples_split': 17, 'min_samples_leaf': 21, 'max_features': 'log2', 'criterion': 'log_loss', 'bootstrap': False}. Best is trial 0 with value: 0.16383967809769712.
[D 2025-12-02 11:57:35,271] Sample trial#10 with TPESampler.
[I 2025-12-02 11:57:38,322] Trial 10 finished with value: 0.15616198676027201 and parameters: {'n_estimators': 300, 'max_depth': 15, 'min_samples_split': 11, 'min_samples_leaf': 19, 'max_features': 'log2', 'criterion': 'gini', 'bootstrap': False}. Best is trial 0 with value: 0.16383967809769712.
[D 2025-12-02 11:57:38,426] Sample trial#11 with TPESampler.
[I 2025-12-02 11:57:40,604] Trial 11 finished with value: 0.1554378878060593 and parameters: {'n_estimators': 250, 'max_depth': 9, 'min_samples_split': 15, 'min_samples_leaf': 23, 'max_features': 'log2', 'criterion': 'gini', 'bootstrap': False}. Best is trial 0 with value: 0.16383967809769712.
[D 2025-12-02 11:57:40,704] Sample trial#12 with TPESampler.
[I 2025-12-02 11:58:06,115] Trial 12 finished with value: 0.11290124546746856 and parameters: {'n_estimators': 300, 'max_depth': 9, 'min_samples_split': 19, 'min_samples_leaf': 17, 'max_features': None, 'criterion': 'log_loss', 'bootstrap': False}. Best is trial 0 with value: 0.16383967809769712.
[D 2025-12-02 11:58:06,215] Sample trial#13 with TPESampler.
[I 2025-12-02 11:58:07,827] Trial 13 finished with value: 0.15525992338025268 and parameters: {'n_estimators': 225, 'max_depth': 6, 'min_samples_split': 15, 'min_samples_leaf': 21, 'max_features': 'log2', 'criterion': 'log_loss', 'bootstrap': True}. Best is trial 0 with value: 0.16383967809769712.
[D 2025-12-02 11:58:07,923] Sample trial#14 with TPESampler.
[I 2025-12-02 11:58:09,482] Trial 14 finished with value: 0.16013972634866364 and parameters: {'n_estimators': 200, 'max_depth': 7, 'min_samples_split': 15, 'min_samples_leaf': 15, 'max_features': 'log2', 'criterion': 'gini', 'bootstrap': False}. Best is trial 0 with value: 0.16383967809769712.
[D 2025-12-02 11:58:09,578] Sample trial#15 with TPESampler.
[I 2025-12-02 11:58:13,051] Trial 15 finished with value: 0.1575993692788272 and parameters: {'n_estimators': 275, 'max_depth': 16, 'min_samples_split': 15, 'min_samples_leaf': 23, 'max_features': 'log2', 'criterion': 'log_loss', 'bootstrap': False}. Best is trial 0 with value: 0.16383967809769712.
[D 2025-12-02 11:58:13,149] Sample trial#16 with TPESampler.
[I 2025-12-02 11:58:15,746] Trial 16 finished with value: 0.1613286625779895 and parameters: {'n_estimators': 275, 'max_depth': 8, 'min_samples_split': 19, 'min_samples_leaf': 21, 'max_features': 'log2', 'criterion': 'log_loss', 'bootstrap': False}. Best is trial 0 with value: 0.16383967809769712.
[D 2025-12-02 11:58:15,848] Sample trial#17 with TPESampler.
[I 2025-12-02 11:58:30,825] Trial 17 finished with value: 0.0944642141447585 and parameters: {'n_estimators': 200, 'max_depth': 11, 'min_samples_split': 7, 'min_samples_leaf': 21, 'max_features': None, 'criterion': 'gini', 'bootstrap': False}. Best is trial 0 with value: 0.16383967809769712.
[D 2025-12-02 11:58:30,923] Sample trial#18 with TPESampler.
[I 2025-12-02 11:58:32,173] Trial 18 finished with value: 0.1605034826053216 and parameters: {'n_estimators': 125, 'max_depth': 6, 'min_samples_split': 19, 'min_samples_leaf': 23, 'max_features': 'log2', 'criterion': 'log_loss', 'bootstrap': False}. Best is trial 0 with value: 0.16383967809769712.
[D 2025-12-02 11:58:32,269] Sample trial#19 with TPESampler.
[I 2025-12-02 11:58:43,696] Trial 19 finished with value: 0.14429173456246236 and parameters: {'n_estimators': 250, 'max_depth': 14, 'min_samples_split': 17, 'min_samples_leaf': 21, 'max_features': None, 'criterion': 'gini', 'bootstrap': True}. Best is trial 0 with value: 0.16383967809769712.
[D 2025-12-02 11:58:43,801] Sample trial#20 with TPESampler.
[I 2025-12-02 11:58:46,394] Trial 20 finished with value: 0.16158947978166371 and parameters: {'n_estimators': 300, 'max_depth': 7, 'min_samples_split': 11, 'min_samples_leaf': 19, 'max_features': 'log2', 'criterion': 'log_loss', 'bootstrap': False}. Best is trial 0 with value: 0.16383967809769712.
[D 2025-12-02 11:58:46,487] Sample trial#21 with TPESampler.
[I 2025-12-02 11:58:48,516] Trial 21 finished with value: 0.16288327840473715 and parameters: {'n_estimators': 275, 'max_depth': 5, 'min_samples_split': 7, 'min_samples_leaf': 17, 'max_features': 'log2', 'criterion': 'log_loss', 'bootstrap': False}. Best is trial 0 with value: 0.16383967809769712.
[D 2025-12-02 11:58:48,617] Sample trial#22 with TPESampler.
[I 2025-12-02 11:58:50,263] Trial 22 finished with value: 0.16408698912194292 and parameters: {'n_estimators': 200, 'max_depth': 6, 'min_samples_split': 5, 'min_samples_leaf': 17, 'max_features': 'log2', 'criterion': 'log_loss', 'bootstrap': False}. Best is trial 22 with value: 0.16408698912194292.
[D 2025-12-02 11:58:50,362] Sample trial#23 with TPESampler.
[I 2025-12-02 11:58:51,911] Trial 23 finished with value: 0.16143705555274684 and parameters: {'n_estimators': 200, 'max_depth': 5, 'min_samples_split': 5, 'min_samples_leaf': 17, 'max_features': 'log2', 'criterion': 'log_loss', 'bootstrap': False}. Best is trial 22 with value: 0.16408698912194292.
[D 2025-12-02 11:58:52,004] Sample trial#24 with TPESampler.
[I 2025-12-02 11:58:53,961] Trial 24 finished with value: 0.15871723310661526 and parameters: {'n_estimators': 300, 'max_depth': 4, 'min_samples_split': 7, 'min_samples_leaf': 15, 'max_features': 'sqrt', 'criterion': 'log_loss', 'bootstrap': True}. Best is trial 22 with value: 0.16408698912194292.
[D 2025-12-02 11:58:54,060] Sample trial#25 with TPESampler.
[I 2025-12-02 11:58:56,484] Trial 25 finished with value: 0.16481371743880455 and parameters: {'n_estimators': 275, 'max_depth': 7, 'min_samples_split': 7, 'min_samples_leaf': 15, 'max_features': 'log2', 'criterion': 'entropy', 'bootstrap': False}. Best is trial 25 with value: 0.16481371743880455.
[D 2025-12-02 11:58:56,587] Sample trial#26 with TPESampler.
[I 2025-12-02 11:58:58,972] Trial 26 finished with value: 0.16240850323581285 and parameters: {'n_estimators': 275, 'max_depth': 7, 'min_samples_split': 5, 'min_samples_leaf': 19, 'max_features': 'log2', 'criterion': 'entropy', 'bootstrap': False}. Best is trial 25 with value: 0.16481371743880455.
[D 2025-12-02 11:58:59,073] Sample trial#27 with TPESampler.
[I 2025-12-02 11:59:13,097] Trial 27 finished with value: 0.12290350166590888 and parameters: {'n_estimators': 225, 'max_depth': 6, 'min_samples_split': 9, 'min_samples_leaf': 15, 'max_features': None, 'criterion': 'entropy', 'bootstrap': False}. Best is trial 25 with value: 0.16481371743880455.
[D 2025-12-02 11:59:13,198] Sample trial#28 with TPESampler.
[I 2025-12-02 11:59:16,300] Trial 28 finished with value: 0.15439775273359974 and parameters: {'n_estimators': 250, 'max_depth': 14, 'min_samples_split': 9, 'min_samples_leaf': 15, 'max_features': 'log2', 'criterion': 'entropy', 'bootstrap': False}. Best is trial 25 with value: 0.16481371743880455.
[D 2025-12-02 11:59:16,416] Sample trial#29 with TPESampler.
[I 2025-12-02 11:59:17,912] Trial 29 finished with value: 0.1559990427130487 and parameters: {'n_estimators': 175, 'max_depth': 10, 'min_samples_split': 5, 'min_samples_leaf': 17, 'max_features': 'log2', 'criterion': 'log_loss', 'bootstrap': True}. Best is trial 25 with value: 0.16481371743880455.
[I 2025-12-02 11:59:19,395] A new study created in memory with name: random_forest_fold_5
[D 2025-12-02 11:59:19,395] Sample trial#0 with RandomSampler.
[I 2025-12-02 11:59:20,999] Trial 0 finished with value: 0.14127730596794896 and parameters: {'n_estimators': 250, 'max_depth': 5, 'min_samples_split': 19, 'min_samples_leaf': 23, 'max_features': 'log2', 'criterion': 'gini', 'bootstrap': True}. Best is trial 0 with value: 0.14127730596794896.
[D 2025-12-02 11:59:21,098] Sample trial#1 with TPESampler.
[I 2025-12-02 11:59:27,399] Trial 1 finished with value: 0.11982539978416759 and parameters: {'n_estimators': 125, 'max_depth': 18, 'min_samples_split': 9, 'min_samples_leaf': 15, 'max_features': None, 'criterion': 'gini', 'bootstrap': True}. Best is trial 0 with value: 0.14127730596794896.
[D 2025-12-02 11:59:27,502] Sample trial#2 with TPESampler.
[I 2025-12-02 11:59:48,631] Trial 2 finished with value: 0.08666935568777386 and parameters: {'n_estimators': 200, 'max_depth': 14, 'min_samples_split': 19, 'min_samples_leaf': 21, 'max_features': None, 'criterion': 'entropy', 'bootstrap': False}. Best is trial 0 with value: 0.14127730596794896.
[D 2025-12-02 11:59:48,732] Sample trial#3 with TPESampler.
[I 2025-12-02 11:59:59,381] Trial 3 finished with value: 0.13113824744338096 and parameters: {'n_estimators': 175, 'max_depth': 14, 'min_samples_split': 15, 'min_samples_leaf': 19, 'max_features': None, 'criterion': 'log_loss', 'bootstrap': True}. Best is trial 0 with value: 0.14127730596794896.
[D 2025-12-02 11:59:59,483] Sample trial#4 with TPESampler.
[I 2025-12-02 12:00:13,980] Trial 4 finished with value: 0.12930371945452857 and parameters: {'n_estimators': 275, 'max_depth': 10, 'min_samples_split': 15, 'min_samples_leaf': 21, 'max_features': None, 'criterion': 'log_loss', 'bootstrap': True}. Best is trial 0 with value: 0.14127730596794896.
[D 2025-12-02 12:00:14,085] Sample trial#5 with TPESampler.
[I 2025-12-02 12:00:26,638] Trial 5 finished with value: 0.0988144402117539 and parameters: {'n_estimators': 175, 'max_depth': 7, 'min_samples_split': 17, 'min_samples_leaf': 21, 'max_features': None, 'criterion': 'entropy', 'bootstrap': False}. Best is trial 0 with value: 0.14127730596794896.
[D 2025-12-02 12:00:26,740] Sample trial#6 with TPESampler.
[I 2025-12-02 12:00:41,270] Trial 6 finished with value: 0.07489879615329852 and parameters: {'n_estimators': 175, 'max_depth': 20, 'min_samples_split': 7, 'min_samples_leaf': 21, 'max_features': None, 'criterion': 'gini', 'bootstrap': False}. Best is trial 0 with value: 0.14127730596794896.
[D 2025-12-02 12:00:41,367] Sample trial#7 with TPESampler.
[I 2025-12-02 12:00:42,975] Trial 7 finished with value: 0.1402617426848382 and parameters: {'n_estimators': 200, 'max_depth': 13, 'min_samples_split': 7, 'min_samples_leaf': 21, 'max_features': 'log2', 'criterion': 'gini', 'bootstrap': True}. Best is trial 0 with value: 0.14127730596794896.
[D 2025-12-02 12:00:43,070] Sample trial#8 with TPESampler.
[I 2025-12-02 12:00:45,110] Trial 8 finished with value: 0.13548499122201713 and parameters: {'n_estimators': 200, 'max_depth': 8, 'min_samples_split': 13, 'min_samples_leaf': 21, 'max_features': 'log2', 'criterion': 'log_loss', 'bootstrap': False}. Best is trial 0 with value: 0.14127730596794896.
[D 2025-12-02 12:00:45,205] Sample trial#9 with TPESampler.
[I 2025-12-02 12:00:48,807] Trial 9 finished with value: 0.1313538353103436 and parameters: {'n_estimators': 250, 'max_depth': 11, 'min_samples_split': 13, 'min_samples_leaf': 17, 'max_features': 'sqrt', 'criterion': 'entropy', 'bootstrap': False}. Best is trial 0 with value: 0.14127730596794896.
[D 2025-12-02 12:00:48,910] Sample trial#10 with TPESampler.
[I 2025-12-02 12:00:50,454] Trial 10 finished with value: 0.14158091639404008 and parameters: {'n_estimators': 225, 'max_depth': 4, 'min_samples_split': 15, 'min_samples_leaf': 21, 'max_features': 'log2', 'criterion': 'gini', 'bootstrap': True}. Best is trial 10 with value: 0.14158091639404008.
[D 2025-12-02 12:00:50,556] Sample trial#11 with TPESampler.
[I 2025-12-02 12:00:52,326] Trial 11 finished with value: 0.1392759213959554 and parameters: {'n_estimators': 275, 'max_depth': 4, 'min_samples_split': 19, 'min_samples_leaf': 25, 'max_features': 'log2', 'criterion': 'gini', 'bootstrap': True}. Best is trial 10 with value: 0.14158091639404008.
[D 2025-12-02 12:00:52,433] Sample trial#12 with TPESampler.
[I 2025-12-02 12:00:53,747] Trial 12 finished with value: 0.1381746487351477 and parameters: {'n_estimators': 200, 'max_depth': 4, 'min_samples_split': 13, 'min_samples_leaf': 19, 'max_features': 'log2', 'criterion': 'gini', 'bootstrap': True}. Best is trial 10 with value: 0.14158091639404008.
[D 2025-12-02 12:00:53,843] Sample trial#13 with TPESampler.
[I 2025-12-02 12:00:55,219] Trial 13 finished with value: 0.1413336758822238 and parameters: {'n_estimators': 175, 'max_depth': 10, 'min_samples_split': 19, 'min_samples_leaf': 21, 'max_features': 'log2', 'criterion': 'gini', 'bootstrap': True}. Best is trial 10 with value: 0.14158091639404008.
[D 2025-12-02 12:00:55,316] Sample trial#14 with TPESampler.
[I 2025-12-02 12:00:56,386] Trial 14 finished with value: 0.1376813326994219 and parameters: {'n_estimators': 125, 'max_depth': 13, 'min_samples_split': 15, 'min_samples_leaf': 23, 'max_features': 'log2', 'criterion': 'gini', 'bootstrap': True}. Best is trial 10 with value: 0.14158091639404008.
[D 2025-12-02 12:00:56,482] Sample trial#15 with TPESampler.
[I 2025-12-02 12:00:58,237] Trial 15 finished with value: 0.13760536083426672 and parameters: {'n_estimators': 200, 'max_depth': 13, 'min_samples_split': 19, 'min_samples_leaf': 23, 'max_features': 'log2', 'criterion': 'entropy', 'bootstrap': True}. Best is trial 10 with value: 0.14158091639404008.
[D 2025-12-02 12:00:58,337] Sample trial#16 with TPESampler.
[I 2025-12-02 12:01:00,072] Trial 16 finished with value: 0.1338168576172818 and parameters: {'n_estimators': 225, 'max_depth': 15, 'min_samples_split': 19, 'min_samples_leaf': 19, 'max_features': 'log2', 'criterion': 'gini', 'bootstrap': True}. Best is trial 10 with value: 0.14158091639404008.
[D 2025-12-02 12:01:00,170] Sample trial#17 with TPESampler.
[I 2025-12-02 12:01:01,827] Trial 17 finished with value: 0.14246499821900857 and parameters: {'n_estimators': 250, 'max_depth': 3, 'min_samples_split': 9, 'min_samples_leaf': 21, 'max_features': 'log2', 'criterion': 'entropy', 'bootstrap': True}. Best is trial 17 with value: 0.14246499821900857.
[D 2025-12-02 12:01:01,933] Sample trial#18 with TPESampler.
[I 2025-12-02 12:01:03,724] Trial 18 finished with value: 0.1414620018224721 and parameters: {'n_estimators': 275, 'max_depth': 4, 'min_samples_split': 9, 'min_samples_leaf': 19, 'max_features': 'log2', 'criterion': 'entropy', 'bootstrap': True}. Best is trial 17 with value: 0.14246499821900857.
[D 2025-12-02 12:01:03,832] Sample trial#19 with TPESampler.
[I 2025-12-02 12:01:05,163] Trial 19 finished with value: 0.13958038336758544 and parameters: {'n_estimators': 175, 'max_depth': 3, 'min_samples_split': 9, 'min_samples_leaf': 25, 'max_features': 'log2', 'criterion': 'entropy', 'bootstrap': True}. Best is trial 17 with value: 0.14246499821900857.
[D 2025-12-02 12:01:05,271] Sample trial#20 with TPESampler.
[I 2025-12-02 12:01:07,315] Trial 20 finished with value: 0.13860018059841472 and parameters: {'n_estimators': 300, 'max_depth': 6, 'min_samples_split': 5, 'min_samples_leaf': 25, 'max_features': 'log2', 'criterion': 'entropy', 'bootstrap': True}. Best is trial 17 with value: 0.14246499821900857.
[D 2025-12-02 12:01:07,421] Sample trial#21 with TPESampler.
[I 2025-12-02 12:01:09,263] Trial 21 finished with value: 0.1418773634162027 and parameters: {'n_estimators': 275, 'max_depth': 3, 'min_samples_split': 7, 'min_samples_leaf': 15, 'max_features': 'log2', 'criterion': 'entropy', 'bootstrap': True}. Best is trial 17 with value: 0.14246499821900857.
[D 2025-12-02 12:01:09,372] Sample trial#22 with TPESampler.
[I 2025-12-02 12:01:10,961] Trial 22 finished with value: 0.14198269799487498 and parameters: {'n_estimators': 250, 'max_depth': 5, 'min_samples_split': 9, 'min_samples_leaf': 15, 'max_features': 'log2', 'criterion': 'log_loss', 'bootstrap': True}. Best is trial 17 with value: 0.14246499821900857.
[D 2025-12-02 12:01:11,055] Sample trial#23 with TPESampler.
