[I 2025-12-02 12:45:13,829] Trial 4 finished with value: 0.17107801300261938 and parameters: {'n_estimators': 300, 'learning_rate': 0.049531431778917896, 'max_depth': 3, 'min_samples_split': 11, 'min_samples_leaf': 15, 'subsample': 0.9418439117734762, 'max_features': 'sqrt'}. Best is trial 4 with value: 0.17107801300261938.
[D 2025-12-02 12:45:13,933] Sample trial#5 with TPESampler.
[I 2025-12-02 12:48:13,825] Trial 5 finished with value: 0.16693127080077858 and parameters: {'n_estimators': 300, 'learning_rate': 0.027216556707399808, 'max_depth': 5, 'min_samples_split': 18, 'min_samples_leaf': 14, 'subsample': 0.9697285885556164, 'max_features': None}. Best is trial 4 with value: 0.17107801300261938.
[D 2025-12-02 12:48:13,927] Sample trial#6 with TPESampler.
[I 2025-12-02 12:48:51,745] Trial 6 finished with value: 0.15729437393834597 and parameters: {'n_estimators': 150, 'learning_rate': 0.01578812624690611, 'max_depth': 2, 'min_samples_split': 20, 'min_samples_leaf': 15, 'subsample': 0.9792594924548492, 'max_features': None}. Best is trial 4 with value: 0.17107801300261938.
[D 2025-12-02 12:48:51,849] Sample trial#7 with TPESampler.
[I 2025-12-02 12:52:18,389] Trial 7 finished with value: 0.1333267932877025 and parameters: {'n_estimators': 250, 'learning_rate': 0.0993699826019578, 'max_depth': 7, 'min_samples_split': 7, 'min_samples_leaf': 5, 'subsample': 0.970669920207852, 'max_features': None}. Best is trial 4 with value: 0.17107801300261938.
[D 2025-12-02 12:52:18,490] Sample trial#8 with TPESampler.
[I 2025-12-02 12:52:43,160] Trial 8 finished with value: 0.12385839115760156 and parameters: {'n_estimators': 300, 'learning_rate': 0.07701211097696488, 'max_depth': 8, 'min_samples_split': 4, 'min_samples_leaf': 18, 'subsample': 0.828429457170446, 'max_features': 'log2'}. Best is trial 4 with value: 0.17107801300261938.
[D 2025-12-02 12:52:43,263] Sample trial#9 with TPESampler.
[I 2025-12-02 12:53:50,395] Trial 9 finished with value: 0.16022528479243164 and parameters: {'n_estimators': 100, 'learning_rate': 0.025148389868086582, 'max_depth': 7, 'min_samples_split': 2, 'min_samples_leaf': 16, 'subsample': 0.8036239071890251, 'max_features': None}. Best is trial 4 with value: 0.17107801300261938.
[D 2025-12-02 12:53:50,497] Sample trial#10 with TPESampler.
[I 2025-12-02 12:54:00,870] Trial 10 finished with value: 0.164741903880726 and parameters: {'n_estimators': 300, 'learning_rate': 0.07826268210157816, 'max_depth': 2, 'min_samples_split': 12, 'min_samples_leaf': 18, 'subsample': 0.9517017443904722, 'max_features': 'sqrt'}. Best is trial 4 with value: 0.17107801300261938.
[D 2025-12-02 12:54:00,971] Sample trial#11 with TPESampler.
[I 2025-12-02 12:54:51,821] Trial 11 finished with value: 0.16556606240750732 and parameters: {'n_estimators': 250, 'learning_rate': 0.03638534511948892, 'max_depth': 2, 'min_samples_split': 6, 'min_samples_leaf': 14, 'subsample': 0.8008519852065538, 'max_features': None}. Best is trial 4 with value: 0.17107801300261938.
[D 2025-12-02 12:54:51,923] Sample trial#12 with TPESampler.
[I 2025-12-02 12:55:06,007] Trial 12 finished with value: 0.17656990201037384 and parameters: {'n_estimators': 300, 'learning_rate': 0.04562355370950133, 'max_depth': 3, 'min_samples_split': 12, 'min_samples_leaf': 8, 'subsample': 0.8956928595455814, 'max_features': 'sqrt'}. Best is trial 12 with value: 0.17656990201037384.
[D 2025-12-02 12:55:06,110] Sample trial#13 with TPESampler.
[I 2025-12-02 12:55:20,061] Trial 13 finished with value: 0.17278816224407678 and parameters: {'n_estimators': 300, 'learning_rate': 0.019992891389909354, 'max_depth': 3, 'min_samples_split': 10, 'min_samples_leaf': 7, 'subsample': 0.890159919857471, 'max_features': 'sqrt'}. Best is trial 12 with value: 0.17656990201037384.
[D 2025-12-02 12:55:20,163] Sample trial#14 with TPESampler.
[I 2025-12-02 12:55:35,282] Trial 14 finished with value: 0.17324153577451626 and parameters: {'n_estimators': 300, 'learning_rate': 0.020072402163283973, 'max_depth': 3, 'min_samples_split': 7, 'min_samples_leaf': 6, 'subsample': 0.9654011947920396, 'max_features': 'sqrt'}. Best is trial 12 with value: 0.17656990201037384.
[D 2025-12-02 12:55:35,385] Sample trial#15 with TPESampler.
[I 2025-12-02 12:55:50,693] Trial 15 finished with value: 0.1732173677993573 and parameters: {'n_estimators': 300, 'learning_rate': 0.03219940871202105, 'max_depth': 3, 'min_samples_split': 3, 'min_samples_leaf': 3, 'subsample': 0.9783466695967703, 'max_features': 'sqrt'}. Best is trial 12 with value: 0.17656990201037384.
[D 2025-12-02 12:55:50,796] Sample trial#16 with TPESampler.
[I 2025-12-02 12:56:13,370] Trial 16 finished with value: 0.1594588136576529 and parameters: {'n_estimators': 300, 'learning_rate': 0.06096379936407568, 'max_depth': 5, 'min_samples_split': 3, 'min_samples_leaf': 11, 'subsample': 0.8941940142523288, 'max_features': 'sqrt'}. Best is trial 12 with value: 0.17656990201037384.
[D 2025-12-02 12:56:13,472] Sample trial#17 with TPESampler.
[I 2025-12-02 12:56:24,188] Trial 17 finished with value: 0.16416851532546417 and parameters: {'n_estimators': 300, 'learning_rate': 0.013124158632812171, 'max_depth': 2, 'min_samples_split': 13, 'min_samples_leaf': 3, 'subsample': 0.9967048886191967, 'max_features': 'sqrt'}. Best is trial 12 with value: 0.17656990201037384.
[D 2025-12-02 12:56:24,292] Sample trial#18 with TPESampler.
[I 2025-12-02 12:56:36,130] Trial 18 finished with value: 0.1790207653185072 and parameters: {'n_estimators': 250, 'learning_rate': 0.06471335472457354, 'max_depth': 3, 'min_samples_split': 15, 'min_samples_leaf': 3, 'subsample': 0.9004409563124749, 'max_features': 'sqrt'}. Best is trial 18 with value: 0.1790207653185072.
[D 2025-12-02 12:56:36,232] Sample trial#19 with TPESampler.
[I 2025-12-02 12:56:48,995] Trial 19 finished with value: 0.17921280198437298 and parameters: {'n_estimators': 200, 'learning_rate': 0.042279705763015527, 'max_depth': 4, 'min_samples_split': 17, 'min_samples_leaf': 1, 'subsample': 0.9365688077061874, 'max_features': 'sqrt'}. Best is trial 19 with value: 0.17921280198437298.
[D 2025-12-02 12:56:49,097] Sample trial#20 with TPESampler.
[I 2025-12-02 12:56:58,962] Trial 20 finished with value: 0.17217563243876163 and parameters: {'n_estimators': 150, 'learning_rate': 0.03838365152332447, 'max_depth': 4, 'min_samples_split': 18, 'min_samples_leaf': 1, 'subsample': 0.9653981467766123, 'max_features': 'sqrt'}. Best is trial 19 with value: 0.17921280198437298.
[D 2025-12-02 12:56:59,063] Sample trial#21 with TPESampler.
[I 2025-12-02 12:57:10,692] Trial 21 finished with value: 0.1627956647619032 and parameters: {'n_estimators': 250, 'learning_rate': 0.09317616057592759, 'max_depth': 3, 'min_samples_split': 15, 'min_samples_leaf': 4, 'subsample': 0.8835611687314247, 'max_features': 'sqrt'}. Best is trial 19 with value: 0.17921280198437298.
[D 2025-12-02 12:57:10,795] Sample trial#22 with TPESampler.
[I 2025-12-02 12:57:20,008] Trial 22 finished with value: 0.174514782596624 and parameters: {'n_estimators': 200, 'learning_rate': 0.051503816136304253, 'max_depth': 3, 'min_samples_split': 20, 'min_samples_leaf': 9, 'subsample': 0.8770334471106107, 'max_features': 'sqrt'}. Best is trial 19 with value: 0.17921280198437298.
[D 2025-12-02 12:57:20,112] Sample trial#23 with TPESampler.
[I 2025-12-02 12:57:29,497] Trial 23 finished with value: 0.17490268666975084 and parameters: {'n_estimators': 200, 'learning_rate': 0.04074217861198591, 'max_depth': 3, 'min_samples_split': 11, 'min_samples_leaf': 2, 'subsample': 0.8916063823323974, 'max_features': 'sqrt'}. Best is trial 19 with value: 0.17921280198437298.
[D 2025-12-02 12:57:29,601] Sample trial#24 with TPESampler.
[I 2025-12-02 12:57:37,018] Trial 24 finished with value: 0.1696909750978473 and parameters: {'n_estimators': 300, 'learning_rate': 0.059291772109166106, 'max_depth': 2, 'min_samples_split': 12, 'min_samples_leaf': 8, 'subsample': 0.8627190312922102, 'max_features': 'log2'}. Best is trial 19 with value: 0.17921280198437298.
[D 2025-12-02 12:57:37,121] Sample trial#25 with TPESampler.
[I 2025-12-02 12:57:49,772] Trial 25 finished with value: 0.17708396300603368 and parameters: {'n_estimators': 250, 'learning_rate': 0.061408187380125094, 'max_depth': 4, 'min_samples_split': 17, 'min_samples_leaf': 1, 'subsample': 0.9630967803044691, 'max_features': 'log2'}. Best is trial 19 with value: 0.17921280198437298.
[D 2025-12-02 12:57:49,875] Sample trial#26 with TPESampler.
[I 2025-12-02 12:58:09,034] Trial 26 finished with value: 0.15927819632248677 and parameters: {'n_estimators': 300, 'learning_rate': 0.06407455396460192, 'max_depth': 5, 'min_samples_split': 15, 'min_samples_leaf': 1, 'subsample': 0.9919042291924134, 'max_features': 'log2'}. Best is trial 19 with value: 0.17921280198437298.
[D 2025-12-02 12:58:09,137] Sample trial#27 with TPESampler.
[I 2025-12-02 12:59:40,133] Trial 27 finished with value: 0.16747072037337601 and parameters: {'n_estimators': 250, 'learning_rate': 0.0786097902071456, 'max_depth': 3, 'min_samples_split': 18, 'min_samples_leaf': 4, 'subsample': 0.9576340943207338, 'max_features': None}. Best is trial 19 with value: 0.17921280198437298.
[D 2025-12-02 12:59:40,236] Sample trial#28 with TPESampler.
[I 2025-12-02 12:59:54,762] Trial 28 finished with value: 0.17206592437096718 and parameters: {'n_estimators': 200, 'learning_rate': 0.04118857320981692, 'max_depth': 6, 'min_samples_split': 17, 'min_samples_leaf': 3, 'subsample': 0.9461779978826392, 'max_features': 'log2'}. Best is trial 19 with value: 0.17921280198437298.
[D 2025-12-02 12:59:54,865] Sample trial#29 with TPESampler.
[I 2025-12-02 13:00:16,868] Trial 29 finished with value: 0.15891635733459009 and parameters: {'n_estimators': 250, 'learning_rate': 0.05402658245495768, 'max_depth': 6, 'min_samples_split': 16, 'min_samples_leaf': 2, 'subsample': 0.8868838164400967, 'max_features': 'sqrt'}. Best is trial 19 with value: 0.17921280198437298.
[I 2025-12-02 13:00:20,760] A new study created in memory with name: gradient_boosting_fold_4
[D 2025-12-02 13:00:20,760] Sample trial#0 with RandomSampler.
[I 2025-12-02 13:00:53,949] Trial 0 finished with value: 0.1538712111679864 and parameters: {'n_estimators': 300, 'learning_rate': 0.08783380347775853, 'max_depth': 7, 'min_samples_split': 19, 'min_samples_leaf': 2, 'subsample': 0.9629257136549099, 'max_features': 'sqrt'}. Best is trial 0 with value: 0.1538712111679864.
[D 2025-12-02 13:00:54,056] Sample trial#1 with TPESampler.
[I 2025-12-02 13:01:05,149] Trial 1 finished with value: 0.1859830811338294 and parameters: {'n_estimators': 300, 'learning_rate': 0.022158803194689436, 'max_depth': 3, 'min_samples_split': 10, 'min_samples_leaf': 20, 'subsample': 0.9043129065829995, 'max_features': 'log2'}. Best is trial 1 with value: 0.1859830811338294.
[D 2025-12-02 13:01:05,254] Sample trial#2 with TPESampler.
[I 2025-12-02 13:01:25,236] Trial 2 finished with value: 0.17928856177951602 and parameters: {'n_estimators': 250, 'learning_rate': 0.05666649763931027, 'max_depth': 5, 'min_samples_split': 7, 'min_samples_leaf': 10, 'subsample': 0.9535943446567727, 'max_features': 'sqrt'}. Best is trial 1 with value: 0.1859830811338294.
[D 2025-12-02 13:01:25,342] Sample trial#3 with TPESampler.
[I 2025-12-02 13:01:35,113] Trial 3 finished with value: 0.18994200874022726 and parameters: {'n_estimators': 150, 'learning_rate': 0.015576597741541721, 'max_depth': 4, 'min_samples_split': 17, 'min_samples_leaf': 5, 'subsample': 0.95677156292215, 'max_features': 'sqrt'}. Best is trial 3 with value: 0.18994200874022726.
[D 2025-12-02 13:01:35,219] Sample trial#4 with TPESampler.
[I 2025-12-02 13:01:44,796] Trial 4 finished with value: 0.19356923661037545 and parameters: {'n_estimators': 250, 'learning_rate': 0.015595997550449003, 'max_depth': 3, 'min_samples_split': 16, 'min_samples_leaf': 10, 'subsample': 0.9415852248953784, 'max_features': 'log2'}. Best is trial 4 with value: 0.19356923661037545.
[D 2025-12-02 13:01:44,901] Sample trial#5 with TPESampler.
[I 2025-12-02 13:03:27,165] Trial 5 finished with value: 0.17612695069653347 and parameters: {'n_estimators': 150, 'learning_rate': 0.03629195539086234, 'max_depth': 6, 'min_samples_split': 4, 'min_samples_leaf': 13, 'subsample': 0.9307333948618287, 'max_features': None}. Best is trial 4 with value: 0.19356923661037545.
[D 2025-12-02 13:03:27,271] Sample trial#6 with TPESampler.
[I 2025-12-02 13:03:31,774] Trial 6 finished with value: 0.18888207962791817 and parameters: {'n_estimators': 100, 'learning_rate': 0.009375621416194949, 'max_depth': 4, 'min_samples_split': 2, 'min_samples_leaf': 4, 'subsample': 0.8306857987959141, 'max_features': 'log2'}. Best is trial 4 with value: 0.19356923661037545.
[D 2025-12-02 13:03:31,879] Sample trial#7 with TPESampler.
[I 2025-12-02 13:04:58,273] Trial 7 finished with value: 0.1678149866682997 and parameters: {'n_estimators': 250, 'learning_rate': 0.08592272249637835, 'max_depth': 3, 'min_samples_split': 11, 'min_samples_leaf': 19, 'subsample': 0.906018600181969, 'max_features': None}. Best is trial 4 with value: 0.19356923661037545.
[D 2025-12-02 13:04:58,378] Sample trial#8 with TPESampler.
[I 2025-12-02 13:09:04,528] Trial 8 finished with value: 0.1493750552712349 and parameters: {'n_estimators': 300, 'learning_rate': 0.0587202620493428, 'max_depth': 7, 'min_samples_split': 15, 'min_samples_leaf': 15, 'subsample': 0.9737205398237029, 'max_features': None}. Best is trial 4 with value: 0.19356923661037545.
[D 2025-12-02 13:09:04,632] Sample trial#9 with TPESampler.
[I 2025-12-02 13:09:11,644] Trial 9 finished with value: 0.19036396665211747 and parameters: {'n_estimators': 150, 'learning_rate': 0.07912204773899853, 'max_depth': 3, 'min_samples_split': 3, 'min_samples_leaf': 10, 'subsample': 0.877556478972733, 'max_features': 'sqrt'}. Best is trial 4 with value: 0.19356923661037545.
[D 2025-12-02 13:09:11,749] Sample trial#10 with TPESampler.
[I 2025-12-02 13:09:19,553] Trial 10 finished with value: 0.18429590376221514 and parameters: {'n_estimators': 300, 'learning_rate': 0.019536884638904392, 'max_depth': 2, 'min_samples_split': 12, 'min_samples_leaf': 7, 'subsample': 0.9014763839744302, 'max_features': 'log2'}. Best is trial 4 with value: 0.19356923661037545.
[D 2025-12-02 13:09:19,658] Sample trial#11 with TPESampler.
[I 2025-12-02 13:09:24,060] Trial 11 finished with value: 0.18721056007198608 and parameters: {'n_estimators': 100, 'learning_rate': 0.06980317222646491, 'max_depth': 3, 'min_samples_split': 3, 'min_samples_leaf': 7, 'subsample': 0.8244387660381725, 'max_features': 'sqrt'}. Best is trial 4 with value: 0.19356923661037545.
[D 2025-12-02 13:09:24,165] Sample trial#12 with TPESampler.
[I 2025-12-02 13:09:33,691] Trial 12 finished with value: 0.17853946715707678 and parameters: {'n_estimators': 150, 'learning_rate': 0.08955330494632524, 'max_depth': 4, 'min_samples_split': 7, 'min_samples_leaf': 6, 'subsample': 0.92980182143697, 'max_features': 'sqrt'}. Best is trial 4 with value: 0.19356923661037545.
[D 2025-12-02 13:09:33,796] Sample trial#13 with TPESampler.
[I 2025-12-02 13:09:55,280] Trial 13 finished with value: 0.18992972563633062 and parameters: {'n_estimators': 300, 'learning_rate': 0.021962668686217324, 'max_depth': 6, 'min_samples_split': 16, 'min_samples_leaf': 11, 'subsample': 0.9330236151693462, 'max_features': 'log2'}. Best is trial 4 with value: 0.19356923661037545.
[D 2025-12-02 13:09:55,387] Sample trial#14 with TPESampler.
[I 2025-12-02 13:10:02,906] Trial 14 finished with value: 0.18746402522391076 and parameters: {'n_estimators': 200, 'learning_rate': 0.03754191361742883, 'max_depth': 3, 'min_samples_split': 19, 'min_samples_leaf': 14, 'subsample': 0.9248959781568032, 'max_features': 'log2'}. Best is trial 4 with value: 0.19356923661037545.
[D 2025-12-02 13:10:03,010] Sample trial#15 with TPESampler.
[I 2025-12-02 13:10:08,563] Trial 15 finished with value: 0.18148254666699049 and parameters: {'n_estimators': 200, 'learning_rate': 0.022074574485451665, 'max_depth': 2, 'min_samples_split': 9, 'min_samples_leaf': 10, 'subsample': 0.9784922273751516, 'max_features': 'log2'}. Best is trial 4 with value: 0.19356923661037545.
[D 2025-12-02 13:10:08,667] Sample trial#16 with TPESampler.
[I 2025-12-02 13:10:13,826] Trial 16 finished with value: 0.18883867115060674 and parameters: {'n_estimators': 200, 'learning_rate': 0.08443826680545427, 'max_depth': 2, 'min_samples_split': 2, 'min_samples_leaf': 5, 'subsample': 0.8908493396437568, 'max_features': 'log2'}. Best is trial 4 with value: 0.19356923661037545.
[D 2025-12-02 13:10:13,930] Sample trial#17 with TPESampler.
[I 2025-12-02 13:10:20,344] Trial 17 finished with value: 0.1813699284414928 and parameters: {'n_estimators': 200, 'learning_rate': 0.06712851314688252, 'max_depth': 2, 'min_samples_split': 11, 'min_samples_leaf': 14, 'subsample': 0.8577665890264624, 'max_features': 'sqrt'}. Best is trial 4 with value: 0.19356923661037545.
[D 2025-12-02 13:10:20,447] Sample trial#18 with TPESampler.
[I 2025-12-02 13:10:33,135] Trial 18 finished with value: 0.19261645720123113 and parameters: {'n_estimators': 200, 'learning_rate': 0.0245537777541993, 'max_depth': 5, 'min_samples_split': 17, 'min_samples_leaf': 7, 'subsample': 0.9829922218318566, 'max_features': 'log2'}. Best is trial 4 with value: 0.19356923661037545.
[D 2025-12-02 13:10:33,239] Sample trial#19 with TPESampler.
[I 2025-12-02 13:10:45,819] Trial 19 finished with value: 0.1760187621290412 and parameters: {'n_estimators': 150, 'learning_rate': 0.04929567421477324, 'max_depth': 7, 'min_samples_split': 19, 'min_samples_leaf': 12, 'subsample': 0.9450592080251358, 'max_features': 'log2'}. Best is trial 4 with value: 0.19356923661037545.
[D 2025-12-02 13:10:45,925] Sample trial#20 with TPESampler.
[I 2025-12-02 13:10:59,101] Trial 20 finished with value: 0.18525901088832253 and parameters: {'n_estimators': 150, 'learning_rate': 0.03754093297143387, 'max_depth': 7, 'min_samples_split': 11, 'min_samples_leaf': 7, 'subsample': 0.9880394562172659, 'max_features': 'log2'}. Best is trial 4 with value: 0.19356923661037545.
[D 2025-12-02 13:10:59,207] Sample trial#21 with TPESampler.
[I 2025-12-02 13:11:06,119] Trial 21 finished with value: 0.1836000638702509 and parameters: {'n_estimators': 250, 'learning_rate': 0.032107544399875586, 'max_depth': 2, 'min_samples_split': 20, 'min_samples_leaf': 8, 'subsample': 0.9791061183311457, 'max_features': 'log2'}. Best is trial 4 with value: 0.19356923661037545.
[D 2025-12-02 13:11:06,222] Sample trial#22 with TPESampler.
[I 2025-12-02 13:11:18,407] Trial 22 finished with value: 0.19487856064287512 and parameters: {'n_estimators': 200, 'learning_rate': 0.031073835934733264, 'max_depth': 5, 'min_samples_split': 18, 'min_samples_leaf': 6, 'subsample': 0.9399699881144048, 'max_features': 'log2'}. Best is trial 22 with value: 0.19487856064287512.
[D 2025-12-02 13:11:18,511] Sample trial#23 with TPESampler.
[I 2025-12-02 13:11:30,633] Trial 23 finished with value: 0.1857819622659155 and parameters: {'n_estimators': 200, 'learning_rate': 0.04061256788634391, 'max_depth': 5, 'min_samples_split': 19, 'min_samples_leaf': 3, 'subsample': 0.9288364021312288, 'max_features': 'log2'}. Best is trial 22 with value: 0.19487856064287512.
[D 2025-12-02 13:11:30,737] Sample trial#24 with TPESampler.
[I 2025-12-02 13:11:43,269] Trial 24 finished with value: 0.19056214204295246 and parameters: {'n_estimators': 200, 'learning_rate': 0.010818610680811448, 'max_depth': 5, 'min_samples_split': 16, 'min_samples_leaf': 7, 'subsample': 0.9699002726495717, 'max_features': 'log2'}. Best is trial 22 with value: 0.19487856064287512.
[D 2025-12-02 13:11:43,374] Sample trial#25 with TPESampler.
[I 2025-12-02 13:13:31,354] Trial 25 finished with value: 0.18561344206699176 and parameters: {'n_estimators': 300, 'learning_rate': 0.021449019015779502, 'max_depth': 3, 'min_samples_split': 17, 'min_samples_leaf': 15, 'subsample': 0.9452679218190102, 'max_features': None}. Best is trial 22 with value: 0.19487856064287512.
[D 2025-12-02 13:13:31,460] Sample trial#26 with TPESampler.
[I 2025-12-02 13:13:44,477] Trial 26 finished with value: 0.18355393785938487 and parameters: {'n_estimators': 250, 'learning_rate': 0.05395433988678762, 'max_depth': 4, 'min_samples_split': 11, 'min_samples_leaf': 3, 'subsample': 0.9873174828669407, 'max_features': 'log2'}. Best is trial 22 with value: 0.19487856064287512.
[D 2025-12-02 13:13:44,580] Sample trial#27 with TPESampler.
[I 2025-12-02 13:14:11,311] Trial 27 finished with value: 0.18686355701005777 and parameters: {'n_estimators': 250, 'learning_rate': 0.027465610786069967, 'max_depth': 7, 'min_samples_split': 13, 'min_samples_leaf': 2, 'subsample': 0.9270385945126528, 'max_features': 'sqrt'}. Best is trial 22 with value: 0.19487856064287512.
[D 2025-12-02 13:14:11,416] Sample trial#28 with TPESampler.
[I 2025-12-02 13:14:20,275] Trial 28 finished with value: 0.17889675083207085 and parameters: {'n_estimators': 250, 'learning_rate': 0.011538062345435293, 'max_depth': 2, 'min_samples_split': 16, 'min_samples_leaf': 12, 'subsample': 0.9723073423610432, 'max_features': 'sqrt'}. Best is trial 22 with value: 0.19487856064287512.
[D 2025-12-02 13:14:20,383] Sample trial#29 with TPESampler.
[I 2025-12-02 13:14:27,364] Trial 29 finished with value: 0.19020126212562433 and parameters: {'n_estimators': 150, 'learning_rate': 0.03574623373177659, 'max_depth': 4, 'min_samples_split': 12, 'min_samples_leaf': 9, 'subsample': 0.8719587037619171, 'max_features': 'log2'}. Best is trial 22 with value: 0.19487856064287512.
[I 2025-12-02 13:14:31,090] A new study created in memory with name: gradient_boosting_fold_5
[D 2025-12-02 13:14:31,090] Sample trial#0 with RandomSampler.
