[I 2025-12-02 14:06:42,787] Trial 17 finished with value: 0.17446260577638673 and parameters: {'iterations': 600, 'learning_rate': 0.016168118803805424, 'depth': 4, 'l2_leaf_reg': 6.251914289205143, 'border_count': 221, 'bagging_temperature': 0.5556578162303631, 'random_strength': 0.3559800567770826, 'scale_pos_weight': 5.118392505840409}. Best is trial 12 with value: 0.17596800890026204.
[D 2025-12-02 14:06:42,917] Sample trial#18 with GPSampler.
[I 2025-12-02 14:06:45,611] Trial 18 finished with value: 0.17140766380903644 and parameters: {'iterations': 400, 'learning_rate': 0.017576964756756106, 'depth': 4, 'l2_leaf_reg': 2.2926881006010613, 'border_count': 202, 'bagging_temperature': 0.5836901017355177, 'random_strength': 0.30867657020173467, 'scale_pos_weight': 5.0}. Best is trial 12 with value: 0.17596800890026204.
[D 2025-12-02 14:06:45,740] Sample trial#19 with GPSampler.
[I 2025-12-02 14:06:49,885] Trial 19 finished with value: 0.1717645088739252 and parameters: {'iterations': 700, 'learning_rate': 0.01756398577568458, 'depth': 4, 'l2_leaf_reg': 7.3498684532580825, 'border_count': 210, 'bagging_temperature': 0.4864425362183556, 'random_strength': 0.30771183231149035, 'scale_pos_weight': 5.232089854380969}. Best is trial 12 with value: 0.17596800890026204.
[D 2025-12-02 14:06:50,014] Sample trial#20 with GPSampler.
[I 2025-12-02 14:06:53,290] Trial 20 finished with value: 0.1695153945181347 and parameters: {'iterations': 500, 'learning_rate': 0.018441023677151877, 'depth': 4, 'l2_leaf_reg': 6.264502618740525, 'border_count': 191, 'bagging_temperature': 0.6909423406626798, 'random_strength': 0.0, 'scale_pos_weight': 5.071339490428786}. Best is trial 12 with value: 0.17596800890026204.
[D 2025-12-02 14:06:53,420] Sample trial#21 with GPSampler.
[I 2025-12-02 14:06:57,085] Trial 21 finished with value: 0.17478470942703825 and parameters: {'iterations': 600, 'learning_rate': 0.016458105659854255, 'depth': 4, 'l2_leaf_reg': 6.4395482944017965, 'border_count': 186, 'bagging_temperature': 0.7326776295089928, 'random_strength': 0.5949112082096438, 'scale_pos_weight': 5.0974739964027584}. Best is trial 12 with value: 0.17596800890026204.
[D 2025-12-02 14:06:57,215] Sample trial#22 with GPSampler.
[I 2025-12-02 14:07:00,307] Trial 22 finished with value: 0.1724505133342021 and parameters: {'iterations': 500, 'learning_rate': 0.02, 'depth': 4, 'l2_leaf_reg': 8.199495710181528, 'border_count': 224, 'bagging_temperature': 0.7987976047941582, 'random_strength': 0.5172524976908245, 'scale_pos_weight': 5.3519663637574215}. Best is trial 12 with value: 0.17596800890026204.
[D 2025-12-02 14:07:00,437] Sample trial#23 with GPSampler.
[I 2025-12-02 14:07:04,325] Trial 23 finished with value: 0.17251219913333676 and parameters: {'iterations': 600, 'learning_rate': 0.01619034900952626, 'depth': 4, 'l2_leaf_reg': 4.887748051194098, 'border_count': 204, 'bagging_temperature': 0.6098437639086582, 'random_strength': 0.5061770133324686, 'scale_pos_weight': 5.131295310816727}. Best is trial 12 with value: 0.17596800890026204.
[D 2025-12-02 14:07:04,455] Sample trial#24 with GPSampler.
[I 2025-12-02 14:07:07,227] Trial 24 finished with value: 0.17715565978058506 and parameters: {'iterations': 400, 'learning_rate': 0.015550564773192214, 'depth': 4, 'l2_leaf_reg': 10.0, 'border_count': 255, 'bagging_temperature': 0.4337864838791545, 'random_strength': 0.4598676444439753, 'scale_pos_weight': 5.0}. Best is trial 24 with value: 0.17715565978058506.
[D 2025-12-02 14:07:07,357] Sample trial#25 with GPSampler.
[I 2025-12-02 14:07:09,883] Trial 25 finished with value: 0.17546746188146917 and parameters: {'iterations': 400, 'learning_rate': 0.013478692089318383, 'depth': 4, 'l2_leaf_reg': 10.0, 'border_count': 255, 'bagging_temperature': 0.0, 'random_strength': 0.2623290557683591, 'scale_pos_weight': 5.0}. Best is trial 24 with value: 0.17715565978058506.
[D 2025-12-02 14:07:10,013] Sample trial#26 with GPSampler.
[I 2025-12-02 14:07:13,179] Trial 26 finished with value: 0.1777952259840922 and parameters: {'iterations': 500, 'learning_rate': 0.015284037241658322, 'depth': 4, 'l2_leaf_reg': 10.0, 'border_count': 255, 'bagging_temperature': 0.5163126460698586, 'random_strength': 0.5540775479897095, 'scale_pos_weight': 5.0}. Best is trial 26 with value: 0.1777952259840922.
[D 2025-12-02 14:07:13,311] Sample trial#27 with GPSampler.
[I 2025-12-02 14:07:17,336] Trial 27 finished with value: 0.15056366392948844 and parameters: {'iterations': 1000, 'learning_rate': 0.001, 'depth': 2, 'l2_leaf_reg': 10.0, 'border_count': 255, 'bagging_temperature': 0.0, 'random_strength': 1.0, 'scale_pos_weight': 5.0}. Best is trial 26 with value: 0.1777952259840922.
[D 2025-12-02 14:07:17,465] Sample trial#28 with GPSampler.
[I 2025-12-02 14:07:19,057] Trial 28 finished with value: 0.16105680086260854 and parameters: {'iterations': 200, 'learning_rate': 0.01526643019464637, 'depth': 4, 'l2_leaf_reg': 10.0, 'border_count': 255, 'bagging_temperature': 0.10599433632037056, 'random_strength': 1.0, 'scale_pos_weight': 5.030328924564606}. Best is trial 26 with value: 0.1777952259840922.
[D 2025-12-02 14:07:19,187] Sample trial#29 with GPSampler.
[I 2025-12-02 14:07:22,491] Trial 29 finished with value: 0.17646529278251463 and parameters: {'iterations': 500, 'learning_rate': 0.01486016291653805, 'depth': 4, 'l2_leaf_reg': 10.0, 'border_count': 255, 'bagging_temperature': 0.45980244079077615, 'random_strength': 0.34751051566843755, 'scale_pos_weight': 5.286996072506211}. Best is trial 26 with value: 0.1777952259840922.
[I 2025-12-02 14:07:24,116] A new study created in memory with name: catboost_fold_2
[D 2025-12-02 14:07:24,117] Sample trial#0 with RandomSampler.
[I 2025-12-02 14:07:28,029] Trial 0 finished with value: 0.1529455034944373 and parameters: {'iterations': 700, 'learning_rate': 0.012806978430960115, 'depth': 4, 'l2_leaf_reg': 1.394550935029135, 'border_count': 230, 'bagging_temperature': 0.39911471581252955, 'random_strength': 0.029349476585236123, 'scale_pos_weight': 5.4019130608781225}. Best is trial 0 with value: 0.1529455034944373.
[D 2025-12-02 14:07:28,163] Sample trial#1 with GPSampler.
[I 2025-12-02 14:07:33,436] Trial 1 finished with value: 0.1601583683296059 and parameters: {'iterations': 1000, 'learning_rate': 0.005343812901085961, 'depth': 4, 'l2_leaf_reg': 8.337956356356173, 'border_count': 217, 'bagging_temperature': 0.6127165408159901, 'random_strength': 0.7230776629338752, 'scale_pos_weight': 5.811798834217579}. Best is trial 1 with value: 0.1601583683296059.
[D 2025-12-02 14:07:33,568] Sample trial#2 with GPSampler.
[I 2025-12-02 14:07:37,207] Trial 2 finished with value: 0.152124874927819 and parameters: {'iterations': 900, 'learning_rate': 0.011230326686369502, 'depth': 2, 'l2_leaf_reg': 3.568843864244541, 'border_count': 160, 'bagging_temperature': 0.09036235743190457, 'random_strength': 0.9094638382040956, 'scale_pos_weight': 5.7238067542244835}. Best is trial 1 with value: 0.1601583683296059.
[D 2025-12-02 14:07:37,340] Sample trial#3 with GPSampler.
[I 2025-12-02 14:07:38,152] Trial 3 finished with value: 0.13872471925378688 and parameters: {'iterations': 100, 'learning_rate': 0.00708012578550767, 'depth': 2, 'l2_leaf_reg': 7.6505187822946725, 'border_count': 218, 'bagging_temperature': 0.3865853494903019, 'random_strength': 0.843612919331047, 'scale_pos_weight': 5.169164077845649}. Best is trial 1 with value: 0.1601583683296059.
[D 2025-12-02 14:07:38,293] Sample trial#4 with GPSampler.
[I 2025-12-02 14:07:40,746] Trial 4 finished with value: 0.15868055226352623 and parameters: {'iterations': 400, 'learning_rate': 0.019942285029550262, 'depth': 4, 'l2_leaf_reg': 4.367613048596497, 'border_count': 240, 'bagging_temperature': 0.5040764244183086, 'random_strength': 0.6033531166192365, 'scale_pos_weight': 5.318228821174559}. Best is trial 1 with value: 0.1601583683296059.
[D 2025-12-02 14:07:40,882] Sample trial#5 with GPSampler.
[I 2025-12-02 14:07:43,022] Trial 5 finished with value: 0.15162709013693537 and parameters: {'iterations': 400, 'learning_rate': 0.013441823622327747, 'depth': 3, 'l2_leaf_reg': 3.3521574125712217, 'border_count': 225, 'bagging_temperature': 0.9651219563005763, 'random_strength': 0.8295957385707967, 'scale_pos_weight': 5.91337163293467}. Best is trial 1 with value: 0.1601583683296059.
[D 2025-12-02 14:07:43,155] Sample trial#6 with GPSampler.
[I 2025-12-02 14:07:44,847] Trial 6 finished with value: 0.15561826728113015 and parameters: {'iterations': 300, 'learning_rate': 0.00858352983665902, 'depth': 3, 'l2_leaf_reg': 4.779595055947477, 'border_count': 189, 'bagging_temperature': 0.5559734106430204, 'random_strength': 0.2748318576100641, 'scale_pos_weight': 5.2533372270487}. Best is trial 1 with value: 0.1601583683296059.
[D 2025-12-02 14:07:44,979] Sample trial#7 with GPSampler.
[I 2025-12-02 14:07:49,209] Trial 7 finished with value: 0.1546530531715868 and parameters: {'iterations': 900, 'learning_rate': 0.005494227573867405, 'depth': 3, 'l2_leaf_reg': 3.478083124440132, 'border_count': 250, 'bagging_temperature': 0.9399450747793239, 'random_strength': 0.9083402359944496, 'scale_pos_weight': 5.016132384882132}. Best is trial 1 with value: 0.1601583683296059.
[D 2025-12-02 14:07:49,342] Sample trial#8 with GPSampler.
[I 2025-12-02 14:07:50,223] Trial 8 finished with value: 0.1432200327693634 and parameters: {'iterations': 100, 'learning_rate': 0.010531206446288039, 'depth': 3, 'l2_leaf_reg': 6.656631246549298, 'border_count': 246, 'bagging_temperature': 0.41316276401123897, 'random_strength': 0.5612840505203834, 'scale_pos_weight': 5.18134499802075}. Best is trial 1 with value: 0.1601583683296059.
[D 2025-12-02 14:07:50,357] Sample trial#9 with GPSampler.
[I 2025-12-02 14:07:52,053] Trial 9 finished with value: 0.1557823171217334 and parameters: {'iterations': 300, 'learning_rate': 0.00846100600376705, 'depth': 3, 'l2_leaf_reg': 7.604095926192851, 'border_count': 189, 'bagging_temperature': 0.7633684571752269, 'random_strength': 0.260973064969912, 'scale_pos_weight': 5.995646769468601}. Best is trial 1 with value: 0.1601583683296059.
[D 2025-12-02 14:07:52,187] Sample trial#10 with GPSampler.
[I 2025-12-02 14:07:56,173] Trial 10 finished with value: 0.1638825207732065 and parameters: {'iterations': 700, 'learning_rate': 0.018878420747255178, 'depth': 4, 'l2_leaf_reg': 8.692374861332786, 'border_count': 203, 'bagging_temperature': 0.738665609524012, 'random_strength': 0.5598835135361673, 'scale_pos_weight': 5.622562107764589}. Best is trial 10 with value: 0.1638825207732065.
[D 2025-12-02 14:07:56,307] Sample trial#11 with GPSampler.
[I 2025-12-02 14:08:00,595] Trial 11 finished with value: 0.15633392332530877 and parameters: {'iterations': 800, 'learning_rate': 0.02, 'depth': 4, 'l2_leaf_reg': 5.402122272801156, 'border_count': 166, 'bagging_temperature': 1.0, 'random_strength': 0.5858132901497372, 'scale_pos_weight': 5.402739389379405}. Best is trial 10 with value: 0.1638825207732065.
[D 2025-12-02 14:08:00,728] Sample trial#12 with GPSampler.
[I 2025-12-02 14:08:05,225] Trial 12 finished with value: 0.1546025772488913 and parameters: {'iterations': 800, 'learning_rate': 0.02, 'depth': 4, 'l2_leaf_reg': 10.0, 'border_count': 228, 'bagging_temperature': 0.6537078382954536, 'random_strength': 0.6035984155542096, 'scale_pos_weight': 5.947613708037327}. Best is trial 10 with value: 0.1638825207732065.
[D 2025-12-02 14:08:05,357] Sample trial#13 with GPSampler.
[I 2025-12-02 14:08:09,791] Trial 13 finished with value: 0.16792515118748993 and parameters: {'iterations': 800, 'learning_rate': 0.013335000312770691, 'depth': 4, 'l2_leaf_reg': 8.044148314991407, 'border_count': 197, 'bagging_temperature': 0.6866048491552414, 'random_strength': 0.4910946038479293, 'scale_pos_weight': 5.18503737281636}. Best is trial 13 with value: 0.16792515118748993.
[D 2025-12-02 14:08:09,924] Sample trial#14 with GPSampler.
[I 2025-12-02 14:08:14,788] Trial 14 finished with value: 0.15903834449873672 and parameters: {'iterations': 900, 'learning_rate': 0.013880574754967501, 'depth': 4, 'l2_leaf_reg': 8.833342921428844, 'border_count': 177, 'bagging_temperature': 0.6070399737710948, 'random_strength': 0.6118076882027986, 'scale_pos_weight': 5.0}. Best is trial 13 with value: 0.16792515118748993.
[D 2025-12-02 14:08:14,921] Sample trial#15 with GPSampler.
[I 2025-12-02 14:08:19,343] Trial 15 finished with value: 0.16660600393710973 and parameters: {'iterations': 800, 'learning_rate': 0.010777640303098544, 'depth': 4, 'l2_leaf_reg': 7.1263343642079, 'border_count': 204, 'bagging_temperature': 0.9859445362903977, 'random_strength': 0.4549547319592237, 'scale_pos_weight': 5.0}. Best is trial 13 with value: 0.16792515118748993.
[D 2025-12-02 14:08:19,475] Sample trial#16 with GPSampler.
[I 2025-12-02 14:08:24,375] Trial 16 finished with value: 0.15900484615766175 and parameters: {'iterations': 900, 'learning_rate': 0.01593413028618439, 'depth': 4, 'l2_leaf_reg': 6.5265114298041755, 'border_count': 202, 'bagging_temperature': 0.39799842987268597, 'random_strength': 0.47205204959416114, 'scale_pos_weight': 5.0}. Best is trial 13 with value: 0.16792515118748993.
[D 2025-12-02 14:08:24,509] Sample trial#17 with GPSampler.
[I 2025-12-02 14:08:28,531] Trial 17 finished with value: 0.1629029888268892 and parameters: {'iterations': 700, 'learning_rate': 0.009746086703199562, 'depth': 4, 'l2_leaf_reg': 8.598987610705679, 'border_count': 205, 'bagging_temperature': 0.7869828928331759, 'random_strength': 0.4378727703293978, 'scale_pos_weight': 5.162223314338162}. Best is trial 13 with value: 0.16792515118748993.
[D 2025-12-02 14:08:28,664] Sample trial#18 with GPSampler.
[I 2025-12-02 14:08:33,328] Trial 18 finished with value: 0.16319062010214783 and parameters: {'iterations': 800, 'learning_rate': 0.013787372786198362, 'depth': 4, 'l2_leaf_reg': 8.488484272400424, 'border_count': 196, 'bagging_temperature': 0.9730525890106535, 'random_strength': 0.4105137867347649, 'scale_pos_weight': 5.339140411114036}. Best is trial 13 with value: 0.16792515118748993.
[D 2025-12-02 14:08:33,461] Sample trial#19 with GPSampler.
[I 2025-12-02 14:08:39,643] Trial 19 finished with value: 0.16054511750716305 and parameters: {'iterations': 1000, 'learning_rate': 0.016498551418635137, 'depth': 4, 'l2_leaf_reg': 6.872046190141312, 'border_count': 202, 'bagging_temperature': 0.7992437438796539, 'random_strength': 0.43417011279459217, 'scale_pos_weight': 5.112971471550281}. Best is trial 13 with value: 0.16792515118748993.
[D 2025-12-02 14:08:39,776] Sample trial#20 with GPSampler.
[I 2025-12-02 14:08:44,006] Trial 20 finished with value: 0.16287080351882716 and parameters: {'iterations': 700, 'learning_rate': 0.016887134018807703, 'depth': 4, 'l2_leaf_reg': 7.583909570771661, 'border_count': 200, 'bagging_temperature': 0.6658665703828911, 'random_strength': 0.45084260466432713, 'scale_pos_weight': 5.534688471864053}. Best is trial 13 with value: 0.16792515118748993.
[D 2025-12-02 14:08:44,139] Sample trial#21 with GPSampler.
[I 2025-12-02 14:08:49,083] Trial 21 finished with value: 0.16356499146599596 and parameters: {'iterations': 800, 'learning_rate': 0.01115909886800382, 'depth': 4, 'l2_leaf_reg': 7.602434500390965, 'border_count': 255, 'bagging_temperature': 1.0, 'random_strength': 0.8049844846245026, 'scale_pos_weight': 5.0}. Best is trial 13 with value: 0.16792515118748993.
[D 2025-12-02 14:08:49,216] Sample trial#22 with GPSampler.
[I 2025-12-02 14:08:53,531] Trial 22 finished with value: 0.14973006745067297 and parameters: {'iterations': 800, 'learning_rate': 0.001, 'depth': 4, 'l2_leaf_reg': 7.319865982131352, 'border_count': 226, 'bagging_temperature': 1.0, 'random_strength': 0.0, 'scale_pos_weight': 5.0}. Best is trial 13 with value: 0.16792515118748993.
[D 2025-12-02 14:08:53,665] Sample trial#23 with GPSampler.
[I 2025-12-02 14:08:58,343] Trial 23 finished with value: 0.16265269345084163 and parameters: {'iterations': 800, 'learning_rate': 0.010422484819906458, 'depth': 4, 'l2_leaf_reg': 7.675167585966707, 'border_count': 215, 'bagging_temperature': 0.9999999999999999, 'random_strength': 0.5677739255413832, 'scale_pos_weight': 5.117034720676826}. Best is trial 13 with value: 0.16792515118748993.
[D 2025-12-02 14:08:58,477] Sample trial#24 with GPSampler.
[I 2025-12-02 14:09:02,369] Trial 24 finished with value: 0.15959870759806952 and parameters: {'iterations': 600, 'learning_rate': 0.0073352199672897965, 'depth': 4, 'l2_leaf_reg': 5.535250098087276, 'border_count': 197, 'bagging_temperature': 1.0, 'random_strength': 0.7287350415066614, 'scale_pos_weight': 5.0}. Best is trial 13 with value: 0.16792515118748993.
[D 2025-12-02 14:09:02,503] Sample trial#25 with GPSampler.
[I 2025-12-02 14:09:05,176] Trial 25 finished with value: 0.1629488481376593 and parameters: {'iterations': 400, 'learning_rate': 0.02, 'depth': 4, 'l2_leaf_reg': 10.0, 'border_count': 198, 'bagging_temperature': 0.9999999999999999, 'random_strength': 0.5381100234044116, 'scale_pos_weight': 5.0}. Best is trial 13 with value: 0.16792515118748993.
[D 2025-12-02 14:09:05,310] Sample trial#26 with GPSampler.
[I 2025-12-02 14:09:06,275] Trial 26 finished with value: 0.15934983579585543 and parameters: {'iterations': 100, 'learning_rate': 0.02, 'depth': 4, 'l2_leaf_reg': 10.0, 'border_count': 150, 'bagging_temperature': 0.0, 'random_strength': 0.0, 'scale_pos_weight': 6.0}. Best is trial 13 with value: 0.16792515118748993.
[D 2025-12-02 14:09:06,409] Sample trial#27 with GPSampler.
[I 2025-12-02 14:09:07,371] Trial 27 finished with value: 0.1592366130884574 and parameters: {'iterations': 100, 'learning_rate': 0.010226904348677415, 'depth': 4, 'l2_leaf_reg': 1.0, 'border_count': 150, 'bagging_temperature': 1.0, 'random_strength': 0.0, 'scale_pos_weight': 5.0}. Best is trial 13 with value: 0.16792515118748993.
[D 2025-12-02 14:09:07,504] Sample trial#28 with GPSampler.
[I 2025-12-02 14:09:13,021] Trial 28 finished with value: 0.15243094732245718 and parameters: {'iterations': 1000, 'learning_rate': 0.018787815740819218, 'depth': 4, 'l2_leaf_reg': 1.0, 'border_count': 255, 'bagging_temperature': 0.9999999999999999, 'random_strength': 1.0, 'scale_pos_weight': 5.0}. Best is trial 13 with value: 0.16792515118748993.
[D 2025-12-02 14:09:13,154] Sample trial#29 with GPSampler.
[I 2025-12-02 14:09:14,348] Trial 29 finished with value: 0.14265708681139294 and parameters: {'iterations': 100, 'learning_rate': 0.02, 'depth': 4, 'l2_leaf_reg': 1.0, 'border_count': 172, 'bagging_temperature': 1.0, 'random_strength': 1.0, 'scale_pos_weight': 6.0}. Best is trial 13 with value: 0.16792515118748993.
[I 2025-12-02 14:09:16,253] A new study created in memory with name: catboost_fold_3
[D 2025-12-02 14:09:16,253] Sample trial#0 with RandomSampler.
[I 2025-12-02 14:09:18,705] Trial 0 finished with value: 0.16032867586444444 and parameters: {'iterations': 400, 'learning_rate': 0.00830180073751538, 'depth': 4, 'l2_leaf_reg': 4.018544744354898, 'border_count': 250, 'bagging_temperature': 0.23957617006279353, 'random_strength': 0.19438850182262501, 'scale_pos_weight': 5.963238240648704}. Best is trial 0 with value: 0.16032867586444444.
[D 2025-12-02 14:09:18,842] Sample trial#1 with GPSampler.
[I 2025-12-02 14:09:22,798] Trial 1 finished with value: 0.15698964551078373 and parameters: {'iterations': 700, 'learning_rate': 0.01566992166766781, 'depth': 4, 'l2_leaf_reg': 7.581137616970071, 'border_count': 248, 'bagging_temperature': 0.5638783275535598, 'random_strength': 0.4524830579679471, 'scale_pos_weight': 5.886155362029171}. Best is trial 0 with value: 0.16032867586444444.
[D 2025-12-02 14:09:22,934] Sample trial#2 with GPSampler.
[I 2025-12-02 14:09:26,833] Trial 2 finished with value: 0.15823906248026468 and parameters: {'iterations': 700, 'learning_rate': 0.0033194389717784733, 'depth': 4, 'l2_leaf_reg': 1.6817979909368064, 'border_count': 254, 'bagging_temperature': 0.7139488985816942, 'random_strength': 0.11930658804428718, 'scale_pos_weight': 5.133935177394631}. Best is trial 0 with value: 0.16032867586444444.
[D 2025-12-02 14:09:26,970] Sample trial#3 with GPSampler.
[I 2025-12-02 14:09:31,671] Trial 3 finished with value: 0.1450247574693848 and parameters: {'iterations': 900, 'learning_rate': 0.0029575273508301234, 'depth': 4, 'l2_leaf_reg': 4.178802507566588, 'border_count': 210, 'bagging_temperature': 0.9412274503224427, 'random_strength': 0.9942926031231868, 'scale_pos_weight': 5.249606846446517}. Best is trial 0 with value: 0.16032867586444444.
[D 2025-12-02 14:09:31,806] Sample trial#4 with GPSampler.
[I 2025-12-02 14:09:32,617] Trial 4 finished with value: 0.1385657142473411 and parameters: {'iterations': 100, 'learning_rate': 0.009752770455330188, 'depth': 2, 'l2_leaf_reg': 1.2399654653370062, 'border_count': 189, 'bagging_temperature': 0.9454270490961817, 'random_strength': 0.23460087922547201, 'scale_pos_weight': 5.613095714427778}. Best is trial 0 with value: 0.16032867586444444.
[D 2025-12-02 14:09:32,752] Sample trial#5 with GPSampler.
[I 2025-12-02 14:09:33,573] Trial 5 finished with value: 0.13763725082658237 and parameters: {'iterations': 100, 'learning_rate': 0.011401665533875834, 'depth': 2, 'l2_leaf_reg': 8.210359906827602, 'border_count': 203, 'bagging_temperature': 0.5746528842643375, 'random_strength': 0.38783529640575565, 'scale_pos_weight': 5.053693587345434}. Best is trial 0 with value: 0.16032867586444444.
[D 2025-12-02 14:09:33,706] Sample trial#6 with GPSampler.
[I 2025-12-02 14:09:36,109] Trial 6 finished with value: 0.15519008484547073 and parameters: {'iterations': 400, 'learning_rate': 0.010651822124021326, 'depth': 4, 'l2_leaf_reg': 2.5815751420337283, 'border_count': 222, 'bagging_temperature': 0.9786398271872067, 'random_strength': 0.7174046729705309, 'scale_pos_weight': 5.358099862824675}. Best is trial 0 with value: 0.16032867586444444.
[D 2025-12-02 14:09:36,245] Sample trial#7 with GPSampler.
