[I 2025-12-02 12:01:12,543] Trial 23 finished with value: 0.1379150861890933 and parameters: {'n_estimators': 225, 'max_depth': 3, 'min_samples_split': 9, 'min_samples_leaf': 17, 'max_features': 'sqrt', 'criterion': 'log_loss', 'bootstrap': True}. Best is trial 17 with value: 0.14246499821900857.
[D 2025-12-02 12:01:12,648] Sample trial#24 with TPESampler.
[I 2025-12-02 12:01:14,914] Trial 24 finished with value: 0.13659359111659314 and parameters: {'n_estimators': 275, 'max_depth': 11, 'min_samples_split': 7, 'min_samples_leaf': 15, 'max_features': 'log2', 'criterion': 'log_loss', 'bootstrap': True}. Best is trial 17 with value: 0.14246499821900857.
[D 2025-12-02 12:01:15,015] Sample trial#25 with TPESampler.
[I 2025-12-02 12:01:17,091] Trial 25 finished with value: 0.13955261278201694 and parameters: {'n_estimators': 250, 'max_depth': 6, 'min_samples_split': 7, 'min_samples_leaf': 15, 'max_features': 'log2', 'criterion': 'entropy', 'bootstrap': False}. Best is trial 17 with value: 0.14246499821900857.
[D 2025-12-02 12:01:17,191] Sample trial#26 with TPESampler.
[I 2025-12-02 12:01:18,835] Trial 26 finished with value: 0.13645492217644334 and parameters: {'n_estimators': 250, 'max_depth': 6, 'min_samples_split': 5, 'min_samples_leaf': 17, 'max_features': 'log2', 'criterion': 'gini', 'bootstrap': True}. Best is trial 17 with value: 0.14246499821900857.
[D 2025-12-02 12:01:18,930] Sample trial#27 with TPESampler.
[I 2025-12-02 12:01:20,928] Trial 27 finished with value: 0.13584543327861348 and parameters: {'n_estimators': 300, 'max_depth': 3, 'min_samples_split': 5, 'min_samples_leaf': 15, 'max_features': 'log2', 'criterion': 'log_loss', 'bootstrap': True}. Best is trial 17 with value: 0.14246499821900857.
[D 2025-12-02 12:01:21,032] Sample trial#28 with TPESampler.
[I 2025-12-02 12:01:28,905] Trial 28 finished with value: 0.13416236430715708 and parameters: {'n_estimators': 225, 'max_depth': 5, 'min_samples_split': 5, 'min_samples_leaf': 15, 'max_features': None, 'criterion': 'entropy', 'bootstrap': True}. Best is trial 17 with value: 0.14246499821900857.
[D 2025-12-02 12:01:29,007] Sample trial#29 with TPESampler.
[I 2025-12-02 12:01:30,789] Trial 29 finished with value: 0.13878782413334406 and parameters: {'n_estimators': 250, 'max_depth': 3, 'min_samples_split': 11, 'min_samples_leaf': 15, 'max_features': 'log2', 'criterion': 'entropy', 'bootstrap': True}. Best is trial 17 with value: 0.14246499821900857.
[I 2025-12-02 12:01:48,476] A new study created in memory with name: gradient_boosting_fold_1
[D 2025-12-02 12:01:48,476] Sample trial#0 with RandomSampler.
[I 2025-12-02 12:04:08,992] Trial 0 finished with value: 0.1465565182011526 and parameters: {'n_estimators': 150, 'learning_rate': 0.0743891555700833, 'max_depth': 8, 'min_samples_split': 8, 'min_samples_leaf': 6, 'subsample': 0.9722593221026627, 'max_features': None}. Best is trial 0 with value: 0.1465565182011526.
[D 2025-12-02 12:04:09,090] Sample trial#1 with TPESampler.
[I 2025-12-02 12:04:14,439] Trial 1 finished with value: 0.16820821629170135 and parameters: {'n_estimators': 150, 'learning_rate': 0.02089340176464002, 'max_depth': 2, 'min_samples_split': 4, 'min_samples_leaf': 13, 'subsample': 0.9701328769278627, 'max_features': 'sqrt'}. Best is trial 1 with value: 0.16820821629170135.
[D 2025-12-02 12:04:14,536] Sample trial#2 with TPESampler.
[I 2025-12-02 12:04:32,550] Trial 2 finished with value: 0.14852307749081056 and parameters: {'n_estimators': 250, 'learning_rate': 0.06753181948065945, 'max_depth': 6, 'min_samples_split': 19, 'min_samples_leaf': 17, 'subsample': 0.9364439204437867, 'max_features': 'log2'}. Best is trial 1 with value: 0.16820821629170135.
[D 2025-12-02 12:04:32,647] Sample trial#3 with TPESampler.
[I 2025-12-02 12:04:44,814] Trial 3 finished with value: 0.1525638189862914 and parameters: {'n_estimators': 150, 'learning_rate': 0.048075150964847636, 'max_depth': 8, 'min_samples_split': 17, 'min_samples_leaf': 19, 'subsample': 0.8119990593391802, 'max_features': 'log2'}. Best is trial 1 with value: 0.16820821629170135.
[D 2025-12-02 12:04:44,913] Sample trial#4 with TPESampler.
[I 2025-12-02 12:06:00,158] Trial 4 finished with value: 0.15640385182135663 and parameters: {'n_estimators': 100, 'learning_rate': 0.04741258131719853, 'max_depth': 7, 'min_samples_split': 9, 'min_samples_leaf': 1, 'subsample': 0.8779173709828526, 'max_features': None}. Best is trial 1 with value: 0.16820821629170135.
[D 2025-12-02 12:06:00,255] Sample trial#5 with TPESampler.
[I 2025-12-02 12:07:10,854] Trial 5 finished with value: 0.18154598686695866 and parameters: {'n_estimators': 150, 'learning_rate': 0.038133321143728284, 'max_depth': 4, 'min_samples_split': 17, 'min_samples_leaf': 6, 'subsample': 0.9334712226921423, 'max_features': None}. Best is trial 5 with value: 0.18154598686695866.
[D 2025-12-02 12:07:10,951] Sample trial#6 with TPESampler.
[I 2025-12-02 12:07:14,449] Trial 6 finished with value: 0.17235977365931382 and parameters: {'n_estimators': 100, 'learning_rate': 0.08945559308437982, 'max_depth': 2, 'min_samples_split': 9, 'min_samples_leaf': 7, 'subsample': 0.9495442544245208, 'max_features': 'sqrt'}. Best is trial 5 with value: 0.18154598686695866.
[D 2025-12-02 12:07:14,548] Sample trial#7 with TPESampler.
[I 2025-12-02 12:07:21,976] Trial 7 finished with value: 0.17123283989178967 and parameters: {'n_estimators': 150, 'learning_rate': 0.013370840075669289, 'max_depth': 3, 'min_samples_split': 17, 'min_samples_leaf': 14, 'subsample': 0.9421478043339799, 'max_features': 'sqrt'}. Best is trial 5 with value: 0.18154598686695866.
[D 2025-12-02 12:07:22,074] Sample trial#8 with TPESampler.
[I 2025-12-02 12:10:01,040] Trial 8 finished with value: 0.1466578759085675 and parameters: {'n_estimators': 250, 'learning_rate': 0.0693064734072149, 'max_depth': 6, 'min_samples_split': 15, 'min_samples_leaf': 13, 'subsample': 0.8721584510291924, 'max_features': None}. Best is trial 5 with value: 0.18154598686695866.
[D 2025-12-02 12:10:01,137] Sample trial#9 with TPESampler.
[I 2025-12-02 12:10:06,424] Trial 9 finished with value: 0.16553989904072058 and parameters: {'n_estimators': 150, 'learning_rate': 0.07871653445780427, 'max_depth': 3, 'min_samples_split': 12, 'min_samples_leaf': 16, 'subsample': 0.8493887423662955, 'max_features': 'log2'}. Best is trial 5 with value: 0.18154598686695866.
[D 2025-12-02 12:10:06,523] Sample trial#10 with TPESampler.
[I 2025-12-02 12:11:07,300] Trial 10 finished with value: 0.18480976305432736 and parameters: {'n_estimators': 250, 'learning_rate': 0.0505954111203234, 'max_depth': 2, 'min_samples_split': 16, 'min_samples_leaf': 2, 'subsample': 0.9384067070258996, 'max_features': None}. Best is trial 10 with value: 0.18480976305432736.
[D 2025-12-02 12:11:07,397] Sample trial#11 with TPESampler.
[I 2025-12-02 12:12:10,771] Trial 11 finished with value: 0.1823344043957301 and parameters: {'n_estimators': 250, 'learning_rate': 0.058335425145373876, 'max_depth': 2, 'min_samples_split': 17, 'min_samples_leaf': 10, 'subsample': 0.9759099409310609, 'max_features': None}. Best is trial 10 with value: 0.18480976305432736.
[D 2025-12-02 12:12:10,873] Sample trial#12 with TPESampler.
[I 2025-12-02 12:13:59,893] Trial 12 finished with value: 0.17731686058351204 and parameters: {'n_estimators': 300, 'learning_rate': 0.03924599686640487, 'max_depth': 3, 'min_samples_split': 15, 'min_samples_leaf': 7, 'subsample': 0.9486316616001965, 'max_features': None}. Best is trial 10 with value: 0.18480976305432736.
[D 2025-12-02 12:13:59,989] Sample trial#13 with TPESampler.
[I 2025-12-02 12:15:35,278] Trial 13 finished with value: 0.1690776830839169 and parameters: {'n_estimators': 250, 'learning_rate': 0.07471128642250098, 'max_depth': 3, 'min_samples_split': 13, 'min_samples_leaf': 11, 'subsample': 0.9920076683631224, 'max_features': None}. Best is trial 10 with value: 0.18480976305432736.
[D 2025-12-02 12:15:35,374] Sample trial#14 with TPESampler.
[I 2025-12-02 12:17:04,113] Trial 14 finished with value: 0.17405557219951656 and parameters: {'n_estimators': 250, 'learning_rate': 0.07094083825260979, 'max_depth': 3, 'min_samples_split': 16, 'min_samples_leaf': 1, 'subsample': 0.927917597818243, 'max_features': None}. Best is trial 10 with value: 0.18480976305432736.
[D 2025-12-02 12:17:04,210] Sample trial#15 with TPESampler.
[I 2025-12-02 12:17:13,173] Trial 15 finished with value: 0.17539704558818495 and parameters: {'n_estimators': 250, 'learning_rate': 0.020965895291435308, 'max_depth': 2, 'min_samples_split': 14, 'min_samples_leaf': 2, 'subsample': 0.9771824794513756, 'max_features': 'sqrt'}. Best is trial 10 with value: 0.18480976305432736.
[D 2025-12-02 12:17:13,270] Sample trial#16 with TPESampler.
[I 2025-12-02 12:18:08,578] Trial 16 finished with value: 0.18282335302461533 and parameters: {'n_estimators': 250, 'learning_rate': 0.0295743064558695, 'max_depth': 2, 'min_samples_split': 8, 'min_samples_leaf': 8, 'subsample': 0.8591474805595238, 'max_features': None}. Best is trial 10 with value: 0.18480976305432736.
[D 2025-12-02 12:18:08,675] Sample trial#17 with TPESampler.
[I 2025-12-02 12:19:03,987] Trial 17 finished with value: 0.17625036178493783 and parameters: {'n_estimators': 250, 'learning_rate': 0.04063517821162414, 'max_depth': 2, 'min_samples_split': 7, 'min_samples_leaf': 14, 'subsample': 0.8597068561084419, 'max_features': None}. Best is trial 10 with value: 0.18480976305432736.
[D 2025-12-02 12:19:04,084] Sample trial#18 with TPESampler.
[I 2025-12-02 12:21:20,674] Trial 18 finished with value: 0.18093044099162855 and parameters: {'n_estimators': 300, 'learning_rate': 0.011067081963945395, 'max_depth': 4, 'min_samples_split': 2, 'min_samples_leaf': 8, 'subsample': 0.9067656181197937, 'max_features': None}. Best is trial 10 with value: 0.18480976305432736.
[D 2025-12-02 12:21:20,770] Sample trial#19 with TPESampler.
[I 2025-12-02 12:21:29,668] Trial 19 finished with value: 0.18733032166286664 and parameters: {'n_estimators': 250, 'learning_rate': 0.02914494758754147, 'max_depth': 3, 'min_samples_split': 7, 'min_samples_leaf': 4, 'subsample': 0.8578510331496536, 'max_features': 'log2'}. Best is trial 19 with value: 0.18733032166286664.
[D 2025-12-02 12:21:29,767] Sample trial#20 with TPESampler.
[I 2025-12-02 12:21:41,315] Trial 20 finished with value: 0.1858895785046777 and parameters: {'n_estimators': 250, 'learning_rate': 0.03742815240370248, 'max_depth': 4, 'min_samples_split': 6, 'min_samples_leaf': 1, 'subsample': 0.8643906488780679, 'max_features': 'log2'}. Best is trial 19 with value: 0.18733032166286664.
[D 2025-12-02 12:21:41,412] Sample trial#21 with TPESampler.
[I 2025-12-02 12:21:55,229] Trial 21 finished with value: 0.18422655787663914 and parameters: {'n_estimators': 300, 'learning_rate': 0.023363429288538122, 'max_depth': 4, 'min_samples_split': 7, 'min_samples_leaf': 2, 'subsample': 0.8634830945749091, 'max_features': 'log2'}. Best is trial 19 with value: 0.18733032166286664.
[D 2025-12-02 12:21:55,326] Sample trial#22 with TPESampler.
[I 2025-12-02 12:22:04,494] Trial 22 finished with value: 0.17338731915641606 and parameters: {'n_estimators': 200, 'learning_rate': 0.05545164305136431, 'max_depth': 4, 'min_samples_split': 3, 'min_samples_leaf': 5, 'subsample': 0.8488559738167266, 'max_features': 'log2'}. Best is trial 19 with value: 0.18733032166286664.
[D 2025-12-02 12:22:04,591] Sample trial#23 with TPESampler.
[I 2025-12-02 12:22:13,443] Trial 23 finished with value: 0.1840745926729962 and parameters: {'n_estimators': 250, 'learning_rate': 0.06229457445018359, 'max_depth': 3, 'min_samples_split': 10, 'min_samples_leaf': 1, 'subsample': 0.8577691059457289, 'max_features': 'log2'}. Best is trial 19 with value: 0.18733032166286664.
[D 2025-12-02 12:22:13,541] Sample trial#24 with TPESampler.
[I 2025-12-02 12:22:24,867] Trial 24 finished with value: 0.18252397873878484 and parameters: {'n_estimators': 250, 'learning_rate': 0.01438014173262914, 'max_depth': 4, 'min_samples_split': 16, 'min_samples_leaf': 8, 'subsample': 0.8514175939739118, 'max_features': 'log2'}. Best is trial 19 with value: 0.18733032166286664.
[D 2025-12-02 12:22:24,964] Sample trial#25 with TPESampler.
[I 2025-12-02 12:22:29,927] Trial 25 finished with value: 0.17201725808385573 and parameters: {'n_estimators': 200, 'learning_rate': 0.02171642486413569, 'max_depth': 2, 'min_samples_split': 5, 'min_samples_leaf': 4, 'subsample': 0.8410660991682557, 'max_features': 'log2'}. Best is trial 19 with value: 0.18733032166286664.
[D 2025-12-02 12:22:30,029] Sample trial#26 with TPESampler.
[I 2025-12-02 12:22:43,414] Trial 26 finished with value: 0.18487696017025085 and parameters: {'n_estimators': 300, 'learning_rate': 0.05559039979229814, 'max_depth': 3, 'min_samples_split': 3, 'min_samples_leaf': 3, 'subsample': 0.8357347385728037, 'max_features': 'sqrt'}. Best is trial 19 with value: 0.18733032166286664.
[D 2025-12-02 12:22:43,511] Sample trial#27 with TPESampler.
[I 2025-12-02 12:23:00,952] Trial 27 finished with value: 0.16376331689447032 and parameters: {'n_estimators': 300, 'learning_rate': 0.0664416675382016, 'max_depth': 4, 'min_samples_split': 9, 'min_samples_leaf': 10, 'subsample': 0.8422937427745505, 'max_features': 'sqrt'}. Best is trial 19 with value: 0.18733032166286664.
[D 2025-12-02 12:23:01,048] Sample trial#28 with TPESampler.
[I 2025-12-02 12:23:08,860] Trial 28 finished with value: 0.18422814437530005 and parameters: {'n_estimators': 250, 'learning_rate': 0.048117413896497756, 'max_depth': 2, 'min_samples_split': 6, 'min_samples_leaf': 2, 'subsample': 0.8390275115889646, 'max_features': 'sqrt'}. Best is trial 19 with value: 0.18733032166286664.
[D 2025-12-02 12:23:08,956] Sample trial#29 with TPESampler.
