[I 2025-12-02 12:23:33,589] Trial 29 finished with value: 0.14884854477250184 and parameters: {'n_estimators': 250, 'learning_rate': 0.05392676508731582, 'max_depth': 7, 'min_samples_split': 10, 'min_samples_leaf': 2, 'subsample': 0.8444945417709195, 'max_features': 'sqrt'}. Best is trial 19 with value: 0.18733032166286664.
Importâncias dos parâmetros para fold 5: {'max_depth': np.float64(0.325657912423664), 'min_samples_split': np.float64(0.25036660398565214), 'max_features': np.float64(0.16111565237385594), 'min_samples_leaf': np.float64(0.09698746295578871), 'criterion': np.float64(0.08414782090475685), 'splitter': np.float64(0.08172454735628253)}
Saved Optuna plots to results/20251202_114155_ana_optimized_binary_less/decision_tree/optuna_plots

Nested CV completed. The 20% holdout set (3536 samples) remains untouched.
This holdout set can be used for final unbiased evaluation.

Training and evaluating 5 best parameter sets on holdout data...
Testing with 4 balancing strategies: none, randomundersampler, smoteenn, tomeklinks

Evaluating fold 1 best params on holdout set...
  - Testing with balance strategy: none
  - Testing with balance strategy: randomundersampler
  - Testing with balance strategy: smoteenn
  - Testing with balance strategy: tomeklinks

Evaluating fold 2 best params on holdout set...
  - Testing with balance strategy: none
  - Testing with balance strategy: randomundersampler
  - Testing with balance strategy: smoteenn
  - Testing with balance strategy: tomeklinks

Evaluating fold 3 best params on holdout set...
  - Testing with balance strategy: none
  - Testing with balance strategy: randomundersampler
  - Testing with balance strategy: smoteenn
  - Testing with balance strategy: tomeklinks

Evaluating fold 4 best params on holdout set...
  - Testing with balance strategy: none
  - Testing with balance strategy: randomundersampler
  - Testing with balance strategy: smoteenn
  - Testing with balance strategy: tomeklinks

Evaluating fold 5 best params on holdout set...
  - Testing with balance strategy: none
  - Testing with balance strategy: randomundersampler
  - Testing with balance strategy: smoteenn
  - Testing with balance strategy: tomeklinks
Saving optimization and holdout results...
Detailed results by fold saved to: ./results/20251202_114155_ana_optimized_binary_less/decision_tree/detailed_results_by_fold.txt
Test predictions for all folds saved to: ./results/20251202_114155_ana_optimized_binary_less/decision_tree/metrics.json
Saving holdout results...
Holdout evaluation results saved to: ./results/20251202_114155_ana_optimized_binary_less/decision_tree/holdout_results.txt
Saved!
[OK] Decision Tree executado com sucesso!
Progresso: 3/9 modelos
================================================================================
EXECUTANDO MODELO: Random Forest
================================================================================

Starting Nested Cross-Validation for random_forest...
Configuration: 5 outer folds, 30 trials per fold
Performing 80/20 holdout split...
Holdout split completed:
  - Training set: 14140 samples (80%)
  - Holdout test set: 3536 samples (20%)
Fold 1
Importâncias dos parâmetros para fold 1: {'max_features': np.float64(0.6462213415294501), 'bootstrap': np.float64(0.2311231607776497), 'max_depth': np.float64(0.0582631683028689), 'min_samples_leaf': np.float64(0.045835272880731276), 'min_samples_split': np.float64(0.015212550450496708), 'criterion': np.float64(0.0027111851830336144), 'n_estimators': np.float64(0.0006333208757696641)}
Saved Optuna plots to results/20251202_114155_ana_optimized_binary_less/random_forest/optuna_plots
Fold 2
Importâncias dos parâmetros para fold 2: {'max_features': np.float64(0.8847493219501289), 'bootstrap': np.float64(0.040823011704048444), 'max_depth': np.float64(0.025696130276406322), 'n_estimators': np.float64(0.01950568304182611), 'min_samples_leaf': np.float64(0.013904372246786539), 'criterion': np.float64(0.01068252409016969), 'min_samples_split': np.float64(0.004638956690633912)}
Saved Optuna plots to results/20251202_114155_ana_optimized_binary_less/random_forest/optuna_plots
Fold 3
Importâncias dos parâmetros para fold 3: {'max_features': np.float64(0.751027373153613), 'bootstrap': np.float64(0.08930208345809326), 'max_depth': np.float64(0.05903389266518621), 'min_samples_split': np.float64(0.057345126121382727), 'n_estimators': np.float64(0.02527627800875115), 'min_samples_leaf': np.float64(0.015323620543273813), 'criterion': np.float64(0.0026916260497000057)}
Saved Optuna plots to results/20251202_114155_ana_optimized_binary_less/random_forest/optuna_plots
Fold 4
Importâncias dos parâmetros para fold 4: {'max_features': np.float64(0.7217664059636758), 'max_depth': np.float64(0.16001613944274298), 'n_estimators': np.float64(0.04029969792556059), 'bootstrap': np.float64(0.04029351722979411), 'min_samples_split': np.float64(0.014634316572369773), 'min_samples_leaf': np.float64(0.012123039619705593), 'criterion': np.float64(0.010866883246151267)}
Saved Optuna plots to results/20251202_114155_ana_optimized_binary_less/random_forest/optuna_plots
Fold 5
Importâncias dos parâmetros para fold 5: {'max_depth': np.float64(0.5404348995724395), 'max_features': np.float64(0.25370172403901786), 'bootstrap': np.float64(0.14468567147823208), 'min_samples_split': np.float64(0.033097215479909535), 'criterion': np.float64(0.016453605968935445), 'min_samples_leaf': np.float64(0.008653227531786883), 'n_estimators': np.float64(0.0029736559296786864)}
Saved Optuna plots to results/20251202_114155_ana_optimized_binary_less/random_forest/optuna_plots

Nested CV completed. The 20% holdout set (3536 samples) remains untouched.
This holdout set can be used for final unbiased evaluation.

Training and evaluating 5 best parameter sets on holdout data...
Testing with 4 balancing strategies: none, randomundersampler, smoteenn, tomeklinks

Evaluating fold 1 best params on holdout set...
  - Testing with balance strategy: none
  - Testing with balance strategy: randomundersampler
  - Testing with balance strategy: smoteenn
  - Testing with balance strategy: tomeklinks

Evaluating fold 2 best params on holdout set...
  - Testing with balance strategy: none
  - Testing with balance strategy: randomundersampler
  - Testing with balance strategy: smoteenn
  - Testing with balance strategy: tomeklinks

Evaluating fold 3 best params on holdout set...
  - Testing with balance strategy: none
  - Testing with balance strategy: randomundersampler
  - Testing with balance strategy: smoteenn
  - Testing with balance strategy: tomeklinks

Evaluating fold 4 best params on holdout set...
  - Testing with balance strategy: none
  - Testing with balance strategy: randomundersampler
  - Testing with balance strategy: smoteenn
  - Testing with balance strategy: tomeklinks

Evaluating fold 5 best params on holdout set...
  - Testing with balance strategy: none
  - Testing with balance strategy: randomundersampler
  - Testing with balance strategy: smoteenn
  - Testing with balance strategy: tomeklinks
Saving optimization and holdout results...
Detailed results by fold saved to: ./results/20251202_114155_ana_optimized_binary_less/random_forest/detailed_results_by_fold.txt
Test predictions for all folds saved to: ./results/20251202_114155_ana_optimized_binary_less/random_forest/metrics.json
Saving holdout results...
Holdout evaluation results saved to: ./results/20251202_114155_ana_optimized_binary_less/random_forest/holdout_results.txt
Saved!
[OK] Random Forest executado com sucesso!
Progresso: 4/9 modelos
================================================================================
EXECUTANDO MODELO: Gradient Boosting
================================================================================

Starting Nested Cross-Validation for gradient_boosting...
Configuration: 5 outer folds, 30 trials per fold
Performing 80/20 holdout split...
Holdout split completed:
  - Training set: 14140 samples (80%)
  - Holdout test set: 3536 samples (20%)
Fold 1
Importâncias dos parâmetros para fold 1: {'max_depth': np.float64(0.9253089455791607), 'learning_rate': np.float64(0.036621660507248244), 'min_samples_leaf': np.float64(0.01643559896063918), 'n_estimators': np.float64(0.009777083446795095), 'subsample': np.float64(0.004894381309188538), 'min_samples_split': np.float64(0.0037391639116451086), 'max_features': np.float64(0.003223166285323291)}
[I 2025-12-02 12:23:36,473] A new study created in memory with name: gradient_boosting_fold_2
[D 2025-12-02 12:23:36,473] Sample trial#0 with RandomSampler.
[I 2025-12-02 12:23:49,361] Trial 0 finished with value: 0.16773788258894487 and parameters: {'n_estimators': 150, 'learning_rate': 0.024101904504629852, 'max_depth': 7, 'min_samples_split': 6, 'min_samples_leaf': 16, 'subsample': 0.9748993049790615, 'max_features': 'log2'}. Best is trial 0 with value: 0.16773788258894487.
[D 2025-12-02 12:23:49,462] Sample trial#1 with TPESampler.
[I 2025-12-02 12:23:55,192] Trial 1 finished with value: 0.1702299777447438 and parameters: {'n_estimators': 100, 'learning_rate': 0.03018905113698555, 'max_depth': 4, 'min_samples_split': 15, 'min_samples_leaf': 10, 'subsample': 0.8394651928829772, 'max_features': 'sqrt'}. Best is trial 1 with value: 0.1702299777447438.
[D 2025-12-02 12:23:55,291] Sample trial#2 with TPESampler.
[I 2025-12-02 12:24:10,268] Trial 2 finished with value: 0.17958198141127668 and parameters: {'n_estimators': 200, 'learning_rate': 0.012981079914041918, 'max_depth': 7, 'min_samples_split': 13, 'min_samples_leaf': 7, 'subsample': 0.835635650421641, 'max_features': 'log2'}. Best is trial 2 with value: 0.17958198141127668.
[D 2025-12-02 12:24:10,368] Sample trial#3 with TPESampler.
[I 2025-12-02 12:24:15,474] Trial 3 finished with value: 0.15994656728406714 and parameters: {'n_estimators': 150, 'learning_rate': 0.02558405872396602, 'max_depth': 2, 'min_samples_split': 7, 'min_samples_leaf': 4, 'subsample': 0.9349935788657242, 'max_features': 'sqrt'}. Best is trial 2 with value: 0.17958198141127668.
[D 2025-12-02 12:24:15,572] Sample trial#4 with TPESampler.
[I 2025-12-02 12:24:31,098] Trial 4 finished with value: 0.18036960279983288 and parameters: {'n_estimators': 200, 'learning_rate': 0.02451188432783547, 'max_depth': 7, 'min_samples_split': 2, 'min_samples_leaf': 14, 'subsample': 0.878054141498138, 'max_features': 'log2'}. Best is trial 4 with value: 0.18036960279983288.
[D 2025-12-02 12:24:31,198] Sample trial#5 with TPESampler.
[I 2025-12-02 12:24:58,009] Trial 5 finished with value: 0.13212908292900086 and parameters: {'n_estimators': 250, 'learning_rate': 0.0991452521237298, 'max_depth': 8, 'min_samples_split': 18, 'min_samples_leaf': 9, 'subsample': 0.828122837284912, 'max_features': 'sqrt'}. Best is trial 4 with value: 0.18036960279983288.
[D 2025-12-02 12:24:58,107] Sample trial#6 with TPESampler.
[I 2025-12-02 12:25:09,703] Trial 6 finished with value: 0.15706144902579539 and parameters: {'n_estimators': 300, 'learning_rate': 0.09197698729971891, 'max_depth': 3, 'min_samples_split': 17, 'min_samples_leaf': 14, 'subsample': 0.9526798722581775, 'max_features': 'log2'}. Best is trial 4 with value: 0.18036960279983288.
[D 2025-12-02 12:25:09,803] Sample trial#7 with TPESampler.
[I 2025-12-02 12:25:24,840] Trial 7 finished with value: 0.13898092133121076 and parameters: {'n_estimators': 150, 'learning_rate': 0.09427735068520703, 'max_depth': 7, 'min_samples_split': 3, 'min_samples_leaf': 14, 'subsample': 0.8794827379559926, 'max_features': 'sqrt'}. Best is trial 4 with value: 0.18036960279983288.
[D 2025-12-02 12:25:24,939] Sample trial#8 with TPESampler.
[I 2025-12-02 12:25:48,456] Trial 8 finished with value: 0.14113185526112929 and parameters: {'n_estimators': 100, 'learning_rate': 0.0091775962362462, 'max_depth': 2, 'min_samples_split': 9, 'min_samples_leaf': 18, 'subsample': 0.9215738513135814, 'max_features': None}. Best is trial 4 with value: 0.18036960279983288.
[D 2025-12-02 12:25:48,554] Sample trial#9 with TPESampler.
[I 2025-12-02 12:25:53,774] Trial 9 finished with value: 0.15689819634747387 and parameters: {'n_estimators': 150, 'learning_rate': 0.08224870051756877, 'max_depth': 2, 'min_samples_split': 11, 'min_samples_leaf': 20, 'subsample': 0.960126007085176, 'max_features': 'sqrt'}. Best is trial 4 with value: 0.18036960279983288.
[D 2025-12-02 12:25:53,876] Sample trial#10 with TPESampler.
[I 2025-12-02 12:26:06,056] Trial 10 finished with value: 0.15887702179884294 and parameters: {'n_estimators': 150, 'learning_rate': 0.047274948876611884, 'max_depth': 8, 'min_samples_split': 6, 'min_samples_leaf': 19, 'subsample': 0.823272546822072, 'max_features': 'log2'}. Best is trial 4 with value: 0.18036960279983288.
[D 2025-12-02 12:26:06,156] Sample trial#11 with TPESampler.
[I 2025-12-02 12:26:20,816] Trial 11 finished with value: 0.17518263209617047 and parameters: {'n_estimators': 200, 'learning_rate': 0.02468831937890263, 'max_depth': 7, 'min_samples_split': 14, 'min_samples_leaf': 2, 'subsample': 0.8180265333242231, 'max_features': 'log2'}. Best is trial 4 with value: 0.18036960279983288.
[D 2025-12-02 12:26:20,916] Sample trial#12 with TPESampler.
[I 2025-12-02 12:26:44,165] Trial 12 finished with value: 0.16312822943575692 and parameters: {'n_estimators': 250, 'learning_rate': 0.03874908524227097, 'max_depth': 8, 'min_samples_split': 5, 'min_samples_leaf': 7, 'subsample': 0.9111467839547158, 'max_features': 'log2'}. Best is trial 4 with value: 0.18036960279983288.
[D 2025-12-02 12:26:44,267] Sample trial#13 with TPESampler.
[I 2025-12-02 12:26:56,110] Trial 13 finished with value: 0.1743405863536821 and parameters: {'n_estimators': 150, 'learning_rate': 0.01104947286051079, 'max_depth': 7, 'min_samples_split': 12, 'min_samples_leaf': 10, 'subsample': 0.8945927250814956, 'max_features': 'log2'}. Best is trial 4 with value: 0.18036960279983288.
[D 2025-12-02 12:26:56,210] Sample trial#14 with TPESampler.
[I 2025-12-02 12:27:10,895] Trial 14 finished with value: 0.1633946558067077 and parameters: {'n_estimators': 200, 'learning_rate': 0.037797322487320914, 'max_depth': 7, 'min_samples_split': 17, 'min_samples_leaf': 12, 'subsample': 0.8261271711629268, 'max_features': 'log2'}. Best is trial 4 with value: 0.18036960279983288.
[D 2025-12-02 12:27:10,994] Sample trial#15 with TPESampler.
[I 2025-12-02 12:27:38,860] Trial 15 finished with value: 0.16556755097681095 and parameters: {'n_estimators': 250, 'learning_rate': 0.026742681194715984, 'max_depth': 8, 'min_samples_split': 4, 'min_samples_leaf': 14, 'subsample': 0.8701537004591021, 'max_features': 'sqrt'}. Best is trial 4 with value: 0.18036960279983288.
[D 2025-12-02 12:27:38,960] Sample trial#16 with TPESampler.
[I 2025-12-02 12:27:48,926] Trial 16 finished with value: 0.16741944998222125 and parameters: {'n_estimators': 150, 'learning_rate': 0.014797365394237514, 'max_depth': 6, 'min_samples_split': 2, 'min_samples_leaf': 13, 'subsample': 0.8670157924328862, 'max_features': 'log2'}. Best is trial 4 with value: 0.18036960279983288.
[D 2025-12-02 12:27:49,026] Sample trial#17 with TPESampler.
[I 2025-12-02 12:28:06,131] Trial 17 finished with value: 0.1510268800205484 and parameters: {'n_estimators': 300, 'learning_rate': 0.05361961670932297, 'max_depth': 5, 'min_samples_split': 6, 'min_samples_leaf': 18, 'subsample': 0.8868442182170071, 'max_features': 'log2'}. Best is trial 4 with value: 0.18036960279983288.
[D 2025-12-02 12:28:06,230] Sample trial#18 with TPESampler.
[I 2025-12-02 12:30:04,934] Trial 18 finished with value: 0.16948722348324474 and parameters: {'n_estimators': 200, 'learning_rate': 0.01443226200146443, 'max_depth': 6, 'min_samples_split': 11, 'min_samples_leaf': 11, 'subsample': 0.820263746390098, 'max_features': None}. Best is trial 4 with value: 0.18036960279983288.
[D 2025-12-02 12:30:05,035] Sample trial#19 with TPESampler.
[I 2025-12-02 12:33:15,900] Trial 19 finished with value: 0.154450681163937 and parameters: {'n_estimators': 250, 'learning_rate': 0.03393863101613415, 'max_depth': 7, 'min_samples_split': 14, 'min_samples_leaf': 8, 'subsample': 0.9103406701662212, 'max_features': None}. Best is trial 4 with value: 0.18036960279983288.
[D 2025-12-02 12:33:16,000] Sample trial#20 with TPESampler.
[I 2025-12-02 12:36:23,206] Trial 20 finished with value: 0.17483732872312838 and parameters: {'n_estimators': 300, 'learning_rate': 0.011971592537246535, 'max_depth': 6, 'min_samples_split': 6, 'min_samples_leaf': 1, 'subsample': 0.8553518915910373, 'max_features': None}. Best is trial 4 with value: 0.18036960279983288.
[D 2025-12-02 12:36:23,307] Sample trial#21 with TPESampler.
[I 2025-12-02 12:36:39,234] Trial 21 finished with value: 0.18515674389458858 and parameters: {'n_estimators': 150, 'learning_rate': 0.01049709684200756, 'max_depth': 8, 'min_samples_split': 14, 'min_samples_leaf': 1, 'subsample': 0.8123275531875824, 'max_features': 'sqrt'}. Best is trial 21 with value: 0.18515674389458858.
[D 2025-12-02 12:36:39,334] Sample trial#22 with TPESampler.
[I 2025-12-02 12:36:52,286] Trial 22 finished with value: 0.18089974474449405 and parameters: {'n_estimators': 150, 'learning_rate': 0.013523779492309656, 'max_depth': 6, 'min_samples_split': 8, 'min_samples_leaf': 2, 'subsample': 0.8645277390912433, 'max_features': 'sqrt'}. Best is trial 21 with value: 0.18515674389458858.
[D 2025-12-02 12:36:52,386] Sample trial#23 with TPESampler.
[I 2025-12-02 12:37:02,970] Trial 23 finished with value: 0.17360750981219136 and parameters: {'n_estimators': 100, 'learning_rate': 0.015179582786486063, 'max_depth': 8, 'min_samples_split': 14, 'min_samples_leaf': 2, 'subsample': 0.8094673183178493, 'max_features': 'sqrt'}. Best is trial 21 with value: 0.18515674389458858.
[D 2025-12-02 12:37:03,070] Sample trial#24 with TPESampler.
[I 2025-12-02 12:37:22,416] Trial 24 finished with value: 0.17674074271348986 and parameters: {'n_estimators': 200, 'learning_rate': 0.021890029095256804, 'max_depth': 7, 'min_samples_split': 5, 'min_samples_leaf': 3, 'subsample': 0.830965341930365, 'max_features': 'sqrt'}. Best is trial 21 with value: 0.18515674389458858.
[D 2025-12-02 12:37:22,516] Sample trial#25 with TPESampler.
[I 2025-12-02 12:38:03,998] Trial 25 finished with value: 0.16765618316966993 and parameters: {'n_estimators': 100, 'learning_rate': 0.027675315527385804, 'max_depth': 4, 'min_samples_split': 5, 'min_samples_leaf': 4, 'subsample': 0.8379768255162295, 'max_features': None}. Best is trial 21 with value: 0.18515674389458858.
[D 2025-12-02 12:38:04,097] Sample trial#26 with TPESampler.
[I 2025-12-02 12:40:55,828] Trial 26 finished with value: 0.16426258073724237 and parameters: {'n_estimators': 200, 'learning_rate': 0.030124407489827636, 'max_depth': 8, 'min_samples_split': 3, 'min_samples_leaf': 18, 'subsample': 0.9109838945310584, 'max_features': None}. Best is trial 21 with value: 0.18515674389458858.
[D 2025-12-02 12:40:55,929] Sample trial#27 with TPESampler.
[I 2025-12-02 12:41:15,183] Trial 27 finished with value: 0.18201855262757688 and parameters: {'n_estimators': 200, 'learning_rate': 0.01742192912259421, 'max_depth': 7, 'min_samples_split': 20, 'min_samples_leaf': 4, 'subsample': 0.839097390683897, 'max_features': 'sqrt'}. Best is trial 21 with value: 0.18515674389458858.
[D 2025-12-02 12:41:15,287] Sample trial#28 with TPESampler.
[I 2025-12-02 12:41:42,187] Trial 28 finished with value: 0.18254352421461556 and parameters: {'n_estimators': 250, 'learning_rate': 0.012739743897416955, 'max_depth': 8, 'min_samples_split': 18, 'min_samples_leaf': 1, 'subsample': 0.827678109496141, 'max_features': 'sqrt'}. Best is trial 21 with value: 0.18515674389458858.
[D 2025-12-02 12:41:42,287] Sample trial#29 with TPESampler.
[I 2025-12-02 12:42:08,494] Trial 29 finished with value: 0.1721418239356003 and parameters: {'n_estimators': 250, 'learning_rate': 0.015955329203260097, 'max_depth': 8, 'min_samples_split': 18, 'min_samples_leaf': 5, 'subsample': 0.803943530970166, 'max_features': 'sqrt'}. Best is trial 21 with value: 0.18515674389458858.
[I 2025-12-02 12:42:13,246] A new study created in memory with name: gradient_boosting_fold_3
[D 2025-12-02 12:42:13,246] Sample trial#0 with RandomSampler.
[I 2025-12-02 12:42:26,650] Trial 0 finished with value: 0.13534016410516475 and parameters: {'n_estimators': 150, 'learning_rate': 0.09422807414794394, 'max_depth': 8, 'min_samples_split': 3, 'min_samples_leaf': 4, 'subsample': 0.8604313436389623, 'max_features': 'log2'}. Best is trial 0 with value: 0.13534016410516475.
[D 2025-12-02 12:42:26,755] Sample trial#1 with TPESampler.
[I 2025-12-02 12:43:30,397] Trial 1 finished with value: 0.16708617080364938 and parameters: {'n_estimators': 300, 'learning_rate': 0.02423913533184923, 'max_depth': 2, 'min_samples_split': 3, 'min_samples_leaf': 12, 'subsample': 0.8333045365773235, 'max_features': None}. Best is trial 1 with value: 0.16708617080364938.
[D 2025-12-02 12:43:30,500] Sample trial#2 with TPESampler.
[I 2025-12-02 12:43:48,599] Trial 2 finished with value: 0.13219304505872237 and parameters: {'n_estimators': 250, 'learning_rate': 0.08692673539006368, 'max_depth': 7, 'min_samples_split': 10, 'min_samples_leaf': 19, 'subsample': 0.8240235288977434, 'max_features': 'log2'}. Best is trial 1 with value: 0.16708617080364938.
[D 2025-12-02 12:43:48,702] Sample trial#3 with TPESampler.
[I 2025-12-02 12:44:59,012] Trial 3 finished with value: 0.16392341489120943 and parameters: {'n_estimators': 150, 'learning_rate': 0.021749980840682092, 'max_depth': 4, 'min_samples_split': 14, 'min_samples_leaf': 19, 'subsample': 0.9408098527911455, 'max_features': None}. Best is trial 1 with value: 0.16708617080364938.
[D 2025-12-02 12:44:59,114] Sample trial#4 with TPESampler.
