[I 2025-12-02 13:14:57,628] Trial 0 finished with value: 0.14364671350132951 and parameters: {'n_estimators': 250, 'learning_rate': 0.05944527287019905, 'max_depth': 7, 'min_samples_split': 20, 'min_samples_leaf': 5, 'subsample': 0.93062418733552, 'max_features': 'sqrt'}. Best is trial 0 with value: 0.14364671350132951.
[D 2025-12-02 13:14:57,738] Sample trial#1 with TPESampler.
[I 2025-12-02 13:15:11,729] Trial 1 finished with value: 0.17129565400692992 and parameters: {'n_estimators': 250, 'learning_rate': 0.06041028636849059, 'max_depth': 4, 'min_samples_split': 3, 'min_samples_leaf': 7, 'subsample': 0.8213771734699276, 'max_features': 'sqrt'}. Best is trial 1 with value: 0.17129565400692992.
[D 2025-12-02 13:15:11,837] Sample trial#2 with TPESampler.
[I 2025-12-02 13:16:28,953] Trial 2 finished with value: 0.1594383102426087 and parameters: {'n_estimators': 250, 'learning_rate': 0.07854509095591354, 'max_depth': 3, 'min_samples_split': 8, 'min_samples_leaf': 11, 'subsample': 0.8243898666991706, 'max_features': None}. Best is trial 1 with value: 0.17129565400692992.
[D 2025-12-02 13:16:29,061] Sample trial#3 with TPESampler.
[I 2025-12-02 13:20:15,400] Trial 3 finished with value: 0.1367063501832016 and parameters: {'n_estimators': 250, 'learning_rate': 0.06868790380173101, 'max_depth': 8, 'min_samples_split': 19, 'min_samples_leaf': 19, 'subsample': 0.968582588823721, 'max_features': None}. Best is trial 1 with value: 0.17129565400692992.
[D 2025-12-02 13:20:15,505] Sample trial#4 with TPESampler.
[I 2025-12-02 13:22:33,009] Trial 4 finished with value: 0.13085075353013537 and parameters: {'n_estimators': 150, 'learning_rate': 0.0758622582085431, 'max_depth': 8, 'min_samples_split': 6, 'min_samples_leaf': 10, 'subsample': 0.9672514725547823, 'max_features': None}. Best is trial 1 with value: 0.17129565400692992.
[D 2025-12-02 13:22:33,117] Sample trial#5 with TPESampler.
[I 2025-12-02 13:22:44,882] Trial 5 finished with value: 0.16436996137898738 and parameters: {'n_estimators': 300, 'learning_rate': 0.018648729357252612, 'max_depth': 3, 'min_samples_split': 7, 'min_samples_leaf': 15, 'subsample': 0.9782989876297311, 'max_features': 'log2'}. Best is trial 1 with value: 0.17129565400692992.
[D 2025-12-02 13:22:44,991] Sample trial#6 with TPESampler.
[I 2025-12-02 13:22:52,538] Trial 6 finished with value: 0.16716400688085642 and parameters: {'n_estimators': 150, 'learning_rate': 0.04917165664442672, 'max_depth': 3, 'min_samples_split': 18, 'min_samples_leaf': 3, 'subsample': 0.9662957034431957, 'max_features': 'sqrt'}. Best is trial 1 with value: 0.17129565400692992.
[D 2025-12-02 13:22:52,645] Sample trial#7 with TPESampler.
[I 2025-12-02 13:24:52,622] Trial 7 finished with value: 0.15849035539160838 and parameters: {'n_estimators': 150, 'learning_rate': 0.02022690645968627, 'max_depth': 7, 'min_samples_split': 19, 'min_samples_leaf': 1, 'subsample': 0.9413718106725995, 'max_features': None}. Best is trial 1 with value: 0.17129565400692992.
[D 2025-12-02 13:24:52,730] Sample trial#8 with TPESampler.
[I 2025-12-02 13:24:58,808] Trial 8 finished with value: 0.1618031837561206 and parameters: {'n_estimators': 100, 'learning_rate': 0.009652237961519794, 'max_depth': 4, 'min_samples_split': 4, 'min_samples_leaf': 5, 'subsample': 0.8898573735602325, 'max_features': 'sqrt'}. Best is trial 1 with value: 0.17129565400692992.
[D 2025-12-02 13:24:58,916] Sample trial#9 with TPESampler.
[I 2025-12-02 13:25:20,790] Trial 9 finished with value: 0.14737809500541382 and parameters: {'n_estimators': 300, 'learning_rate': 0.05899155304881276, 'max_depth': 5, 'min_samples_split': 17, 'min_samples_leaf': 13, 'subsample': 0.8790739627802325, 'max_features': 'sqrt'}. Best is trial 1 with value: 0.17129565400692992.
[D 2025-12-02 13:25:20,898] Sample trial#10 with TPESampler.
[I 2025-12-02 13:25:28,945] Trial 10 finished with value: 0.1631779002446524 and parameters: {'n_estimators': 250, 'learning_rate': 0.03779697010176021, 'max_depth': 2, 'min_samples_split': 4, 'min_samples_leaf': 10, 'subsample': 0.8803456185995275, 'max_features': 'sqrt'}. Best is trial 1 with value: 0.17129565400692992.
[D 2025-12-02 13:25:29,051] Sample trial#11 with TPESampler.
[I 2025-12-02 13:25:35,973] Trial 11 finished with value: 0.15925145190762394 and parameters: {'n_estimators': 200, 'learning_rate': 0.07720658369341626, 'max_depth': 2, 'min_samples_split': 19, 'min_samples_leaf': 1, 'subsample': 0.9509206793654681, 'max_features': 'sqrt'}. Best is trial 1 with value: 0.17129565400692992.
[D 2025-12-02 13:25:36,081] Sample trial#12 with TPESampler.
[I 2025-12-02 13:25:39,559] Trial 12 finished with value: 0.15896499277375842 and parameters: {'n_estimators': 100, 'learning_rate': 0.04544318874313722, 'max_depth': 2, 'min_samples_split': 13, 'min_samples_leaf': 7, 'subsample': 0.9636621826907915, 'max_features': 'sqrt'}. Best is trial 1 with value: 0.17129565400692992.
[D 2025-12-02 13:25:39,666] Sample trial#13 with TPESampler.
[I 2025-12-02 13:25:53,987] Trial 13 finished with value: 0.1607150523710534 and parameters: {'n_estimators': 250, 'learning_rate': 0.0676312779062472, 'max_depth': 4, 'min_samples_split': 5, 'min_samples_leaf': 4, 'subsample': 0.8441922960113725, 'max_features': 'sqrt'}. Best is trial 1 with value: 0.17129565400692992.
[D 2025-12-02 13:25:54,094] Sample trial#14 with TPESampler.
[I 2025-12-02 13:26:15,693] Trial 14 finished with value: 0.15421461361653008 and parameters: {'n_estimators': 200, 'learning_rate': 0.04919734245229813, 'max_depth': 8, 'min_samples_split': 3, 'min_samples_leaf': 6, 'subsample': 0.8237951603834497, 'max_features': 'sqrt'}. Best is trial 1 with value: 0.17129565400692992.
[D 2025-12-02 13:26:15,801] Sample trial#15 with TPESampler.
[I 2025-12-02 13:26:20,458] Trial 15 finished with value: 0.15834838233459164 and parameters: {'n_estimators': 100, 'learning_rate': 0.01460622263716601, 'max_depth': 3, 'min_samples_split': 20, 'min_samples_leaf': 7, 'subsample': 0.8866962211909022, 'max_features': 'sqrt'}. Best is trial 1 with value: 0.17129565400692992.
[D 2025-12-02 13:26:20,567] Sample trial#16 with TPESampler.
[I 2025-12-02 13:26:45,031] Trial 16 finished with value: 0.1436018793734771 and parameters: {'n_estimators': 300, 'learning_rate': 0.057033846101526, 'max_depth': 6, 'min_samples_split': 7, 'min_samples_leaf': 13, 'subsample': 0.826072421424256, 'max_features': 'sqrt'}. Best is trial 1 with value: 0.17129565400692992.
[D 2025-12-02 13:26:45,140] Sample trial#17 with TPESampler.
[I 2025-12-02 13:27:58,881] Trial 17 finished with value: 0.1504718377366168 and parameters: {'n_estimators': 150, 'learning_rate': 0.061926746001330454, 'max_depth': 4, 'min_samples_split': 16, 'min_samples_leaf': 6, 'subsample': 0.9843932063998109, 'max_features': None}. Best is trial 1 with value: 0.17129565400692992.
[D 2025-12-02 13:27:58,990] Sample trial#18 with TPESampler.
[I 2025-12-02 13:28:15,060] Trial 18 finished with value: 0.17743861460975646 and parameters: {'n_estimators': 250, 'learning_rate': 0.016406232058957304, 'max_depth': 6, 'min_samples_split': 5, 'min_samples_leaf': 2, 'subsample': 0.8265730139765517, 'max_features': 'log2'}. Best is trial 18 with value: 0.17743861460975646.
[D 2025-12-02 13:28:15,168] Sample trial#19 with TPESampler.
[I 2025-12-02 13:28:33,291] Trial 19 finished with value: 0.16600428113514093 and parameters: {'n_estimators': 250, 'learning_rate': 0.011595255034302754, 'max_depth': 7, 'min_samples_split': 4, 'min_samples_leaf': 5, 'subsample': 0.8071718007796347, 'max_features': 'log2'}. Best is trial 18 with value: 0.17743861460975646.
[D 2025-12-02 13:28:33,398] Sample trial#20 with TPESampler.
[I 2025-12-02 13:28:45,075] Trial 20 finished with value: 0.17217523611647773 and parameters: {'n_estimators': 250, 'learning_rate': 0.015744274476589548, 'max_depth': 4, 'min_samples_split': 12, 'min_samples_leaf': 2, 'subsample': 0.8875383442173346, 'max_features': 'log2'}. Best is trial 18 with value: 0.17743861460975646.
[D 2025-12-02 13:28:45,183] Sample trial#21 with TPESampler.
[I 2025-12-02 13:28:54,690] Trial 21 finished with value: 0.1694886293814864 and parameters: {'n_estimators': 200, 'learning_rate': 0.01880963446192497, 'max_depth': 4, 'min_samples_split': 14, 'min_samples_leaf': 1, 'subsample': 0.9016780275684766, 'max_features': 'log2'}. Best is trial 18 with value: 0.17743861460975646.
[D 2025-12-02 13:28:54,798] Sample trial#22 with TPESampler.
[I 2025-12-02 13:29:02,253] Trial 22 finished with value: 0.1579572705694159 and parameters: {'n_estimators': 300, 'learning_rate': 0.0165676027627684, 'max_depth': 2, 'min_samples_split': 12, 'min_samples_leaf': 3, 'subsample': 0.8641453808944968, 'max_features': 'log2'}. Best is trial 18 with value: 0.17743861460975646.
[D 2025-12-02 13:29:02,360] Sample trial#23 with TPESampler.
[I 2025-12-02 13:32:14,707] Trial 23 finished with value: 0.16283660489879548 and parameters: {'n_estimators': 300, 'learning_rate': 0.025077409664072195, 'max_depth': 6, 'min_samples_split': 9, 'min_samples_leaf': 2, 'subsample': 0.8795318081078609, 'max_features': None}. Best is trial 18 with value: 0.17743861460975646.
[D 2025-12-02 13:32:14,814] Sample trial#24 with TPESampler.
[I 2025-12-02 13:32:30,590] Trial 24 finished with value: 0.16630130310327068 and parameters: {'n_estimators': 300, 'learning_rate': 0.046598277199971026, 'max_depth': 5, 'min_samples_split': 7, 'min_samples_leaf': 4, 'subsample': 0.8080517270098326, 'max_features': 'log2'}. Best is trial 18 with value: 0.17743861460975646.
[D 2025-12-02 13:32:30,698] Sample trial#25 with TPESampler.
[I 2025-12-02 13:32:45,957] Trial 25 finished with value: 0.16856445758899735 and parameters: {'n_estimators': 250, 'learning_rate': 0.010371062204716185, 'max_depth': 4, 'min_samples_split': 11, 'min_samples_leaf': 7, 'subsample': 0.8979492752058479, 'max_features': 'sqrt'}. Best is trial 18 with value: 0.17743861460975646.
[D 2025-12-02 13:32:46,065] Sample trial#26 with TPESampler.
[I 2025-12-02 13:32:52,096] Trial 26 finished with value: 0.1600603459369268 and parameters: {'n_estimators': 200, 'learning_rate': 0.039776951637594246, 'max_depth': 2, 'min_samples_split': 3, 'min_samples_leaf': 2, 'subsample': 0.820984413472033, 'max_features': 'sqrt'}. Best is trial 18 with value: 0.17743861460975646.
[D 2025-12-02 13:32:52,204] Sample trial#27 with TPESampler.
[I 2025-12-02 13:33:01,424] Trial 27 finished with value: 0.16732961771924 and parameters: {'n_estimators': 200, 'learning_rate': 0.028435179906052148, 'max_depth': 4, 'min_samples_split': 6, 'min_samples_leaf': 1, 'subsample': 0.8690223384714864, 'max_features': 'log2'}. Best is trial 18 with value: 0.17743861460975646.
[D 2025-12-02 13:33:01,532] Sample trial#28 with TPESampler.
[I 2025-12-02 13:33:21,881] Trial 28 finished with value: 0.17137199587542434 and parameters: {'n_estimators': 300, 'learning_rate': 0.014310646036682603, 'max_depth': 6, 'min_samples_split': 11, 'min_samples_leaf': 5, 'subsample': 0.8828491487787679, 'max_features': 'log2'}. Best is trial 18 with value: 0.17743861460975646.
[D 2025-12-02 13:33:21,986] Sample trial#29 with TPESampler.
[I 2025-12-02 13:33:41,952] Trial 29 finished with value: 0.16419824347540835 and parameters: {'n_estimators': 250, 'learning_rate': 0.024005643544273383, 'max_depth': 7, 'min_samples_split': 9, 'min_samples_leaf': 6, 'subsample': 0.896953832218916, 'max_features': 'log2'}. Best is trial 18 with value: 0.17743861460975646.
[I 2025-12-02 13:35:25,021] A new study created in memory with name: histogram_gradient_boosting_fold_1
[D 2025-12-02 13:35:25,022] Sample trial#0 with RandomSampler.
[I 2025-12-02 13:35:25,568] Trial 0 finished with value: 0.16690950492816384 and parameters: {'max_iter': 73, 'learning_rate': 0.04724158600923776, 'max_depth': 4, 'min_samples_leaf': 18, 'l2_regularization': 0.4047164678851912}. Best is trial 0 with value: 0.16690950492816384.
[D 2025-12-02 13:35:25,683] Sample trial#1 with GPSampler.
[I 2025-12-02 13:35:26,104] Trial 1 finished with value: 0.1759803590825713 and parameters: {'max_iter': 61, 'learning_rate': 0.06028121507248138, 'max_depth': 3, 'min_samples_leaf': 2, 'l2_regularization': 0.6263406214474028}. Best is trial 1 with value: 0.1759803590825713.
[D 2025-12-02 13:35:26,221] Sample trial#2 with GPSampler.
[I 2025-12-02 13:35:26,698] Trial 2 finished with value: 0.17360354929272498 and parameters: {'max_iter': 72, 'learning_rate': 0.07340364623951882, 'max_depth': 3, 'min_samples_leaf': 18, 'l2_regularization': 0.3084448619108515}. Best is trial 1 with value: 0.1759803590825713.
[D 2025-12-02 13:35:26,811] Sample trial#3 with GPSampler.
[I 2025-12-02 13:35:27,596] Trial 3 finished with value: 0.16443962333469672 and parameters: {'max_iter': 161, 'learning_rate': 0.04842892761928197, 'max_depth': 4, 'min_samples_leaf': 3, 'l2_regularization': 0.8697006073211042}. Best is trial 1 with value: 0.1759803590825713.
[D 2025-12-02 13:35:27,706] Sample trial#4 with GPSampler.
[I 2025-12-02 13:35:28,202] Trial 4 finished with value: 0.1538948350750556 and parameters: {'max_iter': 110, 'learning_rate': 0.012483314436622787, 'max_depth': 2, 'min_samples_leaf': 7, 'l2_regularization': 0.5209102872749461}. Best is trial 1 with value: 0.1759803590825713.
[D 2025-12-02 13:35:28,313] Sample trial#5 with GPSampler.
[I 2025-12-02 13:35:28,824] Trial 5 finished with value: 0.16341985717105173 and parameters: {'max_iter': 117, 'learning_rate': 0.0427170311049233, 'max_depth': 2, 'min_samples_leaf': 22, 'l2_regularization': 0.6421139520198655}. Best is trial 1 with value: 0.1759803590825713.
[D 2025-12-02 13:35:28,936] Sample trial#6 with GPSampler.
[I 2025-12-02 13:35:29,742] Trial 6 finished with value: 0.16889634930260916 and parameters: {'max_iter': 168, 'learning_rate': 0.04875986948827009, 'max_depth': 4, 'min_samples_leaf': 15, 'l2_regularization': 0.4186716449848036}. Best is trial 1 with value: 0.1759803590825713.
[D 2025-12-02 13:35:29,853] Sample trial#7 with GPSampler.
[I 2025-12-02 13:35:30,378] Trial 7 finished with value: 0.16845099438171734 and parameters: {'max_iter': 121, 'learning_rate': 0.017968392400586355, 'max_depth': 3, 'min_samples_leaf': 26, 'l2_regularization': 0.6873314784325842}. Best is trial 1 with value: 0.1759803590825713.
[D 2025-12-02 13:35:30,490] Sample trial#8 with GPSampler.
[I 2025-12-02 13:35:31,097] Trial 8 finished with value: 0.16501506071785577 and parameters: {'max_iter': 64, 'learning_rate': 0.03924612010162579, 'max_depth': 5, 'min_samples_leaf': 2, 'l2_regularization': 0.17885239865854308}. Best is trial 1 with value: 0.1759803590825713.
[D 2025-12-02 13:35:31,207] Sample trial#9 with GPSampler.
[I 2025-12-02 13:35:31,862] Trial 9 finished with value: 0.17255758338956112 and parameters: {'max_iter': 198, 'learning_rate': 0.036987870143027166, 'max_depth': 3, 'min_samples_leaf': 30, 'l2_regularization': 0.8159026713776745}. Best is trial 1 with value: 0.1759803590825713.
[D 2025-12-02 13:35:31,972] Sample trial#10 with GPSampler.
[I 2025-12-02 13:35:32,519] Trial 10 finished with value: 0.17272399073779385 and parameters: {'max_iter': 50, 'learning_rate': 0.0780671442449084, 'max_depth': 3, 'min_samples_leaf': 2, 'l2_regularization': 0.5338512689452719}. Best is trial 1 with value: 0.1759803590825713.
[D 2025-12-02 13:35:32,629] Sample trial#11 with GPSampler.
[I 2025-12-02 13:35:33,253] Trial 11 finished with value: 0.16865352146904788 and parameters: {'max_iter': 50, 'learning_rate': 0.06521708334755487, 'max_depth': 4, 'min_samples_leaf': 6, 'l2_regularization': 1.0}. Best is trial 1 with value: 0.1759803590825713.
[D 2025-12-02 13:35:33,364] Sample trial#12 with GPSampler.
[I 2025-12-02 13:35:33,780] Trial 12 finished with value: 0.16315999900813785 and parameters: {'max_iter': 50, 'learning_rate': 0.06259951132939363, 'max_depth': 2, 'min_samples_leaf': 1, 'l2_regularization': 0.4222400248228441}. Best is trial 1 with value: 0.1759803590825713.
[D 2025-12-02 13:35:33,896] Sample trial#13 with GPSampler.
[I 2025-12-02 13:35:34,515] Trial 13 finished with value: 0.1724696677947695 and parameters: {'max_iter': 67, 'learning_rate': 0.06131554937116663, 'max_depth': 3, 'min_samples_leaf': 25, 'l2_regularization': 0.9094816094816389}. Best is trial 1 with value: 0.1759803590825713.
[D 2025-12-02 13:35:34,629] Sample trial#14 with GPSampler.
[I 2025-12-02 13:35:35,547] Trial 14 finished with value: 0.17028078864937238 and parameters: {'max_iter': 192, 'learning_rate': 0.05878973778765908, 'max_depth': 3, 'min_samples_leaf': 7, 'l2_regularization': 0.3195931100460769}. Best is trial 1 with value: 0.1759803590825713.
[D 2025-12-02 13:35:35,660] Sample trial#15 with GPSampler.
[I 2025-12-02 13:35:36,111] Trial 15 finished with value: 0.1704372520371004 and parameters: {'max_iter': 50, 'learning_rate': 0.055727162166747356, 'max_depth': 3, 'min_samples_leaf': 5, 'l2_regularization': 0.11935583614261776}. Best is trial 1 with value: 0.1759803590825713.
[D 2025-12-02 13:35:36,221] Sample trial#16 with GPSampler.
[I 2025-12-02 13:35:36,710] Trial 16 finished with value: 0.17389561480676738 and parameters: {'max_iter': 50, 'learning_rate': 0.05827565240381537, 'max_depth': 3, 'min_samples_leaf': 1, 'l2_regularization': 0.8871700490677553}. Best is trial 1 with value: 0.1759803590825713.
[D 2025-12-02 13:35:36,821] Sample trial#17 with GPSampler.
[I 2025-12-02 13:35:37,956] Trial 17 finished with value: 0.15083576731522225 and parameters: {'max_iter': 200, 'learning_rate': 0.1, 'max_depth': 4, 'min_samples_leaf': 30, 'l2_regularization': 0.0}. Best is trial 1 with value: 0.1759803590825713.
[D 2025-12-02 13:35:38,072] Sample trial#18 with GPSampler.
[I 2025-12-02 13:35:38,646] Trial 18 finished with value: 0.16907635694259315 and parameters: {'max_iter': 67, 'learning_rate': 0.05837870092124416, 'max_depth': 3, 'min_samples_leaf': 20, 'l2_regularization': 0.5291943113713711}. Best is trial 1 with value: 0.1759803590825713.
[D 2025-12-02 13:35:38,759] Sample trial#19 with GPSampler.
[I 2025-12-02 13:35:39,499] Trial 19 finished with value: 0.17068709888443317 and parameters: {'max_iter': 50, 'learning_rate': 0.0788514912409554, 'max_depth': 3, 'min_samples_leaf': 16, 'l2_regularization': 1.0}. Best is trial 1 with value: 0.1759803590825713.
[D 2025-12-02 13:35:39,614] Sample trial#20 with GPSampler.
[I 2025-12-02 13:35:40,882] Trial 20 finished with value: 0.16882884283646196 and parameters: {'max_iter': 200, 'learning_rate': 0.009, 'max_depth': 5, 'min_samples_leaf': 30, 'l2_regularization': 1.0}. Best is trial 1 with value: 0.1759803590825713.
[D 2025-12-02 13:35:40,993] Sample trial#21 with GPSampler.
[I 2025-12-02 13:35:41,860] Trial 21 finished with value: 0.16759150508209197 and parameters: {'max_iter': 200, 'learning_rate': 0.06441575225176963, 'max_depth': 3, 'min_samples_leaf': 30, 'l2_regularization': 1.0}. Best is trial 1 with value: 0.1759803590825713.
[D 2025-12-02 13:35:41,970] Sample trial#22 with GPSampler.
[I 2025-12-02 13:35:43,442] Trial 22 finished with value: 0.16483716729957135 and parameters: {'max_iter': 200, 'learning_rate': 0.009, 'max_depth': 4, 'min_samples_leaf': 30, 'l2_regularization': 0.0}. Best is trial 1 with value: 0.1759803590825713.
[D 2025-12-02 13:35:43,551] Sample trial#23 with GPSampler.
[I 2025-12-02 13:35:44,142] Trial 23 finished with value: 0.17356363796008217 and parameters: {'max_iter': 100, 'learning_rate': 0.0664617542864904, 'max_depth': 3, 'min_samples_leaf': 1, 'l2_regularization': 0.838257591172252}. Best is trial 1 with value: 0.1759803590825713.
[D 2025-12-02 13:35:44,256] Sample trial#24 with GPSampler.
[I 2025-12-02 13:35:44,658] Trial 24 finished with value: 0.1623407720556267 and parameters: {'max_iter': 50, 'learning_rate': 0.1, 'max_depth': 2, 'min_samples_leaf': 30, 'l2_regularization': 0.0}. Best is trial 1 with value: 0.1759803590825713.
[D 2025-12-02 13:35:44,768] Sample trial#25 with GPSampler.
[I 2025-12-02 13:35:45,349] Trial 25 finished with value: 0.14447892736561005 and parameters: {'max_iter': 50, 'learning_rate': 0.009, 'max_depth': 5, 'min_samples_leaf': 1, 'l2_regularization': 1.0}. Best is trial 1 with value: 0.1759803590825713.
[D 2025-12-02 13:35:45,458] Sample trial#26 with GPSampler.
[I 2025-12-02 13:35:46,059] Trial 26 finished with value: 0.1672808572116856 and parameters: {'max_iter': 50, 'learning_rate': 0.07309872977736903, 'max_depth': 4, 'min_samples_leaf': 6, 'l2_regularization': 0.188145810921484}. Best is trial 1 with value: 0.1759803590825713.
[D 2025-12-02 13:35:46,171] Sample trial#27 with GPSampler.
[I 2025-12-02 13:35:47,416] Trial 27 finished with value: 0.16548562449296925 and parameters: {'max_iter': 200, 'learning_rate': 0.0337779795144239, 'max_depth': 4, 'min_samples_leaf': 30, 'l2_regularization': 1.0}. Best is trial 1 with value: 0.1759803590825713.
[D 2025-12-02 13:35:47,532] Sample trial#28 with GPSampler.
[I 2025-12-02 13:35:48,140] Trial 28 finished with value: 0.17491362578779338 and parameters: {'max_iter': 50, 'learning_rate': 0.0644892519365888, 'max_depth': 3, 'min_samples_leaf': 6, 'l2_regularization': 0.6497140014627939}. Best is trial 1 with value: 0.1759803590825713.
[D 2025-12-02 13:35:48,252] Sample trial#29 with GPSampler.
[I 2025-12-02 13:35:49,124] Trial 29 finished with value: 0.1502268823486715 and parameters: {'max_iter': 50, 'learning_rate': 0.1, 'max_depth': 5, 'min_samples_leaf': 1, 'l2_regularization': 0.9999999999999999}. Best is trial 1 with value: 0.1759803590825713.
[I 2025-12-02 13:35:49,700] A new study created in memory with name: histogram_gradient_boosting_fold_2
[D 2025-12-02 13:35:49,700] Sample trial#0 with RandomSampler.
