[I 2025-12-02 14:00:43,479] Trial 1 finished with value: 0.12968361430198577 and parameters: {'n_estimators': 200, 'learning_rate': 0.096427788832472, 'max_depth': 10, 'min_child_weight': 7, 'subsample': 0.90264719798414, 'colsample_bytree': 0.4006890509980494, 'reg_alpha': 0.5356424264329183, 'reg_lambda': 5.045903157283783, 'gamma': 5.0, 'scale_pos_weight': 5.474143764645231}. Best is trial 0 with value: 0.13448020211837108.
[D 2025-12-02 14:00:43,612] Sample trial#2 with GPSampler.
[I 2025-12-02 14:00:54,807] Trial 2 finished with value: 0.14837832655930575 and parameters: {'n_estimators': 550, 'learning_rate': 0.04174900079594732, 'max_depth': 2, 'min_child_weight': 7, 'subsample': 0.9271131982099114, 'colsample_bytree': 0.4880837745213541, 'reg_alpha': 0.3572885910006621, 'reg_lambda': 7.961950328952876, 'gamma': 4.0, 'scale_pos_weight': 5.674778360679927}. Best is trial 2 with value: 0.14837832655930575.
[D 2025-12-02 14:00:54,943] Sample trial#3 with GPSampler.
[I 2025-12-02 14:01:03,538] Trial 3 finished with value: 0.13583673407272517 and parameters: {'n_estimators': 950, 'learning_rate': 0.024538282478903058, 'max_depth': 14, 'min_child_weight': 6, 'subsample': 0.9956027530556668, 'colsample_bytree': 0.47181290675360305, 'reg_alpha': 0.3261746767175786, 'reg_lambda': 4.4220112452839, 'gamma': 3.0, 'scale_pos_weight': 5.388168557923468}. Best is trial 2 with value: 0.14837832655930575.
[D 2025-12-02 14:01:03,673] Sample trial#4 with GPSampler.
[I 2025-12-02 14:01:21,057] Trial 4 finished with value: 0.11699824333718549 and parameters: {'n_estimators': 600, 'learning_rate': 0.03646403851790446, 'max_depth': 16, 'min_child_weight': 4, 'subsample': 0.9041852288978484, 'colsample_bytree': 0.4600714635360274, 'reg_alpha': 0.0700589376649452, 'reg_lambda': 6.837443749640332, 'gamma': 0.0, 'scale_pos_weight': 5.656668356260717}. Best is trial 2 with value: 0.14837832655930575.
[D 2025-12-02 14:01:21,193] Sample trial#5 with GPSampler.
[I 2025-12-02 14:01:31,128] Trial 5 finished with value: 0.12541471864460635 and parameters: {'n_estimators': 100, 'learning_rate': 0.04289194051572225, 'max_depth': 8, 'min_child_weight': 1, 'subsample': 0.9442352228859943, 'colsample_bytree': 0.48601112634487104, 'reg_alpha': 0.561252323762012, 'reg_lambda': 6.814013159359169, 'gamma': 0.0, 'scale_pos_weight': 5.992368886104815}. Best is trial 2 with value: 0.14837832655930575.
[D 2025-12-02 14:01:31,258] Sample trial#6 with GPSampler.
[I 2025-12-02 14:01:47,817] Trial 6 finished with value: 0.13487599696160066 and parameters: {'n_estimators': 600, 'learning_rate': 0.01645499374676997, 'max_depth': 12, 'min_child_weight': 8, 'subsample': 0.9601870740284137, 'colsample_bytree': 0.5176803944339242, 'reg_alpha': 0.04965100630504393, 'reg_lambda': 5.951910951411107, 'gamma': 2.0, 'scale_pos_weight': 5.4267276364618935}. Best is trial 2 with value: 0.14837832655930575.
[D 2025-12-02 14:01:47,951] Sample trial#7 with GPSampler.
[I 2025-12-02 14:01:52,111] Trial 7 finished with value: 0.14101706533142616 and parameters: {'n_estimators': 100, 'learning_rate': 0.04501472736964258, 'max_depth': 12, 'min_child_weight': 8, 'subsample': 0.9946994177069695, 'colsample_bytree': 0.4623704737999975, 'reg_alpha': 0.0003034051540001803, 'reg_lambda': 3.8348511759883195, 'gamma': 5.0, 'scale_pos_weight': 5.79702369560804}. Best is trial 2 with value: 0.14837832655930575.
[D 2025-12-02 14:01:52,239] Sample trial#8 with GPSampler.
[I 2025-12-02 14:02:28,011] Trial 8 finished with value: 0.12936822009349386 and parameters: {'n_estimators': 650, 'learning_rate': 0.009353463520683215, 'max_depth': 18, 'min_child_weight': 3, 'subsample': 0.9236342663275277, 'colsample_bytree': 0.5784688068324909, 'reg_alpha': 0.10838324807748789, 'reg_lambda': 1.9689063085317624, 'gamma': 2.0, 'scale_pos_weight': 5.4137258250704186}. Best is trial 2 with value: 0.14837832655930575.
[D 2025-12-02 14:02:28,140] Sample trial#9 with GPSampler.
[I 2025-12-02 14:02:35,481] Trial 9 finished with value: 0.13628752269150568 and parameters: {'n_estimators': 300, 'learning_rate': 0.04364764941620974, 'max_depth': 14, 'min_child_weight': 7, 'subsample': 0.9879821986597422, 'colsample_bytree': 0.5179743970146298, 'reg_alpha': 0.13282107850376246, 'reg_lambda': 5.320000771648109, 'gamma': 2.0, 'scale_pos_weight': 5.514341788942743}. Best is trial 2 with value: 0.14837832655930575.
[D 2025-12-02 14:02:35,610] Sample trial#10 with GPSampler.
[I 2025-12-02 14:02:45,626] Trial 10 finished with value: 0.15307403976491046 and parameters: {'n_estimators': 550, 'learning_rate': 0.032544905182281064, 'max_depth': 2, 'min_child_weight': 9, 'subsample': 0.9556726909533134, 'colsample_bytree': 0.5007150211160143, 'reg_alpha': 0.2733898880420736, 'reg_lambda': 7.851202362720456, 'gamma': 5.0, 'scale_pos_weight': 5.673785916041012}. Best is trial 10 with value: 0.15307403976491046.
[D 2025-12-02 14:02:45,759] Sample trial#11 with GPSampler.
[I 2025-12-02 14:02:51,250] Trial 11 finished with value: 0.14965017941644615 and parameters: {'n_estimators': 250, 'learning_rate': 0.0307954731916896, 'max_depth': 2, 'min_child_weight': 10, 'subsample': 0.9930993701743942, 'colsample_bytree': 0.5123160411541896, 'reg_alpha': 0.18508488994577346, 'reg_lambda': 7.69383386236986, 'gamma': 5.0, 'scale_pos_weight': 5.382778965275863}. Best is trial 10 with value: 0.15307403976491046.
[D 2025-12-02 14:02:51,385] Sample trial#12 with GPSampler.
[I 2025-12-02 14:03:02,442] Trial 12 finished with value: 0.15140790446783517 and parameters: {'n_estimators': 900, 'learning_rate': 0.028212351678734947, 'max_depth': 2, 'min_child_weight': 10, 'subsample': 0.9671659813968043, 'colsample_bytree': 0.5328728310173039, 'reg_alpha': 0.32539104855235423, 'reg_lambda': 9.257958490752452, 'gamma': 5.0, 'scale_pos_weight': 5.997505089041161}. Best is trial 10 with value: 0.15307403976491046.
[D 2025-12-02 14:03:02,575] Sample trial#13 with GPSampler.
[I 2025-12-02 14:03:14,005] Trial 13 finished with value: 0.14812772946678945 and parameters: {'n_estimators': 700, 'learning_rate': 0.009, 'max_depth': 2, 'min_child_weight': 10, 'subsample': 0.9545918045870514, 'colsample_bytree': 0.4983165501727592, 'reg_alpha': 0.11909420075396544, 'reg_lambda': 5.785592327855944, 'gamma': 5.0, 'scale_pos_weight': 5.911049175601988}. Best is trial 10 with value: 0.15307403976491046.
[D 2025-12-02 14:03:14,142] Sample trial#14 with GPSampler.
[I 2025-12-02 14:03:21,649] Trial 14 finished with value: 0.15016398475774723 and parameters: {'n_estimators': 500, 'learning_rate': 0.024844878511053624, 'max_depth': 2, 'min_child_weight': 10, 'subsample': 0.946534936224321, 'colsample_bytree': 0.46790346633647983, 'reg_alpha': 0.3607719955499091, 'reg_lambda': 10.0, 'gamma': 5.0, 'scale_pos_weight': 5.500246526286015}. Best is trial 10 with value: 0.15307403976491046.
[D 2025-12-02 14:03:21,779] Sample trial#15 with GPSampler.
[I 2025-12-02 14:03:28,692] Trial 15 finished with value: 0.14762573057547682 and parameters: {'n_estimators': 650, 'learning_rate': 0.07421893191329404, 'max_depth': 2, 'min_child_weight': 10, 'subsample': 0.9564308269491035, 'colsample_bytree': 0.585515977981076, 'reg_alpha': 0.2858920643942657, 'reg_lambda': 8.220760223955338, 'gamma': 5.0, 'scale_pos_weight': 5.655128998961361}. Best is trial 10 with value: 0.15307403976491046.
[D 2025-12-02 14:03:28,829] Sample trial#16 with GPSampler.
[I 2025-12-02 14:03:37,509] Trial 16 finished with value: 0.15276581751488472 and parameters: {'n_estimators': 650, 'learning_rate': 0.033616838336794255, 'max_depth': 2, 'min_child_weight': 8, 'subsample': 0.9824057405635389, 'colsample_bytree': 0.42147275811875284, 'reg_alpha': 0.3356501765749775, 'reg_lambda': 8.509466735905793, 'gamma': 5.0, 'scale_pos_weight': 5.9061069265813355}. Best is trial 10 with value: 0.15307403976491046.
[D 2025-12-02 14:03:37,638] Sample trial#17 with GPSampler.
[I 2025-12-02 14:03:42,841] Trial 17 finished with value: 0.14544624272118195 and parameters: {'n_estimators': 500, 'learning_rate': 0.009, 'max_depth': 2, 'min_child_weight': 8, 'subsample': 0.9740775462557584, 'colsample_bytree': 0.5157079067554812, 'reg_alpha': 0.6470973548566867, 'reg_lambda': 8.356299919808347, 'gamma': 5.0, 'scale_pos_weight': 5.803483273579193}. Best is trial 10 with value: 0.15307403976491046.
[D 2025-12-02 14:03:42,981] Sample trial#18 with GPSampler.
[I 2025-12-02 14:03:51,485] Trial 18 finished with value: 0.15247911648968548 and parameters: {'n_estimators': 750, 'learning_rate': 0.04344776720756947, 'max_depth': 2, 'min_child_weight': 10, 'subsample': 0.9698610503553341, 'colsample_bytree': 0.4078045923989137, 'reg_alpha': 0.01841265998206319, 'reg_lambda': 7.6899106606179615, 'gamma': 5.0, 'scale_pos_weight': 5.795264051451832}. Best is trial 10 with value: 0.15307403976491046.
[D 2025-12-02 14:03:51,613] Sample trial#19 with GPSampler.
[I 2025-12-02 14:03:57,201] Trial 19 finished with value: 0.14980031331541546 and parameters: {'n_estimators': 300, 'learning_rate': 0.04095778765390853, 'max_depth': 2, 'min_child_weight': 9, 'subsample': 0.9692976294908934, 'colsample_bytree': 0.4930092951810358, 'reg_alpha': 0.024038878435720116, 'reg_lambda': 9.462448904181608, 'gamma': 5.0, 'scale_pos_weight': 6.0}. Best is trial 10 with value: 0.15307403976491046.
[D 2025-12-02 14:03:57,334] Sample trial#20 with GPSampler.
[I 2025-12-02 14:04:05,342] Trial 20 finished with value: 0.14902493168009315 and parameters: {'n_estimators': 850, 'learning_rate': 0.04194370656086, 'max_depth': 2, 'min_child_weight': 10, 'subsample': 0.9718823681985678, 'colsample_bytree': 0.4345005663851839, 'reg_alpha': 0.4857126852084574, 'reg_lambda': 6.627454886007768, 'gamma': 5.0, 'scale_pos_weight': 5.703339772325006}. Best is trial 10 with value: 0.15307403976491046.
[D 2025-12-02 14:04:05,475] Sample trial#21 with GPSampler.
[I 2025-12-02 14:04:12,350] Trial 21 finished with value: 0.14875077821091012 and parameters: {'n_estimators': 1000, 'learning_rate': 0.029146245914026925, 'max_depth': 2, 'min_child_weight': 8, 'subsample': 0.9688344074701614, 'colsample_bytree': 0.4208680162959819, 'reg_alpha': 0.14890670008907744, 'reg_lambda': 8.63854689958417, 'gamma': 5.0, 'scale_pos_weight': 5.546080320761047}. Best is trial 10 with value: 0.15307403976491046.
[D 2025-12-02 14:04:12,486] Sample trial#22 with GPSampler.
[I 2025-12-02 14:04:25,687] Trial 22 finished with value: 0.15413781602582474 and parameters: {'n_estimators': 650, 'learning_rate': 0.0378571094613385, 'max_depth': 2, 'min_child_weight': 9, 'subsample': 0.9827183102363296, 'colsample_bytree': 0.5299973938690103, 'reg_alpha': 0.03604739932679632, 'reg_lambda': 8.759986782830143, 'gamma': 5.0, 'scale_pos_weight': 5.762025860419055}. Best is trial 22 with value: 0.15413781602582474.
[D 2025-12-02 14:04:25,822] Sample trial#23 with GPSampler.
[I 2025-12-02 14:04:30,784] Trial 23 finished with value: 0.1518589055919168 and parameters: {'n_estimators': 700, 'learning_rate': 0.039045716003166385, 'max_depth': 2, 'min_child_weight': 10, 'subsample': 1.0, 'colsample_bytree': 0.470083995001443, 'reg_alpha': 0.0, 'reg_lambda': 10.0, 'gamma': 5.0, 'scale_pos_weight': 6.0}. Best is trial 22 with value: 0.15413781602582474.
[D 2025-12-02 14:04:30,916] Sample trial#24 with GPSampler.
[I 2025-12-02 14:04:39,643] Trial 24 finished with value: 0.1519603710076409 and parameters: {'n_estimators': 700, 'learning_rate': 0.040734861427136705, 'max_depth': 2, 'min_child_weight': 7, 'subsample': 0.9791383826334336, 'colsample_bytree': 0.5924055037962033, 'reg_alpha': 0.0, 'reg_lambda': 7.205143321399349, 'gamma': 5.0, 'scale_pos_weight': 6.0}. Best is trial 22 with value: 0.15413781602582474.
[D 2025-12-02 14:04:39,778] Sample trial#25 with GPSampler.
[I 2025-12-02 14:04:45,449] Trial 25 finished with value: 0.15289164740249223 and parameters: {'n_estimators': 650, 'learning_rate': 0.03709807906267143, 'max_depth': 2, 'min_child_weight': 10, 'subsample': 0.9617091462493768, 'colsample_bytree': 0.5572313471482128, 'reg_alpha': 0.0, 'reg_lambda': 8.651108950156964, 'gamma': 5.0, 'scale_pos_weight': 5.644984551925666}. Best is trial 22 with value: 0.15413781602582474.
[D 2025-12-02 14:04:45,578] Sample trial#26 with GPSampler.
[I 2025-12-02 14:04:55,037] Trial 26 finished with value: 0.1521887443845767 and parameters: {'n_estimators': 550, 'learning_rate': 0.04361875407133625, 'max_depth': 2, 'min_child_weight': 7, 'subsample': 1.0, 'colsample_bytree': 0.44865383674420006, 'reg_alpha': 0.0, 'reg_lambda': 7.732380275582766, 'gamma': 5.0, 'scale_pos_weight': 5.4633915657555665}. Best is trial 22 with value: 0.15413781602582474.
[D 2025-12-02 14:04:55,174] Sample trial#27 with GPSampler.
[I 2025-12-02 14:05:05,361] Trial 27 finished with value: 0.1512205406850084 and parameters: {'n_estimators': 650, 'learning_rate': 0.03909852969307153, 'max_depth': 2, 'min_child_weight': 9, 'subsample': 0.9817742919157953, 'colsample_bytree': 0.5136129082950064, 'reg_alpha': 0.1771125523356939, 'reg_lambda': 8.346122030478812, 'gamma': 5.0, 'scale_pos_weight': 5.779213563013011}. Best is trial 22 with value: 0.15413781602582474.
[D 2025-12-02 14:05:05,489] Sample trial#28 with GPSampler.
[I 2025-12-02 14:05:12,428] Trial 28 finished with value: 0.15354888974490344 and parameters: {'n_estimators': 450, 'learning_rate': 0.04720920313597827, 'max_depth': 2, 'min_child_weight': 10, 'subsample': 1.0, 'colsample_bytree': 0.6, 'reg_alpha': 0.0, 'reg_lambda': 1.0, 'gamma': 5.0, 'scale_pos_weight': 5.0}. Best is trial 22 with value: 0.15413781602582474.
[D 2025-12-02 14:05:12,562] Sample trial#29 with GPSampler.
[I 2025-12-02 14:05:22,232] Trial 29 finished with value: 0.14984505367238737 and parameters: {'n_estimators': 350, 'learning_rate': 0.041714378874094495, 'max_depth': 2, 'min_child_weight': 10, 'subsample': 1.0, 'colsample_bytree': 0.4, 'reg_alpha': 0.0, 'reg_lambda': 1.0, 'gamma': 5.0, 'scale_pos_weight': 5.0}. Best is trial 22 with value: 0.15413781602582474.
[I 2025-12-02 14:05:50,102] A new study created in memory with name: catboost_fold_1
[D 2025-12-02 14:05:50,102] Sample trial#0 with RandomSampler.
[I 2025-12-02 14:05:53,066] Trial 0 finished with value: 0.17586263069128266 and parameters: {'iterations': 500, 'learning_rate': 0.01811019057576534, 'depth': 4, 'l2_leaf_reg': 4.507499891567208, 'border_count': 210, 'bagging_temperature': 0.5834243862181836, 'random_strength': 0.5424096767745498, 'scale_pos_weight': 5.1106340705322735}. Best is trial 0 with value: 0.17586263069128266.
[D 2025-12-02 14:05:53,198] Sample trial#1 with GPSampler.
[I 2025-12-02 14:05:56,560] Trial 1 finished with value: 0.16517102264530079 and parameters: {'iterations': 800, 'learning_rate': 0.011762437114445318, 'depth': 2, 'l2_leaf_reg': 3.5259453675514463, 'border_count': 215, 'bagging_temperature': 0.9306161901597656, 'random_strength': 0.5515976593183178, 'scale_pos_weight': 5.861900925379372}. Best is trial 0 with value: 0.17586263069128266.
[D 2025-12-02 14:05:56,690] Sample trial#2 with GPSampler.
[I 2025-12-02 14:05:59,256] Trial 2 finished with value: 0.16624562240019797 and parameters: {'iterations': 500, 'learning_rate': 0.011294191112860782, 'depth': 3, 'l2_leaf_reg': 8.95832449980193, 'border_count': 216, 'bagging_temperature': 0.17611883673966633, 'random_strength': 0.9059172793553865, 'scale_pos_weight': 5.7587160391106345}. Best is trial 0 with value: 0.17586263069128266.
[D 2025-12-02 14:05:59,386] Sample trial#3 with GPSampler.
[I 2025-12-02 14:06:00,576] Trial 3 finished with value: 0.16256287415245607 and parameters: {'iterations': 200, 'learning_rate': 0.01764811711921213, 'depth': 2, 'l2_leaf_reg': 4.655212664513678, 'border_count': 194, 'bagging_temperature': 0.5474544136966831, 'random_strength': 0.03050697846887951, 'scale_pos_weight': 5.235947041758415}. Best is trial 0 with value: 0.17586263069128266.
[D 2025-12-02 14:06:00,705] Sample trial#4 with GPSampler.
[I 2025-12-02 14:06:04,907] Trial 4 finished with value: 0.16811955010278876 and parameters: {'iterations': 900, 'learning_rate': 0.005785347703519209, 'depth': 3, 'l2_leaf_reg': 2.830818884156901, 'border_count': 232, 'bagging_temperature': 0.9747452654207894, 'random_strength': 0.7823819916535676, 'scale_pos_weight': 5.747008419235396}. Best is trial 0 with value: 0.17586263069128266.
[D 2025-12-02 14:06:05,038] Sample trial#5 with GPSampler.
[I 2025-12-02 14:06:08,472] Trial 5 finished with value: 0.1681856690207571 and parameters: {'iterations': 700, 'learning_rate': 0.003427541148910112, 'depth': 3, 'l2_leaf_reg': 8.89237301795526, 'border_count': 225, 'bagging_temperature': 0.42012537079753187, 'random_strength': 0.17116814780669687, 'scale_pos_weight': 5.84059650226809}. Best is trial 0 with value: 0.17586263069128266.
[D 2025-12-02 14:06:08,601] Sample trial#6 with GPSampler.
[I 2025-12-02 14:06:09,425] Trial 6 finished with value: 0.15445500204902313 and parameters: {'iterations': 100, 'learning_rate': 0.01470981772179827, 'depth': 2, 'l2_leaf_reg': 6.496691854461433, 'border_count': 171, 'bagging_temperature': 0.9914829939723364, 'random_strength': 0.2180184726978962, 'scale_pos_weight': 5.787411280108687}. Best is trial 0 with value: 0.17586263069128266.
[D 2025-12-02 14:06:09,555] Sample trial#7 with GPSampler.
[I 2025-12-02 14:06:11,874] Trial 7 finished with value: 0.1543264908271406 and parameters: {'iterations': 400, 'learning_rate': 0.0013147279408414919, 'depth': 4, 'l2_leaf_reg': 2.6053079586019994, 'border_count': 202, 'bagging_temperature': 0.8962582853968544, 'random_strength': 0.3550325378374122, 'scale_pos_weight': 5.2807064348743875}. Best is trial 0 with value: 0.17586263069128266.
[D 2025-12-02 14:06:12,004] Sample trial#8 with GPSampler.
[I 2025-12-02 14:06:14,434] Trial 8 finished with value: 0.16958777018538362 and parameters: {'iterations': 400, 'learning_rate': 0.015255840277397691, 'depth': 4, 'l2_leaf_reg': 7.30574672796496, 'border_count': 229, 'bagging_temperature': 0.20991634491624156, 'random_strength': 0.9820007608512912, 'scale_pos_weight': 5.625882561849963}. Best is trial 0 with value: 0.17586263069128266.
[D 2025-12-02 14:06:14,564] Sample trial#9 with GPSampler.
[I 2025-12-02 14:06:16,147] Trial 9 finished with value: 0.1638984084436878 and parameters: {'iterations': 300, 'learning_rate': 0.015707068974436102, 'depth': 2, 'l2_leaf_reg': 8.386180968784457, 'border_count': 211, 'bagging_temperature': 0.6165321713046481, 'random_strength': 0.03683477317531092, 'scale_pos_weight': 5.171368434872661}. Best is trial 0 with value: 0.17586263069128266.
[D 2025-12-02 14:06:16,277] Sample trial#10 with GPSampler.
[I 2025-12-02 14:06:20,242] Trial 10 finished with value: 0.17068696325423005 and parameters: {'iterations': 700, 'learning_rate': 0.019999999999999997, 'depth': 4, 'l2_leaf_reg': 5.135960754693192, 'border_count': 228, 'bagging_temperature': 0.36655425856501656, 'random_strength': 0.6263293727781015, 'scale_pos_weight': 5.0}. Best is trial 0 with value: 0.17586263069128266.
[D 2025-12-02 14:06:20,371] Sample trial#11 with GPSampler.
[I 2025-12-02 14:06:22,927] Trial 11 finished with value: 0.16912547683085138 and parameters: {'iterations': 400, 'learning_rate': 0.02, 'depth': 4, 'l2_leaf_reg': 2.8197809992142666, 'border_count': 215, 'bagging_temperature': 0.6133520080360666, 'random_strength': 0.8678247624532489, 'scale_pos_weight': 5.0}. Best is trial 0 with value: 0.17586263069128266.
[D 2025-12-02 14:06:23,057] Sample trial#12 with GPSampler.
[I 2025-12-02 14:06:26,513] Trial 12 finished with value: 0.17596800890026204 and parameters: {'iterations': 600, 'learning_rate': 0.01764390836232427, 'depth': 4, 'l2_leaf_reg': 5.720038475848687, 'border_count': 202, 'bagging_temperature': 0.6869067864956716, 'random_strength': 0.3502650952305512, 'scale_pos_weight': 5.219658113288249}. Best is trial 12 with value: 0.17596800890026204.
[D 2025-12-02 14:06:26,643] Sample trial#13 with GPSampler.
[I 2025-12-02 14:06:29,631] Trial 13 finished with value: 0.17578759733392754 and parameters: {'iterations': 500, 'learning_rate': 0.016205068849538505, 'depth': 4, 'l2_leaf_reg': 3.8276519721042863, 'border_count': 208, 'bagging_temperature': 0.37913459647862774, 'random_strength': 0.29823549616857953, 'scale_pos_weight': 5.08956735635857}. Best is trial 12 with value: 0.17596800890026204.
[D 2025-12-02 14:06:29,760] Sample trial#14 with GPSampler.
[I 2025-12-02 14:06:32,295] Trial 14 finished with value: 0.17527704544057365 and parameters: {'iterations': 400, 'learning_rate': 0.016979090746499795, 'depth': 4, 'l2_leaf_reg': 9.176885398663641, 'border_count': 209, 'bagging_temperature': 0.7011819981844213, 'random_strength': 0.3611401089640662, 'scale_pos_weight': 5.07360251850809}. Best is trial 12 with value: 0.17596800890026204.
[D 2025-12-02 14:06:32,424] Sample trial#15 with GPSampler.
[I 2025-12-02 14:06:35,916] Trial 15 finished with value: 0.170400671259295 and parameters: {'iterations': 600, 'learning_rate': 0.016745413286672287, 'depth': 4, 'l2_leaf_reg': 1.6371134309047655, 'border_count': 225, 'bagging_temperature': 0.9914532174268462, 'random_strength': 0.3537406661739351, 'scale_pos_weight': 5.158874737803453}. Best is trial 12 with value: 0.17596800890026204.
[D 2025-12-02 14:06:36,046] Sample trial#16 with GPSampler.
[I 2025-12-02 14:06:39,008] Trial 16 finished with value: 0.17232038574995837 and parameters: {'iterations': 500, 'learning_rate': 0.018653974520635764, 'depth': 4, 'l2_leaf_reg': 7.038346854865963, 'border_count': 198, 'bagging_temperature': 0.24750946648330918, 'random_strength': 0.3888660887092144, 'scale_pos_weight': 5.12271366978681}. Best is trial 12 with value: 0.17596800890026204.
[D 2025-12-02 14:06:39,139] Sample trial#17 with GPSampler.
