[I 2025-12-02 14:53:40,123] Trial 19 finished with value: 0.135635237647114 and parameters: {'n_layers': 1, 'layer_0_size': 200, 'activation': 'tanh', 'alpha': 0.0001306195486403155, 'learning_rate': 'invscaling', 'solver': 'sgd', 'learning_rate_init': 0.00642026367442766, 'max_iter': 785}. Best is trial 15 with value: 0.16737574147933595.
[D 2025-12-02 14:53:40,295] Sample trial#20 with TPESampler.
[I 2025-12-02 14:54:26,708] Trial 20 finished with value: 0.15563336058502605 and parameters: {'n_layers': 1, 'layer_0_size': 200, 'activation': 'logistic', 'alpha': 0.002854944429479831, 'learning_rate': 'adaptive', 'solver': 'sgd', 'learning_rate_init': 0.017958315076036246, 'max_iter': 1190}. Best is trial 15 with value: 0.16737574147933595.
[D 2025-12-02 14:54:26,864] Sample trial#21 with TPESampler.
[I 2025-12-02 14:54:44,981] Trial 21 finished with value: 0.09573177254765564 and parameters: {'n_layers': 1, 'layer_0_size': 150, 'activation': 'tanh', 'alpha': 0.00018752238363625584, 'learning_rate': 'adaptive', 'solver': 'adam', 'learning_rate_init': 0.0013803122307119524, 'max_iter': 1029}. Best is trial 15 with value: 0.16737574147933595.
[D 2025-12-02 14:54:45,141] Sample trial#22 with TPESampler.
[I 2025-12-02 14:54:56,647] Trial 22 finished with value: 0.16799192844395266 and parameters: {'n_layers': 1, 'layer_0_size': 150, 'activation': 'tanh', 'alpha': 0.00013169198364522015, 'learning_rate': 'adaptive', 'solver': 'sgd', 'learning_rate_init': 0.0004451593700136865, 'max_iter': 1283}. Best is trial 22 with value: 0.16799192844395266.
[D 2025-12-02 14:54:56,802] Sample trial#23 with TPESampler.
[I 2025-12-02 14:55:02,152] Trial 23 finished with value: 0.07064811419560817 and parameters: {'n_layers': 1, 'layer_0_size': 125, 'activation': 'tanh', 'alpha': 0.0002670743019894385, 'learning_rate': 'invscaling', 'solver': 'sgd', 'learning_rate_init': 0.00027946018915145295, 'max_iter': 1118}. Best is trial 22 with value: 0.16799192844395266.
[D 2025-12-02 14:55:02,307] Sample trial#24 with TPESampler.
[I 2025-12-02 14:55:07,124] Trial 24 finished with value: 0.08617483912114507 and parameters: {'n_layers': 1, 'layer_0_size': 150, 'activation': 'logistic', 'alpha': 0.0001825859182458716, 'learning_rate': 'adaptive', 'solver': 'sgd', 'learning_rate_init': 0.00011011023526223918, 'max_iter': 1226}. Best is trial 22 with value: 0.16799192844395266.
[D 2025-12-02 14:55:07,279] Sample trial#25 with TPESampler.
[I 2025-12-02 14:55:16,035] Trial 25 finished with value: 0.15304616560679424 and parameters: {'n_layers': 1, 'layer_0_size': 100, 'activation': 'tanh', 'alpha': 0.00011326139886014736, 'learning_rate': 'adaptive', 'solver': 'sgd', 'learning_rate_init': 0.00040694650335657576, 'max_iter': 1129}. Best is trial 22 with value: 0.16799192844395266.
[D 2025-12-02 14:55:16,191] Sample trial#26 with TPESampler.
[I 2025-12-02 14:55:21,791] Trial 26 finished with value: 0.0884962194731359 and parameters: {'n_layers': 1, 'layer_0_size': 200, 'activation': 'logistic', 'alpha': 0.00043535627594897854, 'learning_rate': 'adaptive', 'solver': 'adam', 'learning_rate_init': 0.06287948475814166, 'max_iter': 1084}. Best is trial 22 with value: 0.16799192844395266.
[D 2025-12-02 14:55:21,946] Sample trial#27 with TPESampler.
[I 2025-12-02 14:55:24,472] Trial 27 finished with value: 0.12544554388048987 and parameters: {'n_layers': 1, 'layer_0_size': 200, 'activation': 'logistic', 'alpha': 0.0001546906567855111, 'learning_rate': 'invscaling', 'solver': 'sgd', 'learning_rate_init': 0.01058324180915525, 'max_iter': 1315}. Best is trial 22 with value: 0.16799192844395266.
[D 2025-12-02 14:55:24,627] Sample trial#28 with TPESampler.
[I 2025-12-02 14:55:44,341] Trial 28 finished with value: 0.16555918385341398 and parameters: {'n_layers': 1, 'layer_0_size': 200, 'activation': 'logistic', 'alpha': 0.00046864770475471643, 'learning_rate': 'adaptive', 'solver': 'sgd', 'learning_rate_init': 0.009290524449686578, 'max_iter': 889}. Best is trial 22 with value: 0.16799192844395266.
[D 2025-12-02 14:55:44,496] Sample trial#29 with TPESampler.
[I 2025-12-02 14:56:55,831] Trial 29 finished with value: 0.08738254219603248 and parameters: {'n_layers': 1, 'layer_0_size': 175, 'activation': 'tanh', 'alpha': 0.0001677293661096062, 'learning_rate': 'constant', 'solver': 'lbfgs', 'learning_rate_init': 0.00017059122714563191, 'max_iter': 1295}. Best is trial 22 with value: 0.16799192844395266.
[I 2025-12-02 14:56:59,514] A new study created in memory with name: multi_layer_perceptron_fold_3
[D 2025-12-02 14:56:59,514] Sample trial#0 with RandomSampler.
[I 2025-12-02 14:57:03,268] Trial 0 finished with value: 0.14234226961328714 and parameters: {'n_layers': 2, 'layer_0_size': 200, 'layer_1_size': 100, 'activation': 'tanh', 'alpha': 0.0011643654986724739, 'learning_rate': 'invscaling', 'solver': 'sgd', 'learning_rate_init': 0.014222813855215503, 'max_iter': 852}. Best is trial 0 with value: 0.14234226961328714.
[D 2025-12-02 14:57:03,428] Sample trial#1 with TPESampler.
[I 2025-12-02 14:57:13,813] Trial 1 finished with value: 0.0962442292625186 and parameters: {'n_layers': 1, 'layer_0_size': 125, 'activation': 'logistic', 'alpha': 0.0023664896228722827, 'learning_rate': 'adaptive', 'solver': 'adam', 'learning_rate_init': 0.006709017841431554, 'max_iter': 1198}. Best is trial 0 with value: 0.14234226961328714.
[D 2025-12-02 14:57:13,970] Sample trial#2 with TPESampler.
[I 2025-12-02 14:57:17,680] Trial 2 finished with value: 0.11326190951413126 and parameters: {'n_layers': 1, 'layer_0_size': 100, 'activation': 'tanh', 'alpha': 0.00048141751108968976, 'learning_rate': 'adaptive', 'solver': 'adam', 'learning_rate_init': 0.01368067710092385, 'max_iter': 765}. Best is trial 0 with value: 0.14234226961328714.
[D 2025-12-02 14:57:17,837] Sample trial#3 with TPESampler.
[I 2025-12-02 14:59:01,933] Trial 3 finished with value: 0.10543230466177078 and parameters: {'n_layers': 1, 'layer_0_size': 175, 'activation': 'tanh', 'alpha': 0.004525633879305492, 'learning_rate': 'adaptive', 'solver': 'sgd', 'learning_rate_init': 0.005877865928870124, 'max_iter': 1256}. Best is trial 0 with value: 0.14234226961328714.
[D 2025-12-02 14:59:02,091] Sample trial#4 with TPESampler.
[I 2025-12-02 14:59:36,199] Trial 4 finished with value: 0.09659717650067054 and parameters: {'n_layers': 1, 'layer_0_size': 200, 'activation': 'tanh', 'alpha': 0.0015189531057784743, 'learning_rate': 'adaptive', 'solver': 'sgd', 'learning_rate_init': 0.08913951586058616, 'max_iter': 909}. Best is trial 0 with value: 0.14234226961328714.
[D 2025-12-02 14:59:36,356] Sample trial#5 with TPESampler.
[I 2025-12-02 15:00:09,347] Trial 5 finished with value: 0.08385132744498928 and parameters: {'n_layers': 1, 'layer_0_size': 125, 'activation': 'tanh', 'alpha': 0.0002821225371310208, 'learning_rate': 'invscaling', 'solver': 'lbfgs', 'learning_rate_init': 0.00020469981219458123, 'max_iter': 1467}. Best is trial 0 with value: 0.14234226961328714.
[D 2025-12-02 15:00:09,512] Sample trial#6 with TPESampler.
[I 2025-12-02 15:00:32,246] Trial 6 finished with value: 0.1005867160417558 and parameters: {'n_layers': 1, 'layer_0_size': 100, 'activation': 'tanh', 'alpha': 0.003022329093708751, 'learning_rate': 'constant', 'solver': 'adam', 'learning_rate_init': 0.0005806128721905031, 'max_iter': 932}. Best is trial 0 with value: 0.14234226961328714.
[D 2025-12-02 15:00:32,404] Sample trial#7 with TPESampler.
[I 2025-12-02 15:02:31,151] Trial 7 finished with value: 0.08721803948114747 and parameters: {'n_layers': 1, 'layer_0_size': 175, 'activation': 'logistic', 'alpha': 0.00024289892714380454, 'learning_rate': 'constant', 'solver': 'lbfgs', 'learning_rate_init': 0.0003364473795226005, 'max_iter': 377}. Best is trial 0 with value: 0.14234226961328714.
[D 2025-12-02 15:02:31,343] Sample trial#8 with TPESampler.
[I 2025-12-02 15:02:42,126] Trial 8 finished with value: 0.11292257728811368 and parameters: {'n_layers': 1, 'layer_0_size': 150, 'activation': 'tanh', 'alpha': 0.00011930607752057524, 'learning_rate': 'adaptive', 'solver': 'adam', 'learning_rate_init': 0.0030029605412132333, 'max_iter': 1133}. Best is trial 0 with value: 0.14234226961328714.
[D 2025-12-02 15:02:42,284] Sample trial#9 with TPESampler.
[I 2025-12-02 15:03:34,309] Trial 9 finished with value: 0.1646927131073385 and parameters: {'n_layers': 2, 'layer_0_size': 125, 'layer_1_size': 175, 'activation': 'logistic', 'alpha': 0.00577313438406987, 'learning_rate': 'adaptive', 'solver': 'adam', 'learning_rate_init': 0.00031925066747884594, 'max_iter': 236}. Best is trial 9 with value: 0.1646927131073385.
[D 2025-12-02 15:03:34,466] Sample trial#10 with TPESampler.
[I 2025-12-02 15:04:07,988] Trial 10 finished with value: 0.16903102065525766 and parameters: {'n_layers': 2, 'layer_0_size': 125, 'layer_1_size': 200, 'activation': 'logistic', 'alpha': 0.007391710264161156, 'learning_rate': 'adaptive', 'solver': 'adam', 'learning_rate_init': 0.000219307418501623, 'max_iter': 286}. Best is trial 10 with value: 0.16903102065525766.
[D 2025-12-02 15:04:08,150] Sample trial#11 with TPESampler.
[I 2025-12-02 15:06:01,827] Trial 11 finished with value: 0.10743530214178501 and parameters: {'n_layers': 2, 'layer_0_size': 150, 'layer_1_size': 200, 'activation': 'logistic', 'alpha': 0.003713924132788623, 'learning_rate': 'adaptive', 'solver': 'adam', 'learning_rate_init': 0.0004838263597650599, 'max_iter': 408}. Best is trial 10 with value: 0.16903102065525766.
[D 2025-12-02 15:06:01,985] Sample trial#12 with TPESampler.
[I 2025-12-02 15:06:05,263] Trial 12 finished with value: 0.1644986615829245 and parameters: {'n_layers': 1, 'layer_0_size': 100, 'activation': 'logistic', 'alpha': 0.0019686544512302058, 'learning_rate': 'adaptive', 'solver': 'adam', 'learning_rate_init': 0.00014057671123246691, 'max_iter': 633}. Best is trial 10 with value: 0.16903102065525766.
[D 2025-12-02 15:06:05,421] Sample trial#13 with TPESampler.
[I 2025-12-02 15:06:19,650] Trial 13 finished with value: 0.06302811015071305 and parameters: {'n_layers': 2, 'layer_0_size': 125, 'layer_1_size': 175, 'activation': 'logistic', 'alpha': 0.009733660676150724, 'learning_rate': 'adaptive', 'solver': 'sgd', 'learning_rate_init': 0.00010834079678266362, 'max_iter': 779}. Best is trial 10 with value: 0.16903102065525766.
[D 2025-12-02 15:06:19,809] Sample trial#14 with TPESampler.
[I 2025-12-02 15:08:00,524] Trial 14 finished with value: 0.09681136184620706 and parameters: {'n_layers': 2, 'layer_0_size': 100, 'layer_1_size': 150, 'activation': 'tanh', 'alpha': 0.002189646390082259, 'learning_rate': 'adaptive', 'solver': 'lbfgs', 'learning_rate_init': 0.00024213435643609708, 'max_iter': 299}. Best is trial 10 with value: 0.16903102065525766.
[D 2025-12-02 15:08:00,696] Sample trial#15 with TPESampler.
[I 2025-12-02 15:09:06,667] Trial 15 finished with value: 0.16596681859840826 and parameters: {'n_layers': 2, 'layer_0_size': 125, 'layer_1_size': 200, 'activation': 'logistic', 'alpha': 0.006694346308627055, 'learning_rate': 'invscaling', 'solver': 'adam', 'learning_rate_init': 0.0002900139583567968, 'max_iter': 290}. Best is trial 10 with value: 0.16903102065525766.
[D 2025-12-02 15:09:06,824] Sample trial#16 with TPESampler.
[I 2025-12-02 15:09:21,922] Trial 16 finished with value: 0.09687883665965183 and parameters: {'n_layers': 2, 'layer_0_size': 100, 'layer_1_size': 200, 'activation': 'tanh', 'alpha': 0.005641021939438667, 'learning_rate': 'invscaling', 'solver': 'adam', 'learning_rate_init': 0.0038656946854374093, 'max_iter': 395}. Best is trial 10 with value: 0.16903102065525766.
[D 2025-12-02 15:09:22,081] Sample trial#17 with TPESampler.
[I 2025-12-02 15:12:14,036] Trial 17 finished with value: 0.07743055662571818 and parameters: {'n_layers': 2, 'layer_0_size': 100, 'layer_1_size': 200, 'activation': 'logistic', 'alpha': 0.0046284246078360175, 'learning_rate': 'invscaling', 'solver': 'lbfgs', 'learning_rate_init': 0.00017692777957383402, 'max_iter': 344}. Best is trial 10 with value: 0.16903102065525766.
[D 2025-12-02 15:12:14,205] Sample trial#18 with TPESampler.
[I 2025-12-02 15:14:24,286] Trial 18 finished with value: 0.13257544712435093 and parameters: {'n_layers': 2, 'layer_0_size': 125, 'layer_1_size': 200, 'activation': 'logistic', 'alpha': 0.0004765195829439362, 'learning_rate': 'invscaling', 'solver': 'adam', 'learning_rate_init': 0.0002122646449456588, 'max_iter': 738}. Best is trial 10 with value: 0.16903102065525766.
[D 2025-12-02 15:14:24,444] Sample trial#19 with TPESampler.
[I 2025-12-02 15:14:28,729] Trial 19 finished with value: 0.07055757661886314 and parameters: {'n_layers': 2, 'layer_0_size': 175, 'layer_1_size': 150, 'activation': 'logistic', 'alpha': 0.005123105995810062, 'learning_rate': 'invscaling', 'solver': 'sgd', 'learning_rate_init': 0.0004989492768380325, 'max_iter': 534}. Best is trial 10 with value: 0.16903102065525766.
[D 2025-12-02 15:14:28,888] Sample trial#20 with TPESampler.
[I 2025-12-02 15:14:29,726] Trial 20 finished with value: 0.06331042937710082 and parameters: {'n_layers': 1, 'layer_0_size': 100, 'activation': 'logistic', 'alpha': 0.0059712070169632234, 'learning_rate': 'invscaling', 'solver': 'sgd', 'learning_rate_init': 0.0014130498600960573, 'max_iter': 296}. Best is trial 10 with value: 0.16903102065525766.
[D 2025-12-02 15:14:29,885] Sample trial#21 with TPESampler.
[I 2025-12-02 15:15:02,849] Trial 21 finished with value: 0.1688637248154947 and parameters: {'n_layers': 2, 'layer_0_size': 125, 'layer_1_size': 175, 'activation': 'logistic', 'alpha': 0.008952096921992671, 'learning_rate': 'constant', 'solver': 'adam', 'learning_rate_init': 0.0003032514500511091, 'max_iter': 344}. Best is trial 10 with value: 0.16903102065525766.
[D 2025-12-02 15:15:03,006] Sample trial#22 with TPESampler.
[I 2025-12-02 15:16:19,460] Trial 22 finished with value: 0.11129997571444965 and parameters: {'n_layers': 2, 'layer_0_size': 100, 'layer_1_size': 175, 'activation': 'logistic', 'alpha': 0.009684005967860891, 'learning_rate': 'constant', 'solver': 'adam', 'learning_rate_init': 0.0008233803750873875, 'max_iter': 371}. Best is trial 10 with value: 0.16903102065525766.
[D 2025-12-02 15:16:19,618] Sample trial#23 with TPESampler.
[I 2025-12-02 15:17:01,541] Trial 23 finished with value: 0.17203099327154922 and parameters: {'n_layers': 2, 'layer_0_size': 150, 'layer_1_size': 200, 'activation': 'logistic', 'alpha': 0.007007637630141531, 'learning_rate': 'invscaling', 'solver': 'adam', 'learning_rate_init': 0.00019017922756472776, 'max_iter': 228}. Best is trial 23 with value: 0.17203099327154922.
[D 2025-12-02 15:17:01,702] Sample trial#24 with TPESampler.
[I 2025-12-02 15:20:48,189] Trial 24 finished with value: 0.09456204221577359 and parameters: {'n_layers': 2, 'layer_0_size': 175, 'layer_1_size': 175, 'activation': 'logistic', 'alpha': 0.006411906243102341, 'learning_rate': 'invscaling', 'solver': 'lbfgs', 'learning_rate_init': 0.00010201061708099509, 'max_iter': 228}. Best is trial 23 with value: 0.17203099327154922.
[D 2025-12-02 15:20:48,366] Sample trial#25 with TPESampler.
[I 2025-12-02 15:22:18,720] Trial 25 finished with value: 0.08788979144460958 and parameters: {'n_layers': 2, 'layer_0_size': 125, 'layer_1_size': 200, 'activation': 'tanh', 'alpha': 0.007008085460158873, 'learning_rate': 'constant', 'solver': 'adam', 'learning_rate_init': 0.00019806773463187252, 'max_iter': 444}. Best is trial 23 with value: 0.17203099327154922.
[D 2025-12-02 15:22:18,880] Sample trial#26 with TPESampler.
[I 2025-12-02 15:22:51,549] Trial 26 finished with value: 0.17148810010635906 and parameters: {'n_layers': 2, 'layer_0_size': 175, 'layer_1_size': 125, 'activation': 'logistic', 'alpha': 0.009598415212482794, 'learning_rate': 'constant', 'solver': 'adam', 'learning_rate_init': 0.0002702290169000926, 'max_iter': 694}. Best is trial 23 with value: 0.17203099327154922.
[D 2025-12-02 15:22:51,714] Sample trial#27 with TPESampler.
[I 2025-12-02 15:26:30,950] Trial 27 finished with value: 0.10656414401695372 and parameters: {'n_layers': 2, 'layer_0_size': 200, 'layer_1_size': 125, 'activation': 'logistic', 'alpha': 0.001615605948509719, 'learning_rate': 'constant', 'solver': 'adam', 'learning_rate_init': 0.00034495113816583774, 'max_iter': 1078}. Best is trial 23 with value: 0.17203099327154922.
[D 2025-12-02 15:26:31,116] Sample trial#28 with TPESampler.
[I 2025-12-02 15:30:43,493] Trial 28 finished with value: 0.08748675495927341 and parameters: {'n_layers': 2, 'layer_0_size': 200, 'layer_1_size': 125, 'activation': 'logistic', 'alpha': 0.008535908726975603, 'learning_rate': 'adaptive', 'solver': 'lbfgs', 'learning_rate_init': 0.0013046831435826346, 'max_iter': 449}. Best is trial 23 with value: 0.17203099327154922.
[D 2025-12-02 15:30:43,693] Sample trial#29 with TPESampler.
[I 2025-12-02 15:33:51,344] Trial 29 finished with value: 0.09639193062512053 and parameters: {'n_layers': 2, 'layer_0_size': 150, 'layer_1_size': 100, 'activation': 'logistic', 'alpha': 0.009169454884675275, 'learning_rate': 'constant', 'solver': 'lbfgs', 'learning_rate_init': 0.0010079281604163182, 'max_iter': 1016}. Best is trial 23 with value: 0.17203099327154922.
[I 2025-12-02 15:34:04,741] A new study created in memory with name: multi_layer_perceptron_fold_4
[D 2025-12-02 15:34:04,742] Sample trial#0 with RandomSampler.
[I 2025-12-02 15:34:26,436] Trial 0 finished with value: 0.12200317933001711 and parameters: {'n_layers': 1, 'layer_0_size': 150, 'activation': 'tanh', 'alpha': 0.0004599566615768002, 'learning_rate': 'adaptive', 'solver': 'sgd', 'learning_rate_init': 0.0636790893256046, 'max_iter': 413}. Best is trial 0 with value: 0.12200317933001711.
[D 2025-12-02 15:34:26,601] Sample trial#1 with TPESampler.
[I 2025-12-02 15:34:50,502] Trial 1 finished with value: 0.09469991788523342 and parameters: {'n_layers': 2, 'layer_0_size': 125, 'layer_1_size': 100, 'activation': 'logistic', 'alpha': 0.0025181618685936992, 'learning_rate': 'invscaling', 'solver': 'adam', 'learning_rate_init': 0.01102275630554072, 'max_iter': 204}. Best is trial 0 with value: 0.12200317933001711.
[D 2025-12-02 15:34:50,670] Sample trial#2 with TPESampler.
[I 2025-12-02 15:34:55,345] Trial 2 finished with value: 0.09134345985154158 and parameters: {'n_layers': 1, 'layer_0_size': 125, 'activation': 'logistic', 'alpha': 0.0025057761645092764, 'learning_rate': 'invscaling', 'solver': 'adam', 'learning_rate_init': 0.05457766602974121, 'max_iter': 1225}. Best is trial 0 with value: 0.12200317933001711.
[D 2025-12-02 15:34:55,508] Sample trial#3 with TPESampler.
[I 2025-12-02 15:38:56,824] Trial 3 finished with value: 0.07530168380013294 and parameters: {'n_layers': 2, 'layer_0_size': 200, 'layer_1_size': 100, 'activation': 'logistic', 'alpha': 0.00011087311397761872, 'learning_rate': 'constant', 'solver': 'lbfgs', 'learning_rate_init': 0.000624382534032199, 'max_iter': 546}. Best is trial 0 with value: 0.12200317933001711.
[D 2025-12-02 15:38:57,005] Sample trial#4 with TPESampler.
[I 2025-12-02 15:39:39,567] Trial 4 finished with value: 0.09520651351133329 and parameters: {'n_layers': 1, 'layer_0_size': 125, 'activation': 'logistic', 'alpha': 0.0016906983118910235, 'learning_rate': 'adaptive', 'solver': 'lbfgs', 'learning_rate_init': 0.002241123004683793, 'max_iter': 779}. Best is trial 0 with value: 0.12200317933001711.
[D 2025-12-02 15:39:39,731] Sample trial#5 with TPESampler.
[I 2025-12-02 15:40:13,392] Trial 5 finished with value: 0.09290776042925931 and parameters: {'n_layers': 1, 'layer_0_size': 150, 'activation': 'logistic', 'alpha': 0.00021288839583876706, 'learning_rate': 'constant', 'solver': 'sgd', 'learning_rate_init': 0.07658782247356821, 'max_iter': 490}. Best is trial 0 with value: 0.12200317933001711.
[D 2025-12-02 15:40:13,556] Sample trial#6 with TPESampler.
[I 2025-12-02 15:42:48,791] Trial 6 finished with value: 0.09510932131237755 and parameters: {'n_layers': 2, 'layer_0_size': 175, 'layer_1_size': 200, 'activation': 'tanh', 'alpha': 0.0012134205812498497, 'learning_rate': 'constant', 'solver': 'lbfgs', 'learning_rate_init': 0.0003939813482757928, 'max_iter': 811}. Best is trial 0 with value: 0.12200317933001711.
[D 2025-12-02 15:42:48,974] Sample trial#7 with TPESampler.
[I 2025-12-02 15:43:33,479] Trial 7 finished with value: 0.09282174142451362 and parameters: {'n_layers': 1, 'layer_0_size': 125, 'activation': 'logistic', 'alpha': 0.0067754338146607885, 'learning_rate': 'constant', 'solver': 'lbfgs', 'learning_rate_init': 0.0007612138223993094, 'max_iter': 442}. Best is trial 0 with value: 0.12200317933001711.
[D 2025-12-02 15:43:33,643] Sample trial#8 with TPESampler.
[I 2025-12-02 15:44:22,383] Trial 8 finished with value: 0.10331127530635112 and parameters: {'n_layers': 2, 'layer_0_size': 200, 'layer_1_size': 150, 'activation': 'logistic', 'alpha': 0.0015104056745366401, 'learning_rate': 'constant', 'solver': 'adam', 'learning_rate_init': 0.0020562167455558645, 'max_iter': 607}. Best is trial 0 with value: 0.12200317933001711.
[D 2025-12-02 15:44:22,544] Sample trial#9 with TPESampler.
[I 2025-12-02 15:44:44,393] Trial 9 finished with value: 0.10526444866336629 and parameters: {'n_layers': 2, 'layer_0_size': 200, 'layer_1_size': 100, 'activation': 'logistic', 'alpha': 0.00011625047373854197, 'learning_rate': 'adaptive', 'solver': 'adam', 'learning_rate_init': 0.045427687119886734, 'max_iter': 1400}. Best is trial 0 with value: 0.12200317933001711.
[D 2025-12-02 15:44:44,555] Sample trial#10 with TPESampler.
[I 2025-12-02 15:45:25,587] Trial 10 finished with value: 0.11980973157082235 and parameters: {'n_layers': 1, 'layer_0_size': 200, 'activation': 'tanh', 'alpha': 0.0002656498786300191, 'learning_rate': 'adaptive', 'solver': 'sgd', 'learning_rate_init': 0.05127484518943802, 'max_iter': 788}. Best is trial 0 with value: 0.12200317933001711.
[D 2025-12-02 15:45:25,747] Sample trial#11 with TPESampler.
