[I 2025-12-02 16:19:08,102] Trial 29 finished with value: 0.10520856683716458 and parameters: {'n_layers': 1, 'layer_0_size': 200, 'activation': 'tanh', 'alpha': 0.0001388195699386037, 'learning_rate': 'adaptive', 'solver': 'sgd', 'learning_rate_init': 0.04365203003062812, 'max_iter': 1182}. Best is trial 24 with value: 0.15694606610044307.
Importâncias dos parâmetros para fold 4: {'depth': np.float64(0.3015316400589679), 'learning_rate': np.float64(0.23665005487764423), 'iterations': np.float64(0.18170866995014004), 'random_strength': np.float64(0.1661051682248683), 'scale_pos_weight': np.float64(0.0400336121158364), 'bagging_temperature': np.float64(0.038090603946609916), 'l2_leaf_reg': np.float64(0.019953458191764438), 'border_count': np.float64(0.015926792634169032)}
Saved Optuna plots to results/20251202_114155_ana_optimized_binary_less/catboost/optuna_plots
Fold 5
Importâncias dos parâmetros para fold 5: {'iterations': np.float64(0.5259309116011858), 'bagging_temperature': np.float64(0.23575088420238322), 'random_strength': np.float64(0.07347758990174695), 'l2_leaf_reg': np.float64(0.060581687879315026), 'learning_rate': np.float64(0.04747511878439517), 'scale_pos_weight': np.float64(0.03437982512617821), 'border_count': np.float64(0.012520221364967433), 'depth': np.float64(0.009883761139828326)}
Saved Optuna plots to results/20251202_114155_ana_optimized_binary_less/catboost/optuna_plots

Nested CV completed. The 20% holdout set (3536 samples) remains untouched.
This holdout set can be used for final unbiased evaluation.

Training and evaluating 5 best parameter sets on holdout data...
Testing with 4 balancing strategies: none, randomundersampler, smoteenn, tomeklinks

Evaluating fold 1 best params on holdout set...
  - Testing with balance strategy: none
  - Testing with balance strategy: randomundersampler
  - Testing with balance strategy: smoteenn
  - Testing with balance strategy: tomeklinks

Evaluating fold 2 best params on holdout set...
  - Testing with balance strategy: none
  - Testing with balance strategy: randomundersampler
  - Testing with balance strategy: smoteenn
  - Testing with balance strategy: tomeklinks

Evaluating fold 3 best params on holdout set...
  - Testing with balance strategy: none
  - Testing with balance strategy: randomundersampler
  - Testing with balance strategy: smoteenn
  - Testing with balance strategy: tomeklinks

Evaluating fold 4 best params on holdout set...
  - Testing with balance strategy: none
  - Testing with balance strategy: randomundersampler
  - Testing with balance strategy: smoteenn
  - Testing with balance strategy: tomeklinks

Evaluating fold 5 best params on holdout set...
  - Testing with balance strategy: none
  - Testing with balance strategy: randomundersampler
  - Testing with balance strategy: smoteenn
  - Testing with balance strategy: tomeklinks
Saving optimization and holdout results...
Detailed results by fold saved to: ./results/20251202_114155_ana_optimized_binary_less/catboost/detailed_results_by_fold.txt
Test predictions for all folds saved to: ./results/20251202_114155_ana_optimized_binary_less/catboost/metrics.json
Saving holdout results...
Holdout evaluation results saved to: ./results/20251202_114155_ana_optimized_binary_less/catboost/holdout_results.txt
Saved!
[OK] CatBoost executado com sucesso!
Progresso: 8/9 modelos
================================================================================
EXECUTANDO MODELO: Multi-Layer Perceptron
================================================================================

Starting Nested Cross-Validation for multi_layer_perceptron...
Configuration: 5 outer folds, 30 trials per fold
Performing 80/20 holdout split...
Holdout split completed:
  - Training set: 14140 samples (80%)
  - Holdout test set: 3536 samples (20%)
Fold 1
Importâncias dos parâmetros para fold 1: {'solver': np.float64(0.3912548903362289), 'alpha': np.float64(0.2889190026592647), 'learning_rate_init': np.float64(0.12649399212988607), 'max_iter': np.float64(0.06091484210055698), 'activation': np.float64(0.05853618283685061), 'learning_rate': np.float64(0.028370971657716678), 'layer_0_size': np.float64(0.02643819683394862), 'n_layers': np.float64(0.019071921445547573)}
Saved Optuna plots to results/20251202_114155_ana_optimized_binary_less/multi_layer_perceptron/optuna_plots
Fold 2
Importâncias dos parâmetros para fold 2: {'solver': np.float64(0.34924304290869945), 'max_iter': np.float64(0.17795176937015186), 'layer_0_size': np.float64(0.12535876885994449), 'learning_rate_init': np.float64(0.1103356919041804), 'alpha': np.float64(0.09118800516442496), 'learning_rate': np.float64(0.07101055083175656), 'n_layers': np.float64(0.0672036365108092), 'activation': np.float64(0.007708534450033169)}
Saved Optuna plots to results/20251202_114155_ana_optimized_binary_less/multi_layer_perceptron/optuna_plots
Fold 3
Importâncias dos parâmetros para fold 3: {'solver': np.float64(0.33222818758170547), 'max_iter': np.float64(0.28850474573251356), 'alpha': np.float64(0.17634569306277412), 'learning_rate_init': np.float64(0.06014075545325677), 'learning_rate': np.float64(0.05821197996600194), 'layer_0_size': np.float64(0.042895347577809426), 'activation': np.float64(0.037732736447414365), 'n_layers': np.float64(0.00394055417852437)}
Saved Optuna plots to results/20251202_114155_ana_optimized_binary_less/multi_layer_perceptron/optuna_plots
Fold 4
Importâncias dos parâmetros para fold 4: {'activation': np.float64(0.2850243028523938), 'solver': np.float64(0.20118138042586292), 'learning_rate': np.float64(0.1776905333611274), 'alpha': np.float64(0.1108458321933619), 'max_iter': np.float64(0.10091087407059918), 'n_layers': np.float64(0.04878203277847092), 'learning_rate_init': np.float64(0.04050613807721045), 'layer_0_size': np.float64(0.035058906240973464)}
Saved Optuna plots to results/20251202_114155_ana_optimized_binary_less/multi_layer_perceptron/optuna_plots
Fold 5
Importâncias dos parâmetros para fold 5: {'solver': np.float64(0.5208843162924058), 'max_iter': np.float64(0.19964630855268192), 'activation': np.float64(0.09674553243317424), 'learning_rate_init': np.float64(0.06993401281825438), 'layer_0_size': np.float64(0.04143970860373312), 'learning_rate': np.float64(0.02962706561972191), 'alpha': np.float64(0.023711742145243006), 'n_layers': np.float64(0.018011313534785592)}
Saved Optuna plots to results/20251202_114155_ana_optimized_binary_less/multi_layer_perceptron/optuna_plots

Nested CV completed. The 20% holdout set (3536 samples) remains untouched.
This holdout set can be used for final unbiased evaluation.

Training and evaluating 5 best parameter sets on holdout data...
Testing with 4 balancing strategies: none, randomundersampler, smoteenn, tomeklinks

Evaluating fold 1 best params on holdout set...
  - Testing with balance strategy: none
  - Testing with balance strategy: randomundersampler
  - Testing with balance strategy: smoteenn
  - Testing with balance strategy: tomeklinks

Evaluating fold 2 best params on holdout set...
  - Testing with balance strategy: none
  - Testing with balance strategy: randomundersampler
  - Testing with balance strategy: smoteenn
  - Testing with balance strategy: tomeklinks

Evaluating fold 3 best params on holdout set...
  - Testing with balance strategy: none
  - Testing with balance strategy: randomundersampler
  - Testing with balance strategy: smoteenn
  - Testing with balance strategy: tomeklinks

Evaluating fold 4 best params on holdout set...
  - Testing with balance strategy: none
  - Testing with balance strategy: randomundersampler
  - Testing with balance strategy: smoteenn
  - Testing with balance strategy: tomeklinks

Evaluating fold 5 best params on holdout set...
  - Testing with balance strategy: none
  - Testing with balance strategy: randomundersampler
  - Testing with balance strategy: smoteenn
  - Testing with balance strategy: tomeklinks
Saving optimization and holdout results...
Detailed results by fold saved to: ./results/20251202_114155_ana_optimized_binary_less/multi_layer_perceptron/detailed_results_by_fold.txt
Test predictions for all folds saved to: ./results/20251202_114155_ana_optimized_binary_less/multi_layer_perceptron/metrics.json
Saving holdout results...
Holdout evaluation results saved to: ./results/20251202_114155_ana_optimized_binary_less/multi_layer_perceptron/holdout_results.txt
Saved!
[OK] Multi-Layer Perceptron executado com sucesso!
Progresso: 9/9 modelos
[I 2025-12-02 16:23:37,770] A new study created in memory with name: svc_fold_1
[D 2025-12-02 16:23:37,771] Sample trial#0 with RandomSampler.
[I 2025-12-02 16:24:06,448] Trial 0 finished with value: 0.1447888025490242 and parameters: {'kernel': 'poly'}. Best is trial 0 with value: 0.1447888025490242.
[D 2025-12-02 16:24:06,608] Sample trial#1 with TPESampler.
[I 2025-12-02 16:24:39,249] Trial 1 finished with value: 0.10307011694246859 and parameters: {'kernel': 'rbf'}. Best is trial 0 with value: 0.1447888025490242.
[D 2025-12-02 16:24:39,408] Sample trial#2 with TPESampler.
[I 2025-12-02 16:25:07,961] Trial 2 finished with value: 0.08738031043909152 and parameters: {'kernel': 'sigmoid'}. Best is trial 0 with value: 0.1447888025490242.
[D 2025-12-02 16:25:08,118] Sample trial#3 with TPESampler.
[I 2025-12-02 16:25:37,050] Trial 3 finished with value: 0.09307305817921599 and parameters: {'kernel': 'sigmoid'}. Best is trial 0 with value: 0.1447888025490242.
[D 2025-12-02 16:25:37,207] Sample trial#4 with TPESampler.
[I 2025-12-02 16:26:05,973] Trial 4 finished with value: 0.09499998154830677 and parameters: {'kernel': 'sigmoid'}. Best is trial 0 with value: 0.1447888025490242.
[D 2025-12-02 16:26:06,131] Sample trial#5 with TPESampler.
[I 2025-12-02 16:26:38,652] Trial 5 finished with value: 0.10308142682023247 and parameters: {'kernel': 'rbf'}. Best is trial 0 with value: 0.1447888025490242.
[D 2025-12-02 16:26:38,810] Sample trial#6 with TPESampler.
[I 2025-12-02 16:27:08,430] Trial 6 finished with value: 0.08853851718321426 and parameters: {'kernel': 'sigmoid'}. Best is trial 0 with value: 0.1447888025490242.
[D 2025-12-02 16:27:08,589] Sample trial#7 with TPESampler.
[I 2025-12-02 16:27:36,389] Trial 7 finished with value: 0.14404273133645387 and parameters: {'kernel': 'poly'}. Best is trial 0 with value: 0.1447888025490242.
[D 2025-12-02 16:27:36,547] Sample trial#8 with TPESampler.
[I 2025-12-02 16:29:45,389] Trial 8 finished with value: 0.16465543187432238 and parameters: {'kernel': 'linear'}. Best is trial 8 with value: 0.16465543187432238.
[D 2025-12-02 16:29:45,545] Sample trial#9 with TPESampler.
[I 2025-12-02 16:31:59,242] Trial 9 finished with value: 0.16476181565748865 and parameters: {'kernel': 'linear'}. Best is trial 9 with value: 0.16476181565748865.
[D 2025-12-02 16:31:59,400] Sample trial#10 with TPESampler.
[I 2025-12-02 16:34:10,620] Trial 10 finished with value: 0.1646881992215276 and parameters: {'kernel': 'linear'}. Best is trial 9 with value: 0.16476181565748865.
[D 2025-12-02 16:34:10,779] Sample trial#11 with TPESampler.
[I 2025-12-02 16:36:23,019] Trial 11 finished with value: 0.16473114588900703 and parameters: {'kernel': 'linear'}. Best is trial 9 with value: 0.16476181565748865.
[D 2025-12-02 16:36:23,177] Sample trial#12 with TPESampler.
[I 2025-12-02 16:38:37,443] Trial 12 finished with value: 0.16473725357311822 and parameters: {'kernel': 'linear'}. Best is trial 9 with value: 0.16476181565748865.
[D 2025-12-02 16:38:37,601] Sample trial#13 with TPESampler.
[I 2025-12-02 16:40:53,006] Trial 13 finished with value: 0.16472202255273288 and parameters: {'kernel': 'linear'}. Best is trial 9 with value: 0.16476181565748865.
[D 2025-12-02 16:40:53,162] Sample trial#14 with TPESampler.
[I 2025-12-02 16:43:04,236] Trial 14 finished with value: 0.1646895708014086 and parameters: {'kernel': 'linear'}. Best is trial 9 with value: 0.16476181565748865.
[D 2025-12-02 16:43:04,394] Sample trial#15 with TPESampler.
[I 2025-12-02 16:45:18,194] Trial 15 finished with value: 0.1647479201314908 and parameters: {'kernel': 'linear'}. Best is trial 9 with value: 0.16476181565748865.
[D 2025-12-02 16:45:18,351] Sample trial#16 with TPESampler.
[I 2025-12-02 16:47:32,812] Trial 16 finished with value: 0.1646395750917465 and parameters: {'kernel': 'linear'}. Best is trial 9 with value: 0.16476181565748865.
[D 2025-12-02 16:47:32,968] Sample trial#17 with TPESampler.
[I 2025-12-02 16:49:44,748] Trial 17 finished with value: 0.1647395062502468 and parameters: {'kernel': 'linear'}. Best is trial 9 with value: 0.16476181565748865.
[D 2025-12-02 16:49:44,907] Sample trial#18 with TPESampler.
[I 2025-12-02 16:50:19,624] Trial 18 finished with value: 0.10309145383137372 and parameters: {'kernel': 'rbf'}. Best is trial 9 with value: 0.16476181565748865.
[D 2025-12-02 16:50:19,782] Sample trial#19 with TPESampler.
[I 2025-12-02 16:50:49,574] Trial 19 finished with value: 0.14359432857800977 and parameters: {'kernel': 'poly'}. Best is trial 9 with value: 0.16476181565748865.
[D 2025-12-02 16:50:49,734] Sample trial#20 with TPESampler.
[I 2025-12-02 16:53:01,968] Trial 20 finished with value: 0.164693067899614 and parameters: {'kernel': 'linear'}. Best is trial 9 with value: 0.16476181565748865.
[D 2025-12-02 16:53:02,127] Sample trial#21 with TPESampler.
[I 2025-12-02 16:55:14,736] Trial 21 finished with value: 0.16470101797113407 and parameters: {'kernel': 'linear'}. Best is trial 9 with value: 0.16476181565748865.
[D 2025-12-02 16:55:14,891] Sample trial#22 with TPESampler.
[I 2025-12-02 16:57:25,989] Trial 22 finished with value: 0.16468353499433275 and parameters: {'kernel': 'linear'}. Best is trial 9 with value: 0.16476181565748865.
[D 2025-12-02 16:57:26,148] Sample trial#23 with TPESampler.
[I 2025-12-02 16:59:37,197] Trial 23 finished with value: 0.16469795330374076 and parameters: {'kernel': 'linear'}. Best is trial 9 with value: 0.16476181565748865.
[D 2025-12-02 16:59:37,355] Sample trial#24 with TPESampler.
[I 2025-12-02 17:01:49,688] Trial 24 finished with value: 0.16471457893245126 and parameters: {'kernel': 'linear'}. Best is trial 9 with value: 0.16476181565748865.
[D 2025-12-02 17:01:49,845] Sample trial#25 with TPESampler.
[I 2025-12-02 17:04:04,191] Trial 25 finished with value: 0.16474566418876216 and parameters: {'kernel': 'linear'}. Best is trial 9 with value: 0.16476181565748865.
[D 2025-12-02 17:04:04,350] Sample trial#26 with TPESampler.
[I 2025-12-02 17:06:19,954] Trial 26 finished with value: 0.16470603798873854 and parameters: {'kernel': 'linear'}. Best is trial 9 with value: 0.16476181565748865.
[D 2025-12-02 17:06:20,111] Sample trial#27 with TPESampler.
[I 2025-12-02 17:06:48,435] Trial 27 finished with value: 0.1450027982730972 and parameters: {'kernel': 'poly'}. Best is trial 9 with value: 0.16476181565748865.
[D 2025-12-02 17:06:48,591] Sample trial#28 with TPESampler.
[I 2025-12-02 17:07:22,112] Trial 28 finished with value: 0.10308582555080073 and parameters: {'kernel': 'rbf'}. Best is trial 9 with value: 0.16476181565748865.
[D 2025-12-02 17:07:22,270] Sample trial#29 with TPESampler.
[I 2025-12-02 17:07:50,492] Trial 29 finished with value: 0.14298041951181545 and parameters: {'kernel': 'poly'}. Best is trial 9 with value: 0.16476181565748865.
[I 2025-12-02 17:08:38,025] A new study created in memory with name: svc_fold_2
[D 2025-12-02 17:08:38,026] Sample trial#0 with RandomSampler.
[I 2025-12-02 17:10:53,123] Trial 0 finished with value: 0.15266142859099524 and parameters: {'kernel': 'linear'}. Best is trial 0 with value: 0.15266142859099524.
[D 2025-12-02 17:10:53,282] Sample trial#1 with TPESampler.
[I 2025-12-02 17:11:25,955] Trial 1 finished with value: 0.10851650900270707 and parameters: {'kernel': 'rbf'}. Best is trial 0 with value: 0.15266142859099524.
[D 2025-12-02 17:11:26,115] Sample trial#2 with TPESampler.
[I 2025-12-02 17:11:54,246] Trial 2 finished with value: 0.10638708533578065 and parameters: {'kernel': 'poly'}. Best is trial 0 with value: 0.15266142859099524.
[D 2025-12-02 17:11:54,405] Sample trial#3 with TPESampler.
[I 2025-12-02 17:12:27,155] Trial 3 finished with value: 0.1083915104503332 and parameters: {'kernel': 'rbf'}. Best is trial 0 with value: 0.15266142859099524.
[D 2025-12-02 17:12:27,315] Sample trial#4 with TPESampler.
[I 2025-12-02 17:12:59,736] Trial 4 finished with value: 0.10852191769879463 and parameters: {'kernel': 'rbf'}. Best is trial 0 with value: 0.15266142859099524.
[D 2025-12-02 17:12:59,895] Sample trial#5 with TPESampler.
[I 2025-12-02 17:13:27,839] Trial 5 finished with value: 0.12480820003724857 and parameters: {'kernel': 'poly'}. Best is trial 0 with value: 0.15266142859099524.
[D 2025-12-02 17:13:27,998] Sample trial#6 with TPESampler.
[I 2025-12-02 17:13:58,166] Trial 6 finished with value: 0.09068242420633714 and parameters: {'kernel': 'sigmoid'}. Best is trial 0 with value: 0.15266142859099524.
[D 2025-12-02 17:13:58,326] Sample trial#7 with TPESampler.
[I 2025-12-02 17:14:30,872] Trial 7 finished with value: 0.10848241980991938 and parameters: {'kernel': 'rbf'}. Best is trial 0 with value: 0.15266142859099524.
[D 2025-12-02 17:14:31,031] Sample trial#8 with TPESampler.
[I 2025-12-02 17:14:59,239] Trial 8 finished with value: 0.10705358823690174 and parameters: {'kernel': 'poly'}. Best is trial 0 with value: 0.15266142859099524.
[D 2025-12-02 17:14:59,398] Sample trial#9 with TPESampler.
[I 2025-12-02 17:15:31,960] Trial 9 finished with value: 0.1084203765311722 and parameters: {'kernel': 'rbf'}. Best is trial 0 with value: 0.15266142859099524.
[D 2025-12-02 17:15:32,118] Sample trial#10 with TPESampler.
[I 2025-12-02 17:17:45,955] Trial 10 finished with value: 0.15262940601812097 and parameters: {'kernel': 'linear'}. Best is trial 0 with value: 0.15266142859099524.
[D 2025-12-02 17:17:46,113] Sample trial#11 with TPESampler.
[I 2025-12-02 17:20:00,361] Trial 11 finished with value: 0.15270513791937795 and parameters: {'kernel': 'linear'}. Best is trial 11 with value: 0.15270513791937795.
[D 2025-12-02 17:20:00,519] Sample trial#12 with TPESampler.
[I 2025-12-02 17:22:13,909] Trial 12 finished with value: 0.15267013569848337 and parameters: {'kernel': 'linear'}. Best is trial 11 with value: 0.15270513791937795.
[D 2025-12-02 17:22:14,066] Sample trial#13 with TPESampler.
[I 2025-12-02 17:24:24,496] Trial 13 finished with value: 0.15267984363497825 and parameters: {'kernel': 'linear'}. Best is trial 11 with value: 0.15270513791937795.
[D 2025-12-02 17:24:24,656] Sample trial#14 with TPESampler.
[I 2025-12-02 17:26:39,057] Trial 14 finished with value: 0.15273788925012827 and parameters: {'kernel': 'linear'}. Best is trial 14 with value: 0.15273788925012827.
[D 2025-12-02 17:26:39,229] Sample trial#15 with TPESampler.
[I 2025-12-02 17:28:54,294] Trial 15 finished with value: 0.15273832409921076 and parameters: {'kernel': 'linear'}. Best is trial 15 with value: 0.15273832409921076.
[D 2025-12-02 17:28:54,449] Sample trial#16 with TPESampler.
[I 2025-12-02 17:29:23,035] Trial 16 finished with value: 0.09127260350106667 and parameters: {'kernel': 'sigmoid'}. Best is trial 15 with value: 0.15273832409921076.
[D 2025-12-02 17:29:23,195] Sample trial#17 with TPESampler.
[I 2025-12-02 17:31:30,130] Trial 17 finished with value: 0.1526599997231297 and parameters: {'kernel': 'linear'}. Best is trial 15 with value: 0.15273832409921076.
[D 2025-12-02 17:31:30,284] Sample trial#18 with TPESampler.
[I 2025-12-02 17:33:43,115] Trial 18 finished with value: 0.1527126760875897 and parameters: {'kernel': 'linear'}. Best is trial 15 with value: 0.15273832409921076.
[D 2025-12-02 17:33:43,272] Sample trial#19 with TPESampler.
[I 2025-12-02 17:35:52,660] Trial 19 finished with value: 0.15270049419534965 and parameters: {'kernel': 'linear'}. Best is trial 15 with value: 0.15273832409921076.
[D 2025-12-02 17:35:52,818] Sample trial#20 with TPESampler.
[I 2025-12-02 17:36:23,389] Trial 20 finished with value: 0.0957468167657625 and parameters: {'kernel': 'sigmoid'}. Best is trial 15 with value: 0.15273832409921076.
[D 2025-12-02 17:36:23,546] Sample trial#21 with TPESampler.
