[I 2025-12-02 14:12:56,643] Trial 27 finished with value: 0.18289475509057332 and parameters: {'iterations': 1000, 'learning_rate': 0.005652643614465282, 'depth': 4, 'l2_leaf_reg': 9.871321598239128, 'border_count': 255, 'bagging_temperature': 0.0, 'random_strength': 0.13995239412398722, 'scale_pos_weight': 5.0}. Best is trial 27 with value: 0.18289475509057332.
[D 2025-12-02 14:12:56,782] Sample trial#28 with GPSampler.
[I 2025-12-02 14:13:02,258] Trial 28 finished with value: 0.1792711412096267 and parameters: {'iterations': 1000, 'learning_rate': 0.005345200922817523, 'depth': 4, 'l2_leaf_reg': 4.195932180450399, 'border_count': 255, 'bagging_temperature': 0.1850398168414519, 'random_strength': 0.13103111500016174, 'scale_pos_weight': 5.362251309981806}. Best is trial 27 with value: 0.18289475509057332.
[D 2025-12-02 14:13:02,396] Sample trial#29 with GPSampler.
[I 2025-12-02 14:13:07,775] Trial 29 finished with value: 0.18180766129497958 and parameters: {'iterations': 1000, 'learning_rate': 0.006468594812999411, 'depth': 4, 'l2_leaf_reg': 10.0, 'border_count': 208, 'bagging_temperature': 0.0, 'random_strength': 0.16483567845175998, 'scale_pos_weight': 5.0}. Best is trial 27 with value: 0.18289475509057332.
Detailed results by fold saved to: ./results/20251202_114155_ana_optimized_binary_less/histogram_gradient_boosting/detailed_results_by_fold.txt
Test predictions for all folds saved to: ./results/20251202_114155_ana_optimized_binary_less/histogram_gradient_boosting/metrics.json
Saving holdout results...
Holdout evaluation results saved to: ./results/20251202_114155_ana_optimized_binary_less/histogram_gradient_boosting/holdout_results.txt
Saved!
[OK] Histogram Gradient Boosting executado com sucesso!
Progresso: 6/9 modelos
================================================================================
EXECUTANDO MODELO: XGBoost
================================================================================

Starting Nested Cross-Validation for xgboost...
Configuration: 5 outer folds, 30 trials per fold
Performing 80/20 holdout split...
Holdout split completed:
  - Training set: 14140 samples (80%)
  - Holdout test set: 3536 samples (20%)
Fold 1
Importâncias dos parâmetros para fold 1: {'gamma': np.float64(0.6728501677144092), 'learning_rate': np.float64(0.1822874813938554), 'subsample': np.float64(0.06792935987920365), 'reg_alpha': np.float64(0.03279652114906293), 'scale_pos_weight': np.float64(0.010971053874589649), 'min_child_weight': np.float64(0.00845611636192824), 'reg_lambda': np.float64(0.007690297786773297), 'max_depth': np.float64(0.007520152421004964), 'colsample_bytree': np.float64(0.005211505634378783), 'n_estimators': np.float64(0.004287343784793903)}
Saved Optuna plots to results/20251202_114155_ana_optimized_binary_less/xgboost/optuna_plots
Fold 2
Importâncias dos parâmetros para fold 2: {'gamma': np.float64(0.3848243122957393), 'learning_rate': np.float64(0.21879525154415191), 'scale_pos_weight': np.float64(0.14228465086866623), 'colsample_bytree': np.float64(0.053805267093981396), 'n_estimators': np.float64(0.049247105007733015), 'reg_alpha': np.float64(0.04321628221745612), 'reg_lambda': np.float64(0.04091590224981655), 'max_depth': np.float64(0.03317581866221403), 'subsample': np.float64(0.03132917706707673), 'min_child_weight': np.float64(0.002406232993164612)}
Saved Optuna plots to results/20251202_114155_ana_optimized_binary_less/xgboost/optuna_plots
Fold 3
Importâncias dos parâmetros para fold 3: {'learning_rate': np.float64(0.33268322454935106), 'min_child_weight': np.float64(0.16928644501302004), 'max_depth': np.float64(0.1395703297744783), 'colsample_bytree': np.float64(0.09357770438410919), 'reg_lambda': np.float64(0.07243349930034802), 'reg_alpha': np.float64(0.0575171838885804), 'scale_pos_weight': np.float64(0.04922893475337591), 'n_estimators': np.float64(0.0354466491220693), 'subsample': np.float64(0.03075518410554561), 'gamma': np.float64(0.019500845109122276)}
Saved Optuna plots to results/20251202_114155_ana_optimized_binary_less/xgboost/optuna_plots
Fold 4
Importâncias dos parâmetros para fold 4: {'max_depth': np.float64(0.1861611986946512), 'colsample_bytree': np.float64(0.1836986927922738), 'reg_lambda': np.float64(0.16665080428939053), 'reg_alpha': np.float64(0.15534161467762803), 'subsample': np.float64(0.08282280215594566), 'scale_pos_weight': np.float64(0.07020868895459326), 'n_estimators': np.float64(0.06529338017733585), 'gamma': np.float64(0.050990788792272014), 'min_child_weight': np.float64(0.023221302249599566), 'learning_rate': np.float64(0.015610727216309992)}
Saved Optuna plots to results/20251202_114155_ana_optimized_binary_less/xgboost/optuna_plots
Fold 5
Importâncias dos parâmetros para fold 5: {'max_depth': np.float64(0.5857273656551976), 'gamma': np.float64(0.1349254912935888), 'subsample': np.float64(0.09579093160864588), 'reg_lambda': np.float64(0.07532797564593303), 'min_child_weight': np.float64(0.05082029199061279), 'scale_pos_weight': np.float64(0.0400994244214228), 'reg_alpha': np.float64(0.010165160002861605), 'learning_rate': np.float64(0.004057138046053249), 'colsample_bytree': np.float64(0.002228483169304559), 'n_estimators': np.float64(0.0008577381663800536)}
Saved Optuna plots to results/20251202_114155_ana_optimized_binary_less/xgboost/optuna_plots

Nested CV completed. The 20% holdout set (3536 samples) remains untouched.
This holdout set can be used for final unbiased evaluation.

Training and evaluating 5 best parameter sets on holdout data...
Testing with 4 balancing strategies: none, randomundersampler, smoteenn, tomeklinks

Evaluating fold 1 best params on holdout set...
  - Testing with balance strategy: none
  - Testing with balance strategy: randomundersampler
  - Testing with balance strategy: smoteenn
  - Testing with balance strategy: tomeklinks

Evaluating fold 2 best params on holdout set...
  - Testing with balance strategy: none
  - Testing with balance strategy: randomundersampler
  - Testing with balance strategy: smoteenn
  - Testing with balance strategy: tomeklinks

Evaluating fold 3 best params on holdout set...
  - Testing with balance strategy: none
  - Testing with balance strategy: randomundersampler
  - Testing with balance strategy: smoteenn
  - Testing with balance strategy: tomeklinks

Evaluating fold 4 best params on holdout set...
  - Testing with balance strategy: none
  - Testing with balance strategy: randomundersampler
  - Testing with balance strategy: smoteenn
  - Testing with balance strategy: tomeklinks

Evaluating fold 5 best params on holdout set...
  - Testing with balance strategy: none
  - Testing with balance strategy: randomundersampler
  - Testing with balance strategy: smoteenn
  - Testing with balance strategy: tomeklinks
Saving optimization and holdout results...
Detailed results by fold saved to: ./results/20251202_114155_ana_optimized_binary_less/xgboost/detailed_results_by_fold.txt
Test predictions for all folds saved to: ./results/20251202_114155_ana_optimized_binary_less/xgboost/metrics.json
Saving holdout results...
Holdout evaluation results saved to: ./results/20251202_114155_ana_optimized_binary_less/xgboost/holdout_results.txt
Saved!
[OK] XGBoost executado com sucesso!
Progresso: 7/9 modelos
================================================================================
EXECUTANDO MODELO: CatBoost
================================================================================

Starting Nested Cross-Validation for catboost...
Configuration: 5 outer folds, 30 trials per fold
Performing 80/20 holdout split...
Holdout split completed:
  - Training set: 14140 samples (80%)
  - Holdout test set: 3536 samples (20%)
Fold 1
Importâncias dos parâmetros para fold 1: {'depth': np.float64(0.33914038634814986), 'learning_rate': np.float64(0.31005557109658693), 'iterations': np.float64(0.1455625686547502), 'scale_pos_weight': np.float64(0.06956650613045504), 'random_strength': np.float64(0.056754237310471155), 'border_count': np.float64(0.0329394629739538), 'bagging_temperature': np.float64(0.03205261145201967), 'l2_leaf_reg': np.float64(0.013928656033613285)}
Saved Optuna plots to results/20251202_114155_ana_optimized_binary_less/catboost/optuna_plots
Fold 2
Importâncias dos parâmetros para fold 2: {'l2_leaf_reg': np.float64(0.2646861667780794), 'random_strength': np.float64(0.18292343381154577), 'border_count': np.float64(0.1792576462866253), 'iterations': np.float64(0.16025101399209146), 'depth': np.float64(0.07657503486888334), 'learning_rate': np.float64(0.06378199056633914), 'bagging_temperature': np.float64(0.039635353609173175), 'scale_pos_weight': np.float64(0.03288936008726249)}
Saved Optuna plots to results/20251202_114155_ana_optimized_binary_less/catboost/optuna_plots
Fold 3
Importâncias dos parâmetros para fold 3: {'border_count': np.float64(0.3347554605355374), 'learning_rate': np.float64(0.21912175097597286), 'random_strength': np.float64(0.1462813406447027), 'iterations': np.float64(0.1404022127490756), 'bagging_temperature': np.float64(0.0609655486767546), 'scale_pos_weight': np.float64(0.04426026029001716), 'depth': np.float64(0.028979250165143286), 'l2_leaf_reg': np.float64(0.02523417596279628)}
Saved Optuna plots to results/20251202_114155_ana_optimized_binary_less/catboost/optuna_plots
Fold 4
[I 2025-12-02 14:13:09,963] A new study created in memory with name: catboost_fold_5
[D 2025-12-02 14:13:09,964] Sample trial#0 with RandomSampler.
[I 2025-12-02 14:13:11,422] Trial 0 finished with value: 0.13853086918748267 and parameters: {'iterations': 200, 'learning_rate': 0.008358158469835654, 'depth': 4, 'l2_leaf_reg': 5.91813379198891, 'border_count': 254, 'bagging_temperature': 0.4632399650255584, 'random_strength': 0.9273016097882769, 'scale_pos_weight': 5.469250846451377}. Best is trial 0 with value: 0.13853086918748267.
[D 2025-12-02 14:13:11,565] Sample trial#1 with GPSampler.
[I 2025-12-02 14:13:16,205] Trial 1 finished with value: 0.1546486324071834 and parameters: {'iterations': 1000, 'learning_rate': 0.00823754346570256, 'depth': 3, 'l2_leaf_reg': 6.978775761057226, 'border_count': 173, 'bagging_temperature': 0.4673398173232216, 'random_strength': 0.44746276139316954, 'scale_pos_weight': 5.101578428929274}. Best is trial 1 with value: 0.1546486324071834.
[D 2025-12-02 14:13:16,346] Sample trial#2 with GPSampler.
[I 2025-12-02 14:13:17,619] Trial 2 finished with value: 0.13666371364789312 and parameters: {'iterations': 200, 'learning_rate': 0.007257344904229041, 'depth': 3, 'l2_leaf_reg': 6.217637271772464, 'border_count': 176, 'bagging_temperature': 0.11868529546989248, 'random_strength': 0.6999710131847783, 'scale_pos_weight': 5.812771469660315}. Best is trial 1 with value: 0.1546486324071834.
[D 2025-12-02 14:13:17,760] Sample trial#3 with GPSampler.
[I 2025-12-02 14:13:19,277] Trial 3 finished with value: 0.14398714231919518 and parameters: {'iterations': 300, 'learning_rate': 0.007672161296572164, 'depth': 2, 'l2_leaf_reg': 4.351976584345307, 'border_count': 173, 'bagging_temperature': 0.41571217047778697, 'random_strength': 0.14007413856669826, 'scale_pos_weight': 5.323295904594749}. Best is trial 1 with value: 0.1546486324071834.
[D 2025-12-02 14:13:19,418] Sample trial#4 with GPSampler.
[I 2025-12-02 14:13:22,312] Trial 4 finished with value: 0.14225221599343235 and parameters: {'iterations': 600, 'learning_rate': 0.002980109580359217, 'depth': 3, 'l2_leaf_reg': 7.550546071961009, 'border_count': 200, 'bagging_temperature': 0.8976200834916137, 'random_strength': 0.5082750596566177, 'scale_pos_weight': 5.5699662212626535}. Best is trial 1 with value: 0.1546486324071834.
[D 2025-12-02 14:13:22,452] Sample trial#5 with GPSampler.
[I 2025-12-02 14:13:26,341] Trial 5 finished with value: 0.15325715496322934 and parameters: {'iterations': 700, 'learning_rate': 0.01875739613737764, 'depth': 4, 'l2_leaf_reg': 7.152775399428456, 'border_count': 218, 'bagging_temperature': 0.7233048582744311, 'random_strength': 0.5193687547357972, 'scale_pos_weight': 5.2613546993286135}. Best is trial 1 with value: 0.1546486324071834.
[D 2025-12-02 14:13:26,482] Sample trial#6 with GPSampler.
[I 2025-12-02 14:13:28,339] Trial 6 finished with value: 0.13070790346242586 and parameters: {'iterations': 400, 'learning_rate': 0.0016554314209257823, 'depth': 2, 'l2_leaf_reg': 7.005121394125292, 'border_count': 247, 'bagging_temperature': 0.024314368270582976, 'random_strength': 0.6611211000691201, 'scale_pos_weight': 5.719185056507464}. Best is trial 1 with value: 0.1546486324071834.
[D 2025-12-02 14:13:28,479] Sample trial#7 with GPSampler.
[I 2025-12-02 14:13:30,645] Trial 7 finished with value: 0.14210581826439922 and parameters: {'iterations': 500, 'learning_rate': 0.005600890748179837, 'depth': 2, 'l2_leaf_reg': 1.3602041777513114, 'border_count': 184, 'bagging_temperature': 0.4070454575083755, 'random_strength': 0.5463758554434899, 'scale_pos_weight': 5.771293469554427}. Best is trial 1 with value: 0.1546486324071834.
[D 2025-12-02 14:13:30,787] Sample trial#8 with GPSampler.
[I 2025-12-02 14:13:31,746] Trial 8 finished with value: 0.13621223993968903 and parameters: {'iterations': 100, 'learning_rate': 0.016514315518690308, 'depth': 4, 'l2_leaf_reg': 1.1059249078087758, 'border_count': 253, 'bagging_temperature': 0.7250741554579642, 'random_strength': 0.9799234969223395, 'scale_pos_weight': 5.371070170361402}. Best is trial 1 with value: 0.1546486324071834.
[D 2025-12-02 14:13:31,887] Sample trial#9 with GPSampler.
[I 2025-12-02 14:13:34,045] Trial 9 finished with value: 0.1332095280890932 and parameters: {'iterations': 500, 'learning_rate': 0.0016420789319095347, 'depth': 2, 'l2_leaf_reg': 1.4740829183278605, 'border_count': 195, 'bagging_temperature': 0.20335852912261154, 'random_strength': 0.580628569737335, 'scale_pos_weight': 5.105183565213808}. Best is trial 1 with value: 0.1546486324071834.
[D 2025-12-02 14:13:34,186] Sample trial#10 with GPSampler.
[I 2025-12-02 14:13:38,932] Trial 10 finished with value: 0.15735908669139667 and parameters: {'iterations': 1000, 'learning_rate': 0.013732506023807566, 'depth': 3, 'l2_leaf_reg': 6.660321409665318, 'border_count': 173, 'bagging_temperature': 0.646937410912125, 'random_strength': 0.34122689677383894, 'scale_pos_weight': 5.266481228112066}. Best is trial 10 with value: 0.15735908669139667.
[D 2025-12-02 14:13:39,072] Sample trial#11 with GPSampler.
[I 2025-12-02 14:13:44,247] Trial 11 finished with value: 0.1526906144900349 and parameters: {'iterations': 1000, 'learning_rate': 0.014501137386462939, 'depth': 4, 'l2_leaf_reg': 10.0, 'border_count': 150, 'bagging_temperature': 0.4356444332432848, 'random_strength': 0.2088388375017191, 'scale_pos_weight': 5.0}. Best is trial 10 with value: 0.15735908669139667.
[D 2025-12-02 14:13:44,388] Sample trial#12 with GPSampler.
[I 2025-12-02 14:13:49,004] Trial 12 finished with value: 0.1519363996170648 and parameters: {'iterations': 1000, 'learning_rate': 0.013503194458678973, 'depth': 3, 'l2_leaf_reg': 1.9432412372233123, 'border_count': 167, 'bagging_temperature': 0.8667672715674108, 'random_strength': 0.4782146025909768, 'scale_pos_weight': 5.685228860500667}. Best is trial 10 with value: 0.15735908669139667.
[D 2025-12-02 14:13:49,145] Sample trial#13 with GPSampler.
[I 2025-12-02 14:13:53,483] Trial 13 finished with value: 0.14879896459021538 and parameters: {'iterations': 1000, 'learning_rate': 0.019069287818494533, 'depth': 2, 'l2_leaf_reg': 7.576000850918801, 'border_count': 195, 'bagging_temperature': 0.604655597208107, 'random_strength': 0.4931727710566561, 'scale_pos_weight': 5.126968928384624}. Best is trial 10 with value: 0.15735908669139667.
[D 2025-12-02 14:13:53,623] Sample trial#14 with GPSampler.
[I 2025-12-02 14:13:58,474] Trial 14 finished with value: 0.15465429024897398 and parameters: {'iterations': 1000, 'learning_rate': 0.011775314409775226, 'depth': 3, 'l2_leaf_reg': 6.589225954002219, 'border_count': 204, 'bagging_temperature': 0.8163118915270949, 'random_strength': 0.1376458989835347, 'scale_pos_weight': 5.203590606482832}. Best is trial 10 with value: 0.15735908669139667.
[D 2025-12-02 14:13:58,614] Sample trial#15 with GPSampler.
[I 2025-12-02 14:14:03,906] Trial 15 finished with value: 0.14508679139795996 and parameters: {'iterations': 1000, 'learning_rate': 0.017715113165065466, 'depth': 4, 'l2_leaf_reg': 5.605051496459724, 'border_count': 174, 'bagging_temperature': 0.967897084571614, 'random_strength': 0.4206554800021217, 'scale_pos_weight': 5.130177964351658}. Best is trial 10 with value: 0.15735908669139667.
[D 2025-12-02 14:14:04,047] Sample trial#16 with GPSampler.
[I 2025-12-02 14:14:08,484] Trial 16 finished with value: 0.15425654496943852 and parameters: {'iterations': 900, 'learning_rate': 0.01240514531806217, 'depth': 3, 'l2_leaf_reg': 5.616684766504103, 'border_count': 185, 'bagging_temperature': 0.5866385028266676, 'random_strength': 0.21166420751697762, 'scale_pos_weight': 5.6210658836269}. Best is trial 10 with value: 0.15735908669139667.
[D 2025-12-02 14:14:08,625] Sample trial#17 with GPSampler.
[I 2025-12-02 14:14:13,662] Trial 17 finished with value: 0.15201142645300114 and parameters: {'iterations': 1000, 'learning_rate': 0.011335652022862665, 'depth': 3, 'l2_leaf_reg': 2.824947393319973, 'border_count': 150, 'bagging_temperature': 0.6460571784735764, 'random_strength': 0.13076923799180784, 'scale_pos_weight': 5.0}. Best is trial 10 with value: 0.15735908669139667.
[D 2025-12-02 14:14:13,803] Sample trial#18 with GPSampler.
[I 2025-12-02 14:14:18,663] Trial 18 finished with value: 0.15060986916260322 and parameters: {'iterations': 1000, 'learning_rate': 0.012214001670439793, 'depth': 2, 'l2_leaf_reg': 9.936579941964578, 'border_count': 182, 'bagging_temperature': 0.5834204825164443, 'random_strength': 0.49858897620177905, 'scale_pos_weight': 5.202375376849795}. Best is trial 10 with value: 0.15735908669139667.
[D 2025-12-02 14:14:18,803] Sample trial#19 with GPSampler.
[I 2025-12-02 14:14:23,794] Trial 19 finished with value: 0.15488848861827037 and parameters: {'iterations': 1000, 'learning_rate': 0.013561002461570864, 'depth': 3, 'l2_leaf_reg': 9.999999999999998, 'border_count': 202, 'bagging_temperature': 0.6470183001660693, 'random_strength': 0.4862008051471652, 'scale_pos_weight': 5.363882081334349}. Best is trial 10 with value: 0.15735908669139667.
[D 2025-12-02 14:14:23,935] Sample trial#20 with GPSampler.
[I 2025-12-02 14:14:29,524] Trial 20 finished with value: 0.15546700850023573 and parameters: {'iterations': 1000, 'learning_rate': 0.014712031548047618, 'depth': 4, 'l2_leaf_reg': 4.977903635404178, 'border_count': 185, 'bagging_temperature': 0.5883574179714727, 'random_strength': 0.42827790686302164, 'scale_pos_weight': 5.52549204107637}. Best is trial 10 with value: 0.15735908669139667.
[D 2025-12-02 14:14:29,665] Sample trial#21 with GPSampler.
[I 2025-12-02 14:14:35,233] Trial 21 finished with value: 0.14770400548677803 and parameters: {'iterations': 1000, 'learning_rate': 0.01693834292623963, 'depth': 4, 'l2_leaf_reg': 9.598867273925638, 'border_count': 255, 'bagging_temperature': 0.6053753574128812, 'random_strength': 0.26639259548564487, 'scale_pos_weight': 5.0}. Best is trial 10 with value: 0.15735908669139667.
[D 2025-12-02 14:14:35,373] Sample trial#22 with GPSampler.
[I 2025-12-02 14:14:40,232] Trial 22 finished with value: 0.1536239051690561 and parameters: {'iterations': 1000, 'learning_rate': 0.014235908826331193, 'depth': 3, 'l2_leaf_reg': 10.0, 'border_count': 151, 'bagging_temperature': 0.5964758055375805, 'random_strength': 0.6213306568806384, 'scale_pos_weight': 5.6991753405066286}. Best is trial 10 with value: 0.15735908669139667.
[D 2025-12-02 14:14:40,372] Sample trial#23 with GPSampler.
[I 2025-12-02 14:14:45,163] Trial 23 finished with value: 0.1533262684620001 and parameters: {'iterations': 1000, 'learning_rate': 0.012361281265558601, 'depth': 3, 'l2_leaf_reg': 10.0, 'border_count': 180, 'bagging_temperature': 0.6465353334622614, 'random_strength': 0.12541312945659575, 'scale_pos_weight': 5.017588703723575}. Best is trial 10 with value: 0.15735908669139667.
[D 2025-12-02 14:14:45,304] Sample trial#24 with GPSampler.
[I 2025-12-02 14:14:50,255] Trial 24 finished with value: 0.1558671140095632 and parameters: {'iterations': 1000, 'learning_rate': 0.010882509717772142, 'depth': 3, 'l2_leaf_reg': 9.201652461743741, 'border_count': 155, 'bagging_temperature': 0.6456834184173286, 'random_strength': 0.3511628983110142, 'scale_pos_weight': 5.714831557561149}. Best is trial 10 with value: 0.15735908669139667.
[D 2025-12-02 14:14:50,394] Sample trial#25 with GPSampler.
[I 2025-12-02 14:14:54,191] Trial 25 finished with value: 0.15176634311305498 and parameters: {'iterations': 700, 'learning_rate': 0.02, 'depth': 4, 'l2_leaf_reg': 6.872834622900038, 'border_count': 150, 'bagging_temperature': 0.5506855779649764, 'random_strength': 0.4571352212302847, 'scale_pos_weight': 5.252256075933575}. Best is trial 10 with value: 0.15735908669139667.
[D 2025-12-02 14:14:54,340] Sample trial#26 with GPSampler.
[I 2025-12-02 14:14:59,023] Trial 26 finished with value: 0.15416316683423142 and parameters: {'iterations': 1000, 'learning_rate': 0.010680060711861998, 'depth': 3, 'l2_leaf_reg': 3.4040051915816427, 'border_count': 180, 'bagging_temperature': 0.6476180685718662, 'random_strength': 0.41138150536552864, 'scale_pos_weight': 5.392800942561667}. Best is trial 10 with value: 0.15735908669139667.
[D 2025-12-02 14:14:59,164] Sample trial#27 with GPSampler.
