[I 2025-12-04 09:54:27,325] Trial 12 finished with value: 0.3837418243824434 and parameters: {'n_estimators': 250, 'learning_rate': 0.037895237286636727, 'max_depth': 4, 'min_samples_split': 16, 'min_samples_leaf': 17, 'subsample': 0.8020694870186842, 'max_features': 'sqrt'}. Best is trial 9 with value: 0.38768151081668784.
[I 2025-12-04 09:58:03,113] Trial 13 finished with value: 0.37807349983435756 and parameters: {'n_estimators': 150, 'learning_rate': 0.07527673880963842, 'max_depth': 3, 'min_samples_split': 19, 'min_samples_leaf': 1, 'subsample': 0.8922155793512871, 'max_features': None}. Best is trial 9 with value: 0.38768151081668784.
[I 2025-12-04 09:58:48,527] Trial 14 finished with value: 0.385914792343948 and parameters: {'n_estimators': 250, 'learning_rate': 0.0704310863394171, 'max_depth': 3, 'min_samples_split': 13, 'min_samples_leaf': 11, 'subsample': 0.8234413801164499, 'max_features': 'sqrt'}. Best is trial 9 with value: 0.38768151081668784.
[I 2025-12-04 10:03:02,508] Trial 15 finished with value: 0.3879025997515481 and parameters: {'n_estimators': 100, 'learning_rate': 0.02599419334277688, 'max_depth': 5, 'min_samples_split': 16, 'min_samples_leaf': 14, 'subsample': 0.9618856828452955, 'max_features': None}. Best is trial 15 with value: 0.3879025997515481.
[I 2025-12-04 10:07:30,648] Trial 16 finished with value: 0.38259133080653973 and parameters: {'n_estimators': 100, 'learning_rate': 0.011570348759366578, 'max_depth': 5, 'min_samples_split': 15, 'min_samples_leaf': 13, 'subsample': 0.9939571314717734, 'max_features': None}. Best is trial 15 with value: 0.3879025997515481.
[I 2025-12-04 10:11:35,477] Trial 17 finished with value: 0.38581632840720015 and parameters: {'n_estimators': 100, 'learning_rate': 0.026171486282466464, 'max_depth': 5, 'min_samples_split': 12, 'min_samples_leaf': 19, 'subsample': 0.9475838478760816, 'max_features': None}. Best is trial 15 with value: 0.3879025997515481.
[I 2025-12-04 10:17:53,914] Trial 18 finished with value: 0.38070907513249835 and parameters: {'n_estimators': 150, 'learning_rate': 0.0661386188708533, 'max_depth': 5, 'min_samples_split': 18, 'min_samples_leaf': 10, 'subsample': 0.9971481497858345, 'max_features': None}. Best is trial 15 with value: 0.3879025997515481.
[I 2025-12-04 10:23:30,104] Trial 19 finished with value: 0.37823330682857403 and parameters: {'n_estimators': 100, 'learning_rate': 0.08231014962178038, 'max_depth': 7, 'min_samples_split': 8, 'min_samples_leaf': 10, 'subsample': 0.9472096012439382, 'max_features': None}. Best is trial 15 with value: 0.3879025997515481.
[I 2025-12-04 10:28:11,431] Trial 20 finished with value: 0.38743037834985194 and parameters: {'n_estimators': 150, 'learning_rate': 0.02476499121727941, 'max_depth': 4, 'min_samples_split': 11, 'min_samples_leaf': 18, 'subsample': 0.8908215995817897, 'max_features': None}. Best is trial 15 with value: 0.3879025997515481.
[I 2025-12-04 10:33:01,383] Trial 21 finished with value: 0.3884328624311028 and parameters: {'n_estimators': 150, 'learning_rate': 0.025968260652092897, 'max_depth': 4, 'min_samples_split': 11, 'min_samples_leaf': 17, 'subsample': 0.8953634573186231, 'max_features': None}. Best is trial 21 with value: 0.3884328624311028.
[I 2025-12-04 10:36:18,622] Trial 22 finished with value: 0.38823112146724625 and parameters: {'n_estimators': 100, 'learning_rate': 0.047158763441233736, 'max_depth': 4, 'min_samples_split': 15, 'min_samples_leaf': 15, 'subsample': 0.9273790171831187, 'max_features': None}. Best is trial 21 with value: 0.3884328624311028.
[I 2025-12-04 10:42:33,083] Trial 23 finished with value: 0.3878517125878201 and parameters: {'n_estimators': 150, 'learning_rate': 0.04406311978389754, 'max_depth': 5, 'min_samples_split': 15, 'min_samples_leaf': 15, 'subsample': 0.9269658086132897, 'max_features': None}. Best is trial 21 with value: 0.3884328624311028.
[I 2025-12-04 10:45:06,510] Trial 24 finished with value: 0.38422035699232526 and parameters: {'n_estimators': 100, 'learning_rate': 0.019060851125062984, 'max_depth': 3, 'min_samples_split': 15, 'min_samples_leaf': 17, 'subsample': 0.9700643501127125, 'max_features': None}. Best is trial 21 with value: 0.3884328624311028.
[I 2025-12-04 10:51:08,741] Trial 25 finished with value: 0.3852514882093861 and parameters: {'n_estimators': 150, 'learning_rate': 0.036334044606805505, 'max_depth': 5, 'min_samples_split': 17, 'min_samples_leaf': 14, 'subsample': 0.9365238933244981, 'max_features': None}. Best is trial 21 with value: 0.3884328624311028.
[I 2025-12-04 10:57:41,217] Trial 26 finished with value: 0.3830390230108086 and parameters: {'n_estimators': 200, 'learning_rate': 0.05082822576420599, 'max_depth': 4, 'min_samples_split': 20, 'min_samples_leaf': 20, 'subsample': 0.9109037067953231, 'max_features': None}. Best is trial 21 with value: 0.3884328624311028.
[I 2025-12-04 11:02:41,847] Trial 27 finished with value: 0.389472669241031 and parameters: {'n_estimators': 100, 'learning_rate': 0.030492312061886864, 'max_depth': 6, 'min_samples_split': 10, 'min_samples_leaf': 17, 'subsample': 0.9634842862868918, 'max_features': None}. Best is trial 27 with value: 0.389472669241031.
[I 2025-12-04 11:13:38,157] Trial 28 finished with value: 0.380604375311632 and parameters: {'n_estimators': 200, 'learning_rate': 0.035012844371323334, 'max_depth': 7, 'min_samples_split': 9, 'min_samples_leaf': 18, 'subsample': 0.9007885950274147, 'max_features': None}. Best is trial 27 with value: 0.389472669241031.
[I 2025-12-04 11:14:17,761] Trial 29 finished with value: 0.38859302643234195 and parameters: {'n_estimators': 100, 'learning_rate': 0.020866363239216743, 'max_depth': 8, 'min_samples_split': 2, 'min_samples_leaf': 16, 'subsample': 0.8748325602242071, 'max_features': 'log2'}. Best is trial 27 with value: 0.389472669241031.
CLASSIFICAÇÃO DE GENES-ALVO USANDO DADOS ÔMICOS
================================================================================
Timestamp do experimento: 20251204_071056
 Usando dados da ANA:
   Features: data/UNION_features.tsv
   Labels: data/processed/UNION_labels.tsv
   Formato labels: genes, 2class (binary), 3class (multiclass)

Arquivos encontrados com sucesso!
Carregando e preparando dados...
============================================================
PREPARANDO DATASET PARA CLASSIFICAÇÃO (MULTICLASS)
============================================================
Carregando UNION_features.tsv
Features carregadas: 19602 genes x 64 features
Tipos de dados das features: {dtype('float64'): 64}
Range das features: [0.0000, 1.0000]
----------------------------------------
Carregando UNION_labels.tsv (classificação: multiclass)
Labels carregados: 19680 genes
Valores únicos em 3class: label
0.0    16727
NaN     1997
1.0      515
2.0      441
Name: count, dtype: int64
Genes with NaN dropped: 1997
Distribuição das classes:
  Classe 0 (passenger): 16727 genes
  Classe 1 (TSG): 515 genes
  Classe 2 (Oncogene): 441 genes
----------------------------------------
Alinhando features e labels
Genes comuns entre features e labels: 17676
Dataset final: 17676 genes x 64 features
Distribuição final das classes: [16727   514   435]
----------------------------------------
DATASET PREPARADO COM SUCESSO!
Shape final: X=(17676, 64), y=(17676,)
Genes: 17676
Features: 64
============================================================

CONFIGURAÇÃO DO EXPERIMENTO (OTIMIZAÇÃO):
  Modelo: Decision Tree
  Trials: 30
  Tipo: multiclass
  Parâmetros: Reduzido
  Balanceamento: none
================================================================================
EXECUTANDO MODELO: Decision Tree
================================================================================

Starting Nested Cross-Validation for decision_tree...
Configuration: 5 outer folds, 30 trials per fold
Performing 80/20 holdout split...
Holdout split completed:
  - Training set: 14140 samples (80%)
  - Holdout test set: 3536 samples (20%)
Fold 1
Importâncias dos parâmetros para fold 1: {'splitter': np.float64(0.445697375758273), 'max_depth': np.float64(0.37493218555389846), 'min_samples_split': np.float64(0.06899716938276099), 'min_samples_leaf': np.float64(0.04069799893372027), 'max_features': np.float64(0.03549094592142218), 'criterion': np.float64(0.03418432444992503)}
Saved Optuna plots to results/20251204_071056_ana_optimized_multiclass_less/decision_tree/optuna_plots
Fold 2
Importâncias dos parâmetros para fold 2: {'max_depth': np.float64(0.6362448926419204), 'min_samples_split': np.float64(0.19030653546269422), 'max_features': np.float64(0.07157936265915633), 'criterion': np.float64(0.03623177555205511), 'splitter': np.float64(0.035686481146634585), 'min_samples_leaf': np.float64(0.0299509525375393)}
Saved Optuna plots to results/20251204_071056_ana_optimized_multiclass_less/decision_tree/optuna_plots
Fold 3
Importâncias dos parâmetros para fold 3: {'max_depth': np.float64(0.5940477137477067), 'min_samples_split': np.float64(0.11528211904476192), 'splitter': np.float64(0.10060603593521893), 'max_features': np.float64(0.07009817445086845), 'min_samples_leaf': np.float64(0.06533367397545177), 'criterion': np.float64(0.05463228284599227)}
Saved Optuna plots to results/20251204_071056_ana_optimized_multiclass_less/decision_tree/optuna_plots
Fold 4
Importâncias dos parâmetros para fold 4: {'max_depth': np.float64(0.2995080862167691), 'min_samples_leaf': np.float64(0.2954375760244862), 'min_samples_split': np.float64(0.15735775037661937), 'criterion': np.float64(0.14472553103643407), 'max_features': np.float64(0.0739358023898136), 'splitter': np.float64(0.029035253955877575)}
Saved Optuna plots to results/20251204_071056_ana_optimized_multiclass_less/decision_tree/optuna_plots
Fold 5
Importâncias dos parâmetros para fold 5: {'max_depth': np.float64(0.608166148653091), 'max_features': np.float64(0.14581378602244935), 'criterion': np.float64(0.08745209731342488), 'min_samples_leaf': np.float64(0.08128739345188295), 'splitter': np.float64(0.04606509073359211), 'min_samples_split': np.float64(0.031215483825559633)}
Saved Optuna plots to results/20251204_071056_ana_optimized_multiclass_less/decision_tree/optuna_plots

Nested CV completed. The 20% holdout set (3536 samples) remains untouched.
This holdout set can be used for final unbiased evaluation.

Training and evaluating 5 best parameter sets on holdout data...
Testing with 4 balancing strategies: none, randomundersampler, smoteenn, tomeklinks

Evaluating fold 1 best params on holdout set...
  - Testing with balance strategy: none
  - Testing with balance strategy: randomundersampler
  - Testing with balance strategy: smoteenn
  - Testing with balance strategy: tomeklinks

Evaluating fold 2 best params on holdout set...
  - Testing with balance strategy: none
  - Testing with balance strategy: randomundersampler
  - Testing with balance strategy: smoteenn
  - Testing with balance strategy: tomeklinks

Evaluating fold 3 best params on holdout set...
  - Testing with balance strategy: none
  - Testing with balance strategy: randomundersampler
  - Testing with balance strategy: smoteenn
  - Testing with balance strategy: tomeklinks

Evaluating fold 4 best params on holdout set...
  - Testing with balance strategy: none
  - Testing with balance strategy: randomundersampler
  - Testing with balance strategy: smoteenn
  - Testing with balance strategy: tomeklinks

Evaluating fold 5 best params on holdout set...
  - Testing with balance strategy: none
  - Testing with balance strategy: randomundersampler
  - Testing with balance strategy: smoteenn
  - Testing with balance strategy: tomeklinks
Saving optimization and holdout results...
Detailed results by fold saved to: ./results/20251204_071056_ana_optimized_multiclass_less/decision_tree/detailed_results_by_fold.txt
Test predictions for all folds saved to: ./results/20251204_071056_ana_optimized_multiclass_less/decision_tree/metrics.json
Saving holdout results...
Holdout evaluation results saved to: ./results/20251204_071056_ana_optimized_multiclass_less/decision_tree/holdout_results.txt
Saved!
[OK] Decision Tree executado com sucesso!

CONFIGURAÇÃO DO EXPERIMENTO (OTIMIZAÇÃO):
  Modelo: Gradient Boosting
  Trials: 30
  Tipo: multiclass
  Parâmetros: Reduzido
  Balanceamento: none
================================================================================
EXECUTANDO MODELO: Gradient Boosting
================================================================================

Starting Nested Cross-Validation for gradient_boosting...
Configuration: 5 outer folds, 30 trials per fold
Performing 80/20 holdout split...
Holdout split completed:
  - Training set: 14140 samples (80%)
  - Holdout test set: 3536 samples (20%)
Fold 1
Importâncias dos parâmetros para fold 1: {'learning_rate': np.float64(0.6238323986988227), 'max_features': np.float64(0.16916870392822034), 'subsample': np.float64(0.09905866332311195), 'min_samples_leaf': np.float64(0.060419273138841795), 'n_estimators': np.float64(0.026653713677655587), 'min_samples_split': np.float64(0.014711742603104152), 'max_depth': np.float64(0.006155504630243359)}
Saved Optuna plots to results/20251204_071056_ana_optimized_multiclass_less/gradient_boosting/optuna_plots
Fold 2
Importâncias dos parâmetros para fold 2: {'learning_rate': np.float64(0.7109727296863451), 'min_samples_split': np.float64(0.12266301485088223), 'subsample': np.float64(0.06937784554548448), 'n_estimators': np.float64(0.039997326572904945), 'max_depth': np.float64(0.02504480762205608), 'min_samples_leaf': np.float64(0.023356779201591075), 'max_features': np.float64(0.008587496520736291)}
Saved Optuna plots to results/20251204_071056_ana_optimized_multiclass_less/gradient_boosting/optuna_plots
Fold 3
[I 2025-12-04 11:15:31,601] A new study created in memory with name: gradient_boosting_fold_4
[I 2025-12-04 11:16:52,081] Trial 0 finished with value: 0.36968903748300164 and parameters: {'n_estimators': 250, 'learning_rate': 0.06585450140938098, 'max_depth': 7, 'min_samples_split': 12, 'min_samples_leaf': 10, 'subsample': 0.8690533237982914, 'max_features': 'log2'}. Best is trial 0 with value: 0.36968903748300164.
[I 2025-12-04 11:17:28,923] Trial 1 finished with value: 0.3867378275221335 and parameters: {'n_estimators': 150, 'learning_rate': 0.009367432764901065, 'max_depth': 4, 'min_samples_split': 9, 'min_samples_leaf': 11, 'subsample': 0.9283412863028437, 'max_features': 'sqrt'}. Best is trial 1 with value: 0.3867378275221335.
[I 2025-12-04 11:17:42,289] Trial 2 finished with value: 0.3841606831150442 and parameters: {'n_estimators': 100, 'learning_rate': 0.07103229721696773, 'max_depth': 2, 'min_samples_split': 13, 'min_samples_leaf': 7, 'subsample': 0.9432104125604492, 'max_features': 'sqrt'}. Best is trial 1 with value: 0.3867378275221335.
[I 2025-12-04 11:19:23,096] Trial 3 finished with value: 0.3630008329699529 and parameters: {'n_estimators': 300, 'learning_rate': 0.0785807676787663, 'max_depth': 8, 'min_samples_split': 13, 'min_samples_leaf': 6, 'subsample': 0.8255210569852567, 'max_features': 'log2'}. Best is trial 1 with value: 0.3867378275221335.
[I 2025-12-04 11:19:40,159] Trial 4 finished with value: 0.38384564322837306 and parameters: {'n_estimators': 150, 'learning_rate': 0.08823395189870413, 'max_depth': 2, 'min_samples_split': 12, 'min_samples_leaf': 8, 'subsample': 0.9649382984726921, 'max_features': 'log2'}. Best is trial 1 with value: 0.3867378275221335.
[I 2025-12-04 11:20:09,003] Trial 5 finished with value: 0.3846349801085508 and parameters: {'n_estimators': 200, 'learning_rate': 0.020188273724441062, 'max_depth': 3, 'min_samples_split': 5, 'min_samples_leaf': 12, 'subsample': 0.8567598596240259, 'max_features': 'log2'}. Best is trial 1 with value: 0.3867378275221335.
[I 2025-12-04 11:21:28,763] Trial 6 finished with value: 0.38512219291302746 and parameters: {'n_estimators': 300, 'learning_rate': 0.014752705272638077, 'max_depth': 6, 'min_samples_split': 9, 'min_samples_leaf': 20, 'subsample': 0.8278696539988007, 'max_features': 'log2'}. Best is trial 1 with value: 0.3867378275221335.
[I 2025-12-04 11:22:08,100] Trial 7 finished with value: 0.38333402625408286 and parameters: {'n_estimators': 100, 'learning_rate': 0.04267193208635283, 'max_depth': 7, 'min_samples_split': 14, 'min_samples_leaf': 13, 'subsample': 0.9861567335487542, 'max_features': 'log2'}. Best is trial 1 with value: 0.3867378275221335.
[I 2025-12-04 11:24:20,951] Trial 8 finished with value: 0.3680329002069004 and parameters: {'n_estimators': 250, 'learning_rate': 0.078798213492757, 'max_depth': 8, 'min_samples_split': 6, 'min_samples_leaf': 12, 'subsample': 0.937350669789816, 'max_features': 'sqrt'}. Best is trial 1 with value: 0.3867378275221335.
[I 2025-12-04 11:30:53,737] Trial 9 finished with value: 0.37466798468336027 and parameters: {'n_estimators': 150, 'learning_rate': 0.044006741368506304, 'max_depth': 8, 'min_samples_split': 14, 'min_samples_leaf': 18, 'subsample': 0.8934857344836135, 'max_features': None}. Best is trial 1 with value: 0.3867378275221335.
[I 2025-12-04 11:31:23,624] Trial 10 finished with value: 0.3907221692647612 and parameters: {'n_estimators': 150, 'learning_rate': 0.03196612478723473, 'max_depth': 4, 'min_samples_split': 20, 'min_samples_leaf': 1, 'subsample': 0.913962845048531, 'max_features': 'sqrt'}. Best is trial 10 with value: 0.3907221692647612.
[I 2025-12-04 11:31:53,675] Trial 11 finished with value: 0.38937527700227725 and parameters: {'n_estimators': 150, 'learning_rate': 0.028464197813766225, 'max_depth': 4, 'min_samples_split': 20, 'min_samples_leaf': 2, 'subsample': 0.9173305382865188, 'max_features': 'sqrt'}. Best is trial 10 with value: 0.3907221692647612.
[I 2025-12-04 11:32:41,484] Trial 12 finished with value: 0.3885825484594689 and parameters: {'n_estimators': 200, 'learning_rate': 0.030700011124406075, 'max_depth': 5, 'min_samples_split': 20, 'min_samples_leaf': 1, 'subsample': 0.8970501804569804, 'max_features': 'sqrt'}. Best is trial 10 with value: 0.3907221692647612.
[I 2025-12-04 11:33:11,597] Trial 13 finished with value: 0.38963715725009335 and parameters: {'n_estimators': 150, 'learning_rate': 0.03885298578685703, 'max_depth': 4, 'min_samples_split': 20, 'min_samples_leaf': 1, 'subsample': 0.9193415900972975, 'max_features': 'sqrt'}. Best is trial 10 with value: 0.3907221692647612.
[I 2025-12-04 11:35:28,255] Trial 14 finished with value: 0.38367333597823083 and parameters: {'n_estimators': 100, 'learning_rate': 0.04965819982344232, 'max_depth': 4, 'min_samples_split': 17, 'min_samples_leaf': 3, 'subsample': 0.870761847386551, 'max_features': None}. Best is trial 10 with value: 0.3907221692647612.
[I 2025-12-04 11:36:19,499] Trial 15 finished with value: 0.38473230564498434 and parameters: {'n_estimators': 200, 'learning_rate': 0.034466811906754546, 'max_depth': 5, 'min_samples_split': 17, 'min_samples_leaf': 5, 'subsample': 0.9644858878812304, 'max_features': 'sqrt'}. Best is trial 10 with value: 0.3907221692647612.
[I 2025-12-04 11:36:42,357] Trial 16 finished with value: 0.38889410820167397 and parameters: {'n_estimators': 150, 'learning_rate': 0.0630555980240897, 'max_depth': 3, 'min_samples_split': 2, 'min_samples_leaf': 4, 'subsample': 0.90336431697574, 'max_features': 'sqrt'}. Best is trial 10 with value: 0.3907221692647612.
[I 2025-12-04 11:37:09,345] Trial 17 finished with value: 0.3815787418355785 and parameters: {'n_estimators': 200, 'learning_rate': 0.05515513424970434, 'max_depth': 3, 'min_samples_split': 17, 'min_samples_leaf': 16, 'subsample': 0.8009632929327001, 'max_features': 'sqrt'}. Best is trial 10 with value: 0.3907221692647612.
[I 2025-12-04 11:46:48,789] Trial 18 finished with value: 0.36861694514282733 and parameters: {'n_estimators': 250, 'learning_rate': 0.09943395097079608, 'max_depth': 6, 'min_samples_split': 18, 'min_samples_leaf': 1, 'subsample': 0.9972448073892579, 'max_features': None}. Best is trial 10 with value: 0.3907221692647612.
[I 2025-12-04 11:47:09,425] Trial 19 finished with value: 0.38630408004666883 and parameters: {'n_estimators': 100, 'learning_rate': 0.021677808945276905, 'max_depth': 4, 'min_samples_split': 19, 'min_samples_leaf': 9, 'subsample': 0.9549663192307212, 'max_features': 'sqrt'}. Best is trial 10 with value: 0.3907221692647612.
[I 2025-12-04 11:47:45,852] Trial 20 finished with value: 0.3883460702548459 and parameters: {'n_estimators': 150, 'learning_rate': 0.03869782020364186, 'max_depth': 5, 'min_samples_split': 15, 'min_samples_leaf': 4, 'subsample': 0.9160960483671622, 'max_features': 'sqrt'}. Best is trial 10 with value: 0.3907221692647612.
[I 2025-12-04 11:48:15,598] Trial 21 finished with value: 0.38936032645202373 and parameters: {'n_estimators': 150, 'learning_rate': 0.027829769982604943, 'max_depth': 4, 'min_samples_split': 20, 'min_samples_leaf': 2, 'subsample': 0.9157349630111471, 'max_features': 'sqrt'}. Best is trial 10 with value: 0.3907221692647612.
[I 2025-12-04 11:48:37,743] Trial 22 finished with value: 0.38556579287525977 and parameters: {'n_estimators': 150, 'learning_rate': 0.0247008655445978, 'max_depth': 3, 'min_samples_split': 20, 'min_samples_leaf': 1, 'subsample': 0.8817641040170601, 'max_features': 'sqrt'}. Best is trial 10 with value: 0.3907221692647612.
[I 2025-12-04 11:49:02,335] Trial 23 finished with value: 0.3881703430656213 and parameters: {'n_estimators': 100, 'learning_rate': 0.04986264205110784, 'max_depth': 5, 'min_samples_split': 16, 'min_samples_leaf': 3, 'subsample': 0.9189389773600336, 'max_features': 'sqrt'}. Best is trial 10 with value: 0.3907221692647612.
[I 2025-12-04 11:49:33,033] Trial 24 finished with value: 0.3860557012644271 and parameters: {'n_estimators': 150, 'learning_rate': 0.034583048846045586, 'max_depth': 4, 'min_samples_split': 18, 'min_samples_leaf': 6, 'subsample': 0.9406208502104303, 'max_features': 'sqrt'}. Best is trial 10 with value: 0.3907221692647612.
