[I 2025-12-04 14:23:52,672] Trial 19 finished with value: 0.36821199569103114 and parameters: {'n_neighbors': 45, 'algorithm': 'brute', 'p': 2, 'leaf_size': 23}. Best is trial 4 with value: 0.37390216839110274.
[I 2025-12-04 14:23:56,170] Trial 20 finished with value: 0.3732201996564855 and parameters: {'n_neighbors': 65, 'algorithm': 'ball_tree', 'p': 2, 'leaf_size': 26}. Best is trial 4 with value: 0.37390216839110274.
[I 2025-12-04 14:23:59,664] Trial 21 finished with value: 0.3732201996564855 and parameters: {'n_neighbors': 65, 'algorithm': 'ball_tree', 'p': 2, 'leaf_size': 26}. Best is trial 4 with value: 0.37390216839110274.
[I 2025-12-04 14:24:03,078] Trial 22 finished with value: 0.3714364616903739 and parameters: {'n_neighbors': 55, 'algorithm': 'ball_tree', 'p': 2, 'leaf_size': 22}. Best is trial 4 with value: 0.37390216839110274.
[I 2025-12-04 14:24:06,590] Trial 23 finished with value: 0.371884110033273 and parameters: {'n_neighbors': 85, 'algorithm': 'ball_tree', 'p': 2, 'leaf_size': 25}. Best is trial 4 with value: 0.37390216839110274.
[I 2025-12-04 14:24:09,697] Trial 24 finished with value: 0.3732201996564855 and parameters: {'n_neighbors': 65, 'algorithm': 'ball_tree', 'p': 2, 'leaf_size': 30}. Best is trial 4 with value: 0.37390216839110274.
[I 2025-12-04 14:24:09,967] Trial 25 finished with value: 0.36821199569103114 and parameters: {'n_neighbors': 45, 'algorithm': 'brute', 'p': 2, 'leaf_size': 28}. Best is trial 4 with value: 0.37390216839110274.
[I 2025-12-04 14:24:10,297] Trial 26 finished with value: 0.373132447822995 and parameters: {'n_neighbors': 75, 'algorithm': 'auto', 'p': 2, 'leaf_size': 21}. Best is trial 4 with value: 0.37390216839110274.
[I 2025-12-04 14:24:15,193] Trial 27 finished with value: 0.36595934101887695 and parameters: {'n_neighbors': 35, 'algorithm': 'kd_tree', 'p': 2, 'leaf_size': 24}. Best is trial 4 with value: 0.37390216839110274.
[I 2025-12-04 14:24:18,611] Trial 28 finished with value: 0.3728393500820658 and parameters: {'n_neighbors': 95, 'algorithm': 'ball_tree', 'p': 2, 'leaf_size': 32}. Best is trial 4 with value: 0.37390216839110274.
[I 2025-12-04 14:24:18,961] Trial 29 finished with value: 0.3715195565243036 and parameters: {'n_neighbors': 55, 'algorithm': 'auto', 'p': 2, 'leaf_size': 27}. Best is trial 4 with value: 0.37390216839110274.
[I 2025-12-04 14:24:19,793] A new study created in memory with name: k_nearest_neighbors_fold_3
[I 2025-12-04 14:24:20,254] Trial 0 finished with value: 0.36901772804245464 and parameters: {'n_neighbors': 65, 'algorithm': 'brute', 'p': 1, 'leaf_size': 23}. Best is trial 0 with value: 0.36901772804245464.
[I 2025-12-04 14:24:24,122] Trial 1 finished with value: 0.35805613355546073 and parameters: {'n_neighbors': 25, 'algorithm': 'ball_tree', 'p': 1, 'leaf_size': 26}. Best is trial 0 with value: 0.36901772804245464.
[I 2025-12-04 14:24:24,682] Trial 2 finished with value: 0.36901772804245464 and parameters: {'n_neighbors': 65, 'algorithm': 'auto', 'p': 1, 'leaf_size': 37}. Best is trial 0 with value: 0.36901772804245464.
[I 2025-12-04 14:24:25,023] Trial 3 finished with value: 0.3670034195275559 and parameters: {'n_neighbors': 85, 'algorithm': 'brute', 'p': 2, 'leaf_size': 39}. Best is trial 0 with value: 0.36901772804245464.
[I 2025-12-04 14:24:28,711] Trial 4 finished with value: 0.3668224282569975 and parameters: {'n_neighbors': 55, 'algorithm': 'ball_tree', 'p': 1, 'leaf_size': 24}. Best is trial 0 with value: 0.36901772804245464.
[I 2025-12-04 14:24:29,032] Trial 5 finished with value: 0.3670034195275559 and parameters: {'n_neighbors': 85, 'algorithm': 'auto', 'p': 2, 'leaf_size': 32}. Best is trial 0 with value: 0.36901772804245464.
[I 2025-12-04 14:24:34,205] Trial 6 finished with value: 0.3729473320821646 and parameters: {'n_neighbors': 105, 'algorithm': 'kd_tree', 'p': 1, 'leaf_size': 34}. Best is trial 6 with value: 0.3729473320821646.
[I 2025-12-04 14:24:38,048] Trial 7 finished with value: 0.35805613355546073 and parameters: {'n_neighbors': 25, 'algorithm': 'ball_tree', 'p': 1, 'leaf_size': 30}. Best is trial 6 with value: 0.3729473320821646.
[I 2025-12-04 14:24:38,665] Trial 8 finished with value: 0.3737271834343433 and parameters: {'n_neighbors': 95, 'algorithm': 'brute', 'p': 1, 'leaf_size': 39}. Best is trial 8 with value: 0.3737271834343433.
[I 2025-12-04 14:24:44,248] Trial 9 finished with value: 0.36839015246677737 and parameters: {'n_neighbors': 95, 'algorithm': 'kd_tree', 'p': 2, 'leaf_size': 20}. Best is trial 8 with value: 0.3737271834343433.
[I 2025-12-04 14:24:44,642] Trial 10 finished with value: 0.36961272190568917 and parameters: {'n_neighbors': 125, 'algorithm': 'brute', 'p': 2, 'leaf_size': 40}. Best is trial 8 with value: 0.3737271834343433.
[I 2025-12-04 14:24:50,520] Trial 11 finished with value: 0.3737180720805865 and parameters: {'n_neighbors': 115, 'algorithm': 'kd_tree', 'p': 1, 'leaf_size': 35}. Best is trial 8 with value: 0.3737271834343433.
[I 2025-12-04 14:24:56,352] Trial 12 finished with value: 0.37247267035679377 and parameters: {'n_neighbors': 125, 'algorithm': 'kd_tree', 'p': 1, 'leaf_size': 35}. Best is trial 8 with value: 0.3737271834343433.
[I 2025-12-04 14:25:00,907] Trial 13 finished with value: 0.37311315295774367 and parameters: {'n_neighbors': 105, 'algorithm': 'kd_tree', 'p': 1, 'leaf_size': 36}. Best is trial 8 with value: 0.3737271834343433.
[I 2025-12-04 14:25:01,554] Trial 14 finished with value: 0.3741733537801248 and parameters: {'n_neighbors': 115, 'algorithm': 'brute', 'p': 1, 'leaf_size': 32}. Best is trial 14 with value: 0.3741733537801248.
[I 2025-12-04 14:25:02,190] Trial 15 finished with value: 0.37327952788246177 and parameters: {'n_neighbors': 105, 'algorithm': 'brute', 'p': 1, 'leaf_size': 28}. Best is trial 14 with value: 0.3741733537801248.
[I 2025-12-04 14:25:02,789] Trial 16 finished with value: 0.3709692512524007 and parameters: {'n_neighbors': 85, 'algorithm': 'brute', 'p': 1, 'leaf_size': 32}. Best is trial 14 with value: 0.3741733537801248.
[I 2025-12-04 14:25:03,074] Trial 17 finished with value: 0.3651722065498262 and parameters: {'n_neighbors': 45, 'algorithm': 'brute', 'p': 2, 'leaf_size': 38}. Best is trial 14 with value: 0.3741733537801248.
[I 2025-12-04 14:25:03,717] Trial 18 finished with value: 0.3741733537801248 and parameters: {'n_neighbors': 115, 'algorithm': 'brute', 'p': 1, 'leaf_size': 32}. Best is trial 14 with value: 0.3741733537801248.
[I 2025-12-04 14:25:04,391] Trial 19 finished with value: 0.37279201983666954 and parameters: {'n_neighbors': 125, 'algorithm': 'brute', 'p': 1, 'leaf_size': 29}. Best is trial 14 with value: 0.3741733537801248.
[I 2025-12-04 14:25:04,788] Trial 20 finished with value: 0.3699238283542082 and parameters: {'n_neighbors': 115, 'algorithm': 'auto', 'p': 2, 'leaf_size': 32}. Best is trial 14 with value: 0.3741733537801248.
[I 2025-12-04 14:25:05,429] Trial 21 finished with value: 0.3737271834343433 and parameters: {'n_neighbors': 95, 'algorithm': 'brute', 'p': 1, 'leaf_size': 33}. Best is trial 14 with value: 0.3741733537801248.
[I 2025-12-04 14:25:06,074] Trial 22 finished with value: 0.3741733537801248 and parameters: {'n_neighbors': 115, 'algorithm': 'brute', 'p': 1, 'leaf_size': 30}. Best is trial 14 with value: 0.3741733537801248.
[I 2025-12-04 14:25:06,728] Trial 23 finished with value: 0.3741733537801248 and parameters: {'n_neighbors': 115, 'algorithm': 'brute', 'p': 1, 'leaf_size': 30}. Best is trial 14 with value: 0.3741733537801248.
[I 2025-12-04 14:25:07,375] Trial 24 finished with value: 0.3741733537801248 and parameters: {'n_neighbors': 115, 'algorithm': 'brute', 'p': 1, 'leaf_size': 27}. Best is trial 14 with value: 0.3741733537801248.
[I 2025-12-04 14:25:08,015] Trial 25 finished with value: 0.37327952788246177 and parameters: {'n_neighbors': 105, 'algorithm': 'brute', 'p': 1, 'leaf_size': 30}. Best is trial 14 with value: 0.3741733537801248.
[I 2025-12-04 14:25:08,677] Trial 26 finished with value: 0.37279201983666954 and parameters: {'n_neighbors': 125, 'algorithm': 'brute', 'p': 1, 'leaf_size': 26}. Best is trial 14 with value: 0.3741733537801248.
[I 2025-12-04 14:25:09,264] Trial 27 finished with value: 0.36949088947724096 and parameters: {'n_neighbors': 75, 'algorithm': 'brute', 'p': 1, 'leaf_size': 31}. Best is trial 14 with value: 0.3741733537801248.
[I 2025-12-04 14:25:13,520] Trial 28 finished with value: 0.3736698142593894 and parameters: {'n_neighbors': 115, 'algorithm': 'ball_tree', 'p': 1, 'leaf_size': 34}. Best is trial 14 with value: 0.3741733537801248.
[I 2025-12-04 14:25:14,136] Trial 29 finished with value: 0.3737271834343433 and parameters: {'n_neighbors': 95, 'algorithm': 'brute', 'p': 1, 'leaf_size': 24}. Best is trial 14 with value: 0.3741733537801248.
[I 2025-12-04 14:25:15,861] A new study created in memory with name: k_nearest_neighbors_fold_4
[I 2025-12-04 14:25:16,377] Trial 0 finished with value: 0.3672527763472233 and parameters: {'n_neighbors': 95, 'algorithm': 'auto', 'p': 1, 'leaf_size': 26}. Best is trial 0 with value: 0.3672527763472233.
[I 2025-12-04 14:25:20,850] Trial 1 finished with value: 0.3673712186348153 and parameters: {'n_neighbors': 55, 'algorithm': 'kd_tree', 'p': 2, 'leaf_size': 38}. Best is trial 1 with value: 0.3673712186348153.
[I 2025-12-04 14:25:21,420] Trial 2 finished with value: 0.36232262165886636 and parameters: {'n_neighbors': 65, 'algorithm': 'brute', 'p': 1, 'leaf_size': 39}. Best is trial 1 with value: 0.3673712186348153.
[I 2025-12-04 14:25:27,095] Trial 3 finished with value: 0.36941436092412894 and parameters: {'n_neighbors': 85, 'algorithm': 'kd_tree', 'p': 2, 'leaf_size': 30}. Best is trial 3 with value: 0.36941436092412894.
[I 2025-12-04 14:25:27,623] Trial 4 finished with value: 0.3624871045030636 and parameters: {'n_neighbors': 45, 'algorithm': 'brute', 'p': 1, 'leaf_size': 20}. Best is trial 3 with value: 0.36941436092412894.
[I 2025-12-04 14:25:31,716] Trial 5 finished with value: 0.36949504742225947 and parameters: {'n_neighbors': 85, 'algorithm': 'ball_tree', 'p': 2, 'leaf_size': 35}. Best is trial 5 with value: 0.36949504742225947.
[I 2025-12-04 14:25:36,416] Trial 6 finished with value: 0.36177811091442147 and parameters: {'n_neighbors': 55, 'algorithm': 'kd_tree', 'p': 1, 'leaf_size': 38}. Best is trial 5 with value: 0.36949504742225947.
[I 2025-12-04 14:25:41,956] Trial 7 finished with value: 0.36941436092412894 and parameters: {'n_neighbors': 85, 'algorithm': 'kd_tree', 'p': 2, 'leaf_size': 30}. Best is trial 5 with value: 0.36949504742225947.
[I 2025-12-04 14:25:47,685] Trial 8 finished with value: 0.3655546703628031 and parameters: {'n_neighbors': 85, 'algorithm': 'kd_tree', 'p': 1, 'leaf_size': 32}. Best is trial 5 with value: 0.36949504742225947.
[I 2025-12-04 14:25:51,891] Trial 9 finished with value: 0.3621893305538203 and parameters: {'n_neighbors': 65, 'algorithm': 'ball_tree', 'p': 1, 'leaf_size': 21}. Best is trial 5 with value: 0.36949504742225947.
[I 2025-12-04 14:25:55,391] Trial 10 finished with value: 0.3726442160944411 and parameters: {'n_neighbors': 125, 'algorithm': 'ball_tree', 'p': 2, 'leaf_size': 35}. Best is trial 10 with value: 0.3726442160944411.
[I 2025-12-04 14:25:58,810] Trial 11 finished with value: 0.3726442160944411 and parameters: {'n_neighbors': 125, 'algorithm': 'ball_tree', 'p': 2, 'leaf_size': 35}. Best is trial 10 with value: 0.3726442160944411.
[I 2025-12-04 14:26:02,130] Trial 12 finished with value: 0.3726442160944411 and parameters: {'n_neighbors': 125, 'algorithm': 'ball_tree', 'p': 2, 'leaf_size': 35}. Best is trial 10 with value: 0.3726442160944411.
[I 2025-12-04 14:26:05,738] Trial 13 finished with value: 0.3726442160944411 and parameters: {'n_neighbors': 125, 'algorithm': 'ball_tree', 'p': 2, 'leaf_size': 34}. Best is trial 10 with value: 0.3726442160944411.
[I 2025-12-04 14:26:09,139] Trial 14 finished with value: 0.371719771530587 and parameters: {'n_neighbors': 105, 'algorithm': 'ball_tree', 'p': 2, 'leaf_size': 27}. Best is trial 10 with value: 0.3726442160944411.
[I 2025-12-04 14:26:09,406] Trial 15 finished with value: 0.3667236016678959 and parameters: {'n_neighbors': 25, 'algorithm': 'auto', 'p': 2, 'leaf_size': 40}. Best is trial 10 with value: 0.3726442160944411.
[I 2025-12-04 14:26:12,839] Trial 16 finished with value: 0.3731800825254878 and parameters: {'n_neighbors': 115, 'algorithm': 'ball_tree', 'p': 2, 'leaf_size': 36}. Best is trial 16 with value: 0.3731800825254878.
[I 2025-12-04 14:26:16,387] Trial 17 finished with value: 0.371719771530587 and parameters: {'n_neighbors': 105, 'algorithm': 'ball_tree', 'p': 2, 'leaf_size': 32}. Best is trial 16 with value: 0.3731800825254878.
[I 2025-12-04 14:26:19,943] Trial 18 finished with value: 0.3732197472107818 and parameters: {'n_neighbors': 115, 'algorithm': 'ball_tree', 'p': 2, 'leaf_size': 27}. Best is trial 18 with value: 0.3732197472107818.
[I 2025-12-04 14:26:20,324] Trial 19 finished with value: 0.371609924408019 and parameters: {'n_neighbors': 105, 'algorithm': 'auto', 'p': 2, 'leaf_size': 23}. Best is trial 18 with value: 0.3732197472107818.
[I 2025-12-04 14:26:20,722] Trial 20 finished with value: 0.37312148186365035 and parameters: {'n_neighbors': 115, 'algorithm': 'brute', 'p': 2, 'leaf_size': 27}. Best is trial 18 with value: 0.3732197472107818.
[I 2025-12-04 14:26:21,113] Trial 21 finished with value: 0.37312148186365035 and parameters: {'n_neighbors': 115, 'algorithm': 'brute', 'p': 2, 'leaf_size': 26}. Best is trial 18 with value: 0.3732197472107818.
[I 2025-12-04 14:26:21,507] Trial 22 finished with value: 0.37312148186365035 and parameters: {'n_neighbors': 115, 'algorithm': 'brute', 'p': 2, 'leaf_size': 24}. Best is trial 18 with value: 0.3732197472107818.
[I 2025-12-04 14:26:21,897] Trial 23 finished with value: 0.37312148186365035 and parameters: {'n_neighbors': 115, 'algorithm': 'brute', 'p': 2, 'leaf_size': 28}. Best is trial 18 with value: 0.3732197472107818.
[I 2025-12-04 14:26:22,258] Trial 24 finished with value: 0.36969740762764286 and parameters: {'n_neighbors': 95, 'algorithm': 'brute', 'p': 2, 'leaf_size': 28}. Best is trial 18 with value: 0.3732197472107818.
[I 2025-12-04 14:26:25,629] Trial 25 finished with value: 0.371719771530587 and parameters: {'n_neighbors': 105, 'algorithm': 'ball_tree', 'p': 2, 'leaf_size': 24}. Best is trial 18 with value: 0.3732197472107818.
[I 2025-12-04 14:26:29,244] Trial 26 finished with value: 0.36980259936442894 and parameters: {'n_neighbors': 95, 'algorithm': 'ball_tree', 'p': 2, 'leaf_size': 30}. Best is trial 18 with value: 0.3732197472107818.
[I 2025-12-04 14:26:29,621] Trial 27 finished with value: 0.37312148186365035 and parameters: {'n_neighbors': 115, 'algorithm': 'brute', 'p': 2, 'leaf_size': 32}. Best is trial 18 with value: 0.3732197472107818.
[I 2025-12-04 14:26:29,990] Trial 28 finished with value: 0.37312148186365035 and parameters: {'n_neighbors': 115, 'algorithm': 'auto', 'p': 2, 'leaf_size': 22}. Best is trial 18 with value: 0.3732197472107818.
[I 2025-12-04 14:26:30,589] Trial 29 finished with value: 0.3672527763472233 and parameters: {'n_neighbors': 95, 'algorithm': 'auto', 'p': 1, 'leaf_size': 25}. Best is trial 18 with value: 0.3732197472107818.
[I 2025-12-04 14:26:41,821] A new study created in memory with name: k_nearest_neighbors_fold_5
[I 2025-12-04 14:26:46,622] Trial 0 finished with value: 0.3788706320901073 and parameters: {'n_neighbors': 125, 'algorithm': 'kd_tree', 'p': 2, 'leaf_size': 34}. Best is trial 0 with value: 0.3788706320901073.
[I 2025-12-04 14:26:50,601] Trial 1 finished with value: 0.3749171979068979 and parameters: {'n_neighbors': 85, 'algorithm': 'kd_tree', 'p': 2, 'leaf_size': 36}. Best is trial 0 with value: 0.3788706320901073.
[I 2025-12-04 14:26:55,583] Trial 2 finished with value: 0.3664309451353127 and parameters: {'n_neighbors': 55, 'algorithm': 'kd_tree', 'p': 1, 'leaf_size': 23}. Best is trial 0 with value: 0.3788706320901073.
[I 2025-12-04 14:27:00,471] Trial 3 finished with value: 0.37307589609671715 and parameters: {'n_neighbors': 85, 'algorithm': 'kd_tree', 'p': 1, 'leaf_size': 22}. Best is trial 0 with value: 0.3788706320901073.
[I 2025-12-04 14:27:00,760] Trial 4 finished with value: 0.37338332249908235 and parameters: {'n_neighbors': 55, 'algorithm': 'brute', 'p': 2, 'leaf_size': 22}. Best is trial 0 with value: 0.3788706320901073.
[I 2025-12-04 14:27:05,625] Trial 5 finished with value: 0.36486526997211066 and parameters: {'n_neighbors': 45, 'algorithm': 'kd_tree', 'p': 1, 'leaf_size': 32}. Best is trial 0 with value: 0.3788706320901073.
[I 2025-12-04 14:27:06,123] Trial 6 finished with value: 0.3614494398683875 and parameters: {'n_neighbors': 25, 'algorithm': 'auto', 'p': 1, 'leaf_size': 34}. Best is trial 0 with value: 0.3788706320901073.
[I 2025-12-04 14:27:09,421] Trial 7 finished with value: 0.375560637307311 and parameters: {'n_neighbors': 75, 'algorithm': 'ball_tree', 'p': 2, 'leaf_size': 36}. Best is trial 0 with value: 0.3788706320901073.
[I 2025-12-04 14:27:09,697] Trial 8 finished with value: 0.3701492969023083 and parameters: {'n_neighbors': 35, 'algorithm': 'brute', 'p': 2, 'leaf_size': 21}. Best is trial 0 with value: 0.3788706320901073.
[I 2025-12-04 14:27:13,212] Trial 9 finished with value: 0.3676065623532114 and parameters: {'n_neighbors': 75, 'algorithm': 'ball_tree', 'p': 1, 'leaf_size': 39}. Best is trial 0 with value: 0.3788706320901073.
[I 2025-12-04 14:27:13,621] Trial 10 finished with value: 0.37901061213311193 and parameters: {'n_neighbors': 125, 'algorithm': 'auto', 'p': 2, 'leaf_size': 29}. Best is trial 10 with value: 0.37901061213311193.
[I 2025-12-04 14:27:14,037] Trial 11 finished with value: 0.37901061213311193 and parameters: {'n_neighbors': 125, 'algorithm': 'auto', 'p': 2, 'leaf_size': 28}. Best is trial 10 with value: 0.37901061213311193.
[I 2025-12-04 14:27:14,450] Trial 12 finished with value: 0.37901061213311193 and parameters: {'n_neighbors': 125, 'algorithm': 'auto', 'p': 2, 'leaf_size': 27}. Best is trial 10 with value: 0.37901061213311193.
[I 2025-12-04 14:27:14,844] Trial 13 finished with value: 0.37853941699828847 and parameters: {'n_neighbors': 115, 'algorithm': 'auto', 'p': 2, 'leaf_size': 28}. Best is trial 10 with value: 0.37901061213311193.
[I 2025-12-04 14:27:15,222] Trial 14 finished with value: 0.37750914315579326 and parameters: {'n_neighbors': 105, 'algorithm': 'auto', 'p': 2, 'leaf_size': 26}. Best is trial 10 with value: 0.37901061213311193.
[I 2025-12-04 14:27:15,604] Trial 15 finished with value: 0.37750914315579326 and parameters: {'n_neighbors': 105, 'algorithm': 'auto', 'p': 2, 'leaf_size': 30}. Best is trial 10 with value: 0.37901061213311193.
[I 2025-12-04 14:27:15,991] Trial 16 finished with value: 0.37750914315579326 and parameters: {'n_neighbors': 105, 'algorithm': 'auto', 'p': 2, 'leaf_size': 25}. Best is trial 10 with value: 0.37901061213311193.
[I 2025-12-04 14:27:16,408] Trial 17 finished with value: 0.37901061213311193 and parameters: {'n_neighbors': 125, 'algorithm': 'auto', 'p': 2, 'leaf_size': 31}. Best is trial 10 with value: 0.37901061213311193.
[I 2025-12-04 14:27:16,787] Trial 18 finished with value: 0.3776286451651637 and parameters: {'n_neighbors': 95, 'algorithm': 'auto', 'p': 2, 'leaf_size': 28}. Best is trial 10 with value: 0.37901061213311193.
[I 2025-12-04 14:27:17,192] Trial 19 finished with value: 0.37853941699828847 and parameters: {'n_neighbors': 115, 'algorithm': 'brute', 'p': 2, 'leaf_size': 24}. Best is trial 10 with value: 0.37901061213311193.
[I 2025-12-04 14:27:20,924] Trial 20 finished with value: 0.37551090997655734 and parameters: {'n_neighbors': 115, 'algorithm': 'ball_tree', 'p': 1, 'leaf_size': 29}. Best is trial 10 with value: 0.37901061213311193.
[I 2025-12-04 14:27:21,333] Trial 21 finished with value: 0.37901061213311193 and parameters: {'n_neighbors': 125, 'algorithm': 'auto', 'p': 2, 'leaf_size': 27}. Best is trial 10 with value: 0.37901061213311193.
[I 2025-12-04 14:27:21,745] Trial 22 finished with value: 0.37901061213311193 and parameters: {'n_neighbors': 125, 'algorithm': 'auto', 'p': 2, 'leaf_size': 26}. Best is trial 10 with value: 0.37901061213311193.
[I 2025-12-04 14:27:22,109] Trial 23 finished with value: 0.3776286451651637 and parameters: {'n_neighbors': 95, 'algorithm': 'auto', 'p': 2, 'leaf_size': 31}. Best is trial 10 with value: 0.37901061213311193.
[I 2025-12-04 14:27:22,516] Trial 24 finished with value: 0.37853941699828847 and parameters: {'n_neighbors': 115, 'algorithm': 'auto', 'p': 2, 'leaf_size': 29}. Best is trial 10 with value: 0.37901061213311193.
[I 2025-12-04 14:27:22,939] Trial 25 finished with value: 0.37901061213311193 and parameters: {'n_neighbors': 125, 'algorithm': 'auto', 'p': 2, 'leaf_size': 25}. Best is trial 10 with value: 0.37901061213311193.
[I 2025-12-04 14:27:23,324] Trial 26 finished with value: 0.3776286451651637 and parameters: {'n_neighbors': 95, 'algorithm': 'auto', 'p': 2, 'leaf_size': 33}. Best is trial 10 with value: 0.37901061213311193.
[I 2025-12-04 14:27:23,702] Trial 27 finished with value: 0.37750914315579326 and parameters: {'n_neighbors': 105, 'algorithm': 'auto', 'p': 2, 'leaf_size': 27}. Best is trial 10 with value: 0.37901061213311193.
[I 2025-12-04 14:27:27,286] Trial 28 finished with value: 0.37806045734864674 and parameters: {'n_neighbors': 115, 'algorithm': 'ball_tree', 'p': 2, 'leaf_size': 30}. Best is trial 10 with value: 0.37901061213311193.
