[I 2025-12-04 14:27:27,687] Trial 29 finished with value: 0.37901061213311193 and parameters: {'n_neighbors': 125, 'algorithm': 'brute', 'p': 2, 'leaf_size': 36}. Best is trial 10 with value: 0.37901061213311193.
Importâncias dos parâmetros para fold 3: {'learning_rate': np.float64(0.4498261793408829), 'min_samples_leaf': np.float64(0.3229416735700317), 'max_depth': np.float64(0.08328971739366993), 'n_estimators': np.float64(0.054520466447369687), 'min_samples_split': np.float64(0.040983553056660196), 'max_features': np.float64(0.030867717534352197), 'subsample': np.float64(0.01757069265703332)}
Saved Optuna plots to results/20251204_071056_ana_optimized_multiclass_less/gradient_boosting/optuna_plots
Fold 4
Importâncias dos parâmetros para fold 4: {'max_depth': np.float64(0.5147664537765569), 'learning_rate': np.float64(0.26334078259951876), 'n_estimators': np.float64(0.14544240193534816), 'max_features': np.float64(0.02915502634715733), 'subsample': np.float64(0.023859582416055947), 'min_samples_leaf': np.float64(0.01377451488971264), 'min_samples_split': np.float64(0.009661238035650225)}
Saved Optuna plots to results/20251204_071056_ana_optimized_multiclass_less/gradient_boosting/optuna_plots
Fold 5
Importâncias dos parâmetros para fold 5: {'learning_rate': np.float64(0.4426504799767642), 'n_estimators': np.float64(0.2571484117100462), 'min_samples_leaf': np.float64(0.1201270909044296), 'max_depth': np.float64(0.07927198789810336), 'subsample': np.float64(0.06468821892852819), 'min_samples_split': np.float64(0.01904725556969462), 'max_features': np.float64(0.017066555012433753)}
Saved Optuna plots to results/20251204_071056_ana_optimized_multiclass_less/gradient_boosting/optuna_plots

Nested CV completed. The 20% holdout set (3536 samples) remains untouched.
This holdout set can be used for final unbiased evaluation.

Training and evaluating 5 best parameter sets on holdout data...
Testing with 4 balancing strategies: none, randomundersampler, smoteenn, tomeklinks

Evaluating fold 1 best params on holdout set...
  - Testing with balance strategy: none
  - Testing with balance strategy: randomundersampler
  - Testing with balance strategy: smoteenn
  - Testing with balance strategy: tomeklinks

Evaluating fold 2 best params on holdout set...
  - Testing with balance strategy: none
  - Testing with balance strategy: randomundersampler
  - Testing with balance strategy: smoteenn
  - Testing with balance strategy: tomeklinks

Evaluating fold 3 best params on holdout set...
  - Testing with balance strategy: none
  - Testing with balance strategy: randomundersampler
  - Testing with balance strategy: smoteenn
  - Testing with balance strategy: tomeklinks

Evaluating fold 4 best params on holdout set...
  - Testing with balance strategy: none
  - Testing with balance strategy: randomundersampler
  - Testing with balance strategy: smoteenn
  - Testing with balance strategy: tomeklinks

Evaluating fold 5 best params on holdout set...
  - Testing with balance strategy: none
  - Testing with balance strategy: randomundersampler
  - Testing with balance strategy: smoteenn
  - Testing with balance strategy: tomeklinks
Saving optimization and holdout results...
Detailed results by fold saved to: ./results/20251204_071056_ana_optimized_multiclass_less/gradient_boosting/detailed_results_by_fold.txt
Test predictions for all folds saved to: ./results/20251204_071056_ana_optimized_multiclass_less/gradient_boosting/metrics.json
Saving holdout results...
Holdout evaluation results saved to: ./results/20251204_071056_ana_optimized_multiclass_less/gradient_boosting/holdout_results.txt
Saved!
[OK] Gradient Boosting executado com sucesso!

CONFIGURAÇÃO DO EXPERIMENTO (OTIMIZAÇÃO):
  Modelo: K-Nearest Neighbors
  Trials: 30
  Tipo: multiclass
  Parâmetros: Reduzido
  Balanceamento: none
================================================================================
EXECUTANDO MODELO: K-Nearest Neighbors
================================================================================

Starting Nested Cross-Validation for k_nearest_neighbors...
Configuration: 5 outer folds, 30 trials per fold
Performing 80/20 holdout split...
Holdout split completed:
  - Training set: 14140 samples (80%)
  - Holdout test set: 3536 samples (20%)
Fold 1
Importâncias dos parâmetros para fold 1: {'p': np.float64(0.5239777748894355), 'n_neighbors': np.float64(0.43215483556402745), 'leaf_size': np.float64(0.03309282153587652), 'algorithm': np.float64(0.010774568010660563)}
Saved Optuna plots to results/20251204_071056_ana_optimized_multiclass_less/k_nearest_neighbors/optuna_plots
Fold 2
Importâncias dos parâmetros para fold 2: {'n_neighbors': np.float64(0.4309515375923141), 'p': np.float64(0.33913483916823756), 'algorithm': np.float64(0.1379106069544941), 'leaf_size': np.float64(0.09200301628495443)}
Saved Optuna plots to results/20251204_071056_ana_optimized_multiclass_less/k_nearest_neighbors/optuna_plots
Fold 3
Importâncias dos parâmetros para fold 3: {'n_neighbors': np.float64(0.8720743621106761), 'algorithm': np.float64(0.062252044303426936), 'p': np.float64(0.05477842998910978), 'leaf_size': np.float64(0.010895163596787221)}
Saved Optuna plots to results/20251204_071056_ana_optimized_multiclass_less/k_nearest_neighbors/optuna_plots
Fold 4
Importâncias dos parâmetros para fold 4: {'n_neighbors': np.float64(0.5646327874918629), 'p': np.float64(0.36246235576253927), 'leaf_size': np.float64(0.04510582398373429), 'algorithm': np.float64(0.027799032761863622)}
Saved Optuna plots to results/20251204_071056_ana_optimized_multiclass_less/k_nearest_neighbors/optuna_plots
Fold 5
Importâncias dos parâmetros para fold 5: {'n_neighbors': np.float64(0.7360931115609373), 'p': np.float64(0.18512222605440434), 'leaf_size': np.float64(0.04130348242326113), 'algorithm': np.float64(0.03748117996139729)}
Saved Optuna plots to results/20251204_071056_ana_optimized_multiclass_less/k_nearest_neighbors/optuna_plots

Nested CV completed. The 20% holdout set (3536 samples) remains untouched.
This holdout set can be used for final unbiased evaluation.

Training and evaluating 5 best parameter sets on holdout data...
Testing with 4 balancing strategies: none, randomundersampler, smoteenn, tomeklinks

Evaluating fold 1 best params on holdout set...
  - Testing with balance strategy: none
  - Testing with balance strategy: randomundersampler
  - Testing with balance strategy: smoteenn
  - Testing with balance strategy: tomeklinks

Evaluating fold 2 best params on holdout set...
  - Testing with balance strategy: none
  - Testing with balance strategy: randomundersampler
  - Testing with balance strategy: smoteenn
  - Testing with balance strategy: tomeklinks

Evaluating fold 3 best params on holdout set...
  - Testing with balance strategy: none
  - Testing with balance strategy: randomundersampler
  - Testing with balance strategy: smoteenn
  - Testing with balance strategy: tomeklinks

Evaluating fold 4 best params on holdout set...
  - Testing with balance strategy: none
  - Testing with balance strategy: randomundersampler
  - Testing with balance strategy: smoteenn
  - Testing with balance strategy: tomeklinks

Evaluating fold 5 best params on holdout set...
  - Testing with balance strategy: none
  - Testing with balance strategy: randomundersampler
  - Testing with balance strategy: smoteenn
  - Testing with balance strategy: tomeklinks
Saving optimization and holdout results...
Detailed results by fold saved to: ./results/20251204_071056_ana_optimized_multiclass_less/k_nearest_neighbors/detailed_results_by_fold.txt
Test predictions for all folds saved to: ./results/20251204_071056_ana_optimized_multiclass_less/k_nearest_neighbors/metrics.json
Saving holdout results...
Holdout evaluation results saved to: ./results/20251204_071056_ana_optimized_multiclass_less/k_nearest_neighbors/holdout_results.txt
Saved!
[OK] K-Nearest Neighbors executado com sucesso!

CONFIGURAÇÃO DO EXPERIMENTO (OTIMIZAÇÃO):
  Modelo: Multi-Layer Perceptron
  Trials: 30
  Tipo: multiclass
  Parâmetros: Reduzido
  Balanceamento: none
================================================================================
EXECUTANDO MODELO: Multi-Layer Perceptron
================================================================================

Starting Nested Cross-Validation for multi_layer_perceptron...
[I 2025-12-04 14:28:10,567] A new study created in memory with name: multi_layer_perceptron_fold_1
[I 2025-12-04 14:30:16,170] Trial 0 finished with value: 0.3445882066084778 and parameters: {'n_layers': 2, 'layer_0_size': 150, 'layer_1_size': 175, 'activation': 'logistic', 'alpha': 0.00021546447515101766, 'learning_rate': 'adaptive', 'solver': 'adam', 'learning_rate_init': 0.031209856169193917, 'max_iter': 1284}. Best is trial 0 with value: 0.3445882066084778.
[I 2025-12-04 14:30:26,083] Trial 1 finished with value: 0.33956657117543976 and parameters: {'n_layers': 1, 'layer_0_size': 175, 'activation': 'logistic', 'alpha': 0.0019084431385766154, 'learning_rate': 'invscaling', 'solver': 'sgd', 'learning_rate_init': 0.0006229993564932552, 'max_iter': 949}. Best is trial 0 with value: 0.3445882066084778.
[I 2025-12-04 14:30:33,724] Trial 2 finished with value: 0.3543832083940092 and parameters: {'n_layers': 1, 'layer_0_size': 100, 'activation': 'tanh', 'alpha': 0.000145502981115574, 'learning_rate': 'invscaling', 'solver': 'adam', 'learning_rate_init': 0.003962474412177646, 'max_iter': 305}. Best is trial 2 with value: 0.3543832083940092.
[I 2025-12-04 14:31:15,596] Trial 3 finished with value: 0.35429931447900526 and parameters: {'n_layers': 1, 'layer_0_size': 100, 'activation': 'tanh', 'alpha': 0.00018377817849959176, 'learning_rate': 'adaptive', 'solver': 'sgd', 'learning_rate_init': 0.008268972183024388, 'max_iter': 782}. Best is trial 2 with value: 0.3543832083940092.
[I 2025-12-04 14:47:51,086] Trial 4 finished with value: 0.3467895588152216 and parameters: {'n_layers': 2, 'layer_0_size': 175, 'layer_1_size': 150, 'activation': 'tanh', 'alpha': 0.00026027765904695644, 'learning_rate': 'adaptive', 'solver': 'sgd', 'learning_rate_init': 0.0050293672874515884, 'max_iter': 1489}. Best is trial 2 with value: 0.3543832083940092.
[I 2025-12-04 14:53:06,145] Trial 5 finished with value: 0.3413392248274777 and parameters: {'n_layers': 2, 'layer_0_size': 150, 'layer_1_size': 175, 'activation': 'logistic', 'alpha': 0.008564325340675142, 'learning_rate': 'adaptive', 'solver': 'lbfgs', 'learning_rate_init': 0.0032445706304196848, 'max_iter': 534}. Best is trial 2 with value: 0.3543832083940092.
[I 2025-12-04 14:53:19,638] Trial 6 finished with value: 0.3565375683130923 and parameters: {'n_layers': 1, 'layer_0_size': 175, 'activation': 'logistic', 'alpha': 0.0009587978641405928, 'learning_rate': 'invscaling', 'solver': 'sgd', 'learning_rate_init': 0.0012852327136369144, 'max_iter': 772}. Best is trial 6 with value: 0.3565375683130923.
[I 2025-12-04 15:00:38,898] Trial 7 finished with value: 0.3441124084209287 and parameters: {'n_layers': 2, 'layer_0_size': 200, 'layer_1_size': 125, 'activation': 'logistic', 'alpha': 0.0013333112214173554, 'learning_rate': 'invscaling', 'solver': 'lbfgs', 'learning_rate_init': 0.0020291307406542186, 'max_iter': 545}. Best is trial 6 with value: 0.3565375683130923.
[I 2025-12-04 15:01:55,196] Trial 8 finished with value: 0.36046254344665235 and parameters: {'n_layers': 2, 'layer_0_size': 100, 'layer_1_size': 150, 'activation': 'tanh', 'alpha': 0.00013962292154778193, 'learning_rate': 'constant', 'solver': 'adam', 'learning_rate_init': 0.00296037611987405, 'max_iter': 616}. Best is trial 8 with value: 0.36046254344665235.
[I 2025-12-04 15:14:10,506] Trial 9 finished with value: 0.351666747671084 and parameters: {'n_layers': 2, 'layer_0_size': 200, 'layer_1_size': 150, 'activation': 'tanh', 'alpha': 0.0007807389624541011, 'learning_rate': 'constant', 'solver': 'adam', 'learning_rate_init': 0.00028055656084342455, 'max_iter': 694}. Best is trial 8 with value: 0.36046254344665235.
[I 2025-12-04 15:14:29,171] Trial 10 finished with value: 0.35399868106325105 and parameters: {'n_layers': 2, 'layer_0_size': 125, 'layer_1_size': 100, 'activation': 'tanh', 'alpha': 0.00043749864695125204, 'learning_rate': 'constant', 'solver': 'adam', 'learning_rate_init': 0.0930456828657711, 'max_iter': 232}. Best is trial 8 with value: 0.36046254344665235.
[I 2025-12-04 15:14:35,694] Trial 11 finished with value: 0.3815829684679795 and parameters: {'n_layers': 1, 'layer_0_size': 150, 'activation': 'logistic', 'alpha': 0.00427481589272344, 'learning_rate': 'constant', 'solver': 'sgd', 'learning_rate_init': 0.0009398745719821366, 'max_iter': 1022}. Best is trial 11 with value: 0.3815829684679795.
[I 2025-12-04 15:14:38,313] Trial 12 finished with value: 0.343271897957679 and parameters: {'n_layers': 1, 'layer_0_size': 125, 'activation': 'logistic', 'alpha': 0.0043940013719274236, 'learning_rate': 'constant', 'solver': 'sgd', 'learning_rate_init': 0.00011168851256229174, 'max_iter': 1035}. Best is trial 11 with value: 0.3815829684679795.
[I 2025-12-04 15:14:42,674] Trial 13 finished with value: 0.35216854253270685 and parameters: {'n_layers': 1, 'layer_0_size': 125, 'activation': 'tanh', 'alpha': 0.003392489867612911, 'learning_rate': 'constant', 'solver': 'adam', 'learning_rate_init': 0.012802839448414855, 'max_iter': 1147}. Best is trial 11 with value: 0.3815829684679795.
[I 2025-12-04 15:23:01,247] Trial 14 finished with value: 0.3408537631766835 and parameters: {'n_layers': 2, 'layer_0_size': 100, 'layer_1_size': 200, 'activation': 'logistic', 'alpha': 0.009650728660355514, 'learning_rate': 'constant', 'solver': 'lbfgs', 'learning_rate_init': 0.0007675434708010003, 'max_iter': 477}. Best is trial 11 with value: 0.3815829684679795.
[I 2025-12-04 15:23:10,892] Trial 15 finished with value: 0.38658988880535927 and parameters: {'n_layers': 1, 'layer_0_size': 125, 'activation': 'tanh', 'alpha': 0.0004586562957984064, 'learning_rate': 'constant', 'solver': 'sgd', 'learning_rate_init': 0.00044739171297618596, 'max_iter': 1111}. Best is trial 15 with value: 0.38658988880535927.
[I 2025-12-04 15:23:21,712] Trial 16 finished with value: 0.38603224255765367 and parameters: {'n_layers': 1, 'layer_0_size': 150, 'activation': 'tanh', 'alpha': 0.0004712262570241071, 'learning_rate': 'constant', 'solver': 'sgd', 'learning_rate_init': 0.00028591522791841936, 'max_iter': 1233}. Best is trial 15 with value: 0.38658988880535927.
[I 2025-12-04 15:23:32,187] Trial 17 finished with value: 0.37827652905960063 and parameters: {'n_layers': 1, 'layer_0_size': 125, 'activation': 'tanh', 'alpha': 0.0004668480880536462, 'learning_rate': 'constant', 'solver': 'sgd', 'learning_rate_init': 0.0002380230183654183, 'max_iter': 1307}. Best is trial 15 with value: 0.38658988880535927.
[I 2025-12-04 15:23:47,405] Trial 18 finished with value: 0.3734806868663655 and parameters: {'n_layers': 1, 'layer_0_size': 150, 'activation': 'tanh', 'alpha': 0.00044297157344515303, 'learning_rate': 'constant', 'solver': 'sgd', 'learning_rate_init': 0.00011771662915482535, 'max_iter': 1471}. Best is trial 15 with value: 0.38658988880535927.
[I 2025-12-04 15:23:57,552] Trial 19 finished with value: 0.3797628822346749 and parameters: {'n_layers': 1, 'layer_0_size': 125, 'activation': 'tanh', 'alpha': 0.0001024902396380022, 'learning_rate': 'constant', 'solver': 'sgd', 'learning_rate_init': 0.0003540924225945361, 'max_iter': 1202}. Best is trial 15 with value: 0.38658988880535927.
[I 2025-12-04 15:25:38,329] Trial 20 finished with value: 0.38351533505667396 and parameters: {'n_layers': 1, 'layer_0_size': 175, 'activation': 'tanh', 'alpha': 0.0002973791445464887, 'learning_rate': 'constant', 'solver': 'sgd', 'learning_rate_init': 0.0004660025226088501, 'max_iter': 950}. Best is trial 15 with value: 0.38658988880535927.
[I 2025-12-04 15:27:11,498] Trial 21 finished with value: 0.379822640142592 and parameters: {'n_layers': 1, 'layer_0_size': 175, 'activation': 'tanh', 'alpha': 0.000315545250094128, 'learning_rate': 'constant', 'solver': 'sgd', 'learning_rate_init': 0.0004594515418762917, 'max_iter': 902}. Best is trial 15 with value: 0.38658988880535927.
[I 2025-12-04 15:28:46,401] Trial 22 finished with value: 0.37751288096150004 and parameters: {'n_layers': 1, 'layer_0_size': 175, 'activation': 'tanh', 'alpha': 0.0006422053812336444, 'learning_rate': 'constant', 'solver': 'sgd', 'learning_rate_init': 0.00015953676864777138, 'max_iter': 1120}. Best is trial 15 with value: 0.38658988880535927.
[I 2025-12-04 15:28:58,020] Trial 23 finished with value: 0.378121270415801 and parameters: {'n_layers': 1, 'layer_0_size': 150, 'activation': 'tanh', 'alpha': 0.00037680167475707916, 'learning_rate': 'constant', 'solver': 'sgd', 'learning_rate_init': 0.00020776065313027103, 'max_iter': 1325}. Best is trial 15 with value: 0.38658988880535927.
[I 2025-12-04 15:30:40,343] Trial 24 finished with value: 0.3552799466302235 and parameters: {'n_layers': 1, 'layer_0_size': 150, 'activation': 'tanh', 'alpha': 0.0006094250378459068, 'learning_rate': 'constant', 'solver': 'sgd', 'learning_rate_init': 0.0016396437857629054, 'max_iter': 1056}. Best is trial 15 with value: 0.38658988880535927.
[I 2025-12-04 15:33:38,569] Trial 25 finished with value: 0.34732924513640784 and parameters: {'n_layers': 1, 'layer_0_size': 200, 'activation': 'tanh', 'alpha': 0.0013874385830806068, 'learning_rate': 'constant', 'solver': 'lbfgs', 'learning_rate_init': 0.00046143977618987367, 'max_iter': 1226}. Best is trial 15 with value: 0.38658988880535927.
[I 2025-12-04 15:35:34,172] Trial 26 finished with value: 0.3857466380765021 and parameters: {'n_layers': 1, 'layer_0_size': 175, 'activation': 'tanh', 'alpha': 0.0005969828934640878, 'learning_rate': 'constant', 'solver': 'sgd', 'learning_rate_init': 0.0007700791348843658, 'max_iter': 1385}. Best is trial 15 with value: 0.38658988880535927.
[I 2025-12-04 15:35:55,456] Trial 27 finished with value: 0.3819073781087553 and parameters: {'n_layers': 1, 'layer_0_size': 125, 'activation': 'tanh', 'alpha': 0.001209709794812092, 'learning_rate': 'constant', 'solver': 'sgd', 'learning_rate_init': 0.0008965814647552236, 'max_iter': 1399}. Best is trial 15 with value: 0.38658988880535927.
[I 2025-12-04 15:36:11,436] Trial 28 finished with value: 0.3824162814636161 and parameters: {'n_layers': 1, 'layer_0_size': 150, 'activation': 'tanh', 'alpha': 0.0020985388720264975, 'learning_rate': 'adaptive', 'solver': 'sgd', 'learning_rate_init': 0.00020598140182548068, 'max_iter': 1388}. Best is trial 15 with value: 0.38658988880535927.
[I 2025-12-04 15:37:56,648] Trial 29 finished with value: 0.34890290045865957 and parameters: {'n_layers': 1, 'layer_0_size': 150, 'activation': 'tanh', 'alpha': 0.00020815223014309715, 'learning_rate': 'invscaling', 'solver': 'lbfgs', 'learning_rate_init': 0.0013776189955245783, 'max_iter': 1268}. Best is trial 15 with value: 0.38658988880535927.
[I 2025-12-04 15:37:59,661] A new study created in memory with name: multi_layer_perceptron_fold_2
[I 2025-12-04 15:40:26,107] Trial 0 finished with value: 0.3461135577580797 and parameters: {'n_layers': 1, 'layer_0_size': 150, 'activation': 'logistic', 'alpha': 0.000135178109423659, 'learning_rate': 'invscaling', 'solver': 'lbfgs', 'learning_rate_init': 0.03221200553460562, 'max_iter': 601}. Best is trial 0 with value: 0.3461135577580797.
[I 2025-12-04 15:42:03,232] Trial 1 finished with value: 0.35589983233016 and parameters: {'n_layers': 2, 'layer_0_size': 175, 'layer_1_size': 150, 'activation': 'tanh', 'alpha': 0.0004724978551106113, 'learning_rate': 'invscaling', 'solver': 'adam', 'learning_rate_init': 0.007739134864670836, 'max_iter': 1319}. Best is trial 1 with value: 0.35589983233016.
[I 2025-12-04 15:42:42,010] Trial 2 finished with value: 0.35309653883896275 and parameters: {'n_layers': 1, 'layer_0_size': 175, 'activation': 'logistic', 'alpha': 0.001305255482757229, 'learning_rate': 'adaptive', 'solver': 'adam', 'learning_rate_init': 0.06707691758468136, 'max_iter': 749}. Best is trial 1 with value: 0.35589983233016.
[I 2025-12-04 15:44:08,404] Trial 3 finished with value: 0.38100809326897705 and parameters: {'n_layers': 2, 'layer_0_size': 175, 'layer_1_size': 175, 'activation': 'logistic', 'alpha': 0.0017633943891813963, 'learning_rate': 'constant', 'solver': 'adam', 'learning_rate_init': 0.06611516999333196, 'max_iter': 762}. Best is trial 3 with value: 0.38100809326897705.
[I 2025-12-04 15:45:28,480] Trial 4 finished with value: 0.3444840053204733 and parameters: {'n_layers': 2, 'layer_0_size': 150, 'layer_1_size': 125, 'activation': 'logistic', 'alpha': 0.00010524986355475977, 'learning_rate': 'constant', 'solver': 'adam', 'learning_rate_init': 0.020295295847770876, 'max_iter': 1124}. Best is trial 3 with value: 0.38100809326897705.
[I 2025-12-04 15:46:11,367] Trial 5 finished with value: 0.3516606637570155 and parameters: {'n_layers': 1, 'layer_0_size': 150, 'activation': 'logistic', 'alpha': 0.0009658007057969867, 'learning_rate': 'constant', 'solver': 'adam', 'learning_rate_init': 0.0008437300723370248, 'max_iter': 933}. Best is trial 3 with value: 0.38100809326897705.
[I 2025-12-04 15:46:44,481] Trial 6 finished with value: 0.3535951677775334 and parameters: {'n_layers': 2, 'layer_0_size': 100, 'layer_1_size': 125, 'activation': 'tanh', 'alpha': 0.00011418156011569311, 'learning_rate': 'invscaling', 'solver': 'adam', 'learning_rate_init': 0.059558619009745614, 'max_iter': 874}. Best is trial 3 with value: 0.38100809326897705.
[I 2025-12-04 15:49:36,013] Trial 7 finished with value: 0.34923621243038083 and parameters: {'n_layers': 2, 'layer_0_size': 175, 'layer_1_size': 150, 'activation': 'tanh', 'alpha': 0.0008101620671937328, 'learning_rate': 'constant', 'solver': 'lbfgs', 'learning_rate_init': 0.00035214890492801305, 'max_iter': 710}. Best is trial 3 with value: 0.38100809326897705.
