[I 2025-12-04 07:10:56,995] A new study created in memory with name: decision_tree_fold_1
[I 2025-12-04 07:10:57,081] Trial 0 finished with value: 0.34421339202889223 and parameters: {'max_depth': 18, 'min_samples_split': 6, 'min_samples_leaf': 17, 'criterion': 'entropy', 'max_features': 'sqrt', 'splitter': 'random'}. Best is trial 0 with value: 0.34421339202889223.
[I 2025-12-04 07:11:00,131] Trial 1 finished with value: 0.345806300394632 and parameters: {'max_depth': 32, 'min_samples_split': 13, 'min_samples_leaf': 16, 'criterion': 'entropy', 'max_features': None, 'splitter': 'best'}. Best is trial 1 with value: 0.345806300394632.
[I 2025-12-04 07:11:00,292] Trial 2 finished with value: 0.3409957988859571 and parameters: {'max_depth': 28, 'min_samples_split': 11, 'min_samples_leaf': 18, 'criterion': 'entropy', 'max_features': 'log2', 'splitter': 'random'}. Best is trial 1 with value: 0.345806300394632.
[I 2025-12-04 07:11:00,449] Trial 3 finished with value: 0.344457751606638 and parameters: {'max_depth': 21, 'min_samples_split': 7, 'min_samples_leaf': 18, 'criterion': 'log_loss', 'max_features': 'sqrt', 'splitter': 'random'}. Best is trial 1 with value: 0.345806300394632.
[I 2025-12-04 07:11:00,784] Trial 4 finished with value: 0.345043034345454 and parameters: {'max_depth': 31, 'min_samples_split': 6, 'min_samples_leaf': 15, 'criterion': 'gini', 'max_features': 'log2', 'splitter': 'best'}. Best is trial 1 with value: 0.345806300394632.
[I 2025-12-04 07:11:00,927] Trial 5 finished with value: 0.33814922979672213 and parameters: {'max_depth': 3, 'min_samples_split': 5, 'min_samples_leaf': 20, 'criterion': 'gini', 'max_features': 'sqrt', 'splitter': 'random'}. Best is trial 1 with value: 0.345806300394632.
[I 2025-12-04 07:11:01,407] Trial 6 finished with value: 0.3429161864999043 and parameters: {'max_depth': 26, 'min_samples_split': 6, 'min_samples_leaf': 18, 'criterion': 'entropy', 'max_features': 'sqrt', 'splitter': 'best'}. Best is trial 1 with value: 0.345806300394632.
[I 2025-12-04 07:11:01,804] Trial 7 finished with value: 0.34618519086951227 and parameters: {'max_depth': 29, 'min_samples_split': 10, 'min_samples_leaf': 18, 'criterion': 'gini', 'max_features': 'sqrt', 'splitter': 'best'}. Best is trial 7 with value: 0.34618519086951227.
[I 2025-12-04 07:11:02,099] Trial 8 finished with value: 0.3508100567282031 and parameters: {'max_depth': 6, 'min_samples_split': 5, 'min_samples_leaf': 16, 'criterion': 'gini', 'max_features': 'sqrt', 'splitter': 'best'}. Best is trial 8 with value: 0.3508100567282031.
[I 2025-12-04 07:11:04,261] Trial 9 finished with value: 0.3418414654414027 and parameters: {'max_depth': 15, 'min_samples_split': 18, 'min_samples_leaf': 16, 'criterion': 'gini', 'max_features': None, 'splitter': 'best'}. Best is trial 8 with value: 0.3508100567282031.
[I 2025-12-04 07:11:04,951] Trial 10 finished with value: 0.34881433434492143 and parameters: {'max_depth': 2, 'min_samples_split': 15, 'min_samples_leaf': 20, 'criterion': 'log_loss', 'max_features': None, 'splitter': 'best'}. Best is trial 8 with value: 0.3508100567282031.
[I 2025-12-04 07:11:05,656] Trial 11 finished with value: 0.34881433434492143 and parameters: {'max_depth': 2, 'min_samples_split': 15, 'min_samples_leaf': 20, 'criterion': 'log_loss', 'max_features': None, 'splitter': 'best'}. Best is trial 8 with value: 0.3508100567282031.
[I 2025-12-04 07:11:07,794] Trial 12 finished with value: 0.3468027903044196 and parameters: {'max_depth': 8, 'min_samples_split': 20, 'min_samples_leaf': 19, 'criterion': 'log_loss', 'max_features': None, 'splitter': 'best'}. Best is trial 8 with value: 0.3508100567282031.
[I 2025-12-04 07:11:10,043] Trial 13 finished with value: 0.3463127875719655 and parameters: {'max_depth': 9, 'min_samples_split': 16, 'min_samples_leaf': 15, 'criterion': 'log_loss', 'max_features': None, 'splitter': 'best'}. Best is trial 8 with value: 0.3508100567282031.
[I 2025-12-04 07:11:10,314] Trial 14 finished with value: 0.3489442956404388 and parameters: {'max_depth': 7, 'min_samples_split': 9, 'min_samples_leaf': 16, 'criterion': 'gini', 'max_features': 'log2', 'splitter': 'best'}. Best is trial 8 with value: 0.3508100567282031.
[I 2025-12-04 07:11:10,613] Trial 15 finished with value: 0.34872788621142703 and parameters: {'max_depth': 10, 'min_samples_split': 9, 'min_samples_leaf': 16, 'criterion': 'gini', 'max_features': 'log2', 'splitter': 'best'}. Best is trial 8 with value: 0.3508100567282031.
[I 2025-12-04 07:11:10,929] Trial 16 finished with value: 0.343873090032102 and parameters: {'max_depth': 13, 'min_samples_split': 8, 'min_samples_leaf': 17, 'criterion': 'gini', 'max_features': 'log2', 'splitter': 'best'}. Best is trial 8 with value: 0.3508100567282031.
[I 2025-12-04 07:11:11,188] Trial 17 finished with value: 0.3471431245291253 and parameters: {'max_depth': 7, 'min_samples_split': 12, 'min_samples_leaf': 16, 'criterion': 'gini', 'max_features': 'log2', 'splitter': 'best'}. Best is trial 8 with value: 0.3508100567282031.
[I 2025-12-04 07:11:11,338] Trial 18 finished with value: 0.33963957556165714 and parameters: {'max_depth': 6, 'min_samples_split': 9, 'min_samples_leaf': 15, 'criterion': 'gini', 'max_features': 'log2', 'splitter': 'random'}. Best is trial 8 with value: 0.3508100567282031.
[I 2025-12-04 07:11:11,715] Trial 19 finished with value: 0.3509335870690294 and parameters: {'max_depth': 12, 'min_samples_split': 8, 'min_samples_leaf': 17, 'criterion': 'gini', 'max_features': 'sqrt', 'splitter': 'best'}. Best is trial 19 with value: 0.3509335870690294.
[I 2025-12-04 07:11:12,094] Trial 20 finished with value: 0.3458866485521546 and parameters: {'max_depth': 12, 'min_samples_split': 5, 'min_samples_leaf': 17, 'criterion': 'gini', 'max_features': 'sqrt', 'splitter': 'best'}. Best is trial 19 with value: 0.3509335870690294.
[I 2025-12-04 07:11:12,362] Trial 21 finished with value: 0.3489327658609623 and parameters: {'max_depth': 5, 'min_samples_split': 8, 'min_samples_leaf': 16, 'criterion': 'gini', 'max_features': 'sqrt', 'splitter': 'best'}. Best is trial 19 with value: 0.3509335870690294.
[I 2025-12-04 07:11:12,739] Trial 22 finished with value: 0.3478657091244186 and parameters: {'max_depth': 11, 'min_samples_split': 8, 'min_samples_leaf': 17, 'criterion': 'gini', 'max_features': 'sqrt', 'splitter': 'best'}. Best is trial 19 with value: 0.3509335870690294.
[I 2025-12-04 07:11:13,151] Trial 23 finished with value: 0.34351584123608964 and parameters: {'max_depth': 18, 'min_samples_split': 10, 'min_samples_leaf': 16, 'criterion': 'gini', 'max_features': 'sqrt', 'splitter': 'best'}. Best is trial 19 with value: 0.3509335870690294.
[I 2025-12-04 07:11:13,553] Trial 24 finished with value: 0.34466483226611666 and parameters: {'max_depth': 15, 'min_samples_split': 7, 'min_samples_leaf': 17, 'criterion': 'gini', 'max_features': 'sqrt', 'splitter': 'best'}. Best is trial 19 with value: 0.3509335870690294.
[I 2025-12-04 07:11:13,804] Trial 25 finished with value: 0.3503988888474144 and parameters: {'max_depth': 5, 'min_samples_split': 13, 'min_samples_leaf': 15, 'criterion': 'gini', 'max_features': 'log2', 'splitter': 'best'}. Best is trial 19 with value: 0.3509335870690294.
[I 2025-12-04 07:11:13,955] Trial 26 finished with value: 0.3391487737584828 and parameters: {'max_depth': 4, 'min_samples_split': 12, 'min_samples_leaf': 15, 'criterion': 'gini', 'max_features': 'sqrt', 'splitter': 'random'}. Best is trial 19 with value: 0.3509335870690294.
[I 2025-12-04 07:11:14,293] Trial 27 finished with value: 0.34512593168744365 and parameters: {'max_depth': 13, 'min_samples_split': 14, 'min_samples_leaf': 15, 'criterion': 'gini', 'max_features': 'log2', 'splitter': 'best'}. Best is trial 19 with value: 0.3509335870690294.
[I 2025-12-04 07:11:14,786] Trial 28 finished with value: 0.34534735688193463 and parameters: {'max_depth': 21, 'min_samples_split': 11, 'min_samples_leaf': 19, 'criterion': 'entropy', 'max_features': 'sqrt', 'splitter': 'best'}. Best is trial 19 with value: 0.3509335870690294.
[I 2025-12-04 07:11:14,941] Trial 29 finished with value: 0.3455461686810009 and parameters: {'max_depth': 9, 'min_samples_split': 17, 'min_samples_leaf': 17, 'criterion': 'gini', 'max_features': 'sqrt', 'splitter': 'random'}. Best is trial 19 with value: 0.3509335870690294.
[I 2025-12-04 07:11:16,533] A new study created in memory with name: decision_tree_fold_2
[I 2025-12-04 07:11:16,705] Trial 0 finished with value: 0.34591721557483 and parameters: {'max_depth': 14, 'min_samples_split': 11, 'min_samples_leaf': 15, 'criterion': 'log_loss', 'max_features': None, 'splitter': 'random'}. Best is trial 0 with value: 0.34591721557483.
[I 2025-12-04 07:11:16,897] Trial 1 finished with value: 0.34371119715818554 and parameters: {'max_depth': 26, 'min_samples_split': 5, 'min_samples_leaf': 19, 'criterion': 'entropy', 'max_features': 'sqrt', 'splitter': 'random'}. Best is trial 0 with value: 0.34591721557483.
[I 2025-12-04 07:11:17,093] Trial 2 finished with value: 0.3461471934195044 and parameters: {'max_depth': 22, 'min_samples_split': 5, 'min_samples_leaf': 18, 'criterion': 'gini', 'max_features': 'sqrt', 'splitter': 'random'}. Best is trial 2 with value: 0.3461471934195044.
[I 2025-12-04 07:11:17,286] Trial 3 finished with value: 0.34576243778776683 and parameters: {'max_depth': 12, 'min_samples_split': 12, 'min_samples_leaf': 15, 'criterion': 'log_loss', 'max_features': 'log2', 'splitter': 'random'}. Best is trial 2 with value: 0.3461471934195044.
[I 2025-12-04 07:11:19,854] Trial 4 finished with value: 0.3462864938822227 and parameters: {'max_depth': 10, 'min_samples_split': 10, 'min_samples_leaf': 17, 'criterion': 'log_loss', 'max_features': None, 'splitter': 'best'}. Best is trial 4 with value: 0.3462864938822227.
[I 2025-12-04 07:11:20,040] Trial 5 finished with value: 0.34422752714225624 and parameters: {'max_depth': 29, 'min_samples_split': 7, 'min_samples_leaf': 16, 'criterion': 'log_loss', 'max_features': 'sqrt', 'splitter': 'random'}. Best is trial 4 with value: 0.3462864938822227.
[I 2025-12-04 07:11:20,216] Trial 6 finished with value: 0.3437988874476955 and parameters: {'max_depth': 20, 'min_samples_split': 11, 'min_samples_leaf': 19, 'criterion': 'entropy', 'max_features': 'log2', 'splitter': 'random'}. Best is trial 4 with value: 0.3462864938822227.
[I 2025-12-04 07:11:20,401] Trial 7 finished with value: 0.34185454361151757 and parameters: {'max_depth': 19, 'min_samples_split': 11, 'min_samples_leaf': 18, 'criterion': 'log_loss', 'max_features': 'sqrt', 'splitter': 'random'}. Best is trial 4 with value: 0.3462864938822227.
[I 2025-12-04 07:11:22,542] Trial 8 finished with value: 0.34601924912009707 and parameters: {'max_depth': 15, 'min_samples_split': 16, 'min_samples_leaf': 17, 'criterion': 'gini', 'max_features': None, 'splitter': 'best'}. Best is trial 4 with value: 0.3462864938822227.
[I 2025-12-04 07:11:22,706] Trial 9 finished with value: 0.33925313482699704 and parameters: {'max_depth': 2, 'min_samples_split': 9, 'min_samples_leaf': 20, 'criterion': 'log_loss', 'max_features': 'sqrt', 'splitter': 'random'}. Best is trial 4 with value: 0.3462864938822227.
[I 2025-12-04 07:11:23,953] Trial 10 finished with value: 0.3530710684795701 and parameters: {'max_depth': 4, 'min_samples_split': 19, 'min_samples_leaf': 17, 'criterion': 'entropy', 'max_features': None, 'splitter': 'best'}. Best is trial 10 with value: 0.3530710684795701.
[I 2025-12-04 07:11:25,440] Trial 11 finished with value: 0.3519373805015091 and parameters: {'max_depth': 5, 'min_samples_split': 20, 'min_samples_leaf': 17, 'criterion': 'entropy', 'max_features': None, 'splitter': 'best'}. Best is trial 10 with value: 0.3530710684795701.
[I 2025-12-04 07:11:26,141] Trial 12 finished with value: 0.34811739878469733 and parameters: {'max_depth': 2, 'min_samples_split': 20, 'min_samples_leaf': 16, 'criterion': 'entropy', 'max_features': None, 'splitter': 'best'}. Best is trial 10 with value: 0.3530710684795701.
[I 2025-12-04 07:11:28,097] Trial 13 finished with value: 0.3515518814831392 and parameters: {'max_depth': 7, 'min_samples_split': 20, 'min_samples_leaf': 16, 'criterion': 'entropy', 'max_features': None, 'splitter': 'best'}. Best is trial 10 with value: 0.3530710684795701.
[I 2025-12-04 07:11:29,884] Trial 14 finished with value: 0.3536586816708588 and parameters: {'max_depth': 6, 'min_samples_split': 16, 'min_samples_leaf': 17, 'criterion': 'entropy', 'max_features': None, 'splitter': 'best'}. Best is trial 14 with value: 0.3536586816708588.
[I 2025-12-04 07:11:32,105] Trial 15 finished with value: 0.35256407993779276 and parameters: {'max_depth': 8, 'min_samples_split': 16, 'min_samples_leaf': 18, 'criterion': 'entropy', 'max_features': None, 'splitter': 'best'}. Best is trial 14 with value: 0.3536586816708588.
[I 2025-12-04 07:11:33,690] Trial 16 finished with value: 0.35192768307619404 and parameters: {'max_depth': 5, 'min_samples_split': 16, 'min_samples_leaf': 16, 'criterion': 'entropy', 'max_features': None, 'splitter': 'best'}. Best is trial 14 with value: 0.3536586816708588.
[I 2025-12-04 07:11:34,191] Trial 17 finished with value: 0.34698609714325934 and parameters: {'max_depth': 10, 'min_samples_split': 14, 'min_samples_leaf': 19, 'criterion': 'entropy', 'max_features': 'log2', 'splitter': 'best'}. Best is trial 14 with value: 0.3536586816708588.
[I 2025-12-04 07:11:35,522] Trial 18 finished with value: 0.35209914712203016 and parameters: {'max_depth': 6, 'min_samples_split': 18, 'min_samples_leaf': 17, 'criterion': 'gini', 'max_features': None, 'splitter': 'best'}. Best is trial 14 with value: 0.3536586816708588.
[I 2025-12-04 07:11:36,249] Trial 19 finished with value: 0.34811739878469733 and parameters: {'max_depth': 2, 'min_samples_split': 14, 'min_samples_leaf': 18, 'criterion': 'entropy', 'max_features': None, 'splitter': 'best'}. Best is trial 14 with value: 0.3536586816708588.
[I 2025-12-04 07:11:36,688] Trial 20 finished with value: 0.3459057138070687 and parameters: {'max_depth': 12, 'min_samples_split': 18, 'min_samples_leaf': 20, 'criterion': 'entropy', 'max_features': 'log2', 'splitter': 'best'}. Best is trial 14 with value: 0.3536586816708588.
[I 2025-12-04 07:11:39,139] Trial 21 finished with value: 0.350199159883226 and parameters: {'max_depth': 9, 'min_samples_split': 17, 'min_samples_leaf': 18, 'criterion': 'entropy', 'max_features': None, 'splitter': 'best'}. Best is trial 14 with value: 0.3536586816708588.
[I 2025-12-04 07:11:40,612] Trial 22 finished with value: 0.3513661213616976 and parameters: {'max_depth': 7, 'min_samples_split': 15, 'min_samples_leaf': 17, 'criterion': 'entropy', 'max_features': None, 'splitter': 'best'}. Best is trial 14 with value: 0.3536586816708588.
[I 2025-12-04 07:11:41,575] Trial 23 finished with value: 0.3549819061136187 and parameters: {'max_depth': 4, 'min_samples_split': 18, 'min_samples_leaf': 18, 'criterion': 'entropy', 'max_features': None, 'splitter': 'best'}. Best is trial 23 with value: 0.3549819061136187.
[I 2025-12-04 07:11:42,681] Trial 24 finished with value: 0.35454066828418257 and parameters: {'max_depth': 4, 'min_samples_split': 18, 'min_samples_leaf': 19, 'criterion': 'entropy', 'max_features': None, 'splitter': 'best'}. Best is trial 23 with value: 0.3549819061136187.
[I 2025-12-04 07:11:43,441] Trial 25 finished with value: 0.3527970518650598 and parameters: {'max_depth': 4, 'min_samples_split': 18, 'min_samples_leaf': 19, 'criterion': 'gini', 'max_features': None, 'splitter': 'best'}. Best is trial 23 with value: 0.3549819061136187.
[I 2025-12-04 07:11:45,432] Trial 26 finished with value: 0.344821275838216 and parameters: {'max_depth': 12, 'min_samples_split': 13, 'min_samples_leaf': 20, 'criterion': 'entropy', 'max_features': None, 'splitter': 'best'}. Best is trial 23 with value: 0.3549819061136187.
[I 2025-12-04 07:11:47,739] Trial 27 finished with value: 0.3440264948660192 and parameters: {'max_depth': 32, 'min_samples_split': 17, 'min_samples_leaf': 19, 'criterion': 'entropy', 'max_features': None, 'splitter': 'best'}. Best is trial 23 with value: 0.3549819061136187.
[I 2025-12-04 07:11:50,176] Trial 28 finished with value: 0.3442097432571284 and parameters: {'max_depth': 17, 'min_samples_split': 15, 'min_samples_leaf': 18, 'criterion': 'entropy', 'max_features': None, 'splitter': 'best'}. Best is trial 23 with value: 0.3549819061136187.
[I 2025-12-04 07:11:50,494] Trial 29 finished with value: 0.3470296720022056 and parameters: {'max_depth': 15, 'min_samples_split': 17, 'min_samples_leaf': 15, 'criterion': 'gini', 'max_features': 'log2', 'splitter': 'best'}. Best is trial 23 with value: 0.3549819061136187.
[I 2025-12-04 07:11:51,580] A new study created in memory with name: decision_tree_fold_3
[I 2025-12-04 07:11:51,653] Trial 0 finished with value: 0.35133883062022925 and parameters: {'max_depth': 30, 'min_samples_split': 18, 'min_samples_leaf': 18, 'criterion': 'gini', 'max_features': 'sqrt', 'splitter': 'random'}. Best is trial 0 with value: 0.35133883062022925.
[I 2025-12-04 07:11:51,830] Trial 1 finished with value: 0.3471682071436849 and parameters: {'max_depth': 4, 'min_samples_split': 6, 'min_samples_leaf': 17, 'criterion': 'gini', 'max_features': None, 'splitter': 'random'}. Best is trial 0 with value: 0.35133883062022925.
[I 2025-12-04 07:11:51,981] Trial 2 finished with value: 0.3439018113787847 and parameters: {'max_depth': 13, 'min_samples_split': 17, 'min_samples_leaf': 20, 'criterion': 'gini', 'max_features': 'sqrt', 'splitter': 'random'}. Best is trial 0 with value: 0.35133883062022925.
[I 2025-12-04 07:11:53,037] Trial 3 finished with value: 0.35017432579929914 and parameters: {'max_depth': 6, 'min_samples_split': 11, 'min_samples_leaf': 19, 'criterion': 'gini', 'max_features': None, 'splitter': 'best'}. Best is trial 0 with value: 0.35133883062022925.
[I 2025-12-04 07:11:53,414] Trial 4 finished with value: 0.347254726470397 and parameters: {'max_depth': 18, 'min_samples_split': 13, 'min_samples_leaf': 19, 'criterion': 'gini', 'max_features': 'sqrt', 'splitter': 'best'}. Best is trial 0 with value: 0.35133883062022925.
[I 2025-12-04 07:11:53,715] Trial 5 finished with value: 0.34058509836197765 and parameters: {'max_depth': 20, 'min_samples_split': 19, 'min_samples_leaf': 18, 'criterion': 'gini', 'max_features': 'log2', 'splitter': 'random'}. Best is trial 0 with value: 0.35133883062022925.
[I 2025-12-04 07:11:53,961] Trial 6 finished with value: 0.3462720336522214 and parameters: {'max_depth': 14, 'min_samples_split': 15, 'min_samples_leaf': 19, 'criterion': 'log_loss', 'max_features': 'log2', 'splitter': 'random'}. Best is trial 0 with value: 0.35133883062022925.
[I 2025-12-04 07:11:54,226] Trial 7 finished with value: 0.3482590668996528 and parameters: {'max_depth': 9, 'min_samples_split': 20, 'min_samples_leaf': 16, 'criterion': 'gini', 'max_features': 'log2', 'splitter': 'best'}. Best is trial 0 with value: 0.35133883062022925.
[I 2025-12-04 07:11:54,546] Trial 8 finished with value: 0.34789448670386003 and parameters: {'max_depth': 12, 'min_samples_split': 11, 'min_samples_leaf': 19, 'criterion': 'gini', 'max_features': 'sqrt', 'splitter': 'best'}. Best is trial 0 with value: 0.35133883062022925.
[I 2025-12-04 07:11:54,683] Trial 9 finished with value: 0.34310154208020865 and parameters: {'max_depth': 5, 'min_samples_split': 11, 'min_samples_leaf': 16, 'criterion': 'log_loss', 'max_features': 'log2', 'splitter': 'random'}. Best is trial 0 with value: 0.35133883062022925.
[I 2025-12-04 07:11:54,864] Trial 10 finished with value: 0.34459594215766326 and parameters: {'max_depth': 31, 'min_samples_split': 6, 'min_samples_leaf': 15, 'criterion': 'entropy', 'max_features': 'sqrt', 'splitter': 'random'}. Best is trial 0 with value: 0.35133883062022925.
[I 2025-12-04 07:11:57,257] Trial 11 finished with value: 0.3414775795994606 and parameters: {'max_depth': 32, 'min_samples_split': 9, 'min_samples_leaf': 18, 'criterion': 'entropy', 'max_features': None, 'splitter': 'best'}. Best is trial 0 with value: 0.35133883062022925.
[I 2025-12-04 07:11:59,363] Trial 12 finished with value: 0.341785028371466 and parameters: {'max_depth': 24, 'min_samples_split': 15, 'min_samples_leaf': 20, 'criterion': 'gini', 'max_features': None, 'splitter': 'best'}. Best is trial 0 with value: 0.35133883062022925.
[I 2025-12-04 07:12:01,120] Trial 13 finished with value: 0.34438557578305046 and parameters: {'max_depth': 23, 'min_samples_split': 9, 'min_samples_leaf': 17, 'criterion': 'gini', 'max_features': None, 'splitter': 'best'}. Best is trial 0 with value: 0.35133883062022925.
[I 2025-12-04 07:12:01,274] Trial 14 finished with value: 0.3426630350442282 and parameters: {'max_depth': 27, 'min_samples_split': 17, 'min_samples_leaf': 18, 'criterion': 'log_loss', 'max_features': 'sqrt', 'splitter': 'random'}. Best is trial 0 with value: 0.35133883062022925.
[I 2025-12-04 07:12:01,855] Trial 15 finished with value: 0.34862827489908843 and parameters: {'max_depth': 2, 'min_samples_split': 13, 'min_samples_leaf': 19, 'criterion': 'entropy', 'max_features': None, 'splitter': 'best'}. Best is trial 0 with value: 0.35133883062022925.
[I 2025-12-04 07:12:03,513] Trial 16 finished with value: 0.3452985703351659 and parameters: {'max_depth': 8, 'min_samples_split': 9, 'min_samples_leaf': 20, 'criterion': 'gini', 'max_features': None, 'splitter': 'best'}. Best is trial 0 with value: 0.35133883062022925.
[I 2025-12-04 07:12:03,722] Trial 17 finished with value: 0.34507439513667826 and parameters: {'max_depth': 28, 'min_samples_split': 15, 'min_samples_leaf': 17, 'criterion': 'gini', 'max_features': 'sqrt', 'splitter': 'random'}. Best is trial 0 with value: 0.35133883062022925.
