[I 2025-12-04 11:56:28,913] Trial 25 finished with value: 0.3753978232917933 and parameters: {'n_estimators': 200, 'learning_rate': 0.05696697390005183, 'max_depth': 6, 'min_samples_split': 19, 'min_samples_leaf': 3, 'subsample': 0.9069078310088416, 'max_features': None}. Best is trial 10 with value: 0.3907221692647612.
[I 2025-12-04 11:56:51,022] Trial 26 finished with value: 0.3856973637537978 and parameters: {'n_estimators': 150, 'learning_rate': 0.016932299034174862, 'max_depth': 3, 'min_samples_split': 16, 'min_samples_leaf': 5, 'subsample': 0.885095641037786, 'max_features': 'sqrt'}. Best is trial 10 with value: 0.3907221692647612.
[I 2025-12-04 11:57:31,130] Trial 27 finished with value: 0.3864341052054884 and parameters: {'n_estimators': 200, 'learning_rate': 0.038789617325288926, 'max_depth': 4, 'min_samples_split': 19, 'min_samples_leaf': 1, 'subsample': 0.9287160690786807, 'max_features': 'sqrt'}. Best is trial 10 with value: 0.3907221692647612.
[I 2025-12-04 11:57:56,444] Trial 28 finished with value: 0.3860166131320389 and parameters: {'n_estimators': 100, 'learning_rate': 0.029333249490094082, 'max_depth': 5, 'min_samples_split': 10, 'min_samples_leaf': 15, 'subsample': 0.957397294578683, 'max_features': 'sqrt'}. Best is trial 10 with value: 0.3907221692647612.
[I 2025-12-04 12:00:16,700] Trial 29 finished with value: 0.38393291843608723 and parameters: {'n_estimators': 200, 'learning_rate': 0.045471360397539004, 'max_depth': 2, 'min_samples_split': 18, 'min_samples_leaf': 3, 'subsample': 0.8720599472246915, 'max_features': None}. Best is trial 10 with value: 0.3907221692647612.
[I 2025-12-04 12:00:24,872] A new study created in memory with name: gradient_boosting_fold_5
[I 2025-12-04 12:01:34,246] Trial 0 finished with value: 0.3855358996937611 and parameters: {'n_estimators': 200, 'learning_rate': 0.0470507246758042, 'max_depth': 8, 'min_samples_split': 10, 'min_samples_leaf': 1, 'subsample': 0.8472535490240529, 'max_features': 'sqrt'}. Best is trial 0 with value: 0.3855358996937611.
[I 2025-12-04 12:02:01,790] Trial 1 finished with value: 0.3914113581676255 and parameters: {'n_estimators': 250, 'learning_rate': 0.032093827158898594, 'max_depth': 3, 'min_samples_split': 20, 'min_samples_leaf': 13, 'subsample': 0.8505550473099426, 'max_features': 'log2'}. Best is trial 1 with value: 0.3914113581676255.
[I 2025-12-04 12:03:12,744] Trial 2 finished with value: 0.38198021276060434 and parameters: {'n_estimators': 300, 'learning_rate': 0.05185052652851252, 'max_depth': 6, 'min_samples_split': 16, 'min_samples_leaf': 7, 'subsample': 0.9860368907826431, 'max_features': 'log2'}. Best is trial 1 with value: 0.3914113581676255.
[I 2025-12-04 12:07:02,681] Trial 3 finished with value: 0.3912818026119934 and parameters: {'n_estimators': 300, 'learning_rate': 0.009978558822673199, 'max_depth': 2, 'min_samples_split': 18, 'min_samples_leaf': 19, 'subsample': 0.9573854791415806, 'max_features': None}. Best is trial 1 with value: 0.3914113581676255.
[I 2025-12-04 12:15:47,322] Trial 4 finished with value: 0.3861171344042209 and parameters: {'n_estimators': 200, 'learning_rate': 0.03869922818240408, 'max_depth': 7, 'min_samples_split': 8, 'min_samples_leaf': 3, 'subsample': 0.9893997817116643, 'max_features': None}. Best is trial 1 with value: 0.3914113581676255.
[I 2025-12-04 12:25:11,041] Trial 5 finished with value: 0.3817250624279348 and parameters: {'n_estimators': 300, 'learning_rate': 0.07210580951372528, 'max_depth': 5, 'min_samples_split': 5, 'min_samples_leaf': 3, 'subsample': 0.9771616717192999, 'max_features': None}. Best is trial 1 with value: 0.3914113581676255.
[I 2025-12-04 12:25:19,435] Trial 6 finished with value: 0.39195454207661573 and parameters: {'n_estimators': 100, 'learning_rate': 0.09692490710883368, 'max_depth': 2, 'min_samples_split': 6, 'min_samples_leaf': 5, 'subsample': 0.9121123646152909, 'max_features': 'log2'}. Best is trial 6 with value: 0.39195454207661573.
[I 2025-12-04 12:25:43,469] Trial 7 finished with value: 0.38839982512291676 and parameters: {'n_estimators': 150, 'learning_rate': 0.08533293153934783, 'max_depth': 3, 'min_samples_split': 2, 'min_samples_leaf': 18, 'subsample': 0.9687890834879195, 'max_features': 'sqrt'}. Best is trial 6 with value: 0.39195454207661573.
[I 2025-12-04 12:33:45,152] Trial 8 finished with value: 0.3806522766867392 and parameters: {'n_estimators': 300, 'learning_rate': 0.0751956494499035, 'max_depth': 5, 'min_samples_split': 19, 'min_samples_leaf': 11, 'subsample': 0.8524860064540826, 'max_features': None}. Best is trial 6 with value: 0.39195454207661573.
[I 2025-12-04 12:35:29,880] Trial 9 finished with value: 0.3940624597893815 and parameters: {'n_estimators': 100, 'learning_rate': 0.09812349066165409, 'max_depth': 3, 'min_samples_split': 17, 'min_samples_leaf': 11, 'subsample': 0.8918027479104723, 'max_features': None}. Best is trial 9 with value: 0.3940624597893815.
[I 2025-12-04 12:37:47,576] Trial 10 finished with value: 0.39062440887886984 and parameters: {'n_estimators': 100, 'learning_rate': 0.0999130167148095, 'max_depth': 4, 'min_samples_split': 14, 'min_samples_leaf': 15, 'subsample': 0.8946937829083463, 'max_features': None}. Best is trial 9 with value: 0.3940624597893815.
[I 2025-12-04 12:37:55,909] Trial 11 finished with value: 0.3904869821834759 and parameters: {'n_estimators': 100, 'learning_rate': 0.09199675623183043, 'max_depth': 2, 'min_samples_split': 12, 'min_samples_leaf': 7, 'subsample': 0.9176930470401495, 'max_features': 'log2'}. Best is trial 9 with value: 0.3940624597893815.
[I 2025-12-04 12:38:13,257] Trial 12 finished with value: 0.3903684760026958 and parameters: {'n_estimators': 150, 'learning_rate': 0.07359954441816935, 'max_depth': 3, 'min_samples_split': 6, 'min_samples_leaf': 8, 'subsample': 0.901372269922936, 'max_features': 'log2'}. Best is trial 9 with value: 0.3940624597893815.
[I 2025-12-04 12:38:20,664] Trial 13 finished with value: 0.38993185882379416 and parameters: {'n_estimators': 100, 'learning_rate': 0.09842400938865174, 'max_depth': 2, 'min_samples_split': 2, 'min_samples_leaf': 9, 'subsample': 0.8019393775936504, 'max_features': 'log2'}. Best is trial 9 with value: 0.3940624597893815.
[I 2025-12-04 12:38:50,531] Trial 14 finished with value: 0.3914601344435329 and parameters: {'n_estimators': 150, 'learning_rate': 0.08180166256965993, 'max_depth': 4, 'min_samples_split': 13, 'min_samples_leaf': 5, 'subsample': 0.9314259013776814, 'max_features': 'sqrt'}. Best is trial 9 with value: 0.3940624597893815.
[I 2025-12-04 12:41:07,052] Trial 15 finished with value: 0.39406350827149944 and parameters: {'n_estimators': 100, 'learning_rate': 0.06361630619869349, 'max_depth': 4, 'min_samples_split': 9, 'min_samples_leaf': 12, 'subsample': 0.8842836530938608, 'max_features': None}. Best is trial 15 with value: 0.39406350827149944.
[I 2025-12-04 12:44:29,013] Trial 16 finished with value: 0.39024177928885584 and parameters: {'n_estimators': 150, 'learning_rate': 0.06336946144720229, 'max_depth': 4, 'min_samples_split': 10, 'min_samples_leaf': 15, 'subsample': 0.875437693049818, 'max_features': None}. Best is trial 15 with value: 0.39406350827149944.
[I 2025-12-04 12:47:47,759] Trial 17 finished with value: 0.39781551052317105 and parameters: {'n_estimators': 100, 'learning_rate': 0.024454313898903898, 'max_depth': 6, 'min_samples_split': 15, 'min_samples_leaf': 11, 'subsample': 0.8752522525364393, 'max_features': None}. Best is trial 17 with value: 0.39781551052317105.
[I 2025-12-04 12:55:30,532] Trial 18 finished with value: 0.3948766632438798 and parameters: {'n_estimators': 250, 'learning_rate': 0.017365336895558997, 'max_depth': 6, 'min_samples_split': 14, 'min_samples_leaf': 14, 'subsample': 0.8245960993260686, 'max_features': None}. Best is trial 17 with value: 0.39781551052317105.
[I 2025-12-04 13:03:08,773] Trial 19 finished with value: 0.39608728497422574 and parameters: {'n_estimators': 250, 'learning_rate': 0.010206029969784671, 'max_depth': 6, 'min_samples_split': 15, 'min_samples_leaf': 16, 'subsample': 0.8151645416560721, 'max_features': None}. Best is trial 17 with value: 0.39781551052317105.
[I 2025-12-04 13:11:38,295] Trial 20 finished with value: 0.39195908359571285 and parameters: {'n_estimators': 250, 'learning_rate': 0.025331246583094366, 'max_depth': 7, 'min_samples_split': 16, 'min_samples_leaf': 17, 'subsample': 0.8047536276633613, 'max_features': None}. Best is trial 17 with value: 0.39781551052317105.
[I 2025-12-04 13:19:18,789] Trial 21 finished with value: 0.395933461416584 and parameters: {'n_estimators': 250, 'learning_rate': 0.009238092284982517, 'max_depth': 6, 'min_samples_split': 14, 'min_samples_leaf': 14, 'subsample': 0.8242548964491171, 'max_features': None}. Best is trial 17 with value: 0.39781551052317105.
[I 2025-12-04 13:27:02,958] Trial 22 finished with value: 0.3967374546482719 and parameters: {'n_estimators': 250, 'learning_rate': 0.009992537317470183, 'max_depth': 6, 'min_samples_split': 15, 'min_samples_leaf': 16, 'subsample': 0.8250144206801407, 'max_features': None}. Best is trial 17 with value: 0.39781551052317105.
[I 2025-12-04 13:34:30,751] Trial 23 finished with value: 0.3931632228685982 and parameters: {'n_estimators': 200, 'learning_rate': 0.02105210698922435, 'max_depth': 7, 'min_samples_split': 15, 'min_samples_leaf': 20, 'subsample': 0.8678873518892052, 'max_features': None}. Best is trial 17 with value: 0.39781551052317105.
[I 2025-12-04 13:42:09,346] Trial 24 finished with value: 0.3903667591027578 and parameters: {'n_estimators': 250, 'learning_rate': 0.03157753549119378, 'max_depth': 6, 'min_samples_split': 12, 'min_samples_leaf': 17, 'subsample': 0.8251825607764767, 'max_features': None}. Best is trial 17 with value: 0.39781551052317105.
[I 2025-12-04 13:43:15,948] Trial 25 finished with value: 0.39539163289759904 and parameters: {'n_estimators': 200, 'learning_rate': 0.016491677842810276, 'max_depth': 8, 'min_samples_split': 17, 'min_samples_leaf': 16, 'subsample': 0.8360327539415005, 'max_features': 'sqrt'}. Best is trial 17 with value: 0.39781551052317105.
[I 2025-12-04 13:50:04,413] Trial 26 finished with value: 0.3931629255190081 and parameters: {'n_estimators': 250, 'learning_rate': 0.027904464199435066, 'max_depth': 5, 'min_samples_split': 18, 'min_samples_leaf': 20, 'subsample': 0.8644425693358457, 'max_features': None}. Best is trial 17 with value: 0.39781551052317105.
[I 2025-12-04 13:57:03,873] Trial 27 finished with value: 0.3879115784423086 and parameters: {'n_estimators': 200, 'learning_rate': 0.04026307793736183, 'max_depth': 7, 'min_samples_split': 15, 'min_samples_leaf': 10, 'subsample': 0.8149841386106134, 'max_features': None}. Best is trial 17 with value: 0.39781551052317105.
[I 2025-12-04 14:03:44,166] Trial 28 finished with value: 0.3977939996168462 and parameters: {'n_estimators': 250, 'learning_rate': 0.013325620222377016, 'max_depth': 5, 'min_samples_split': 12, 'min_samples_leaf': 12, 'subsample': 0.8408767645612985, 'max_features': None}. Best is trial 17 with value: 0.39781551052317105.
[I 2025-12-04 14:04:27,966] Trial 29 finished with value: 0.38728195495048123 and parameters: {'n_estimators': 200, 'learning_rate': 0.042405904122499054, 'max_depth': 5, 'min_samples_split': 11, 'min_samples_leaf': 12, 'subsample': 0.8366903253638545, 'max_features': 'sqrt'}. Best is trial 17 with value: 0.39781551052317105.
[I 2025-12-04 14:22:20,182] A new study created in memory with name: k_nearest_neighbors_fold_1
[I 2025-12-04 14:22:23,572] Trial 0 finished with value: 0.3725097585844477 and parameters: {'n_neighbors': 85, 'algorithm': 'ball_tree', 'p': 2, 'leaf_size': 25}. Best is trial 0 with value: 0.3725097585844477.
[I 2025-12-04 14:22:27,114] Trial 1 finished with value: 0.3771236848159079 and parameters: {'n_neighbors': 125, 'algorithm': 'ball_tree', 'p': 2, 'leaf_size': 32}. Best is trial 1 with value: 0.3771236848159079.
[I 2025-12-04 14:22:30,763] Trial 2 finished with value: 0.37252229850911817 and parameters: {'n_neighbors': 85, 'algorithm': 'ball_tree', 'p': 2, 'leaf_size': 38}. Best is trial 1 with value: 0.3771236848159079.
[I 2025-12-04 14:22:34,247] Trial 3 finished with value: 0.3673584015007695 and parameters: {'n_neighbors': 75, 'algorithm': 'ball_tree', 'p': 1, 'leaf_size': 37}. Best is trial 1 with value: 0.3771236848159079.
[I 2025-12-04 14:22:34,783] Trial 4 finished with value: 0.3640565037622322 and parameters: {'n_neighbors': 55, 'algorithm': 'auto', 'p': 1, 'leaf_size': 27}. Best is trial 1 with value: 0.3771236848159079.
[I 2025-12-04 14:22:38,516] Trial 5 finished with value: 0.3638377965712406 and parameters: {'n_neighbors': 55, 'algorithm': 'ball_tree', 'p': 1, 'leaf_size': 24}. Best is trial 1 with value: 0.3771236848159079.
[I 2025-12-04 14:22:42,106] Trial 6 finished with value: 0.3759925160750717 and parameters: {'n_neighbors': 105, 'algorithm': 'ball_tree', 'p': 2, 'leaf_size': 32}. Best is trial 1 with value: 0.3771236848159079.
[I 2025-12-04 14:22:47,141] Trial 7 finished with value: 0.36355121207093427 and parameters: {'n_neighbors': 45, 'algorithm': 'kd_tree', 'p': 1, 'leaf_size': 25}. Best is trial 1 with value: 0.3771236848159079.
[I 2025-12-04 14:22:52,271] Trial 8 finished with value: 0.3601037177385037 and parameters: {'n_neighbors': 35, 'algorithm': 'kd_tree', 'p': 1, 'leaf_size': 24}. Best is trial 1 with value: 0.3771236848159079.
[I 2025-12-04 14:22:56,484] Trial 9 finished with value: 0.3684523442991392 and parameters: {'n_neighbors': 85, 'algorithm': 'kd_tree', 'p': 1, 'leaf_size': 38}. Best is trial 1 with value: 0.3771236848159079.
[I 2025-12-04 14:22:56,898] Trial 10 finished with value: 0.3773329172205029 and parameters: {'n_neighbors': 125, 'algorithm': 'brute', 'p': 2, 'leaf_size': 32}. Best is trial 10 with value: 0.3773329172205029.
[I 2025-12-04 14:22:57,296] Trial 11 finished with value: 0.3773329172205029 and parameters: {'n_neighbors': 125, 'algorithm': 'brute', 'p': 2, 'leaf_size': 32}. Best is trial 10 with value: 0.3773329172205029.
[I 2025-12-04 14:22:57,702] Trial 12 finished with value: 0.3773329172205029 and parameters: {'n_neighbors': 125, 'algorithm': 'brute', 'p': 2, 'leaf_size': 20}. Best is trial 10 with value: 0.3773329172205029.
[I 2025-12-04 14:22:58,082] Trial 13 finished with value: 0.376242220867396 and parameters: {'n_neighbors': 105, 'algorithm': 'brute', 'p': 2, 'leaf_size': 34}. Best is trial 10 with value: 0.3773329172205029.
[I 2025-12-04 14:22:58,460] Trial 14 finished with value: 0.376242220867396 and parameters: {'n_neighbors': 105, 'algorithm': 'brute', 'p': 2, 'leaf_size': 29}. Best is trial 10 with value: 0.3773329172205029.
[I 2025-12-04 14:22:58,868] Trial 15 finished with value: 0.3773329172205029 and parameters: {'n_neighbors': 125, 'algorithm': 'brute', 'p': 2, 'leaf_size': 35}. Best is trial 10 with value: 0.3773329172205029.
[I 2025-12-04 14:22:59,267] Trial 16 finished with value: 0.3782686803896195 and parameters: {'n_neighbors': 115, 'algorithm': 'brute', 'p': 2, 'leaf_size': 30}. Best is trial 16 with value: 0.3782686803896195.
[I 2025-12-04 14:22:59,643] Trial 17 finished with value: 0.376242220867396 and parameters: {'n_neighbors': 105, 'algorithm': 'auto', 'p': 2, 'leaf_size': 29}. Best is trial 16 with value: 0.3782686803896195.
[I 2025-12-04 14:23:00,034] Trial 18 finished with value: 0.3782686803896195 and parameters: {'n_neighbors': 115, 'algorithm': 'brute', 'p': 2, 'leaf_size': 35}. Best is trial 16 with value: 0.3782686803896195.
[I 2025-12-04 14:23:00,405] Trial 19 finished with value: 0.3742413234405447 and parameters: {'n_neighbors': 95, 'algorithm': 'brute', 'p': 2, 'leaf_size': 36}. Best is trial 16 with value: 0.3782686803896195.
[I 2025-12-04 14:23:00,729] Trial 20 finished with value: 0.37418328454431793 and parameters: {'n_neighbors': 65, 'algorithm': 'brute', 'p': 2, 'leaf_size': 34}. Best is trial 16 with value: 0.3782686803896195.
[I 2025-12-04 14:23:01,132] Trial 21 finished with value: 0.3782686803896195 and parameters: {'n_neighbors': 115, 'algorithm': 'brute', 'p': 2, 'leaf_size': 30}. Best is trial 16 with value: 0.3782686803896195.
[I 2025-12-04 14:23:01,532] Trial 22 finished with value: 0.3782686803896195 and parameters: {'n_neighbors': 115, 'algorithm': 'brute', 'p': 2, 'leaf_size': 40}. Best is trial 16 with value: 0.3782686803896195.
[I 2025-12-04 14:23:01,939] Trial 23 finished with value: 0.3782686803896195 and parameters: {'n_neighbors': 115, 'algorithm': 'brute', 'p': 2, 'leaf_size': 30}. Best is trial 16 with value: 0.3782686803896195.
[I 2025-12-04 14:23:02,320] Trial 24 finished with value: 0.3742413234405447 and parameters: {'n_neighbors': 95, 'algorithm': 'auto', 'p': 2, 'leaf_size': 29}. Best is trial 16 with value: 0.3782686803896195.
[I 2025-12-04 14:23:02,714] Trial 25 finished with value: 0.3782686803896195 and parameters: {'n_neighbors': 115, 'algorithm': 'brute', 'p': 2, 'leaf_size': 27}. Best is trial 16 with value: 0.3782686803896195.
[I 2025-12-04 14:23:03,085] Trial 26 finished with value: 0.3742413234405447 and parameters: {'n_neighbors': 95, 'algorithm': 'brute', 'p': 2, 'leaf_size': 27}. Best is trial 16 with value: 0.3782686803896195.
[I 2025-12-04 14:23:03,457] Trial 27 finished with value: 0.3782686803896195 and parameters: {'n_neighbors': 115, 'algorithm': 'brute', 'p': 2, 'leaf_size': 31}. Best is trial 16 with value: 0.3782686803896195.
[I 2025-12-04 14:23:03,699] Trial 28 finished with value: 0.3689229442294179 and parameters: {'n_neighbors': 25, 'algorithm': 'brute', 'p': 2, 'leaf_size': 34}. Best is trial 16 with value: 0.3782686803896195.
[I 2025-12-04 14:23:07,847] Trial 29 finished with value: 0.37257046319052195 and parameters: {'n_neighbors': 85, 'algorithm': 'kd_tree', 'p': 2, 'leaf_size': 40}. Best is trial 16 with value: 0.3782686803896195.
[I 2025-12-04 14:23:08,846] A new study created in memory with name: k_nearest_neighbors_fold_2
[I 2025-12-04 14:23:09,315] Trial 0 finished with value: 0.364013113667652 and parameters: {'n_neighbors': 65, 'algorithm': 'auto', 'p': 1, 'leaf_size': 32}. Best is trial 0 with value: 0.364013113667652.
[I 2025-12-04 14:23:09,945] Trial 1 finished with value: 0.36804929551966425 and parameters: {'n_neighbors': 105, 'algorithm': 'auto', 'p': 1, 'leaf_size': 34}. Best is trial 1 with value: 0.36804929551966425.
[I 2025-12-04 14:23:13,357] Trial 2 finished with value: 0.36956406642439876 and parameters: {'n_neighbors': 125, 'algorithm': 'ball_tree', 'p': 1, 'leaf_size': 38}. Best is trial 2 with value: 0.36956406642439876.
[I 2025-12-04 14:23:16,880] Trial 3 finished with value: 0.37229295104902366 and parameters: {'n_neighbors': 75, 'algorithm': 'ball_tree', 'p': 2, 'leaf_size': 22}. Best is trial 3 with value: 0.37229295104902366.
[I 2025-12-04 14:23:17,198] Trial 4 finished with value: 0.37390216839110274 and parameters: {'n_neighbors': 65, 'algorithm': 'brute', 'p': 2, 'leaf_size': 25}. Best is trial 4 with value: 0.37390216839110274.
[I 2025-12-04 14:23:17,844] Trial 5 finished with value: 0.36804929551966425 and parameters: {'n_neighbors': 105, 'algorithm': 'auto', 'p': 1, 'leaf_size': 39}. Best is trial 4 with value: 0.37390216839110274.
[I 2025-12-04 14:23:18,491] Trial 6 finished with value: 0.369189645963104 and parameters: {'n_neighbors': 115, 'algorithm': 'brute', 'p': 1, 'leaf_size': 39}. Best is trial 4 with value: 0.37390216839110274.
[I 2025-12-04 14:23:22,306] Trial 7 finished with value: 0.3683906490414933 and parameters: {'n_neighbors': 115, 'algorithm': 'ball_tree', 'p': 1, 'leaf_size': 35}. Best is trial 4 with value: 0.37390216839110274.
[I 2025-12-04 14:23:25,954] Trial 8 finished with value: 0.37229295104902366 and parameters: {'n_neighbors': 75, 'algorithm': 'ball_tree', 'p': 2, 'leaf_size': 24}. Best is trial 4 with value: 0.37390216839110274.
[I 2025-12-04 14:23:26,578] Trial 9 finished with value: 0.36727213904680756 and parameters: {'n_neighbors': 95, 'algorithm': 'brute', 'p': 1, 'leaf_size': 30}. Best is trial 4 with value: 0.37390216839110274.
[I 2025-12-04 14:23:31,466] Trial 10 finished with value: 0.36595934101887695 and parameters: {'n_neighbors': 35, 'algorithm': 'kd_tree', 'p': 2, 'leaf_size': 26}. Best is trial 4 with value: 0.37390216839110274.
[I 2025-12-04 14:23:31,824] Trial 11 finished with value: 0.3715195565243036 and parameters: {'n_neighbors': 55, 'algorithm': 'brute', 'p': 2, 'leaf_size': 20}. Best is trial 4 with value: 0.37390216839110274.
[I 2025-12-04 14:23:36,698] Trial 12 finished with value: 0.3680565851545084 and parameters: {'n_neighbors': 45, 'algorithm': 'kd_tree', 'p': 2, 'leaf_size': 20}. Best is trial 4 with value: 0.37390216839110274.
[I 2025-12-04 14:23:40,135] Trial 13 finished with value: 0.371884110033273 and parameters: {'n_neighbors': 85, 'algorithm': 'ball_tree', 'p': 2, 'leaf_size': 25}. Best is trial 4 with value: 0.37390216839110274.
[I 2025-12-04 14:23:40,393] Trial 14 finished with value: 0.3633111790419973 and parameters: {'n_neighbors': 25, 'algorithm': 'brute', 'p': 2, 'leaf_size': 27}. Best is trial 4 with value: 0.37390216839110274.
[I 2025-12-04 14:23:43,610] Trial 15 finished with value: 0.3732201996564855 and parameters: {'n_neighbors': 65, 'algorithm': 'ball_tree', 'p': 2, 'leaf_size': 23}. Best is trial 4 with value: 0.37390216839110274.
[I 2025-12-04 14:23:43,898] Trial 16 finished with value: 0.3715195565243036 and parameters: {'n_neighbors': 55, 'algorithm': 'brute', 'p': 2, 'leaf_size': 29}. Best is trial 4 with value: 0.37390216839110274.
[I 2025-12-04 14:23:48,783] Trial 17 finished with value: 0.3731030811949102 and parameters: {'n_neighbors': 65, 'algorithm': 'kd_tree', 'p': 2, 'leaf_size': 23}. Best is trial 4 with value: 0.37390216839110274.
[I 2025-12-04 14:23:52,384] Trial 18 finished with value: 0.371884110033273 and parameters: {'n_neighbors': 85, 'algorithm': 'ball_tree', 'p': 2, 'leaf_size': 28}. Best is trial 4 with value: 0.37390216839110274.
